"No.","Time","Source","Destination","Protocol","Length","Info"
"1","0.000000","10.152.152.11","173.194.65.113","TCP","54","50575  >  443 [ACK] Seq=1 Ack=1 Win=2640 Len=0"
"2","0.001096","173.194.65.113","10.152.152.11","TCP","60","[TCP ACKed unseen segment] 443  >  50575 [ACK] Seq=1 Ack=2 Win=1896 Len=0"
"3","1.649417","10.152.152.11","173.194.65.106","TCP","54","40777  >  443 [ACK] Seq=1 Ack=1 Win=2640 Len=0"
"4","1.649942","173.194.65.106","10.152.152.11","TCP","60","[TCP ACKed unseen segment] 443  >  40777 [ACK] Seq=1 Ack=2 Win=1650 Len=0"
"5","3.155013","10.152.152.11","173.194.65.94","TCP","54","60160  >  443 [ACK] Seq=1 Ack=1 Win=2008 Len=0"
"6","3.155684","173.194.65.94","10.152.152.11","TCP","60","[TCP ACKed unseen segment] 443  >  60160 [ACK] Seq=1 Ack=2 Win=1114 Len=0"
"7","3.954994","10.152.152.11","74.125.136.94","TLSv1.1","731","Application Data"
"8","3.955698","10.152.152.11","74.125.136.94","TLSv1.1","123","Application Data"
"9","3.957108","74.125.136.94","10.152.152.11","TCP","60","443  >  41876 [ACK] Seq=1 Ack=678 Win=1896 Len=0"
"10","3.957161","74.125.136.94","10.152.152.11","TCP","60","443  >  41876 [ACK] Seq=1 Ack=747 Win=1896 Len=0"
"11","4.061530","10.152.152.11","74.125.136.94","TLSv1.1","731","Application Data"
"12","4.062155","74.125.136.94","10.152.152.11","TCP","60","443  >  41876 [ACK] Seq=1 Ack=1424 Win=2063 Len=0"
"13","4.138574","10.152.152.11","173.194.65.139","TCP","54","35944  >  443 [ACK] Seq=1 Ack=1 Win=2190 Len=0"
"14","4.138948","173.194.65.139","10.152.152.11","TCP","60","[TCP ACKed unseen segment] 443  >  35944 [ACK] Seq=1 Ack=2 Win=1114 Len=0"
"15","4.144898","74.125.136.94","10.152.152.11","TLSv1.1","123","Application Data"
"16","4.164943","10.152.152.11","74.125.136.94","TLSv1.1","715","Application Data"
"17","4.165663","74.125.136.94","10.152.152.11","TCP","60","443  >  41876 [ACK] Seq=70 Ack=2085 Win=2229 Len=0"
"18","4.304710","74.125.136.94","10.152.152.11","TLSv1.1","581","Application Data, Application Data, Application Data"
"19","4.305839","10.152.152.11","74.125.136.94","TLSv1.1","123","Application Data"
"20","4.306716","74.125.136.94","10.152.152.11","TCP","60","443  >  41876 [ACK] Seq=597 Ack=2154 Win=2229 Len=0"
"21","4.337384","74.125.136.94","10.152.152.11","TLSv1.1","485","Application Data, Application Data, Application Data"
"22","4.338030","10.152.152.11","74.125.136.94","TLSv1.1","123","Application Data"
"23","4.377199","74.125.136.94","10.152.152.11","TCP","60","443  >  41876 [ACK] Seq=1028 Ack=2223 Win=2229 Len=0"
"24","4.402001","10.152.152.11","74.125.136.147","TCP","54","42360  >  443 [ACK] Seq=1 Ack=1 Win=2640 Len=0"
"25","4.403056","74.125.136.147","10.152.152.11","TCP","60","[TCP ACKed unseen segment] 443  >  42360 [ACK] Seq=1 Ack=2 Win=1918 Len=0"
"26","4.403646","10.152.152.11","74.125.136.94","TLSv1.1","747","Application Data"
"27","4.403768","74.125.136.94","10.152.152.11","TCP","60","443  >  41876 [ACK] Seq=1028 Ack=2916 Win=2396 Len=0"
"28","4.475973","74.125.136.94","10.152.152.11","TLSv1.1","549","Application Data, Application Data, Application Data"
"29","4.477064","10.152.152.11","74.125.136.94","TLSv1.1","123","Application Data"
"30","4.477641","74.125.136.94","10.152.152.11","TCP","60","443  >  41876 [ACK] Seq=1523 Ack=2985 Win=2396 Len=0"
"31","4.563483","10.152.152.11","173.194.65.105","TCP","54","54452  >  443 [ACK] Seq=1 Ack=1 Win=2640 Len=0"
"32","4.564212","173.194.65.105","10.152.152.11","TCP","60","[TCP ACKed unseen segment] 443  >  54452 [ACK] Seq=1 Ack=2 Win=1382 Len=0"
"33","4.634514","10.152.152.11","74.125.136.94","TLSv1.1","731","Application Data"
"34","4.635529","74.125.136.94","10.152.152.11","TCP","60","443  >  41876 [ACK] Seq=1523 Ack=3662 Win=2562 Len=0"
"35","4.698065","74.125.136.94","10.152.152.11","TLSv1.1","517","Application Data, Application Data, Application Data"
"36","4.700011","10.152.152.11","74.125.136.94","TLSv1.1","123","Application Data"
"37","4.701964","74.125.136.94","10.152.152.11","TCP","60","443  >  41876 [ACK] Seq=1986 Ack=3731 Win=2562 Len=0"
"38","4.738188","10.152.152.11","173.194.44.51","TCP","54","57717  >  443 [ACK] Seq=1 Ack=1 Win=5342 Len=0"
"39","4.738288","173.194.44.51","10.152.152.11","TCP","60","[TCP ACKed unseen segment] 443  >  57717 [ACK] Seq=1 Ack=2 Win=2640 Len=0"
"40","4.896856","74.125.136.94","10.152.152.11","TLSv1.1","533","Application Data, Application Data, Application Data"
"41","4.897571","10.152.152.11","74.125.136.94","TLSv1.1","123","Application Data"
"42","4.897925","74.125.136.94","10.152.152.11","TCP","60","443  >  41876 [ACK] Seq=2465 Ack=3800 Win=2562 Len=0"
"43","4.954284","10.152.152.11","74.125.136.94","TLSv1.1","731","Application Data"
"44","4.955328","74.125.136.94","10.152.152.11","TCP","60","443  >  41876 [ACK] Seq=2465 Ack=4477 Win=2640 Len=0"
"45","4.972521","10.152.152.11","10.152.152.10","DNS","83","Standard query 0xf205 A safebrowsing.google.com"
"46","5.090318","10.152.152.11","74.125.136.94","TLSv1.1","731","Application Data"
"47","5.129129","74.125.136.94","10.152.152.11","TCP","60","443  >  41876 [ACK] Seq=2465 Ack=5154 Win=2640 Len=0"
"48","5.189157","74.125.136.94","10.152.152.11","TLSv1.1","501","Application Data, Application Data, Application Data"
"49","5.190610","10.152.152.11","74.125.136.94","TLSv1.1","123","Application Data"
"50","5.191345","74.125.136.94","10.152.152.11","TCP","60","443  >  41876 [ACK] Seq=2912 Ack=5223 Win=2640 Len=0"
"51","5.381245","10.152.152.10","10.152.152.11","DNS","99","Standard query response 0xf205 A safebrowsing.google.com A 173.194.65.136"
"52","5.381260","74.125.136.94","10.152.152.11","TLSv1.1","485","Application Data, Application Data, Application Data"
"53","5.381660","10.152.152.11","173.194.65.136","TCP","66","60219  >  443 [SYN] Seq=0 Win=14600 Len=0 MSS=1460 SACK_PERM=1 WS=16"
"54","5.383151","173.194.65.136","10.152.152.11","TCP","66","443  >  60219 [SYN, ACK] Seq=0 Ack=1 Win=14600 Len=0 MSS=1460 SACK_PERM=1 WS=16"
"55","5.383204","10.152.152.11","173.194.65.136","TCP","54","60219  >  443 [ACK] Seq=1 Ack=1 Win=14608 Len=0"
"56","5.383680","10.152.152.11","74.125.136.94","TLSv1.1","123","Application Data"
"57","5.385028","74.125.136.94","10.152.152.11","TCP","60","443  >  41876 [ACK] Seq=3343 Ack=5292 Win=2640 Len=0"
"58","5.385258","10.152.152.11","173.194.65.136","TLSv1.1","226","Client Hello"
"59","5.385897","173.194.65.136","10.152.152.11","TCP","60","443  >  60219 [ACK] Seq=1 Ack=173 Win=15680 Len=0"
"60","5.651510","173.194.65.136","10.152.152.11","TLSv1.1","1514","Server Hello"
"61","5.651534","10.152.152.11","173.194.65.136","TCP","54","60219  >  443 [ACK] Seq=173 Ack=1461 Win=17520 Len=0"
"62","5.651693","173.194.65.136","10.152.152.11","TCP","1514","443  >  60219 [ACK] Seq=1461 Ack=173 Win=15680 Len=1460 [TCP segment of a reassembled PDU]"
"63","5.651700","10.152.152.11","173.194.65.136","TCP","54","60219  >  443 [ACK] Seq=173 Ack=2921 Win=20448 Len=0"
"64","5.651721","173.194.65.136","10.152.152.11","TCP","620","443  >  60219 [PSH, ACK] Seq=2921 Ack=173 Win=15680 Len=566 [TCP segment of a reassembled PDU]"
"65","5.651726","10.152.152.11","173.194.65.136","TCP","54","60219  >  443 [ACK] Seq=173 Ack=3487 Win=23360 Len=0"
"66","5.779824","173.194.65.136","10.152.152.11","TLSv1.1","1091","Certificate, Server Key Exchange, Server Hello Done"
"67","5.779845","10.152.152.11","173.194.65.136","TCP","54","60219  >  443 [ACK] Seq=173 Ack=4524 Win=26288 Len=0"
"68","5.793658","10.152.152.11","173.194.65.136","TLSv1.1","332","Client Key Exchange, Change Cipher Spec, Encrypted Handshake Message"
"69","5.794715","173.194.65.136","10.152.152.11","TCP","60","443  >  60219 [ACK] Seq=4524 Ack=451 Win=16752 Len=0"
"70","5.830040","10.152.152.11","74.125.136.94","TLSv1.1","747","Application Data"
"71","5.830824","74.125.136.94","10.152.152.11","TCP","60","443  >  41876 [ACK] Seq=3343 Ack=5985 Win=2640 Len=0"
"72","5.847560","10.152.152.11","74.125.136.190","TCP","54","58665  >  443 [ACK] Seq=1 Ack=1 Win=2008 Len=0"
"73","5.847785","74.125.136.190","10.152.152.11","TCP","60","[TCP ACKed unseen segment] 443  >  58665 [ACK] Seq=1 Ack=2 Win=1114 Len=0"
"74","6.002268","10.152.152.11","74.125.136.94","TLSv1.1","731","Application Data"
"75","6.003156","74.125.136.94","10.152.152.11","TCP","60","443  >  41876 [ACK] Seq=3343 Ack=6662 Win=2640 Len=0"
"76","6.115236","10.152.152.11","74.125.136.94","TLSv1.1","763","Application Data"
"77","6.116823","74.125.136.94","10.152.152.11","TCP","60","443  >  41876 [ACK] Seq=3343 Ack=7371 Win=2640 Len=0"
"78","6.142366","173.194.65.136","10.152.152.11","TLSv1.1","526","New Session Ticket, Change Cipher Spec, Encrypted Handshake Message, Application Data, Application Data"
"79","6.149721","10.152.152.11","173.194.65.136","TLSv1.1","139","Application Data"
"80","6.149947","10.152.152.11","173.194.65.136","TLSv1.1","123","Application Data"
"81","6.150119","173.194.65.136","10.152.152.11","TCP","60","443  >  60219 [ACK] Seq=4996 Ack=536 Win=16752 Len=0"
"82","6.150471","10.152.152.11","173.194.65.136","TLSv1.1","683","Application Data"
"83","6.150709","10.152.152.11","173.194.65.136","TCP","1514","60219  >  443 [ACK] Seq=1234 Ack=4996 Win=29200 Len=1460 [TCP segment of a reassembled PDU]"
"84","6.150787","173.194.65.136","10.152.152.11","TCP","60","443  >  60219 [ACK] Seq=4996 Ack=605 Win=16752 Len=0"
"85","6.150790","173.194.65.136","10.152.152.11","TCP","60","443  >  60219 [ACK] Seq=4996 Ack=1234 Win=18016 Len=0"
"86","6.150884","10.152.152.11","173.194.65.136","TLSv1.1","1511","Application Data"
"87","6.151083","173.194.65.136","10.152.152.11","TCP","60","443  >  60219 [ACK] Seq=4996 Ack=2694 Win=20928 Len=0"
"88","6.151231","10.152.152.11","173.194.65.136","TCP","1514","60219  >  443 [ACK] Seq=4151 Ack=4996 Win=29200 Len=1460 [TCP segment of a reassembled PDU]"
"89","6.151324","10.152.152.11","173.194.65.136","TLSv1.1","1511","Application Data"
"90","6.151447","173.194.65.136","10.152.152.11","TCP","60","443  >  60219 [ACK] Seq=4996 Ack=4151 Win=23856 Len=0"
"91","6.151715","173.194.65.136","10.152.152.11","TCP","60","443  >  60219 [ACK] Seq=4996 Ack=5611 Win=26768 Len=0"
"92","6.151719","173.194.65.136","10.152.152.11","TCP","60","443  >  60219 [ACK] Seq=4996 Ack=7068 Win=29696 Len=0"
"93","6.151831","10.152.152.11","173.194.65.136","TCP","1514","60219  >  443 [ACK] Seq=7068 Ack=4996 Win=29200 Len=1460 [TCP segment of a reassembled PDU]"
"94","6.152590","173.194.65.136","10.152.152.11","TCP","60","443  >  60219 [ACK] Seq=4996 Ack=8528 Win=32608 Len=0"
"95","6.152738","10.152.152.11","173.194.65.136","TLSv1.1","1399","Application Data"
"96","6.152990","173.194.65.136","10.152.152.11","TCP","60","443  >  60219 [ACK] Seq=4996 Ack=9873 Win=35536 Len=0"
"97","6.217835","10.152.152.11","74.125.136.94","TLSv1.1","731","Application Data"
"98","6.218526","74.125.136.94","10.152.152.11","TCP","60","443  >  41876 [ACK] Seq=3343 Ack=8048 Win=2640 Len=0"
"99","6.344925","74.125.136.94","10.152.152.11","TLSv1.1","517","Application Data, Application Data, Application Data"
"100","6.348344","10.152.152.11","74.125.136.94","TLSv1.1","123","Application Data"
"101","6.348707","74.125.136.94","10.152.152.11","TCP","60","443  >  41876 [ACK] Seq=3806 Ack=8117 Win=2640 Len=0"
"102","6.371845","10.152.152.11","216.58.211.163","TLSv1.1","891","Application Data"
"103","6.372397","10.152.152.11","216.58.211.163","TLSv1.1","123","Application Data"
"104","6.372811","216.58.211.163","10.152.152.11","TCP","60","443  >  49234 [ACK] Seq=1 Ack=838 Win=1928 Len=0"
"105","6.372811","216.58.211.163","10.152.152.11","TCP","60","443  >  49234 [ACK] Seq=1 Ack=907 Win=1928 Len=0"
"106","6.515507","74.125.136.94","10.152.152.11","TLSv1.1","948","Application Data, Application Data, Application Data, Application Data, Application Data, Application Data"
"107","6.516565","10.152.152.11","74.125.136.94","TLSv1.1","123","Application Data"
"108","6.516594","74.125.136.94","10.152.152.11","TCP","60","443  >  41876 [ACK] Seq=4700 Ack=8186 Win=2640 Len=0"
"109","6.516798","10.152.152.11","74.125.136.94","TLSv1.1","123","Application Data"
"110","6.517152","74.125.136.94","10.152.152.11","TCP","60","443  >  41876 [ACK] Seq=4700 Ack=8255 Win=2640 Len=0"
"111","6.779013","173.194.65.136","10.152.152.11","TLSv1.1","1514","Application Data"
"112","6.779054","173.194.65.136","10.152.152.11","TLSv1.1","678","Application Data, Application Data, Application Data"
"113","6.779063","10.152.152.11","173.194.65.136","TCP","54","60219  >  443 [ACK] Seq=9873 Ack=7080 Win=35040 Len=0"
"114","6.782315","10.152.152.11","10.152.152.10","DNS","89","Standard query 0xc3aa A safebrowsing-cache.google.com"
"115","6.782504","10.152.152.11","173.194.65.136","TLSv1.1","123","Application Data"
"116","6.782905","173.194.65.136","10.152.152.11","TCP","60","443  >  60219 [ACK] Seq=7080 Ack=9942 Win=35536 Len=0"
"117","6.811836","10.152.152.11","74.125.136.138","TCP","54","46717  >  443 [ACK] Seq=1 Ack=1 Win=2190 Len=0"
"118","6.812838","74.125.136.138","10.152.152.11","TCP","60","[TCP ACKed unseen segment] 443  >  46717 [ACK] Seq=1 Ack=2 Win=1183 Len=0"
"119","6.918039","74.125.136.94","10.152.152.11","TLSv1.1","517","Application Data, Application Data, Application Data"
"120","6.918811","10.152.152.11","74.125.136.94","TLSv1.1","123","Application Data"
"121","6.919001","74.125.136.94","10.152.152.11","TCP","60","443  >  41876 [ACK] Seq=5163 Ack=8324 Win=2640 Len=0"
"122","6.956134","10.152.152.11","74.125.136.139","TCP","54","54060  >  443 [ACK] Seq=1 Ack=1 Win=2008 Len=0"
"123","6.956784","74.125.136.139","10.152.152.11","TCP","60","[TCP ACKed unseen segment] 443  >  54060 [ACK] Seq=1 Ack=2 Win=1114 Len=0"
"124","7.098729","216.58.211.163","10.152.152.11","TLSv1.1","123","Application Data"
"125","7.136094","10.152.152.11","216.58.211.163","TCP","54","49234  >  443 [ACK] Seq=907 Ack=70 Win=3917 Len=0"
"126","7.287878","10.152.152.10","10.152.152.11","DNS","105","Standard query response 0xc3aa A safebrowsing-cache.google.com A 74.125.136.138"
"127","7.288213","10.152.152.11","74.125.136.138","TCP","66","46723  >  443 [SYN] Seq=0 Win=14600 Len=0 MSS=1460 SACK_PERM=1 WS=16"
"128","7.288463","74.125.136.138","10.152.152.11","TCP","66","443  >  46723 [SYN, ACK] Seq=0 Ack=1 Win=14600 Len=0 MSS=1460 SACK_PERM=1 WS=16"
"129","7.288478","10.152.152.11","74.125.136.138","TCP","54","46723  >  443 [ACK] Seq=1 Ack=1 Win=14608 Len=0"
"130","7.289249","10.152.152.11","74.125.136.138","TLSv1.1","232","Client Hello"
"131","7.290228","74.125.136.138","10.152.152.11","TCP","60","443  >  46723 [ACK] Seq=1 Ack=179 Win=15680 Len=0"
"132","7.297954","216.58.211.163","10.152.152.11","TLSv1.1","1514","Application Data"
"133","7.297967","10.152.152.11","216.58.211.163","TCP","54","49234  >  443 [ACK] Seq=907 Ack=1530 Win=4100 Len=0"
"134","7.297993","216.58.211.163","10.152.152.11","TLSv1.1","1514","Application Data [TCP segment of a reassembled PDU]"
"135","7.298037","10.152.152.11","216.58.211.163","TCP","54","49234  >  443 [ACK] Seq=907 Ack=2990 Win=4282 Len=0"
"136","7.298301","216.58.211.163","10.152.152.11","TLSv1.1","620","Application Data [TCP segment of a reassembled PDU]"
"137","7.298306","10.152.152.11","216.58.211.163","TCP","54","49234  >  443 [ACK] Seq=907 Ack=3556 Win=4465 Len=0"
"138","7.316916","216.58.211.163","10.152.152.11","TLSv1.1","1514","Application Data [TCP segment of a reassembled PDU]"
"139","7.316938","10.152.152.11","216.58.211.163","TCP","54","49234  >  443 [ACK] Seq=907 Ack=5016 Win=4647 Len=0"
"140","7.316966","216.58.211.163","10.152.152.11","TLSv1.1","1514","Application Data [TCP segment of a reassembled PDU]"
"141","7.316971","10.152.152.11","216.58.211.163","TCP","54","49234  >  443 [ACK] Seq=907 Ack=6476 Win=4830 Len=0"
"142","7.316990","216.58.211.163","10.152.152.11","TCP","1118","443  >  49234 [PSH, ACK] Seq=6476 Ack=907 Win=1928 Len=1064 [TCP segment of a reassembled PDU]"
"143","7.316995","10.152.152.11","216.58.211.163","TCP","54","49234  >  443 [ACK] Seq=907 Ack=7540 Win=5012 Len=0"
"144","7.338563","216.58.211.163","10.152.152.11","TLSv1.1","1514","Application Data [TCP segment of a reassembled PDU]"
"145","7.338586","10.152.152.11","216.58.211.163","TCP","54","49234  >  443 [ACK] Seq=907 Ack=9000 Win=5163 Len=0"
"146","7.338613","216.58.211.163","10.152.152.11","TLSv1.1","1514","Application Data [TCP segment of a reassembled PDU]"
"147","7.338617","10.152.152.11","216.58.211.163","TCP","54","49234  >  443 [ACK] Seq=907 Ack=10460 Win=5163 Len=0"
"148","7.338649","216.58.211.163","10.152.152.11","TLSv1.1","1118","Application Data [TCP segment of a reassembled PDU]"
"149","7.338654","10.152.152.11","216.58.211.163","TCP","54","49234  >  443 [ACK] Seq=907 Ack=11524 Win=5117 Len=0"
"150","7.433396","216.58.211.163","10.152.152.11","TLSv1.1","1514","Application Data [TCP segment of a reassembled PDU]"
"151","7.433428","10.152.152.11","216.58.211.163","TCP","54","49234  >  443 [ACK] Seq=907 Ack=12984 Win=5163 Len=0"
"152","7.433499","216.58.211.163","10.152.152.11","TLSv1.1","1514","Application Data [TCP segment of a reassembled PDU]"
"153","7.433503","10.152.152.11","216.58.211.163","TCP","54","49234  >  443 [ACK] Seq=907 Ack=14444 Win=5163 Len=0"
"154","7.433517","216.58.211.163","10.152.152.11","TLSv1.1","1118","Application Data [TCP segment of a reassembled PDU]"
"155","7.433521","10.152.152.11","216.58.211.163","TCP","54","49234  >  443 [ACK] Seq=907 Ack=15508 Win=5117 Len=0"
"156","7.435723","216.58.211.163","10.152.152.11","TCP","552","443  >  49234 [PSH, ACK] Seq=15508 Ack=907 Win=1928 Len=498 [TCP segment of a reassembled PDU]"
"157","7.435764","10.152.152.11","216.58.211.163","TCP","54","49234  >  443 [ACK] Seq=907 Ack=16006 Win=5163 Len=0"
"158","7.440327","216.58.211.163","10.152.152.11","TLSv1.1","1514","Application Data [TCP segment of a reassembled PDU]"
"159","7.440337","10.152.152.11","216.58.211.163","TCP","54","49234  >  443 [ACK] Seq=907 Ack=17466 Win=5163 Len=0"
"160","7.440354","216.58.211.163","10.152.152.11","TLSv1.1","1514","Application Data [TCP segment of a reassembled PDU]"
"161","7.440357","10.152.152.11","216.58.211.163","TCP","54","49234  >  443 [ACK] Seq=907 Ack=18926 Win=5163 Len=0"
"162","7.440377","216.58.211.163","10.152.152.11","TLSv1.1","620","Application Data [TCP segment of a reassembled PDU]"
"163","7.440381","10.152.152.11","216.58.211.163","TCP","54","49234  >  443 [ACK] Seq=907 Ack=19492 Win=5128 Len=0"
"164","7.441921","216.58.211.163","10.152.152.11","TLSv1.1","1514","Application Data [TCP segment of a reassembled PDU]"
"165","7.441960","10.152.152.11","216.58.211.163","TCP","54","49234  >  443 [ACK] Seq=907 Ack=20952 Win=5163 Len=0"
"166","7.442250","216.58.211.163","10.152.152.11","TLSv1.1","1514","Application Data [TCP segment of a reassembled PDU]"
"167","7.442255","10.152.152.11","216.58.211.163","TCP","54","49234  >  443 [ACK] Seq=907 Ack=22412 Win=5163 Len=0"
"168","7.442269","216.58.211.163","10.152.152.11","TLSv1.1","1118","Application Data [TCP segment of a reassembled PDU]"
"169","7.442271","10.152.152.11","216.58.211.163","TCP","54","49234  >  443 [ACK] Seq=907 Ack=23476 Win=5163 Len=0"
"170","7.443892","216.58.211.163","10.152.152.11","TLSv1.1","1514","Application Data [TCP segment of a reassembled PDU]"
"171","7.443948","10.152.152.11","216.58.211.163","TCP","54","49234  >  443 [ACK] Seq=907 Ack=24936 Win=5163 Len=0"
"172","7.443978","216.58.211.163","10.152.152.11","TLSv1.1","1514","Application Data [TCP segment of a reassembled PDU]"
"173","7.444010","10.152.152.11","216.58.211.163","TCP","54","49234  >  443 [ACK] Seq=907 Ack=26396 Win=5163 Len=0"
"174","7.444036","216.58.211.163","10.152.152.11","TCP","620","443  >  49234 [PSH, ACK] Seq=26396 Ack=907 Win=1928 Len=566 [TCP segment of a reassembled PDU]"
"175","7.444400","10.152.152.11","216.58.211.163","TCP","54","49234  >  443 [ACK] Seq=907 Ack=26962 Win=5163 Len=0"
"176","7.456087","216.58.211.163","10.152.152.11","TCP","552","443  >  49234 [PSH, ACK] Seq=26962 Ack=907 Win=1928 Len=498 [TCP segment of a reassembled PDU]"
"177","7.456150","10.152.152.11","216.58.211.163","TCP","54","49234  >  443 [ACK] Seq=907 Ack=27460 Win=5163 Len=0"
"178","7.459328","216.58.211.163","10.152.152.11","TLSv1.1","1514","Application Data [TCP segment of a reassembled PDU]"
"179","7.459335","216.58.211.163","10.152.152.11","TLSv1.1","1514","Application Data [TCP segment of a reassembled PDU]"
"180","7.459340","10.152.152.11","216.58.211.163","TCP","54","49234  >  443 [ACK] Seq=907 Ack=30380 Win=5163 Len=0"
"181","7.459355","216.58.211.163","10.152.152.11","TLSv1.1","1118","Application Data [TCP segment of a reassembled PDU]"
"182","7.459569","10.152.152.11","216.58.211.163","TCP","54","49234  >  443 [ACK] Seq=907 Ack=31444 Win=5163 Len=0"
"183","7.461353","216.58.211.163","10.152.152.11","TLSv1.1","552","Application Data [TCP segment of a reassembled PDU]"
"184","7.461389","10.152.152.11","216.58.211.163","TCP","54","49234  >  443 [ACK] Seq=907 Ack=31942 Win=5163 Len=0"
"185","7.476737","216.58.211.163","10.152.152.11","TLSv1.1","1514","Application Data [TCP segment of a reassembled PDU]"
"186","7.476779","216.58.211.163","10.152.152.11","TLSv1.1","1514","Application Data [TCP segment of a reassembled PDU]"
"187","7.476809","10.152.152.11","216.58.211.163","TCP","54","49234  >  443 [ACK] Seq=907 Ack=34862 Win=5163 Len=0"
"188","7.476836","216.58.211.163","10.152.152.11","TCP","620","443  >  49234 [PSH, ACK] Seq=34862 Ack=907 Win=1928 Len=566 [TCP segment of a reassembled PDU]"
"189","7.477054","10.152.152.11","216.58.211.163","TCP","54","49234  >  443 [ACK] Seq=907 Ack=35428 Win=5163 Len=0"
"190","7.572565","216.58.211.163","10.152.152.11","TLSv1.1","1514","Application Data [TCP segment of a reassembled PDU]"
"191","7.572608","216.58.211.163","10.152.152.11","TLSv1.1","1514","Application Data [TCP segment of a reassembled PDU]"
"192","7.572625","10.152.152.11","216.58.211.163","TCP","54","49234  >  443 [ACK] Seq=907 Ack=38348 Win=5163 Len=0"
"193","7.572646","216.58.211.163","10.152.152.11","TLSv1.1","1118","Application Data [TCP segment of a reassembled PDU]"
"194","7.573666","10.152.152.11","216.58.211.163","TCP","54","49234  >  443 [ACK] Seq=907 Ack=39412 Win=5163 Len=0"
"195","7.574500","216.58.211.163","10.152.152.11","TLSv1.1","1514","Application Data [TCP segment of a reassembled PDU]"
"196","7.574508","216.58.211.163","10.152.152.11","TLSv1.1","1514","Application Data [TCP segment of a reassembled PDU]"
"197","7.574511","10.152.152.11","216.58.211.163","TCP","54","49234  >  443 [ACK] Seq=907 Ack=42332 Win=5163 Len=0"
"198","7.574711","216.58.211.163","10.152.152.11","TLSv1.1","1118","Application Data [TCP segment of a reassembled PDU]"
"199","7.574716","216.58.211.163","10.152.152.11","TLSv1.1","1514","Application Data [TCP segment of a reassembled PDU]"
"200","7.574749","10.152.152.11","216.58.211.163","TCP","54","49234  >  443 [ACK] Seq=907 Ack=44856 Win=5163 Len=0"
"201","7.575832","216.58.211.163","10.152.152.11","TLSv1.1","1514","Application Data [TCP segment of a reassembled PDU]"
"202","7.575890","216.58.211.163","10.152.152.11","TLSv1.1","1118","Application Data [TCP segment of a reassembled PDU]"
"203","7.575940","10.152.152.11","216.58.211.163","TCP","54","49234  >  443 [ACK] Seq=907 Ack=47380 Win=5163 Len=0"
"204","7.575977","216.58.211.163","10.152.152.11","TLSv1.1","1514","Application Data [TCP segment of a reassembled PDU]"
"205","7.576001","216.58.211.163","10.152.152.11","TLSv1.1","1514","Application Data [TCP segment of a reassembled PDU]"
"206","7.576574","216.58.211.163","10.152.152.11","TCP","1118","443  >  49234 [PSH, ACK] Seq=50300 Ack=907 Win=1928 Len=1064 [TCP segment of a reassembled PDU]"
"207","7.579158","216.58.211.163","10.152.152.11","TLSv1.1","1514","Application Data, Application Data"
"208","7.579175","216.58.211.163","10.152.152.11","TLSv1.1","1514","Application Data [TCP segment of a reassembled PDU]"
"209","7.582696","216.58.211.163","10.152.152.11","TLSv1.1","1514","Application Data [TCP segment of a reassembled PDU]"
"210","7.582713","216.58.211.163","10.152.152.11","TLSv1.1","1514","Application Data [TCP segment of a reassembled PDU]"
"211","7.582719","216.58.211.163","10.152.152.11","TLSv1.1","1514","Application Data [TCP segment of a reassembled PDU]"
"212","7.583031","10.152.152.11","216.58.211.163","TCP","54","49234  >  443 [ACK] Seq=907 Ack=58664 Win=5163 Len=0"
"213","7.583741","216.58.211.163","10.152.152.11","TCP","722","443  >  49234 [PSH, ACK] Seq=58664 Ack=907 Win=1928 Len=668 [TCP segment of a reassembled PDU]"
"214","7.583788","216.58.211.163","10.152.152.11","TLSv1.1","1514","Application Data [TCP segment of a reassembled PDU]"
"215","7.583828","216.58.211.163","10.152.152.11","TLSv1.1","1514","Application Data [TCP segment of a reassembled PDU]"
"216","7.583866","216.58.211.163","10.152.152.11","TLSv1.1","1514","Application Data [TCP segment of a reassembled PDU]"
"217","7.584979","216.58.211.163","10.152.152.11","TLSv1.1","1514","Application Data [TCP segment of a reassembled PDU]"
"218","7.584996","216.58.211.163","10.152.152.11","TLSv1.1","1514","Application Data [TCP segment of a reassembled PDU]"
"219","7.585545","10.152.152.11","216.58.211.163","TCP","54","49234  >  443 [ACK] Seq=907 Ack=66632 Win=5163 Len=0"
"220","7.586107","216.58.211.163","10.152.152.11","TLSv1.1","722","Application Data [TCP segment of a reassembled PDU]"
"221","7.586235","10.152.152.11","216.58.211.163","TCP","54","49234  >  443 [ACK] Seq=907 Ack=67300 Win=5163 Len=0"
"222","7.599562","216.58.211.163","10.152.152.11","TLSv1.1","1514","Application Data [TCP segment of a reassembled PDU]"
"223","7.599630","216.58.211.163","10.152.152.11","TLSv1.1","1514","Application Data [TCP segment of a reassembled PDU]"
"224","7.599669","10.152.152.11","216.58.211.163","TCP","54","49234  >  443 [ACK] Seq=907 Ack=70220 Win=5163 Len=0"
"225","7.599702","216.58.211.163","10.152.152.11","TCP","620","443  >  49234 [PSH, ACK] Seq=70220 Ack=907 Win=1928 Len=566 [TCP segment of a reassembled PDU]"
"226","7.600688","216.58.211.163","10.152.152.11","TLSv1.1","1514","Application Data [TCP segment of a reassembled PDU]"
"227","7.601081","10.152.152.11","216.58.211.163","TCP","54","49234  >  443 [ACK] Seq=907 Ack=72246 Win=5163 Len=0"
"228","7.601456","216.58.211.163","10.152.152.11","TLSv1.1","1514","Application Data [TCP segment of a reassembled PDU]"
"229","7.601466","216.58.211.163","10.152.152.11","TLSv1.1","171","Application Data"
"230","7.601475","10.152.152.11","216.58.211.163","TCP","54","49234  >  443 [ACK] Seq=907 Ack=73823 Win=5163 Len=0"
"231","7.810439","216.58.211.163","10.152.152.11","TLSv1.1","1514","Application Data"
"232","7.810473","10.152.152.11","216.58.211.163","TCP","54","49234  >  443 [ACK] Seq=907 Ack=75283 Win=5163 Len=0"
"233","7.810490","216.58.211.163","10.152.152.11","TLSv1.1","1514","Application Data [TCP segment of a reassembled PDU]"
"234","7.810494","10.152.152.11","216.58.211.163","TCP","54","49234  >  443 [ACK] Seq=907 Ack=76743 Win=5163 Len=0"
"235","7.810506","216.58.211.163","10.152.152.11","TCP","620","443  >  49234 [PSH, ACK] Seq=76743 Ack=907 Win=1928 Len=566 [TCP segment of a reassembled PDU]"
"236","7.810509","10.152.152.11","216.58.211.163","TCP","54","49234  >  443 [ACK] Seq=907 Ack=77309 Win=5128 Len=0"
"237","7.824766","216.58.211.163","10.152.152.11","TLSv1.1","1514","Application Data [TCP segment of a reassembled PDU]"
"238","7.824783","10.152.152.11","216.58.211.163","TCP","54","49234  >  443 [ACK] Seq=907 Ack=78769 Win=5163 Len=0"
"239","7.824802","216.58.211.163","10.152.152.11","TLSv1.1","1514","Application Data [TCP segment of a reassembled PDU]"
"240","7.824805","10.152.152.11","216.58.211.163","TCP","54","49234  >  443 [ACK] Seq=907 Ack=80229 Win=5163 Len=0"
"241","7.824818","216.58.211.163","10.152.152.11","TLSv1.1","1118","Application Data [TCP segment of a reassembled PDU]"
"242","7.824821","10.152.152.11","216.58.211.163","TCP","54","49234  >  443 [ACK] Seq=907 Ack=81293 Win=5117 Len=0"
"243","7.839886","216.58.211.163","10.152.152.11","TLSv1.1","1514","Application Data, Application Data"
"244","7.839906","10.152.152.11","216.58.211.163","TCP","54","49234  >  443 [ACK] Seq=907 Ack=82753 Win=5163 Len=0"
"245","7.839933","216.58.211.163","10.152.152.11","TLSv1.1","1514","Application Data [TCP segment of a reassembled PDU]"
"246","7.839937","10.152.152.11","216.58.211.163","TCP","54","49234  >  443 [ACK] Seq=907 Ack=84213 Win=5163 Len=0"
"247","7.839955","216.58.211.163","10.152.152.11","TCP","1118","443  >  49234 [PSH, ACK] Seq=84213 Ack=907 Win=1928 Len=1064 [TCP segment of a reassembled PDU]"
"248","7.839958","10.152.152.11","216.58.211.163","TCP","54","49234  >  443 [ACK] Seq=907 Ack=85277 Win=5117 Len=0"
"249","7.853236","216.58.211.163","10.152.152.11","TLSv1.1","1514","Application Data [TCP segment of a reassembled PDU]"
"250","7.853255","10.152.152.11","216.58.211.163","TCP","54","49234  >  443 [ACK] Seq=907 Ack=86737 Win=5163 Len=0"
"251","7.853276","216.58.211.163","10.152.152.11","TLSv1.1","1514","Application Data, Application Data"
"252","7.853279","10.152.152.11","216.58.211.163","TCP","54","49234  >  443 [ACK] Seq=907 Ack=88197 Win=5163 Len=0"
"253","7.853291","216.58.211.163","10.152.152.11","TLSv1.1","1118","Application Data [TCP segment of a reassembled PDU]"
"254","7.853294","10.152.152.11","216.58.211.163","TCP","54","49234  >  443 [ACK] Seq=907 Ack=89261 Win=5117 Len=0"
"255","7.861729","216.58.211.163","10.152.152.11","TCP","552","443  >  49234 [PSH, ACK] Seq=89261 Ack=907 Win=1928 Len=498 [TCP segment of a reassembled PDU]"
"256","7.861747","10.152.152.11","216.58.211.163","TCP","54","49234  >  443 [ACK] Seq=907 Ack=89759 Win=5163 Len=0"
"257","7.868354","216.58.211.163","10.152.152.11","TLSv1.1","1514","Application Data [TCP segment of a reassembled PDU]"
"258","7.868464","10.152.152.11","216.58.211.163","TCP","54","49234  >  443 [ACK] Seq=907 Ack=91219 Win=5163 Len=0"
"259","7.868511","216.58.211.163","10.152.152.11","TLSv1.1","1514","Application Data [TCP segment of a reassembled PDU]"
"260","7.868565","10.152.152.11","216.58.211.163","TCP","54","49234  >  443 [ACK] Seq=907 Ack=92679 Win=5163 Len=0"
"261","7.868601","216.58.211.163","10.152.152.11","TCP","620","443  >  49234 [PSH, ACK] Seq=92679 Ack=907 Win=1928 Len=566 [TCP segment of a reassembled PDU]"
"262","7.868649","10.152.152.11","216.58.211.163","TCP","54","49234  >  443 [ACK] Seq=907 Ack=93245 Win=5128 Len=0"
"263","7.881134","216.58.211.163","10.152.152.11","TLSv1.1","1514","Application Data, Application Data"
"264","7.881206","216.58.211.163","10.152.152.11","TLSv1.1","1514","Application Data [TCP segment of a reassembled PDU]"
"265","7.881259","10.152.152.11","216.58.211.163","TCP","54","49234  >  443 [ACK] Seq=907 Ack=96165 Win=5163 Len=0"
"266","7.881297","216.58.211.163","10.152.152.11","TCP","620","443  >  49234 [PSH, ACK] Seq=96165 Ack=907 Win=1928 Len=566 [TCP segment of a reassembled PDU]"
"267","7.885735","10.152.152.11","216.58.211.163","TCP","54","49234  >  443 [ACK] Seq=907 Ack=96731 Win=5163 Len=0"
"268","7.886656","10.152.152.11","173.194.65.139","TLSv1.1","315","[TCP Previous segment not captured] , Application Data"
"269","7.887370","173.194.65.139","10.152.152.11","TCP","60","[TCP ACKed unseen segment] 443  >  35944 [ACK] Seq=1 Ack=263 Win=1181 Len=0"
"270","7.887504","216.58.211.163","10.152.152.11","TCP","552","443  >  49234 [PSH, ACK] Seq=96731 Ack=907 Win=1928 Len=498 [TCP segment of a reassembled PDU]"
"271","7.889249","10.152.152.11","216.58.211.163","TCP","54","49234  >  443 [ACK] Seq=907 Ack=97229 Win=5163 Len=0"
"272","7.889554","10.152.152.11","173.194.65.139","TLSv1.1","123","Application Data"
"273","7.890332","173.194.65.139","10.152.152.11","TCP","60","443  >  35944 [ACK] Seq=1 Ack=332 Win=1181 Len=0"
"274","7.896751","216.58.211.163","10.152.152.11","TLSv1.1","1514","Application Data [TCP segment of a reassembled PDU]"
"275","7.896821","216.58.211.163","10.152.152.11","TLSv1.1","1514","Application Data [TCP segment of a reassembled PDU]"
"276","7.896872","10.152.152.11","216.58.211.163","TCP","54","49234  >  443 [ACK] Seq=907 Ack=100149 Win=5163 Len=0"
"277","7.896908","216.58.211.163","10.152.152.11","TLSv1.1","620","Application Data [TCP segment of a reassembled PDU]"
"278","7.897151","10.152.152.11","216.58.211.163","TCP","54","49234  >  443 [ACK] Seq=907 Ack=100715 Win=5163 Len=0"
"279","7.904602","216.58.211.163","10.152.152.11","TCP","552","443  >  49234 [PSH, ACK] Seq=100715 Ack=907 Win=1928 Len=498 [TCP segment of a reassembled PDU]"
"280","7.906089","10.152.152.11","216.58.211.163","TCP","54","49234  >  443 [ACK] Seq=907 Ack=101213 Win=5163 Len=0"
"281","7.912189","216.58.211.163","10.152.152.11","TLSv1.1","1514","Application Data [TCP segment of a reassembled PDU]"
"282","7.912267","216.58.211.163","10.152.152.11","TLSv1.1","1116","Application Data, Application Data, Application Data"
"283","7.912329","10.152.152.11","216.58.211.163","TCP","54","49234  >  443 [ACK] Seq=907 Ack=103735 Win=5163 Len=0"
"284","7.912372","74.125.136.138","10.152.152.11","TCP","552","443  >  46723 [PSH, ACK] Seq=1 Ack=179 Win=15680 Len=498 [TCP segment of a reassembled PDU]"
"285","7.912435","10.152.152.11","74.125.136.138","TCP","54","46723  >  443 [ACK] Seq=179 Ack=499 Win=15680 Len=0"
"286","7.914230","10.152.152.11","216.58.211.163","TLSv1.1","123","Application Data"
"287","7.915293","216.58.211.163","10.152.152.11","TCP","60","443  >  49234 [ACK] Seq=103735 Ack=976 Win=1928 Len=0"
"288","7.928918","74.125.136.138","10.152.152.11","TLSv1.1","1050","Server Hello [TCP segment of a reassembled PDU]"
"289","7.928937","10.152.152.11","74.125.136.138","TCP","54","46723  >  443 [ACK] Seq=179 Ack=1495 Win=17664 Len=0"
"290","7.932650","74.125.136.138","10.152.152.11","TCP","1514","443  >  46723 [ACK] Seq=1495 Ack=179 Win=15680 Len=1460 [TCP segment of a reassembled PDU]"
"291","7.932657","10.152.152.11","74.125.136.138","TCP","54","46723  >  443 [ACK] Seq=179 Ack=2955 Win=20592 Len=0"
"292","7.932813","74.125.136.138","10.152.152.11","TLSv1.1","1514","Certificate [TCP segment of a reassembled PDU]"
"293","7.932819","10.152.152.11","74.125.136.138","TCP","54","46723  >  443 [ACK] Seq=179 Ack=4415 Win=23504 Len=0"
"294","7.932832","74.125.136.138","10.152.152.11","TLSv1.1","164","Server Key Exchange, Server Hello Done"
"295","7.932835","10.152.152.11","74.125.136.138","TCP","54","46723  >  443 [ACK] Seq=179 Ack=4525 Win=23504 Len=0"
"296","7.960543","10.152.152.11","10.152.152.10","DNS","72","Standard query 0xb546 A id.google.ca"
"297","7.974613","10.152.152.11","74.125.136.138","TLSv1.1","332","Client Key Exchange, Change Cipher Spec, Encrypted Handshake Message"
"298","7.975170","74.125.136.138","10.152.152.11","TCP","60","443  >  46723 [ACK] Seq=4525 Ack=457 Win=16752 Len=0"
"299","8.242823","10.152.152.10","10.152.152.11","DNS","88","Standard query response 0xb546 A id.google.ca A 74.125.239.55"
"300","8.248439","10.152.152.11","74.125.136.139","TCP","54","54061  >  443 [ACK] Seq=1 Ack=1 Win=2008 Len=0"
"301","8.249606","74.125.136.139","10.152.152.11","TCP","60","[TCP ACKed unseen segment] 443  >  54061 [ACK] Seq=1 Ack=2 Win=1400 Len=0"
"302","8.266605","10.152.152.11","74.125.239.55","TCP","66","35650  >  443 [SYN] Seq=0 Win=14600 Len=0 MSS=1460 SACK_PERM=1 WS=16"
"303","8.267665","74.125.239.55","10.152.152.11","TCP","66","443  >  35650 [SYN, ACK] Seq=0 Ack=1 Win=14600 Len=0 MSS=1460 SACK_PERM=1 WS=16"
"304","8.267687","10.152.152.11","74.125.239.55","TCP","54","35650  >  443 [ACK] Seq=1 Ack=1 Win=14608 Len=0"
"305","8.273600","10.152.152.11","74.125.239.55","TLSv1.1","215","Client Hello"
"306","8.274212","74.125.239.55","10.152.152.11","TCP","60","443  >  35650 [ACK] Seq=1 Ack=162 Win=15680 Len=0"
"307","8.383248","10.152.152.11","10.152.152.10","DNS","79","Standard query 0xfdac A clients5.google.com"
"308","8.410691","173.194.65.139","10.152.152.11","TLSv1.1","1514","Application Data, Application Data"
"309","8.410759","173.194.65.139","10.152.152.11","TLSv1.1","1323","Application Data, Application Data, Application Data"
"310","8.410776","10.152.152.11","173.194.65.139","TCP","54","35944  >  443 [ACK] Seq=332 Ack=2730 Win=2555 Len=0"
"311","8.413262","10.152.152.11","173.194.65.139","TLSv1.1","123","Application Data"
"312","8.414145","173.194.65.139","10.152.152.11","TCP","60","443  >  35944 [ACK] Seq=2730 Ack=401 Win=1181 Len=0"
"313","8.419644","10.152.152.11","173.194.65.113","TLSv1.1","955","[TCP Previous segment not captured] , Application Data"
"314","8.420312","173.194.65.113","10.152.152.11","TCP","60","[TCP ACKed unseen segment] 443  >  50575 [ACK] Seq=1 Ack=903 Win=2063 Len=0"
"315","8.432299","10.152.152.11","173.194.65.113","TLSv1.1","123","Application Data"
"316","8.432514","10.152.152.11","173.194.65.113","TLSv1.1","219","Application Data"
"317","8.433003","173.194.65.113","10.152.152.11","TCP","60","443  >  50575 [ACK] Seq=1 Ack=972 Win=2063 Len=0"
"318","8.433022","173.194.65.113","10.152.152.11","TCP","60","443  >  50575 [ACK] Seq=1 Ack=1137 Win=2229 Len=0"
"319","8.436072","10.152.152.11","74.125.136.154","TCP","54","50993  >  443 [ACK] Seq=1 Ack=1 Win=2008 Len=0"
"320","8.436833","74.125.136.154","10.152.152.11","TCP","60","[TCP ACKed unseen segment] 443  >  50993 [ACK] Seq=1 Ack=2 Win=1122 Len=0"
"321","8.452544","10.152.152.11","74.125.136.84","TCP","54","48555  >  443 [ACK] Seq=1 Ack=1 Win=2008 Len=0"
"322","8.452953","74.125.136.84","10.152.152.11","TCP","60","[TCP ACKed unseen segment] 443  >  48555 [ACK] Seq=1 Ack=2 Win=1412 Len=0"
"323","8.465692","10.152.152.11","74.125.136.139","TLSv1.1","315","[TCP Previous segment not captured] , Application Data"
"324","8.466446","74.125.136.139","10.152.152.11","TCP","60","[TCP ACKed unseen segment] 443  >  54060 [ACK] Seq=1 Ack=263 Win=1181 Len=0"
"325","8.466843","10.152.152.11","74.125.136.139","TLSv1.1","123","Application Data"
"326","8.468527","74.125.136.139","10.152.152.11","TCP","60","443  >  54060 [ACK] Seq=1 Ack=332 Win=1181 Len=0"
"327","8.562809","74.125.136.138","10.152.152.11","TLSv1.1","526","New Session Ticket, Change Cipher Spec, Encrypted Handshake Message, Application Data, Application Data"
"328","8.562843","10.152.152.11","74.125.136.138","TCP","54","46723  >  443 [ACK] Seq=457 Ack=4997 Win=26432 Len=0"
"329","8.568455","10.152.152.11","74.125.136.138","TLSv1.1","139","Application Data"
"330","8.568462","74.125.136.138","10.152.152.11","TCP","60","443  >  46723 [ACK] Seq=4997 Ack=542 Win=16752 Len=0"
"331","8.568755","10.152.152.11","74.125.136.138","TLSv1.1","123","Application Data"
"332","8.569118","10.152.152.11","74.125.136.138","TLSv1.1","635","Application Data"
"333","8.569364","74.125.136.138","10.152.152.11","TCP","60","443  >  46723 [ACK] Seq=4997 Ack=611 Win=16752 Len=0"
"334","8.569367","74.125.136.138","10.152.152.11","TCP","60","443  >  46723 [ACK] Seq=4997 Ack=1192 Win=17920 Len=0"
"335","8.580299","10.152.152.11","74.125.136.102","TCP","54","39483  >  443 [ACK] Seq=1 Ack=1 Win=3005 Len=0"
"336","8.581757","74.125.136.102","10.152.152.11","TCP","60","[TCP ACKed unseen segment] 443  >  39483 [ACK] Seq=1 Ack=2 Win=1114 Len=0"
"337","8.713825","10.152.152.10","10.152.152.11","DNS","95","Standard query response 0xfdac A clients5.google.com A 74.125.136.102"
"338","8.714862","10.152.152.11","74.125.136.102","TCP","66","39533  >  443 [SYN] Seq=0 Win=14600 Len=0 MSS=1460 SACK_PERM=1 WS=16"
"339","8.716761","74.125.136.102","10.152.152.11","TCP","66","443  >  39533 [SYN, ACK] Seq=0 Ack=1 Win=14600 Len=0 MSS=1460 SACK_PERM=1 WS=16"
"340","8.716776","10.152.152.11","74.125.136.102","TCP","54","39533  >  443 [ACK] Seq=1 Ack=1 Win=14608 Len=0"
