"No.","Time","Source","Destination","Protocol","Length","Info"
"1","0.000000","10.152.152.11","54.239.168.246","TCP","54","58695  >  80 [ACK] Seq=1 Ack=1 Win=1162 Len=0"
"2","0.000039","54.239.168.246","10.152.152.11","TCP","552","80  >  58694 [PSH, ACK] Seq=1 Ack=1 Win=980 Len=498 [TCP segment of a reassembled PDU]"
"3","0.000047","10.152.152.11","54.239.168.246","TCP","54","58694  >  80 [ACK] Seq=1 Ack=499 Win=980 Len=0"
"4","0.000284","10.152.152.11","54.239.168.246","HTTP","453","GET /bangla-media/2013/01/06/14_180x50_adn_telecome.jpg/BINARY/14_180x50_adn_telecome.jpg HTTP/1.1 "
"5","0.000412","54.239.168.246","10.152.152.11","TCP","60","80  >  58695 [ACK] Seq=1 Ack=400 Win=1047 Len=0"
"6","0.018597","10.152.152.10","10.152.152.11","DNS","66","Standard query response 0x6b7f No such name AAAA goo.gl"
"7","0.018619","10.152.152.10","10.152.152.11","DNS","82","Standard query response 0x6d3d A goo.gl A 173.194.116.195"
"8","0.101475","54.239.168.246","10.152.152.11","HTTP","546","HTTP/1.1 200 OK  (PNG)"
"9","0.101491","10.152.152.11","54.239.168.246","TCP","54","58694  >  80 [ACK] Seq=1 Ack=991 Win=1047 Len=0"
"10","0.101515","54.239.168.246","10.152.152.11","HTTP","1098","HTTP/1.1 200 OK  (GIF89a)"
"11","0.101521","10.152.152.11","54.239.168.246","TCP","54","58693  >  80 [ACK] Seq=1 Ack=1045 Win=1043 Len=0"
"12","0.101882","10.152.152.11","54.239.168.246","HTTP","561","GET /media/2016/02/23/subi-reef-located-in-the-disputed-spratly-islands-in-the-south-china-sea.jpg/ALTERNATES/w320/Subi+reef%2C+located+in+the+disputed+Spratly+Islands+in+the+South+China+Sea%2C.jpg HTTP/1.1 "
"13","0.102152","54.239.168.246","10.152.152.11","TCP","60","80  >  58693 [ACK] Seq=1045 Ack=508 Win=1047 Len=0"
"14","0.102475","10.152.152.11","54.239.168.246","HTTP","447","GET /media/2016/02/23/uk_and_bangladesh_.jpg/ALTERNATES/w320/uk_and_bangladesh_.jpg HTTP/1.1 "
"15","0.102618","54.239.168.246","10.152.152.11","TCP","60","80  >  58694 [ACK] Seq=991 Ack=394 Win=1047 Len=0"
"16","0.110982","10.152.152.11","173.194.65.156","TCP","54","51742  >  80 [ACK] Seq=1 Ack=1 Win=2640 Len=0"
"17","0.111228","173.194.65.156","10.152.152.11","TCP","60","[TCP ACKed unseen segment] 80  >  51742 [ACK] Seq=1 Ack=2 Win=1360 Len=0"
"18","0.145887","10.152.152.10","10.152.152.11","DNS","76","Standard query response 0x5425 No such name AAAA bpl.bdnews24.com"
"19","0.153141","10.152.152.10","10.152.152.11","DNS","92","Standard query response 0xdcca A bpl.bdnews24.com A 52.74.64.136"
"20","0.153175","10.152.152.10","10.152.152.11","DNS","77","Standard query response 0x477c No such name AAAA arts.bdnews24.com"
"21","0.153231","10.152.152.10","10.152.152.11","DNS","93","Standard query response 0x5136 A arts.bdnews24.com A 54.179.173.14"
"22","0.181901","104.244.43.204","10.152.152.11","TLSv1.2","552","Server Hello"
"23","0.181935","10.152.152.11","104.244.43.204","TCP","54","38462  >  443 [ACK] Seq=1 Ack=499 Win=980 Len=0"
"24","0.182618","104.244.43.204","10.152.152.11","TCP","1514","443  >  38462 [ACK] Seq=499 Ack=1 Win=980 Len=1460 [TCP segment of a reassembled PDU]"
"25","0.182630","10.152.152.11","104.244.43.204","TCP","54","38462  >  443 [ACK] Seq=1 Ack=1959 Win=1162 Len=0"
"26","0.182662","104.244.43.204","10.152.152.11","TLSv1.2","1514","Certificate, Certificate Status"
"27","0.182667","10.152.152.11","104.244.43.204","TCP","54","38462  >  443 [ACK] Seq=1 Ack=3419 Win=1345 Len=0"
"28","0.182676","104.244.43.204","10.152.152.11","TLSv1.2","234","Server Key Exchange, Server Hello Done"
"29","0.182681","10.152.152.11","104.244.43.204","TCP","54","38462  >  443 [ACK] Seq=1 Ack=3599 Win=1527 Len=0"
"30","0.182690","173.241.250.219","10.152.152.11","TCP","552","80  >  38346 [PSH, ACK] Seq=1 Ack=1 Win=1048 Len=498 [TCP segment of a reassembled PDU]"
"31","0.182695","10.152.152.11","173.241.250.219","TCP","54","38346  >  80 [ACK] Seq=1 Ack=499 Win=2640 Len=0"
"32","0.183353","173.241.250.219","10.152.152.11","HTTP","158","HTTP/1.1 302 Moved Temporarily "
"33","0.183365","10.152.152.11","173.241.250.219","TCP","54","38346  >  80 [ACK] Seq=1 Ack=603 Win=2640 Len=0"
"34","0.184048","54.169.46.48","10.152.152.11","TCP","1514","80  >  58912 [ACK] Seq=1 Ack=1 Win=1047 Len=1460 [TCP segment of a reassembled PDU]"
"35","0.184060","10.152.152.11","54.169.46.48","TCP","54","58912  >  80 [ACK] Seq=1 Ack=1461 Win=2640 Len=0"
"36","0.184080","54.169.46.48","10.152.152.11","TCP","1514","80  >  58912 [ACK] Seq=1461 Ack=1 Win=1047 Len=1460 [TCP segment of a reassembled PDU]"
"37","0.184084","10.152.152.11","54.169.46.48","TCP","54","58912  >  80 [ACK] Seq=1 Ack=2921 Win=2591 Len=0"
"38","0.184091","54.169.46.48","10.152.152.11","TCP","620","80  >  58912 [PSH, ACK] Seq=2921 Ack=1 Win=1047 Len=566 [TCP segment of a reassembled PDU]"
"39","0.184104","10.152.152.11","54.169.46.48","TCP","54","58912  >  80 [ACK] Seq=1 Ack=3487 Win=2556 Len=0"
"40","0.184837","54.169.46.48","10.152.152.11","TCP","1514","80  >  58912 [ACK] Seq=3487 Ack=1 Win=1047 Len=1460 [TCP segment of a reassembled PDU]"
"41","0.184858","10.152.152.11","54.169.46.48","TCP","54","58912  >  80 [ACK] Seq=1 Ack=4947 Win=2465 Len=0"
"42","0.184872","54.169.46.48","10.152.152.11","TCP","1514","80  >  58912 [ACK] Seq=4947 Ack=1 Win=1047 Len=1460 [TCP segment of a reassembled PDU]"
"43","0.184887","10.152.152.11","54.169.46.48","TCP","54","58912  >  80 [ACK] Seq=1 Ack=6407 Win=2381 Len=0"
"44","0.184897","54.169.46.48","10.152.152.11","TCP","1118","80  >  58912 [PSH, ACK] Seq=6407 Ack=1 Win=1047 Len=1064 [TCP segment of a reassembled PDU]"
"45","0.184903","10.152.152.11","54.169.46.48","TCP","54","58912  >  80 [ACK] Seq=1 Ack=7471 Win=2315 Len=0"
"46","0.186345","10.152.152.11","104.244.43.204","TLSv1.2","180","Client Key Exchange, Change Cipher Spec, Encrypted Handshake Message"
"47","0.186654","104.244.43.204","10.152.152.11","TCP","60","443  >  38462 [ACK] Seq=3599 Ack=127 Win=980 Len=0"
"48","0.212050","54.169.46.48","10.152.152.11","TCP","1005","80  >  58912 [PSH, ACK] Seq=7471 Ack=1 Win=1047 Len=951 [TCP segment of a reassembled PDU]"
"49","0.212088","10.152.152.11","54.169.46.48","TCP","54","58912  >  80 [ACK] Seq=1 Ack=8422 Win=2640 Len=0"
"50","0.213830","54.169.46.48","10.152.152.11","TCP","1502","80  >  58912 [PSH, ACK] Seq=8422 Ack=1 Win=1047 Len=1448 [TCP segment of a reassembled PDU]"
"51","0.213843","10.152.152.11","54.169.46.48","TCP","54","58912  >  80 [ACK] Seq=1 Ack=9870 Win=2640 Len=0"
"52","0.214742","54.169.46.48","10.152.152.11","TCP","1514","80  >  58912 [ACK] Seq=9870 Ack=1 Win=1047 Len=1460 [TCP segment of a reassembled PDU]"
"53","0.214751","10.152.152.11","54.169.46.48","TCP","54","58912  >  80 [ACK] Seq=1 Ack=11330 Win=2591 Len=0"
"54","0.214763","54.169.46.48","10.152.152.11","TCP","1490","80  >  58912 [PSH, ACK] Seq=11330 Ack=1 Win=1047 Len=1436 [TCP segment of a reassembled PDU]"
"55","0.214768","10.152.152.11","54.169.46.48","TCP","54","58912  >  80 [ACK] Seq=1 Ack=12766 Win=2521 Len=0"
"56","0.214811","54.169.46.48","10.152.152.11","TCP","552","80  >  58882 [PSH, ACK] Seq=1 Ack=1 Win=1047 Len=498 [TCP segment of a reassembled PDU]"
"57","0.214817","10.152.152.11","54.169.46.48","TCP","54","58882  >  80 [ACK] Seq=1 Ack=499 Win=2640 Len=0"
"58","0.219252","54.169.46.48","10.152.152.11","TCP","1514","80  >  58882 [ACK] Seq=499 Ack=1 Win=1047 Len=1460 [TCP segment of a reassembled PDU]"
"59","0.219279","10.152.152.11","54.169.46.48","TCP","54","58882  >  80 [ACK] Seq=1 Ack=1959 Win=2591 Len=0"
"60","0.219296","54.169.46.48","10.152.152.11","TCP","1514","80  >  58882 [ACK] Seq=1959 Ack=1 Win=1047 Len=1460 [TCP segment of a reassembled PDU]"
"61","0.219302","10.152.152.11","54.169.46.48","TCP","54","58882  >  80 [ACK] Seq=1 Ack=3419 Win=2521 Len=0"
"62","0.219314","54.169.46.48","10.152.152.11","TCP","980","80  >  58882 [PSH, ACK] Seq=3419 Ack=1 Win=1047 Len=926 [TCP segment of a reassembled PDU]"
"63","0.219319","10.152.152.11","54.169.46.48","TCP","54","58882  >  80 [ACK] Seq=1 Ack=4345 Win=2464 Len=0"
"64","0.219843","54.169.46.48","10.152.152.11","TCP","552","80  >  58882 [PSH, ACK] Seq=4345 Ack=1 Win=1047 Len=498 [TCP segment of a reassembled PDU]"
"65","0.219853","10.152.152.11","54.169.46.48","TCP","54","58882  >  80 [ACK] Seq=1 Ack=4843 Win=2433 Len=0"
"66","0.226986","10.152.152.11","173.194.65.156","TCP","54","51748  >  80 [ACK] Seq=1 Ack=1 Win=3370 Len=0"
"67","0.227222","173.194.65.156","10.152.152.11","TCP","60","[TCP ACKed unseen segment] 80  >  51748 [ACK] Seq=1 Ack=2 Win=998 Len=0"
"68","0.227523","10.152.152.11","10.152.152.10","DNS","79","Standard query 0x0af2 A bangla.bdnews24.com"
"69","0.228032","10.152.152.11","54.169.46.48","TCP","66","58950  >  80 [SYN] Seq=0 Win=14600 Len=0 MSS=1460 SACK_PERM=1 WS=16"
"70","0.228252","54.169.46.48","10.152.152.11","TCP","66","80  >  58950 [SYN, ACK] Seq=0 Ack=1 Win=14600 Len=0 MSS=1460 SACK_PERM=1 WS=16"
"71","0.228280","10.152.152.11","54.169.46.48","TCP","54","58950  >  80 [ACK] Seq=1 Ack=1 Win=14608 Len=0"
"72","0.229233","54.169.46.48","10.152.152.11","HTTP","1182","HTTP/1.1 200 OK "
"73","0.229253","10.152.152.11","54.169.46.48","TCP","54","58882  >  80 [ACK] Seq=1 Ack=5971 Win=2640 Len=0"
"74","0.229837","74.125.136.155","10.152.152.11","TLSv1.2","1514","Server Hello"
"75","0.229851","10.152.152.11","74.125.136.155","TCP","54","36509  >  443 [ACK] Seq=1 Ack=1461 Win=1095 Len=0"
"76","0.229866","74.125.136.155","10.152.152.11","TCP","1514","443  >  36509 [ACK] Seq=1461 Ack=1 Win=980 Len=1460 [TCP segment of a reassembled PDU]"
"77","0.229872","10.152.152.11","74.125.136.155","TCP","54","36509  >  443 [ACK] Seq=1 Ack=2921 Win=1278 Len=0"
"78","0.229979","74.125.136.155","10.152.152.11","TLSv1.2","1000","Certificate, Server Key Exchange, Server Hello Done"
"79","0.229988","10.152.152.11","74.125.136.155","TCP","54","36509  >  443 [ACK] Seq=1 Ack=3867 Win=1460 Len=0"
"80","0.230189","74.125.136.155","10.152.152.11","TCP","1472","80  >  57398 [PSH, ACK] Seq=1 Ack=1 Win=1596 Len=1418 [TCP segment of a reassembled PDU]"
"81","0.230201","10.152.152.11","74.125.136.155","TCP","54","57398  >  80 [ACK] Seq=1 Ack=1419 Win=1229 Len=0"
"82","0.230472","74.125.136.155","10.152.152.11","TCP","1514","80  >  57398 [ACK] Seq=1419 Ack=1 Win=1596 Len=1460 [TCP segment of a reassembled PDU]"
"83","0.230482","10.152.152.11","74.125.136.155","TCP","54","57398  >  80 [ACK] Seq=1 Ack=2879 Win=1412 Len=0"
"84","0.230506","74.125.136.155","10.152.152.11","TCP","1514","80  >  57398 [ACK] Seq=2879 Ack=1 Win=1596 Len=1460 [TCP segment of a reassembled PDU]"
"85","0.230512","10.152.152.11","74.125.136.155","TCP","54","57398  >  80 [ACK] Seq=1 Ack=4339 Win=1594 Len=0"
"86","0.230650","74.125.136.155","10.152.152.11","TCP","1118","80  >  57398 [PSH, ACK] Seq=4339 Ack=1 Win=1596 Len=1064 [TCP segment of a reassembled PDU]"
"87","0.230659","10.152.152.11","74.125.136.155","TCP","54","57398  >  80 [ACK] Seq=1 Ack=5403 Win=1777 Len=0"
"88","0.230968","74.125.136.155","10.152.152.11","TCP","1514","80  >  57398 [ACK] Seq=5403 Ack=1 Win=1596 Len=1460 [TCP segment of a reassembled PDU]"
"89","0.230980","10.152.152.11","74.125.136.155","TCP","54","57398  >  80 [ACK] Seq=1 Ack=6863 Win=1959 Len=0"
"90","0.231004","74.125.136.155","10.152.152.11","TCP","1514","80  >  57398 [ACK] Seq=6863 Ack=1 Win=1596 Len=1460 [TCP segment of a reassembled PDU]"
"91","0.231010","10.152.152.11","74.125.136.155","TCP","54","57398  >  80 [ACK] Seq=1 Ack=8323 Win=2142 Len=0"
"92","0.231021","74.125.136.155","10.152.152.11","TCP","1118","80  >  57398 [PSH, ACK] Seq=8323 Ack=1 Win=1596 Len=1064 [TCP segment of a reassembled PDU]"
"93","0.231036","10.152.152.11","74.125.136.155","TCP","54","57398  >  80 [ACK] Seq=1 Ack=9387 Win=2311 Len=0"
"94","0.231353","74.125.136.155","10.152.152.11","TCP","1514","80  >  57398 [ACK] Seq=9387 Ack=1 Win=1596 Len=1460 [TCP segment of a reassembled PDU]"
"95","0.231363","10.152.152.11","74.125.136.155","TCP","54","57398  >  80 [ACK] Seq=1 Ack=10847 Win=2241 Len=0"
"96","0.231386","74.125.136.155","10.152.152.11","TCP","1514","80  >  57398 [ACK] Seq=10847 Ack=1 Win=1596 Len=1460 [TCP segment of a reassembled PDU]"
"97","0.231392","10.152.152.11","74.125.136.155","TCP","54","57398  >  80 [ACK] Seq=1 Ack=12307 Win=2171 Len=0"
"98","0.231502","74.125.136.155","10.152.152.11","TCP","620","80  >  57398 [PSH, ACK] Seq=12307 Ack=1 Win=1596 Len=566 [TCP segment of a reassembled PDU]"
"99","0.231508","10.152.152.11","74.125.136.155","TCP","54","57398  >  80 [ACK] Seq=1 Ack=12873 Win=2136 Len=0"
"100","0.239799","10.152.152.11","74.125.136.155","TLSv1.2","216","Client Key Exchange, Change Cipher Spec, Encrypted Handshake Message"
"101","0.240156","74.125.136.155","10.152.152.11","TCP","60","443  >  36509 [ACK] Seq=3867 Ack=163 Win=1047 Len=0"
"102","0.248347","10.152.152.11","10.152.152.10","DNS","79","Standard query 0x6932 A clients1.google.com"
"103","0.248377","10.152.152.11","10.152.152.10","DNS","79","Standard query 0x0403 AAAA clients1.google.com"
"104","0.250199","10.152.152.11","10.152.152.10","DNS","79","Standard query 0x37d8 A clients1.google.com"
"105","0.265546","74.125.136.155","10.152.152.11","TCP","1362","80  >  57398 [PSH, ACK] Seq=12873 Ack=1 Win=1596 Len=1308 [TCP segment of a reassembled PDU]"
"106","0.265573","10.152.152.11","74.125.136.155","TCP","54","57398  >  80 [ACK] Seq=1 Ack=14181 Win=2507 Len=0"
"107","0.265909","185.57.60.185","10.152.152.11","HTTP","664","HTTP/1.1 200 OK  (PNG)"
"108","0.265934","10.152.152.11","185.57.60.185","TCP","54","59739  >  80 [ACK] Seq=1 Ack=611 Win=989 Len=0"
"109","0.266453","74.125.136.155","10.152.152.11","TCP","552","80  >  57398 [PSH, ACK] Seq=14181 Ack=1 Win=1596 Len=498 [TCP segment of a reassembled PDU]"
"110","0.266467","10.152.152.11","74.125.136.155","TCP","54","57398  >  80 [ACK] Seq=1 Ack=14679 Win=2640 Len=0"
"111","0.268019","74.125.136.155","10.152.152.11","TCP","1472","80  >  57398 [PSH, ACK] Seq=14679 Ack=1 Win=1596 Len=1418 [TCP segment of a reassembled PDU]"
"112","0.268032","10.152.152.11","74.125.136.155","TCP","54","57398  >  80 [ACK] Seq=1 Ack=16097 Win=2640 Len=0"
"113","0.268411","74.125.136.155","10.152.152.11","TCP","1514","80  >  57398 [ACK] Seq=16097 Ack=1 Win=1596 Len=1460 [TCP segment of a reassembled PDU]"
"114","0.268419","74.125.136.155","10.152.152.11","TCP","1514","80  >  57398 [ACK] Seq=17557 Ack=1 Win=1596 Len=1460 [TCP segment of a reassembled PDU]"
"115","0.268423","74.125.136.155","10.152.152.11","TCP","1206","80  >  57398 [PSH, ACK] Seq=19017 Ack=1 Win=1596 Len=1152 [TCP segment of a reassembled PDU]"
"116","0.268424","10.152.152.11","74.125.136.155","TCP","54","57398  >  80 [ACK] Seq=1 Ack=17557 Win=2640 Len=0"
"117","0.268425","74.125.136.155","10.152.152.11","TCP","1514","80  >  57398 [ACK] Seq=20169 Ack=1 Win=1596 Len=1460 [TCP segment of a reassembled PDU]"
"118","0.268441","10.152.152.11","74.125.136.155","TCP","54","57398  >  80 [ACK] Seq=1 Ack=19017 Win=2591 Len=0"
"119","0.268462","10.152.152.11","74.125.136.155","TCP","54","57398  >  80 [ACK] Seq=1 Ack=20169 Win=2521 Len=0"
"120","0.268487","10.152.152.11","74.125.136.155","TCP","54","57398  >  80 [ACK] Seq=1 Ack=21629 Win=2451 Len=0"
"121","0.268547","74.125.136.155","10.152.152.11","TCP","1494","80  >  57398 [PSH, ACK] Seq=21629 Ack=1 Win=1596 Len=1440 [TCP segment of a reassembled PDU]"
"122","0.268555","10.152.152.11","74.125.136.155","TCP","54","57398  >  80 [ACK] Seq=1 Ack=23069 Win=2640 Len=0"
"123","0.268670","74.125.136.155","10.152.152.11","TCP","552","80  >  57398 [PSH, ACK] Seq=23069 Ack=1 Win=1596 Len=498 [TCP segment of a reassembled PDU]"
"124","0.268678","10.152.152.11","74.125.136.155","TCP","54","57398  >  80 [ACK] Seq=1 Ack=23567 Win=2640 Len=0"
"125","0.269189","74.125.136.155","10.152.152.11","TCP","1514","80  >  57398 [ACK] Seq=23567 Ack=1 Win=1596 Len=1460 [TCP segment of a reassembled PDU]"
"126","0.269210","10.152.152.11","74.125.136.155","TCP","54","57398  >  80 [ACK] Seq=1 Ack=25027 Win=2640 Len=0"
"127","0.269227","74.125.136.155","10.152.152.11","TCP","1514","80  >  57398 [ACK] Seq=25027 Ack=1 Win=1596 Len=1460 [TCP segment of a reassembled PDU]"
"128","0.269270","74.125.136.155","10.152.152.11","TCP","1118","80  >  57398 [PSH, ACK] Seq=26487 Ack=1 Win=1596 Len=1064 [TCP segment of a reassembled PDU]"
"129","0.269523","10.152.152.11","74.125.136.155","TCP","54","57398  >  80 [ACK] Seq=1 Ack=27551 Win=2640 Len=0"
"130","0.269727","74.125.136.155","10.152.152.11","TCP","1514","80  >  57398 [ACK] Seq=27551 Ack=1 Win=1596 Len=1460 [TCP segment of a reassembled PDU]"
"131","0.269747","74.125.136.155","10.152.152.11","TCP","1514","80  >  57398 [ACK] Seq=29011 Ack=1 Win=1596 Len=1460 [TCP segment of a reassembled PDU]"
"132","0.269751","74.125.136.155","10.152.152.11","TCP","1118","80  >  57398 [PSH, ACK] Seq=30471 Ack=1 Win=1596 Len=1064 [TCP segment of a reassembled PDU]"
"133","0.269833","10.152.152.11","74.125.136.155","TCP","54","57398  >  80 [ACK] Seq=1 Ack=31535 Win=2640 Len=0"
"134","0.269945","74.125.136.155","10.152.152.11","TCP","552","80  >  57398 [PSH, ACK] Seq=31535 Ack=1 Win=1596 Len=498 [TCP segment of a reassembled PDU]"
"135","0.269997","10.152.152.11","74.125.136.155","TCP","54","57398  >  80 [ACK] Seq=1 Ack=32033 Win=2640 Len=0"
"136","0.270719","74.125.136.155","10.152.152.11","TCP","1514","80  >  57398 [ACK] Seq=32033 Ack=1 Win=1596 Len=1460 [TCP segment of a reassembled PDU]"
"137","0.270738","74.125.136.155","10.152.152.11","TCP","1514","80  >  57398 [ACK] Seq=33493 Ack=1 Win=1596 Len=1460 [TCP segment of a reassembled PDU]"
"138","0.270741","74.125.136.155","10.152.152.11","TCP","620","80  >  57398 [PSH, ACK] Seq=34953 Ack=1 Win=1596 Len=566 [TCP segment of a reassembled PDU]"
"139","0.270821","10.152.152.11","74.125.136.155","TCP","54","57398  >  80 [ACK] Seq=1 Ack=35519 Win=2640 Len=0"
"140","0.274201","74.125.136.155","10.152.152.11","TCP","1514","80  >  57398 [ACK] Seq=35519 Ack=1 Win=1596 Len=1460 [TCP segment of a reassembled PDU]"
"141","0.274223","74.125.136.155","10.152.152.11","TCP","1514","80  >  57398 [ACK] Seq=36979 Ack=1 Win=1596 Len=1460 [TCP segment of a reassembled PDU]"
"142","0.274227","74.125.136.155","10.152.152.11","TCP","400","80  >  57398 [PSH, ACK] Seq=38439 Ack=1 Win=1596 Len=346 [TCP segment of a reassembled PDU]"
"143","0.274461","10.152.152.11","74.125.136.155","TCP","54","57398  >  80 [ACK] Seq=1 Ack=38785 Win=2640 Len=0"
"144","0.278634","74.125.136.155","10.152.152.11","TCP","1514","80  >  57398 [ACK] Seq=38785 Ack=1 Win=1596 Len=1460 [TCP segment of a reassembled PDU]"
"145","0.278658","74.125.136.155","10.152.152.11","TCP","932","80  >  57398 [PSH, ACK] Seq=40245 Ack=1 Win=1596 Len=878 [TCP segment of a reassembled PDU]"
"146","0.278723","10.152.152.11","74.125.136.155","TCP","54","57398  >  80 [ACK] Seq=1 Ack=41123 Win=2640 Len=0"
"147","0.313105","74.125.136.155","10.152.152.11","TCP","552","80  >  57398 [PSH, ACK] Seq=41123 Ack=1 Win=1596 Len=498 [TCP segment of a reassembled PDU]"
"148","0.313261","10.152.152.11","74.125.136.155","TCP","54","57398  >  80 [ACK] Seq=1 Ack=41621 Win=2640 Len=0"
"149","0.315663","74.125.136.155","10.152.152.11","TCP","974","80  >  57398 [PSH, ACK] Seq=41621 Ack=1 Win=1596 Len=920 [TCP segment of a reassembled PDU]"
"150","0.315754","10.152.152.11","74.125.136.155","TCP","54","57398  >  80 [ACK] Seq=1 Ack=42541 Win=2640 Len=0"
"151","0.315882","74.125.136.155","10.152.152.11","TCP","552","80  >  57398 [PSH, ACK] Seq=42541 Ack=1 Win=1596 Len=498 [TCP segment of a reassembled PDU]"
"152","0.315957","10.152.152.11","74.125.136.155","TCP","54","57398  >  80 [ACK] Seq=1 Ack=43039 Win=2640 Len=0"
"153","0.316412","74.125.136.155","10.152.152.11","TCP","1514","80  >  57398 [ACK] Seq=43039 Ack=1 Win=1596 Len=1460 [TCP segment of a reassembled PDU]"
"154","0.316433","74.125.136.155","10.152.152.11","TCP","1514","80  >  57398 [ACK] Seq=44499 Ack=1 Win=1596 Len=1460 [TCP segment of a reassembled PDU]"
"155","0.316436","74.125.136.155","10.152.152.11","TCP","620","80  >  57398 [PSH, ACK] Seq=45959 Ack=1 Win=1596 Len=566 [TCP segment of a reassembled PDU]"
"156","0.316515","10.152.152.11","74.125.136.155","TCP","54","57398  >  80 [ACK] Seq=1 Ack=46525 Win=2640 Len=0"
"157","0.325669","74.125.136.155","10.152.152.11","TCP","1514","80  >  57398 [ACK] Seq=46525 Ack=1 Win=1596 Len=1460 [TCP segment of a reassembled PDU]"
"158","0.325710","74.125.136.155","10.152.152.11","TCP","1514","80  >  57398 [ACK] Seq=47985 Ack=1 Win=1596 Len=1460 [TCP segment of a reassembled PDU]"
"159","0.325715","74.125.136.155","10.152.152.11","TCP","1118","80  >  57398 [PSH, ACK] Seq=49445 Ack=1 Win=1596 Len=1064 [TCP segment of a reassembled PDU]"
"160","0.325916","10.152.152.11","74.125.136.155","TCP","54","57398  >  80 [ACK] Seq=1 Ack=50509 Win=2640 Len=0"
"161","0.327407","74.125.136.155","10.152.152.11","TCP","1092","80  >  57398 [PSH, ACK] Seq=50509 Ack=1 Win=1596 Len=1038 [TCP segment of a reassembled PDU]"
"162","0.327424","10.152.152.11","74.125.136.155","TCP","54","57398  >  80 [ACK] Seq=1 Ack=51547 Win=2822 Len=0"
"163","0.327608","74.125.136.155","10.152.152.11","TCP","1514","80  >  57398 [ACK] Seq=51547 Ack=1 Win=1596 Len=1460 [TCP segment of a reassembled PDU]"
"164","0.327618","10.152.152.11","74.125.136.155","TCP","54","57398  >  80 [ACK] Seq=1 Ack=53007 Win=3005 Len=0"
"165","0.327631","74.125.136.155","10.152.152.11","TCP","932","80  >  57398 [PSH, ACK] Seq=53007 Ack=1 Win=1596 Len=878 [TCP segment of a reassembled PDU]"
"166","0.327641","10.152.152.11","74.125.136.155","TCP","54","57398  >  80 [ACK] Seq=1 Ack=53885 Win=3187 Len=0"
"167","0.327998","74.125.136.155","10.152.152.11","TCP","552","80  >  57398 [PSH, ACK] Seq=53885 Ack=1 Win=1596 Len=498 [TCP segment of a reassembled PDU]"
"168","0.328010","10.152.152.11","74.125.136.155","TCP","54","57398  >  80 [ACK] Seq=1 Ack=54383 Win=3370 Len=0"
"169","0.329650","74.125.136.155","10.152.152.11","TCP","1514","80  >  57398 [ACK] Seq=54383 Ack=1 Win=1596 Len=1460 [TCP segment of a reassembled PDU]"
"170","0.329662","10.152.152.11","74.125.136.155","TCP","54","57398  >  80 [ACK] Seq=1 Ack=55843 Win=3552 Len=0"
"171","0.329679","74.125.136.155","10.152.152.11","TCP","1430","80  >  57398 [PSH, ACK] Seq=55843 Ack=1 Win=1596 Len=1376 [TCP segment of a reassembled PDU]"
"172","0.329685","10.152.152.11","74.125.136.155","TCP","54","57398  >  80 [ACK] Seq=1 Ack=57219 Win=3735 Len=0"
"173","0.329846","74.125.136.155","10.152.152.11","TCP","1514","80  >  57398 [ACK] Seq=57219 Ack=1 Win=1596 Len=1460 [TCP segment of a reassembled PDU]"
"174","0.329856","10.152.152.11","74.125.136.155","TCP","54","57398  >  80 [ACK] Seq=1 Ack=58679 Win=3917 Len=0"
"175","0.329870","74.125.136.155","10.152.152.11","TCP","932","80  >  57398 [PSH, ACK] Seq=58679 Ack=1 Win=1596 Len=878 [TCP segment of a reassembled PDU]"
"176","0.329875","10.152.152.11","74.125.136.155","TCP","54","57398  >  80 [ACK] Seq=1 Ack=59557 Win=4100 Len=0"
"177","0.333361","74.125.136.155","10.152.152.11","TCP","1472","80  >  57398 [PSH, ACK] Seq=59557 Ack=1 Win=1596 Len=1418 [TCP segment of a reassembled PDU]"
"178","0.333375","10.152.152.11","74.125.136.155","TCP","54","57398  >  80 [ACK] Seq=1 Ack=60975 Win=4226 Len=0"
"179","0.334485","74.125.136.155","10.152.152.11","TCP","552","80  >  57398 [PSH, ACK] Seq=60975 Ack=1 Win=1596 Len=498 [TCP segment of a reassembled PDU]"
"180","0.334588","10.152.152.11","74.125.136.155","TCP","54","57398  >  80 [ACK] Seq=1 Ack=61473 Win=4226 Len=0"
"181","0.337267","74.125.136.155","10.152.152.11","TCP","1514","80  >  57398 [ACK] Seq=61473 Ack=1 Win=1596 Len=1460 [TCP segment of a reassembled PDU]"
"182","0.337289","74.125.136.155","10.152.152.11","TCP","1430","80  >  57398 [PSH, ACK] Seq=62933 Ack=1 Win=1596 Len=1376 [TCP segment of a reassembled PDU]"
"183","0.337296","10.152.152.11","74.125.136.155","TCP","54","57398  >  80 [ACK] Seq=1 Ack=64309 Win=4226 Len=0"
"184","0.339785","74.125.136.155","10.152.152.11","TCP","1514","80  >  57398 [ACK] Seq=64309 Ack=1 Win=1596 Len=1460 [TCP segment of a reassembled PDU]"
"185","0.339815","74.125.136.155","10.152.152.11","TCP","1430","80  >  57398 [PSH, ACK] Seq=65769 Ack=1 Win=1596 Len=1376 [TCP segment of a reassembled PDU]"
"186","0.339829","10.152.152.11","74.125.136.155","TCP","54","57398  >  80 [ACK] Seq=1 Ack=67145 Win=4226 Len=0"
"187","0.340837","74.125.136.155","10.152.152.11","TCP","1514","80  >  57398 [ACK] Seq=67145 Ack=1 Win=1596 Len=1460 [TCP segment of a reassembled PDU]"
"188","0.340856","74.125.136.155","10.152.152.11","TCP","932","80  >  57398 [PSH, ACK] Seq=68605 Ack=1 Win=1596 Len=878 [TCP segment of a reassembled PDU]"
"189","0.340871","10.152.152.11","74.125.136.155","TCP","54","57398  >  80 [ACK] Seq=1 Ack=69483 Win=4226 Len=0"
"190","0.341659","74.125.136.155","10.152.152.11","TCP","552","80  >  57398 [PSH, ACK] Seq=69483 Ack=1 Win=1596 Len=498 [TCP segment of a reassembled PDU]"
"191","0.341742","10.152.152.11","74.125.136.155","TCP","54","57398  >  80 [ACK] Seq=1 Ack=69981 Win=4226 Len=0"
"192","0.350390","74.125.136.155","10.152.152.11","TCP","1514","80  >  57398 [ACK] Seq=69981 Ack=1 Win=1596 Len=1460 [TCP segment of a reassembled PDU]"
"193","0.350423","74.125.136.155","10.152.152.11","TCP","1430","80  >  57398 [PSH, ACK] Seq=71441 Ack=1 Win=1596 Len=1376 [TCP segment of a reassembled PDU]"
"194","0.350433","10.152.152.11","74.125.136.155","TCP","54","57398  >  80 [ACK] Seq=1 Ack=72817 Win=4226 Len=0"
"195","0.354607","74.125.136.155","10.152.152.11","TCP","1514","80  >  57398 [ACK] Seq=72817 Ack=1 Win=1596 Len=1460 [TCP segment of a reassembled PDU]"
"196","0.354637","74.125.136.155","10.152.152.11","TCP","1430","80  >  57398 [PSH, ACK] Seq=74277 Ack=1 Win=1596 Len=1376 [TCP segment of a reassembled PDU]"
"197","0.354653","10.152.152.11","74.125.136.155","TCP","54","57398  >  80 [ACK] Seq=1 Ack=75653 Win=4226 Len=0"
"198","0.357704","74.125.136.155","10.152.152.11","TCP","1514","80  >  57398 [ACK] Seq=75653 Ack=1 Win=1596 Len=1460 [TCP segment of a reassembled PDU]"
"199","0.357738","74.125.136.155","10.152.152.11","TCP","1430","80  >  57398 [PSH, ACK] Seq=77113 Ack=1 Win=1596 Len=1376 [TCP segment of a reassembled PDU]"
"200","0.357755","10.152.152.11","74.125.136.155","TCP","54","57398  >  80 [ACK] Seq=1 Ack=78489 Win=4226 Len=0"
"201","0.359431","74.125.136.155","10.152.152.11","TCP","1514","80  >  57398 [ACK] Seq=78489 Ack=1 Win=1596 Len=1460 [TCP segment of a reassembled PDU]"
"202","0.359485","74.125.136.155","10.152.152.11","TCP","1430","80  >  57398 [PSH, ACK] Seq=79949 Ack=1 Win=1596 Len=1376 [TCP segment of a reassembled PDU]"
"203","0.359492","10.152.152.11","74.125.136.155","TCP","54","57398  >  80 [ACK] Seq=1 Ack=81325 Win=4226 Len=0"
"204","0.359670","74.125.136.155","10.152.152.11","TCP","1514","80  >  57398 [ACK] Seq=81325 Ack=1 Win=1596 Len=1460 [TCP segment of a reassembled PDU]"
"205","0.359679","74.125.136.155","10.152.152.11","TCP","1430","80  >  57398 [PSH, ACK] Seq=82785 Ack=1 Win=1596 Len=1376 [TCP segment of a reassembled PDU]"
"206","0.359685","10.152.152.11","74.125.136.155","TCP","54","57398  >  80 [ACK] Seq=1 Ack=84161 Win=4226 Len=0"
"207","0.360068","74.125.136.155","10.152.152.11","TCP","1514","80  >  57398 [ACK] Seq=84161 Ack=1 Win=1596 Len=1460 [TCP segment of a reassembled PDU]"
"208","0.360077","74.125.136.155","10.152.152.11","TCP","1514","80  >  57398 [ACK] Seq=85621 Ack=1 Win=1596 Len=1460 [TCP segment of a reassembled PDU]"
"209","0.360085","10.152.152.11","74.125.136.155","TCP","54","57398  >  80 [ACK] Seq=1 Ack=87081 Win=4226 Len=0"
"210","0.360099","74.125.136.155","10.152.152.11","TCP","468","80  >  57398 [PSH, ACK] Seq=87081 Ack=1 Win=1596 Len=414 [TCP segment of a reassembled PDU]"
"211","0.360187","10.152.152.11","74.125.136.155","TCP","54","57398  >  80 [ACK] Seq=1 Ack=87495 Win=4226 Len=0"
"212","0.361262","74.125.136.155","10.152.152.11","TCP","1514","80  >  57398 [ACK] Seq=87495 Ack=1 Win=1596 Len=1460 [TCP segment of a reassembled PDU]"
"213","0.361284","74.125.136.155","10.152.152.11","TCP","1514","80  >  57398 [ACK] Seq=88955 Ack=1 Win=1596 Len=1460 [TCP segment of a reassembled PDU]"
"214","0.361292","10.152.152.11","74.125.136.155","TCP","54","57398  >  80 [ACK] Seq=1 Ack=90415 Win=4226 Len=0"
"215","0.361321","74.125.136.155","10.152.152.11","TCP","1118","80  >  57398 [PSH, ACK] Seq=90415 Ack=1 Win=1596 Len=1064 [TCP segment of a reassembled PDU]"
"216","0.361335","10.152.152.11","74.125.136.155","TCP","54","57398  >  80 [ACK] Seq=1 Ack=91479 Win=4226 Len=0"
"217","0.361577","74.125.136.155","10.152.152.11","TCP","1514","80  >  57398 [ACK] Seq=91479 Ack=1 Win=1596 Len=1460 [TCP segment of a reassembled PDU]"
"218","0.361994","74.125.136.155","10.152.152.11","TCP","1202","80  >  57398 [PSH, ACK] Seq=92939 Ack=1 Win=1596 Len=1148 [TCP segment of a reassembled PDU]"
"219","0.362004","10.152.152.11","74.125.136.155","TCP","54","57398  >  80 [ACK] Seq=1 Ack=94087 Win=4408 Len=0"
"220","0.393225","74.125.136.155","10.152.152.11","TCP","1514","80  >  57398 [ACK] Seq=94087 Ack=1 Win=1596 Len=1460 [TCP segment of a reassembled PDU]"
"221","0.393255","10.152.152.11","74.125.136.155","TCP","54","57398  >  80 [ACK] Seq=1 Ack=95547 Win=4591 Len=0"
"222","0.393295","74.125.136.155","10.152.152.11","TCP","1514","80  >  57398 [ACK] Seq=95547 Ack=1 Win=1596 Len=1460 [TCP segment of a reassembled PDU]"
"223","0.393314","10.152.152.11","74.125.136.155","TCP","54","57398  >  80 [ACK] Seq=1 Ack=97007 Win=4773 Len=0"
"224","0.393326","74.125.136.155","10.152.152.11","TCP","620","80  >  57398 [PSH, ACK] Seq=97007 Ack=1 Win=1596 Len=566 [TCP segment of a reassembled PDU]"
"225","0.393340","10.152.152.11","74.125.136.155","TCP","54","57398  >  80 [ACK] Seq=1 Ack=97573 Win=4956 Len=0"
"226","0.395278","74.125.136.155","10.152.152.11","TCP","1514","80  >  57398 [ACK] Seq=97573 Ack=1 Win=1596 Len=1460 [TCP segment of a reassembled PDU]"
"227","0.395288","10.152.152.11","74.125.136.155","TCP","54","57398  >  80 [ACK] Seq=1 Ack=99033 Win=5138 Len=0"
"228","0.395318","74.125.136.155","10.152.152.11","TCP","780","80  >  57398 [PSH, ACK] Seq=99033 Ack=1 Win=1596 Len=726 [TCP segment of a reassembled PDU]"
"229","0.395323","10.152.152.11","74.125.136.155","TCP","54","57398  >  80 [ACK] Seq=1 Ack=99759 Win=5321 Len=0"
"230","0.401352","74.125.136.155","10.152.152.11","TCP","1514","80  >  57398 [ACK] Seq=99759 Ack=1 Win=1596 Len=1460 [TCP segment of a reassembled PDU]"
"231","0.401382","10.152.152.11","74.125.136.155","TCP","54","57398  >  80 [ACK] Seq=1 Ack=101219 Win=5503 Len=0"
"232","0.401404","74.125.136.155","10.152.152.11","TCP","1514","80  >  57398 [ACK] Seq=101219 Ack=1 Win=1596 Len=1460 [TCP segment of a reassembled PDU]"
"233","0.401409","10.152.152.11","74.125.136.155","TCP","54","57398  >  80 [ACK] Seq=1 Ack=102679 Win=5620 Len=0"
"234","0.401416","74.125.136.155","10.152.152.11","TCP","620","80  >  57398 [PSH, ACK] Seq=102679 Ack=1 Win=1596 Len=566 [TCP segment of a reassembled PDU]"
"235","0.401528","10.152.152.11","74.125.136.155","TCP","54","57398  >  80 [ACK] Seq=1 Ack=103245 Win=5620 Len=0"
"236","0.404364","74.125.136.155","10.152.152.11","HTTP","1069","HTTP/1.1 200 OK  (text/javascript)"
"237","0.404413","95.101.1.80","10.152.152.11","TCP","552","80  >  35848 [PSH, ACK] Seq=1 Ack=1 Win=980 Len=498 [TCP segment of a reassembled PDU]"
"238","0.404419","10.152.152.11","95.101.1.80","TCP","54","35848  >  80 [ACK] Seq=1 Ack=499 Win=980 Len=0"
"239","0.404539","10.152.152.11","74.125.136.155","TCP","54","57398  >  80 [ACK] Seq=1 Ack=104260 Win=5620 Len=0"
"240","0.434165","95.101.1.80","10.152.152.11","TCP","1004","80  >  35848 [PSH, ACK] Seq=499 Ack=1 Win=980 Len=950 [TCP segment of a reassembled PDU]"
"241","0.434212","10.152.152.11","95.101.1.80","TCP","54","35848  >  80 [ACK] Seq=1 Ack=1449 Win=1099 Len=0"
"242","0.495013","10.152.152.11","216.58.213.202","TCP","54","46439  >  80 [ACK] Seq=1 Ack=1 Win=2640 Len=0"
"243","0.495216","216.58.213.202","10.152.152.11","TCP","60","[TCP ACKed unseen segment] 80  >  46439 [ACK] Seq=1 Ack=2 Win=980 Len=0"
"244","0.498973","10.152.152.11","88.221.254.18","TCP","54","60704  >  80 [ACK] Seq=1 Ack=1 Win=2640 Len=0"
"245","0.499162","88.221.254.18","10.152.152.11","TCP","60","[TCP ACKed unseen segment] 80  >  60704 [ACK] Seq=1 Ack=2 Win=980 Len=0"
"246","0.500528","10.152.152.10","10.152.152.11","DNS","95","Standard query response 0x0af2 A bangla.bdnews24.com A 54.169.46.48"
"247","0.500674","95.101.1.80","10.152.152.11","TCP","552","80  >  35848 [PSH, ACK] Seq=1449 Ack=1 Win=980 Len=498 [TCP segment of a reassembled PDU]"
"248","0.500683","10.152.152.11","95.101.1.80","TCP","54","35848  >  80 [ACK] Seq=1 Ack=1947 Win=1217 Len=0"
"249","0.529231","10.152.152.10","10.152.152.11","DNS","95","Standard query response 0x6932 A clients1.google.com A 173.194.116.198"
"250","0.529247","10.152.152.10","10.152.152.11","DNS","79","Standard query response 0x0403 No such name AAAA clients1.google.com"
"251","0.540697","10.152.152.10","10.152.152.11","DNS","95","Standard query response 0x37d8 A clients1.google.com A 173.194.116.198"
"252","0.540989","10.152.152.11","173.194.116.198","TCP","66","56612  >  80 [SYN] Seq=0 Win=14600 Len=0 MSS=1460 SACK_PERM=1 WS=16"
"253","0.541192","173.194.116.198","10.152.152.11","TCP","66","80  >  56612 [SYN, ACK] Seq=0 Ack=1 Win=14600 Len=0 MSS=1460 SACK_PERM=1 WS=16"
"254","0.541220","10.152.152.11","173.194.116.198","TCP","54","56612  >  80 [ACK] Seq=1 Ack=1 Win=14608 Len=0"
"255","0.541381","10.152.152.11","173.194.116.198","TCP","66","56613  >  80 [SYN] Seq=0 Win=14600 Len=0 MSS=1460 SACK_PERM=1 WS=16"
"256","0.541653","10.152.152.11","173.194.116.198","OCSP","498","Request"
"257","0.541770","173.194.116.198","10.152.152.11","TCP","66","80  >  56613 [SYN, ACK] Seq=0 Ack=1 Win=14600 Len=0 MSS=1460 SACK_PERM=1 WS=16"
"258","0.541780","10.152.152.11","173.194.116.198","TCP","54","56613  >  80 [ACK] Seq=1 Ack=1 Win=14608 Len=0"
"259","0.541792","173.194.116.198","10.152.152.11","TCP","60","80  >  56612 [ACK] Seq=1 Ack=445 Win=15680 Len=0"
"260","0.544202","95.101.1.80","10.152.152.11","TCP","1514","80  >  35848 [ACK] Seq=1947 Ack=1 Win=980 Len=1460 [TCP segment of a reassembled PDU]"
"261","0.544237","10.152.152.11","95.101.1.80","TCP","54","35848  >  80 [ACK] Seq=1 Ack=3407 Win=1400 Len=0"
"262","0.544253","95.101.1.80","10.152.152.11","HTTP","1140","HTTP/1.1 200 OK  (application/x-javascript)"
"263","0.544259","10.152.152.11","95.101.1.80","TCP","54","35848  >  80 [ACK] Seq=1 Ack=4493 Win=1582 Len=0"
"264","0.548862","10.152.152.11","173.194.112.109","TCP","54","40349  >  443 [FIN, ACK] Seq=1 Ack=1 Win=913 Len=0"
"265","0.548985","10.152.152.11","74.125.136.155","TCP","54","36509  >  443 [FIN, ACK] Seq=163 Ack=3867 Win=1460 Len=0"
"266","0.549238","173.194.112.109","10.152.152.11","TCP","60","443  >  40349 [FIN, ACK] Seq=1 Ack=2 Win=980 Len=0"
"267","0.549256","10.152.152.11","173.194.112.109","TCP","54","40349  >  443 [ACK] Seq=2 Ack=2 Win=913 Len=0"
"268","0.549454","74.125.136.155","10.152.152.11","TCP","60","443  >  36509 [FIN, ACK] Seq=3867 Ack=164 Win=1047 Len=0"
"269","0.549467","10.152.152.11","74.125.136.155","TCP","54","36509  >  443 [ACK] Seq=164 Ack=3868 Win=1460 Len=0"
"270","0.556752","54.239.168.246","10.152.152.11","TCP","1514","80  >  58690 [ACK] Seq=1 Ack=1 Win=1047 Len=1460 [TCP segment of a reassembled PDU]"
"271","0.556785","54.239.168.246","10.152.152.11","TCP","1514","80  >  58690 [ACK] Seq=1461 Ack=1 Win=1047 Len=1460 [TCP segment of a reassembled PDU]"
"272","0.556796","10.152.152.11","54.239.168.246","TCP","54","58690  >  80 [ACK] Seq=1 Ack=2921 Win=1710 Len=0"
"273","0.556812","54.239.168.246","10.152.152.11","TCP","1118","80  >  58690 [PSH, ACK] Seq=2921 Ack=1 Win=1047 Len=1064 [TCP segment of a reassembled PDU]"
"274","0.557121","54.239.168.246","10.152.152.11","TCP","1514","80  >  58690 [ACK] Seq=3985 Ack=1 Win=1047 Len=1460 [TCP segment of a reassembled PDU]"
"275","0.557141","10.152.152.11","54.239.168.246","TCP","54","58690  >  80 [ACK] Seq=1 Ack=5445 Win=2075 Len=0"
"276","0.557155","54.239.168.246","10.152.152.11","TCP","1514","80  >  58690 [ACK] Seq=5445 Ack=1 Win=1047 Len=1460 [TCP segment of a reassembled PDU]"
"277","0.557263","54.239.168.246","10.152.152.11","TCP","620","80  >  58690 [PSH, ACK] Seq=6905 Ack=1 Win=1047 Len=566 [TCP segment of a reassembled PDU]"
"278","0.557282","10.152.152.11","54.239.168.246","TCP","54","58690  >  80 [ACK] Seq=1 Ack=7471 Win=2440 Len=0"
"279","0.570588","54.239.168.246","10.152.152.11","TCP","552","80  >  58690 [PSH, ACK] Seq=7471 Ack=1 Win=1047 Len=498 [TCP segment of a reassembled PDU]"
"280","0.573296","54.239.168.246","10.152.152.11","TCP","1514","80  >  58690 [ACK] Seq=7969 Ack=1 Win=1047 Len=1460 [TCP segment of a reassembled PDU]"
"281","0.573319","10.152.152.11","54.239.168.246","TCP","54","58690  >  80 [ACK] Seq=1 Ack=9429 Win=2640 Len=0"
"282","0.573344","54.239.168.246","10.152.152.11","TCP","1514","80  >  58690 [ACK] Seq=9429 Ack=1 Win=1047 Len=1460 [TCP segment of a reassembled PDU]"
"283","0.573476","54.239.168.246","10.152.152.11","TCP","1118","80  >  58690 [PSH, ACK] Seq=10889 Ack=1 Win=1047 Len=1064 [TCP segment of a reassembled PDU]"
"284","0.573485","10.152.152.11","54.239.168.246","TCP","54","58690  >  80 [ACK] Seq=1 Ack=11953 Win=2640 Len=0"
"285","0.583877","54.239.168.246","10.152.152.11","HTTP","805","HTTP/1.1 200 OK  (JPEG JFIF image)"
"286","0.584115","10.152.152.11","54.239.168.246","HTTP","402","GET /skins/escenic-times-bangla/css/global.css HTTP/1.1 "
"287","0.584407","54.239.168.246","10.152.152.11","TCP","60","80  >  58690 [ACK] Seq=12704 Ack=349 Win=1114 Len=0"
"288","0.587184","54.239.168.246","10.152.152.11","TCP","552","80  >  58691 [PSH, ACK] Seq=1 Ack=1 Win=1047 Len=498 [TCP segment of a reassembled PDU]"
"289","0.589153","54.239.168.246","10.152.152.11","TCP","1514","80  >  58691 [ACK] Seq=499 Ack=1 Win=1047 Len=1460 [TCP segment of a reassembled PDU]"
"290","0.589163","10.152.152.11","54.239.168.246","TCP","54","58691  >  80 [ACK] Seq=1 Ack=1959 Win=1494 Len=0"
"291","0.589187","54.239.168.246","10.152.152.11","TCP","1514","80  >  58691 [ACK] Seq=1959 Ack=1 Win=1047 Len=1460 [TCP segment of a reassembled PDU]"
"292","0.589243","54.239.168.246","10.152.152.11","TCP","620","80  >  58691 [PSH, ACK] Seq=3419 Ack=1 Win=1047 Len=566 [TCP segment of a reassembled PDU]"
"293","0.589248","10.152.152.11","54.239.168.246","TCP","54","58691  >  80 [ACK] Seq=1 Ack=3985 Win=1859 Len=0"
"294","0.597869","54.239.168.246","10.152.152.11","TCP","1514","80  >  58691 [ACK] Seq=3985 Ack=1 Win=1047 Len=1460 [TCP segment of a reassembled PDU]"
"295","0.597890","54.239.168.246","10.152.152.11","TCP","1514","80  >  58691 [ACK] Seq=5445 Ack=1 Win=1047 Len=1460 [TCP segment of a reassembled PDU]"
"296","0.597906","10.152.152.11","54.239.168.246","TCP","54","58691  >  80 [ACK] Seq=1 Ack=6905 Win=2224 Len=0"
"297","0.597917","54.239.168.246","10.152.152.11","TCP","1118","80  >  58691 [PSH, ACK] Seq=6905 Ack=1 Win=1047 Len=1064 [TCP segment of a reassembled PDU]"
"298","0.604503","54.239.168.246","10.152.152.11","TCP","1514","80  >  58691 [ACK] Seq=7969 Ack=1 Win=1047 Len=1460 [TCP segment of a reassembled PDU]"
"299","0.604530","10.152.152.11","54.239.168.246","TCP","54","58691  >  80 [ACK] Seq=1 Ack=9429 Win=2589 Len=0"
"300","0.604573","54.239.168.246","10.152.152.11","TCP","1514","80  >  58691 [ACK] Seq=9429 Ack=1 Win=1047 Len=1460 [TCP segment of a reassembled PDU]"
"301","0.604693","54.239.168.246","10.152.152.11","TCP","1118","80  >  58691 [PSH, ACK] Seq=10889 Ack=1 Win=1047 Len=1064 [TCP segment of a reassembled PDU]"
"302","0.604754","10.152.152.11","54.239.168.246","TCP","54","58691  >  80 [ACK] Seq=1 Ack=11953 Win=2640 Len=0"
