"No.","Time","Source","Destination","Protocol","Length","Info"
"1","0.000000","64.233.164.16","10.152.152.11","TCP","552","[TCP segment of a reassembled PDU]"
"2","0.000206","10.152.152.11","64.233.164.16","TCP","54","49496  >  993 [ACK] Seq=1 Ack=499 Win=28229 Len=0"
"3","0.007106","64.233.167.16","10.152.152.11","TLSv1.2","141","Application Data"
"4","0.012598","10.152.152.11","64.233.167.16","TLSv1.2","85","Encrypted Alert"
"5","0.012665","10.152.152.11","64.233.167.16","TCP","54","39239  >  465 [FIN, ACK] Seq=32 Ack=88 Win=1047 Len=0"
"6","0.012892","64.233.167.16","10.152.152.11","TCP","60","465  >  39239 [ACK] Seq=88 Ack=32 Win=1412 Len=0"
"7","0.013182","64.233.167.16","10.152.152.11","TCP","60","465  >  39239 [FIN, ACK] Seq=88 Ack=33 Win=1412 Len=0"
"8","0.013203","10.152.152.11","64.233.167.16","TCP","54","39239  >  465 [ACK] Seq=33 Ack=89 Win=1047 Len=0"
"9","0.013390","10.152.152.11","64.233.184.16","TLSv1.2","99","Application Data"
"10","0.013857","64.233.184.16","10.152.152.11","TCP","60","993  >  34771 [ACK] Seq=1 Ack=46 Win=4198 Len=0"
"11","0.016598","64.233.164.16","10.152.152.11","SSLv2","1514","Encrypted Data"
"12","0.016644","64.233.164.16","10.152.152.11","TCP","1514","[TCP segment of a reassembled PDU]"
"13","0.016748","64.233.164.16","10.152.152.11","TCP","1118","[TCP segment of a reassembled PDU]"
"14","0.016752","10.152.152.11","64.233.164.16","TCP","54","49496  >  993 [ACK] Seq=1 Ack=3419 Win=28103 Len=0"
"15","0.017366","10.152.152.11","64.233.164.16","TCP","54","49496  >  993 [ACK] Seq=1 Ack=4483 Win=28229 Len=0"
"16","0.033091","64.233.164.16","10.152.152.11","TCP","1514","[TCP segment of a reassembled PDU]"
"17","0.033146","64.233.164.16","10.152.152.11","TCP","1514","[TCP segment of a reassembled PDU]"
"18","0.033234","64.233.164.16","10.152.152.11","TCP","1118","[TCP segment of a reassembled PDU]"
"19","0.033287","10.152.152.11","64.233.164.16","TCP","54","49496  >  993 [ACK] Seq=1 Ack=8467 Win=28033 Len=0"
"20","0.041613","64.233.164.16","10.152.152.11","TCP","1050","[TCP segment of a reassembled PDU]"
"21","0.041872","10.152.152.11","64.233.164.16","TCP","54","49496  >  993 [ACK] Seq=1 Ack=9463 Win=28229 Len=0"
"22","0.050802","64.233.164.16","10.152.152.11","TCP","1514","[TCP segment of a reassembled PDU]"
"23","0.050859","64.233.164.16","10.152.152.11","TCP","1514","[TCP segment of a reassembled PDU]"
"24","0.050866","64.233.164.16","10.152.152.11","SSLv2","1206","Encrypted Data"
"25","0.050872","64.233.164.16","10.152.152.11","TCP","1514","[TCP segment of a reassembled PDU]"
"26","0.050994","10.152.152.11","64.233.164.16","TCP","54","49496  >  993 [ACK] Seq=1 Ack=14995 Win=27963 Len=0"
"27","0.051189","64.233.164.16","10.152.152.11","TCP","1494","[TCP segment of a reassembled PDU]"
"28","0.051729","10.152.152.11","64.233.164.16","TCP","54","49496  >  993 [ACK] Seq=1 Ack=16435 Win=28229 Len=0"
"29","0.058528","64.233.164.16","10.152.152.11","SSLv2","1514","Encrypted Data"
"30","0.058549","64.233.164.16","10.152.152.11","TCP","1514","[TCP segment of a reassembled PDU]"
"31","0.058631","64.233.164.16","10.152.152.11","TCP","1118","[TCP segment of a reassembled PDU]"
"32","0.058823","10.152.152.11","64.233.164.16","TCP","54","49496  >  993 [ACK] Seq=1 Ack=20419 Win=28033 Len=0"
"33","0.067846","64.233.164.16","10.152.152.11","TCP","552","[TCP segment of a reassembled PDU]"
"34","0.068046","10.152.152.11","64.233.164.16","TCP","54","49496  >  993 [ACK] Seq=1 Ack=20917 Win=28229 Len=0"
"35","0.072940","64.233.164.16","10.152.152.11","TCP","1514","[TCP segment of a reassembled PDU]"
"36","0.073018","64.233.164.16","10.152.152.11","TCP","1514","[TCP segment of a reassembled PDU]"
"37","0.073161","64.233.164.16","10.152.152.11","TCP","1118","[TCP segment of a reassembled PDU]"
"38","0.073220","10.152.152.11","64.233.164.16","TCP","54","49496  >  993 [ACK] Seq=1 Ack=24901 Win=28033 Len=0"
"39","0.084519","64.233.164.16","10.152.152.11","TCP","1514","[TCP segment of a reassembled PDU]"
"40","0.084587","64.233.164.16","10.152.152.11","TCP","1514","[TCP segment of a reassembled PDU]"
"41","0.084603","10.152.152.11","64.233.164.16","TCP","54","49496  >  993 [ACK] Seq=1 Ack=27821 Win=28103 Len=0"
"42","0.084638","64.233.164.16","10.152.152.11","TCP","620","[TCP segment of a reassembled PDU]"
"43","0.085098","10.152.152.11","64.233.164.16","TCP","54","49496  >  993 [ACK] Seq=1 Ack=28387 Win=28229 Len=0"
"44","0.100141","64.233.164.16","10.152.152.11","TCP","1514","[TCP segment of a reassembled PDU]"
"45","0.100331","64.233.164.16","10.152.152.11","TCP","1514","[TCP segment of a reassembled PDU]"
"46","0.100434","64.233.164.16","10.152.152.11","TCP","1118","[TCP segment of a reassembled PDU]"
"47","0.100435","10.152.152.11","64.233.164.16","TCP","54","49496  >  993 [ACK] Seq=1 Ack=31307 Win=28103 Len=0"
"48","0.100817","10.152.152.11","64.233.164.16","TCP","54","49496  >  993 [ACK] Seq=1 Ack=32371 Win=28229 Len=0"
"49","0.110002","64.233.164.16","10.152.152.11","TCP","1514","[TCP segment of a reassembled PDU]"
"50","0.110091","64.233.164.16","10.152.152.11","TCP","586","[TCP segment of a reassembled PDU]"
"51","0.110258","10.152.152.11","64.233.164.16","TCP","54","49496  >  993 [ACK] Seq=1 Ack=34363 Win=28105 Len=0"
"52","0.118741","64.233.164.16","10.152.152.11","TCP","1514","[TCP segment of a reassembled PDU]"
"53","0.118810","64.233.164.16","10.152.152.11","TCP","1514","[TCP segment of a reassembled PDU]"
"54","0.118932","64.233.164.16","10.152.152.11","TCP","620","[TCP segment of a reassembled PDU]"
"55","0.119036","10.152.152.11","64.233.164.16","TCP","54","49496  >  993 [ACK] Seq=1 Ack=37849 Win=28033 Len=0"
"56","0.128038","64.233.164.16","10.152.152.11","TCP","1514","[TCP segment of a reassembled PDU]"
"57","0.128173","64.233.164.16","10.152.152.11","TCP","1514","[TCP segment of a reassembled PDU]"
"58","0.128193","10.152.152.11","64.233.164.16","TCP","54","49496  >  993 [ACK] Seq=1 Ack=40769 Win=28103 Len=0"
"59","0.128289","64.233.164.16","10.152.152.11","TCP","1206","[TCP segment of a reassembled PDU]"
"60","0.128412","64.233.164.16","10.152.152.11","TCP","1514","[TCP segment of a reassembled PDU]"
"61","0.128523","10.152.152.11","64.233.164.16","TCP","54","49496  >  993 [ACK] Seq=1 Ack=43381 Win=27963 Len=0"
"62","0.128853","64.233.164.16","10.152.152.11","TCP","996","[TCP segment of a reassembled PDU]"
"63","0.129706","10.152.152.11","64.233.164.16","TCP","54","49496  >  993 [ACK] Seq=1 Ack=44323 Win=28229 Len=0"
"64","0.136201","64.233.164.16","10.152.152.11","TCP","1514","[TCP segment of a reassembled PDU]"
"65","0.136513","64.233.164.16","10.152.152.11","SSLv2","1514","Encrypted Data"
"66","0.136520","64.233.164.16","10.152.152.11","TCP","620","[TCP segment of a reassembled PDU]"
"67","0.136639","10.152.152.11","64.233.164.16","TCP","54","49496  >  993 [ACK] Seq=1 Ack=47809 Win=28033 Len=0"
"68","0.139763","64.233.164.16","10.152.152.11","TCP","552","[TCP segment of a reassembled PDU]"
"69","0.140126","10.152.152.11","64.233.164.16","TCP","54","49496  >  993 [ACK] Seq=1 Ack=48307 Win=28229 Len=0"
"70","0.144138","64.233.164.16","10.152.152.11","TCP","1514","[TCP segment of a reassembled PDU]"
"71","0.144233","64.233.164.16","10.152.152.11","TCP","1514","[TCP segment of a reassembled PDU]"
"72","0.144388","64.233.164.16","10.152.152.11","TCP","620","993  >  49496 [PSH, ACK] Seq=51227 Ack=1 Win=1181 Len=566 [TCP segment of a reassembled PDU]"
"73","0.144463","10.152.152.11","64.233.164.16","TCP","54","49496  >  993 [ACK] Seq=1 Ack=51793 Win=28033 Len=0"
"74","0.148623","64.233.164.16","10.152.152.11","TCP","1514","993  >  49496 [ACK] Seq=51793 Ack=1 Win=1181 Len=1460 [TCP segment of a reassembled PDU]"
"75","0.148685","64.233.164.16","10.152.152.11","TCP","1514","993  >  49496 [ACK] Seq=53253 Ack=1 Win=1181 Len=1460 [TCP segment of a reassembled PDU]"
"76","0.148699","10.152.152.11","64.233.164.16","TCP","54","49496  >  993 [ACK] Seq=1 Ack=54713 Win=28103 Len=0"
"77","0.148722","64.233.164.16","10.152.152.11","TCP","1118","993  >  49496 [PSH, ACK] Seq=54713 Ack=1 Win=1181 Len=1064 [TCP segment of a reassembled PDU]"
"78","0.149474","10.152.152.11","64.233.164.16","TCP","54","49496  >  993 [ACK] Seq=1 Ack=55777 Win=28229 Len=0"
"79","0.164824","64.233.164.16","10.152.152.11","TCP","1050","993  >  49496 [PSH, ACK] Seq=55777 Ack=1 Win=1181 Len=996 [TCP segment of a reassembled PDU]"
"80","0.165188","10.152.152.11","64.233.164.16","TCP","54","49496  >  993 [ACK] Seq=1 Ack=56773 Win=28229 Len=0"
"81","0.174785","64.233.164.16","10.152.152.11","TCP","1514","993  >  49496 [ACK] Seq=56773 Ack=1 Win=1181 Len=1460 [TCP segment of a reassembled PDU]"
"82","0.174845","64.233.164.16","10.152.152.11","TCP","1084","993  >  49496 [PSH, ACK] Seq=58233 Ack=1 Win=1181 Len=1030 [TCP segment of a reassembled PDU]"
"83","0.174995","10.152.152.11","64.233.164.16","TCP","54","49496  >  993 [ACK] Seq=1 Ack=59263 Win=28103 Len=0"
"84","0.183045","64.233.164.16","10.152.152.11","TCP","1514","993  >  49496 [ACK] Seq=59263 Ack=1 Win=1181 Len=1460 [TCP segment of a reassembled PDU]"
"85","0.183085","64.233.164.16","10.152.152.11","TCP","1514","993  >  49496 [ACK] Seq=60723 Ack=1 Win=1181 Len=1460 [TCP segment of a reassembled PDU]"
"86","0.183094","10.152.152.11","64.233.164.16","TCP","54","49496  >  993 [ACK] Seq=1 Ack=62183 Win=28103 Len=0"
"87","0.183160","64.233.164.16","10.152.152.11","TCP","620","993  >  49496 [PSH, ACK] Seq=62183 Ack=1 Win=1181 Len=566 [TCP segment of a reassembled PDU]"
"88","0.183374","10.152.152.11","64.233.164.16","TCP","54","49496  >  993 [ACK] Seq=1 Ack=62749 Win=28229 Len=0"
"89","0.190936","64.233.164.16","10.152.152.11","TCP","1514","993  >  49496 [ACK] Seq=62749 Ack=1 Win=1181 Len=1460 [TCP segment of a reassembled PDU]"
"90","0.191092","64.233.164.16","10.152.152.11","TCP","1514","993  >  49496 [ACK] Seq=64209 Ack=1 Win=1181 Len=1460 [TCP segment of a reassembled PDU]"
"91","0.191109","64.233.164.16","10.152.152.11","TCP","1118","993  >  49496 [PSH, ACK] Seq=65669 Ack=1 Win=1181 Len=1064 [TCP segment of a reassembled PDU]"
"92","0.191147","10.152.152.11","64.233.164.16","TCP","54","49496  >  993 [ACK] Seq=1 Ack=66733 Win=28033 Len=0"
"93","0.205441","64.233.164.16","10.152.152.11","TCP","1514","993  >  49496 [ACK] Seq=66733 Ack=1 Win=1181 Len=1460 [TCP segment of a reassembled PDU]"
"94","0.205501","64.233.164.16","10.152.152.11","TCP","1514","993  >  49496 [ACK] Seq=68193 Ack=1 Win=1181 Len=1460 [TCP segment of a reassembled PDU]"
"95","0.205515","10.152.152.11","64.233.164.16","TCP","54","49496  >  993 [ACK] Seq=1 Ack=69653 Win=28103 Len=0"
"96","0.205539","64.233.164.16","10.152.152.11","TCP","1118","993  >  49496 [PSH, ACK] Seq=69653 Ack=1 Win=1181 Len=1064 [TCP segment of a reassembled PDU]"
"97","0.205835","64.233.164.16","10.152.152.11","TCP","1514","993  >  49496 [ACK] Seq=70717 Ack=1 Win=1181 Len=1460 [TCP segment of a reassembled PDU]"
"98","0.206030","10.152.152.11","64.233.164.16","TCP","54","49496  >  993 [ACK] Seq=1 Ack=72177 Win=28033 Len=0"
"99","0.206332","64.233.164.16","10.152.152.11","TCP","586","993  >  49496 [PSH, ACK] Seq=72177 Ack=1 Win=1181 Len=532 [TCP segment of a reassembled PDU]"
"100","0.206508","10.152.152.11","64.233.164.16","TCP","54","49496  >  993 [ACK] Seq=1 Ack=72709 Win=28229 Len=0"
"101","0.222113","64.233.164.16","10.152.152.11","TCP","1514","993  >  49496 [ACK] Seq=72709 Ack=1 Win=1181 Len=1460 [TCP segment of a reassembled PDU]"
"102","0.222178","64.233.164.16","10.152.152.11","TCP","1514","993  >  49496 [ACK] Seq=74169 Ack=1 Win=1181 Len=1460 [TCP segment of a reassembled PDU]"
"103","0.222187","64.233.164.16","10.152.152.11","TCP","620","993  >  49496 [PSH, ACK] Seq=75629 Ack=1 Win=1181 Len=566 [TCP segment of a reassembled PDU]"
"104","0.222288","10.152.152.11","64.233.164.16","TCP","54","49496  >  993 [ACK] Seq=1 Ack=76195 Win=28033 Len=0"
"105","0.239192","64.233.164.16","10.152.152.11","SSLv2","1514","Encrypted Data [TCP segment of a reassembled PDU]"
"106","0.239235","64.233.164.16","10.152.152.11","TCP","1514","993  >  49496 [ACK] Seq=77655 Ack=1 Win=1181 Len=1460 [TCP segment of a reassembled PDU]"
"107","0.239248","10.152.152.11","64.233.164.16","TCP","54","49496  >  993 [ACK] Seq=1 Ack=79115 Win=28103 Len=0"
"108","0.239268","64.233.164.16","10.152.152.11","TCP","1118","993  >  49496 [PSH, ACK] Seq=79115 Ack=1 Win=1181 Len=1064 [TCP segment of a reassembled PDU]"
"109","0.239815","10.152.152.11","64.233.164.16","TCP","54","49496  >  993 [ACK] Seq=1 Ack=80179 Win=28229 Len=0"
"110","0.248122","64.233.164.16","10.152.152.11","TCP","1514","993  >  49496 [ACK] Seq=80179 Ack=1 Win=1181 Len=1460 [TCP segment of a reassembled PDU]"
"111","0.248165","64.233.164.16","10.152.152.11","TCP","1514","993  >  49496 [ACK] Seq=81639 Ack=1 Win=1181 Len=1460 [TCP segment of a reassembled PDU]"
"112","0.248171","64.233.164.16","10.152.152.11","TCP","1118","993  >  49496 [PSH, ACK] Seq=83099 Ack=1 Win=1181 Len=1064 [TCP segment of a reassembled PDU]"
"113","0.248255","10.152.152.11","64.233.164.16","TCP","54","49496  >  993 [ACK] Seq=1 Ack=84163 Win=28033 Len=0"
"114","0.257095","64.233.164.16","10.152.152.11","TCP","1514","993  >  49496 [ACK] Seq=84163 Ack=1 Win=1181 Len=1460 [TCP segment of a reassembled PDU]"
"115","0.257172","64.233.164.16","10.152.152.11","TCP","1514","993  >  49496 [ACK] Seq=85623 Ack=1 Win=1181 Len=1460 [TCP segment of a reassembled PDU]"
"116","0.257192","10.152.152.11","64.233.164.16","TCP","54","49496  >  993 [ACK] Seq=1 Ack=87083 Win=28103 Len=0"
"117","0.257230","64.233.164.16","10.152.152.11","TCP","620","993  >  49496 [PSH, ACK] Seq=87083 Ack=1 Win=1181 Len=566 [TCP segment of a reassembled PDU]"
"118","0.257898","10.152.152.11","64.233.164.16","TCP","54","49496  >  993 [ACK] Seq=1 Ack=87649 Win=28229 Len=0"
"119","0.265878","64.233.164.16","10.152.152.11","TCP","1050","993  >  49496 [PSH, ACK] Seq=87649 Ack=1 Win=1181 Len=996 [TCP segment of a reassembled PDU]"
"120","0.266368","10.152.152.11","64.233.164.16","TCP","54","49496  >  993 [ACK] Seq=1 Ack=88645 Win=28229 Len=0"
"121","0.273725","64.233.164.16","10.152.152.11","SSLv2","1514","Encrypted Data [TCP segment of a reassembled PDU]"
"122","0.273805","64.233.164.16","10.152.152.11","TCP","1514","993  >  49496 [ACK] Seq=90105 Ack=1 Win=1181 Len=1460 [TCP segment of a reassembled PDU]"
"123","0.273918","64.233.164.16","10.152.152.11","TCP","1206","993  >  49496 [PSH, ACK] Seq=91565 Ack=1 Win=1181 Len=1152 [TCP segment of a reassembled PDU]"
"124","0.273982","64.233.164.16","10.152.152.11","TCP","1514","993  >  49496 [ACK] Seq=92717 Ack=1 Win=1181 Len=1460 [TCP segment of a reassembled PDU]"
"125","0.274172","10.152.152.11","64.233.164.16","TCP","54","49496  >  993 [ACK] Seq=1 Ack=94177 Win=27963 Len=0"
"126","0.274592","64.233.164.16","10.152.152.11","TCP","1494","993  >  49496 [PSH, ACK] Seq=94177 Ack=1 Win=1181 Len=1440 [TCP segment of a reassembled PDU]"
"127","0.275408","10.152.152.11","64.233.164.16","TCP","54","49496  >  993 [ACK] Seq=1 Ack=95617 Win=28229 Len=0"
"128","0.277464","64.233.164.16","10.152.152.11","SSLv2","1514","Encrypted Data [TCP segment of a reassembled PDU]"
"129","0.277536","64.233.164.16","10.152.152.11","TCP","1514","993  >  49496 [ACK] Seq=97077 Ack=1 Win=1181 Len=1460 [TCP segment of a reassembled PDU]"
"130","0.277541","64.233.164.16","10.152.152.11","TCP","1118","993  >  49496 [PSH, ACK] Seq=98537 Ack=1 Win=1181 Len=1064 [TCP segment of a reassembled PDU]"
"131","0.277686","10.152.152.11","64.233.164.16","TCP","54","49496  >  993 [ACK] Seq=1 Ack=99601 Win=28033 Len=0"
"132","0.277988","64.233.164.16","10.152.152.11","TCP","552","993  >  49496 [PSH, ACK] Seq=99601 Ack=1 Win=1181 Len=498 [TCP segment of a reassembled PDU]"
"133","0.278139","10.152.152.11","64.233.164.16","TCP","54","49496  >  993 [ACK] Seq=1 Ack=100099 Win=28229 Len=0"
"134","0.289875","64.233.164.16","10.152.152.11","TCP","1514","993  >  49496 [ACK] Seq=100099 Ack=1 Win=1181 Len=1460 [TCP segment of a reassembled PDU]"
"135","0.290026","64.233.164.16","10.152.152.11","TCP","1514","993  >  49496 [ACK] Seq=101559 Ack=1 Win=1181 Len=1460 [TCP segment of a reassembled PDU]"
"136","0.290095","10.152.152.11","64.233.164.16","TCP","54","49496  >  993 [ACK] Seq=1 Ack=103019 Win=28103 Len=0"
"137","0.290212","64.233.164.16","10.152.152.11","TCP","620","993  >  49496 [PSH, ACK] Seq=103019 Ack=1 Win=1181 Len=566 [TCP segment of a reassembled PDU]"
"138","0.291568","10.152.152.11","64.233.164.16","TCP","54","49496  >  993 [ACK] Seq=1 Ack=103585 Win=28229 Len=0"
"139","0.306255","64.233.164.16","10.152.152.11","TCP","1050","993  >  49496 [PSH, ACK] Seq=103585 Ack=1 Win=1181 Len=996 [TCP segment of a reassembled PDU]"
"140","0.306673","10.152.152.11","64.233.164.16","TCP","54","49496  >  993 [ACK] Seq=1 Ack=104581 Win=28229 Len=0"
"141","0.313584","64.233.164.16","10.152.152.11","TCP","1514","993  >  49496 [ACK] Seq=104581 Ack=1 Win=1181 Len=1460 [TCP segment of a reassembled PDU]"
"142","0.313666","64.233.164.16","10.152.152.11","TCP","1514","993  >  49496 [ACK] Seq=106041 Ack=1 Win=1181 Len=1460 [TCP segment of a reassembled PDU]"
"143","0.313678","64.233.164.16","10.152.152.11","TCP","620","993  >  49496 [PSH, ACK] Seq=107501 Ack=1 Win=1181 Len=566 [TCP segment of a reassembled PDU]"
"144","0.313874","10.152.152.11","64.233.164.16","TCP","54","49496  >  993 [ACK] Seq=1 Ack=108067 Win=28033 Len=0"
"145","0.321402","64.233.164.16","10.152.152.11","TCP","1050","993  >  49496 [PSH, ACK] Seq=108067 Ack=1 Win=1181 Len=996 [TCP segment of a reassembled PDU]"
"146","0.321570","10.152.152.11","64.233.164.16","TCP","54","49496  >  993 [ACK] Seq=1 Ack=109063 Win=28229 Len=0"
"147","0.328074","64.233.164.16","10.152.152.11","TCP","1514","993  >  49496 [ACK] Seq=109063 Ack=1 Win=1181 Len=1460 [TCP segment of a reassembled PDU]"
"148","0.328152","64.233.164.16","10.152.152.11","TCP","1514","993  >  49496 [ACK] Seq=110523 Ack=1 Win=1181 Len=1460 [TCP segment of a reassembled PDU]"
"149","0.328160","64.233.164.16","10.152.152.11","TCP","620","993  >  49496 [PSH, ACK] Seq=111983 Ack=1 Win=1181 Len=566 [TCP segment of a reassembled PDU]"
"150","0.328261","10.152.152.11","64.233.164.16","TCP","54","49496  >  993 [ACK] Seq=1 Ack=112549 Win=28033 Len=0"
"151","0.336392","64.233.164.16","10.152.152.11","TCP","1514","993  >  49496 [ACK] Seq=112549 Ack=1 Win=1181 Len=1460 [TCP segment of a reassembled PDU]"
"152","0.336529","64.233.164.16","10.152.152.11","TCP","1514","993  >  49496 [ACK] Seq=114009 Ack=1 Win=1181 Len=1460 [TCP segment of a reassembled PDU]"
"153","0.336544","10.152.152.11","64.233.164.16","TCP","54","49496  >  993 [ACK] Seq=1 Ack=115469 Win=28103 Len=0"
"154","0.336617","64.233.164.16","10.152.152.11","TCP","1118","993  >  49496 [PSH, ACK] Seq=115469 Ack=1 Win=1181 Len=1064 [TCP segment of a reassembled PDU]"
"155","0.337112","10.152.152.11","64.233.164.16","TCP","54","49496  >  993 [ACK] Seq=1 Ack=116533 Win=28229 Len=0"
"156","0.343505","64.233.164.16","10.152.152.11","SSLv2","1514","Encrypted Data [TCP segment of a reassembled PDU]"
"157","0.343581","64.233.164.16","10.152.152.11","TCP","1514","993  >  49496 [ACK] Seq=117993 Ack=1 Win=1181 Len=1460 [TCP segment of a reassembled PDU]"
"158","0.343722","64.233.164.16","10.152.152.11","TCP","1118","993  >  49496 [PSH, ACK] Seq=119453 Ack=1 Win=1181 Len=1064 [TCP segment of a reassembled PDU]"
"159","0.343800","10.152.152.11","64.233.164.16","TCP","54","49496  >  993 [ACK] Seq=1 Ack=120517 Win=28033 Len=0"
"160","0.355177","64.233.164.16","10.152.152.11","TCP","1514","993  >  49496 [ACK] Seq=120517 Ack=1 Win=1181 Len=1460 [TCP segment of a reassembled PDU]"
"161","0.355210","64.233.164.16","10.152.152.11","SSLv2","1514","Encrypted Data [TCP segment of a reassembled PDU]"
"162","0.355255","10.152.152.11","64.233.164.16","TCP","54","49496  >  993 [ACK] Seq=1 Ack=123437 Win=28103 Len=0"
"163","0.355425","64.233.164.16","10.152.152.11","TCP","620","993  >  49496 [PSH, ACK] Seq=123437 Ack=1 Win=1181 Len=566 [TCP segment of a reassembled PDU]"
"164","0.355883","10.152.152.11","64.233.164.16","TCP","54","49496  >  993 [ACK] Seq=1 Ack=124003 Win=28229 Len=0"
"165","0.397459","64.233.164.16","10.152.152.11","TCP","1514","993  >  49496 [ACK] Seq=124003 Ack=1 Win=1181 Len=1460 [TCP segment of a reassembled PDU]"
"166","0.397506","64.233.164.16","10.152.152.11","TCP","1514","993  >  49496 [ACK] Seq=125463 Ack=1 Win=1181 Len=1460 [TCP segment of a reassembled PDU]"
"167","0.397666","64.233.164.16","10.152.152.11","TCP","1118","993  >  49496 [PSH, ACK] Seq=126923 Ack=1 Win=1181 Len=1064 [TCP segment of a reassembled PDU]"
"168","0.397858","10.152.152.11","64.233.164.16","TCP","54","49496  >  993 [ACK] Seq=1 Ack=127987 Win=28033 Len=0"
"169","0.398333","64.233.164.16","10.152.152.11","TCP","1514","993  >  49496 [ACK] Seq=127987 Ack=1 Win=1181 Len=1460 [TCP segment of a reassembled PDU]"
"170","0.398568","64.233.164.16","10.152.152.11","TCP","1514","993  >  49496 [ACK] Seq=129447 Ack=1 Win=1181 Len=1460 [TCP segment of a reassembled PDU]"
"171","0.398600","64.233.164.16","10.152.152.11","TCP","620","993  >  49496 [PSH, ACK] Seq=130907 Ack=1 Win=1181 Len=566 [TCP segment of a reassembled PDU]"
"172","0.398809","10.152.152.11","64.233.164.16","TCP","54","49496  >  993 [ACK] Seq=1 Ack=131473 Win=27823 Len=0"
"173","0.419889","64.233.164.16","10.152.152.11","TCP","1514","993  >  49496 [ACK] Seq=131473 Ack=1 Win=1181 Len=1460 [TCP segment of a reassembled PDU]"
"174","0.419935","64.233.164.16","10.152.152.11","TCP","1084","993  >  49496 [PSH, ACK] Seq=132933 Ack=1 Win=1181 Len=1030 [TCP segment of a reassembled PDU]"
"175","0.419951","10.152.152.11","64.233.164.16","TCP","54","49496  >  993 [ACK] Seq=1 Ack=133963 Win=28103 Len=0"
"176","0.439591","64.233.164.16","10.152.152.11","TCP","1514","993  >  49496 [ACK] Seq=133963 Ack=1 Win=1181 Len=1460 [TCP segment of a reassembled PDU]"
"177","0.439674","64.233.164.16","10.152.152.11","SSLv2","1084","Encrypted Data [TCP segment of a reassembled PDU]"
"178","0.439694","10.152.152.11","64.233.164.16","TCP","54","49496  >  993 [ACK] Seq=1 Ack=136453 Win=28103 Len=0"
"179","0.455637","64.233.164.16","10.152.152.11","SSLv2","1514","Encrypted Data [TCP segment of a reassembled PDU]"
"180","0.455717","64.233.164.16","10.152.152.11","TCP","1514","993  >  49496 [ACK] Seq=137913 Ack=1 Win=1181 Len=1460 [TCP segment of a reassembled PDU]"
"181","0.455732","10.152.152.11","64.233.164.16","TCP","54","49496  >  993 [ACK] Seq=1 Ack=139373 Win=28103 Len=0"
"182","0.455837","64.233.164.16","10.152.152.11","TCP","620","993  >  49496 [PSH, ACK] Seq=139373 Ack=1 Win=1181 Len=566 [TCP segment of a reassembled PDU]"
"183","0.456131","10.152.152.11","64.233.164.16","TCP","54","49496  >  993 [ACK] Seq=1 Ack=139939 Win=28229 Len=0"
"184","0.465967","64.233.164.16","10.152.152.11","TCP","1514","993  >  49496 [ACK] Seq=139939 Ack=1 Win=1181 Len=1460 [TCP segment of a reassembled PDU]"
"185","0.466045","64.233.164.16","10.152.152.11","TCP","1514","993  >  49496 [ACK] Seq=141399 Ack=1 Win=1181 Len=1460 [TCP segment of a reassembled PDU]"
"186","0.466055","64.233.164.16","10.152.152.11","TCP","1118","993  >  49496 [PSH, ACK] Seq=142859 Ack=1 Win=1181 Len=1064 [TCP segment of a reassembled PDU]"
"187","0.466196","10.152.152.11","64.233.164.16","TCP","54","49496  >  993 [ACK] Seq=1 Ack=143923 Win=28033 Len=0"
"188","0.482035","64.233.164.16","10.152.152.11","TCP","1514","993  >  49496 [ACK] Seq=143923 Ack=1 Win=1181 Len=1460 [TCP segment of a reassembled PDU]"
"189","0.482098","64.233.164.16","10.152.152.11","TCP","1514","993  >  49496 [ACK] Seq=145383 Ack=1 Win=1181 Len=1460 [TCP segment of a reassembled PDU]"
"190","0.482112","10.152.152.11","64.233.164.16","TCP","54","49496  >  993 [ACK] Seq=1 Ack=146843 Win=28103 Len=0"
"191","0.482132","64.233.164.16","10.152.152.11","TCP","1118","993  >  49496 [PSH, ACK] Seq=146843 Ack=1 Win=1181 Len=1064 [TCP segment of a reassembled PDU]"
"192","0.482618","64.233.164.16","10.152.152.11","TCP","1514","993  >  49496 [ACK] Seq=147907 Ack=1 Win=1181 Len=1460 [TCP segment of a reassembled PDU]"
"193","0.482637","10.152.152.11","64.233.164.16","TCP","54","49496  >  993 [ACK] Seq=1 Ack=149367 Win=28103 Len=0"
"194","0.482736","64.233.164.16","10.152.152.11","TCP","1514","993  >  49496 [ACK] Seq=149367 Ack=1 Win=1181 Len=1460 [TCP segment of a reassembled PDU]"
"195","0.482835","64.233.164.16","10.152.152.11","TCP","620","993  >  49496 [PSH, ACK] Seq=150827 Ack=1 Win=1181 Len=566 [TCP segment of a reassembled PDU]"
"196","0.482852","10.152.152.11","64.233.164.16","TCP","54","49496  >  993 [ACK] Seq=1 Ack=151393 Win=28103 Len=0"
"197","0.485422","64.233.164.16","10.152.152.11","TCP","1050","993  >  49496 [PSH, ACK] Seq=151393 Ack=1 Win=1181 Len=996 [TCP segment of a reassembled PDU]"
"198","0.485630","10.152.152.11","64.233.164.16","TCP","54","49496  >  993 [ACK] Seq=1 Ack=152389 Win=28229 Len=0"
"199","0.497465","64.233.164.16","10.152.152.11","TCP","1514","993  >  49496 [ACK] Seq=152389 Ack=1 Win=1181 Len=1460 [TCP segment of a reassembled PDU]"
"200","0.497526","64.233.164.16","10.152.152.11","TCP","1514","993  >  49496 [ACK] Seq=153849 Ack=1 Win=1181 Len=1460 [TCP segment of a reassembled PDU]"
"201","0.497534","64.233.164.16","10.152.152.11","TCP","620","993  >  49496 [PSH, ACK] Seq=155309 Ack=1 Win=1181 Len=566 [TCP segment of a reassembled PDU]"
"202","0.497669","10.152.152.11","64.233.164.16","TCP","54","49496  >  993 [ACK] Seq=1 Ack=155875 Win=28033 Len=0"
"203","0.503551","64.233.164.16","10.152.152.11","SSLv2","1514","Encrypted Data [TCP segment of a reassembled PDU]"
"204","0.503606","64.233.164.16","10.152.152.11","TCP","1514","993  >  49496 [ACK] Seq=157335 Ack=1 Win=1181 Len=1460 [TCP segment of a reassembled PDU]"
"205","0.503618","10.152.152.11","64.233.164.16","TCP","54","49496  >  993 [ACK] Seq=1 Ack=158795 Win=28103 Len=0"
"206","0.503640","64.233.164.16","10.152.152.11","TCP","122","993  >  49496 [PSH, ACK] Seq=158795 Ack=1 Win=1181 Len=68 [TCP segment of a reassembled PDU]"
"207","0.503970","10.152.152.11","64.233.164.16","TCP","54","49496  >  993 [ACK] Seq=1 Ack=158863 Win=28229 Len=0"
"208","0.510662","64.233.164.16","10.152.152.11","TCP","1514","993  >  49496 [ACK] Seq=158863 Ack=1 Win=1181 Len=1460 [TCP segment of a reassembled PDU]"
"209","0.510844","64.233.164.16","10.152.152.11","TCP","1514","993  >  49496 [ACK] Seq=160323 Ack=1 Win=1181 Len=1460 [TCP segment of a reassembled PDU]"
"210","0.510856","64.233.164.16","10.152.152.11","TCP","620","993  >  49496 [PSH, ACK] Seq=161783 Ack=1 Win=1181 Len=566 [TCP segment of a reassembled PDU]"
"211","0.510939","10.152.152.11","64.233.164.16","TCP","54","49496  >  993 [ACK] Seq=1 Ack=162349 Win=28033 Len=0"
"212","0.513358","64.233.164.16","10.152.152.11","TCP","1514","993  >  49496 [ACK] Seq=162349 Ack=1 Win=1181 Len=1460 [TCP segment of a reassembled PDU]"
"213","0.513483","64.233.164.16","10.152.152.11","TCP","1514","993  >  49496 [ACK] Seq=163809 Ack=1 Win=1181 Len=1460 [TCP segment of a reassembled PDU]"
"214","0.513513","10.152.152.11","64.233.164.16","TCP","54","49496  >  993 [ACK] Seq=1 Ack=165269 Win=28103 Len=0"
"215","0.513560","64.233.164.16","10.152.152.11","TCP","1118","993  >  49496 [PSH, ACK] Seq=165269 Ack=1 Win=1181 Len=1064 [TCP segment of a reassembled PDU]"
"216","0.514162","10.152.152.11","64.233.164.16","TCP","54","49496  >  993 [ACK] Seq=1 Ack=166333 Win=28229 Len=0"
"217","0.524561","64.233.164.16","10.152.152.11","TCP","1514","993  >  49496 [ACK] Seq=166333 Ack=1 Win=1181 Len=1460 [TCP segment of a reassembled PDU]"
"218","0.524688","64.233.164.16","10.152.152.11","TCP","586","993  >  49496 [PSH, ACK] Seq=167793 Ack=1 Win=1181 Len=532 [TCP segment of a reassembled PDU]"
"219","0.524817","10.152.152.11","64.233.164.16","TCP","54","49496  >  993 [ACK] Seq=1 Ack=168325 Win=28105 Len=0"
"220","0.532285","64.233.164.16","10.152.152.11","TCP","1514","993  >  49496 [ACK] Seq=168325 Ack=1 Win=1181 Len=1460 [TCP segment of a reassembled PDU]"
"221","0.532360","64.233.164.16","10.152.152.11","TCP","1514","993  >  49496 [ACK] Seq=169785 Ack=1 Win=1181 Len=1460 [TCP segment of a reassembled PDU]"
"222","0.532371","64.233.164.16","10.152.152.11","TCP","1206","993  >  49496 [PSH, ACK] Seq=171245 Ack=1 Win=1181 Len=1152 [TCP segment of a reassembled PDU]"
"223","0.532478","64.233.164.16","10.152.152.11","TCP","1514","993  >  49496 [ACK] Seq=172397 Ack=1 Win=1181 Len=1460 [TCP segment of a reassembled PDU]"
"224","0.532709","10.152.152.11","64.233.164.16","TCP","54","49496  >  993 [ACK] Seq=1 Ack=173857 Win=27963 Len=0"
"225","0.533281","64.233.164.16","10.152.152.11","TCP","1494","993  >  49496 [PSH, ACK] Seq=173857 Ack=1 Win=1181 Len=1440 [TCP segment of a reassembled PDU]"
"226","0.533727","10.152.152.11","64.233.164.16","TCP","54","49496  >  993 [ACK] Seq=1 Ack=175297 Win=28229 Len=0"
"227","0.539313","64.233.164.16","10.152.152.11","TCP","1514","993  >  49496 [ACK] Seq=175297 Ack=1 Win=1181 Len=1460 [TCP segment of a reassembled PDU]"
"228","0.539384","64.233.164.16","10.152.152.11","TCP","1514","993  >  49496 [ACK] Seq=176757 Ack=1 Win=1181 Len=1460 [TCP segment of a reassembled PDU]"
"229","0.539393","64.233.164.16","10.152.152.11","TCP","1118","993  >  49496 [PSH, ACK] Seq=178217 Ack=1 Win=1181 Len=1064 [TCP segment of a reassembled PDU]"
"230","0.539623","10.152.152.11","64.233.164.16","TCP","54","49496  >  993 [ACK] Seq=1 Ack=179281 Win=28033 Len=0"
"231","0.550749","64.233.164.16","10.152.152.11","TCP","552","993  >  49496 [PSH, ACK] Seq=179281 Ack=1 Win=1181 Len=498 [TCP segment of a reassembled PDU]"
"232","0.550893","10.152.152.11","64.233.164.16","TCP","54","49496  >  993 [ACK] Seq=1 Ack=179779 Win=28229 Len=0"
"233","0.553597","64.233.164.16","10.152.152.11","TCP","1514","993  >  49496 [ACK] Seq=179779 Ack=1 Win=1181 Len=1460 [TCP segment of a reassembled PDU]"
"234","0.553651","64.233.164.16","10.152.152.11","TCP","1514","993  >  49496 [ACK] Seq=181239 Ack=1 Win=1181 Len=1460 [TCP segment of a reassembled PDU]"
"235","0.553799","64.233.164.16","10.152.152.11","TCP","620","993  >  49496 [PSH, ACK] Seq=182699 Ack=1 Win=1181 Len=566 [TCP segment of a reassembled PDU]"
"236","0.553836","10.152.152.11","64.233.164.16","TCP","54","49496  >  993 [ACK] Seq=1 Ack=183265 Win=28033 Len=0"
"237","0.561573","64.233.164.16","10.152.152.11","TCP","1050","993  >  49496 [PSH, ACK] Seq=183265 Ack=1 Win=1181 Len=996 [TCP segment of a reassembled PDU]"
"238","0.561972","10.152.152.11","64.233.164.16","TCP","54","49496  >  993 [ACK] Seq=1 Ack=184261 Win=28229 Len=0"
"239","0.570300","64.233.164.16","10.152.152.11","SSLv2","1514","Encrypted Data [TCP segment of a reassembled PDU]"
"240","0.570362","64.233.164.16","10.152.152.11","TCP","1514","993  >  49496 [ACK] Seq=185721 Ack=1 Win=1181 Len=1460 [TCP segment of a reassembled PDU]"
"241","0.570370","64.233.164.16","10.152.152.11","TCP","1206","993  >  49496 [PSH, ACK] Seq=187181 Ack=1 Win=1181 Len=1152 [TCP segment of a reassembled PDU]"
"242","0.570483","64.233.164.16","10.152.152.11","TCP","1514","993  >  49496 [ACK] Seq=188333 Ack=1 Win=1181 Len=1460 [TCP segment of a reassembled PDU]"
"243","0.570542","10.152.152.11","64.233.164.16","TCP","54","49496  >  993 [ACK] Seq=1 Ack=189793 Win=27963 Len=0"
"244","0.570885","64.233.164.16","10.152.152.11","TCP","1494","993  >  49496 [PSH, ACK] Seq=189793 Ack=1 Win=1181 Len=1440 [TCP segment of a reassembled PDU]"
"245","0.571296","10.152.152.11","64.233.164.16","TCP","54","49496  >  993 [ACK] Seq=1 Ack=191233 Win=28229 Len=0"
"246","0.585529","64.233.164.16","10.152.152.11","TCP","552","993  >  49496 [PSH, ACK] Seq=191233 Ack=1 Win=1181 Len=498 [TCP segment of a reassembled PDU]"
"247","0.585749","10.152.152.11","64.233.164.16","TCP","54","49496  >  993 [ACK] Seq=1 Ack=191731 Win=28229 Len=0"
"248","0.595767","64.233.164.16","10.152.152.11","TCP","1514","993  >  49496 [ACK] Seq=191731 Ack=1 Win=1181 Len=1460 [TCP segment of a reassembled PDU]"
"249","0.595800","64.233.164.16","10.152.152.11","SSLv2","1514","Encrypted Data [TCP segment of a reassembled PDU]"
"250","0.595903","64.233.164.16","10.152.152.11","TCP","1118","993  >  49496 [PSH, ACK] Seq=194651 Ack=1 Win=1181 Len=1064 [TCP segment of a reassembled PDU]"
"251","0.596192","10.152.152.11","64.233.164.16","TCP","54","49496  >  993 [ACK] Seq=1 Ack=195715 Win=28033 Len=0"
"252","0.612808","64.233.164.16","10.152.152.11","TCP","1514","993  >  49496 [ACK] Seq=195715 Ack=1 Win=1181 Len=1460 [TCP segment of a reassembled PDU]"
"253","0.612891","64.233.164.16","10.152.152.11","TCP","1514","993  >  49496 [ACK] Seq=197175 Ack=1 Win=1181 Len=1460 [TCP segment of a reassembled PDU]"
"254","0.612921","10.152.152.11","64.233.164.16","TCP","54","49496  >  993 [ACK] Seq=1 Ack=198635 Win=28103 Len=0"
"255","0.612944","64.233.164.16","10.152.152.11","TCP","1118","993  >  49496 [PSH, ACK] Seq=198635 Ack=1 Win=1181 Len=1064 [TCP segment of a reassembled PDU]"
"256","0.613401","10.152.152.11","64.233.164.16","TCP","54","49496  >  993 [ACK] Seq=1 Ack=199699 Win=28229 Len=0"
"257","0.613686","64.233.164.16","10.152.152.11","TCP","552","993  >  49496 [PSH, ACK] Seq=199699 Ack=1 Win=1181 Len=498 [TCP segment of a reassembled PDU]"
"258","0.613897","10.152.152.11","64.233.164.16","TCP","54","49496  >  993 [ACK] Seq=1 Ack=200197 Win=28229 Len=0"
"259","0.616084","64.233.164.16","10.152.152.11","TCP","1514","993  >  49496 [ACK] Seq=200197 Ack=1 Win=1181 Len=1460 [TCP segment of a reassembled PDU]"
"260","0.616158","64.233.164.16","10.152.152.11","TCP","1514","993  >  49496 [ACK] Seq=201657 Ack=1 Win=1181 Len=1460 [TCP segment of a reassembled PDU]"
"261","0.616256","10.152.152.11","64.233.164.16","TCP","54","49496  >  993 [ACK] Seq=1 Ack=203117 Win=28103 Len=0"
"262","0.616267","64.233.164.16","10.152.152.11","TCP","620","993  >  49496 [PSH, ACK] Seq=203117 Ack=1 Win=1181 Len=566 [TCP segment of a reassembled PDU]"
"263","0.616740","10.152.152.11","64.233.164.16","TCP","54","49496  >  993 [ACK] Seq=1 Ack=203683 Win=28229 Len=0"
"264","0.620291","64.233.164.16","10.152.152.11","TCP","1514","993  >  49496 [ACK] Seq=203683 Ack=1 Win=1181 Len=1460 [TCP segment of a reassembled PDU]"
"265","0.620351","64.233.164.16","10.152.152.11","TCP","1514","993  >  49496 [ACK] Seq=205143 Ack=1 Win=1181 Len=1460 [TCP segment of a reassembled PDU]"
"266","0.620445","64.233.164.16","10.152.152.11","TCP","620","993  >  49496 [PSH, ACK] Seq=206603 Ack=1 Win=1181 Len=566 [TCP segment of a reassembled PDU]"
"267","0.620474","10.152.152.11","64.233.164.16","TCP","54","49496  >  993 [ACK] Seq=1 Ack=207169 Win=28033 Len=0"
"268","0.629036","64.233.164.16","10.152.152.11","SSLv2","1514","Encrypted Data [TCP segment of a reassembled PDU]"
"269","0.629086","64.233.164.16","10.152.152.11","TCP","88","993  >  49496 [PSH, ACK] Seq=208629 Ack=1 Win=1181 Len=34 [TCP segment of a reassembled PDU]"
"270","0.629097","10.152.152.11","64.233.164.16","TCP","54","49496  >  993 [ACK] Seq=1 Ack=208663 Win=28151 Len=0"
"271","0.642218","64.233.164.16","10.152.152.11","TCP","1514","993  >  49496 [ACK] Seq=208663 Ack=1 Win=1181 Len=1460 [TCP segment of a reassembled PDU]"
"272","0.642305","64.233.164.16","10.152.152.11","TCP","1514","993  >  49496 [ACK] Seq=210123 Ack=1 Win=1181 Len=1460 [TCP segment of a reassembled PDU]"
"273","0.642442","64.233.164.16","10.152.152.11","TCP","620","993  >  49496 [PSH, ACK] Seq=211583 Ack=1 Win=1181 Len=566 [TCP segment of a reassembled PDU]"
"274","0.642501","10.152.152.11","64.233.164.16","TCP","54","49496  >  993 [ACK] Seq=1 Ack=212149 Win=28033 Len=0"
"275","0.643889","64.233.184.16","10.152.152.11","TLSv1.2","91","Application Data"
"276","0.643976","10.152.152.11","64.233.184.16","TCP","54","34771  >  993 [ACK] Seq=46 Ack=38 Win=2190 Len=0"
"277","0.644058","64.233.164.16","10.152.152.11","TCP","1514","993  >  49496 [ACK] Seq=212149 Ack=1 Win=1181 Len=1460 [TCP segment of a reassembled PDU]"
"278","0.644274","64.233.164.16","10.152.152.11","SSLv2","1514","Encrypted Data [TCP segment of a reassembled PDU]"
"279","0.644349","10.152.152.11","64.233.164.16","TCP","54","49496  >  993 [ACK] Seq=1 Ack=215069 Win=28103 Len=0"
"280","0.644391","64.233.164.16","10.152.152.11","TCP","620","993  >  49496 [PSH, ACK] Seq=215069 Ack=1 Win=1181 Len=566 [TCP segment of a reassembled PDU]"
"281","0.645223","10.152.152.11","64.233.164.16","TCP","54","49496  >  993 [ACK] Seq=1 Ack=215635 Win=28229 Len=0"
"282","0.645597","10.152.152.11","64.233.184.16","TLSv1.2","171","Application Data"
"283","0.646029","64.233.184.16","10.152.152.11","TCP","60","993  >  34771 [ACK] Seq=38 Ack=163 Win=4198 Len=0"
"284","0.649574","10.152.152.11","64.233.184.16","TLSv1.2","91","Application Data"
"285","0.649788","64.233.184.16","10.152.152.11","TCP","60","993  >  34771 [ACK] Seq=38 Ack=200 Win=4198 Len=0"
"286","0.651472","64.233.164.16","10.152.152.11","TCP","552","993  >  49496 [PSH, ACK] Seq=215635 Ack=1 Win=1181 Len=498 [TCP segment of a reassembled PDU]"
"287","0.651671","10.152.152.11","64.233.164.16","TCP","54","49496  >  993 [ACK] Seq=1 Ack=216133 Win=28229 Len=0"
"288","0.659136","64.233.164.16","10.152.152.11","TCP","1514","993  >  49496 [ACK] Seq=216133 Ack=1 Win=1181 Len=1460 [TCP segment of a reassembled PDU]"
"289","0.659182","64.233.164.16","10.152.152.11","TCP","1514","993  >  49496 [ACK] Seq=217593 Ack=1 Win=1181 Len=1460 [TCP segment of a reassembled PDU]"
"290","0.659187","64.233.164.16","10.152.152.11","TCP","620","993  >  49496 [PSH, ACK] Seq=219053 Ack=1 Win=1181 Len=566 [TCP segment of a reassembled PDU]"
"291","0.659301","10.152.152.11","64.233.164.16","TCP","54","49496  >  993 [ACK] Seq=1 Ack=219619 Win=28033 Len=0"
"292","0.667127","64.233.164.16","10.152.152.11","TCP","1514","993  >  49496 [ACK] Seq=219619 Ack=1 Win=1181 Len=1460 [TCP segment of a reassembled PDU]"
"293","0.667171","64.233.164.16","10.152.152.11","SSLv2","1514","Encrypted Data [TCP segment of a reassembled PDU]"
"294","0.667181","10.152.152.11","64.233.164.16","TCP","54","49496  >  993 [ACK] Seq=1 Ack=222539 Win=28103 Len=0"
"295","0.667202","64.233.164.16","10.152.152.11","SSLv2","1118","Encrypted Data [TCP segment of a reassembled PDU]"
"296","0.667473","10.152.152.11","64.233.164.16","TCP","54","49496  >  993 [ACK] Seq=1 Ack=223603 Win=28229 Len=0"
"297","0.668488","64.233.164.16","10.152.152.11","TCP","1514","993  >  49496 [ACK] Seq=223603 Ack=1 Win=1181 Len=1460 [TCP segment of a reassembled PDU]"
"298","0.668570","64.233.164.16","10.152.152.11","TCP","1514","993  >  49496 [ACK] Seq=225063 Ack=1 Win=1181 Len=1460 [TCP segment of a reassembled PDU]"
"299","0.668576","64.233.164.16","10.152.152.11","TCP","1118","993  >  49496 [PSH, ACK] Seq=226523 Ack=1 Win=1181 Len=1064 [TCP segment of a reassembled PDU]"
"300","0.668672","10.152.152.11","64.233.164.16","TCP","54","49496  >  993 [ACK] Seq=1 Ack=227587 Win=28033 Len=0"
"301","0.681504","64.233.164.16","10.152.152.11","TCP","1514","993  >  49496 [ACK] Seq=227587 Ack=1 Win=1181 Len=1460 [TCP segment of a reassembled PDU]"
"302","0.681591","64.233.164.16","10.152.152.11","TCP","1514","993  >  49496 [ACK] Seq=229047 Ack=1 Win=1181 Len=1460 [TCP segment of a reassembled PDU]"
"303","0.681610","10.152.152.11","64.233.164.16","TCP","54","49496  >  993 [ACK] Seq=1 Ack=230507 Win=28103 Len=0"
"304","0.681648","64.233.164.16","10.152.152.11","TCP","620","993  >  49496 [PSH, ACK] Seq=230507 Ack=1 Win=1181 Len=566 [TCP segment of a reassembled PDU]"
"305","0.682378","10.152.152.11","64.233.164.16","TCP","54","49496  >  993 [ACK] Seq=1 Ack=231073 Win=28229 Len=0"
"306","0.691843","64.233.164.16","10.152.152.11","TCP","1050","993  >  49496 [PSH, ACK] Seq=231073 Ack=1 Win=1181 Len=996 [TCP segment of a reassembled PDU]"
