"No.","Time","Source","Destination","Protocol","Length","Info"
"1","0.000000","10.152.152.11","10.152.152.10","DNS","79","Standard query 0x278c A smtp.googlemail.com"
"2","0.000133","10.152.152.11","10.152.152.10","DNS","79","Standard query 0xbbe9 AAAA smtp.googlemail.com"
"3","0.712132","10.152.152.10","10.152.152.11","DNS","79","Standard query response 0xbbe9 No such name AAAA smtp.googlemail.com"
"4","0.776879","10.152.152.10","10.152.152.11","DNS","95","Standard query response 0x278c A smtp.googlemail.com A 64.233.167.16"
"5","0.777651","10.152.152.11","64.233.167.16","TCP","66","39222  >  465 [SYN] Seq=0 Win=14600 Len=0 MSS=1460 SACK_PERM=1 WS=16"
"6","0.778203","64.233.167.16","10.152.152.11","TCP","66","465  >  39222 [SYN, ACK] Seq=0 Ack=1 Win=14600 Len=0 MSS=1460 SACK_PERM=1 WS=16"
"7","0.778300","10.152.152.11","64.233.167.16","TCP","54","39222  >  465 [ACK] Seq=1 Ack=1 Win=14608 Len=0"
"8","0.778597","10.152.152.11","64.233.167.16","TLSv1.2","212","Client Hello"
"9","0.778950","64.233.167.16","10.152.152.11","TCP","60","465  >  39222 [ACK] Seq=1 Ack=159 Win=15680 Len=0"
"10","2.920295","64.233.167.16","10.152.152.11","TLSv1.2","1514","Server Hello"
"11","2.920401","10.152.152.11","64.233.167.16","TCP","54","39222  >  465 [ACK] Seq=159 Ack=1461 Win=17520 Len=0"
"12","2.920444","64.233.167.16","10.152.152.11","TCP","1514","465  >  39222 [ACK] Seq=1461 Ack=159 Win=15680 Len=1460 [TCP segment of a reassembled PDU]"
"13","2.920468","10.152.152.11","64.233.167.16","TCP","54","39222  >  465 [ACK] Seq=159 Ack=2921 Win=20448 Len=0"
"14","2.920502","64.233.167.16","10.152.152.11","TLSv1.2","620","Certificate [TCP segment of a reassembled PDU]"
"15","2.920522","10.152.152.11","64.233.167.16","TCP","54","39222  >  465 [ACK] Seq=159 Ack=3487 Win=23360 Len=0"
"16","2.985560","64.233.167.16","10.152.152.11","TLSv1.2","71","Server Key Exchange, Server Hello Done"
"17","2.985600","10.152.152.11","64.233.167.16","TCP","54","39222  >  465 [ACK] Seq=159 Ack=3504 Win=23360 Len=0"
"18","2.991949","10.152.152.11","64.233.167.16","TLSv1.2","180","Client Key Exchange, Change Cipher Spec, Encrypted Handshake Message"
"19","2.992355","64.233.167.16","10.152.152.11","TCP","60","465  >  39222 [ACK] Seq=3504 Ack=285 Win=15680 Len=0"
"20","3.278188","64.233.167.16","10.152.152.11","TLSv1.2","300","New Session Ticket, Change Cipher Spec, Encrypted Handshake Message"
"21","3.317098","10.152.152.11","64.233.167.16","TCP","54","39222  >  465 [ACK] Seq=285 Ack=3750 Win=26288 Len=0"
"22","3.439995","64.233.167.16","10.152.152.11","TLSv1.2","143","Application Data"
"23","3.440033","10.152.152.11","64.233.167.16","TCP","54","39222  >  465 [ACK] Seq=285 Ack=3839 Win=26288 Len=0"
"24","3.441049","10.152.152.11","64.233.167.16","TLSv1.2","105","Application Data"
"25","3.441573","64.233.167.16","10.152.152.11","TCP","60","465  >  39222 [ACK] Seq=3839 Ack=336 Win=15680 Len=0"
"26","3.731395","64.233.167.16","10.152.152.11","TLSv1.2","297","Application Data"
"27","3.745145","10.152.152.11","10.152.152.10","DNS","78","Standard query 0xe3e8 A www.googleapis.com"
"28","3.745211","10.152.152.11","10.152.152.10","DNS","78","Standard query 0x13e8 AAAA www.googleapis.com"
"29","3.746107","10.152.152.11","10.152.152.10","DNS","78","Standard query 0x9d29 A www.googleapis.com"
"30","3.769577","10.152.152.11","64.233.167.16","TCP","54","39222  >  465 [ACK] Seq=336 Ack=4082 Win=29200 Len=0"
"31","3.977810","10.152.152.10","10.152.152.11","DNS","94","Standard query response 0xe3e8 A www.googleapis.com A 216.58.211.10"
"32","4.106429","10.152.152.10","10.152.152.11","DNS","78","Standard query response 0x13e8 No such name AAAA www.googleapis.com"
"33","4.270742","10.152.152.10","10.152.152.11","DNS","94","Standard query response 0x9d29 A www.googleapis.com A 216.58.211.10"
"34","4.271534","10.152.152.11","216.58.211.10","TCP","66","47759  >  443 [SYN] Seq=0 Win=14600 Len=0 MSS=1460 SACK_PERM=1 WS=16"
"35","4.272087","216.58.211.10","10.152.152.11","TCP","66","443  >  47759 [SYN, ACK] Seq=0 Ack=1 Win=14600 Len=0 MSS=1460 SACK_PERM=1 WS=16"
"36","4.272187","10.152.152.11","216.58.211.10","TCP","54","47759  >  443 [ACK] Seq=1 Ack=1 Win=14608 Len=0"
"37","4.272670","10.152.152.11","216.58.211.10","TLSv1.2","571","Client Hello"
"38","4.273130","216.58.211.10","10.152.152.11","TCP","60","443  >  47759 [ACK] Seq=1 Ack=518 Win=15680 Len=0"
"39","4.997048","216.58.211.10","10.152.152.11","TLSv1.2","1514","Server Hello"
"40","4.997150","10.152.152.11","216.58.211.10","TCP","54","47759  >  443 [ACK] Seq=518 Ack=1461 Win=17520 Len=0"
"41","4.997191","216.58.211.10","10.152.152.11","TCP","1514","443  >  47759 [ACK] Seq=1461 Ack=518 Win=15680 Len=1460 [TCP segment of a reassembled PDU]"
"42","4.997214","10.152.152.11","216.58.211.10","TCP","54","47759  >  443 [ACK] Seq=518 Ack=2921 Win=20448 Len=0"
"43","4.997245","216.58.211.10","10.152.152.11","TLSv1.2","620","Certificate [TCP segment of a reassembled PDU]"
"44","4.997264","10.152.152.11","216.58.211.10","TCP","54","47759  >  443 [ACK] Seq=518 Ack=3487 Win=23360 Len=0"
"45","5.008182","10.152.152.11","10.152.152.10","DNS","79","Standard query 0xa5a2 A clients1.google.com"
"46","5.008228","10.152.152.11","10.152.152.10","DNS","79","Standard query 0x3c5d AAAA clients1.google.com"
"47","5.008632","10.152.152.11","10.152.152.10","DNS","79","Standard query 0xffe1 A clients1.google.com"
"48","5.115284","216.58.211.10","10.152.152.11","TLSv1.2","163","Server Key Exchange, Server Hello Done"
"49","5.115314","10.152.152.11","216.58.211.10","TCP","54","47759  >  443 [ACK] Seq=518 Ack=3596 Win=23360 Len=0"
"50","5.122425","10.152.152.11","216.58.211.10","TLSv1.2","180","Client Key Exchange, Change Cipher Spec, Encrypted Handshake Message"
"51","5.122948","216.58.211.10","10.152.152.11","TCP","60","443  >  47759 [ACK] Seq=3596 Ack=644 Win=15680 Len=0"
"52","5.221226","10.152.152.10","10.152.152.11","DNS","95","Standard query response 0xa5a2 A clients1.google.com A 31.172.32.106"
"53","5.349136","10.152.152.10","10.152.152.11","DNS","79","Standard query response 0x3c5d No such name AAAA clients1.google.com"
"54","5.505929","64.233.164.16","10.152.152.11","TLSv1.2","130","Application Data, Application Data"
"55","5.505980","10.152.152.11","64.233.164.16","TCP","54","49496  >  993 [ACK] Seq=1 Ack=77 Win=28225 Len=0"
"56","5.509759","10.152.152.11","64.233.164.16","TLSv1.2","91","Application Data"
"57","5.510270","64.233.164.16","10.152.152.11","TCP","60","993  >  49496 [ACK] Seq=77 Ack=38 Win=1181 Len=0"
"58","5.570577","10.152.152.10","10.152.152.11","DNS","95","Standard query response 0xffe1 A clients1.google.com A 31.172.32.106"
"59","5.570827","10.152.152.11","31.172.32.106","TCP","66","50670  >  80 [SYN] Seq=0 Win=14600 Len=0 MSS=1460 SACK_PERM=1 WS=16"
"60","5.571187","31.172.32.106","10.152.152.11","TCP","66","80  >  50670 [SYN, ACK] Seq=0 Ack=1 Win=14600 Len=0 MSS=1460 SACK_PERM=1 WS=16"
"61","5.571274","10.152.152.11","31.172.32.106","TCP","54","50670  >  80 [ACK] Seq=1 Ack=1 Win=14608 Len=0"
"62","5.571658","10.152.152.11","31.172.32.106","OCSP","503","Request"
"63","5.571846","31.172.32.106","10.152.152.11","TCP","60","80  >  50670 [ACK] Seq=1 Ack=450 Win=15680 Len=0"
"64","5.673907","216.58.211.10","10.152.152.11","TLSv1.2","398","New Session Ticket, Change Cipher Spec, Encrypted Handshake Message, Application Data, Application Data"
"65","5.710546","10.152.152.11","216.58.211.10","TCP","54","47759  >  443 [ACK] Seq=644 Ack=3940 Win=26288 Len=0"
"66","5.977265","64.233.164.16","10.152.152.11","TLSv1.2","94","Application Data"
"67","5.978411","10.152.152.11","64.233.164.16","TLSv1.2","94","Application Data"
"68","5.978854","64.233.164.16","10.152.152.11","TCP","60","993  >  49496 [ACK] Seq=117 Ack=78 Win=1181 Len=0"
"69","6.089881","31.172.32.106","10.152.152.11","OCSP","833","Response"
"70","6.089926","10.152.152.11","31.172.32.106","TCP","54","50670  >  80 [ACK] Seq=450 Ack=780 Win=16160 Len=0"
"71","6.092643","10.152.152.11","216.58.211.10","TLSv1.2","211","Application Data"
"72","6.092820","10.152.152.11","216.58.211.10","TLSv1.2","336","Application Data"
"73","6.092896","10.152.152.11","216.58.211.10","TLSv1.2","300","Application Data"
"74","6.092962","216.58.211.10","10.152.152.11","TCP","60","443  >  47759 [ACK] Seq=3940 Ack=801 Win=16752 Len=0"
"75","6.092973","216.58.211.10","10.152.152.11","TCP","60","443  >  47759 [ACK] Seq=3940 Ack=1083 Win=17824 Len=0"
"76","6.093010","10.152.152.11","216.58.211.10","TLSv1.2","92","Application Data"
"77","6.093064","216.58.211.10","10.152.152.11","TCP","60","443  >  47759 [ACK] Seq=3940 Ack=1329 Win=18896 Len=0"
"78","6.093154","216.58.211.10","10.152.152.11","TCP","60","443  >  47759 [ACK] Seq=3940 Ack=1367 Win=18896 Len=0"
"79","6.386417","64.233.164.16","10.152.152.11","TLSv1.2","94","Application Data"
"80","6.388554","10.152.152.11","64.233.164.16","TLSv1.2","94","Application Data"
"81","6.388952","64.233.164.16","10.152.152.11","TCP","60","993  >  49496 [ACK] Seq=157 Ack=118 Win=1181 Len=0"
"82","6.591285","216.58.211.10","10.152.152.11","TLSv1.2","92","Application Data"
"83","6.591376","10.152.152.11","216.58.211.10","TCP","54","47759  >  443 [ACK] Seq=1367 Ack=3978 Win=26288 Len=0"
"84","6.881808","64.233.164.16","10.152.152.11","TLSv1.2","101","Application Data"
"85","6.881894","216.58.211.10","10.152.152.11","TLSv1.2","796","Application Data, Application Data, Application Data"
"86","6.881915","10.152.152.11","216.58.211.10","TCP","54","47759  >  443 [ACK] Seq=1367 Ack=4720 Win=29200 Len=0"
"87","6.882642","10.152.152.11","216.58.211.10","TLSv1.2","100","Application Data"
"88","6.883034","216.58.211.10","10.152.152.11","TCP","60","443  >  47759 [ACK] Seq=4720 Ack=1413 Win=18896 Len=0"
"89","6.889907","10.152.152.11","64.233.167.16","TLSv1.2","250","Application Data"
"90","6.890195","10.152.152.11","64.233.164.16","TLSv1.2","94","Application Data"
"91","6.890354","64.233.167.16","10.152.152.11","TCP","60","465  >  39222 [ACK] Seq=4082 Ack=532 Win=16752 Len=0"
"92","6.890584","64.233.164.16","10.152.152.11","TCP","60","993  >  49496 [ACK] Seq=204 Ack=158 Win=1181 Len=0"
"93","6.995551","64.233.164.16","10.152.152.11","TLSv1.2","84","Application Data"
"94","7.035039","10.152.152.11","64.233.164.16","TCP","54","49496  >  993 [ACK] Seq=158 Ack=234 Win=28229 Len=0"
"95","7.611482","64.233.167.16","10.152.152.11","TLSv1.2","103","Application Data"
"96","7.611570","10.152.152.11","64.233.167.16","TCP","54","39222  >  465 [ACK] Seq=532 Ack=4131 Win=29200 Len=0"
"97","7.623293","10.152.152.11","64.233.167.16","TLSv1.2","126","Application Data"
"98","7.623796","64.233.167.16","10.152.152.11","TCP","60","465  >  39222 [ACK] Seq=4131 Ack=604 Win=16752 Len=0"
"99","7.974722","64.233.167.16","10.152.152.11","TLSv1.2","126","Application Data"
"100","7.975578","10.152.152.11","64.233.167.16","TLSv1.2","114","Application Data"
"101","7.975992","64.233.167.16","10.152.152.11","TCP","60","465  >  39222 [ACK] Seq=4203 Ack=664 Win=16752 Len=0"
"102","8.204104","64.233.164.16","10.152.152.11","TLSv1.2","101","Application Data"
"103","8.204150","10.152.152.11","64.233.164.16","TCP","54","49496  >  993 [ACK] Seq=158 Ack=281 Win=28227 Len=0"
"104","8.214367","10.152.152.11","64.233.164.16","TLSv1.2","100","Application Data"
"105","8.214665","64.233.164.16","10.152.152.11","TCP","60","993  >  49496 [ACK] Seq=281 Ack=204 Win=1181 Len=0"
"106","8.279814","64.233.167.16","10.152.152.11","TLSv1.2","126","Application Data"
"107","8.288335","10.152.152.11","64.233.167.16","TLSv1.2","89","Application Data"
"108","8.288752","64.233.167.16","10.152.152.11","TCP","60","465  >  39222 [ACK] Seq=4275 Ack=699 Win=16752 Len=0"
"109","8.644288","64.233.164.16","10.152.152.11","TLSv1.2","459","Application Data, Application Data"
"110","8.684003","10.152.152.11","64.233.164.16","TCP","54","49496  >  993 [ACK] Seq=204 Ack=686 Win=28229 Len=0"
"111","8.708670","10.152.152.11","64.233.164.16","TLSv1.2","97","Application Data"
"112","8.709090","64.233.164.16","10.152.152.11","TCP","60","993  >  49496 [ACK] Seq=686 Ack=247 Win=1181 Len=0"
"113","8.982309","64.233.167.16","10.152.152.11","TLSv1.2","127","Application Data"
"114","8.992660","10.152.152.11","64.233.167.16","TCP","1514","39222  >  465 [ACK] Seq=699 Ack=4348 Win=29200 Len=1460 [TCP segment of a reassembled PDU]"
"115","8.992902","10.152.152.11","64.233.167.16","TLSv1.2","1187","Application Data"
"116","8.993107","64.233.167.16","10.152.152.11","TCP","60","465  >  39222 [ACK] Seq=4348 Ack=2159 Win=19664 Len=0"
"117","8.993122","64.233.167.16","10.152.152.11","TCP","60","465  >  39222 [ACK] Seq=4348 Ack=3292 Win=22592 Len=0"
"118","9.637537","64.233.164.16","10.152.152.11","TLSv1.2","341","Application Data"
"119","9.637664","10.152.152.11","64.233.164.16","TCP","54","49496  >  993 [ACK] Seq=247 Ack=973 Win=28212 Len=0"
"120","9.648310","64.233.164.16","10.152.152.11","TLSv1.2","1514","Application Data"
"121","9.648387","10.152.152.11","64.233.164.16","TCP","54","49496  >  993 [ACK] Seq=247 Ack=2433 Win=28173 Len=0"
"122","9.648427","64.233.164.16","10.152.152.11","TLSv1.2","1514","Application Data [TCP segment of a reassembled PDU]"
"123","9.648443","10.152.152.11","64.233.164.16","TCP","54","49496  >  993 [ACK] Seq=247 Ack=3893 Win=28103 Len=0"
"124","9.648472","64.233.164.16","10.152.152.11","TLSv1.2","620","Application Data [TCP segment of a reassembled PDU]"
"125","9.648487","10.152.152.11","64.233.164.16","TCP","54","49496  >  993 [ACK] Seq=247 Ack=4459 Win=28068 Len=0"
"126","9.709820","64.233.164.16","10.152.152.11","TLSv1.2","1514","Application Data [TCP segment of a reassembled PDU]"
"127","9.709844","10.152.152.11","64.233.164.16","TCP","54","49496  >  993 [ACK] Seq=247 Ack=5919 Win=28173 Len=0"
"128","9.709896","64.233.164.16","10.152.152.11","TLSv1.2","1514","Application Data [TCP segment of a reassembled PDU]"
"129","9.709909","10.152.152.11","64.233.164.16","TCP","54","49496  >  993 [ACK] Seq=247 Ack=7379 Win=28103 Len=0"
"130","9.709939","64.233.164.16","10.152.152.11","TLSv1.2","1206","Application Data [TCP segment of a reassembled PDU]"
"131","9.709951","10.152.152.11","64.233.164.16","TCP","54","49496  >  993 [ACK] Seq=247 Ack=8531 Win=28033 Len=0"
"132","9.710155","64.233.164.16","10.152.152.11","TLSv1.2","1514","Application Data [TCP segment of a reassembled PDU]"
"133","9.710169","10.152.152.11","64.233.164.16","TCP","54","49496  >  993 [ACK] Seq=247 Ack=9991 Win=27963 Len=0"
"134","9.710190","64.233.164.16","10.152.152.11","TCP","303","993  >  49496 [PSH, ACK] Seq=9991 Ack=247 Win=1181 Len=249 [TCP segment of a reassembled PDU]"
"135","9.710201","10.152.152.11","64.233.164.16","TCP","54","49496  >  993 [ACK] Seq=247 Ack=10240 Win=27948 Len=0"
"136","9.710456","64.233.164.16","10.152.152.11","TLSv1.2","552","Application Data [TCP segment of a reassembled PDU]"
"137","9.710474","10.152.152.11","64.233.164.16","TCP","54","49496  >  993 [ACK] Seq=247 Ack=10738 Win=27963 Len=0"
"138","9.756443","64.233.164.16","10.152.152.11","TLSv1.2","1514","Application Data [TCP segment of a reassembled PDU]"
"139","9.756472","10.152.152.11","64.233.164.16","TCP","54","49496  >  993 [ACK] Seq=247 Ack=12198 Win=28173 Len=0"
"140","9.756529","64.233.164.16","10.152.152.11","TLSv1.2","1514","Application Data [TCP segment of a reassembled PDU]"
"141","9.756537","10.152.152.11","64.233.164.16","TCP","54","49496  >  993 [ACK] Seq=247 Ack=13658 Win=28103 Len=0"
"142","9.756568","64.233.164.16","10.152.152.11","TCP","620","993  >  49496 [PSH, ACK] Seq=13658 Ack=247 Win=1181 Len=566 [TCP segment of a reassembled PDU]"
"143","9.756575","10.152.152.11","64.233.164.16","TCP","54","49496  >  993 [ACK] Seq=247 Ack=14224 Win=28068 Len=0"
"144","9.763588","64.233.164.16","10.152.152.11","TLSv1.2","293","Application Data"
"145","9.763599","10.152.152.11","64.233.164.16","TCP","54","49496  >  993 [ACK] Seq=247 Ack=14463 Win=28173 Len=0"
"146","9.774817","64.233.164.16","10.152.152.11","TLSv1.2","1514","Application Data"
"147","9.774851","10.152.152.11","64.233.164.16","TCP","54","49496  >  993 [ACK] Seq=247 Ack=15923 Win=28173 Len=0"
"148","9.774942","64.233.164.16","10.152.152.11","TLSv1.2","1514","Application Data, Application Data"
"149","9.774959","10.152.152.11","64.233.164.16","TCP","54","49496  >  993 [ACK] Seq=247 Ack=17383 Win=28103 Len=0"
"150","9.774989","64.233.164.16","10.152.152.11","TCP","1206","993  >  49496 [PSH, ACK] Seq=17383 Ack=247 Win=1181 Len=1152 [TCP segment of a reassembled PDU]"
"151","9.775137","64.233.164.16","10.152.152.11","TLSv1.2","1514","Application Data [TCP segment of a reassembled PDU]"
"152","9.775328","10.152.152.11","64.233.164.16","TCP","54","49496  >  993 [ACK] Seq=247 Ack=19995 Win=27963 Len=0"
"153","9.775693","64.233.164.16","10.152.152.11","TLSv1.2","806","Application Data [TCP segment of a reassembled PDU]"
"154","9.775887","10.152.152.11","64.233.164.16","TCP","54","49496  >  993 [ACK] Seq=247 Ack=20747 Win=28229 Len=0"
"155","9.820921","64.233.164.16","10.152.152.11","TLSv1.2","1514","Application Data [TCP segment of a reassembled PDU]"
"156","9.821008","64.233.164.16","10.152.152.11","TLSv1.2","1514","Application Data [TCP segment of a reassembled PDU]"
"157","9.821173","64.233.164.16","10.152.152.11","TLSv1.2","1118","Application Data [TCP segment of a reassembled PDU]"
"158","9.821284","10.152.152.11","64.233.164.16","TCP","54","49496  >  993 [ACK] Seq=247 Ack=24731 Win=28033 Len=0"
"159","9.822032","64.233.164.16","10.152.152.11","TLSv1.2","1514","Application Data [TCP segment of a reassembled PDU]"
"160","9.822146","64.233.164.16","10.152.152.11","TLSv1.2","1514","Application Data [TCP segment of a reassembled PDU]"
"161","9.822161","10.152.152.11","64.233.164.16","TCP","54","49496  >  993 [ACK] Seq=247 Ack=27651 Win=28033 Len=0"
"162","9.822225","64.233.164.16","10.152.152.11","TCP","620","993  >  49496 [PSH, ACK] Seq=27651 Ack=247 Win=1181 Len=566 [TCP segment of a reassembled PDU]"
"163","9.822716","10.152.152.11","64.233.164.16","TCP","54","49496  >  993 [ACK] Seq=247 Ack=28217 Win=28229 Len=0"
"164","9.839880","64.233.164.16","10.152.152.11","TLSv1.2","1514","Application Data [TCP segment of a reassembled PDU]"
"165","9.839938","64.233.164.16","10.152.152.11","TLSv1.2","1514","Application Data [TCP segment of a reassembled PDU]"
"166","9.840017","64.233.164.16","10.152.152.11","TLSv1.2","1118","Application Data [TCP segment of a reassembled PDU]"
"167","9.840039","10.152.152.11","64.233.164.16","TCP","54","49496  >  993 [ACK] Seq=247 Ack=32201 Win=28033 Len=0"
"168","9.840628","64.233.164.16","10.152.152.11","TLSv1.2","1050","Application Data [TCP segment of a reassembled PDU]"
"169","9.840799","10.152.152.11","64.233.164.16","TCP","54","49496  >  993 [ACK] Seq=247 Ack=33197 Win=28229 Len=0"
"170","9.841067","64.233.164.16","10.152.152.11","TLSv1.2","881","Application Data, Application Data"
"171","9.841511","10.152.152.11","64.233.164.16","TCP","54","49496  >  993 [ACK] Seq=247 Ack=34024 Win=28229 Len=0"
"172","9.879257","64.233.164.16","10.152.152.11","TLSv1.2","1514","Application Data"
"173","9.879305","64.233.164.16","10.152.152.11","TLSv1.2","1514","Application Data [TCP segment of a reassembled PDU]"
"174","9.879373","64.233.164.16","10.152.152.11","TCP","620","993  >  49496 [PSH, ACK] Seq=36944 Ack=247 Win=1181 Len=566 [TCP segment of a reassembled PDU]"
"175","9.879435","10.152.152.11","64.233.164.16","TCP","54","49496  >  993 [ACK] Seq=247 Ack=37510 Win=28033 Len=0"
"176","9.901170","64.233.164.16","10.152.152.11","TLSv1.2","1514","Application Data [TCP segment of a reassembled PDU]"
"177","9.901253","64.233.164.16","10.152.152.11","TLSv1.2","1514","Application Data [TCP segment of a reassembled PDU]"
"178","9.901277","10.152.152.11","64.233.164.16","TCP","54","49496  >  993 [ACK] Seq=247 Ack=40430 Win=28103 Len=0"
"179","9.901464","64.233.164.16","10.152.152.11","TLSv1.2","1118","Application Data [TCP segment of a reassembled PDU]"
"180","9.901746","10.152.152.11","64.233.164.16","TCP","54","49496  >  993 [ACK] Seq=247 Ack=41494 Win=28229 Len=0"
"181","9.902465","64.233.164.16","10.152.152.11","TLSv1.2","1514","Application Data [TCP segment of a reassembled PDU]"
"182","9.902550","64.233.164.16","10.152.152.11","TLSv1.2","1514","Application Data [TCP segment of a reassembled PDU]"
"183","9.902688","64.233.164.16","10.152.152.11","TLSv1.2","1118","Application Data [TCP segment of a reassembled PDU]"
"184","9.902735","10.152.152.11","64.233.164.16","TCP","54","49496  >  993 [ACK] Seq=247 Ack=45478 Win=28033 Len=0"
"185","9.905452","64.233.164.16","10.152.152.11","TLSv1.2","1514","Application Data [TCP segment of a reassembled PDU]"
"186","9.905542","64.233.164.16","10.152.152.11","TLSv1.2","1514","Application Data [TCP segment of a reassembled PDU]"
"187","9.905565","10.152.152.11","64.233.164.16","TCP","54","49496  >  993 [ACK] Seq=247 Ack=48398 Win=28103 Len=0"
"188","9.905761","64.233.164.16","10.152.152.11","TLSv1.2","1061","Application Data"
"189","9.905984","10.152.152.11","64.233.164.16","TCP","54","49496  >  993 [ACK] Seq=247 Ack=49405 Win=28229 Len=0"
"190","9.906265","64.233.164.16","10.152.152.11","TLSv1.2","1405","Application Data"
"191","9.906350","10.152.152.11","64.233.164.16","TCP","54","49496  >  993 [ACK] Seq=247 Ack=50756 Win=28229 Len=0"
"192","9.919764","64.233.164.16","10.152.152.11","TLSv1.2","1514","Application Data"
"193","9.919982","64.233.164.16","10.152.152.11","TLSv1.2","1514","Application Data [TCP segment of a reassembled PDU]"
"194","9.920058","64.233.164.16","10.152.152.11","TCP","1206","993  >  49496 [PSH, ACK] Seq=53676 Ack=247 Win=1181 Len=1152 [TCP segment of a reassembled PDU]"
"195","9.920133","10.152.152.11","64.233.164.16","TCP","54","49496  >  993 [ACK] Seq=247 Ack=54828 Win=28033 Len=0"
"196","9.920462","64.233.164.16","10.152.152.11","TLSv1.2","165","Application Data"
"197","9.920683","10.152.152.11","64.233.164.16","TCP","54","49496  >  993 [ACK] Seq=247 Ack=54939 Win=28229 Len=0"
"198","9.944351","64.233.164.16","10.152.152.11","TLSv1.2","1514","Application Data"
"199","9.944427","64.233.164.16","10.152.152.11","TLSv1.2","1514","Application Data [TCP segment of a reassembled PDU]"
"200","9.944438","64.233.164.16","10.152.152.11","TCP","620","993  >  49496 [PSH, ACK] Seq=57859 Ack=247 Win=1181 Len=566 [TCP segment of a reassembled PDU]"
"201","9.944559","10.152.152.11","64.233.164.16","TCP","54","49496  >  993 [ACK] Seq=247 Ack=58425 Win=28033 Len=0"
"202","9.995252","64.233.167.16","10.152.152.11","TLSv1.2","137","Application Data"
"203","9.995499","64.233.164.16","10.152.152.11","TLSv1.2","1514","Application Data [TCP segment of a reassembled PDU]"
"204","9.995517","64.233.164.16","10.152.152.11","TLSv1.2","1514","Application Data [TCP segment of a reassembled PDU]"
"205","9.995537","10.152.152.11","64.233.164.16","TCP","54","49496  >  993 [ACK] Seq=247 Ack=61345 Win=28103 Len=0"
"206","9.995916","64.233.164.16","10.152.152.11","TLSv1.2","1118","Application Data [TCP segment of a reassembled PDU]"
"207","9.996081","10.152.152.11","64.233.164.16","TCP","54","49496  >  993 [ACK] Seq=247 Ack=62409 Win=28229 Len=0"
"208","9.997213","64.233.164.16","10.152.152.11","TLSv1.2","1514","Application Data [TCP segment of a reassembled PDU]"
"209","9.997299","64.233.164.16","10.152.152.11","TLSv1.2","1514","Application Data [TCP segment of a reassembled PDU]"
"210","9.997447","10.152.152.11","64.233.164.16","TCP","54","49496  >  993 [ACK] Seq=247 Ack=65329 Win=28103 Len=0"
"211","9.997559","64.233.164.16","10.152.152.11","TLSv1.2","1118","Application Data [TCP segment of a reassembled PDU]"
"212","9.997966","10.152.152.11","64.233.164.16","TCP","54","49496  >  993 [ACK] Seq=247 Ack=66393 Win=28229 Len=0"
"213","9.998083","10.152.152.11","64.233.167.16","TLSv1.2","89","Application Data"
"214","9.998221","64.233.164.16","10.152.152.11","TLSv1.2","1180","Application Data, Application Data"
"215","9.998242","64.233.167.16","10.152.152.11","TCP","60","465  >  39222 [ACK] Seq=4431 Ack=3327 Win=22592 Len=0"
"216","9.998636","10.152.152.11","64.233.164.16","TCP","54","49496  >  993 [ACK] Seq=247 Ack=67519 Win=28229 Len=0"
"217","10.009024","64.233.164.16","10.152.152.11","TLSv1.2","1514","Application Data"
"218","10.009079","64.233.164.16","10.152.152.11","TLSv1.2","1426","Application Data"
"219","10.010137","10.152.152.11","64.233.164.16","TCP","54","49496  >  993 [ACK] Seq=247 Ack=70351 Win=28103 Len=0"
"220","10.012883","64.233.164.16","10.152.152.11","TLSv1.2","1514","Application Data"
"221","10.012936","64.233.164.16","10.152.152.11","TLSv1.2","1514","Application Data [TCP segment of a reassembled PDU]"
"222","10.012949","10.152.152.11","64.233.164.16","TCP","54","49496  >  993 [ACK] Seq=247 Ack=73271 Win=28103 Len=0"
"223","10.013039","64.233.164.16","10.152.152.11","TCP","620","993  >  49496 [PSH, ACK] Seq=73271 Ack=247 Win=1181 Len=566 [TCP segment of a reassembled PDU]"
"224","10.013156","10.152.152.11","64.233.164.16","TCP","54","49496  >  993 [ACK] Seq=247 Ack=73837 Win=28229 Len=0"
"225","10.048302","64.233.164.16","10.152.152.11","TLSv1.2","1514","Application Data [TCP segment of a reassembled PDU]"
"226","10.048513","64.233.164.16","10.152.152.11","TLSv1.2","1514","Application Data [TCP segment of a reassembled PDU]"
"227","10.048525","64.233.164.16","10.152.152.11","TLSv1.2","1118","Application Data [TCP segment of a reassembled PDU]"
"228","10.048680","10.152.152.11","64.233.164.16","TCP","54","49496  >  993 [ACK] Seq=247 Ack=77821 Win=28033 Len=0"
"229","10.049523","64.233.164.16","10.152.152.11","TLSv1.2","1514","Application Data [TCP segment of a reassembled PDU]"
"230","10.049631","64.233.164.16","10.152.152.11","TLSv1.2","1514","Application Data [TCP segment of a reassembled PDU]"
"231","10.049652","10.152.152.11","64.233.164.16","TCP","54","49496  >  993 [ACK] Seq=247 Ack=80741 Win=28103 Len=0"
"232","10.049798","64.233.164.16","10.152.152.11","TLSv1.2","1118","Application Data [TCP segment of a reassembled PDU]"
"233","10.050559","10.152.152.11","64.233.164.16","TCP","54","49496  >  993 [ACK] Seq=247 Ack=81805 Win=28229 Len=0"
"234","10.126849","64.233.164.16","10.152.152.11","TLSv1.2","1514","Application Data [TCP segment of a reassembled PDU]"
"235","10.126927","64.233.164.16","10.152.152.11","TLSv1.2","1514","Application Data [TCP segment of a reassembled PDU]"
"236","10.126939","64.233.164.16","10.152.152.11","TLSv1.2","1206","Application Data [TCP segment of a reassembled PDU]"
"237","10.127067","10.152.152.11","64.233.164.16","TCP","54","49496  >  993 [ACK] Seq=247 Ack=85877 Win=28033 Len=0"
"238","10.127347","64.233.164.16","10.152.152.11","TLSv1.2","1260","Application Data"
"239","10.127510","10.152.152.11","64.233.164.16","TCP","54","49496  >  993 [ACK] Seq=247 Ack=87083 Win=28229 Len=0"
"240","10.139452","64.233.164.16","10.152.152.11","TLSv1.2","1514","Application Data"
"241","10.139529","64.233.164.16","10.152.152.11","TLSv1.2","1514","Application Data [TCP segment of a reassembled PDU]"
"242","10.139762","64.233.164.16","10.152.152.11","TCP","620","993  >  49496 [PSH, ACK] Seq=90003 Ack=247 Win=1181 Len=566 [TCP segment of a reassembled PDU]"
"243","10.139885","10.152.152.11","64.233.164.16","TCP","54","49496  >  993 [ACK] Seq=247 Ack=90569 Win=28033 Len=0"
"244","10.254530","64.233.164.16","10.152.152.11","TLSv1.2","1514","Application Data [TCP segment of a reassembled PDU]"
"245","10.254580","64.233.164.16","10.152.152.11","TLSv1.2","1514","Application Data [TCP segment of a reassembled PDU]"
"246","10.254591","10.152.152.11","64.233.164.16","TCP","54","49496  >  993 [ACK] Seq=247 Ack=93489 Win=28103 Len=0"
"247","10.254618","64.233.164.16","10.152.152.11","TLSv1.2","620","Application Data [TCP segment of a reassembled PDU]"
"248","10.254911","10.152.152.11","64.233.164.16","TCP","54","49496  >  993 [ACK] Seq=247 Ack=94055 Win=28229 Len=0"
"249","10.258941","64.233.164.16","10.152.152.11","TLSv1.2","1514","Application Data [TCP segment of a reassembled PDU]"
"250","10.258983","64.233.164.16","10.152.152.11","TLSv1.2","1514","Application Data [TCP segment of a reassembled PDU]"
"251","10.259054","64.233.164.16","10.152.152.11","TCP","1118","993  >  49496 [PSH, ACK] Seq=96975 Ack=247 Win=1181 Len=1064 [TCP segment of a reassembled PDU]"
"252","10.259061","10.152.152.11","64.233.164.16","TCP","54","49496  >  993 [ACK] Seq=247 Ack=96975 Win=28103 Len=0"
"253","10.259234","10.152.152.11","64.233.164.16","TCP","54","49496  >  993 [ACK] Seq=247 Ack=98039 Win=28229 Len=0"
"254","10.259292","64.233.164.16","10.152.152.11","TLSv1.2","1514","Application Data [TCP segment of a reassembled PDU]"
"255","10.259357","64.233.164.16","10.152.152.11","TLSv1.2","1514","Application Data [TCP segment of a reassembled PDU]"
"256","10.259404","64.233.164.16","10.152.152.11","TLSv1.2","78","Application Data"
"257","10.259469","10.152.152.11","64.233.164.16","TCP","54","49496  >  993 [ACK] Seq=247 Ack=100983 Win=28081 Len=0"
"258","10.259768","64.233.164.16","10.152.152.11","TLSv1.2","1514","Application Data"
"259","10.259808","64.233.164.16","10.152.152.11","TLSv1.2","1514","Application Data [TCP segment of a reassembled PDU]"
"260","10.259815","10.152.152.11","64.233.164.16","TCP","54","49496  >  993 [ACK] Seq=247 Ack=103903 Win=28103 Len=0"
"261","10.259955","64.233.164.16","10.152.152.11","TCP","1206","993  >  49496 [PSH, ACK] Seq=103903 Ack=247 Win=1181 Len=1152 [TCP segment of a reassembled PDU]"
"262","10.260128","10.152.152.11","64.233.164.16","TCP","54","49496  >  993 [ACK] Seq=247 Ack=105055 Win=28229 Len=0"
"263","10.260216","64.233.164.16","10.152.152.11","TLSv1.2","1514","Application Data [TCP segment of a reassembled PDU]"
"264","10.260429","64.233.164.16","10.152.152.11","TLSv1.2","1514","Application Data [TCP segment of a reassembled PDU]"
"265","10.260464","64.233.164.16","10.152.152.11","TLSv1.2","1514","Application Data, Application Data"
"266","10.260468","64.233.164.16","10.152.152.11","TCP","488","993  >  49496 [PSH, ACK] Seq=109435 Ack=247 Win=1181 Len=434 [TCP segment of a reassembled PDU]"
"267","10.260552","10.152.152.11","64.233.164.16","TCP","54","49496  >  993 [ACK] Seq=247 Ack=109869 Win=27963 Len=0"
"268","10.287095","64.233.164.16","10.152.152.11","TLSv1.2","1514","Application Data [TCP segment of a reassembled PDU]"
"269","10.287175","64.233.164.16","10.152.152.11","TLSv1.2","1514","Application Data [TCP segment of a reassembled PDU]"
"270","10.287193","10.152.152.11","64.233.164.16","TCP","54","49496  >  993 [ACK] Seq=247 Ack=112789 Win=28103 Len=0"
"271","10.287226","64.233.164.16","10.152.152.11","TLSv1.2","1118","Application Data [TCP segment of a reassembled PDU]"
"272","10.287801","10.152.152.11","64.233.164.16","TCP","54","49496  >  993 [ACK] Seq=247 Ack=113853 Win=28229 Len=0"
"273","10.287916","64.233.164.16","10.152.152.11","TLSv1.2","1514","Application Data [TCP segment of a reassembled PDU]"
"274","10.288095","64.233.164.16","10.152.152.11","TLSv1.2","1514","Application Data [TCP segment of a reassembled PDU]"
"275","10.288186","10.152.152.11","64.233.164.16","TCP","54","49496  >  993 [ACK] Seq=247 Ack=116773 Win=28103 Len=0"
"276","10.288289","64.233.164.16","10.152.152.11","TLSv1.2","996","Application Data"
"277","10.288373","10.152.152.11","64.233.164.16","TCP","54","49496  >  993 [ACK] Seq=247 Ack=117715 Win=28229 Len=0"
"278","10.324092","64.233.164.16","10.152.152.11","TLSv1.2","1514","Application Data"
"279","10.324172","64.233.164.16","10.152.152.11","TLSv1.2","1514","Application Data [TCP segment of a reassembled PDU]"
"280","10.324182","64.233.164.16","10.152.152.11","TCP","1206","993  >  49496 [PSH, ACK] Seq=120635 Ack=247 Win=1181 Len=1152 [TCP segment of a reassembled PDU]"
"281","10.324290","64.233.164.16","10.152.152.11","TLSv1.2","1514","Application Data [TCP segment of a reassembled PDU]"
"282","10.324309","10.152.152.11","64.233.164.16","TCP","54","49496  >  993 [ACK] Seq=247 Ack=123247 Win=27963 Len=0"
"283","10.324481","64.233.164.16","10.152.152.11","TLSv1.2","1494","Application Data [TCP segment of a reassembled PDU]"
"284","10.324727","64.233.164.16","10.152.152.11","TLSv1.2","1514","Application Data, Application Data"
"285","10.324749","10.152.152.11","64.233.164.16","TCP","54","49496  >  993 [ACK] Seq=247 Ack=126147 Win=28103 Len=0"
"286","10.324773","64.233.164.16","10.152.152.11","TLSv1.2","1514","Application Data [TCP segment of a reassembled PDU]"
"287","10.324938","64.233.164.16","10.152.152.11","TCP","1118","993  >  49496 [PSH, ACK] Seq=127607 Ack=247 Win=1181 Len=1064 [TCP segment of a reassembled PDU]"
"288","10.324953","10.152.152.11","64.233.164.16","TCP","54","49496  >  993 [ACK] Seq=247 Ack=128671 Win=28103 Len=0"
"289","10.325530","64.233.164.16","10.152.152.11","TLSv1.2","1514","Application Data [TCP segment of a reassembled PDU]"
"290","10.325596","64.233.164.16","10.152.152.11","TLSv1.2","1514","Application Data [TCP segment of a reassembled PDU]"
"291","10.325608","10.152.152.11","64.233.164.16","TCP","54","49496  >  993 [ACK] Seq=247 Ack=131591 Win=28103 Len=0"
"292","10.325667","64.233.164.16","10.152.152.11","TLSv1.2","1118","Application Data [TCP segment of a reassembled PDU]"
"293","10.326055","10.152.152.11","64.233.164.16","TCP","54","49496  >  993 [ACK] Seq=247 Ack=132655 Win=28229 Len=0"
"294","10.326230","64.233.164.16","10.152.152.11","TLSv1.2","1050","Application Data [TCP segment of a reassembled PDU]"
"295","10.326393","10.152.152.11","64.233.164.16","TCP","54","49496  >  993 [ACK] Seq=247 Ack=133651 Win=28229 Len=0"
"296","10.326509","64.233.164.16","10.152.152.11","TLSv1.2","1514","Application Data, Application Data"
"297","10.326544","64.233.164.16","10.152.152.11","TLSv1.2","1514","Application Data [TCP segment of a reassembled PDU]"
"298","10.326603","64.233.164.16","10.152.152.11","TLSv1.2","1206","Application Data [TCP segment of a reassembled PDU]"
"299","10.326741","10.152.152.11","64.233.164.16","TCP","54","49496  >  993 [ACK] Seq=247 Ack=137723 Win=28033 Len=0"
"300","10.326977","64.233.164.16","10.152.152.11","TCP","295","993  >  49496 [PSH, ACK] Seq=137723 Ack=247 Win=1181 Len=241 [TCP segment of a reassembled PDU]"
"301","10.327194","10.152.152.11","64.233.164.16","TCP","54","49496  >  993 [ACK] Seq=247 Ack=137964 Win=28229 Len=0"
"302","10.327392","64.233.164.16","10.152.152.11","TLSv1.2","830","Application Data [TCP segment of a reassembled PDU]"
"303","10.327549","10.152.152.11","64.233.164.16","TCP","54","49496  >  993 [ACK] Seq=247 Ack=138740 Win=28229 Len=0"
"304","10.373894","64.233.164.16","10.152.152.11","TLSv1.2","1514","Application Data [TCP segment of a reassembled PDU]"
"305","10.373957","64.233.164.16","10.152.152.11","TLSv1.2","1514","Application Data [TCP segment of a reassembled PDU]"
"306","10.373965","64.233.164.16","10.152.152.11","TCP","1206","993  >  49496 [PSH, ACK] Seq=141660 Ack=247 Win=1181 Len=1152 [TCP segment of a reassembled PDU]"
"307","10.374066","10.152.152.11","64.233.164.16","TCP","54","49496  >  993 [ACK] Seq=247 Ack=142812 Win=28033 Len=0"
"308","10.374311","64.233.164.16","10.152.152.11","TLSv1.2","1502","Application Data, Application Data"
"309","10.374472","10.152.152.11","64.233.164.16","TCP","54","49496  >  993 [ACK] Seq=247 Ack=144260 Win=28229 Len=0"
"310","10.388563","64.233.164.16","10.152.152.11","TLSv1.2","1514","Application Data"
"311","10.388662","64.233.164.16","10.152.152.11","TLSv1.2","1514","Application Data [TCP segment of a reassembled PDU]"
"312","10.388672","64.233.164.16","10.152.152.11","TCP","1206","993  >  49496 [PSH, ACK] Seq=147180 Ack=247 Win=1181 Len=1152 [TCP segment of a reassembled PDU]"
"313","10.388882","10.152.152.11","64.233.164.16","TCP","54","49496  >  993 [ACK] Seq=247 Ack=148332 Win=28033 Len=0"
"314","10.389170","64.233.164.16","10.152.152.11","TLSv1.2","165","Application Data"
"315","10.389253","10.152.152.11","64.233.164.16","TCP","54","49496  >  993 [ACK] Seq=247 Ack=148443 Win=28229 Len=0"
"316","10.389435","64.233.164.16","10.152.152.11","TLSv1.2","1514","Application Data"
"317","10.389512","64.233.164.16","10.152.152.11","TLSv1.2","1361","Application Data"
"318","10.390157","10.152.152.11","64.233.164.16","TCP","54","49496  >  993 [ACK] Seq=247 Ack=151210 Win=28103 Len=0"
"319","10.401276","64.233.164.16","10.152.152.11","TLSv1.2","1514","Application Data"
"320","10.401361","64.233.164.16","10.152.152.11","TLSv1.2","1514","Application Data [TCP segment of a reassembled PDU]"
"321","10.401381","10.152.152.11","64.233.164.16","TCP","54","49496  >  993 [ACK] Seq=247 Ack=154130 Win=28103 Len=0"
"322","10.401433","64.233.164.16","10.152.152.11","TCP","1206","993  >  49496 [PSH, ACK] Seq=154130 Ack=247 Win=1181 Len=1152 [TCP segment of a reassembled PDU]"
"323","10.401940","10.152.152.11","64.233.164.16","TCP","54","49496  >  993 [ACK] Seq=247 Ack=155282 Win=28229 Len=0"
"324","10.402267","64.233.164.16","10.152.152.11","TLSv1.2","244","Application Data [TCP segment of a reassembled PDU]"
"325","10.402528","10.152.152.11","64.233.164.16","TCP","54","49496  >  993 [ACK] Seq=247 Ack=155472 Win=28229 Len=0"
"326","10.468433","64.233.164.16","10.152.152.11","TLSv1.2","1514","Application Data [TCP segment of a reassembled PDU]"
"327","10.468521","64.233.164.16","10.152.152.11","TLSv1.2","1514","Application Data [TCP segment of a reassembled PDU]"
"328","10.468535","64.233.164.16","10.152.152.11","TCP","620","993  >  49496 [PSH, ACK] Seq=158392 Ack=247 Win=1181 Len=566 [TCP segment of a reassembled PDU]"
"329","10.468656","64.233.167.16","10.152.152.11","TLSv1.2","142","Application Data"
"330","10.468772","10.152.152.11","64.233.164.16","TCP","54","49496  >  993 [ACK] Seq=247 Ack=158958 Win=28033 Len=0"
"331","10.479042","10.152.152.11","10.152.152.10","DNS","79","Standard query 0x164e A imap.googlemail.com"
"332","10.479091","10.152.152.11","10.152.152.10","DNS","79","Standard query 0xf63e AAAA imap.googlemail.com"
"333","10.479477","10.152.152.11","64.233.167.16","TLSv1.2","85","Encrypted Alert"
"334","10.479561","10.152.152.11","64.233.167.16","TCP","54","39222  >  465 [FIN, ACK] Seq=3358 Ack=4519 Win=29200 Len=0"
"335","10.479820","64.233.167.16","10.152.152.11","TCP","60","465  >  39222 [ACK] Seq=4519 Ack=3358 Win=22592 Len=0"
"336","10.480067","10.152.152.11","74.125.21.16","TLSv1.2","85","Encrypted Alert"
"337","10.480142","10.152.152.11","74.125.21.16","TCP","54","58788  >  993 [FIN, ACK] Seq=32 Ack=1 Win=2257 Len=0"
"338","10.480566","64.233.167.16","10.152.152.11","TCP","60","465  >  39222 [FIN, ACK] Seq=4519 Ack=3359 Win=22592 Len=0"
"339","10.480590","10.152.152.11","64.233.167.16","TCP","54","39222  >  465 [ACK] Seq=3359 Ack=4520 Win=29200 Len=0"
"340","10.485690","64.233.164.16","10.152.152.11","TLSv1.2","1514","Application Data [TCP segment of a reassembled PDU]"
"341","10.485730","64.233.164.16","10.152.152.11","TLSv1.2","1514","Application Data [TCP segment of a reassembled PDU]"
"342","10.485739","10.152.152.11","64.233.164.16","TCP","54","49496  >  993 [ACK] Seq=247 Ack=161878 Win=28103 Len=0"
"343","10.485816","64.233.164.16","10.152.152.11","TLSv1.2","584","Application Data"
"344","10.485993","10.152.152.11","64.233.164.16","TCP","54","49496  >  993 [ACK] Seq=247 Ack=162408 Win=28229 Len=0"
"345","10.489251","64.233.164.16","10.152.152.11","TLSv1.2","1514","Application Data"
"346","10.489697","64.233.164.16","10.152.152.11","TLSv1.2","1514","Application Data [TCP segment of a reassembled PDU]"
"347","10.489777","64.233.164.16","10.152.152.11","TCP","620","993  >  49496 [PSH, ACK] Seq=165328 Ack=247 Win=1181 Len=566 [TCP segment of a reassembled PDU]"
