"No.","Time","Source","Destination","Protocol","Length","Info"
"1","0.000000","10.152.152.11","64.233.167.16","TLSv1.2","1514","Ignored Unknown Record"
"2","0.002060","64.233.167.16","10.152.152.11","TCP","60","465  >  39233 [ACK] Seq=1 Ack=1461 Win=4204 Len=0"
"3","0.002077","10.152.152.11","64.233.167.16","TLSv1.2","1514","Ignored Unknown Record"
"4","0.002094","10.152.152.11","64.233.167.16","TLSv1.2","1514","Ignored Unknown Record"
"5","0.002111","10.152.152.11","64.233.167.16","TLSv1.2","1514","Ignored Unknown Record"
"6","0.002128","10.152.152.11","64.233.167.16","TLSv1.2","1514","Ignored Unknown Record"
"7","0.002146","10.152.152.11","64.233.167.16","TLSv1.2","1514","Ignored Unknown Record"
"8","0.002163","10.152.152.11","64.233.167.16","TCP","1514","[TCP segment of a reassembled PDU]"
"9","0.002181","10.152.152.11","64.233.167.16","TLSv1.2","1514","Ignored Unknown Record"
"10","0.002197","10.152.152.11","64.233.167.16","TLSv1.2","1514","Ignored Unknown Record"
"11","0.002213","10.152.152.11","64.233.167.16","TCP","1514","39233  >  465 [ACK] Seq=13141 Ack=1 Win=1047 Len=1460"
"12","0.002230","10.152.152.11","64.233.167.16","TLSv1.2","1514","Ignored Unknown Record"
"13","0.002249","10.152.152.11","64.233.167.16","TCP","1514","[TCP segment of a reassembled PDU]"
"14","0.002267","10.152.152.11","64.233.167.16","TLSv1.2","1514","Ignored Unknown Record"
"15","0.002283","10.152.152.11","64.233.167.16","TLSv1.2","1172","Ignored Unknown Record"
"16","0.002486","10.152.152.11","64.233.167.16","TCP","1514","39233  >  465 [ACK] Seq=20099 Ack=1 Win=1047 Len=1460 [TCP segment of a reassembled PDU]"
"17","0.002576","10.152.152.11","64.233.167.16","TCP","1514","39233  >  465 [ACK] Seq=21559 Ack=1 Win=1047 Len=1460 [TCP segment of a reassembled PDU]"
"18","0.002656","10.152.152.11","64.233.167.16","TCP","1514","39233  >  465 [ACK] Seq=23019 Ack=1 Win=1047 Len=1460 [TCP segment of a reassembled PDU]"
"19","0.002743","10.152.152.11","64.233.167.16","TCP","1514","39233  >  465 [ACK] Seq=24479 Ack=1 Win=1047 Len=1460 [TCP segment of a reassembled PDU]"
"20","0.002821","10.152.152.11","64.233.167.16","TCP","1514","39233  >  465 [ACK] Seq=25939 Ack=1 Win=1047 Len=1460 [TCP segment of a reassembled PDU]"
"21","0.004583","64.233.167.16","10.152.152.11","TCP","60","465  >  39233 [ACK] Seq=1 Ack=27399 Win=3784 Len=0"
"22","0.004620","10.152.152.11","64.233.167.16","TCP","1514","39233  >  465 [ACK] Seq=27399 Ack=1 Win=1047 Len=1460 [TCP segment of a reassembled PDU]"
"23","0.004637","10.152.152.11","64.233.167.16","TCP","1514","39233  >  465 [ACK] Seq=28859 Ack=1 Win=1047 Len=1460 [TCP segment of a reassembled PDU]"
"24","0.004654","10.152.152.11","64.233.167.16","TCP","1514","39233  >  465 [ACK] Seq=30319 Ack=1 Win=1047 Len=1460 [TCP segment of a reassembled PDU]"
"25","0.004673","10.152.152.11","64.233.167.16","TCP","1514","39233  >  465 [ACK] Seq=31779 Ack=1 Win=1047 Len=1460 [TCP segment of a reassembled PDU]"
"26","0.004689","10.152.152.11","64.233.167.16","TCP","1514","39233  >  465 [ACK] Seq=33239 Ack=1 Win=1047 Len=1460 [TCP segment of a reassembled PDU]"
"27","0.004708","10.152.152.11","64.233.167.16","TCP","1514","39233  >  465 [ACK] Seq=34699 Ack=1 Win=1047 Len=1460 [TCP segment of a reassembled PDU]"
"28","0.004753","10.152.152.11","64.233.167.16","TLSv1.2","1514","Application Data [TCP segment of a reassembled PDU]"
"29","0.004769","10.152.152.11","64.233.167.16","TCP","1514","39233  >  465 [ACK] Seq=37619 Ack=1 Win=1047 Len=1460 [TCP segment of a reassembled PDU]"
"30","0.004786","10.152.152.11","64.233.167.16","TCP","1514","39233  >  465 [ACK] Seq=39079 Ack=1 Win=1047 Len=1460 [TCP segment of a reassembled PDU]"
"31","0.004805","10.152.152.11","64.233.167.16","TCP","1514","39233  >  465 [ACK] Seq=40539 Ack=1 Win=1047 Len=1460 [TCP segment of a reassembled PDU]"
"32","0.004821","10.152.152.11","64.233.167.16","TCP","1514","39233  >  465 [ACK] Seq=41999 Ack=1 Win=1047 Len=1460 [TCP segment of a reassembled PDU]"
"33","0.004838","10.152.152.11","64.233.167.16","TCP","1514","39233  >  465 [ACK] Seq=43459 Ack=1 Win=1047 Len=1460 [TCP segment of a reassembled PDU]"
"34","0.004879","10.152.152.11","64.233.167.16","TCP","1514","39233  >  465 [ACK] Seq=44919 Ack=1 Win=1047 Len=1460 [TCP segment of a reassembled PDU]"
"35","0.004898","10.152.152.11","64.233.167.16","TCP","1514","39233  >  465 [ACK] Seq=46379 Ack=1 Win=1047 Len=1460 [TCP segment of a reassembled PDU]"
"36","0.004916","10.152.152.11","64.233.167.16","TCP","1514","39233  >  465 [PSH, ACK] Seq=47839 Ack=1 Win=1047 Len=1460 [TCP segment of a reassembled PDU]"
"37","0.005031","10.152.152.11","64.233.167.16","TCP","1514","39233  >  465 [ACK] Seq=49299 Ack=1 Win=1047 Len=1460 [TCP segment of a reassembled PDU]"
"38","0.005072","10.152.152.11","64.233.167.16","TCP","1514","39233  >  465 [ACK] Seq=50759 Ack=1 Win=1047 Len=1460 [TCP segment of a reassembled PDU]"
"39","0.005109","10.152.152.11","64.233.167.16","TLSv1.2","758","Application Data"
"40","0.008147","64.233.167.16","10.152.152.11","TCP","60","465  >  39233 [ACK] Seq=1 Ack=52923 Win=3294 Len=0"
"41","0.008192","10.152.152.11","64.233.167.16","TLSv1.2","1514","Application Data"
"42","0.008212","10.152.152.11","64.233.167.16","TCP","1514","39233  >  465 [ACK] Seq=54383 Ack=1 Win=1047 Len=1460 [TCP segment of a reassembled PDU]"
"43","0.008233","10.152.152.11","64.233.167.16","TCP","1514","39233  >  465 [ACK] Seq=55843 Ack=1 Win=1047 Len=1460 [TCP segment of a reassembled PDU]"
"44","0.008250","10.152.152.11","64.233.167.16","TCP","1514","39233  >  465 [ACK] Seq=57303 Ack=1 Win=1047 Len=1460 [TCP segment of a reassembled PDU]"
"45","0.008268","10.152.152.11","64.233.167.16","TCP","1514","39233  >  465 [ACK] Seq=58763 Ack=1 Win=1047 Len=1460 [TCP segment of a reassembled PDU]"
"46","0.008333","10.152.152.11","64.233.167.16","TCP","1514","39233  >  465 [ACK] Seq=60223 Ack=1 Win=1047 Len=1460 [TCP segment of a reassembled PDU]"
"47","0.008352","10.152.152.11","64.233.167.16","TCP","1514","39233  >  465 [ACK] Seq=61683 Ack=1 Win=1047 Len=1460 [TCP segment of a reassembled PDU]"
"48","0.008369","10.152.152.11","64.233.167.16","TCP","1514","39233  >  465 [ACK] Seq=63143 Ack=1 Win=1047 Len=1460 [TCP segment of a reassembled PDU]"
"49","0.008412","10.152.152.11","64.233.167.16","TCP","1514","39233  >  465 [ACK] Seq=64603 Ack=1 Win=1047 Len=1460 [TCP segment of a reassembled PDU]"
"50","0.008433","10.152.152.11","64.233.167.16","TCP","1514","39233  >  465 [ACK] Seq=66063 Ack=1 Win=1047 Len=1460 [TCP segment of a reassembled PDU]"
"51","0.008451","10.152.152.11","64.233.167.16","TCP","1514","39233  >  465 [ACK] Seq=67523 Ack=1 Win=1047 Len=1460 [TCP segment of a reassembled PDU]"
"52","0.008471","10.152.152.11","64.233.167.16","TLSv1.2","1514","Application Data [TCP segment of a reassembled PDU]"
"53","0.008513","10.152.152.11","64.233.167.16","TCP","1514","39233  >  465 [ACK] Seq=70443 Ack=1 Win=1047 Len=1460 [TCP segment of a reassembled PDU]"
"54","0.008532","10.152.152.11","64.233.167.16","TCP","1514","39233  >  465 [ACK] Seq=71903 Ack=1 Win=1047 Len=1460 [TCP segment of a reassembled PDU]"
"55","0.008548","10.152.152.11","64.233.167.16","TCP","1514","39233  >  465 [ACK] Seq=73363 Ack=1 Win=1047 Len=1460 [TCP segment of a reassembled PDU]"
"56","0.008574","10.152.152.11","64.233.167.16","TCP","1514","39233  >  465 [ACK] Seq=74823 Ack=1 Win=1047 Len=1460 [TCP segment of a reassembled PDU]"
"57","0.008698","10.152.152.11","64.233.167.16","TCP","1514","39233  >  465 [PSH, ACK] Seq=76283 Ack=1 Win=1047 Len=1460 [TCP segment of a reassembled PDU]"
"58","0.008760","10.152.152.11","64.233.167.16","TCP","1514","39233  >  465 [ACK] Seq=77743 Ack=1 Win=1047 Len=1460 [TCP segment of a reassembled PDU]"
"59","0.010937","64.233.167.16","10.152.152.11","TCP","60","465  >  39233 [ACK] Seq=1 Ack=79203 Win=2874 Len=0"
"60","0.010956","10.152.152.11","64.233.167.16","TCP","1514","39233  >  465 [ACK] Seq=79203 Ack=1 Win=1047 Len=1460 [TCP segment of a reassembled PDU]"
"61","0.010975","10.152.152.11","64.233.167.16","TCP","1514","39233  >  465 [ACK] Seq=80663 Ack=1 Win=1047 Len=1460 [TCP segment of a reassembled PDU]"
"62","0.010995","10.152.152.11","64.233.167.16","TCP","1514","39233  >  465 [ACK] Seq=82123 Ack=1 Win=1047 Len=1460 [TCP segment of a reassembled PDU]"
"63","0.011014","10.152.152.11","64.233.167.16","TCP","1514","39233  >  465 [ACK] Seq=83583 Ack=1 Win=1047 Len=1460 [TCP segment of a reassembled PDU]"
"64","0.011030","10.152.152.11","64.233.167.16","TLSv1.2","1514","Application Data, Application Data"
"65","0.011046","10.152.152.11","64.233.167.16","TCP","1514","39233  >  465 [ACK] Seq=86503 Ack=1 Win=1047 Len=1460 [TCP segment of a reassembled PDU]"
"66","0.011064","10.152.152.11","64.233.167.16","TCP","1514","39233  >  465 [ACK] Seq=87963 Ack=1 Win=1047 Len=1460 [TCP segment of a reassembled PDU]"
"67","0.011082","10.152.152.11","64.233.167.16","TCP","1514","39233  >  465 [ACK] Seq=89423 Ack=1 Win=1047 Len=1460 [TCP segment of a reassembled PDU]"
"68","0.011100","10.152.152.11","64.233.167.16","TCP","1514","39233  >  465 [ACK] Seq=90883 Ack=1 Win=1047 Len=1460 [TCP segment of a reassembled PDU]"
"69","0.011118","10.152.152.11","64.233.167.16","TCP","1514","39233  >  465 [ACK] Seq=92343 Ack=1 Win=1047 Len=1460 [TCP segment of a reassembled PDU]"
"70","0.011136","10.152.152.11","64.233.167.16","TCP","1514","39233  >  465 [ACK] Seq=93803 Ack=1 Win=1047 Len=1460 [TCP segment of a reassembled PDU]"
"71","0.011152","10.152.152.11","64.233.167.16","TCP","1514","39233  >  465 [ACK] Seq=95263 Ack=1 Win=1047 Len=1460 [TCP segment of a reassembled PDU]"
"72","0.011170","10.152.152.11","64.233.167.16","TCP","1514","39233  >  465 [ACK] Seq=96723 Ack=1 Win=1047 Len=1460 [TCP segment of a reassembled PDU]"
"73","0.011187","10.152.152.11","64.233.167.16","TCP","1514","39233  >  465 [ACK] Seq=98183 Ack=1 Win=1047 Len=1460 [TCP segment of a reassembled PDU]"
"74","0.011203","10.152.152.11","64.233.167.16","TCP","1514","39233  >  465 [ACK] Seq=99643 Ack=1 Win=1047 Len=1460 [TCP segment of a reassembled PDU]"
"75","0.011220","10.152.152.11","64.233.167.16","TLSv1.2","1514","Application Data [TCP segment of a reassembled PDU]"
"76","0.011319","10.152.152.11","64.233.167.16","TCP","1514","39233  >  465 [PSH, ACK] Seq=102563 Ack=1 Win=1047 Len=1460 [TCP segment of a reassembled PDU]"
"77","0.011378","10.152.152.11","64.233.167.16","TCP","1514","39233  >  465 [ACK] Seq=104023 Ack=1 Win=1047 Len=1460 [TCP segment of a reassembled PDU]"
"78","0.011435","10.152.152.11","64.233.167.16","TCP","1514","39233  >  465 [ACK] Seq=105483 Ack=1 Win=1047 Len=1460 [TCP segment of a reassembled PDU]"
"79","0.050872","64.233.167.16","10.152.152.11","TCP","60","465  >  39233 [ACK] Seq=1 Ack=106943 Win=1544 Len=0"
"80","0.050904","10.152.152.11","64.233.167.16","TCP","1514","39233  >  465 [ACK] Seq=106943 Ack=1 Win=1047 Len=1460 [TCP segment of a reassembled PDU]"
"81","0.050921","10.152.152.11","64.233.167.16","TCP","1514","39233  >  465 [ACK] Seq=108403 Ack=1 Win=1047 Len=1460 [TCP segment of a reassembled PDU]"
"82","0.050933","10.152.152.11","64.233.167.16","TCP","1514","39233  >  465 [ACK] Seq=109863 Ack=1 Win=1047 Len=1460 [TCP segment of a reassembled PDU]"
"83","0.050943","10.152.152.11","64.233.167.16","TCP","1514","39233  >  465 [ACK] Seq=111323 Ack=1 Win=1047 Len=1460 [TCP segment of a reassembled PDU]"
"84","0.050953","10.152.152.11","64.233.167.16","TCP","1514","39233  >  465 [ACK] Seq=112783 Ack=1 Win=1047 Len=1460 [TCP segment of a reassembled PDU]"
"85","0.050966","10.152.152.11","64.233.167.16","TCP","1514","39233  >  465 [ACK] Seq=114243 Ack=1 Win=1047 Len=1460 [TCP segment of a reassembled PDU]"
"86","0.050978","10.152.152.11","64.233.167.16","TCP","1514","39233  >  465 [ACK] Seq=115703 Ack=1 Win=1047 Len=1460 [TCP segment of a reassembled PDU]"
"87","0.050990","10.152.152.11","64.233.167.16","TCP","1514","39233  >  465 [ACK] Seq=117163 Ack=1 Win=1047 Len=1460 [TCP segment of a reassembled PDU]"
"88","0.051000","10.152.152.11","64.233.167.16","TLSv1.2","1514","Application Data, Application Data"
"89","0.051011","10.152.152.11","64.233.167.16","TCP","1514","39233  >  465 [ACK] Seq=120083 Ack=1 Win=1047 Len=1460 [TCP segment of a reassembled PDU]"
"90","0.051022","10.152.152.11","64.233.167.16","TCP","1514","39233  >  465 [ACK] Seq=121543 Ack=1 Win=1047 Len=1460 [TCP segment of a reassembled PDU]"
"91","0.051032","10.152.152.11","64.233.167.16","TCP","1514","39233  >  465 [ACK] Seq=123003 Ack=1 Win=1047 Len=1460 [TCP segment of a reassembled PDU]"
"92","0.051043","10.152.152.11","64.233.167.16","TCP","1514","39233  >  465 [ACK] Seq=124463 Ack=1 Win=1047 Len=1460 [TCP segment of a reassembled PDU]"
"93","0.051053","10.152.152.11","64.233.167.16","TCP","1514","39233  >  465 [ACK] Seq=125923 Ack=1 Win=1047 Len=1460 [TCP segment of a reassembled PDU]"
"94","0.051064","10.152.152.11","64.233.167.16","TCP","1514","39233  >  465 [ACK] Seq=127383 Ack=1 Win=1047 Len=1460 [TCP segment of a reassembled PDU]"
"95","0.051077","10.152.152.11","64.233.167.16","TCP","1514","39233  >  465 [ACK] Seq=128843 Ack=1 Win=1047 Len=1460 [TCP segment of a reassembled PDU]"
"96","0.058763","64.233.164.16","10.152.152.11","TLSv1.2","101","Application Data"
"97","0.058838","10.152.152.11","64.233.164.16","TCP","54","49496  >  993 [ACK] Seq=1 Ack=48 Win=28227 Len=0"
"98","0.066241","10.152.152.11","64.233.164.16","TLSv1.2","91","Application Data"
"99","0.066773","64.233.164.16","10.152.152.11","TCP","60","993  >  49496 [ACK] Seq=48 Ack=38 Win=1181 Len=0"
"100","0.090954","64.233.167.16","10.152.152.11","TCP","60","465  >  39233 [ACK] Seq=1 Ack=130303 Win=424 Len=0"
"101","0.091002","10.152.152.11","64.233.167.16","TCP","1514","39233  >  465 [ACK] Seq=130303 Ack=1 Win=1047 Len=1460 [TCP segment of a reassembled PDU]"
"102","0.091037","10.152.152.11","64.233.167.16","TCP","1514","39233  >  465 [PSH, ACK] Seq=131763 Ack=1 Win=1047 Len=1460 [TCP segment of a reassembled PDU]"
"103","0.091060","10.152.152.11","64.233.167.16","TCP","1514","39233  >  465 [ACK] Seq=133223 Ack=1 Win=1047 Len=1460 [TCP segment of a reassembled PDU]"
"104","0.091082","10.152.152.11","64.233.167.16","TLSv1.2","1514","Application Data [TCP segment of a reassembled PDU]"
"105","0.130961","64.233.167.16","10.152.152.11","TCP","60","465  >  39233 [ACK] Seq=1 Ack=136143 Win=144 Len=0"
"106","0.131006","10.152.152.11","64.233.167.16","TCP","1514","39233  >  465 [ACK] Seq=136143 Ack=1 Win=1047 Len=1460 [TCP segment of a reassembled PDU]"
"107","0.171070","64.233.167.16","10.152.152.11","TCP","60","465  >  39233 [ACK] Seq=1 Ack=137603 Win=53 Len=0"
"108","0.386661","10.152.152.11","64.233.167.16","TCP","902","39233  >  465 [PSH, ACK] Seq=137603 Ack=1 Win=1047 Len=848 [TCP segment of a reassembled PDU]"
"109","0.387136","64.233.167.16","10.152.152.11","TCP","60","[TCP ZeroWindow] 465  >  39233 [ACK] Seq=1 Ack=138451 Win=0 Len=0"
"110","0.448191","64.233.167.16","10.152.152.11","TCP","60","[TCP Window Update] 465  >  39233 [ACK] Seq=1 Ack=138451 Win=774 Len=0"
"111","0.448221","10.152.152.11","64.233.167.16","TCP","666","39233  >  465 [PSH, ACK] Seq=138451 Ack=1 Win=1047 Len=612 [TCP segment of a reassembled PDU]"
"112","0.448259","10.152.152.11","64.233.167.16","TCP","1514","39233  >  465 [ACK] Seq=139063 Ack=1 Win=1047 Len=1460 [TCP segment of a reassembled PDU]"
"113","0.448284","10.152.152.11","64.233.167.16","TCP","1514","39233  >  465 [ACK] Seq=140523 Ack=1 Win=1047 Len=1460 [TCP segment of a reassembled PDU]"
"114","0.448307","10.152.152.11","64.233.167.16","TCP","1514","39233  >  465 [ACK] Seq=141983 Ack=1 Win=1047 Len=1460 [TCP segment of a reassembled PDU]"
"115","0.448331","10.152.152.11","64.233.167.16","TCP","1514","39233  >  465 [ACK] Seq=143443 Ack=1 Win=1047 Len=1460 [TCP segment of a reassembled PDU]"
"116","0.448354","10.152.152.11","64.233.167.16","TCP","1514","39233  >  465 [ACK] Seq=144903 Ack=1 Win=1047 Len=1460 [TCP segment of a reassembled PDU]"
"117","0.448377","10.152.152.11","64.233.167.16","TCP","1514","39233  >  465 [ACK] Seq=146363 Ack=1 Win=1047 Len=1460 [TCP segment of a reassembled PDU]"
"118","0.448401","10.152.152.11","64.233.167.16","TCP","1514","39233  >  465 [ACK] Seq=147823 Ack=1 Win=1047 Len=1460 [TCP segment of a reassembled PDU]"
"119","0.448424","10.152.152.11","64.233.167.16","TCP","1514","39233  >  465 [ACK] Seq=149283 Ack=1 Win=1047 Len=1460 [TCP segment of a reassembled PDU]"
"120","0.452607","64.233.167.16","10.152.152.11","TCP","60","465  >  39233 [ACK] Seq=1 Ack=150743 Win=914 Len=0"
"121","0.452627","10.152.152.11","64.233.167.16","TLSv1.2","1514","Application Data [TCP segment of a reassembled PDU]"
"122","0.452642","10.152.152.11","64.233.167.16","TCP","1514","39233  >  465 [ACK] Seq=152203 Ack=1 Win=1047 Len=1460 [TCP segment of a reassembled PDU]"
"123","0.452653","10.152.152.11","64.233.167.16","TCP","1514","39233  >  465 [ACK] Seq=153663 Ack=1 Win=1047 Len=1460 [TCP segment of a reassembled PDU]"
"124","0.452664","10.152.152.11","64.233.167.16","TCP","1514","39233  >  465 [ACK] Seq=155123 Ack=1 Win=1047 Len=1460 [TCP segment of a reassembled PDU]"
"125","0.452675","10.152.152.11","64.233.167.16","TCP","1514","39233  >  465 [ACK] Seq=156583 Ack=1 Win=1047 Len=1460 [TCP segment of a reassembled PDU]"
"126","0.452686","10.152.152.11","64.233.167.16","TCP","1514","39233  >  465 [ACK] Seq=158043 Ack=1 Win=1047 Len=1460 [TCP segment of a reassembled PDU]"
"127","0.452696","10.152.152.11","64.233.167.16","TCP","1514","39233  >  465 [PSH, ACK] Seq=159503 Ack=1 Win=1047 Len=1460 [TCP segment of a reassembled PDU]"
"128","0.452707","10.152.152.11","64.233.167.16","TCP","1514","39233  >  465 [ACK] Seq=160963 Ack=1 Win=1047 Len=1460 [TCP segment of a reassembled PDU]"
"129","0.452718","10.152.152.11","64.233.167.16","TCP","1514","39233  >  465 [ACK] Seq=162423 Ack=1 Win=1047 Len=1460 [TCP segment of a reassembled PDU]"
"130","0.452729","10.152.152.11","64.233.167.16","TCP","1514","39233  >  465 [ACK] Seq=163883 Ack=1 Win=1047 Len=1460 [TCP segment of a reassembled PDU]"
"131","0.491684","64.233.167.16","10.152.152.11","TCP","60","465  >  39233 [ACK] Seq=1 Ack=165343 Win=214 Len=0"
"132","0.491903","10.152.152.11","64.233.167.16","TCP","1514","39233  >  465 [ACK] Seq=165343 Ack=1 Win=1047 Len=1460 [TCP segment of a reassembled PDU]"
"133","0.491940","10.152.152.11","64.233.167.16","TLSv1.2","1514","Application Data [TCP segment of a reassembled PDU]"
"134","0.531753","64.233.167.16","10.152.152.11","TCP","60","465  >  39233 [ACK] Seq=1 Ack=168263 Win=32 Len=0"
"135","0.643370","64.233.167.16","10.152.152.11","TCP","60","[TCP Window Update] 465  >  39233 [ACK] Seq=1 Ack=168263 Win=914 Len=0"
"136","0.643401","10.152.152.11","64.233.167.16","TCP","1514","39233  >  465 [ACK] Seq=168263 Ack=1 Win=1047 Len=1460 [TCP segment of a reassembled PDU]"
"137","0.643439","10.152.152.11","64.233.167.16","TCP","1514","39233  >  465 [ACK] Seq=169723 Ack=1 Win=1047 Len=1460 [TCP segment of a reassembled PDU]"
"138","0.643463","10.152.152.11","64.233.167.16","TCP","1514","39233  >  465 [ACK] Seq=171183 Ack=1 Win=1047 Len=1460 [TCP segment of a reassembled PDU]"
"139","0.643487","10.152.152.11","64.233.167.16","TCP","1514","39233  >  465 [ACK] Seq=172643 Ack=1 Win=1047 Len=1460 [TCP segment of a reassembled PDU]"
"140","0.643511","10.152.152.11","64.233.167.16","TCP","1514","39233  >  465 [ACK] Seq=174103 Ack=1 Win=1047 Len=1460 [TCP segment of a reassembled PDU]"
"141","0.643534","10.152.152.11","64.233.167.16","TCP","1514","39233  >  465 [ACK] Seq=175563 Ack=1 Win=1047 Len=1460 [TCP segment of a reassembled PDU]"
"142","0.643558","10.152.152.11","64.233.167.16","TCP","1514","39233  >  465 [ACK] Seq=177023 Ack=1 Win=1047 Len=1460 [TCP segment of a reassembled PDU]"
"143","0.643582","10.152.152.11","64.233.167.16","TCP","1514","39233  >  465 [ACK] Seq=178483 Ack=1 Win=1047 Len=1460 [TCP segment of a reassembled PDU]"
"144","0.643606","10.152.152.11","64.233.167.16","TCP","1514","39233  >  465 [ACK] Seq=179943 Ack=1 Win=1047 Len=1460 [TCP segment of a reassembled PDU]"
"145","0.643630","10.152.152.11","64.233.167.16","TCP","1514","39233  >  465 [ACK] Seq=181403 Ack=1 Win=1047 Len=1460 [TCP segment of a reassembled PDU]"
"146","0.683093","64.233.167.16","10.152.152.11","TCP","60","465  >  39233 [ACK] Seq=1 Ack=182863 Win=214 Len=0"
"147","0.683177","10.152.152.11","64.233.167.16","TLSv1.2","1514","Application Data [TCP segment of a reassembled PDU]"
"148","0.683215","10.152.152.11","64.233.167.16","TLSv1.2","1514","Application Data [TCP segment of a reassembled PDU]"
"149","0.723101","64.233.167.16","10.152.152.11","TCP","60","465  >  39233 [ACK] Seq=1 Ack=185783 Win=32 Len=0"
"150","0.782631","64.233.164.16","10.152.152.11","TLSv1.2","115","Application Data"
"151","0.784401","10.152.152.11","64.233.164.16","TLSv1.2","95","Application Data"
"152","0.784866","64.233.164.16","10.152.152.11","TCP","60","993  >  49496 [ACK] Seq=109 Ack=79 Win=1181 Len=0"
"153","0.851420","64.233.167.16","10.152.152.11","TCP","60","[TCP Window Update] 465  >  39233 [ACK] Seq=1 Ack=185783 Win=844 Len=0"
"154","0.851505","10.152.152.11","64.233.167.16","TCP","1514","39233  >  465 [PSH, ACK] Seq=185783 Ack=1 Win=1047 Len=1460 [TCP segment of a reassembled PDU]"
"155","0.851554","10.152.152.11","64.233.167.16","TCP","1514","39233  >  465 [ACK] Seq=187243 Ack=1 Win=1047 Len=1460 [TCP segment of a reassembled PDU]"
"156","0.851773","10.152.152.11","64.233.167.16","TCP","1514","39233  >  465 [ACK] Seq=188703 Ack=1 Win=1047 Len=1460 [TCP segment of a reassembled PDU]"
"157","0.851818","10.152.152.11","64.233.167.16","TCP","1514","39233  >  465 [ACK] Seq=190163 Ack=1 Win=1047 Len=1460 [TCP segment of a reassembled PDU]"
"158","0.851853","10.152.152.11","64.233.167.16","TCP","1514","39233  >  465 [ACK] Seq=191623 Ack=1 Win=1047 Len=1460 [TCP segment of a reassembled PDU]"
"159","0.851891","10.152.152.11","64.233.167.16","TCP","1514","39233  >  465 [ACK] Seq=193083 Ack=1 Win=1047 Len=1460 [TCP segment of a reassembled PDU]"
"160","0.851927","10.152.152.11","64.233.167.16","TCP","1514","39233  >  465 [ACK] Seq=194543 Ack=1 Win=1047 Len=1460 [TCP segment of a reassembled PDU]"
"161","0.852052","10.152.152.11","64.233.167.16","TCP","1514","39233  >  465 [ACK] Seq=196003 Ack=1 Win=1047 Len=1460 [TCP segment of a reassembled PDU]"
"162","0.852088","10.152.152.11","64.233.167.16","TCP","1514","39233  >  465 [ACK] Seq=197463 Ack=1 Win=1047 Len=1460 [TCP segment of a reassembled PDU]"
"163","0.857353","64.233.167.16","10.152.152.11","TCP","60","465  >  39233 [ACK] Seq=1 Ack=198923 Win=984 Len=0"
"164","0.857391","10.152.152.11","64.233.167.16","TCP","1514","39233  >  465 [ACK] Seq=198923 Ack=1 Win=1047 Len=1460 [TCP segment of a reassembled PDU]"
"165","0.857426","10.152.152.11","64.233.167.16","TLSv1.2","1514","Application Data [TCP segment of a reassembled PDU]"
"166","0.857450","10.152.152.11","64.233.167.16","TCP","1514","39233  >  465 [ACK] Seq=201843 Ack=1 Win=1047 Len=1460 [TCP segment of a reassembled PDU]"
"167","0.857474","10.152.152.11","64.233.167.16","TCP","1514","39233  >  465 [ACK] Seq=203303 Ack=1 Win=1047 Len=1460 [TCP segment of a reassembled PDU]"
"168","0.857498","10.152.152.11","64.233.167.16","TCP","1514","39233  >  465 [ACK] Seq=204763 Ack=1 Win=1047 Len=1460 [TCP segment of a reassembled PDU]"
"169","0.857523","10.152.152.11","64.233.167.16","TCP","1514","39233  >  465 [PSH, ACK] Seq=206223 Ack=1 Win=1047 Len=1460 [TCP segment of a reassembled PDU]"
"170","0.857547","10.152.152.11","64.233.167.16","TCP","1514","39233  >  465 [ACK] Seq=207683 Ack=1 Win=1047 Len=1460 [TCP segment of a reassembled PDU]"
"171","0.857570","10.152.152.11","64.233.167.16","TCP","1514","39233  >  465 [ACK] Seq=209143 Ack=1 Win=1047 Len=1460 [TCP segment of a reassembled PDU]"
"172","0.857594","10.152.152.11","64.233.167.16","TCP","1514","39233  >  465 [ACK] Seq=210603 Ack=1 Win=1047 Len=1460 [TCP segment of a reassembled PDU]"
"173","0.857617","10.152.152.11","64.233.167.16","TCP","1514","39233  >  465 [ACK] Seq=212063 Ack=1 Win=1047 Len=1460 [TCP segment of a reassembled PDU]"
"174","0.895307","64.233.167.16","10.152.152.11","TCP","60","465  >  39233 [ACK] Seq=1 Ack=213523 Win=284 Len=0"
"175","0.895364","10.152.152.11","64.233.167.16","TCP","1514","39233  >  465 [ACK] Seq=213523 Ack=1 Win=1047 Len=1460 [TCP segment of a reassembled PDU]"
"176","0.895401","10.152.152.11","64.233.167.16","TCP","1514","39233  >  465 [ACK] Seq=214983 Ack=1 Win=1047 Len=1460 [TCP segment of a reassembled PDU]"
"177","0.895425","10.152.152.11","64.233.167.16","TLSv1.2","1514","Application Data, Application Data"
"178","0.935809","64.233.167.16","10.152.152.11","TCP","60","465  >  39233 [ACK] Seq=1 Ack=217903 Win=11 Len=0"
"179","0.995221","64.233.167.16","10.152.152.11","TCP","60","[TCP Window Update] 465  >  39233 [ACK] Seq=1 Ack=217903 Win=914 Len=0"
"180","0.995256","10.152.152.11","64.233.167.16","TCP","1514","39233  >  465 [ACK] Seq=217903 Ack=1 Win=1047 Len=1460 [TCP segment of a reassembled PDU]"
"181","0.995295","10.152.152.11","64.233.167.16","TCP","1514","39233  >  465 [ACK] Seq=219363 Ack=1 Win=1047 Len=1460 [TCP segment of a reassembled PDU]"
"182","0.995320","10.152.152.11","64.233.167.16","TCP","1514","39233  >  465 [ACK] Seq=220823 Ack=1 Win=1047 Len=1460 [TCP segment of a reassembled PDU]"
"183","0.995344","10.152.152.11","64.233.167.16","TCP","1514","39233  >  465 [ACK] Seq=222283 Ack=1 Win=1047 Len=1460 [TCP segment of a reassembled PDU]"
"184","0.995368","10.152.152.11","64.233.167.16","TCP","1514","39233  >  465 [ACK] Seq=223743 Ack=1 Win=1047 Len=1460 [TCP segment of a reassembled PDU]"
"185","0.995391","10.152.152.11","64.233.167.16","TCP","1514","39233  >  465 [ACK] Seq=225203 Ack=1 Win=1047 Len=1460 [TCP segment of a reassembled PDU]"
"186","0.995415","10.152.152.11","64.233.167.16","TCP","1514","39233  >  465 [ACK] Seq=226663 Ack=1 Win=1047 Len=1460 [TCP segment of a reassembled PDU]"
"187","0.995438","10.152.152.11","64.233.167.16","TCP","1514","39233  >  465 [ACK] Seq=228123 Ack=1 Win=1047 Len=1460 [TCP segment of a reassembled PDU]"
"188","0.995461","10.152.152.11","64.233.167.16","TCP","1514","39233  >  465 [ACK] Seq=229583 Ack=1 Win=1047 Len=1460 [TCP segment of a reassembled PDU]"
"189","0.995485","10.152.152.11","64.233.167.16","TCP","1514","39233  >  465 [ACK] Seq=231043 Ack=1 Win=1047 Len=1460 [TCP segment of a reassembled PDU]"
"190","1.035606","64.233.167.16","10.152.152.11","TCP","60","465  >  39233 [ACK] Seq=1 Ack=232503 Win=214 Len=0"
"191","1.035648","10.152.152.11","64.233.167.16","TLSv1.2","1514","Application Data [TCP segment of a reassembled PDU]"
"192","1.035685","10.152.152.11","64.233.167.16","TCP","1514","39233  >  465 [ACK] Seq=233963 Ack=1 Win=1047 Len=1460 [TCP segment of a reassembled PDU]"
"193","1.075626","64.233.167.16","10.152.152.11","TCP","60","465  >  39233 [ACK] Seq=1 Ack=235423 Win=32 Len=0"
"194","1.258151","64.233.167.16","10.152.152.11","TCP","60","[TCP Window Update] 465  >  39233 [ACK] Seq=1 Ack=235423 Win=844 Len=0"
"195","1.258181","10.152.152.11","64.233.167.16","TCP","1514","39233  >  465 [ACK] Seq=235423 Ack=1 Win=1047 Len=1460 [TCP segment of a reassembled PDU]"
"196","1.258211","10.152.152.11","64.233.167.16","TCP","1514","39233  >  465 [ACK] Seq=236883 Ack=1 Win=1047 Len=1460 [TCP segment of a reassembled PDU]"
"197","1.258229","10.152.152.11","64.233.167.16","TCP","1514","39233  >  465 [PSH, ACK] Seq=238343 Ack=1 Win=1047 Len=1460 [TCP segment of a reassembled PDU]"
"198","1.258246","10.152.152.11","64.233.167.16","TCP","1514","39233  >  465 [ACK] Seq=239803 Ack=1 Win=1047 Len=1460 [TCP segment of a reassembled PDU]"
"199","1.258264","10.152.152.11","64.233.167.16","TCP","1514","39233  >  465 [ACK] Seq=241263 Ack=1 Win=1047 Len=1460 [TCP segment of a reassembled PDU]"
"200","1.258281","10.152.152.11","64.233.167.16","TCP","1514","39233  >  465 [ACK] Seq=242723 Ack=1 Win=1047 Len=1460 [TCP segment of a reassembled PDU]"
"201","1.258299","10.152.152.11","64.233.167.16","TCP","1514","39233  >  465 [ACK] Seq=244183 Ack=1 Win=1047 Len=1460 [TCP segment of a reassembled PDU]"
"202","1.258316","10.152.152.11","64.233.167.16","TCP","1514","39233  >  465 [ACK] Seq=245643 Ack=1 Win=1047 Len=1460 [TCP segment of a reassembled PDU]"
"203","1.258333","10.152.152.11","64.233.167.16","TCP","1514","39233  >  465 [ACK] Seq=247103 Ack=1 Win=1047 Len=1460 [TCP segment of a reassembled PDU]"
"204","1.258544","64.233.167.16","10.152.152.11","TCP","60","465  >  39233 [ACK] Seq=1 Ack=236883 Win=774 Len=0"
"205","1.259705","64.233.167.16","10.152.152.11","TCP","60","465  >  39233 [ACK] Seq=1 Ack=248563 Win=1054 Len=0"
"206","1.259731","10.152.152.11","64.233.167.16","TLSv1.2","1514","Application Data"
"207","1.259758","10.152.152.11","64.233.167.16","TLSv1.2","1514","Application Data"
"208","1.259776","10.152.152.11","64.233.167.16","TCP","1514","39233  >  465 [ACK] Seq=251483 Ack=1 Win=1047 Len=1460 [TCP segment of a reassembled PDU]"
"209","1.259793","10.152.152.11","64.233.167.16","TCP","1514","39233  >  465 [ACK] Seq=252943 Ack=1 Win=1047 Len=1460 [TCP segment of a reassembled PDU]"
"210","1.259810","10.152.152.11","64.233.167.16","TCP","1514","39233  >  465 [ACK] Seq=254403 Ack=1 Win=1047 Len=1460 [TCP segment of a reassembled PDU]"
"211","1.259827","10.152.152.11","64.233.167.16","TCP","1514","39233  >  465 [ACK] Seq=255863 Ack=1 Win=1047 Len=1460 [TCP segment of a reassembled PDU]"
"212","1.259844","10.152.152.11","64.233.167.16","TCP","1514","39233  >  465 [ACK] Seq=257323 Ack=1 Win=1047 Len=1460 [TCP segment of a reassembled PDU]"
"213","1.259862","10.152.152.11","64.233.167.16","TCP","1514","39233  >  465 [ACK] Seq=258783 Ack=1 Win=1047 Len=1460 [TCP segment of a reassembled PDU]"
"214","1.259879","10.152.152.11","64.233.167.16","TCP","1514","39233  >  465 [ACK] Seq=260243 Ack=1 Win=1047 Len=1460 [TCP segment of a reassembled PDU]"
"215","1.259896","10.152.152.11","64.233.167.16","TCP","1514","39233  >  465 [ACK] Seq=261703 Ack=1 Win=1047 Len=1460 [TCP segment of a reassembled PDU]"
"216","1.259914","10.152.152.11","64.233.167.16","TCP","1514","39233  >  465 [ACK] Seq=263163 Ack=1 Win=1047 Len=1460 [TCP segment of a reassembled PDU]"
"217","1.299141","64.233.167.16","10.152.152.11","TCP","60","465  >  39233 [ACK] Seq=1 Ack=264623 Win=284 Len=0"
"218","1.299197","10.152.152.11","64.233.167.16","TCP","1514","39233  >  465 [ACK] Seq=264623 Ack=1 Win=1047 Len=1460 [TCP segment of a reassembled PDU]"
"219","1.299246","10.152.152.11","64.233.167.16","TLSv1.2","1514","Application Data [TCP segment of a reassembled PDU]"
"220","1.299286","10.152.152.11","64.233.167.16","TCP","1514","39233  >  465 [ACK] Seq=267543 Ack=1 Win=1047 Len=1460 [TCP segment of a reassembled PDU]"
"221","1.315364","64.233.164.16","10.152.152.11","TLSv1.2","94","Application Data"
"222","1.316230","10.152.152.11","64.233.164.16","TLSv1.2","95","Application Data"
"223","1.316736","64.233.164.16","10.152.152.11","TCP","60","993  >  49496 [ACK] Seq=149 Ack=120 Win=1181 Len=0"
"224","1.317526","64.233.167.16","10.152.152.11","TCP","60","465  >  39233 [ACK] Seq=1 Ack=269003 Win=844 Len=0"
"225","1.317558","10.152.152.11","64.233.167.16","TCP","1514","39233  >  465 [PSH, ACK] Seq=269003 Ack=1 Win=1047 Len=1460 [TCP segment of a reassembled PDU]"
"226","1.317592","10.152.152.11","64.233.167.16","TCP","1514","39233  >  465 [ACK] Seq=270463 Ack=1 Win=1047 Len=1460 [TCP segment of a reassembled PDU]"
"227","1.317616","10.152.152.11","64.233.167.16","TCP","1514","39233  >  465 [ACK] Seq=271923 Ack=1 Win=1047 Len=1460 [TCP segment of a reassembled PDU]"
"228","1.317640","10.152.152.11","64.233.167.16","TCP","1514","39233  >  465 [ACK] Seq=273383 Ack=1 Win=1047 Len=1460 [TCP segment of a reassembled PDU]"
"229","1.317664","10.152.152.11","64.233.167.16","TCP","1514","39233  >  465 [ACK] Seq=274843 Ack=1 Win=1047 Len=1460 [TCP segment of a reassembled PDU]"
"230","1.317688","10.152.152.11","64.233.167.16","TCP","1514","39233  >  465 [ACK] Seq=276303 Ack=1 Win=1047 Len=1460 [TCP segment of a reassembled PDU]"
"231","1.317716","10.152.152.11","64.233.167.16","TCP","1514","39233  >  465 [ACK] Seq=277763 Ack=1 Win=1047 Len=1460 [TCP segment of a reassembled PDU]"
"232","1.317740","10.152.152.11","64.233.167.16","TCP","1514","39233  >  465 [ACK] Seq=279223 Ack=1 Win=1047 Len=1460 [TCP segment of a reassembled PDU]"
"233","1.317764","10.152.152.11","64.233.167.16","TCP","1514","39233  >  465 [ACK] Seq=280683 Ack=1 Win=1047 Len=1460 [TCP segment of a reassembled PDU]"
"234","1.323161","64.233.167.16","10.152.152.11","TCP","60","465  >  39233 [ACK] Seq=1 Ack=282143 Win=1054 Len=0"
"235","1.323211","10.152.152.11","64.233.167.16","TLSv1.2","1514","Application Data, Application Data"
"236","1.323262","10.152.152.11","64.233.167.16","TCP","1514","39233  >  465 [ACK] Seq=283603 Ack=1 Win=1047 Len=1460 [TCP segment of a reassembled PDU]"
"237","1.323302","10.152.152.11","64.233.167.16","TCP","1514","39233  >  465 [ACK] Seq=285063 Ack=1 Win=1047 Len=1460 [TCP segment of a reassembled PDU]"
"238","1.323341","10.152.152.11","64.233.167.16","TCP","1514","39233  >  465 [ACK] Seq=286523 Ack=1 Win=1047 Len=1460 [TCP segment of a reassembled PDU]"
"239","1.323384","10.152.152.11","64.233.167.16","TCP","1514","39233  >  465 [ACK] Seq=287983 Ack=1 Win=1047 Len=1460 [TCP segment of a reassembled PDU]"
"240","1.323424","10.152.152.11","64.233.167.16","TCP","1514","39233  >  465 [ACK] Seq=289443 Ack=1 Win=1047 Len=1460 [TCP segment of a reassembled PDU]"
"241","1.323467","10.152.152.11","64.233.167.16","TCP","1514","39233  >  465 [PSH, ACK] Seq=290903 Ack=1 Win=1047 Len=1460 [TCP segment of a reassembled PDU]"
"242","1.323507","10.152.152.11","64.233.167.16","TCP","1514","39233  >  465 [ACK] Seq=292363 Ack=1 Win=1047 Len=1460 [TCP segment of a reassembled PDU]"
"243","1.323550","10.152.152.11","64.233.167.16","TCP","1514","39233  >  465 [ACK] Seq=293823 Ack=1 Win=1047 Len=1460 [TCP segment of a reassembled PDU]"
"244","1.323591","10.152.152.11","64.233.167.16","TCP","1514","39233  >  465 [ACK] Seq=295283 Ack=1 Win=1047 Len=1460 [TCP segment of a reassembled PDU]"
"245","1.323632","10.152.152.11","64.233.167.16","TCP","1514","39233  >  465 [ACK] Seq=296743 Ack=1 Win=1047 Len=1460 [TCP segment of a reassembled PDU]"
"246","1.362895","64.233.167.16","10.152.152.11","TCP","60","465  >  39233 [ACK] Seq=1 Ack=298203 Win=284 Len=0"
"247","1.362948","10.152.152.11","64.233.167.16","TLSv1.2","1514","Application Data [TCP segment of a reassembled PDU]"
"248","1.362985","10.152.152.11","64.233.167.16","TCP","1514","39233  >  465 [ACK] Seq=299663 Ack=1 Win=1047 Len=1460 [TCP segment of a reassembled PDU]"
"249","1.363010","10.152.152.11","64.233.167.16","TCP","1514","39233  >  465 [ACK] Seq=301123 Ack=1 Win=1047 Len=1460 [TCP segment of a reassembled PDU]"
"250","1.397260","64.233.167.16","10.152.152.11","TCP","60","465  >  39233 [ACK] Seq=1 Ack=302583 Win=844 Len=0"
"251","1.397309","10.152.152.11","64.233.167.16","TCP","1514","39233  >  465 [ACK] Seq=302583 Ack=1 Win=1047 Len=1460 [TCP segment of a reassembled PDU]"
"252","1.397346","10.152.152.11","64.233.167.16","TCP","1514","39233  >  465 [ACK] Seq=304043 Ack=1 Win=1047 Len=1460 [TCP segment of a reassembled PDU]"
"253","1.397371","10.152.152.11","64.233.167.16","TCP","1514","39233  >  465 [ACK] Seq=305503 Ack=1 Win=1047 Len=1460 [TCP segment of a reassembled PDU]"
"254","1.397403","10.152.152.11","64.233.167.16","TCP","1514","39233  >  465 [ACK] Seq=306963 Ack=1 Win=1047 Len=1460 [TCP segment of a reassembled PDU]"
"255","1.397417","10.152.152.11","64.233.167.16","TCP","1514","39233  >  465 [ACK] Seq=308423 Ack=1 Win=1047 Len=1460 [TCP segment of a reassembled PDU]"
"256","1.397431","10.152.152.11","64.233.167.16","TCP","1514","39233  >  465 [ACK] Seq=309883 Ack=1 Win=1047 Len=1460 [TCP segment of a reassembled PDU]"
"257","1.397446","10.152.152.11","64.233.167.16","TCP","1514","39233  >  465 [ACK] Seq=311343 Ack=1 Win=1047 Len=1460 [TCP segment of a reassembled PDU]"
"258","1.397460","10.152.152.11","64.233.167.16","TCP","1514","39233  >  465 [ACK] Seq=312803 Ack=1 Win=1047 Len=1460 [TCP segment of a reassembled PDU]"
"259","1.397474","10.152.152.11","64.233.167.16","TCP","1514","39233  >  465 [ACK] Seq=314263 Ack=1 Win=1047 Len=1460 [TCP segment of a reassembled PDU]"
"260","1.400952","64.233.167.16","10.152.152.11","TCP","60","465  >  39233 [ACK] Seq=1 Ack=315723 Win=984 Len=0"
"261","1.400969","10.152.152.11","64.233.167.16","TLSv1.2","1514","Application Data [TCP segment of a reassembled PDU]"
"262","1.400985","10.152.152.11","64.233.167.16","TCP","1514","39233  >  465 [ACK] Seq=317183 Ack=1 Win=1047 Len=1460 [TCP segment of a reassembled PDU]"
"263","1.400995","10.152.152.11","64.233.167.16","TCP","1514","39233  >  465 [ACK] Seq=318643 Ack=1 Win=1047 Len=1460 [TCP segment of a reassembled PDU]"
"264","1.401008","10.152.152.11","64.233.167.16","TCP","1514","39233  >  465 [PSH, ACK] Seq=320103 Ack=1 Win=1047 Len=1460 [TCP segment of a reassembled PDU]"
"265","1.401020","10.152.152.11","64.233.167.16","TCP","1514","39233  >  465 [ACK] Seq=321563 Ack=1 Win=1047 Len=1460 [TCP segment of a reassembled PDU]"
"266","1.401031","10.152.152.11","64.233.167.16","TCP","1514","39233  >  465 [ACK] Seq=323023 Ack=1 Win=1047 Len=1460 [TCP segment of a reassembled PDU]"
"267","1.401042","10.152.152.11","64.233.167.16","TCP","1514","39233  >  465 [ACK] Seq=324483 Ack=1 Win=1047 Len=1460 [TCP segment of a reassembled PDU]"
"268","1.401054","10.152.152.11","64.233.167.16","TCP","1514","39233  >  465 [ACK] Seq=325943 Ack=1 Win=1047 Len=1460 [TCP segment of a reassembled PDU]"
"269","1.401066","10.152.152.11","64.233.167.16","TCP","1514","39233  >  465 [ACK] Seq=327403 Ack=1 Win=1047 Len=1460 [TCP segment of a reassembled PDU]"
"270","1.401077","10.152.152.11","64.233.167.16","TCP","1514","39233  >  465 [ACK] Seq=328863 Ack=1 Win=1047 Len=1460 [TCP segment of a reassembled PDU]"
"271","1.403257","64.233.167.16","10.152.152.11","TCP","60","465  >  39233 [ACK] Seq=1 Ack=330323 Win=1054 Len=0"
"272","1.403273","10.152.152.11","64.233.167.16","TCP","1514","39233  >  465 [ACK] Seq=330323 Ack=1 Win=1047 Len=1460 [TCP segment of a reassembled PDU]"
"273","1.403288","10.152.152.11","64.233.167.16","TLSv1.2","1514","Application Data [TCP segment of a reassembled PDU]"
"274","1.403300","10.152.152.11","64.233.167.16","TCP","1514","39233  >  465 [ACK] Seq=333243 Ack=1 Win=1047 Len=1460 [TCP segment of a reassembled PDU]"
"275","1.403313","10.152.152.11","64.233.167.16","TCP","1514","39233  >  465 [ACK] Seq=334703 Ack=1 Win=1047 Len=1460 [TCP segment of a reassembled PDU]"
"276","1.403324","10.152.152.11","64.233.167.16","TCP","1514","39233  >  465 [ACK] Seq=336163 Ack=1 Win=1047 Len=1460 [TCP segment of a reassembled PDU]"
"277","1.403337","10.152.152.11","64.233.167.16","TCP","1514","39233  >  465 [ACK] Seq=337623 Ack=1 Win=1047 Len=1460 [TCP segment of a reassembled PDU]"
"278","1.403347","10.152.152.11","64.233.167.16","TCP","1514","39233  >  465 [ACK] Seq=339083 Ack=1 Win=1047 Len=1460 [TCP segment of a reassembled PDU]"
"279","1.403358","10.152.152.11","64.233.167.16","TCP","1514","39233  >  465 [ACK] Seq=340543 Ack=1 Win=1047 Len=1460 [TCP segment of a reassembled PDU]"
"280","1.403369","10.152.152.11","64.233.167.16","TCP","1514","39233  >  465 [ACK] Seq=342003 Ack=1 Win=1047 Len=1460 [TCP segment of a reassembled PDU]"
"281","1.403381","10.152.152.11","64.233.167.16","TCP","1514","39233  >  465 [ACK] Seq=343463 Ack=1 Win=1047 Len=1460 [TCP segment of a reassembled PDU]"
