"No.","Time","Source","Destination","Protocol","Length","Info"
"1","0.000000","10.152.152.11","104.86.110.33","TCP","54","33806  >  443 [ACK] Seq=1 Ack=1 Win=1650 Len=0"
"2","0.000130","10.152.152.11","104.86.110.33","TCP","54","33807  >  443 [ACK] Seq=1 Ack=1 Win=1516 Len=0"
"3","0.000472","104.86.110.33","10.152.152.11","TCP","60","[TCP ACKed unseen segment] 443  >  33806 [ACK] Seq=1 Ack=2 Win=1650 Len=0"
"4","0.000492","104.86.110.33","10.152.152.11","TCP","60","[TCP ACKed unseen segment] 443  >  33807 [ACK] Seq=1 Ack=2 Win=1516 Len=0"
"5","5.887882","10.152.152.11","46.229.224.29","TCP","54","56005  >  443 [ACK] Seq=1 Ack=1 Win=2640 Len=0"
"6","5.888515","46.229.224.29","10.152.152.11","TCP","60","[TCP ACKed unseen segment] 443  >  56005 [ACK] Seq=1 Ack=2 Win=2026 Len=0"
"7","9.215945","10.152.152.11","46.229.224.44","TCP","54","39920  >  443 [ACK] Seq=1 Ack=1 Win=2622 Len=0"
"8","9.216463","46.229.224.44","10.152.152.11","TCP","60","[TCP ACKed unseen segment] 443  >  39920 [ACK] Seq=1 Ack=2 Win=1449 Len=0"
"9","9.331456","10.152.152.11","66.220.158.19","TLSv1.1","923","Application Data"
"10","9.331994","66.220.158.19","10.152.152.11","TCP","60","443  >  33650 [ACK] Seq=1 Ack=870 Win=2640 Len=0"
"11","9.332568","10.152.152.11","66.220.158.19","TLSv1.1","123","Application Data"
"12","9.332926","66.220.158.19","10.152.152.11","TCP","60","443  >  33650 [ACK] Seq=1 Ack=939 Win=2640 Len=0"
"13","9.947752","10.152.152.11","66.220.158.19","TLSv1.1","667","Application Data"
"14","9.948244","66.220.158.19","10.152.152.11","TCP","60","443  >  33650 [ACK] Seq=1 Ack=1552 Win=2640 Len=0"
"15","10.027969","66.220.158.19","10.152.152.11","TLSv1.1","123","Application Data"
"16","10.027996","10.152.152.11","66.220.158.19","TCP","54","33650  >  443 [ACK] Seq=1552 Ack=70 Win=5547 Len=0"
"17","10.184118","66.220.158.19","10.152.152.11","TLSv1.1","123","Application Data"
"18","10.184160","10.152.152.11","66.220.158.19","TCP","54","33650  >  443 [ACK] Seq=1552 Ack=139 Win=5547 Len=0"
"19","10.200910","66.220.158.19","10.152.152.11","TCP","1050","443  >  33650 [PSH, ACK] Seq=139 Ack=1552 Win=2640 Len=996 [TCP segment of a reassembled PDU]"
"20","10.200936","10.152.152.11","66.220.158.19","TCP","54","33650  >  443 [ACK] Seq=1552 Ack=1135 Win=5547 Len=0"
"21","10.249141","66.220.158.19","10.152.152.11","TLSv1.1","1514","Application Data [TCP segment of a reassembled PDU]"
"22","10.249168","10.152.152.11","66.220.158.19","TCP","54","33650  >  443 [ACK] Seq=1552 Ack=2595 Win=5547 Len=0"
"23","10.249255","66.220.158.19","10.152.152.11","TLSv1.1","1514","Application Data [TCP segment of a reassembled PDU]"
"24","10.249272","10.152.152.11","66.220.158.19","TCP","54","33650  >  443 [ACK] Seq=1552 Ack=4055 Win=5547 Len=0"
"25","10.249298","66.220.158.19","10.152.152.11","TLSv1.1","142","Application Data, Application Data"
"26","10.249309","10.152.152.11","66.220.158.19","TCP","54","33650  >  443 [ACK] Seq=1552 Ack=4143 Win=5546 Len=0"
"27","10.315378","10.152.152.11","66.220.158.19","TLSv1.1","603","Application Data"
"28","10.315677","66.220.158.19","10.152.152.11","TCP","60","443  >  33650 [ACK] Seq=4143 Ack=2101 Win=2640 Len=0"
"29","10.315819","10.152.152.11","66.220.158.19","TCP","1514","33650  >  443 [ACK] Seq=2101 Ack=4143 Win=5547 Len=1460 [TCP segment of a reassembled PDU]"
"30","10.315910","10.152.152.11","66.220.158.19","TLSv1.1","167","Application Data"
"31","10.316046","66.220.158.19","10.152.152.11","TCP","60","443  >  33650 [ACK] Seq=4143 Ack=3561 Win=2640 Len=0"
"32","10.316053","66.220.158.19","10.152.152.11","TCP","60","443  >  33650 [ACK] Seq=4143 Ack=3674 Win=2639 Len=0"
"33","10.508795","66.220.158.19","10.152.152.11","TLSv1.1","123","Application Data"
"34","10.508883","10.152.152.11","66.220.158.19","TCP","54","33650  >  443 [ACK] Seq=3674 Ack=4212 Win=5547 Len=0"
"35","10.704693","66.220.158.19","10.152.152.11","TCP","552","443  >  33650 [PSH, ACK] Seq=4212 Ack=3674 Win=2640 Len=498 [TCP segment of a reassembled PDU]"
"36","10.704792","10.152.152.11","66.220.158.19","TCP","54","33650  >  443 [ACK] Seq=3674 Ack=4710 Win=5547 Len=0"
"37","10.856151","66.220.158.19","10.152.152.11","TCP","552","443  >  33650 [PSH, ACK] Seq=4710 Ack=3674 Win=2640 Len=498 [TCP segment of a reassembled PDU]"
"38","10.856190","10.152.152.11","66.220.158.19","TCP","54","33650  >  443 [ACK] Seq=3674 Ack=5208 Win=5547 Len=0"
"39","10.877304","66.220.158.19","10.152.152.11","TLSv1.1","1514","Application Data [TCP segment of a reassembled PDU]"
"40","10.877331","10.152.152.11","66.220.158.19","TCP","54","33650  >  443 [ACK] Seq=3674 Ack=6668 Win=5547 Len=0"
"41","10.877419","66.220.158.19","10.152.152.11","TLSv1.1","1514","Application Data [TCP segment of a reassembled PDU]"
"42","10.877437","10.152.152.11","66.220.158.19","TCP","54","33650  >  443 [ACK] Seq=3674 Ack=8128 Win=5547 Len=0"
"43","10.877465","66.220.158.19","10.152.152.11","TLSv1.1","206","Application Data, Application Data"
"44","10.877477","10.152.152.11","66.220.158.19","TCP","54","33650  >  443 [ACK] Seq=3674 Ack=8280 Win=5538 Len=0"
"45","10.920418","66.220.158.19","10.152.152.11","TLSv1.1","123","Application Data"
"46","10.920446","10.152.152.11","66.220.158.19","TCP","54","33650  >  443 [ACK] Seq=3674 Ack=8349 Win=5547 Len=0"
"47","11.082176","66.220.158.19","10.152.152.11","TLSv1.1","123","Application Data"
"48","11.082202","10.152.152.11","66.220.158.19","TCP","54","33650  >  443 [ACK] Seq=3674 Ack=8418 Win=5547 Len=0"
"49","11.157619","66.220.158.19","10.152.152.11","TCP","552","443  >  33650 [PSH, ACK] Seq=8418 Ack=3674 Win=2640 Len=498 [TCP segment of a reassembled PDU]"
"50","11.157645","10.152.152.11","66.220.158.19","TCP","54","33650  >  443 [ACK] Seq=3674 Ack=8916 Win=5547 Len=0"
"51","11.254650","66.220.158.19","10.152.152.11","TCP","552","443  >  33650 [PSH, ACK] Seq=8916 Ack=3674 Win=2640 Len=498 [TCP segment of a reassembled PDU]"
"52","11.254678","10.152.152.11","66.220.158.19","TCP","54","33650  >  443 [ACK] Seq=3674 Ack=9414 Win=5547 Len=0"
"53","11.260367","66.220.158.19","10.152.152.11","TLSv1.1","945","Application Data, Application Data, Application Data"
"54","11.260392","10.152.152.11","66.220.158.19","TCP","54","33650  >  443 [ACK] Seq=3674 Ack=10305 Win=5547 Len=0"
"55","15.531179","10.152.152.11","66.220.158.19","TLSv1.1","555","Application Data"
"56","15.531464","66.220.158.19","10.152.152.11","TCP","60","443  >  33650 [ACK] Seq=10305 Ack=4175 Win=2640 Len=0"
"57","15.531540","10.152.152.11","66.220.158.19","TLSv1.1","1195","Application Data"
"58","15.531969","66.220.158.19","10.152.152.11","TCP","60","443  >  33650 [ACK] Seq=10305 Ack=5316 Win=2640 Len=0"
"59","16.053195","66.220.158.19","10.152.152.11","TLSv1.1","123","Application Data"
"60","16.053285","10.152.152.11","66.220.158.19","TCP","54","33650  >  443 [ACK] Seq=5316 Ack=10374 Win=5547 Len=0"
"61","16.221338","66.220.158.19","10.152.152.11","TCP","552","443  >  33650 [PSH, ACK] Seq=10374 Ack=5316 Win=2640 Len=498 [TCP segment of a reassembled PDU]"
"62","16.221369","10.152.152.11","66.220.158.19","TCP","54","33650  >  443 [ACK] Seq=5316 Ack=10872 Win=5547 Len=0"
"63","16.224670","66.220.158.19","10.152.152.11","TCP","552","443  >  33650 [PSH, ACK] Seq=10872 Ack=5316 Win=2640 Len=498 [TCP segment of a reassembled PDU]"
"64","16.224686","10.152.152.11","66.220.158.19","TCP","54","33650  >  443 [ACK] Seq=5316 Ack=11370 Win=5547 Len=0"
"65","16.286281","66.220.158.19","10.152.152.11","TLSv1.1","945","Application Data, Application Data, Application Data"
"66","16.286319","10.152.152.11","66.220.158.19","TCP","54","33650  >  443 [ACK] Seq=5316 Ack=12261 Win=5547 Len=0"
"67","18.496795","10.152.152.11","66.220.158.19","TLSv1.1","363","Application Data"
"68","18.497353","66.220.158.19","10.152.152.11","TCP","60","443  >  33650 [ACK] Seq=12261 Ack=5625 Win=2640 Len=0"
"69","18.497953","10.152.152.11","66.220.158.19","TLSv1.1","395","Application Data"
"70","18.498466","66.220.158.19","10.152.152.11","TCP","60","443  >  33650 [ACK] Seq=12261 Ack=5966 Win=2640 Len=0"
"71","18.886769","66.220.158.19","10.152.152.11","TLSv1.1","123","Application Data"
"72","18.886859","10.152.152.11","66.220.158.19","TCP","54","33650  >  443 [ACK] Seq=5966 Ack=12330 Win=5547 Len=0"
"73","18.952352","31.13.93.3","10.152.152.11","TLSv1.1","651","Application Data"
"74","18.966569","10.152.152.11","31.13.93.3","TLSv1.1","1211","Application Data"
"75","18.966941","31.13.93.3","10.152.152.11","TCP","60","443  >  34010 [ACK] Seq=598 Ack=1158 Win=2640 Len=0"
"76","19.182249","66.220.158.19","10.152.152.11","TCP","552","443  >  33650 [PSH, ACK] Seq=12330 Ack=5966 Win=2640 Len=498 [TCP segment of a reassembled PDU]"
"77","19.182329","10.152.152.11","66.220.158.19","TCP","54","33650  >  443 [ACK] Seq=5966 Ack=12828 Win=5547 Len=0"
"78","19.354801","66.220.158.19","10.152.152.11","TCP","552","443  >  33650 [PSH, ACK] Seq=12828 Ack=5966 Win=2640 Len=498 [TCP segment of a reassembled PDU]"
"79","19.354838","10.152.152.11","66.220.158.19","TCP","54","33650  >  443 [ACK] Seq=5966 Ack=13326 Win=5547 Len=0"
"80","19.420182","66.220.158.19","10.152.152.11","TLSv1.1","700","Application Data, Application Data"
"81","19.420201","10.152.152.11","66.220.158.19","TCP","54","33650  >  443 [ACK] Seq=5966 Ack=13972 Win=5547 Len=0"
"82","26.879943","10.152.152.11","173.194.204.188","TCP","54","34927  >  5228 [ACK] Seq=1 Ack=1 Win=2142 Len=0"
"83","26.880481","173.194.204.188","10.152.152.11","TCP","60","[TCP ACKed unseen segment] 5228  >  34927 [ACK] Seq=1 Ack=2 Win=1248 Len=0"
"84","44.543903","10.152.152.11","104.86.110.33","TCP","54","33800  >  443 [ACK] Seq=1 Ack=1 Win=1315 Len=0"
"85","44.544421","104.86.110.33","10.152.152.11","TCP","60","[TCP ACKed unseen segment] 443  >  33800 [ACK] Seq=1 Ack=2 Win=1315 Len=0"
"86","44.671937","10.152.152.11","104.86.110.33","TCP","54","33809  >  443 [ACK] Seq=1 Ack=1 Win=1248 Len=0"
"87","44.672072","10.152.152.11","104.86.110.33","TCP","54","33796  >  443 [ACK] Seq=1 Ack=1 Win=2640 Len=0"
"88","44.672100","10.152.152.11","104.86.110.33","TCP","54","33797  >  443 [ACK] Seq=1 Ack=1 Win=1248 Len=0"
"89","44.672123","10.152.152.11","104.86.110.33","TCP","54","33798  >  443 [ACK] Seq=1 Ack=1 Win=1382 Len=0"
"90","44.672146","10.152.152.11","104.86.110.33","TCP","54","33801  >  443 [ACK] Seq=1 Ack=1 Win=1296 Len=0"
"91","44.672169","10.152.152.11","104.86.110.33","TCP","54","33802  >  443 [ACK] Seq=1 Ack=1 Win=2640 Len=0"
"92","44.672194","10.152.152.11","104.86.110.33","TCP","54","33804  >  443 [ACK] Seq=1 Ack=1 Win=1449 Len=0"
"93","44.672218","10.152.152.11","104.86.110.33","TCP","54","33805  >  443 [ACK] Seq=1 Ack=1 Win=1382 Len=0"
"94","44.672343","104.86.110.33","10.152.152.11","TCP","60","[TCP ACKed unseen segment] 443  >  33809 [ACK] Seq=1 Ack=2 Win=1248 Len=0"
"95","44.672358","104.86.110.33","10.152.152.11","TCP","60","[TCP ACKed unseen segment] 443  >  33796 [ACK] Seq=1 Ack=2 Win=1650 Len=0"
"96","44.672365","104.86.110.33","10.152.152.11","TCP","60","[TCP ACKed unseen segment] 443  >  33797 [ACK] Seq=1 Ack=2 Win=1248 Len=0"
"97","44.672470","104.86.110.33","10.152.152.11","TCP","60","[TCP ACKed unseen segment] 443  >  33798 [ACK] Seq=1 Ack=2 Win=1382 Len=0"
"98","44.672479","104.86.110.33","10.152.152.11","TCP","60","[TCP ACKed unseen segment] 443  >  33801 [ACK] Seq=1 Ack=2 Win=1181 Len=0"
"99","44.672486","104.86.110.33","10.152.152.11","TCP","60","[TCP ACKed unseen segment] 443  >  33802 [ACK] Seq=1 Ack=2 Win=1784 Len=0"
"100","44.672492","104.86.110.33","10.152.152.11","TCP","60","[TCP ACKed unseen segment] 443  >  33804 [ACK] Seq=1 Ack=2 Win=1449 Len=0"
"101","44.672498","104.86.110.33","10.152.152.11","TCP","60","[TCP ACKed unseen segment] 443  >  33805 [ACK] Seq=1 Ack=2 Win=1382 Len=0"
"102","44.799940","10.152.152.11","104.86.110.33","TCP","54","33799  >  443 [ACK] Seq=1 Ack=1 Win=1315 Len=0"
"103","44.800461","104.86.110.33","10.152.152.11","TCP","60","[TCP ACKed unseen segment] 443  >  33799 [ACK] Seq=1 Ack=2 Win=1315 Len=0"
"104","45.055959","10.152.152.11","104.86.110.33","TCP","54","[TCP Dup ACK 1#1] 33806  >  443 [ACK] Seq=1 Ack=1 Win=1650 Len=0"
"105","45.056090","10.152.152.11","104.86.110.33","TCP","54","[TCP Dup ACK 2#1] 33807  >  443 [ACK] Seq=1 Ack=1 Win=1516 Len=0"
"106","45.056323","104.86.110.33","10.152.152.11","TCP","60","[TCP Dup ACK 3#1] [TCP ACKed unseen segment] 443  >  33806 [ACK] Seq=1 Ack=2 Win=1650 Len=0"
"107","45.056335","104.86.110.33","10.152.152.11","TCP","60","[TCP Dup ACK 4#1] [TCP ACKed unseen segment] 443  >  33807 [ACK] Seq=1 Ack=2 Win=1516 Len=0"
"108","48.662127","10.152.152.11","66.220.158.19","TLSv1.1","587","Application Data"
"109","48.662414","66.220.158.19","10.152.152.11","TCP","60","443  >  33650 [ACK] Seq=13972 Ack=6499 Win=2640 Len=0"
"110","48.662670","10.152.152.11","66.220.158.19","TLSv1.1","123","Application Data"
"111","48.662838","66.220.158.19","10.152.152.11","TCP","60","443  >  33650 [ACK] Seq=13972 Ack=6568 Win=2640 Len=0"
"112","48.663003","10.152.152.11","66.220.158.19","TCP","1514","33650  >  443 [ACK] Seq=6568 Ack=13972 Win=5547 Len=1460 [TCP segment of a reassembled PDU]"
"113","48.663093","10.152.152.11","66.220.158.19","TLSv1.1","503","Application Data"
"114","48.663224","66.220.158.19","10.152.152.11","TCP","60","443  >  33650 [ACK] Seq=13972 Ack=8028 Win=2639 Len=0"
"115","48.663234","66.220.158.19","10.152.152.11","TCP","60","443  >  33650 [ACK] Seq=13972 Ack=8477 Win=2611 Len=0"
"116","48.668052","10.152.152.11","66.220.158.19","TLSv1.1","363","Application Data"
"117","48.668275","66.220.158.19","10.152.152.11","TCP","60","443  >  33650 [ACK] Seq=13972 Ack=8786 Win=2640 Len=0"
"118","48.668436","10.152.152.11","66.220.158.19","TLSv1.1","395","Application Data"
"119","48.668694","66.220.158.19","10.152.152.11","TCP","60","443  >  33650 [ACK] Seq=13972 Ack=9127 Win=2640 Len=0"
"120","49.144636","66.220.158.19","10.152.152.11","TLSv1.1","123","Application Data"
"121","49.144704","10.152.152.11","66.220.158.19","TCP","54","33650  >  443 [ACK] Seq=9127 Ack=14041 Win=5547 Len=0"
"122","49.317657","66.220.158.19","10.152.152.11","TLSv1.1","123","Application Data"
"123","49.317694","10.152.152.11","66.220.158.19","TCP","54","33650  >  443 [ACK] Seq=9127 Ack=14110 Win=5547 Len=0"
"124","49.335329","66.220.158.19","10.152.152.11","TLSv1.1","123","Application Data"
"125","49.335356","10.152.152.11","66.220.158.19","TCP","54","33650  >  443 [ACK] Seq=9127 Ack=14179 Win=5547 Len=0"
"126","49.335443","31.13.93.3","10.152.152.11","TCP","552","443  >  34010 [PSH, ACK] Seq=598 Ack=1158 Win=2640 Len=498 [TCP segment of a reassembled PDU]"
"127","49.371934","10.152.152.11","31.13.93.3","TCP","54","34010  >  443 [ACK] Seq=1158 Ack=1096 Win=2640 Len=0"
"128","49.383356","31.13.93.3","10.152.152.11","TLSv1.1","793","Application Data"
"129","49.383382","10.152.152.11","31.13.93.3","TCP","54","34010  >  443 [ACK] Seq=1158 Ack=1835 Win=2640 Len=0"
"130","49.401499","10.152.152.11","31.13.93.3","TLSv1.1","1211","Application Data"
"131","49.401764","31.13.93.3","10.152.152.11","TCP","60","443  >  34010 [ACK] Seq=1835 Ack=2315 Win=2640 Len=0"
"132","49.447660","66.220.158.19","10.152.152.11","TCP","552","443  >  33650 [PSH, ACK] Seq=14179 Ack=9127 Win=2640 Len=498 [TCP segment of a reassembled PDU]"
"133","49.447694","10.152.152.11","66.220.158.19","TCP","54","33650  >  443 [ACK] Seq=9127 Ack=14677 Win=5547 Len=0"
"134","49.484575","66.220.158.19","10.152.152.11","TCP","552","443  >  33650 [PSH, ACK] Seq=14677 Ack=9127 Win=2640 Len=498 [TCP segment of a reassembled PDU]"
"135","49.484600","10.152.152.11","66.220.158.19","TCP","54","33650  >  443 [ACK] Seq=9127 Ack=15175 Win=5547 Len=0"
"136","49.488907","66.220.158.19","10.152.152.11","TLSv1.1","1514","Application Data, Application Data, Application Data, Application Data"
"137","49.488932","10.152.152.11","66.220.158.19","TCP","54","33650  >  443 [ACK] Seq=9127 Ack=16635 Win=5547 Len=0"
"138","49.488964","66.220.158.19","10.152.152.11","TCP","116","443  >  33650 [PSH, ACK] Seq=16635 Ack=9127 Win=2640 Len=62 [TCP segment of a reassembled PDU]"
"139","49.488976","10.152.152.11","66.220.158.19","TCP","54","33650  >  443 [ACK] Seq=9127 Ack=16697 Win=5547 Len=0"
"140","49.489554","66.220.158.19","10.152.152.11","TCP","552","443  >  33650 [PSH, ACK] Seq=16697 Ack=9127 Win=2640 Len=498 [TCP segment of a reassembled PDU]"
"141","49.489575","10.152.152.11","66.220.158.19","TCP","54","33650  >  443 [ACK] Seq=9127 Ack=17195 Win=5547 Len=0"
"142","49.531721","66.220.158.19","10.152.152.11","TLSv1.1","753","Application Data, Application Data, Application Data"
"143","49.531740","10.152.152.11","66.220.158.19","TCP","54","33650  >  443 [ACK] Seq=9127 Ack=17894 Win=5547 Len=0"
"144","49.901819","31.13.93.3","10.152.152.11","TCP","552","443  >  34010 [PSH, ACK] Seq=1835 Ack=2315 Win=2640 Len=498 [TCP segment of a reassembled PDU]"
"145","49.939934","10.152.152.11","31.13.93.3","TCP","54","34010  >  443 [ACK] Seq=2315 Ack=2333 Win=2640 Len=0"
"146","49.967023","31.13.93.3","10.152.152.11","TLSv1.1","537","Application Data"
"147","49.967048","10.152.152.11","31.13.93.3","TCP","54","34010  >  443 [ACK] Seq=2315 Ack=2816 Win=2640 Len=0"
"148","49.976267","10.152.152.11","31.13.93.3","TLSv1.1","1211","Application Data"
"149","49.976645","31.13.93.3","10.152.152.11","TCP","60","443  >  34010 [ACK] Seq=2816 Ack=3472 Win=2640 Len=0"
"150","50.649778","31.13.93.3","10.152.152.11","TCP","552","443  >  34010 [PSH, ACK] Seq=2816 Ack=3472 Win=2640 Len=498 [TCP segment of a reassembled PDU]"
"151","50.687932","10.152.152.11","31.13.93.3","TCP","54","34010  >  443 [ACK] Seq=3472 Ack=3314 Win=2640 Len=0"
"152","50.752176","31.13.93.3","10.152.152.11","TLSv1.1","153","Application Data"
"153","50.752202","10.152.152.11","31.13.93.3","TCP","54","34010  >  443 [ACK] Seq=3472 Ack=3413 Win=2640 Len=0"
"154","50.762493","10.152.152.11","31.13.93.3","TLSv1.1","1211","Application Data"
"155","50.762850","31.13.93.3","10.152.152.11","TCP","60","443  >  34010 [ACK] Seq=3413 Ack=4629 Win=2640 Len=0"
"156","50.943926","10.152.152.11","46.229.224.29","TCP","54","[TCP Dup ACK 5#1] 56005  >  443 [ACK] Seq=1 Ack=1 Win=2640 Len=0"
"157","50.944433","46.229.224.29","10.152.152.11","TCP","60","[TCP Dup ACK 6#1] [TCP ACKed unseen segment] 443  >  56005 [ACK] Seq=1 Ack=2 Win=2026 Len=0"
"158","51.417669","31.13.93.3","10.152.152.11","TCP","552","443  >  34010 [PSH, ACK] Seq=3413 Ack=4629 Win=2640 Len=498 [TCP segment of a reassembled PDU]"
"159","51.455966","10.152.152.11","31.13.93.3","TCP","54","34010  >  443 [ACK] Seq=4629 Ack=3911 Win=2640 Len=0"
"160","51.520558","31.13.93.3","10.152.152.11","TLSv1.1","153","Application Data"
"161","51.520586","10.152.152.11","31.13.93.3","TCP","54","34010  >  443 [ACK] Seq=4629 Ack=4010 Win=2640 Len=0"
"162","51.528715","10.152.152.11","31.13.93.3","TLSv1.1","1211","Application Data"
"163","51.529051","31.13.93.3","10.152.152.11","TCP","60","443  >  34010 [ACK] Seq=4010 Ack=5786 Win=2640 Len=0"
"164","54.271947","10.152.152.11","46.229.224.44","TCP","54","[TCP Dup ACK 7#1] 39920  >  443 [ACK] Seq=1 Ack=1 Win=2622 Len=0"
"165","54.272432","46.229.224.44","10.152.152.11","TCP","60","[TCP Dup ACK 8#1] [TCP ACKed unseen segment] 443  >  39920 [ACK] Seq=1 Ack=2 Win=1449 Len=0"
"166","54.729200","31.13.93.3","10.152.152.11","TCP","552","443  >  34010 [PSH, ACK] Seq=4010 Ack=5786 Win=2640 Len=498 [TCP segment of a reassembled PDU]"
"167","54.767929","10.152.152.11","31.13.93.3","TCP","54","34010  >  443 [ACK] Seq=5786 Ack=4508 Win=2640 Len=0"
"168","54.832529","31.13.93.3","10.152.152.11","TLSv1.1","681","Application Data"
"169","54.832560","10.152.152.11","31.13.93.3","TCP","54","34010  >  443 [ACK] Seq=5786 Ack=5135 Win=2640 Len=0"
"170","54.867976","10.152.152.11","66.220.158.19","TLSv1.1","571","Application Data"
"171","54.868279","66.220.158.19","10.152.152.11","TCP","60","443  >  33650 [ACK] Seq=17894 Ack=9644 Win=2640 Len=0"
"172","54.868341","10.152.152.11","66.220.158.19","TLSv1.1","379","Application Data"
"173","54.868514","66.220.158.19","10.152.152.11","TCP","60","443  >  33650 [ACK] Seq=17894 Ack=9969 Win=2640 Len=0"
"174","54.871072","10.152.152.11","66.220.158.19","TLSv1.1","363","Application Data"
"175","54.871281","66.220.158.19","10.152.152.11","TCP","60","443  >  33650 [ACK] Seq=17894 Ack=10278 Win=2640 Len=0"
"176","54.871386","10.152.152.11","66.220.158.19","TLSv1.1","363","Application Data"
"177","54.871652","66.220.158.19","10.152.152.11","TCP","60","443  >  33650 [ACK] Seq=17894 Ack=10587 Win=2640 Len=0"
"178","54.897798","10.152.152.11","31.13.93.3","TLSv1.1","1211","Application Data"
"179","54.898020","31.13.93.3","10.152.152.11","TCP","60","443  >  34010 [ACK] Seq=5135 Ack=6943 Win=2640 Len=0"
"180","55.350007","66.220.158.19","10.152.152.11","TLSv1.1","123","Application Data"
"181","55.350062","10.152.152.11","66.220.158.19","TCP","54","33650  >  443 [ACK] Seq=10587 Ack=17963 Win=5547 Len=0"
"182","55.368546","31.13.93.3","10.152.152.11","TCP","552","443  >  34010 [PSH, ACK] Seq=5135 Ack=6943 Win=2640 Len=498 [TCP segment of a reassembled PDU]"
"183","55.368628","10.152.152.11","31.13.93.3","TCP","54","34010  >  443 [ACK] Seq=6943 Ack=5633 Win=2640 Len=0"
"184","55.433970","31.13.93.3","10.152.152.11","TLSv1.1","617","Application Data"
"185","55.433996","10.152.152.11","31.13.93.3","TCP","54","34010  >  443 [ACK] Seq=6943 Ack=6196 Win=2640 Len=0"
"186","55.444038","10.152.152.11","31.13.93.3","TLSv1.1","1211","Application Data"
"187","55.444444","31.13.93.3","10.152.152.11","TCP","60","443  >  34010 [ACK] Seq=6196 Ack=8100 Win=2640 Len=0"
"188","55.521658","66.220.158.19","10.152.152.11","TLSv1.1","123","Application Data"
"189","55.521689","10.152.152.11","66.220.158.19","TCP","54","33650  >  443 [ACK] Seq=10587 Ack=18032 Win=5547 Len=0"
"190","55.628123","66.220.158.19","10.152.152.11","TCP","552","443  >  33650 [PSH, ACK] Seq=18032 Ack=10587 Win=2640 Len=498 [TCP segment of a reassembled PDU]"
"191","55.628150","10.152.152.11","66.220.158.19","TCP","54","33650  >  443 [ACK] Seq=10587 Ack=18530 Win=5547 Len=0"
"192","55.694632","66.220.158.19","10.152.152.11","TCP","552","443  >  33650 [PSH, ACK] Seq=18530 Ack=10587 Win=2640 Len=498 [TCP segment of a reassembled PDU]"
"193","55.694657","10.152.152.11","66.220.158.19","TCP","54","33650  >  443 [ACK] Seq=10587 Ack=19028 Win=5547 Len=0"
"194","55.758743","66.220.158.19","10.152.152.11","TLSv1.1","769","Application Data, Application Data, Application Data"
"195","55.758768","10.152.152.11","66.220.158.19","TCP","54","33650  >  443 [ACK] Seq=10587 Ack=19743 Win=5547 Len=0"
"196","55.961365","66.220.158.19","10.152.152.11","TCP","552","443  >  33650 [PSH, ACK] Seq=19743 Ack=10587 Win=2640 Len=498 [TCP segment of a reassembled PDU]"
"197","55.961397","10.152.152.11","66.220.158.19","TCP","54","33650  >  443 [ACK] Seq=10587 Ack=20241 Win=5547 Len=0"
"198","56.133985","66.220.158.19","10.152.152.11","TCP","552","443  >  33650 [PSH, ACK] Seq=20241 Ack=10587 Win=2640 Len=498 [TCP segment of a reassembled PDU]"
"199","56.134016","10.152.152.11","66.220.158.19","TCP","54","33650  >  443 [ACK] Seq=10587 Ack=20739 Win=5547 Len=0"
"200","56.198269","66.220.158.19","10.152.152.11","TLSv1.1","934","Application Data, Application Data, Application Data, Application Data"
"201","56.198294","10.152.152.11","66.220.158.19","TCP","54","33650  >  443 [ACK] Seq=10587 Ack=21619 Win=5547 Len=0"
"202","56.750576","31.13.93.3","10.152.152.11","TCP","552","443  >  34010 [PSH, ACK] Seq=6196 Ack=8100 Win=2640 Len=498 [TCP segment of a reassembled PDU]"
"203","56.787930","10.152.152.11","31.13.93.3","TCP","54","34010  >  443 [ACK] Seq=8100 Ack=6694 Win=2640 Len=0"
"204","56.815219","31.13.93.3","10.152.152.11","TLSv1.1","249","Application Data"
"205","56.815244","10.152.152.11","31.13.93.3","TCP","54","34010  >  443 [ACK] Seq=8100 Ack=6889 Win=2640 Len=0"
"206","56.834232","10.152.152.11","31.13.93.3","TLSv1.1","1211","Application Data"
"207","56.834456","31.13.93.3","10.152.152.11","TCP","60","443  >  34010 [ACK] Seq=6889 Ack=9257 Win=2640 Len=0"
"208","57.376073","31.13.93.3","10.152.152.11","TCP","552","443  >  34010 [PSH, ACK] Seq=6889 Ack=9257 Win=2640 Len=498 [TCP segment of a reassembled PDU]"
"209","57.415934","10.152.152.11","31.13.93.3","TCP","54","34010  >  443 [ACK] Seq=9257 Ack=7387 Win=2640 Len=0"
"210","57.480062","31.13.93.3","10.152.152.11","TLSv1.1","265","Application Data"
"211","57.480088","10.152.152.11","31.13.93.3","TCP","54","34010  >  443 [ACK] Seq=9257 Ack=7598 Win=2640 Len=0"
"212","57.490298","10.152.152.11","31.13.93.3","TLSv1.1","1211","Application Data"
"213","57.490618","31.13.93.3","10.152.152.11","TCP","60","443  >  34010 [ACK] Seq=7598 Ack=10414 Win=2640 Len=0"
"214","68.464754","10.152.152.11","66.220.158.19","TLSv1.1","587","Application Data"
"215","68.465207","66.220.158.19","10.152.152.11","TCP","60","443  >  33650 [ACK] Seq=21619 Ack=11120 Win=2640 Len=0"
"216","68.465877","10.152.152.11","66.220.158.19","TLSv1.1","123","Application Data"
"217","68.466407","66.220.158.19","10.152.152.11","TCP","60","443  >  33650 [ACK] Seq=21619 Ack=11189 Win=2640 Len=0"
"218","68.466930","10.152.152.11","66.220.158.19","TLSv1.1","459","Application Data"
"219","68.467364","66.220.158.19","10.152.152.11","TCP","60","443  >  33650 [ACK] Seq=21619 Ack=11594 Win=2640 Len=0"
"220","68.947248","66.220.158.19","10.152.152.11","TLSv1.1","192","Application Data, Application Data"
"221","68.947335","10.152.152.11","66.220.158.19","TCP","54","33650  >  443 [ACK] Seq=11594 Ack=21757 Win=5547 Len=0"
"222","69.184303","66.220.158.19","10.152.152.11","TCP","552","443  >  33650 [PSH, ACK] Seq=21757 Ack=11594 Win=2640 Len=498 [TCP segment of a reassembled PDU]"
"223","69.184337","10.152.152.11","66.220.158.19","TCP","54","33650  >  443 [ACK] Seq=11594 Ack=22255 Win=5547 Len=0"
"224","69.291911","66.220.158.19","10.152.152.11","TCP","552","443  >  33650 [PSH, ACK] Seq=22255 Ack=11594 Win=2640 Len=498 [TCP segment of a reassembled PDU]"
"225","69.291951","10.152.152.11","66.220.158.19","TCP","54","33650  >  443 [ACK] Seq=11594 Ack=22753 Win=5547 Len=0"
"226","69.356335","66.220.158.19","10.152.152.11","TLSv1.1","1014","Application Data, Application Data, Application Data, Application Data"
"227","69.356361","10.152.152.11","66.220.158.19","TCP","54","33650  >  443 [ACK] Seq=11594 Ack=23713 Win=5547 Len=0"
"228","71.935934","10.152.152.11","173.194.204.188","TCP","54","[TCP Dup ACK 82#1] 34927  >  5228 [ACK] Seq=1 Ack=1 Win=2142 Len=0"
"229","71.936410","173.194.204.188","10.152.152.11","TCP","60","[TCP Dup ACK 83#1] [TCP ACKed unseen segment] 5228  >  34927 [ACK] Seq=1 Ack=2 Win=1248 Len=0"
"230","89.601120","10.152.152.11","104.86.110.33","TCP","54","[TCP Dup ACK 84#1] 33800  >  443 [ACK] Seq=1 Ack=1 Win=1315 Len=0"
"231","89.601592","104.86.110.33","10.152.152.11","TCP","60","[TCP Dup ACK 85#1] [TCP ACKed unseen segment] 443  >  33800 [ACK] Seq=1 Ack=2 Win=1315 Len=0"
"232","89.727964","10.152.152.11","104.86.110.33","TCP","54","[TCP Dup ACK 86#1] 33809  >  443 [ACK] Seq=1 Ack=1 Win=1248 Len=0"
"233","89.728125","10.152.152.11","104.86.110.33","TCP","54","[TCP Dup ACK 87#1] 33796  >  443 [ACK] Seq=1 Ack=1 Win=2640 Len=0"
"234","89.728167","10.152.152.11","104.86.110.33","TCP","54","[TCP Dup ACK 88#1] 33797  >  443 [ACK] Seq=1 Ack=1 Win=1248 Len=0"
"235","89.728205","10.152.152.11","104.86.110.33","TCP","54","[TCP Dup ACK 89#1] 33798  >  443 [ACK] Seq=1 Ack=1 Win=1382 Len=0"
"236","89.728244","10.152.152.11","104.86.110.33","TCP","54","[TCP Dup ACK 90#1] 33801  >  443 [ACK] Seq=1 Ack=1 Win=1296 Len=0"
"237","89.728281","10.152.152.11","104.86.110.33","TCP","54","[TCP Dup ACK 91#1] 33802  >  443 [ACK] Seq=1 Ack=1 Win=2640 Len=0"
"238","89.728328","10.152.152.11","104.86.110.33","TCP","54","[TCP Dup ACK 92#1] 33804  >  443 [ACK] Seq=1 Ack=1 Win=1449 Len=0"
"239","89.728365","10.152.152.11","104.86.110.33","TCP","54","[TCP Dup ACK 93#1] 33805  >  443 [ACK] Seq=1 Ack=1 Win=1382 Len=0"
"240","89.728414","104.86.110.33","10.152.152.11","TCP","60","[TCP Dup ACK 94#1] [TCP ACKed unseen segment] 443  >  33809 [ACK] Seq=1 Ack=2 Win=1248 Len=0"
"241","89.728433","104.86.110.33","10.152.152.11","TCP","60","[TCP Dup ACK 95#1] [TCP ACKed unseen segment] 443  >  33796 [ACK] Seq=1 Ack=2 Win=1650 Len=0"
"242","89.728625","104.86.110.33","10.152.152.11","TCP","60","[TCP Dup ACK 96#1] [TCP ACKed unseen segment] 443  >  33797 [ACK] Seq=1 Ack=2 Win=1248 Len=0"
"243","89.728639","104.86.110.33","10.152.152.11","TCP","60","[TCP Dup ACK 97#1] [TCP ACKed unseen segment] 443  >  33798 [ACK] Seq=1 Ack=2 Win=1382 Len=0"
"244","89.728660","104.86.110.33","10.152.152.11","TCP","60","[TCP Dup ACK 98#1] [TCP ACKed unseen segment] 443  >  33801 [ACK] Seq=1 Ack=2 Win=1181 Len=0"
"245","89.728669","104.86.110.33","10.152.152.11","TCP","60","[TCP Dup ACK 99#1] [TCP ACKed unseen segment] 443  >  33802 [ACK] Seq=1 Ack=2 Win=1784 Len=0"
"246","89.728679","104.86.110.33","10.152.152.11","TCP","60","[TCP Dup ACK 100#1] [TCP ACKed unseen segment] 443  >  33804 [ACK] Seq=1 Ack=2 Win=1449 Len=0"
"247","89.728689","104.86.110.33","10.152.152.11","TCP","60","[TCP Dup ACK 101#1] [TCP ACKed unseen segment] 443  >  33805 [ACK] Seq=1 Ack=2 Win=1382 Len=0"
"248","89.855931","10.152.152.11","104.86.110.33","TCP","54","[TCP Dup ACK 102#1] 33799  >  443 [ACK] Seq=1 Ack=1 Win=1315 Len=0"
"249","89.856459","104.86.110.33","10.152.152.11","TCP","60","[TCP Dup ACK 103#1] [TCP ACKed unseen segment] 443  >  33799 [ACK] Seq=1 Ack=2 Win=1315 Len=0"
"250","90.111925","10.152.152.11","104.86.110.33","TCP","54","[TCP Dup ACK 1#2] 33806  >  443 [ACK] Seq=1 Ack=1 Win=1650 Len=0"
"251","90.112046","10.152.152.11","104.86.110.33","TCP","54","[TCP Dup ACK 2#2] 33807  >  443 [ACK] Seq=1 Ack=1 Win=1516 Len=0"
"252","90.112389","104.86.110.33","10.152.152.11","TCP","60","[TCP Dup ACK 3#2] [TCP ACKed unseen segment] 443  >  33806 [ACK] Seq=1 Ack=2 Win=1650 Len=0"
"253","90.112411","104.86.110.33","10.152.152.11","TCP","60","[TCP Dup ACK 4#2] [TCP ACKed unseen segment] 443  >  33807 [ACK] Seq=1 Ack=2 Win=1516 Len=0"
"254","92.000768","104.86.110.33","10.152.152.11","TLSv1.1","107","[TCP ACKed unseen segment] , Encrypted Alert"
"255","92.000861","10.152.152.11","104.86.110.33","TCP","54","[TCP Previous segment not captured] 33805  >  443 [ACK] Seq=2 Ack=54 Win=1382 Len=0"
"256","92.064994","104.86.110.33","10.152.152.11","TCP","60","[TCP ACKed unseen segment] 443  >  33805 [FIN, ACK] Seq=54 Ack=2 Win=1382 Len=0"
"257","92.065017","104.86.110.33","10.152.152.11","TLSv1.1","107","[TCP ACKed unseen segment] , Encrypted Alert"
"258","92.065090","10.152.152.11","104.86.110.33","TCP","54","[TCP Previous segment not captured] 33798  >  443 [ACK] Seq=2 Ack=54 Win=1382 Len=0"
"259","92.065126","104.86.110.33","10.152.152.11","TCP","60","[TCP ACKed unseen segment] 443  >  33798 [FIN, ACK] Seq=54 Ack=2 Win=1382 Len=0"
"260","92.103928","10.152.152.11","104.86.110.33","TCP","54","33805  >  443 [ACK] Seq=2 Ack=55 Win=1382 Len=0"
"261","92.104069","10.152.152.11","104.86.110.33","TCP","54","33798  >  443 [ACK] Seq=2 Ack=55 Win=1382 Len=0"
"262","94.428447","10.152.152.11","104.86.110.33","TCP","54","33805  >  443 [FIN, ACK] Seq=2 Ack=55 Win=1382 Len=0"
"263","94.428693","10.152.152.11","104.86.110.33","TCP","54","33798  >  443 [FIN, ACK] Seq=2 Ack=55 Win=1382 Len=0"
"264","94.428762","104.86.110.33","10.152.152.11","TCP","60","443  >  33805 [ACK] Seq=55 Ack=3 Win=1382 Len=0"
"265","94.428905","104.86.110.33","10.152.152.11","TCP","60","443  >  33798 [ACK] Seq=55 Ack=3 Win=1382 Len=0"
"266","94.432171","10.152.152.11","66.220.158.19","TLSv1.1","571","Application Data"
"267","94.432468","66.220.158.19","10.152.152.11","TCP","60","443  >  33650 [ACK] Seq=23713 Ack=12111 Win=2640 Len=0"
"268","94.432589","10.152.152.11","66.220.158.19","TLSv1.1","123","Application Data"
"269","94.432814","66.220.158.19","10.152.152.11","TCP","60","443  >  33650 [ACK] Seq=23713 Ack=12180 Win=2640 Len=0"
"270","94.432985","10.152.152.11","66.220.158.19","TLSv1.1","1419","Application Data"
"271","94.433227","66.220.158.19","10.152.152.11","TCP","60","443  >  33650 [ACK] Seq=23713 Ack=13545 Win=2640 Len=0"
"272","94.915748","66.220.158.19","10.152.152.11","TLSv1.1","123","Application Data"
"273","94.915946","10.152.152.11","66.220.158.19","TCP","54","33650  >  443 [ACK] Seq=13545 Ack=23782 Win=5547 Len=0"
"274","95.088185","66.220.158.19","10.152.152.11","TLSv1.1","123","Application Data"
"275","95.088221","10.152.152.11","66.220.158.19","TCP","54","33650  >  443 [ACK] Seq=13545 Ack=23851 Win=5547 Len=0"
"276","95.237809","66.220.158.19","10.152.152.11","TCP","552","443  >  33650 [PSH, ACK] Seq=23851 Ack=13545 Win=2640 Len=498 [TCP segment of a reassembled PDU]"
"277","95.237838","10.152.152.11","66.220.158.19","TCP","54","33650  >  443 [ACK] Seq=13545 Ack=24349 Win=5547 Len=0"
"278","95.260730","66.220.158.19","10.152.152.11","TCP","552","443  >  33650 [PSH, ACK] Seq=24349 Ack=13545 Win=2640 Len=498 [TCP segment of a reassembled PDU]"
"279","95.260755","10.152.152.11","66.220.158.19","TCP","54","33650  >  443 [ACK] Seq=13545 Ack=24847 Win=5547 Len=0"
"280","95.302340","66.220.158.19","10.152.152.11","TLSv1.1","876","Application Data, Application Data"
"281","95.302376","10.152.152.11","66.220.158.19","TCP","54","33650  >  443 [ACK] Seq=13545 Ack=25669 Win=5547 Len=0"
"282","95.431673","66.220.158.19","10.152.152.11","TLSv1.1","123","Application Data"
"283","95.431702","10.152.152.11","66.220.158.19","TCP","54","33650  >  443 [ACK] Seq=13545 Ack=25738 Win=5547 Len=0"
"284","95.999980","10.152.152.11","46.229.224.29","TCP","54","[TCP Dup ACK 5#2] 56005  >  443 [ACK] Seq=1 Ack=1 Win=2640 Len=0"
"285","96.000441","46.229.224.29","10.152.152.11","TCP","60","[TCP Dup ACK 6#2] [TCP ACKed unseen segment] 443  >  56005 [ACK] Seq=1 Ack=2 Win=2026 Len=0"
"286","97.305371","10.152.152.11","66.220.158.19","TLSv1.1","363","Application Data"
"287","97.305649","66.220.158.19","10.152.152.11","TCP","60","443  >  33650 [ACK] Seq=25738 Ack=13854 Win=2640 Len=0"
"288","97.305682","10.152.152.11","66.220.158.19","TCP","1514","33650  >  443 [ACK] Seq=13854 Ack=25738 Win=5547 Len=1460 [TCP segment of a reassembled PDU]"
"289","97.305701","10.152.152.11","66.220.158.19","TLSv1.1","375","Application Data"
"290","97.305859","66.220.158.19","10.152.152.11","TCP","60","443  >  33650 [ACK] Seq=25738 Ack=15314 Win=2640 Len=0"
"291","97.305887","66.220.158.19","10.152.152.11","TCP","60","443  >  33650 [ACK] Seq=25738 Ack=15635 Win=2620 Len=0"
"292","97.701069","66.220.158.19","10.152.152.11","TLSv1.1","123","Application Data"
"293","97.701161","10.152.152.11","66.220.158.19","TCP","54","33650  >  443 [ACK] Seq=15635 Ack=25807 Win=5547 Len=0"
"294","98.151118","31.13.93.3","10.152.152.11","TCP","552","443  >  34010 [PSH, ACK] Seq=7598 Ack=10414 Win=2640 Len=498 [TCP segment of a reassembled PDU]"
"295","98.187927","10.152.152.11","31.13.93.3","TCP","54","34010  >  443 [ACK] Seq=10414 Ack=8096 Win=2640 Len=0"
"296","98.188408","31.13.93.3","10.152.152.11","TLSv1.1","697","Application Data"
"297","98.188433","10.152.152.11","31.13.93.3","TCP","54","34010  >  443 [ACK] Seq=10414 Ack=8739 Win=2640 Len=0"
"298","98.215577","66.220.158.19","10.152.152.11","TCP","552","443  >  33650 [PSH, ACK] Seq=25807 Ack=15635 Win=2640 Len=498 [TCP segment of a reassembled PDU]"
"299","98.215595","10.152.152.11","66.220.158.19","TCP","54","33650  >  443 [ACK] Seq=15635 Ack=26305 Win=5547 Len=0"
"300","98.232786","10.152.152.11","31.13.93.3","TLSv1.1","1211","Application Data"
"301","98.233167","31.13.93.3","10.152.152.11","TCP","60","443  >  34010 [ACK] Seq=8739 Ack=11571 Win=2640 Len=0"
"302","98.346329","66.220.158.19","10.152.152.11","TCP","552","443  >  33650 [PSH, ACK] Seq=26305 Ack=15635 Win=2640 Len=498 [TCP segment of a reassembled PDU]"
"303","98.346365","10.152.152.11","66.220.158.19","TCP","54","33650  >  443 [ACK] Seq=15635 Ack=26803 Win=5547 Len=0"
"304","98.413966","66.220.158.19","10.152.152.11","TLSv1.1","1078","Application Data, Application Data, Application Data, Application Data"
"305","98.413997","10.152.152.11","66.220.158.19","TCP","54","33650  >  443 [ACK] Seq=15635 Ack=27827 Win=5547 Len=0"
"306","99.035641","31.13.93.3","10.152.152.11","TCP","552","443  >  34010 [PSH, ACK] Seq=8739 Ack=11571 Win=2640 Len=498 [TCP segment of a reassembled PDU]"
"307","99.035731","10.152.152.11","31.13.93.3","TCP","54","34010  >  443 [ACK] Seq=11571 Ack=9237 Win=2640 Len=0"
"308","99.100428","31.13.93.3","10.152.152.11","TLSv1.1","457","Application Data"
"309","99.100454","10.152.152.11","31.13.93.3","TCP","54","34010  >  443 [ACK] Seq=11571 Ack=9640 Win=2640 Len=0"
"310","99.108469","10.152.152.11","31.13.93.3","TLSv1.1","1211","Application Data"
"311","99.108819","31.13.93.3","10.152.152.11","TCP","60","443  >  34010 [ACK] Seq=9640 Ack=12728 Win=2640 Len=0"
"312","99.327870","10.152.152.11","46.229.224.44","TCP","54","[TCP Dup ACK 7#2] 39920  >  443 [ACK] Seq=1 Ack=1 Win=2622 Len=0"
"313","99.328391","46.229.224.44","10.152.152.11","TCP","60","[TCP Dup ACK 8#2] [TCP ACKed unseen segment] 443  >  39920 [ACK] Seq=1 Ack=2 Win=1449 Len=0"
"314","99.639543","31.13.93.3","10.152.152.11","TCP","552","443  >  34010 [PSH, ACK] Seq=9640 Ack=12728 Win=2640 Len=498 [TCP segment of a reassembled PDU]"
"315","99.675912","10.152.152.11","31.13.93.3","TCP","54","34010  >  443 [ACK] Seq=12728 Ack=10138 Win=2640 Len=0"
"316","99.744084","31.13.93.3","10.152.152.11","TLSv1.1","153","Application Data"
"317","99.744112","10.152.152.11","31.13.93.3","TCP","54","34010  >  443 [ACK] Seq=12728 Ack=10237 Win=2640 Len=0"
"318","99.756134","10.152.152.11","31.13.93.3","TLSv1.1","1211","Application Data"
"319","99.756420","31.13.93.3","10.152.152.11","TCP","60","443  >  34010 [ACK] Seq=10237 Ack=13885 Win=2640 Len=0"
"320","107.626530","10.152.152.11","66.220.158.19","TLSv1.1","699","Application Data"
"321","107.626788","10.152.152.11","66.220.158.19","TLSv1.1","827","Application Data"
"322","107.626822","66.220.158.19","10.152.152.11","TCP","60","443  >  33650 [ACK] Seq=27827 Ack=16280 Win=2640 Len=0"
"323","107.627018","66.220.158.19","10.152.152.11","TCP","60","443  >  33650 [ACK] Seq=27827 Ack=17053 Win=2592 Len=0"
"324","108.254939","66.220.158.19","10.152.152.11","TLSv1.1","123","Application Data"
"325","108.255046","10.152.152.11","66.220.158.19","TCP","54","33650  >  443 [ACK] Seq=17053 Ack=27896 Win=5547 Len=0"
"326","108.754651","66.220.158.19","10.152.152.11","TCP","552","443  >  33650 [PSH, ACK] Seq=27896 Ack=17053 Win=2640 Len=498 [TCP segment of a reassembled PDU]"
"327","108.754687","10.152.152.11","66.220.158.19","TCP","54","33650  >  443 [ACK] Seq=17053 Ack=28394 Win=5547 Len=0"
"328","108.756793","66.220.158.19","10.152.152.11","TLSv1.1","1514","Application Data [TCP segment of a reassembled PDU]"
"329","108.756820","10.152.152.11","66.220.158.19","TCP","54","33650  >  443 [ACK] Seq=17053 Ack=29854 Win=5547 Len=0"
"330","108.756925","66.220.158.19","10.152.152.11","TLSv1.1","1514","Application Data [TCP segment of a reassembled PDU]"
"331","108.756943","10.152.152.11","66.220.158.19","TCP","54","33650  >  443 [ACK] Seq=17053 Ack=31314 Win=5547 Len=0"
"332","108.757254","66.220.158.19","10.152.152.11","TCP","620","443  >  33650 [PSH, ACK] Seq=31314 Ack=17053 Win=2640 Len=566 [TCP segment of a reassembled PDU]"
"333","108.757277","10.152.152.11","66.220.158.19","TCP","54","33650  >  443 [ACK] Seq=17053 Ack=31880 Win=5547 Len=0"
"334","108.757688","66.220.158.19","10.152.152.11","TLSv1.1","552","Application Data [TCP segment of a reassembled PDU]"
