"No.","Time","Source","Destination","Protocol","Length","Info"
"1","0.000000","10.152.152.11","173.194.123.41","TCP","54","55665  >  443 [ACK] Seq=1 Ack=1 Win=5665 Len=0"
"2","0.000436","173.194.123.41","10.152.152.11","TCP","60","[TCP ACKed unseen segment] 443  >  55665 [ACK] Seq=1 Ack=2 Win=2640 Len=0"
"3","0.966283","173.194.123.32","10.152.152.11","TLSv1.1","208","Application Data, Application Data"
"4","0.967911","10.152.152.11","173.194.123.32","TCP","54","60022  >  443 [FIN, ACK] Seq=1 Ack=155 Win=2640 Len=0"
"5","0.968599","173.194.123.32","10.152.152.11","TCP","60","443  >  60022 [FIN, ACK] Seq=155 Ack=2 Win=1319 Len=0"
"6","0.968635","10.152.152.11","173.194.123.32","TCP","54","60022  >  443 [ACK] Seq=2 Ack=156 Win=2640 Len=0"
"7","1.280026","10.152.152.11","74.125.141.105","TCP","54","49831  >  443 [ACK] Seq=1 Ack=1 Win=2440 Len=0"
"8","1.280412","74.125.141.105","10.152.152.11","TCP","60","[TCP ACKed unseen segment] 443  >  49831 [ACK] Seq=1 Ack=2 Win=1467 Len=0"
"9","2.175988","10.152.152.11","173.194.123.45","TCP","54","55230  >  443 [ACK] Seq=1 Ack=1 Win=1710 Len=0"
"10","2.176455","173.194.123.45","10.152.152.11","TCP","60","[TCP ACKed unseen segment] 443  >  55230 [ACK] Seq=1 Ack=2 Win=1118 Len=0"
"11","2.304009","10.152.152.11","216.58.219.237","TCP","54","58019  >  443 [ACK] Seq=1 Ack=1 Win=2640 Len=0"
"12","2.304498","216.58.219.237","10.152.152.11","TCP","60","[TCP ACKed unseen segment] 443  >  58019 [ACK] Seq=1 Ack=2 Win=1650 Len=0"
"13","2.395346","216.58.219.227","10.152.152.11","TLSv1.1","208","Application Data, Application Data"
"14","2.396814","10.152.152.11","216.58.219.227","TCP","54","40425  >  443 [FIN, ACK] Seq=1 Ack=155 Win=2440 Len=0"
"15","2.397398","216.58.219.227","10.152.152.11","TCP","60","443  >  40425 [FIN, ACK] Seq=155 Ack=2 Win=1229 Len=0"
"16","2.397431","10.152.152.11","216.58.219.227","TCP","54","40425  >  443 [ACK] Seq=2 Ack=156 Win=2440 Len=0"
"17","2.581779","216.58.219.227","10.152.152.11","TLSv1.1","208","Application Data, Application Data"
"18","2.583367","10.152.152.11","216.58.219.227","TCP","54","40427  >  443 [FIN, ACK] Seq=1 Ack=155 Win=2622 Len=0"
"19","2.584743","216.58.219.227","10.152.152.11","TCP","60","443  >  40427 [FIN, ACK] Seq=155 Ack=2 Win=1229 Len=0"
"20","2.584780","10.152.152.11","216.58.219.227","TCP","54","40427  >  443 [ACK] Seq=2 Ack=156 Win=2622 Len=0"
"21","2.687969","10.152.152.11","173.194.123.32","TCP","54","60002  >  443 [ACK] Seq=1 Ack=1 Win=2257 Len=0"
"22","2.688356","173.194.123.32","10.152.152.11","TCP","60","[TCP ACKed unseen segment] 443  >  60002 [ACK] Seq=1 Ack=2 Win=1248 Len=0"
"23","3.840802","10.152.152.11","173.194.123.57","TCP","54","46654  >  443 [ACK] Seq=1 Ack=1 Win=1825 Len=0"
"24","3.841277","173.194.123.57","10.152.152.11","TCP","60","[TCP ACKed unseen segment] 443  >  46654 [ACK] Seq=1 Ack=2 Win=1164 Len=0"
"25","7.071951","10.152.152.11","173.194.123.46","TCP","54","56383  >  443 [ACK] Seq=1 Ack=1 Win=2440 Len=0"
"26","7.072473","173.194.123.46","10.152.152.11","TCP","60","[TCP ACKed unseen segment] 443  >  56383 [ACK] Seq=1 Ack=2 Win=3091 Len=0"
"27","10.004405","10.152.152.11","173.194.123.46","TCP","1514","56367  >  443 [ACK] Seq=1 Ack=1 Win=2640 Len=1460 [TCP segment of a reassembled PDU]"
"28","10.004501","10.152.152.11","173.194.123.46","TLSv1.1","1159","Application Data"
"29","10.004796","173.194.123.46","10.152.152.11","TCP","60","443  >  56367 [ACK] Seq=1 Ack=1461 Win=4601 Len=0"
"30","10.004857","173.194.123.46","10.152.152.11","TCP","60","443  >  56367 [ACK] Seq=1 Ack=2566 Win=4601 Len=0"
"31","10.005140","10.152.152.11","173.194.123.46","TLSv1.1","123","Application Data"
"32","10.005377","173.194.123.46","10.152.152.11","TCP","60","443  >  56367 [ACK] Seq=1 Ack=2635 Win=4601 Len=0"
"33","10.005475","10.152.152.11","173.194.123.46","TLSv1.1","251","Application Data"
"34","10.005721","173.194.123.46","10.152.152.11","TCP","60","443  >  56367 [ACK] Seq=1 Ack=2832 Win=4601 Len=0"
"35","10.459946","173.194.123.46","10.152.152.11","TLSv1.1","123","Application Data"
"36","10.499980","10.152.152.11","173.194.123.46","TCP","54","56367  >  443 [ACK] Seq=2832 Ack=70 Win=2640 Len=0"
"37","10.528872","173.194.123.47","10.152.152.11","TLSv1.1","208","Application Data, Application Data"
"38","10.530557","10.152.152.11","173.194.123.47","TCP","54","57496  >  443 [FIN, ACK] Seq=1 Ack=155 Win=2640 Len=0"
"39","10.531264","173.194.123.47","10.152.152.11","TCP","60","443  >  57496 [FIN, ACK] Seq=155 Ack=2 Win=1516 Len=0"
"40","10.531379","10.152.152.11","173.194.123.47","TCP","54","57496  >  443 [ACK] Seq=2 Ack=156 Win=2640 Len=0"
"41","10.565281","173.194.123.46","10.152.152.11","TLSv1.1","373","Application Data, Application Data, Application Data"
"42","10.565313","10.152.152.11","173.194.123.46","TCP","54","56367  >  443 [ACK] Seq=2832 Ack=389 Win=2640 Len=0"
"43","10.568851","10.152.152.11","173.194.123.46","TLSv1.1","123","Application Data"
"44","10.569274","173.194.123.46","10.152.152.11","TCP","60","443  >  56367 [ACK] Seq=389 Ack=2901 Win=4601 Len=0"
"45","10.593746","74.125.22.189","10.152.152.11","TLSv1.1","592","Application Data, Application Data"
"46","10.593832","10.152.152.11","74.125.22.189","TCP","54","58421  >  443 [ACK] Seq=1 Ack=539 Win=2640 Len=0"
"47","10.596341","10.152.152.11","74.125.22.189","TLSv1.1","123","Application Data"
"48","10.596773","74.125.22.189","10.152.152.11","TCP","60","443  >  58421 [ACK] Seq=539 Ack=70 Win=2640 Len=0"
"49","10.609975","10.152.152.11","74.125.22.189","TCP","1514","58421  >  443 [ACK] Seq=70 Ack=539 Win=2640 Len=1460 [TCP segment of a reassembled PDU]"
"50","10.610088","10.152.152.11","74.125.22.189","TLSv1.1","711","Application Data"
"51","10.610385","74.125.22.189","10.152.152.11","TCP","60","443  >  58421 [ACK] Seq=539 Ack=1530 Win=2640 Len=0"
"52","10.610400","74.125.22.189","10.152.152.11","TCP","60","443  >  58421 [ACK] Seq=539 Ack=2187 Win=2599 Len=0"
"53","10.859957","10.152.152.11","173.194.123.54","TCP","1514","33567  >  443 [ACK] Seq=1 Ack=1 Win=22006 Len=1460 [TCP segment of a reassembled PDU]"
"54","10.860015","10.152.152.11","173.194.123.54","TCP","1514","33567  >  443 [ACK] Seq=1461 Ack=1 Win=22006 Len=1460 [TCP segment of a reassembled PDU]"
"55","10.860026","10.152.152.11","173.194.123.54","TLSv1.1","195","Application Data"
"56","10.860349","173.194.123.54","10.152.152.11","TCP","60","443  >  33567 [ACK] Seq=1 Ack=1461 Win=5622 Len=0"
"57","10.860364","173.194.123.54","10.152.152.11","TCP","60","443  >  33567 [ACK] Seq=1 Ack=2921 Win=5622 Len=0"
"58","10.860370","173.194.123.54","10.152.152.11","TCP","60","443  >  33567 [ACK] Seq=1 Ack=3062 Win=5622 Len=0"
"59","10.860654","10.152.152.11","173.194.123.54","TLSv1.1","123","Application Data"
"60","10.860773","173.194.123.54","10.152.152.11","TCP","60","443  >  33567 [ACK] Seq=1 Ack=3131 Win=5622 Len=0"
"61","11.008026","10.152.152.11","216.58.219.237","TCP","54","58032  >  443 [ACK] Seq=1 Ack=1 Win=4647 Len=0"
"62","11.008201","10.152.152.11","173.194.123.33","TCP","54","46986  >  443 [ACK] Seq=1 Ack=1 Win=5217 Len=0"
"63","11.008373","216.58.219.237","10.152.152.11","TCP","60","[TCP ACKed unseen segment] 443  >  58032 [ACK] Seq=1 Ack=2 Win=2640 Len=0"
"64","11.008385","173.194.123.33","10.152.152.11","TCP","60","[TCP ACKed unseen segment] 443  >  46986 [ACK] Seq=1 Ack=2 Win=2640 Len=0"
"65","11.057692","74.125.22.189","10.152.152.11","TLSv1.1","224","Application Data, Application Data"
"66","11.095983","10.152.152.11","74.125.22.189","TCP","54","58421  >  443 [ACK] Seq=2187 Ack=709 Win=2640 Len=0"
"67","11.344516","173.194.123.54","10.152.152.11","TLSv1.1","123","Application Data"
"68","11.383966","10.152.152.11","173.194.123.54","TCP","54","33567  >  443 [ACK] Seq=3131 Ack=70 Win=22006 Len=0"
"69","11.450645","173.194.123.54","10.152.152.11","TLSv1.1","552","Application Data"
"70","11.450685","10.152.152.11","173.194.123.54","TCP","54","33567  >  443 [ACK] Seq=3131 Ack=568 Win=22006 Len=0"
"71","11.515049","173.194.123.54","10.152.152.11","TLSv1.1","563","Application Data, Application Data"
"72","11.515075","10.152.152.11","173.194.123.54","TCP","54","33567  >  443 [ACK] Seq=3131 Ack=1077 Win=22006 Len=0"
"73","11.516865","10.152.152.11","173.194.123.54","TLSv1.1","123","Application Data"
"74","11.517308","173.194.123.54","10.152.152.11","TCP","60","443  >  33567 [ACK] Seq=1077 Ack=3200 Win=5622 Len=0"
"75","13.055989","10.152.152.11","173.194.123.43","TCP","54","47894  >  443 [ACK] Seq=1 Ack=1 Win=2640 Len=0"
"76","13.056499","173.194.123.43","10.152.152.11","TCP","60","[TCP ACKed unseen segment] 443  >  47894 [ACK] Seq=1 Ack=2 Win=1527 Len=0"
"77","14.950477","74.125.141.105","10.152.152.11","TLSv1.1","208","[TCP ACKed unseen segment] , Application Data, Application Data"
"78","14.951559","10.152.152.11","74.125.141.105","TCP","54","[TCP Previous segment not captured] 49831  >  443 [FIN, ACK] Seq=2 Ack=155 Win=2622 Len=0"
"79","14.952103","74.125.141.105","10.152.152.11","TCP","60","[TCP ACKed unseen segment] 443  >  49831 [FIN, ACK] Seq=155 Ack=3 Win=1467 Len=0"
"80","14.952126","10.152.152.11","74.125.141.105","TCP","54","49831  >  443 [ACK] Seq=3 Ack=156 Win=2622 Len=0"
"81","15.381355","10.152.152.11","173.194.123.46","TCP","1514","56367  >  443 [ACK] Seq=2901 Ack=389 Win=2640 Len=1460 [TCP segment of a reassembled PDU]"
"82","15.381468","10.152.152.11","173.194.123.46","TLSv1.1","1159","Application Data"
"83","15.381666","173.194.123.46","10.152.152.11","TCP","60","443  >  56367 [ACK] Seq=389 Ack=4361 Win=4601 Len=0"
"84","15.381681","173.194.123.46","10.152.152.11","TCP","60","443  >  56367 [ACK] Seq=389 Ack=5466 Win=4601 Len=0"
"85","15.381922","10.152.152.11","173.194.123.46","TLSv1.1","251","Application Data"
"86","15.382163","173.194.123.46","10.152.152.11","TCP","60","443  >  56367 [ACK] Seq=389 Ack=5663 Win=4601 Len=0"
"87","15.897597","173.194.123.46","10.152.152.11","TLSv1.1","373","Application Data, Application Data, Application Data"
"88","15.899405","10.152.152.11","173.194.123.46","TLSv1.1","123","Application Data"
"89","15.899716","173.194.123.46","10.152.152.11","TCP","60","443  >  56367 [ACK] Seq=708 Ack=5732 Win=4601 Len=0"
"90","16.003268","74.125.22.189","10.152.152.11","TLSv1.1","523","Application Data"
"91","16.003300","10.152.152.11","74.125.22.189","TCP","54","58421  >  443 [ACK] Seq=2187 Ack=1178 Win=2640 Len=0"
"92","16.127966","10.152.152.11","173.194.123.46","TCP","54","56349  >  443 [ACK] Seq=1 Ack=1 Win=2640 Len=0"
"93","16.128405","173.194.123.46","10.152.152.11","TCP","60","[TCP ACKed unseen segment] 443  >  56349 [ACK] Seq=1 Ack=2 Win=2640 Len=0"
"94","16.823908","173.194.123.45","10.152.152.11","TLSv1.1","208","[TCP ACKed unseen segment] , Application Data, Application Data"
"95","16.824280","10.152.152.11","173.194.123.45","TCP","54","[TCP Previous segment not captured] 55230  >  443 [FIN, ACK] Seq=2 Ack=155 Win=1892 Len=0"
"96","16.824573","173.194.123.45","10.152.152.11","TCP","60","[TCP ACKed unseen segment] 443  >  55230 [FIN, ACK] Seq=155 Ack=3 Win=1118 Len=0"
"97","16.824584","10.152.152.11","173.194.123.45","TCP","54","55230  >  443 [ACK] Seq=3 Ack=156 Win=1892 Len=0"
"98","16.994424","216.58.219.237","10.152.152.11","TLSv1.1","208","[TCP ACKed unseen segment] , Application Data, Application Data"
"99","16.994516","216.58.219.237","10.152.152.11","TCP","60","[TCP ACKed unseen segment] 443  >  58019 [FIN, ACK] Seq=155 Ack=2 Win=1650 Len=0"
"100","16.996022","10.152.152.11","216.58.219.237","TCP","54","[TCP Previous segment not captured] 58019  >  443 [FIN, ACK] Seq=2 Ack=156 Win=2640 Len=0"
"101","16.996514","216.58.219.237","10.152.152.11","TCP","60","[TCP ACKed unseen segment] 443  >  58019 [ACK] Seq=156 Ack=3 Win=1650 Len=0"
"102","17.154252","10.152.152.11","173.194.123.41","TCP","1514","[TCP Previous segment not captured] 55665  >  443 [ACK] Seq=2 Ack=1 Win=5665 Len=1460 [TCP segment of a reassembled PDU]"
"103","17.154355","10.152.152.11","173.194.123.41","TLSv1.1","1111","Application Data"
"104","17.154582","173.194.123.41","10.152.152.11","TCP","60","[TCP ACKed unseen segment] 443  >  55665 [ACK] Seq=1 Ack=1462 Win=2640 Len=0"
"105","17.154594","173.194.123.41","10.152.152.11","TCP","60","443  >  55665 [ACK] Seq=1 Ack=2519 Win=2591 Len=0"
"106","17.154746","10.152.152.11","173.194.123.41","TLSv1.1","123","Application Data"
"107","17.154915","173.194.123.41","10.152.152.11","TCP","60","443  >  55665 [ACK] Seq=1 Ack=2588 Win=2640 Len=0"
"108","17.155140","10.152.152.11","173.194.123.41","TLSv1.1","1163","Application Data"
"109","17.155343","173.194.123.41","10.152.152.11","TCP","60","443  >  55665 [ACK] Seq=1 Ack=3697 Win=2639 Len=0"
"110","17.244673","74.125.22.189","10.152.152.11","TLSv1.1","523","Application Data"
"111","17.244701","10.152.152.11","74.125.22.189","TCP","54","58421  >  443 [ACK] Seq=2187 Ack=1647 Win=2640 Len=0"
"112","17.368813","173.194.123.32","10.152.152.11","TLSv1.1","208","[TCP ACKed unseen segment] , Application Data, Application Data"
"113","17.369713","10.152.152.11","173.194.123.32","TCP","54","[TCP Previous segment not captured] 60002  >  443 [FIN, ACK] Seq=2 Ack=155 Win=2440 Len=0"
"114","17.370145","173.194.123.32","10.152.152.11","TCP","60","[TCP ACKed unseen segment] 443  >  60002 [FIN, ACK] Seq=155 Ack=3 Win=1248 Len=0"
"115","17.370204","10.152.152.11","173.194.123.32","TCP","54","60002  >  443 [ACK] Seq=3 Ack=156 Win=2440 Len=0"
"116","17.407874","10.152.152.11","173.194.116.120","TCP","54","41329  >  443 [ACK] Seq=1 Ack=1 Win=2190 Len=0"
"117","17.408225","173.194.116.120","10.152.152.11","TCP","60","[TCP ACKed unseen segment] 443  >  41329 [ACK] Seq=1 Ack=2 Win=1363 Len=0"
"118","17.537258","74.125.22.189","10.152.152.11","TLSv1.1","539","Application Data"
"119","17.537289","10.152.152.11","74.125.22.189","TCP","54","58421  >  443 [ACK] Seq=2187 Ack=2132 Win=2640 Len=0"
"120","17.625974","173.194.123.41","10.152.152.11","TLSv1.1","123","Application Data"
"121","17.663963","10.152.152.11","173.194.123.41","TCP","54","55665  >  443 [ACK] Seq=3697 Ack=70 Win=5665 Len=0"
"122","17.733121","173.194.123.41","10.152.152.11","TLSv1.1","240","Application Data, Application Data"
"123","17.733149","10.152.152.11","173.194.123.41","TCP","54","55665  >  443 [ACK] Seq=3697 Ack=256 Win=5665 Len=0"
"124","17.797661","173.194.123.41","10.152.152.11","TLSv1.1","192","Application Data, Application Data"
"125","17.797690","10.152.152.11","173.194.123.41","TCP","54","55665  >  443 [ACK] Seq=3697 Ack=394 Win=5665 Len=0"
"126","17.798976","10.152.152.11","173.194.123.41","TLSv1.1","123","Application Data"
"127","17.799395","173.194.123.41","10.152.152.11","TCP","60","443  >  55665 [ACK] Seq=394 Ack=3766 Win=2640 Len=0"
"128","18.063929","10.152.152.11","173.194.123.46","TCP","54","56345  >  443 [ACK] Seq=1 Ack=1 Win=2640 Len=0"
"129","18.064353","173.194.123.46","10.152.152.11","TCP","60","[TCP ACKed unseen segment] 443  >  56345 [ACK] Seq=1 Ack=2 Win=2640 Len=0"
"130","18.415968","173.194.123.57","10.152.152.11","TLSv1.1","208","[TCP ACKed unseen segment] , Application Data, Application Data"
"131","18.416911","10.152.152.11","173.194.123.57","TCP","54","[TCP Previous segment not captured] 46654  >  443 [FIN, ACK] Seq=2 Ack=155 Win=2008 Len=0"
"132","18.417577","173.194.123.57","10.152.152.11","TCP","60","[TCP ACKed unseen segment] 443  >  46654 [FIN, ACK] Seq=155 Ack=3 Win=1164 Len=0"
"133","18.417683","10.152.152.11","173.194.123.57","TCP","54","46654  >  443 [ACK] Seq=3 Ack=156 Win=2008 Len=0"
"134","18.479091","10.152.152.11","173.194.123.46","TCP","1514","56367  >  443 [ACK] Seq=5732 Ack=708 Win=2640 Len=1460 [TCP segment of a reassembled PDU]"
"135","18.479235","10.152.152.11","173.194.123.46","TLSv1.1","1159","Application Data"
"136","18.479526","173.194.123.46","10.152.152.11","TCP","60","443  >  56367 [ACK] Seq=708 Ack=7192 Win=4601 Len=0"
"137","18.479547","173.194.123.46","10.152.152.11","TCP","60","443  >  56367 [ACK] Seq=708 Ack=8297 Win=4601 Len=0"
"138","18.479954","10.152.152.11","173.194.123.46","TLSv1.1","251","Application Data"
"139","18.480277","173.194.123.46","10.152.152.11","TCP","60","443  >  56367 [ACK] Seq=708 Ack=8494 Win=4601 Len=0"
"140","18.942223","173.194.123.46","10.152.152.11","TLSv1.1","373","Application Data, Application Data, Application Data"
"141","18.945540","10.152.152.11","173.194.123.46","TLSv1.1","123","Application Data"
"142","18.945972","173.194.123.46","10.152.152.11","TCP","60","443  >  56367 [ACK] Seq=1027 Ack=8563 Win=4601 Len=0"
"143","20.383279","10.152.152.11","173.194.123.46","TCP","1514","56367  >  443 [ACK] Seq=8563 Ack=1027 Win=2640 Len=1460 [TCP segment of a reassembled PDU]"
"144","20.383316","10.152.152.11","173.194.123.46","TLSv1.1","1159","Application Data"
"145","20.383544","173.194.123.46","10.152.152.11","TCP","60","443  >  56367 [ACK] Seq=1027 Ack=10023 Win=4601 Len=0"
"146","20.383592","173.194.123.46","10.152.152.11","TCP","60","443  >  56367 [ACK] Seq=1027 Ack=11128 Win=4601 Len=0"
"147","20.383596","10.152.152.11","173.194.123.46","TLSv1.1","251","Application Data"
"148","20.383748","173.194.123.46","10.152.152.11","TCP","60","443  >  56367 [ACK] Seq=1027 Ack=11325 Win=4601 Len=0"
"149","20.905186","173.194.123.46","10.152.152.11","TLSv1.1","373","Application Data, Application Data, Application Data"
"150","20.909440","10.152.152.11","173.194.123.46","TLSv1.1","123","Application Data"
"151","20.909768","173.194.123.46","10.152.152.11","TCP","60","443  >  56367 [ACK] Seq=1346 Ack=11394 Win=4601 Len=0"
"152","21.010891","74.125.22.189","10.152.152.11","TLSv1.1","523","Application Data"
"153","21.010935","10.152.152.11","74.125.22.189","TCP","54","58421  >  443 [ACK] Seq=2187 Ack=2601 Win=2640 Len=0"
"154","21.515298","10.152.152.11","173.194.123.46","TCP","1514","[TCP Previous segment not captured] 56383  >  443 [ACK] Seq=2 Ack=1 Win=2440 Len=1460 [TCP segment of a reassembled PDU]"
"155","21.515354","10.152.152.11","173.194.123.46","TLSv1.1","1095","Application Data"
"156","21.515598","173.194.123.46","10.152.152.11","TCP","60","[TCP ACKed unseen segment] 443  >  56383 [ACK] Seq=1 Ack=1462 Win=3070 Len=0"
"157","21.515613","173.194.123.46","10.152.152.11","TCP","60","443  >  56383 [ACK] Seq=1 Ack=2503 Win=3005 Len=0"
"158","21.515751","10.152.152.11","173.194.123.46","TLSv1.1","123","Application Data"
"159","21.515962","173.194.123.46","10.152.152.11","TCP","60","443  >  56383 [ACK] Seq=1 Ack=2572 Win=3091 Len=0"
"160","21.516185","10.152.152.11","173.194.123.46","TCP","1514","56383  >  443 [ACK] Seq=2572 Ack=1 Win=2440 Len=1460 [TCP segment of a reassembled PDU]"
"161","21.516244","10.152.152.11","173.194.123.46","TLSv1.1","1511","Application Data"
"162","21.516428","173.194.123.46","10.152.152.11","TCP","60","443  >  56383 [ACK] Seq=1 Ack=4032 Win=3048 Len=0"
"163","21.516439","173.194.123.46","10.152.152.11","TCP","60","443  >  56383 [ACK] Seq=1 Ack=5489 Win=2978 Len=0"
"164","21.516611","10.152.152.11","173.194.123.46","TCP","1514","56383  >  443 [ACK] Seq=5489 Ack=1 Win=2440 Len=1460 [TCP segment of a reassembled PDU]"
"165","21.516664","10.152.152.11","173.194.123.46","TLSv1.1","1511","Application Data"
"166","21.516829","173.194.123.46","10.152.152.11","TCP","60","443  >  56383 [ACK] Seq=1 Ack=6949 Win=3070 Len=0"
"167","21.516836","173.194.123.46","10.152.152.11","TCP","60","443  >  56383 [ACK] Seq=1 Ack=8406 Win=3000 Len=0"
"168","21.516989","10.152.152.11","173.194.123.46","TCP","1514","56383  >  443 [ACK] Seq=8406 Ack=1 Win=2440 Len=1460 [TCP segment of a reassembled PDU]"
"169","21.517031","10.152.152.11","173.194.123.46","TLSv1.1","1511","Application Data"
"170","21.517170","173.194.123.46","10.152.152.11","TCP","60","443  >  56383 [ACK] Seq=1 Ack=9866 Win=2930 Len=0"
"171","21.517178","173.194.123.46","10.152.152.11","TCP","60","443  >  56383 [ACK] Seq=1 Ack=11323 Win=2860 Len=0"
"172","21.517435","10.152.152.11","173.194.123.46","TCP","1514","56383  >  443 [ACK] Seq=11323 Ack=1 Win=2440 Len=1460 [TCP segment of a reassembled PDU]"
"173","21.517479","10.152.152.11","173.194.123.46","TLSv1.1","1511","Application Data"
"174","21.517614","173.194.123.46","10.152.152.11","TCP","60","443  >  56383 [ACK] Seq=1 Ack=12783 Win=3070 Len=0"
"175","21.517622","173.194.123.46","10.152.152.11","TCP","60","443  >  56383 [ACK] Seq=1 Ack=14240 Win=3000 Len=0"
"176","21.517815","10.152.152.11","173.194.123.46","TCP","1514","56383  >  443 [ACK] Seq=14240 Ack=1 Win=2440 Len=1460 [TCP segment of a reassembled PDU]"
"177","21.517860","10.152.152.11","173.194.123.46","TLSv1.1","1511","Application Data"
"178","21.517951","173.194.123.46","10.152.152.11","TCP","60","443  >  56383 [ACK] Seq=1 Ack=15700 Win=2930 Len=0"
"179","21.517959","173.194.123.46","10.152.152.11","TCP","60","443  >  56383 [ACK] Seq=1 Ack=17157 Win=2860 Len=0"
"180","21.518201","10.152.152.11","173.194.123.46","TCP","1514","56383  >  443 [ACK] Seq=17157 Ack=1 Win=2440 Len=1460 [TCP segment of a reassembled PDU]"
"181","21.518244","10.152.152.11","173.194.123.46","TLSv1.1","1511","Application Data"
"182","21.518323","173.194.123.46","10.152.152.11","TCP","60","443  >  56383 [ACK] Seq=1 Ack=18617 Win=3070 Len=0"
"183","21.518331","173.194.123.46","10.152.152.11","TCP","60","443  >  56383 [ACK] Seq=1 Ack=20074 Win=3000 Len=0"
"184","21.518633","10.152.152.11","173.194.123.46","TCP","1514","56383  >  443 [ACK] Seq=20074 Ack=1 Win=2440 Len=1460 [TCP segment of a reassembled PDU]"
"185","21.518679","10.152.152.11","173.194.123.46","TLSv1.1","1511","Application Data"
"186","21.518818","173.194.123.46","10.152.152.11","TCP","60","443  >  56383 [ACK] Seq=1 Ack=21534 Win=3070 Len=0"
"187","21.519013","10.152.152.11","173.194.123.46","TCP","1514","56383  >  443 [ACK] Seq=22991 Ack=1 Win=2440 Len=1460 [TCP segment of a reassembled PDU]"
"188","21.519060","10.152.152.11","173.194.123.46","TLSv1.1","1511","Application Data"
"189","21.519460","10.152.152.11","173.194.123.46","TCP","1514","56383  >  443 [ACK] Seq=25908 Ack=1 Win=2440 Len=1460 [TCP segment of a reassembled PDU]"
"190","21.519502","10.152.152.11","173.194.123.46","TLSv1.1","231","Application Data"
"191","21.520210","173.194.123.46","10.152.152.11","TCP","60","443  >  56383 [ACK] Seq=1 Ack=27545 Win=3091 Len=0"
"192","21.859521","173.194.123.46","10.152.152.11","TLSv1.1","123","Application Data"
"193","21.896003","10.152.152.11","173.194.123.46","TCP","54","56383  >  443 [ACK] Seq=27545 Ack=70 Win=2440 Len=0"
"194","22.180711","173.194.123.46","10.152.152.11","TLSv1.1","325","Application Data, Application Data, Application Data"
"195","22.180746","10.152.152.11","173.194.123.46","TCP","54","56383  >  443 [ACK] Seq=27545 Ack=341 Win=2622 Len=0"
"196","22.182953","10.152.152.11","173.194.123.46","TLSv1.1","123","Application Data"
"197","22.183277","173.194.123.46","10.152.152.11","TCP","60","443  >  56383 [ACK] Seq=341 Ack=27614 Win=3091 Len=0"
"198","22.655860","10.152.152.11","173.194.123.46","TCP","54","56378  >  443 [ACK] Seq=1 Ack=1 Win=2640 Len=0"
"199","22.656180","173.194.123.46","10.152.152.11","TCP","60","[TCP ACKed unseen segment] 443  >  56378 [ACK] Seq=1 Ack=2 Win=2640 Len=0"
"200","23.520912","10.152.152.11","173.194.123.46","TCP","1514","56367  >  443 [ACK] Seq=11394 Ack=1346 Win=2640 Len=1460 [TCP segment of a reassembled PDU]"
"201","23.521000","10.152.152.11","173.194.123.46","TLSv1.1","1159","Application Data"
"202","23.521246","173.194.123.46","10.152.152.11","TCP","60","443  >  56367 [ACK] Seq=1346 Ack=12854 Win=4601 Len=0"
"203","23.521281","173.194.123.46","10.152.152.11","TCP","60","443  >  56367 [ACK] Seq=1346 Ack=13959 Win=4601 Len=0"
"204","23.521492","10.152.152.11","173.194.123.46","TLSv1.1","251","Application Data"
"205","23.521749","173.194.123.46","10.152.152.11","TCP","60","443  >  56367 [ACK] Seq=1346 Ack=14156 Win=4601 Len=0"
"206","23.807990","10.152.152.11","64.233.171.188","TCP","54","36590  >  5228 [ACK] Seq=1 Ack=1 Win=2640 Len=0"
"207","23.808709","64.233.171.188","10.152.152.11","TCP","60","[TCP ACKed unseen segment] 5228  >  36590 [ACK] Seq=1 Ack=2 Win=1181 Len=0"
"208","24.319997","10.152.152.11","173.194.123.38","TCP","54","56461  >  443 [ACK] Seq=1 Ack=1 Win=2257 Len=0"
"209","24.320542","173.194.123.38","10.152.152.11","TCP","60","[TCP ACKed unseen segment] 443  >  56461 [ACK] Seq=1 Ack=2 Win=2586 Len=0"
"210","24.366501","173.194.123.46","10.152.152.11","TLSv1.1","373","Application Data, Application Data, Application Data"
"211","24.368597","10.152.152.11","173.194.123.46","TLSv1.1","123","Application Data"
"212","24.368834","173.194.123.46","10.152.152.11","TCP","60","443  >  56367 [ACK] Seq=1665 Ack=14225 Win=4601 Len=0"
"213","25.389239","10.152.152.11","173.194.123.46","TCP","1514","56367  >  443 [ACK] Seq=14225 Ack=1665 Win=2640 Len=1460 [TCP segment of a reassembled PDU]"
"214","25.389322","10.152.152.11","173.194.123.46","TLSv1.1","1159","Application Data"
"215","25.389664","173.194.123.46","10.152.152.11","TCP","60","443  >  56367 [ACK] Seq=1665 Ack=15685 Win=4601 Len=0"
"216","25.389690","173.194.123.46","10.152.152.11","TCP","60","443  >  56367 [ACK] Seq=1665 Ack=16790 Win=4601 Len=0"
"217","25.390004","10.152.152.11","173.194.123.46","TLSv1.1","251","Application Data"
"218","25.390275","173.194.123.46","10.152.152.11","TCP","60","443  >  56367 [ACK] Seq=1665 Ack=16987 Win=4601 Len=0"
"219","25.610419","216.58.219.237","10.152.152.11","TLSv1.1","208","[TCP ACKed unseen segment] , Application Data, Application Data"
"220","25.611771","10.152.152.11","216.58.219.237","TCP","54","[TCP Previous segment not captured] 58032  >  443 [FIN, ACK] Seq=2 Ack=155 Win=4647 Len=0"
"221","25.612529","216.58.219.237","10.152.152.11","TCP","60","[TCP ACKed unseen segment] 443  >  58032 [FIN, ACK] Seq=155 Ack=3 Win=2640 Len=0"
"222","25.612566","10.152.152.11","216.58.219.237","TCP","54","58032  >  443 [ACK] Seq=3 Ack=156 Win=4647 Len=0"
"223","25.959061","173.194.123.33","10.152.152.11","TLSv1.1","208","[TCP ACKed unseen segment] , Application Data, Application Data"
"224","25.959336","173.194.123.33","10.152.152.11","TCP","60","[TCP ACKed unseen segment] 443  >  46986 [FIN, ACK] Seq=155 Ack=2 Win=2640 Len=0"
"225","25.960570","10.152.152.11","173.194.123.33","TCP","54","[TCP Previous segment not captured] 46986  >  443 [FIN, ACK] Seq=2 Ack=156 Win=5217 Len=0"
"226","25.960918","173.194.123.33","10.152.152.11","TCP","60","[TCP ACKed unseen segment] 443  >  46986 [ACK] Seq=156 Ack=3 Win=2640 Len=0"
"227","26.023269","173.194.123.46","10.152.152.11","TLSv1.1","171","Application Data"
"228","26.028453","10.152.152.11","173.194.123.46","TCP","1514","56367  >  443 [ACK] Seq=16987 Ack=1782 Win=2640 Len=1460 [TCP segment of a reassembled PDU]"
"229","26.028513","10.152.152.11","173.194.123.46","TLSv1.1","1159","Application Data"
"230","26.028718","173.194.123.46","10.152.152.11","TCP","60","443  >  56367 [ACK] Seq=1782 Ack=18447 Win=4601 Len=0"
"231","26.028734","173.194.123.46","10.152.152.11","TCP","60","443  >  56367 [ACK] Seq=1782 Ack=19552 Win=4601 Len=0"
"232","26.028744","10.152.152.11","173.194.123.46","TLSv1.1","283","Application Data"
"233","26.028927","173.194.123.46","10.152.152.11","TCP","60","443  >  56367 [ACK] Seq=1782 Ack=19781 Win=4601 Len=0"
"234","26.088996","173.194.123.46","10.152.152.11","TLSv1.1","256","Application Data, Application Data"
"235","26.089126","74.125.22.189","10.152.152.11","TLSv1.1","523","Application Data"
"236","26.089143","10.152.152.11","74.125.22.189","TCP","54","58421  >  443 [ACK] Seq=2187 Ack=3070 Win=2640 Len=0"
"237","26.092481","10.152.152.11","173.194.123.46","TLSv1.1","123","Application Data"
"238","26.092889","173.194.123.46","10.152.152.11","TCP","60","443  >  56367 [ACK] Seq=1984 Ack=19850 Win=4601 Len=0"
"239","26.821721","173.194.123.46","10.152.152.11","TLSv1.1","357","Application Data, Application Data, Application Data"
"240","26.825486","10.152.152.11","173.194.123.46","TLSv1.1","123","Application Data"
"241","26.825897","173.194.123.46","10.152.152.11","TCP","60","443  >  56367 [ACK] Seq=2287 Ack=19919 Win=4601 Len=0"
"242","27.519963","10.152.152.11","173.194.123.36","TCP","54","34992  >  443 [ACK] Seq=1 Ack=1 Win=2640 Len=0"
"243","27.520256","173.194.123.36","10.152.152.11","TCP","60","[TCP ACKed unseen segment] 443  >  34992 [ACK] Seq=1 Ack=2 Win=1329 Len=0"
"244","27.705562","173.194.123.43","10.152.152.11","TLSv1.1","208","[TCP ACKed unseen segment] , Application Data, Application Data"
"245","27.706791","10.152.152.11","173.194.123.43","TCP","54","[TCP Previous segment not captured] 47894  >  443 [FIN, ACK] Seq=2 Ack=155 Win=2640 Len=0"
"246","27.707361","173.194.123.43","10.152.152.11","TCP","60","[TCP ACKed unseen segment] 443  >  47894 [FIN, ACK] Seq=155 Ack=3 Win=1527 Len=0"
"247","27.707387","10.152.152.11","173.194.123.43","TCP","54","47894  >  443 [ACK] Seq=3 Ack=156 Win=2640 Len=0"
"248","28.158512","10.152.152.11","173.194.123.46","TCP","1514","56367  >  443 [ACK] Seq=19919 Ack=2287 Win=2640 Len=1460 [TCP segment of a reassembled PDU]"
"249","28.158621","10.152.152.11","173.194.123.46","TLSv1.1","1159","Application Data"
"250","28.159019","173.194.123.46","10.152.152.11","TCP","60","443  >  56367 [ACK] Seq=2287 Ack=21379 Win=4601 Len=0"
"251","28.159050","173.194.123.46","10.152.152.11","TCP","60","443  >  56367 [ACK] Seq=2287 Ack=22484 Win=4601 Len=0"
"252","28.159315","10.152.152.11","173.194.123.46","TLSv1.1","251","Application Data"
"253","28.159645","173.194.123.46","10.152.152.11","TCP","60","443  >  56367 [ACK] Seq=2287 Ack=22681 Win=4601 Len=0"
"254","28.560946","10.152.152.11","173.194.123.46","TCP","1514","56367  >  443 [ACK] Seq=22681 Ack=2287 Win=2640 Len=1460 [TCP segment of a reassembled PDU]"
"255","28.561005","10.152.152.11","173.194.123.46","TLSv1.1","1159","Application Data"
"256","28.561277","173.194.123.46","10.152.152.11","TCP","60","443  >  56367 [ACK] Seq=2287 Ack=24141 Win=4601 Len=0"
"257","28.561292","173.194.123.46","10.152.152.11","TCP","60","443  >  56367 [ACK] Seq=2287 Ack=25246 Win=4601 Len=0"
"258","28.561625","10.152.152.11","173.194.123.46","TLSv1.1","251","Application Data"
"259","28.561791","173.194.123.46","10.152.152.11","TCP","60","443  >  56367 [ACK] Seq=2287 Ack=25443 Win=4601 Len=0"
"260","28.697205","173.194.123.46","10.152.152.11","TLSv1.1","373","Application Data, Application Data, Application Data"
"261","28.700342","10.152.152.11","173.194.123.46","TLSv1.1","123","Application Data"
"262","28.700721","173.194.123.46","10.152.152.11","TCP","60","443  >  56367 [ACK] Seq=2606 Ack=25512 Win=4601 Len=0"
"263","28.802760","74.125.22.189","10.152.152.11","TLSv1.1","523","Application Data"
"264","28.802869","10.152.152.11","74.125.22.189","TCP","54","58421  >  443 [ACK] Seq=2187 Ack=3539 Win=2640 Len=0"
"265","29.114689","173.194.123.46","10.152.152.11","TLSv1.1","357","Application Data, Application Data, Application Data"
"266","29.116168","10.152.152.11","173.194.123.46","TLSv1.1","123","Application Data"
"267","29.116416","173.194.123.46","10.152.152.11","TCP","60","443  >  56367 [ACK] Seq=2909 Ack=25581 Win=4601 Len=0"
"268","32.101529","173.194.116.120","10.152.152.11","TLSv1.1","208","[TCP ACKed unseen segment] , Application Data, Application Data"
"269","32.102415","10.152.152.11","173.194.116.120","TCP","54","[TCP Previous segment not captured] 41329  >  443 [FIN, ACK] Seq=2 Ack=155 Win=2373 Len=0"
"270","32.102966","173.194.116.120","10.152.152.11","TCP","60","[TCP ACKed unseen segment] 443  >  41329 [FIN, ACK] Seq=155 Ack=3 Win=1363 Len=0"
"271","32.103040","10.152.152.11","173.194.116.120","TCP","54","41329  >  443 [ACK] Seq=3 Ack=156 Win=2373 Len=0"
"272","33.157452","10.152.152.11","173.194.123.46","TCP","1514","56367  >  443 [ACK] Seq=25581 Ack=2909 Win=2640 Len=1460 [TCP segment of a reassembled PDU]"
"273","33.157625","10.152.152.11","173.194.123.46","TLSv1.1","1159","Application Data"
"274","33.157844","173.194.123.46","10.152.152.11","TCP","60","443  >  56367 [ACK] Seq=2909 Ack=27041 Win=4601 Len=0"
"275","33.157895","173.194.123.46","10.152.152.11","TCP","60","443  >  56367 [ACK] Seq=2909 Ack=28146 Win=4601 Len=0"
"276","33.158355","10.152.152.11","173.194.123.46","TLSv1.1","251","Application Data"
"277","33.158678","173.194.123.46","10.152.152.11","TCP","60","443  >  56367 [ACK] Seq=2909 Ack=28343 Win=4601 Len=0"
"278","33.587215","10.152.152.11","173.194.123.46","TCP","1514","56367  >  443 [ACK] Seq=28343 Ack=2909 Win=2640 Len=1460 [TCP segment of a reassembled PDU]"
"279","33.587444","10.152.152.11","173.194.123.46","TLSv1.1","1159","Application Data"
"280","33.587805","173.194.123.46","10.152.152.11","TCP","60","443  >  56367 [ACK] Seq=2909 Ack=29803 Win=4601 Len=0"
"281","33.587865","173.194.123.46","10.152.152.11","TCP","60","443  >  56367 [ACK] Seq=2909 Ack=30908 Win=4601 Len=0"
"282","33.588325","10.152.152.11","173.194.123.46","TLSv1.1","251","Application Data"
"283","33.588526","173.194.123.46","10.152.152.11","TCP","60","443  >  56367 [ACK] Seq=2909 Ack=31105 Win=4601 Len=0"
"284","33.725884","173.194.123.46","10.152.152.11","TLSv1.1","373","Application Data, Application Data, Application Data"
"285","33.730047","10.152.152.11","173.194.123.46","TLSv1.1","123","Application Data"
"286","33.730419","173.194.123.46","10.152.152.11","TCP","60","443  >  56367 [ACK] Seq=3228 Ack=31174 Win=4601 Len=0"
"287","33.832277","74.125.22.189","10.152.152.11","TLSv1.1","523","Application Data"
"288","33.832311","10.152.152.11","74.125.22.189","TCP","54","58421  >  443 [ACK] Seq=2187 Ack=4008 Win=2640 Len=0"
"289","34.106435","173.194.123.46","10.152.152.11","TLSv1.1","155","Application Data"
"290","34.143998","10.152.152.11","173.194.123.46","TCP","54","56367  >  443 [ACK] Seq=31174 Ack=3329 Win=2640 Len=0"
"291","34.214095","173.194.123.46","10.152.152.11","TLSv1.1","256","Application Data, Application Data"
"292","34.214129","10.152.152.11","173.194.123.46","TCP","54","56367  >  443 [ACK] Seq=31174 Ack=3531 Win=2640 Len=0"
"293","34.216541","10.152.152.11","173.194.123.46","TLSv1.1","123","Application Data"
"294","34.216950","173.194.123.46","10.152.152.11","TCP","60","443  >  56367 [ACK] Seq=3531 Ack=31243 Win=4601 Len=0"
"295","37.897158","74.125.22.189","10.152.152.11","TLSv1.1","523","Application Data"
"296","37.897256","10.152.152.11","74.125.22.189","TCP","54","58421  >  443 [ACK] Seq=2187 Ack=4477 Win=2640 Len=0"
"297","38.158570","10.152.152.11","173.194.123.46","TCP","1514","56367  >  443 [ACK] Seq=31243 Ack=3531 Win=2640 Len=1460 [TCP segment of a reassembled PDU]"
"298","38.158654","10.152.152.11","173.194.123.46","TLSv1.1","1159","Application Data"
"299","38.159013","173.194.123.46","10.152.152.11","TCP","60","443  >  56367 [ACK] Seq=3531 Ack=32703 Win=4601 Len=0"
"300","38.159030","173.194.123.46","10.152.152.11","TCP","60","443  >  56367 [ACK] Seq=3531 Ack=33808 Win=4601 Len=0"
"301","38.159461","10.152.152.11","173.194.123.46","TLSv1.1","251","Application Data"
"302","38.159603","173.194.123.46","10.152.152.11","TCP","60","443  >  56367 [ACK] Seq=3531 Ack=34005 Win=4601 Len=0"
"303","38.655993","10.152.152.11","173.194.123.35","TCP","54","46072  >  443 [ACK] Seq=1 Ack=1 Win=10334 Len=0"
"304","38.656466","173.194.123.35","10.152.152.11","TCP","60","[TCP ACKed unseen segment] 443  >  46072 [ACK] Seq=1 Ack=2 Win=2640 Len=0"
"305","38.673218","173.194.123.46","10.152.152.11","TLSv1.1","171","Application Data"
"306","38.711985","10.152.152.11","173.194.123.46","TCP","54","56367  >  443 [ACK] Seq=34005 Ack=3648 Win=2640 Len=0"
"307","38.780080","173.194.123.46","10.152.152.11","TLSv1.1","256","Application Data, Application Data"
"308","38.780108","10.152.152.11","173.194.123.46","TCP","54","56367  >  443 [ACK] Seq=34005 Ack=3850 Win=2640 Len=0"
"309","38.782955","10.152.152.11","173.194.123.46","TLSv1.1","123","Application Data"
"310","38.783318","173.194.123.46","10.152.152.11","TCP","60","443  >  56367 [ACK] Seq=3850 Ack=34074 Win=4601 Len=0"
"311","38.843749","74.125.22.189","10.152.152.11","TLSv1.1","523","Application Data"
"312","38.843789","10.152.152.11","74.125.22.189","TCP","54","58421  >  443 [ACK] Seq=2187 Ack=4946 Win=2640 Len=0"
"313","39.847634","10.152.152.11","173.194.123.46","TCP","1514","56367  >  443 [ACK] Seq=34074 Ack=3850 Win=2640 Len=1460 [TCP segment of a reassembled PDU]"
"314","39.847748","10.152.152.11","173.194.123.46","TLSv1.1","1159","Application Data"
"315","39.848132","173.194.123.46","10.152.152.11","TCP","60","443  >  56367 [ACK] Seq=3850 Ack=35534 Win=4601 Len=0"
"316","39.848164","173.194.123.46","10.152.152.11","TCP","60","443  >  56367 [ACK] Seq=3850 Ack=36639 Win=4601 Len=0"
"317","39.848718","10.152.152.11","173.194.123.46","TLSv1.1","251","Application Data"
"318","39.849120","173.194.123.46","10.152.152.11","TCP","60","443  >  56367 [ACK] Seq=3850 Ack=36836 Win=4601 Len=0"
"319","40.386712","173.194.123.46","10.152.152.11","TLSv1.1","373","Application Data, Application Data, Application Data"
"320","40.389635","10.152.152.11","173.194.123.46","TLSv1.1","123","Application Data"
"321","40.389921","173.194.123.46","10.152.152.11","TCP","60","443  >  56367 [ACK] Seq=4169 Ack=36905 Win=4601 Len=0"
"322","43.161307","10.152.152.11","173.194.123.46","TCP","1514","56367  >  443 [ACK] Seq=36905 Ack=4169 Win=2640 Len=1460 [TCP segment of a reassembled PDU]"
"323","43.161552","10.152.152.11","173.194.123.46","TLSv1.1","1159","Application Data"
"324","43.161759","173.194.123.46","10.152.152.11","TCP","60","443  >  56367 [ACK] Seq=4169 Ack=38365 Win=4601 Len=0"
"325","43.161772","173.194.123.46","10.152.152.11","TCP","60","443  >  56367 [ACK] Seq=4169 Ack=39470 Win=4601 Len=0"
"326","43.162219","10.152.152.11","173.194.123.46","TLSv1.1","251","Application Data"
"327","43.162570","173.194.123.46","10.152.152.11","TCP","60","443  >  56367 [ACK] Seq=4169 Ack=39667 Win=4601 Len=0"
"328","43.714768","173.194.123.46","10.152.152.11","TLSv1.1","373","Application Data, Application Data, Application Data"
"329","43.717739","10.152.152.11","173.194.123.46","TLSv1.1","123","Application Data"
"330","43.718123","173.194.123.46","10.152.152.11","TCP","60","443  >  56367 [ACK] Seq=4488 Ack=39736 Win=4601 Len=0"
"331","43.820296","74.125.22.189","10.152.152.11","TLSv1.1","523","Application Data"
"332","43.820328","10.152.152.11","74.125.22.189","TCP","54","58421  >  443 [ACK] Seq=2187 Ack=5415 Win=2640 Len=0"
"333","44.857548","10.152.152.11","173.194.123.46","TCP","1514","56367  >  443 [ACK] Seq=39736 Ack=4488 Win=2640 Len=1460 [TCP segment of a reassembled PDU]"
"334","44.857635","10.152.152.11","173.194.123.46","TLSv1.1","1159","Application Data"
"335","44.857948","173.194.123.46","10.152.152.11","TCP","60","443  >  56367 [ACK] Seq=4488 Ack=41196 Win=4601 Len=0"
"336","44.858028","173.194.123.46","10.152.152.11","TCP","60","443  >  56367 [ACK] Seq=4488 Ack=42301 Win=4601 Len=0"
"337","44.858188","10.152.152.11","173.194.123.46","TLSv1.1","251","Application Data"
"338","44.858412","173.194.123.46","10.152.152.11","TCP","60","443  >  56367 [ACK] Seq=4488 Ack=42498 Win=4601 Len=0"
"339","45.434934","173.194.123.46","10.152.152.11","TLSv1.1","373","Application Data, Application Data, Application Data"
"340","45.437675","10.152.152.11","173.194.123.46","TLSv1.1","123","Application Data"
"341","45.438098","173.194.123.46","10.152.152.11","TCP","60","443  >  56367 [ACK] Seq=4807 Ack=42567 Win=4601 Len=0"
"342","45.893078","10.152.152.11","173.194.123.46","TCP","1514","56367  >  443 [ACK] Seq=42567 Ack=4807 Win=2640 Len=1460 [TCP segment of a reassembled PDU]"
"343","45.893277","10.152.152.11","173.194.123.46","TLSv1.1","1159","Application Data"
