"No.","Time","Source","Destination","Protocol","Length","Info"
"1","0.000000","10.152.152.11","5.9.28.6","TCP","171","49616  >  5222 [PSH, ACK] Seq=1 Ack=1 Win=4764 Len=117 [TCP segment of a reassembled PDU]"
"2","0.000638","5.9.28.6","10.152.152.11","TCP","60","5222  >  49616 [ACK] Seq=1 Ack=118 Win=2640 Len=0"
"3","0.466312","5.9.28.6","10.152.152.11","TCP","203","5222  >  49616 [PSH, ACK] Seq=1 Ack=118 Win=2640 Len=149 [TCP segment of a reassembled PDU]"
"4","0.466403","10.152.152.11","5.9.28.6","TCP","54","49616  >  5222 [ACK] Seq=118 Ack=150 Win=4764 Len=0"
"5","1.050718","5.9.28.6","10.152.152.11","TCP","315","5222  >  49616 [PSH, ACK] Seq=150 Ack=118 Win=2640 Len=261 [TCP segment of a reassembled PDU]"
"6","1.050851","10.152.152.11","5.9.28.6","TCP","54","49616  >  5222 [ACK] Seq=118 Ack=411 Win=4764 Len=0"
"7","5.002889","PcsCompu_11:4d:b1","PcsCompu_78:57:ca","ARP","42","Who has 10.152.152.10? Tell 10.152.152.11"
"8","5.003243","PcsCompu_78:57:ca","PcsCompu_11:4d:b1","ARP","60","10.152.152.10 is at 08:00:27:78:57:ca"
"9","13.636146","10.152.152.11","5.9.28.6","TCP","379","49616  >  5222 [PSH, ACK] Seq=118 Ack=411 Win=4764 Len=325 [TCP segment of a reassembled PDU]"
"10","13.636412","5.9.28.6","10.152.152.11","TCP","60","5222  >  49616 [ACK] Seq=411 Ack=443 Win=2640 Len=0"
"11","13.871500","5.9.28.6","10.152.152.11","TCP","459","5222  >  49616 [PSH, ACK] Seq=411 Ack=443 Win=2640 Len=405 [TCP segment of a reassembled PDU]"
"12","13.871594","10.152.152.11","5.9.28.6","TCP","54","49616  >  5222 [ACK] Seq=443 Ack=816 Win=4764 Len=0"
"13","59.999754","10.152.152.11","5.9.28.6","TCP","171","49616  >  5222 [PSH, ACK] Seq=443 Ack=816 Win=4764 Len=117 [TCP segment of a reassembled PDU]"
"14","59.999977","5.9.28.6","10.152.152.11","TCP","60","5222  >  49616 [ACK] Seq=816 Ack=560 Win=2640 Len=0"
"15","60.226628","5.9.28.6","10.152.152.11","TCP","203","5222  >  49616 [PSH, ACK] Seq=816 Ack=560 Win=2640 Len=149 [TCP segment of a reassembled PDU]"
"16","60.226721","10.152.152.11","5.9.28.6","TCP","54","49616  >  5222 [ACK] Seq=560 Ack=965 Win=4764 Len=0"
"17","65.002921","PcsCompu_11:4d:b1","PcsCompu_78:57:ca","ARP","42","Who has 10.152.152.10? Tell 10.152.152.11"
"18","65.003082","PcsCompu_78:57:ca","PcsCompu_11:4d:b1","ARP","60","10.152.152.10 is at 08:00:27:78:57:ca"
"19","70.988751","5.9.28.6","10.152.152.11","TCP","539","5222  >  49616 [PSH, ACK] Seq=965 Ack=560 Win=2640 Len=485 [TCP segment of a reassembled PDU]"
"20","70.988785","10.152.152.11","5.9.28.6","TCP","54","49616  >  5222 [ACK] Seq=560 Ack=1450 Win=4764 Len=0"
"21","76.002828","PcsCompu_78:57:ca","PcsCompu_11:4d:b1","ARP","60","Who has 10.152.152.11? Tell 10.152.152.10"
"22","76.002850","PcsCompu_11:4d:b1","PcsCompu_78:57:ca","ARP","42","10.152.152.11 is at 08:00:27:11:4d:b1"
"23","80.220415","10.152.152.11","5.9.28.6","TCP","923","49616  >  5222 [PSH, ACK] Seq=560 Ack=1450 Win=4764 Len=869 [TCP segment of a reassembled PDU]"
"24","80.221055","5.9.28.6","10.152.152.11","TCP","60","5222  >  49616 [ACK] Seq=1450 Ack=1429 Win=2640 Len=0"
"25","80.659383","5.9.28.6","10.152.152.11","TCP","552","5222  >  49616 [PSH, ACK] Seq=1450 Ack=1429 Win=2640 Len=498 [TCP segment of a reassembled PDU]"
"26","80.659408","10.152.152.11","5.9.28.6","TCP","54","49616  >  5222 [ACK] Seq=1429 Ack=1948 Win=4764 Len=0"
"27","80.787034","5.9.28.6","10.152.152.11","TCP","505","5222  >  49616 [PSH, ACK] Seq=1948 Ack=1429 Win=2640 Len=451 [TCP segment of a reassembled PDU]"
"28","80.787112","10.152.152.11","5.9.28.6","TCP","54","49616  >  5222 [ACK] Seq=1429 Ack=2399 Win=4764 Len=0"
"29","89.653812","5.9.28.6","10.152.152.11","TCP","539","5222  >  49616 [PSH, ACK] Seq=2399 Ack=1429 Win=2640 Len=485 [TCP segment of a reassembled PDU]"
"30","89.653847","10.152.152.11","5.9.28.6","TCP","54","49616  >  5222 [ACK] Seq=1429 Ack=2884 Win=4764 Len=0"
"31","103.587836","10.152.152.11","5.9.28.6","TCP","459","49616  >  5222 [PSH, ACK] Seq=1429 Ack=2884 Win=4764 Len=405 [TCP segment of a reassembled PDU]"
"32","103.588337","5.9.28.6","10.152.152.11","TCP","60","5222  >  49616 [ACK] Seq=2884 Ack=1834 Win=2640 Len=0"
"33","103.878006","5.9.28.6","10.152.152.11","TCP","539","5222  >  49616 [PSH, ACK] Seq=2884 Ack=1834 Win=2640 Len=485 [TCP segment of a reassembled PDU]"
"34","103.878096","10.152.152.11","5.9.28.6","TCP","54","49616  >  5222 [ACK] Seq=1834 Ack=3369 Win=4764 Len=0"
"35","109.817016","5.9.28.6","10.152.152.11","TCP","539","5222  >  49616 [PSH, ACK] Seq=3369 Ack=1834 Win=2640 Len=485 [TCP segment of a reassembled PDU]"
"36","109.817051","10.152.152.11","5.9.28.6","TCP","54","49616  >  5222 [ACK] Seq=1834 Ack=3854 Win=4764 Len=0"
"37","113.705935","5.9.28.6","10.152.152.11","TCP","539","5222  >  49616 [PSH, ACK] Seq=3854 Ack=1834 Win=2640 Len=485 [TCP segment of a reassembled PDU]"
"38","113.705970","10.152.152.11","5.9.28.6","TCP","54","49616  >  5222 [ACK] Seq=1834 Ack=4339 Win=4764 Len=0"
"39","115.396450","10.152.152.11","5.9.28.6","TCP","955","49616  >  5222 [PSH, ACK] Seq=1834 Ack=4339 Win=4764 Len=901 [TCP segment of a reassembled PDU]"
"40","115.397016","5.9.28.6","10.152.152.11","TCP","60","5222  >  49616 [ACK] Seq=4339 Ack=2735 Win=2640 Len=0"
"41","116.234082","5.9.28.6","10.152.152.11","TCP","552","5222  >  49616 [PSH, ACK] Seq=4339 Ack=2735 Win=2640 Len=498 [TCP segment of a reassembled PDU]"
"42","116.234153","10.152.152.11","5.9.28.6","TCP","54","49616  >  5222 [ACK] Seq=2735 Ack=4837 Win=4764 Len=0"
"43","116.358264","5.9.28.6","10.152.152.11","TCP","297","5222  >  49616 [PSH, ACK] Seq=4837 Ack=2735 Win=2640 Len=243 [TCP segment of a reassembled PDU]"
"44","116.358283","10.152.152.11","5.9.28.6","TCP","54","49616  >  5222 [ACK] Seq=2735 Ack=5080 Win=4764 Len=0"
"45","132.212497","10.152.152.11","5.9.28.6","TCP","987","49616  >  5222 [PSH, ACK] Seq=2735 Ack=5080 Win=4764 Len=933 [TCP segment of a reassembled PDU]"
"46","132.213045","5.9.28.6","10.152.152.11","TCP","60","5222  >  49616 [ACK] Seq=5080 Ack=3668 Win=2640 Len=0"
"47","132.490285","5.9.28.6","10.152.152.11","TCP","552","5222  >  49616 [PSH, ACK] Seq=5080 Ack=3668 Win=2640 Len=498 [TCP segment of a reassembled PDU]"
"48","132.490381","10.152.152.11","5.9.28.6","TCP","54","49616  >  5222 [ACK] Seq=3668 Ack=5578 Win=4764 Len=0"
"49","132.614433","5.9.28.6","10.152.152.11","TCP","297","5222  >  49616 [PSH, ACK] Seq=5578 Ack=3668 Win=2640 Len=243 [TCP segment of a reassembled PDU]"
"50","132.614455","10.152.152.11","5.9.28.6","TCP","54","49616  >  5222 [ACK] Seq=3668 Ack=5821 Win=4764 Len=0"
"51","135.460482","5.9.28.6","10.152.152.11","TCP","539","5222  >  49616 [PSH, ACK] Seq=5821 Ack=3668 Win=2640 Len=485 [TCP segment of a reassembled PDU]"
"52","135.460563","10.152.152.11","5.9.28.6","TCP","54","49616  >  5222 [ACK] Seq=3668 Ack=6306 Win=4764 Len=0"
"53","143.919596","10.152.152.11","10.152.152.10","DNS","81","Standard query 0x44e1 A jabber.hot-chilli.net"
"54","143.919749","10.152.152.11","10.152.152.10","DNS","74","Standard query 0x366b A 2.gravatar.com"
"55","143.919863","10.152.152.11","10.152.152.10","DNS","79","Standard query 0x570f A accounts.google.com"
"56","144.021270","10.152.152.11","10.152.152.10","DNS","92","Standard query 0x2917 A conference.jabber.hot-chilli.net"
"57","144.040286","10.152.152.11","10.152.152.10","DNS","79","Standard query 0xd278 A clients4.google.com"
"58","144.040715","10.152.152.11","10.152.152.10","DNS","84","Standard query 0xe97f A translate.googleapis.com"
"59","144.927124","10.152.152.11","10.152.152.10","DNS","81","Standard query 0x3ae9 A jabber.hot-chilli.net"
"60","144.927466","10.152.152.11","10.152.152.10","DNS","74","Standard query 0x66d5 A 2.gravatar.com"
"61","144.927757","10.152.152.11","10.152.152.10","DNS","79","Standard query 0xcead A accounts.google.com"
"62","145.029354","10.152.152.11","10.152.152.10","DNS","92","Standard query 0x04f5 A conference.jabber.hot-chilli.net"
"63","145.048352","10.152.152.11","10.152.152.10","DNS","79","Standard query 0x573e A clients4.google.com"
"64","145.048736","10.152.152.11","10.152.152.10","DNS","84","Standard query 0x3de8 A translate.googleapis.com"
"65","145.108252","10.152.152.10","10.152.152.11","DNS","95","Standard query response 0x570f A accounts.google.com A 216.58.211.13"
"66","145.109521","10.152.152.11","10.152.152.10","DNS","76","Standard query 0xe224 A mtalk.google.com"
"67","145.110055","10.152.152.11","216.58.211.13","TCP","66","35657  >  443 [SYN] Seq=0 Win=14600 Len=0 MSS=1460 SACK_PERM=1 WS=16"
"68","145.110248","10.152.152.11","216.58.211.13","TCP","66","35658  >  443 [SYN] Seq=0 Win=14600 Len=0 MSS=1460 SACK_PERM=1 WS=16"
"69","145.110349","216.58.211.13","10.152.152.11","TCP","66","443  >  35657 [SYN, ACK] Seq=0 Ack=1 Win=14600 Len=0 MSS=1460 SACK_PERM=1 WS=16"
"70","145.110451","10.152.152.11","216.58.211.13","TCP","54","35657  >  443 [ACK] Seq=1 Ack=1 Win=14608 Len=0"
"71","145.110483","216.58.211.13","10.152.152.11","TCP","66","443  >  35658 [SYN, ACK] Seq=0 Ack=1 Win=14600 Len=0 MSS=1460 SACK_PERM=1 WS=16"
"72","145.110503","10.152.152.11","216.58.211.13","TCP","54","35658  >  443 [ACK] Seq=1 Ack=1 Win=14608 Len=0"
"73","145.114676","10.152.152.11","216.58.211.13","TLSv1.1","218","Client Hello"
"74","145.114923","10.152.152.11","216.58.211.13","TLSv1.1","218","Client Hello"
"75","145.114682","216.58.211.13","10.152.152.11","TCP","60","443  >  35657 [ACK] Seq=1 Ack=165 Win=15680 Len=0"
"76","145.114913","216.58.211.13","10.152.152.11","TCP","60","443  >  35658 [ACK] Seq=1 Ack=165 Win=15680 Len=0"
"77","145.183139","10.152.152.10","10.152.152.11","DNS","90","Standard query response 0x366b A 2.gravatar.com A 68.232.35.121"
"78","145.183987","10.152.152.11","10.152.152.10","DNS","75","Standard query 0xd9c3 A www.gstatic.com"
"79","145.286924","10.152.152.10","10.152.152.11","DNS","97","Standard query response 0x44e1 A jabber.hot-chilli.net A 5.9.28.6"
"80","145.287447","10.152.152.11","10.152.152.10","DNS","80","Standard query 0x4ea9 A accounts.youtube.com"
"81","145.349272","10.152.152.10","10.152.152.11","DNS","95","Standard query response 0xd278 A clients4.google.com A 195.95.178.116"
"82","145.349561","10.152.152.10","10.152.152.11","DNS","100","Standard query response 0xe97f A translate.googleapis.com A 216.58.211.42"
"83","145.350045","10.152.152.11","195.95.178.116","TCP","66","51332  >  443 [SYN] Seq=0 Win=14600 Len=0 MSS=1460 SACK_PERM=1 WS=16"
"84","145.350361","10.152.152.11","216.58.211.42","TCP","66","37841  >  443 [SYN] Seq=0 Win=14600 Len=0 MSS=1460 SACK_PERM=1 WS=16"
"85","145.350225","195.95.178.116","10.152.152.11","TCP","66","443  >  51332 [SYN, ACK] Seq=0 Ack=1 Win=14600 Len=0 MSS=1460 SACK_PERM=1 WS=16"
"86","145.350304","10.152.152.11","195.95.178.116","TCP","54","51332  >  443 [ACK] Seq=1 Ack=1 Win=14608 Len=0"
"87","145.350330","216.58.211.42","10.152.152.11","TCP","66","443  >  37841 [SYN, ACK] Seq=0 Ack=1 Win=14600 Len=0 MSS=1460 SACK_PERM=1 WS=16"
"88","145.350350","10.152.152.11","216.58.211.42","TCP","54","37841  >  443 [ACK] Seq=1 Ack=1 Win=14608 Len=0"
"89","145.351696","10.152.152.11","195.95.178.116","TLSv1.1","218","Client Hello"
"90","145.351845","10.152.152.11","216.58.211.42","TLSv1.1","223","Client Hello"
"91","145.351656","195.95.178.116","10.152.152.11","TCP","60","443  >  51332 [ACK] Seq=1 Ack=165 Win=15680 Len=0"
"92","145.351898","216.58.211.42","10.152.152.11","TCP","60","443  >  37841 [ACK] Seq=1 Ack=170 Win=15680 Len=0"
"93","145.352014","10.152.152.10","10.152.152.11","DNS","108","Standard query response 0x2917 A conference.jabber.hot-chilli.net A 5.9.28.6"
"94","145.352565","10.152.152.11","5.9.28.6","TCP","66","46482  >  5281 [SYN] Seq=0 Win=14600 Len=0 MSS=1460 SACK_PERM=1 WS=16"
"95","145.352728","10.152.152.11","5.9.28.6","TCP","66","46483  >  5281 [SYN] Seq=0 Win=14600 Len=0 MSS=1460 SACK_PERM=1 WS=16"
"96","145.352707","5.9.28.6","10.152.152.11","TCP","66","5281  >  46482 [SYN, ACK] Seq=0 Ack=1 Win=14600 Len=0 MSS=1460 SACK_PERM=1 WS=16"
"97","145.352769","10.152.152.11","5.9.28.6","TCP","54","46482  >  5281 [ACK] Seq=1 Ack=1 Win=14608 Len=0"
"98","145.352803","5.9.28.6","10.152.152.11","TCP","66","5281  >  46483 [SYN, ACK] Seq=0 Ack=1 Win=14600 Len=0 MSS=1460 SACK_PERM=1 WS=16"
"99","145.352819","10.152.152.11","5.9.28.6","TCP","54","46483  >  5281 [ACK] Seq=1 Ack=1 Win=14608 Len=0"
"100","145.353800","10.152.152.11","5.9.28.6","TLSv1","235","Client Hello"
"101","145.353996","10.152.152.11","5.9.28.6","TLSv1","235","Client Hello"
"102","145.353723","5.9.28.6","10.152.152.11","TCP","60","5281  >  46482 [ACK] Seq=1 Ack=182 Win=15680 Len=0"
"103","145.353832","5.9.28.6","10.152.152.11","TCP","60","5281  >  46483 [ACK] Seq=1 Ack=182 Win=15680 Len=0"
"104","145.436996","216.58.211.13","10.152.152.11","TLSv1.1","1484","Server Hello"
"105","145.437088","10.152.152.11","216.58.211.13","TCP","54","35657  >  443 [ACK] Seq=165 Ack=1431 Win=17520 Len=0"
"106","145.472001","216.58.211.13","10.152.152.11","TCP","1484","443  >  35657 [PSH, ACK] Seq=1431 Ack=165 Win=15680 Len=1430 [TCP segment of a reassembled PDU]"
"107","145.472028","10.152.152.11","216.58.211.13","TCP","54","35657  >  443 [ACK] Seq=165 Ack=2861 Win=20448 Len=0"
"108","145.490242","216.58.211.13","10.152.152.11","TLSv1.1","1336","Certificate, Server Key Exchange, Server Hello Done"
"109","145.490270","10.152.152.11","216.58.211.13","TCP","54","35657  >  443 [ACK] Seq=165 Ack=4143 Win=23360 Len=0"
"110","145.490375","216.58.211.13","10.152.152.11","TCP","552","443  >  35658 [PSH, ACK] Seq=1 Ack=165 Win=15680 Len=498 [TCP segment of a reassembled PDU]"
"111","145.490394","10.152.152.11","216.58.211.13","TCP","54","35658  >  443 [ACK] Seq=165 Ack=499 Win=15680 Len=0"
"112","145.505354","10.152.152.11","216.58.211.13","TLSv1.1","204","Client Key Exchange, Change Cipher Spec, Encrypted Handshake Message"
"113","145.505330","216.58.211.13","10.152.152.11","TCP","60","443  >  35657 [ACK] Seq=4143 Ack=315 Win=16752 Len=0"
"114","145.569147","216.58.211.13","10.152.152.11","TLSv1.1","1514","Server Hello [TCP segment of a reassembled PDU]"
"115","145.569195","10.152.152.11","216.58.211.13","TCP","54","35658  >  443 [ACK] Seq=165 Ack=1959 Win=18592 Len=0"
"116","145.569313","216.58.211.13","10.152.152.11","TCP","1454","443  >  35658 [PSH, ACK] Seq=1959 Ack=165 Win=15680 Len=1400 [TCP segment of a reassembled PDU]"
"117","145.569332","10.152.152.11","216.58.211.13","TCP","54","35658  >  443 [ACK] Seq=165 Ack=3359 Win=21520 Len=0"
"118","145.670903","216.58.211.13","10.152.152.11","TLSv1.1","838","Certificate, Server Key Exchange, Server Hello Done"
"119","145.670933","10.152.152.11","216.58.211.13","TCP","54","35658  >  443 [ACK] Seq=165 Ack=4143 Win=24432 Len=0"
"120","145.685164","10.152.152.11","216.58.211.13","TLSv1.1","204","Client Key Exchange, Change Cipher Spec, Encrypted Handshake Message"
"121","145.685260","216.58.211.13","10.152.152.11","TCP","60","443  >  35658 [ACK] Seq=4143 Ack=315 Win=16752 Len=0"
"122","145.787007","10.152.152.10","10.152.152.11","DNS","97","Standard query response 0x3ae9 A jabber.hot-chilli.net A 5.9.28.6"
"123","145.787046","10.152.152.11","10.152.152.10","ICMP","125","Destination unreachable (Port unreachable)"
"124","145.787080","10.152.152.10","10.152.152.11","DNS","90","Standard query response 0x66d5 A 2.gravatar.com A 68.232.35.121"
"125","145.787090","10.152.152.11","10.152.152.10","ICMP","118","Destination unreachable (Port unreachable)"
"126","145.787454","10.152.152.10","10.152.152.11","DNS","95","Standard query response 0xcead A accounts.google.com A 216.58.211.13"
"127","145.787476","10.152.152.11","10.152.152.10","ICMP","123","Destination unreachable (Port unreachable)"
"128","145.787529","195.95.178.116","10.152.152.11","TLSv1.1","552","Server Hello"
"129","145.787607","10.152.152.11","195.95.178.116","TCP","54","51332  >  443 [ACK] Seq=165 Ack=499 Win=15680 Len=0"
"130","145.788302","10.152.152.10","10.152.152.11","DNS","108","Standard query response 0x04f5 A conference.jabber.hot-chilli.net A 5.9.28.6"
"131","145.788371","10.152.152.11","10.152.152.10","ICMP","136","Destination unreachable (Port unreachable)"
"132","145.793992","195.95.178.116","10.152.152.11","TCP","1514","443  >  51332 [PSH, ACK] Seq=499 Ack=165 Win=15680 Len=1460 [TCP segment of a reassembled PDU]"
"133","145.794019","10.152.152.11","195.95.178.116","TCP","54","51332  >  443 [ACK] Seq=165 Ack=1959 Win=18592 Len=0"
"134","145.800372","10.152.152.10","10.152.152.11","DNS","95","Standard query response 0x573e A clients4.google.com A 195.95.178.116"
"135","145.800399","10.152.152.11","10.152.152.10","ICMP","123","Destination unreachable (Port unreachable)"
"136","145.800430","10.152.152.10","10.152.152.11","DNS","100","Standard query response 0x3de8 A translate.googleapis.com A 216.58.211.42"
"137","145.800440","10.152.152.11","10.152.152.10","ICMP","128","Destination unreachable (Port unreachable)"
"138","145.800876","10.152.152.10","10.152.152.11","DNS","91","Standard query response 0xd9c3 A www.gstatic.com A 195.95.178.109"
"139","145.801674","10.152.152.11","195.95.178.109","TCP","66","41076  >  443 [SYN] Seq=0 Win=14600 Len=0 MSS=1460 SACK_PERM=1 WS=16"
"140","145.801935","195.95.178.109","10.152.152.11","TCP","66","443  >  41076 [SYN, ACK] Seq=0 Ack=1 Win=14600 Len=0 MSS=1460 SACK_PERM=1 WS=16"
"141","145.802039","10.152.152.11","195.95.178.109","TCP","54","41076  >  443 [ACK] Seq=1 Ack=1 Win=14608 Len=0"
"142","145.803465","10.152.152.11","195.95.178.109","TLSv1","218","Client Hello"
"143","145.803514","195.95.178.109","10.152.152.11","TCP","60","443  >  41076 [ACK] Seq=1 Ack=165 Win=15680 Len=0"
"144","145.832634","195.95.178.116","10.152.152.11","TCP","1514","443  >  51332 [ACK] Seq=1959 Ack=165 Win=15680 Len=1460 [TCP segment of a reassembled PDU]"
"145","145.832662","10.152.152.11","195.95.178.116","TCP","54","51332  >  443 [ACK] Seq=165 Ack=3419 Win=21520 Len=0"
"146","145.832743","195.95.178.116","10.152.152.11","TLSv1.1","547","Certificate, Server Key Exchange, Server Hello Done"
"147","145.832760","10.152.152.11","195.95.178.116","TCP","54","51332  >  443 [ACK] Seq=165 Ack=3912 Win=24432 Len=0"
"148","145.849603","10.152.152.11","195.95.178.116","TLSv1.1","204","Client Key Exchange, Change Cipher Spec, Encrypted Handshake Message"
"149","145.849949","195.95.178.116","10.152.152.11","TCP","60","443  >  51332 [ACK] Seq=3912 Ack=315 Win=16752 Len=0"
"150","145.896913","216.58.211.42","10.152.152.11","TLSv1.1","552","Server Hello"
"151","145.897003","10.152.152.11","216.58.211.42","TCP","54","37841  >  443 [ACK] Seq=170 Ack=499 Win=15680 Len=0"
"152","145.937093","10.152.152.10","10.152.152.11","DNS","96","Standard query response 0x4ea9 A accounts.youtube.com A 195.95.178.89"
"153","145.937179","10.152.152.10","10.152.152.11","DNS","92","Standard query response 0xe224 A mtalk.google.com A 64.233.167.188"
"154","145.938012","10.152.152.11","64.233.167.188","TCP","66","60251  >  5228 [SYN] Seq=0 Win=14600 Len=0 MSS=1460 SACK_PERM=1 WS=16"
"155","145.938223","64.233.167.188","10.152.152.11","TCP","66","5228  >  60251 [SYN, ACK] Seq=0 Ack=1 Win=14600 Len=0 MSS=1460 SACK_PERM=1 WS=16"
"156","145.938319","10.152.152.11","64.233.167.188","TCP","54","60251  >  5228 [ACK] Seq=1 Ack=1 Win=14608 Len=0"
"157","145.941037","10.152.152.11","64.233.167.188","TLSv1","191","Client Hello"
"158","145.941226","64.233.167.188","10.152.152.11","TCP","60","5228  >  60251 [ACK] Seq=1 Ack=138 Win=15680 Len=0"
"159","145.962005","216.58.211.42","10.152.152.11","TCP","1514","443  >  37841 [ACK] Seq=499 Ack=170 Win=15680 Len=1460 [TCP segment of a reassembled PDU]"
"160","145.962097","10.152.152.11","216.58.211.42","TCP","54","37841  >  443 [ACK] Seq=170 Ack=1959 Win=18592 Len=0"
"161","145.962303","216.58.211.42","10.152.152.11","TLSv1.1","1514","Certificate [TCP segment of a reassembled PDU]"
"162","145.962331","10.152.152.11","216.58.211.42","TCP","54","37841  >  443 [ACK] Seq=170 Ack=3419 Win=21520 Len=0"
"163","145.962360","216.58.211.42","10.152.152.11","TLSv1.1","235","Server Key Exchange, Server Hello Done"
"164","145.962373","10.152.152.11","216.58.211.42","TCP","54","37841  >  443 [ACK] Seq=170 Ack=3600 Win=24432 Len=0"
"165","145.977971","10.152.152.11","216.58.211.42","TLSv1.1","204","Client Key Exchange, Change Cipher Spec, Encrypted Handshake Message"
"166","145.978217","216.58.211.42","10.152.152.11","TCP","60","443  >  37841 [ACK] Seq=3600 Ack=320 Win=16752 Len=0"
"167","146.073819","10.152.152.11","64.233.167.188","TCP","54","60251  >  5228 [FIN, ACK] Seq=138 Ack=1 Win=14608 Len=0"
"168","146.074188","64.233.167.188","10.152.152.11","TCP","60","5228  >  60251 [FIN, ACK] Seq=1 Ack=139 Win=15680 Len=0"
"169","146.074206","10.152.152.11","64.233.167.188","TCP","54","60251  >  5228 [ACK] Seq=139 Ack=2 Win=14608 Len=0"
"170","146.082948","10.152.152.11","216.58.211.13","TCP","54","35657  >  443 [FIN, ACK] Seq=315 Ack=4143 Win=23360 Len=0"
"171","146.083387","10.152.152.11","216.58.211.13","TCP","54","35658  >  443 [FIN, ACK] Seq=315 Ack=4143 Win=24432 Len=0"
"172","146.083484","216.58.211.13","10.152.152.11","TCP","60","443  >  35657 [FIN, ACK] Seq=4143 Ack=316 Win=16752 Len=0"
"173","146.083516","10.152.152.11","216.58.211.13","TCP","54","35657  >  443 [ACK] Seq=316 Ack=4144 Win=23360 Len=0"
"174","146.083759","216.58.211.13","10.152.152.11","TCP","60","443  >  35658 [FIN, ACK] Seq=4143 Ack=316 Win=16752 Len=0"
"175","146.083774","10.152.152.11","216.58.211.13","TCP","54","35658  >  443 [ACK] Seq=316 Ack=4144 Win=24432 Len=0"
"176","146.084360","10.152.152.11","5.9.28.6","TCP","54","46482  >  5281 [FIN, ACK] Seq=182 Ack=1 Win=14608 Len=0"
"177","146.084551","10.152.152.11","5.9.28.6","TCP","54","46483  >  5281 [FIN, ACK] Seq=182 Ack=1 Win=14608 Len=0"
"178","146.084616","5.9.28.6","10.152.152.11","TCP","60","5281  >  46482 [FIN, ACK] Seq=1 Ack=183 Win=15680 Len=0"
"179","146.084627","10.152.152.11","5.9.28.6","TCP","54","46482  >  5281 [ACK] Seq=183 Ack=2 Win=14608 Len=0"
"180","146.084863","5.9.28.6","10.152.152.11","TCP","60","5281  >  46483 [FIN, ACK] Seq=1 Ack=183 Win=15680 Len=0"
"181","146.084873","10.152.152.11","5.9.28.6","TCP","54","46483  >  5281 [ACK] Seq=183 Ack=2 Win=14608 Len=0"
"182","146.098986","10.152.152.11","195.95.178.116","TCP","54","51332  >  443 [FIN, ACK] Seq=315 Ack=3912 Win=24432 Len=0"
"183","146.099211","10.152.152.11","216.58.211.42","TCP","54","37841  >  443 [FIN, ACK] Seq=320 Ack=3600 Win=24432 Len=0"
"184","146.099388","195.95.178.116","10.152.152.11","TCP","60","443  >  51332 [FIN, ACK] Seq=3912 Ack=316 Win=16752 Len=0"
"185","146.099405","10.152.152.11","195.95.178.116","TCP","54","51332  >  443 [ACK] Seq=316 Ack=3913 Win=24432 Len=0"
"186","146.099571","216.58.211.42","10.152.152.11","TCP","60","443  >  37841 [FIN, ACK] Seq=3600 Ack=321 Win=16752 Len=0"
"187","146.099582","10.152.152.11","216.58.211.42","TCP","54","37841  >  443 [ACK] Seq=321 Ack=3601 Win=24432 Len=0"
"188","146.099711","10.152.152.11","195.95.178.109","TCP","54","41076  >  443 [FIN, ACK] Seq=165 Ack=1 Win=14608 Len=0"
"189","146.100153","195.95.178.109","10.152.152.11","TCP","60","443  >  41076 [FIN, ACK] Seq=1 Ack=166 Win=15680 Len=0"
"190","146.100175","10.152.152.11","195.95.178.109","TCP","54","41076  >  443 [ACK] Seq=166 Ack=2 Win=14608 Len=0"
"191","153.483597","10.152.152.11","5.9.28.6","TCP","459","49616  >  5222 [PSH, ACK] Seq=3668 Ack=6306 Win=4764 Len=405 [TCP segment of a reassembled PDU]"
"192","153.483885","5.9.28.6","10.152.152.11","TCP","60","5222  >  49616 [ACK] Seq=6306 Ack=4073 Win=2640 Len=0"
"193","153.742110","5.9.28.6","10.152.152.11","TCP","539","5222  >  49616 [PSH, ACK] Seq=6306 Ack=4073 Win=2640 Len=485 [TCP segment of a reassembled PDU]"
"194","153.742199","10.152.152.11","5.9.28.6","TCP","54","49616  >  5222 [ACK] Seq=4073 Ack=6791 Win=4764 Len=0"
"195","155.622249","5.9.28.6","10.152.152.11","TCP","539","5222  >  49616 [PSH, ACK] Seq=6791 Ack=4073 Win=2640 Len=485 [TCP segment of a reassembled PDU]"
"196","155.622330","10.152.152.11","5.9.28.6","TCP","54","49616  >  5222 [ACK] Seq=4073 Ack=7276 Win=4764 Len=0"
"197","168.444264","10.152.152.11","5.9.28.6","TCP","1195","49616  >  5222 [PSH, ACK] Seq=4073 Ack=7276 Win=4764 Len=1141 [TCP segment of a reassembled PDU]"
"198","168.444769","5.9.28.6","10.152.152.11","TCP","60","5222  >  49616 [ACK] Seq=7276 Ack=5214 Win=2640 Len=0"
"199","168.806290","5.9.28.6","10.152.152.11","TCP","552","5222  >  49616 [PSH, ACK] Seq=7276 Ack=5214 Win=2640 Len=498 [TCP segment of a reassembled PDU]"
"200","168.806380","10.152.152.11","5.9.28.6","TCP","54","49616  >  5222 [ACK] Seq=5214 Ack=7774 Win=4764 Len=0"
"201","168.934432","5.9.28.6","10.152.152.11","TCP","297","5222  >  49616 [PSH, ACK] Seq=7774 Ack=5214 Win=2640 Len=243 [TCP segment of a reassembled PDU]"
"202","168.934457","10.152.152.11","5.9.28.6","TCP","54","49616  >  5222 [ACK] Seq=5214 Ack=8017 Win=4764 Len=0"
"203","171.102692","5.9.28.6","10.152.152.11","TCP","539","5222  >  49616 [PSH, ACK] Seq=8017 Ack=5214 Win=2640 Len=485 [TCP segment of a reassembled PDU]"
"204","171.102728","10.152.152.11","5.9.28.6","TCP","54","49616  >  5222 [ACK] Seq=5214 Ack=8502 Win=4764 Len=0"
"205","190.596210","10.152.152.11","5.9.28.6","TCP","971","49616  >  5222 [PSH, ACK] Seq=5214 Ack=8502 Win=4764 Len=917 [TCP segment of a reassembled PDU]"
"206","190.596684","5.9.28.6","10.152.152.11","TCP","60","5222  >  49616 [ACK] Seq=8502 Ack=6131 Win=2640 Len=0"
"207","190.935312","5.9.28.6","10.152.152.11","TCP","552","5222  >  49616 [PSH, ACK] Seq=8502 Ack=6131 Win=2640 Len=498 [TCP segment of a reassembled PDU]"
"208","190.935404","10.152.152.11","5.9.28.6","TCP","54","49616  >  5222 [ACK] Seq=6131 Ack=9000 Win=4764 Len=0"
"209","191.098080","5.9.28.6","10.152.152.11","TCP","297","5222  >  49616 [PSH, ACK] Seq=9000 Ack=6131 Win=2640 Len=243 [TCP segment of a reassembled PDU]"
"210","191.098106","10.152.152.11","5.9.28.6","TCP","54","49616  >  5222 [ACK] Seq=6131 Ack=9243 Win=4764 Len=0"
"211","193.373059","5.9.28.6","10.152.152.11","TCP","539","5222  >  49616 [PSH, ACK] Seq=9243 Ack=6131 Win=2640 Len=485 [TCP segment of a reassembled PDU]"
"212","193.373143","10.152.152.11","5.9.28.6","TCP","54","49616  >  5222 [ACK] Seq=6131 Ack=9728 Win=4764 Len=0"
"213","195.610968","PcsCompu_11:4d:b1","PcsCompu_78:57:ca","ARP","42","Who has 10.152.152.10? Tell 10.152.152.11"
"214","195.611459","PcsCompu_78:57:ca","PcsCompu_11:4d:b1","ARP","60","10.152.152.10 is at 08:00:27:78:57:ca"
"215","197.819340","10.152.152.11","5.9.28.6","TCP","459","49616  >  5222 [PSH, ACK] Seq=6131 Ack=9728 Win=4764 Len=405 [TCP segment of a reassembled PDU]"
"216","197.819854","5.9.28.6","10.152.152.11","TCP","60","5222  >  49616 [ACK] Seq=9728 Ack=6536 Win=2640 Len=0"
"217","198.159655","5.9.28.6","10.152.152.11","TCP","539","5222  >  49616 [PSH, ACK] Seq=9728 Ack=6536 Win=2640 Len=485 [TCP segment of a reassembled PDU]"
"218","198.159746","10.152.152.11","5.9.28.6","TCP","54","49616  >  5222 [ACK] Seq=6536 Ack=10213 Win=4764 Len=0"
"219","200.187238","10.152.152.11","5.9.28.6","TCP","459","49616  >  5222 [PSH, ACK] Seq=6536 Ack=10213 Win=4764 Len=405 [TCP segment of a reassembled PDU]"
"220","200.187484","5.9.28.6","10.152.152.11","TCP","60","5222  >  49616 [ACK] Seq=10213 Ack=6941 Win=2640 Len=0"
"221","200.520990","5.9.28.6","10.152.152.11","TCP","539","5222  >  49616 [PSH, ACK] Seq=10213 Ack=6941 Win=2640 Len=485 [TCP segment of a reassembled PDU]"
"222","200.521089","10.152.152.11","5.9.28.6","TCP","54","49616  >  5222 [ACK] Seq=6941 Ack=10698 Win=4764 Len=0"
"223","200.645849","5.9.28.6","10.152.152.11","TCP","539","5222  >  49616 [PSH, ACK] Seq=10698 Ack=6941 Win=2640 Len=485 [TCP segment of a reassembled PDU]"
"224","200.645870","10.152.152.11","5.9.28.6","TCP","54","49616  >  5222 [ACK] Seq=6941 Ack=11183 Win=4764 Len=0"
"225","202.050657","10.152.152.11","5.9.28.6","TCP","459","49616  >  5222 [PSH, ACK] Seq=6941 Ack=11183 Win=4764 Len=405 [TCP segment of a reassembled PDU]"
"226","202.051075","5.9.28.6","10.152.152.11","TCP","60","5222  >  49616 [ACK] Seq=11183 Ack=7346 Win=2640 Len=0"
"227","202.284454","5.9.28.6","10.152.152.11","TCP","539","5222  >  49616 [PSH, ACK] Seq=11183 Ack=7346 Win=2640 Len=485 [TCP segment of a reassembled PDU]"
"228","202.284545","10.152.152.11","5.9.28.6","TCP","54","49616  >  5222 [ACK] Seq=7346 Ack=11668 Win=4764 Len=0"
"229","203.780110","5.9.28.6","10.152.152.11","TCP","539","5222  >  49616 [PSH, ACK] Seq=11668 Ack=7346 Win=2640 Len=485 [TCP segment of a reassembled PDU]"
"230","203.780135","10.152.152.11","5.9.28.6","TCP","54","49616  >  5222 [ACK] Seq=7346 Ack=12153 Win=4764 Len=0"
"231","204.978395","5.9.28.6","10.152.152.11","TCP","539","5222  >  49616 [PSH, ACK] Seq=12153 Ack=7346 Win=2640 Len=485 [TCP segment of a reassembled PDU]"
"232","204.978428","10.152.152.11","5.9.28.6","TCP","54","49616  >  5222 [ACK] Seq=7346 Ack=12638 Win=4764 Len=0"
"233","207.340356","10.152.152.11","5.9.28.6","TCP","955","49616  >  5222 [PSH, ACK] Seq=7346 Ack=12638 Win=4764 Len=901 [TCP segment of a reassembled PDU]"
"234","207.340452","5.9.28.6","10.152.152.11","TCP","60","5222  >  49616 [ACK] Seq=12638 Ack=8247 Win=2640 Len=0"
"235","207.743058","5.9.28.6","10.152.152.11","TCP","552","5222  >  49616 [PSH, ACK] Seq=12638 Ack=8247 Win=2640 Len=498 [TCP segment of a reassembled PDU]"
"236","207.743118","10.152.152.11","5.9.28.6","TCP","54","49616  >  5222 [ACK] Seq=8247 Ack=13136 Win=4764 Len=0"
"237","207.868222","5.9.28.6","10.152.152.11","TCP","297","5222  >  49616 [PSH, ACK] Seq=13136 Ack=8247 Win=2640 Len=243 [TCP segment of a reassembled PDU]"
"238","207.868307","10.152.152.11","5.9.28.6","TCP","54","49616  >  5222 [ACK] Seq=8247 Ack=13379 Win=4764 Len=0"
"239","211.403563","10.152.152.11","5.9.28.6","TCP","715","49616  >  5222 [PSH, ACK] Seq=8247 Ack=13379 Win=4764 Len=661 [TCP segment of a reassembled PDU]"
"240","211.404029","5.9.28.6","10.152.152.11","TCP","60","5222  >  49616 [ACK] Seq=13379 Ack=8908 Win=2640 Len=0"
"241","211.810493","5.9.28.6","10.152.152.11","TCP","552","5222  >  49616 [PSH, ACK] Seq=13379 Ack=8908 Win=2640 Len=498 [TCP segment of a reassembled PDU]"
"242","211.810584","10.152.152.11","5.9.28.6","TCP","54","49616  >  5222 [ACK] Seq=8908 Ack=13877 Win=4764 Len=0"
"243","211.935728","5.9.28.6","10.152.152.11","TCP","281","5222  >  49616 [PSH, ACK] Seq=13877 Ack=8908 Win=2640 Len=227 [TCP segment of a reassembled PDU]"
"244","211.935978","10.152.152.11","5.9.28.6","TCP","54","49616  >  5222 [ACK] Seq=8908 Ack=14104 Win=4764 Len=0"
"245","212.720516","5.9.28.6","10.152.152.11","TCP","539","5222  >  49616 [PSH, ACK] Seq=14104 Ack=8908 Win=2640 Len=485 [TCP segment of a reassembled PDU]"
"246","212.720595","10.152.152.11","5.9.28.6","TCP","54","49616  >  5222 [ACK] Seq=8908 Ack=14589 Win=4764 Len=0"
"247","213.832754","5.9.28.6","10.152.152.11","TCP","539","5222  >  49616 [PSH, ACK] Seq=14589 Ack=8908 Win=2640 Len=485 [TCP segment of a reassembled PDU]"
"248","213.832788","10.152.152.11","5.9.28.6","TCP","54","49616  >  5222 [ACK] Seq=8908 Ack=15074 Win=4764 Len=0"
"249","215.019610","10.152.152.11","5.9.28.6","TCP","715","49616  >  5222 [PSH, ACK] Seq=8908 Ack=15074 Win=4764 Len=661 [TCP segment of a reassembled PDU]"
"250","215.020130","5.9.28.6","10.152.152.11","TCP","60","5222  >  49616 [ACK] Seq=15074 Ack=9569 Win=2640 Len=0"
"251","215.352909","5.9.28.6","10.152.152.11","TCP","539","5222  >  49616 [PSH, ACK] Seq=15074 Ack=9569 Win=2640 Len=485 [TCP segment of a reassembled PDU]"
"252","215.352972","10.152.152.11","5.9.28.6","TCP","54","49616  >  5222 [ACK] Seq=9569 Ack=15559 Win=4764 Len=0"
"253","215.478431","5.9.28.6","10.152.152.11","TCP","552","5222  >  49616 [PSH, ACK] Seq=15559 Ack=9569 Win=2640 Len=498 [TCP segment of a reassembled PDU]"
"254","215.478513","10.152.152.11","5.9.28.6","TCP","54","49616  >  5222 [ACK] Seq=9569 Ack=16057 Win=4764 Len=0"
"255","215.543630","5.9.28.6","10.152.152.11","TCP","281","5222  >  49616 [PSH, ACK] Seq=16057 Ack=9569 Win=2640 Len=227 [TCP segment of a reassembled PDU]"
"256","215.543653","10.152.152.11","5.9.28.6","TCP","54","49616  >  5222 [ACK] Seq=9569 Ack=16284 Win=4764 Len=0"
"257","215.920831","5.9.28.6","10.152.152.11","TCP","539","5222  >  49616 [PSH, ACK] Seq=16284 Ack=9569 Win=2640 Len=485 [TCP segment of a reassembled PDU]"
"258","215.920858","10.152.152.11","5.9.28.6","TCP","54","49616  >  5222 [ACK] Seq=9569 Ack=16769 Win=4764 Len=0"
"259","219.123200","10.152.152.11","5.9.28.6","TCP","715","49616  >  5222 [PSH, ACK] Seq=9569 Ack=16769 Win=4764 Len=661 [TCP segment of a reassembled PDU]"
"260","219.123598","5.9.28.6","10.152.152.11","TCP","60","5222  >  49616 [ACK] Seq=16769 Ack=10230 Win=2640 Len=0"
"261","219.415937","5.9.28.6","10.152.152.11","TCP","552","5222  >  49616 [PSH, ACK] Seq=16769 Ack=10230 Win=2640 Len=498 [TCP segment of a reassembled PDU]"
"262","219.416003","10.152.152.11","5.9.28.6","TCP","54","49616  >  5222 [ACK] Seq=10230 Ack=17267 Win=4764 Len=0"
"263","219.540098","5.9.28.6","10.152.152.11","TCP","281","5222  >  49616 [PSH, ACK] Seq=17267 Ack=10230 Win=2640 Len=227 [TCP segment of a reassembled PDU]"
"264","219.540160","10.152.152.11","5.9.28.6","TCP","54","49616  >  5222 [ACK] Seq=10230 Ack=17494 Win=4764 Len=0"
"265","221.377393","10.152.152.11","5.9.28.6","TCP","459","49616  >  5222 [PSH, ACK] Seq=10230 Ack=17494 Win=4764 Len=405 [TCP segment of a reassembled PDU]"
"266","221.377504","5.9.28.6","10.152.152.11","TCP","60","5222  >  49616 [ACK] Seq=17494 Ack=10635 Win=2640 Len=0"
"267","221.722287","5.9.28.6","10.152.152.11","TCP","539","5222  >  49616 [PSH, ACK] Seq=17494 Ack=10635 Win=2640 Len=485 [TCP segment of a reassembled PDU]"
"268","221.722349","10.152.152.11","5.9.28.6","TCP","54","49616  >  5222 [ACK] Seq=10635 Ack=17979 Win=4764 Len=0"
"269","228.221825","5.9.28.6","10.152.152.11","TCP","539","5222  >  49616 [PSH, ACK] Seq=17979 Ack=10635 Win=2640 Len=485 [TCP segment of a reassembled PDU]"
"270","228.221866","10.152.152.11","5.9.28.6","TCP","54","49616  >  5222 [ACK] Seq=10635 Ack=18464 Win=4764 Len=0"
"271","228.843352","5.9.28.6","10.152.152.11","TCP","539","5222  >  49616 [PSH, ACK] Seq=18464 Ack=10635 Win=2640 Len=485 [TCP segment of a reassembled PDU]"
"272","228.843386","10.152.152.11","5.9.28.6","TCP","54","49616  >  5222 [ACK] Seq=10635 Ack=18949 Win=4764 Len=0"
"273","233.989162","10.152.152.11","5.9.28.6","TCP","1514","49616  >  5222 [ACK] Seq=10635 Ack=18949 Win=4764 Len=1460 [TCP segment of a reassembled PDU]"
"274","233.989295","10.152.152.11","5.9.28.6","TCP","231","49616  >  5222 [PSH, ACK] Seq=12095 Ack=18949 Win=4764 Len=177 [TCP segment of a reassembled PDU]"
"275","233.989593","5.9.28.6","10.152.152.11","TCP","60","5222  >  49616 [ACK] Seq=18949 Ack=12095 Win=2640 Len=0"
"276","233.989624","5.9.28.6","10.152.152.11","TCP","60","5222  >  49616 [ACK] Seq=18949 Ack=12272 Win=2629 Len=0"
"277","234.374478","5.9.28.6","10.152.152.11","TCP","552","5222  >  49616 [PSH, ACK] Seq=18949 Ack=12272 Win=2640 Len=498 [TCP segment of a reassembled PDU]"
"278","234.374590","10.152.152.11","5.9.28.6","TCP","54","49616  >  5222 [ACK] Seq=12272 Ack=19447 Win=4764 Len=0"
"279","234.555526","5.9.28.6","10.152.152.11","TCP","297","5222  >  49616 [PSH, ACK] Seq=19447 Ack=12272 Win=2640 Len=243 [TCP segment of a reassembled PDU]"
"280","234.555557","10.152.152.11","5.9.28.6","TCP","54","49616  >  5222 [ACK] Seq=12272 Ack=19690 Win=4764 Len=0"
"281","239.177063","5.9.28.6","10.152.152.11","TCP","539","5222  >  49616 [PSH, ACK] Seq=19690 Ack=12272 Win=2640 Len=485 [TCP segment of a reassembled PDU]"
"282","239.177110","10.152.152.11","5.9.28.6","TCP","54","49616  >  5222 [ACK] Seq=12272 Ack=20175 Win=4764 Len=0"
"283","246.555932","10.152.152.11","5.9.28.6","TCP","955","49616  >  5222 [PSH, ACK] Seq=12272 Ack=20175 Win=4764 Len=901 [TCP segment of a reassembled PDU]"
"284","246.556406","5.9.28.6","10.152.152.11","TCP","60","5222  >  49616 [ACK] Seq=20175 Ack=13173 Win=2640 Len=0"
"285","247.031809","5.9.28.6","10.152.152.11","TCP","552","5222  >  49616 [PSH, ACK] Seq=20175 Ack=13173 Win=2640 Len=498 [TCP segment of a reassembled PDU]"
"286","247.031924","10.152.152.11","5.9.28.6","TCP","54","49616  >  5222 [ACK] Seq=13173 Ack=20673 Win=4764 Len=0"
"287","247.156556","5.9.28.6","10.152.152.11","TCP","297","5222  >  49616 [PSH, ACK] Seq=20673 Ack=13173 Win=2640 Len=243 [TCP segment of a reassembled PDU]"
"288","247.156584","10.152.152.11","5.9.28.6","TCP","54","49616  >  5222 [ACK] Seq=13173 Ack=20916 Win=4764 Len=0"
"289","258.498313","5.9.28.6","10.152.152.11","TCP","539","5222  >  49616 [PSH, ACK] Seq=20916 Ack=13173 Win=2640 Len=485 [TCP segment of a reassembled PDU]"
"290","258.498358","10.152.152.11","5.9.28.6","TCP","54","49616  >  5222 [ACK] Seq=13173 Ack=21401 Win=4764 Len=0"
"291","271.525698","10.152.152.11","5.9.28.6","TCP","1514","49616  >  5222 [ACK] Seq=13173 Ack=21401 Win=4764 Len=1460 [TCP segment of a reassembled PDU]"
"292","271.525783","10.152.152.11","5.9.28.6","TCP","487","49616  >  5222 [PSH, ACK] Seq=14633 Ack=21401 Win=4764 Len=433 [TCP segment of a reassembled PDU]"
"293","271.525855","5.9.28.6","10.152.152.11","TCP","60","5222  >  49616 [ACK] Seq=21401 Ack=14633 Win=2640 Len=0"
"294","271.525884","5.9.28.6","10.152.152.11","TCP","60","5222  >  49616 [ACK] Seq=21401 Ack=15066 Win=2613 Len=0"
"295","271.875110","5.9.28.6","10.152.152.11","TCP","552","5222  >  49616 [PSH, ACK] Seq=21401 Ack=15066 Win=2640 Len=498 [TCP segment of a reassembled PDU]"
"296","271.875199","10.152.152.11","5.9.28.6","TCP","54","49616  >  5222 [ACK] Seq=15066 Ack=21899 Win=4764 Len=0"
"297","272.002101","5.9.28.6","10.152.152.11","TCP","297","5222  >  49616 [PSH, ACK] Seq=21899 Ack=15066 Win=2640 Len=243 [TCP segment of a reassembled PDU]"
"298","272.002127","10.152.152.11","5.9.28.6","TCP","54","49616  >  5222 [ACK] Seq=15066 Ack=22142 Win=4764 Len=0"
"299","274.014128","5.9.28.6","10.152.152.11","TCP","539","5222  >  49616 [PSH, ACK] Seq=22142 Ack=15066 Win=2640 Len=485 [TCP segment of a reassembled PDU]"
"300","274.014216","10.152.152.11","5.9.28.6","TCP","54","49616  >  5222 [ACK] Seq=15066 Ack=22627 Win=4764 Len=0"
"301","276.538931","PcsCompu_11:4d:b1","PcsCompu_78:57:ca","ARP","42","Who has 10.152.152.10? Tell 10.152.152.11"
"302","276.539099","PcsCompu_78:57:ca","PcsCompu_11:4d:b1","ARP","60","10.152.152.10 is at 08:00:27:78:57:ca"
"303","284.323940","10.152.152.11","5.9.28.6","TCP","1195","49616  >  5222 [PSH, ACK] Seq=15066 Ack=22627 Win=4764 Len=1141 [TCP segment of a reassembled PDU]"
"304","284.324406","5.9.28.6","10.152.152.11","TCP","60","5222  >  49616 [ACK] Seq=22627 Ack=16207 Win=2640 Len=0"
"305","284.785704","5.9.28.6","10.152.152.11","XMPP/XML","552","UNKNOWN PACKET "
"306","284.785795","10.152.152.11","5.9.28.6","TCP","54","49616  >  5222 [ACK] Seq=16207 Ack=23125 Win=4764 Len=0"
"307","284.910257","5.9.28.6","10.152.152.11","TCP","297","5222  >  49616 [PSH, ACK] Seq=23125 Ack=16207 Win=2640 Len=243 [TCP segment of a reassembled PDU]"
"308","284.910291","10.152.152.11","5.9.28.6","TCP","54","49616  >  5222 [ACK] Seq=16207 Ack=23368 Win=4764 Len=0"
"309","287.061908","5.9.28.6","10.152.152.11","TCP","539","5222  >  49616 [PSH, ACK] Seq=23368 Ack=16207 Win=2640 Len=485 [TCP segment of a reassembled PDU]"
"310","287.061942","10.152.152.11","5.9.28.6","TCP","54","49616  >  5222 [ACK] Seq=16207 Ack=23853 Win=4764 Len=0"
"311","302.813405","10.152.152.11","5.9.28.6","TCP","1451","49616  >  5222 [PSH, ACK] Seq=16207 Ack=23853 Win=4764 Len=1397 [TCP segment of a reassembled PDU]"
"312","302.813695","5.9.28.6","10.152.152.11","TCP","60","5222  >  49616 [ACK] Seq=23853 Ack=17604 Win=2640 Len=0"
"313","303.169807","5.9.28.6","10.152.152.11","TCP","552","5222  >  49616 [PSH, ACK] Seq=23853 Ack=17604 Win=2640 Len=498 [TCP segment of a reassembled PDU]"
"314","303.169916","10.152.152.11","5.9.28.6","TCP","54","49616  >  5222 [ACK] Seq=17604 Ack=24351 Win=4764 Len=0"
"315","303.294348","5.9.28.6","10.152.152.11","TCP","297","5222  >  49616 [PSH, ACK] Seq=24351 Ack=17604 Win=2640 Len=243 [TCP segment of a reassembled PDU]"
"316","303.294385","10.152.152.11","5.9.28.6","TCP","54","49616  >  5222 [ACK] Seq=17604 Ack=24594 Win=4764 Len=0"
"317","305.621872","5.9.28.6","10.152.152.11","TCP","539","5222  >  49616 [PSH, ACK] Seq=24594 Ack=17604 Win=2640 Len=485 [TCP segment of a reassembled PDU]"
"318","305.621947","10.152.152.11","5.9.28.6","TCP","54","49616  >  5222 [ACK] Seq=17604 Ack=25079 Win=4764 Len=0"
"319","327.268838","10.152.152.11","5.9.28.6","TCP","1514","49616  >  5222 [ACK] Seq=17604 Ack=25079 Win=4764 Len=1460 [TCP segment of a reassembled PDU]"
"320","327.268952","10.152.152.11","5.9.28.6","TCP","487","49616  >  5222 [PSH, ACK] Seq=19064 Ack=25079 Win=4764 Len=433 [TCP segment of a reassembled PDU]"
"321","327.269253","5.9.28.6","10.152.152.11","TCP","60","5222  >  49616 [ACK] Seq=25079 Ack=19064 Win=2640 Len=0"
"322","327.269275","5.9.28.6","10.152.152.11","TCP","60","5222  >  49616 [ACK] Seq=25079 Ack=19497 Win=2613 Len=0"
"323","327.667483","5.9.28.6","10.152.152.11","TCP","552","5222  >  49616 [PSH, ACK] Seq=25079 Ack=19497 Win=2640 Len=498 [TCP segment of a reassembled PDU]"
"324","327.667588","10.152.152.11","5.9.28.6","TCP","54","49616  >  5222 [ACK] Seq=19497 Ack=25577 Win=4764 Len=0"
"325","327.791748","5.9.28.6","10.152.152.11","TCP","297","5222  >  49616 [PSH, ACK] Seq=25577 Ack=19497 Win=2640 Len=243 [TCP segment of a reassembled PDU]"
"326","327.791777","10.152.152.11","5.9.28.6","TCP","54","49616  >  5222 [ACK] Seq=19497 Ack=25820 Win=4764 Len=0"
"327","330.140272","5.9.28.6","10.152.152.11","TCP","539","5222  >  49616 [PSH, ACK] Seq=25820 Ack=19497 Win=2640 Len=485 [TCP segment of a reassembled PDU]"
"328","330.140355","10.152.152.11","5.9.28.6","TCP","54","49616  >  5222 [ACK] Seq=19497 Ack=26305 Win=4764 Len=0"
"329","332.282973","PcsCompu_11:4d:b1","PcsCompu_78:57:ca","ARP","42","Who has 10.152.152.10? Tell 10.152.152.11"
"330","332.283421","PcsCompu_78:57:ca","PcsCompu_11:4d:b1","ARP","60","10.152.152.10 is at 08:00:27:78:57:ca"
"331","345.812445","10.152.152.11","5.9.28.6","TCP","1451","49616  >  5222 [PSH, ACK] Seq=19497 Ack=26305 Win=4764 Len=1397 [TCP segment of a reassembled PDU]"
"332","345.812955","5.9.28.6","10.152.152.11","TCP","60","5222  >  49616 [ACK] Seq=26305 Ack=20894 Win=2640 Len=0"
"333","346.181651","5.9.28.6","10.152.152.11","TCP","552","5222  >  49616 [PSH, ACK] Seq=26305 Ack=20894 Win=2640 Len=498 [TCP segment of a reassembled PDU]"
"334","346.181740","10.152.152.11","5.9.28.6","TCP","54","49616  >  5222 [ACK] Seq=20894 Ack=26803 Win=4764 Len=0"
"335","346.306216","5.9.28.6","10.152.152.11","TCP","297","5222  >  49616 [PSH, ACK] Seq=26803 Ack=20894 Win=2640 Len=243 [TCP segment of a reassembled PDU]"
"336","346.306298","10.152.152.11","5.9.28.6","TCP","54","49616  >  5222 [ACK] Seq=20894 Ack=27046 Win=4764 Len=0"
"337","348.231396","5.9.28.6","10.152.152.11","TCP","539","5222  >  49616 [PSH, ACK] Seq=27046 Ack=20894 Win=2640 Len=485 [TCP segment of a reassembled PDU]"
"338","348.231431","10.152.152.11","5.9.28.6","TCP","54","49616  >  5222 [ACK] Seq=20894 Ack=27531 Win=4764 Len=0"
"339","366.747945","10.152.152.11","5.9.28.6","TCP","1195","49616  >  5222 [PSH, ACK] Seq=20894 Ack=27531 Win=4764 Len=1141 [TCP segment of a reassembled PDU]"
"340","366.748402","5.9.28.6","10.152.152.11","TCP","60","5222  >  49616 [ACK] Seq=27531 Ack=22035 Win=2640 Len=0"
"341","367.161658","5.9.28.6","10.152.152.11","TCP","552","5222  >  49616 [PSH, ACK] Seq=27531 Ack=22035 Win=2640 Len=498 [TCP segment of a reassembled PDU]"
"342","367.161776","10.152.152.11","5.9.28.6","TCP","54","49616  >  5222 [ACK] Seq=22035 Ack=28029 Win=4764 Len=0"
"343","367.187480","5.9.28.6","10.152.152.11","TCP","297","5222  >  49616 [PSH, ACK] Seq=28029 Ack=22035 Win=2640 Len=243 [TCP segment of a reassembled PDU]"
"344","367.187506","10.152.152.11","5.9.28.6","TCP","54","49616  >  5222 [ACK] Seq=22035 Ack=28272 Win=4764 Len=0"
"345","368.749791","5.9.28.6","10.152.152.11","TCP","539","5222  >  49616 [PSH, ACK] Seq=28272 Ack=22035 Win=2640 Len=485 [TCP segment of a reassembled PDU]"
"346","368.749825","10.152.152.11","5.9.28.6","TCP","54","49616  >  5222 [ACK] Seq=22035 Ack=28757 Win=4764 Len=0"
"347","395.282621","10.152.152.11","5.9.28.6","TCP","715","49616  >  5222 [PSH, ACK] Seq=22035 Ack=28757 Win=4764 Len=661 [TCP segment of a reassembled PDU]"
"348","395.282703","5.9.28.6","10.152.152.11","TCP","60","5222  >  49616 [ACK] Seq=28757 Ack=22696 Win=2640 Len=0"
"349","395.606991","5.9.28.6","10.152.152.11","TCP","552","5222  >  49616 [PSH, ACK] Seq=28757 Ack=22696 Win=2640 Len=498 [TCP segment of a reassembled PDU]"
"350","395.607079","10.152.152.11","5.9.28.6","TCP","54","49616  >  5222 [ACK] Seq=22696 Ack=29255 Win=4764 Len=0"
"351","395.731420","5.9.28.6","10.152.152.11","XMPP/XML","281","UNKNOWN PACKET "
"352","395.731450","10.152.152.11","5.9.28.6","TCP","54","49616  >  5222 [ACK] Seq=22696 Ack=29482 Win=4764 Len=0"
"353","400.250118","5.9.28.6","10.152.152.11","TCP","552","5222  >  49616 [PSH, ACK] Seq=29482 Ack=22696 Win=2640 Len=498 [TCP segment of a reassembled PDU]"
"354","400.250164","10.152.152.11","5.9.28.6","TCP","54","49616  >  5222 [ACK] Seq=22696 Ack=29980 Win=4764 Len=0"
"355","400.383085","5.9.28.6","10.152.152.11","TCP","281","5222  >  49616 [PSH, ACK] Seq=29980 Ack=22696 Win=2640 Len=227 [TCP segment of a reassembled PDU]"
"356","400.383113","10.152.152.11","5.9.28.6","TCP","54","49616  >  5222 [ACK] Seq=22696 Ack=30207 Win=4764 Len=0"
"357","405.155971","10.152.152.11","5.9.28.6","TCP","955","49616  >  5222 [PSH, ACK] Seq=22696 Ack=30207 Win=4764 Len=901 [TCP segment of a reassembled PDU]"
"358","405.156385","5.9.28.6","10.152.152.11","TCP","60","5222  >  49616 [ACK] Seq=30207 Ack=23597 Win=2640 Len=0"
"359","405.449095","5.9.28.6","10.152.152.11","TCP","552","5222  >  49616 [PSH, ACK] Seq=30207 Ack=23597 Win=2640 Len=498 [TCP segment of a reassembled PDU]"
"360","405.449168","10.152.152.11","5.9.28.6","TCP","54","49616  >  5222 [ACK] Seq=23597 Ack=30705 Win=4764 Len=0"
"361","405.615966","5.9.28.6","10.152.152.11","TCP","297","5222  >  49616 [PSH, ACK] Seq=30705 Ack=23597 Win=2640 Len=243 [TCP segment of a reassembled PDU]"
"362","405.616043","10.152.152.11","5.9.28.6","TCP","54","49616  >  5222 [ACK] Seq=23597 Ack=30948 Win=4764 Len=0"
"363","408.138020","5.9.28.6","10.152.152.11","TCP","539","5222  >  49616 [PSH, ACK] Seq=30948 Ack=23597 Win=2640 Len=485 [TCP segment of a reassembled PDU]"
"364","408.138062","10.152.152.11","5.9.28.6","TCP","54","49616  >  5222 [ACK] Seq=23597 Ack=31433 Win=4764 Len=0"
"365","410.442693","10.152.152.11","5.9.28.6","TCP","715","49616  >  5222 [PSH, ACK] Seq=23597 Ack=31433 Win=4764 Len=661 [TCP segment of a reassembled PDU]"
"366","410.442910","5.9.28.6","10.152.152.11","TCP","60","5222  >  49616 [ACK] Seq=31433 Ack=24258 Win=2640 Len=0"
"367","410.749058","5.9.28.6","10.152.152.11","TCP","552","5222  >  49616 [PSH, ACK] Seq=31433 Ack=24258 Win=2640 Len=498 [TCP segment of a reassembled PDU]"
"368","410.749146","10.152.152.11","5.9.28.6","TCP","54","49616  >  5222 [ACK] Seq=24258 Ack=31931 Win=4764 Len=0"
"369","410.873337","5.9.28.6","10.152.152.11","TCP","281","5222  >  49616 [PSH, ACK] Seq=31931 Ack=24258 Win=2640 Len=227 [TCP segment of a reassembled PDU]"
"370","410.873363","10.152.152.11","5.9.28.6","TCP","54","49616  >  5222 [ACK] Seq=24258 Ack=32158 Win=4764 Len=0"
"371","414.135525","5.9.28.6","10.152.152.11","TCP","552","5222  >  49616 [PSH, ACK] Seq=32158 Ack=24258 Win=2640 Len=498 [TCP segment of a reassembled PDU]"
"372","414.135606","10.152.152.11","5.9.28.6","TCP","54","49616  >  5222 [ACK] Seq=24258 Ack=32656 Win=4764 Len=0"
"373","414.265394","5.9.28.6","10.152.152.11","TCP","281","5222  >  49616 [PSH, ACK] Seq=32656 Ack=24258 Win=2640 Len=227 [TCP segment of a reassembled PDU]"
"374","414.265432","10.152.152.11","5.9.28.6","TCP","54","49616  >  5222 [ACK] Seq=24258 Ack=32883 Win=4764 Len=0"
"375","449.999663","10.152.152.11","5.9.28.6","TCP","171","49616  >  5222 [PSH, ACK] Seq=24258 Ack=32883 Win=4764 Len=117 [TCP segment of a reassembled PDU]"
"376","449.999826","5.9.28.6","10.152.152.11","TCP","60","5222  >  49616 [ACK] Seq=32883 Ack=24375 Win=2640 Len=0"
"377","451.191759","5.9.28.6","10.152.152.11","TCP","203","5222  >  49616 [PSH, ACK] Seq=32883 Ack=24375 Win=2640 Len=149 [TCP segment of a reassembled PDU]"
"378","451.191847","10.152.152.11","5.9.28.6","TCP","54","49616  >  5222 [ACK] Seq=24375 Ack=33032 Win=4764 Len=0"
"379","455.002948","PcsCompu_11:4d:b1","PcsCompu_78:57:ca","ARP","42","Who has 10.152.152.10? Tell 10.152.152.11"
"380","455.003103","PcsCompu_78:57:ca","PcsCompu_11:4d:b1","ARP","60","10.152.152.10 is at 08:00:27:78:57:ca"
"381","510.000296","10.152.152.11","5.9.28.6","TCP","171","49616  >  5222 [PSH, ACK] Seq=24375 Ack=33032 Win=4764 Len=117 [TCP segment of a reassembled PDU]"
"382","510.000548","5.9.28.6","10.152.152.11","TCP","60","5222  >  49616 [ACK] Seq=33032 Ack=24492 Win=2640 Len=0"
"383","510.239961","5.9.28.6","10.152.152.11","TCP","203","5222  >  49616 [PSH, ACK] Seq=33032 Ack=24492 Win=2640 Len=149 [TCP segment of a reassembled PDU]"
"384","510.240059","10.152.152.11","5.9.28.6","TCP","54","49616  >  5222 [ACK] Seq=24492 Ack=33181 Win=4764 Len=0"
"385","515.002921","PcsCompu_11:4d:b1","PcsCompu_78:57:ca","ARP","42","Who has 10.152.152.10? Tell 10.152.152.11"
"386","515.003099","PcsCompu_78:57:ca","PcsCompu_11:4d:b1","ARP","60","10.152.152.10 is at 08:00:27:78:57:ca"
