"No.","Time","Source","Destination","Protocol","Length","Info"
"1","0.000000","157.56.126.111","10.152.152.11","TLSv1","507","Application Data"
"2","0.000069","10.152.152.11","157.56.126.111","TCP","54","53178  >  443 [ACK] Seq=1 Ack=454 Win=4100 Len=0"
"3","6.689434","157.56.126.111","10.152.152.11","TLSv1","507","Application Data"
"4","6.689492","10.152.152.11","157.56.126.111","TCP","54","53178  >  443 [ACK] Seq=1 Ack=907 Win=4133 Len=0"
"5","9.193540","10.152.152.11","157.56.126.111","TLSv1","699","Application Data"
"6","9.194610","157.56.126.111","10.152.152.11","TCP","60","443  >  53178 [ACK] Seq=907 Ack=646 Win=2640 Len=0"
"7","9.553096","157.56.126.111","10.152.152.11","TCP","552","443  >  53178 [PSH, ACK] Seq=907 Ack=646 Win=2640 Len=498 [TCP segment of a reassembled PDU]"
"8","9.553120","10.152.152.11","157.56.126.111","TCP","54","53178  >  443 [ACK] Seq=646 Ack=1405 Win=4133 Len=0"
"9","9.749605","157.56.126.111","10.152.152.11","TLSv1","574","Application Data, Application Data"
"10","9.749626","10.152.152.11","157.56.126.111","TCP","54","53178  >  443 [ACK] Seq=646 Ack=1925 Win=4133 Len=0"
"11","12.213717","157.56.126.111","10.152.152.11","TLSv1","507","Application Data"
"12","12.213820","10.152.152.11","157.56.126.111","TCP","54","53178  >  443 [ACK] Seq=646 Ack=2378 Win=4133 Len=0"
"13","14.202344","PcsCompu_11:4d:b1","PcsCompu_78:57:ca","ARP","42","Who has 10.152.152.10? Tell 10.152.152.11"
"14","14.202754","PcsCompu_78:57:ca","PcsCompu_11:4d:b1","ARP","60","10.152.152.10 is at 08:00:27:78:57:ca"
"15","21.135120","157.56.126.111","10.152.152.11","TLSv1","507","Application Data"
"16","21.135191","10.152.152.11","157.56.126.111","TCP","54","53178  >  443 [ACK] Seq=646 Ack=2831 Win=4133 Len=0"
"17","25.862956","157.56.126.111","10.152.152.11","TCP","552","443  >  53178 [PSH, ACK] Seq=2831 Ack=646 Win=2640 Len=498 [TCP segment of a reassembled PDU]"
"18","25.862976","10.152.152.11","157.56.126.111","TCP","54","53178  >  443 [ACK] Seq=646 Ack=3329 Win=4133 Len=0"
"19","26.054377","157.56.126.111","10.152.152.11","TLSv1","585","Application Data"
"20","26.054399","10.152.152.11","157.56.126.111","TCP","54","53178  >  443 [ACK] Seq=646 Ack=3860 Win=4133 Len=0"
"21","26.054899","10.152.152.11","157.56.126.111","TLSv1","555","Application Data"
"22","26.055281","157.56.126.111","10.152.152.11","TCP","60","443  >  53178 [ACK] Seq=3860 Ack=1147 Win=2640 Len=0"
"23","28.136537","157.55.130.151","10.152.152.11","TCP","60","40015  >  32826 [PSH, ACK] Seq=1 Ack=1 Win=2640 Len=4"
"24","28.136593","10.152.152.11","157.55.130.151","TCP","54","32826  >  40015 [ACK] Seq=1 Ack=5 Win=3735 Len=0"
"25","28.326458","157.55.130.151","10.152.152.11","TCP","260","40015  >  32826 [PSH, ACK] Seq=5 Ack=1 Win=2640 Len=206"
"26","28.326477","10.152.152.11","157.55.130.151","TCP","54","32826  >  40015 [ACK] Seq=1 Ack=211 Win=3735 Len=0"
"27","28.326972","10.152.152.11","157.55.130.151","TCP","64","32826  >  40015 [PSH, ACK] Seq=1 Ack=211 Win=3735 Len=10"
"28","28.327552","157.55.130.151","10.152.152.11","TCP","60","40015  >  32826 [ACK] Seq=211 Ack=11 Win=2640 Len=0"
"29","28.327931","10.152.152.11","5.178.135.69","TCP","66","60705  >  53262 [SYN] Seq=0 Win=14600 Len=0 MSS=1460 SACK_PERM=1 WS=16"
"30","28.328523","5.178.135.69","10.152.152.11","TCP","66","53262  >  60705 [SYN, ACK] Seq=0 Ack=1 Win=14600 Len=0 MSS=1460 SACK_PERM=1 WS=16"
"31","28.328537","10.152.152.11","5.178.135.69","TCP","54","60705  >  53262 [ACK] Seq=1 Ack=1 Win=14608 Len=0"
"32","28.329596","10.152.152.11","5.178.135.69","TCP","151","60705  >  53262 [PSH, ACK] Seq=1 Ack=1 Win=14608 Len=97"
"33","28.330044","5.178.135.69","10.152.152.11","TCP","60","53262  >  60705 [ACK] Seq=1 Ack=98 Win=14608 Len=0"
"34","28.887494","5.178.135.69","10.152.152.11","TCP","139","53262  >  60705 [PSH, ACK] Seq=1 Ack=98 Win=14608 Len=85"
"35","28.887516","10.152.152.11","5.178.135.69","TCP","54","60705  >  53262 [ACK] Seq=98 Ack=86 Win=14608 Len=0"
"36","28.888347","10.152.152.11","5.178.135.69","TCP","62","60705  >  53262 [PSH, ACK] Seq=98 Ack=86 Win=14608 Len=8"
"37","28.888838","5.178.135.69","10.152.152.11","TCP","60","53262  >  60705 [ACK] Seq=86 Ack=106 Win=14608 Len=0"
"38","28.888847","10.152.152.11","5.178.135.69","TCP","94","60705  >  53262 [PSH, ACK] Seq=106 Ack=86 Win=14608 Len=40"
"39","28.889224","5.178.135.69","10.152.152.11","TCP","60","53262  >  60705 [ACK] Seq=86 Ack=146 Win=14608 Len=0"
"40","29.190466","5.178.135.69","10.152.152.11","TCP","80","53262  >  60705 [PSH, ACK] Seq=86 Ack=146 Win=14608 Len=26"
"41","29.190739","10.152.152.11","5.178.135.69","TCP","70","60705  >  53262 [PSH, ACK] Seq=146 Ack=112 Win=14608 Len=16"
"42","29.191464","5.178.135.69","10.152.152.11","TCP","60","53262  >  60705 [ACK] Seq=112 Ack=162 Win=14608 Len=0"
"43","29.551192","5.178.135.69","10.152.152.11","TCP","68","53262  >  60705 [PSH, ACK] Seq=112 Ack=162 Win=14608 Len=14"
"44","29.554918","10.152.152.11","5.178.135.69","TCP","735","60705  >  53262 [PSH, ACK] Seq=162 Ack=126 Win=14608 Len=681"
"45","29.555528","5.178.135.69","10.152.152.11","TCP","60","53262  >  60705 [ACK] Seq=126 Ack=843 Win=15968 Len=0"
"46","29.555683","10.152.152.11","157.55.130.151","TCP","84","32826  >  40015 [PSH, ACK] Seq=11 Ack=211 Win=3735 Len=30"
"47","29.556092","157.55.130.151","10.152.152.11","TCP","60","40015  >  32826 [ACK] Seq=211 Ack=41 Win=2640 Len=0"
"48","29.556100","10.152.152.11","157.55.130.151","TCP","114","32826  >  40015 [PSH, ACK] Seq=41 Ack=211 Win=3735 Len=60"
"49","29.556699","157.55.130.151","10.152.152.11","TCP","60","40015  >  32826 [ACK] Seq=211 Ack=101 Win=2640 Len=0"
"50","29.700575","5.178.135.69","10.152.152.11","TCP","68","53262  >  60705 [PSH, ACK] Seq=126 Ack=843 Win=15968 Len=14"
"51","29.700701","10.152.152.11","5.178.135.69","TCP","58","60705  >  53262 [PSH, ACK] Seq=843 Ack=140 Win=14608 Len=4"
"52","29.700903","5.178.135.69","10.152.152.11","TCP","60","53262  >  60705 [ACK] Seq=140 Ack=847 Win=15968 Len=0"
"53","29.891204","157.55.130.151","10.152.152.11","TCP","60","40015  >  32826 [PSH, ACK] Seq=211 Ack=101 Win=2640 Len=4"
"54","29.929748","10.152.152.11","157.55.130.151","TCP","54","32826  >  40015 [ACK] Seq=101 Ack=215 Win=3735 Len=0"
"55","30.018146","157.55.130.151","10.152.152.11","TCP","714","40015  >  32826 [PSH, ACK] Seq=215 Ack=101 Win=2640 Len=660"
"56","30.018166","10.152.152.11","157.55.130.151","TCP","54","32826  >  40015 [ACK] Seq=101 Ack=875 Win=3917 Len=0"
"57","30.109426","157.55.130.151","10.152.152.11","TCP","724","40015  >  32826 [PSH, ACK] Seq=875 Ack=101 Win=2640 Len=670"
"58","30.109445","10.152.152.11","157.55.130.151","TCP","54","32826  >  40015 [ACK] Seq=101 Ack=1545 Win=4100 Len=0"
"59","30.110340","10.152.152.11","5.14.63.154","TCP","66","43956  >  40181 [SYN] Seq=0 Win=14600 Len=0 MSS=1460 SACK_PERM=1 WS=16"
"60","30.110631","10.152.152.11","5.166.57.17","TCP","66","43519  >  22390 [SYN] Seq=0 Win=14600 Len=0 MSS=1460 SACK_PERM=1 WS=16"
"61","30.110961","5.14.63.154","10.152.152.11","TCP","66","40181  >  43956 [SYN, ACK] Seq=0 Ack=1 Win=14600 Len=0 MSS=1460 SACK_PERM=1 WS=16"
"62","30.110976","10.152.152.11","5.14.63.154","TCP","54","43956  >  40181 [ACK] Seq=1 Ack=1 Win=14608 Len=0"
"63","30.110997","5.166.57.17","10.152.152.11","TCP","66","22390  >  43519 [SYN, ACK] Seq=0 Ack=1 Win=14600 Len=0 MSS=1460 SACK_PERM=1 WS=16"
"64","30.111005","10.152.152.11","5.166.57.17","TCP","54","43519  >  22390 [ACK] Seq=1 Ack=1 Win=14608 Len=0"
"65","30.111811","10.152.152.11","5.166.57.17","TCP","135","43519  >  22390 [PSH, ACK] Seq=1 Ack=1 Win=14608 Len=81"
"66","30.112458","5.166.57.17","10.152.152.11","TCP","60","22390  >  43519 [ACK] Seq=1 Ack=82 Win=14608 Len=0"
"67","30.112757","10.152.152.11","5.14.63.154","TCP","109","43956  >  40181 [PSH, ACK] Seq=1 Ack=1 Win=14608 Len=55"
"68","30.113089","5.14.63.154","10.152.152.11","TCP","60","40181  >  43956 [ACK] Seq=1 Ack=56 Win=14608 Len=0"
"69","30.610586","5.166.57.17","10.152.152.11","TCP","105","22390  >  43519 [PSH, ACK] Seq=1 Ack=82 Win=14608 Len=51"
"70","30.610612","10.152.152.11","5.166.57.17","TCP","54","43519  >  22390 [ACK] Seq=82 Ack=52 Win=14608 Len=0"
"71","30.611422","10.152.152.11","5.166.57.17","TCP","62","43519  >  22390 [PSH, ACK] Seq=82 Ack=52 Win=14608 Len=8"
"72","30.611698","5.166.57.17","10.152.152.11","TCP","60","22390  >  43519 [ACK] Seq=52 Ack=90 Win=14608 Len=0"
"73","30.629705","5.178.135.69","10.152.152.11","TCP","1165","53262  >  60705 [PSH, ACK] Seq=140 Ack=847 Win=15968 Len=1111"
"74","30.634746","10.152.152.11","5.178.135.69","TCP","603","60705  >  53262 [PSH, ACK] Seq=847 Ack=1251 Win=16832 Len=549"
"75","30.635418","5.178.135.69","10.152.152.11","TCP","60","53262  >  60705 [ACK] Seq=1251 Ack=1396 Win=17328 Len=0"
"76","30.637435","10.152.152.11","5.178.135.69","TCP","95","60705  >  53262 [PSH, ACK] Seq=1396 Ack=1251 Win=16832 Len=41"
"77","30.637837","5.178.135.69","10.152.152.11","TCP","60","53262  >  60705 [ACK] Seq=1251 Ack=1437 Win=17328 Len=0"
"78","30.637847","10.152.152.11","5.178.135.69","TCP","97","60705  >  53262 [PSH, ACK] Seq=1437 Ack=1251 Win=16832 Len=43"
"79","30.638536","5.178.135.69","10.152.152.11","TCP","60","53262  >  60705 [ACK] Seq=1251 Ack=1480 Win=17328 Len=0"
"80","30.676416","5.14.63.154","10.152.152.11","TCP","128","40181  >  43956 [PSH, ACK] Seq=1 Ack=56 Win=14608 Len=74"
"81","30.676431","10.152.152.11","5.14.63.154","TCP","54","43956  >  40181 [ACK] Seq=56 Ack=75 Win=14608 Len=0"
"82","30.677242","10.152.152.11","5.14.63.154","TCP","62","43956  >  40181 [PSH, ACK] Seq=56 Ack=75 Win=14608 Len=8"
"83","30.677544","5.14.63.154","10.152.152.11","TCP","60","40181  >  43956 [ACK] Seq=75 Ack=64 Win=14608 Len=0"
"84","30.871287","5.166.57.17","10.152.152.11","TCP","62","22390  >  43519 [PSH, ACK] Seq=52 Ack=90 Win=14608 Len=8"
"85","30.871308","5.14.63.154","10.152.152.11","TCP","62","40181  >  43956 [PSH, ACK] Seq=75 Ack=64 Win=14608 Len=8"
"86","30.871597","10.152.152.11","5.14.63.154","TCP","94","43956  >  40181 [PSH, ACK] Seq=64 Ack=83 Win=14608 Len=40"
"87","30.871873","5.14.63.154","10.152.152.11","TCP","60","40181  >  43956 [ACK] Seq=83 Ack=104 Win=14608 Len=0"
"88","30.911543","10.152.152.11","5.166.57.17","TCP","54","43519  >  22390 [ACK] Seq=90 Ack=60 Win=14608 Len=0"
"89","31.079781","5.166.57.17","10.152.152.11","TCP","105","22390  >  43519 [PSH, ACK] Seq=60 Ack=90 Win=14608 Len=51"
"90","31.079801","10.152.152.11","5.166.57.17","TCP","54","43519  >  22390 [ACK] Seq=90 Ack=111 Win=14608 Len=0"
"91","31.079827","5.14.63.154","10.152.152.11","TCP","103","40181  >  43956 [PSH, ACK] Seq=83 Ack=104 Win=14608 Len=49"
"92","31.080456","10.152.152.11","5.166.57.17","TCP","94","43519  >  22390 [PSH, ACK] Seq=90 Ack=111 Win=14608 Len=40"
"93","31.080659","10.152.152.11","5.14.63.154","TCP","68","43956  >  40181 [PSH, ACK] Seq=104 Ack=132 Win=14608 Len=14"
"94","31.081095","5.166.57.17","10.152.152.11","TCP","60","22390  >  43519 [ACK] Seq=111 Ack=130 Win=14608 Len=0"
"95","31.081103","10.152.152.11","5.166.57.17","TCP","68","43519  >  22390 [PSH, ACK] Seq=130 Ack=111 Win=14608 Len=14"
"96","31.081467","5.14.63.154","10.152.152.11","TCP","60","40181  >  43956 [ACK] Seq=132 Ack=118 Win=14608 Len=0"
"97","31.081594","5.166.57.17","10.152.152.11","TCP","60","22390  >  43519 [ACK] Seq=111 Ack=144 Win=14608 Len=0"
"98","31.386398","5.178.135.69","10.152.152.11","TCP","155","53262  >  60705 [PSH, ACK] Seq=1251 Ack=1480 Win=17328 Len=101"
"99","31.386626","10.152.152.11","5.178.135.69","TCP","82","60705  >  53262 [PSH, ACK] Seq=1480 Ack=1352 Win=16832 Len=28"
"100","31.386893","10.152.152.11","5.178.135.69","TCP","116","60705  >  53262 [PSH, ACK] Seq=1508 Ack=1352 Win=16832 Len=62"
"101","31.387070","10.152.152.11","5.178.135.69","TCP","113","60705  >  53262 [PSH, ACK] Seq=1570 Ack=1352 Win=16832 Len=59"
"102","31.387161","5.178.135.69","10.152.152.11","TCP","60","53262  >  60705 [ACK] Seq=1352 Ack=1508 Win=17328 Len=0"
"103","31.387404","5.178.135.69","10.152.152.11","TCP","60","53262  >  60705 [ACK] Seq=1352 Ack=1570 Win=17328 Len=0"
"104","31.387767","5.178.135.69","10.152.152.11","TCP","60","53262  >  60705 [ACK] Seq=1352 Ack=1629 Win=17328 Len=0"
"105","31.576510","157.55.130.151","10.152.152.11","TCP","115","40015  >  32826 [PSH, ACK] Seq=1545 Ack=101 Win=2640 Len=61"
"106","31.576527","10.152.152.11","157.55.130.151","TCP","54","32826  >  40015 [ACK] Seq=101 Ack=1606 Win=4100 Len=0"
"107","31.576544","5.14.63.154","10.152.152.11","TCP","71","40181  >  43956 [PSH, ACK] Seq=132 Ack=118 Win=14608 Len=17"
"108","31.576809","10.152.152.11","157.55.130.151","TCP","104","32826  >  40015 [PSH, ACK] Seq=101 Ack=1606 Win=4100 Len=50"
"109","31.576936","10.152.152.11","5.178.135.69","TCP","84","60705  >  53262 [PSH, ACK] Seq=1629 Ack=1352 Win=16832 Len=30"
"110","31.577010","10.152.152.11","5.14.63.154","TCP","84","43956  >  40181 [PSH, ACK] Seq=118 Ack=149 Win=14608 Len=30"
"111","31.577188","157.55.130.151","10.152.152.11","TCP","60","40015  >  32826 [ACK] Seq=1606 Ack=151 Win=2640 Len=0"
"112","31.577255","10.152.152.11","85.25.103.119","UDP","70","3697  >  3697 Len=28"
"113","31.577387","5.178.135.69","10.152.152.11","TCP","60","53262  >  60705 [ACK] Seq=1352 Ack=1659 Win=17328 Len=0"
"114","31.577391","5.14.63.154","10.152.152.11","TCP","60","40181  >  43956 [ACK] Seq=149 Ack=148 Win=14608 Len=0"
"115","31.577607","10.152.152.11","216.24.87.150","UDP","60","3697  >  14887 Len=18"
"116","31.577628","10.152.152.11","37.204.74.149","UDP","60","3697  >  23265 Len=18"
"117","31.577705","10.152.152.11","185.43.189.45","UDP","60","3697  >  28994 Len=18"
"118","31.577778","10.152.152.11","71.232.134.209","UDP","60","3697  >  26531 Len=18"
"119","31.669834","10.152.152.11","157.56.126.111","TLSv1","747","Application Data"
"120","31.670372","157.56.126.111","10.152.152.11","TCP","60","443  >  53178 [ACK] Seq=3860 Ack=1840 Win=2640 Len=0"
"121","31.775439","5.178.135.69","10.152.152.11","TCP","132","53262  >  60705 [PSH, ACK] Seq=1352 Ack=1659 Win=17328 Len=78"
"122","31.775471","5.166.57.17","10.152.152.11","TCP","72","22390  >  43519 [PSH, ACK] Seq=111 Ack=144 Win=14608 Len=18"
"123","31.775773","10.152.152.11","5.178.135.69","TCP","81","60705  >  53262 [PSH, ACK] Seq=1659 Ack=1430 Win=16832 Len=27"
"124","31.776078","10.152.152.11","5.178.135.69","TCP","82","60705  >  53262 [PSH, ACK] Seq=1686 Ack=1430 Win=16832 Len=28"
"125","31.776186","5.178.135.69","10.152.152.11","TCP","60","53262  >  60705 [ACK] Seq=1430 Ack=1686 Win=17328 Len=0"
"126","31.776361","10.152.152.11","5.178.135.69","TCP","84","60705  >  53262 [PSH, ACK] Seq=1714 Ack=1430 Win=16832 Len=30"
"127","31.776478","10.152.152.11","5.14.63.154","TCP","84","43956  >  40181 [PSH, ACK] Seq=148 Ack=149 Win=14608 Len=30"
"128","31.776589","10.152.152.11","5.166.57.17","TCP","84","43519  >  22390 [PSH, ACK] Seq=144 Ack=129 Win=14608 Len=30"
"129","31.776669","5.178.135.69","10.152.152.11","TCP","60","53262  >  60705 [ACK] Seq=1430 Ack=1714 Win=17328 Len=0"
"130","31.776893","5.178.135.69","10.152.152.11","TCP","60","53262  >  60705 [ACK] Seq=1430 Ack=1744 Win=17328 Len=0"
"131","31.776899","5.14.63.154","10.152.152.11","TCP","60","40181  >  43956 [ACK] Seq=149 Ack=178 Win=14608 Len=0"
"132","31.776913","5.166.57.17","10.152.152.11","TCP","60","22390  >  43519 [ACK] Seq=129 Ack=174 Win=14608 Len=0"
"133","31.777201","10.152.152.11","85.25.103.119","UDP","70","3697  >  3697 Len=28"
"134","31.804516","10.152.152.11","157.56.126.111","TLSv1","747","Application Data"
"135","31.805186","157.56.126.111","10.152.152.11","TCP","60","443  >  53178 [ACK] Seq=3860 Ack=2533 Win=2640 Len=0"
"136","31.942552","5.178.135.69","10.152.152.11","TCP","109","53262  >  60705 [PSH, ACK] Seq=1430 Ack=1744 Win=17328 Len=55"
"137","31.982563","10.152.152.11","5.178.135.69","TCP","54","60705  >  53262 [ACK] Seq=1744 Ack=1485 Win=16832 Len=0"
"138","32.112114","157.56.126.111","10.152.152.11","TLSv1","155","Application Data"
"139","32.150510","10.152.152.11","157.56.126.111","TCP","54","53178  >  443 [ACK] Seq=2533 Ack=3961 Win=4133 Len=0"
"140","32.214385","10.152.152.11","85.25.103.119","UDP","70","3697  >  3697 Len=28"
"141","32.326194","5.178.135.69","10.152.152.11","TCP","75","53262  >  60705 [PSH, ACK] Seq=1485 Ack=1744 Win=17328 Len=21"
"142","32.326215","10.152.152.11","5.178.135.69","TCP","54","60705  >  53262 [ACK] Seq=1744 Ack=1506 Win=16832 Len=0"
"143","32.520484","157.56.126.111","10.152.152.11","TLSv1","155","Application Data"
"144","32.520514","10.152.152.11","157.56.126.111","TCP","54","53178  >  443 [ACK] Seq=2533 Ack=4062 Win=4133 Len=0"
"145","32.714974","5.178.135.69","10.152.152.11","TCP","263","53262  >  60705 [PSH, ACK] Seq=1506 Ack=1744 Win=17328 Len=209"
"146","32.715001","10.152.152.11","5.178.135.69","TCP","54","60705  >  53262 [ACK] Seq=1744 Ack=1715 Win=19056 Len=0"
"147","32.715611","10.152.152.11","5.178.135.69","TCP","82","60705  >  53262 [PSH, ACK] Seq=1744 Ack=1715 Win=19056 Len=28"
"148","32.716072","10.152.152.11","5.178.135.69","TCP","81","60705  >  53262 [PSH, ACK] Seq=1772 Ack=1715 Win=19056 Len=27"
"149","32.716160","5.178.135.69","10.152.152.11","TCP","60","53262  >  60705 [ACK] Seq=1715 Ack=1772 Win=17328 Len=0"
"150","32.716390","5.178.135.69","10.152.152.11","TCP","60","53262  >  60705 [ACK] Seq=1715 Ack=1799 Win=17328 Len=0"
"151","32.716529","10.152.152.11","5.178.135.69","TCP","114","60705  >  53262 [PSH, ACK] Seq=1799 Ack=1715 Win=19056 Len=60"
"152","32.716776","10.152.152.11","5.178.135.69","TCP","102","60705  >  53262 [PSH, ACK] Seq=1859 Ack=1715 Win=19056 Len=48"
"153","32.716943","10.152.152.11","5.178.135.69","TCP","83","60705  >  53262 [PSH, ACK] Seq=1907 Ack=1715 Win=19056 Len=29"
"154","32.717220","5.178.135.69","10.152.152.11","TCP","60","53262  >  60705 [ACK] Seq=1715 Ack=1859 Win=17328 Len=0"
"155","32.717337","5.178.135.69","10.152.152.11","TCP","60","53262  >  60705 [ACK] Seq=1715 Ack=1907 Win=17328 Len=0"
"156","32.717513","5.178.135.69","10.152.152.11","TCP","60","53262  >  60705 [ACK] Seq=1715 Ack=1936 Win=17328 Len=0"
"157","33.017764","10.152.152.11","85.25.103.119","UDP","70","3697  >  3697 Len=28"
"158","33.498872","5.178.135.69","10.152.152.11","TCP","83","53262  >  60705 [PSH, ACK] Seq=1715 Ack=1936 Win=17328 Len=29"
"159","33.537562","10.152.152.11","5.178.135.69","TCP","54","60705  >  53262 [ACK] Seq=1936 Ack=1744 Win=19056 Len=0"
"160","33.749365","5.178.135.69","10.152.152.11","TCP","552","53262  >  60705 [PSH, ACK] Seq=1744 Ack=1936 Win=17328 Len=498"
"161","33.749384","10.152.152.11","5.178.135.69","TCP","54","60705  >  53262 [ACK] Seq=1936 Ack=2242 Win=21280 Len=0"
"162","33.938491","5.178.135.69","10.152.152.11","TCP","363","53262  >  60705 [PSH, ACK] Seq=2242 Ack=1936 Win=17328 Len=309"
"163","33.938511","10.152.152.11","5.178.135.69","TCP","54","60705  >  53262 [ACK] Seq=1936 Ack=2551 Win=23488 Len=0"
"164","33.938988","10.152.152.11","5.178.135.69","TCP","81","60705  >  53262 [PSH, ACK] Seq=1936 Ack=2551 Win=23488 Len=27"
"165","33.939206","10.152.152.11","5.178.135.69","TCP","100","60705  >  53262 [PSH, ACK] Seq=1963 Ack=2551 Win=23488 Len=46"
"166","33.939377","10.152.152.11","5.178.135.69","TCP","83","60705  >  53262 [PSH, ACK] Seq=2009 Ack=2551 Win=23488 Len=29"
"167","33.939461","5.178.135.69","10.152.152.11","TCP","60","53262  >  60705 [ACK] Seq=2551 Ack=1963 Win=17328 Len=0"
"168","33.939687","10.152.152.11","5.178.135.69","TCP","109","60705  >  53262 [PSH, ACK] Seq=2038 Ack=2551 Win=23488 Len=55"
"169","33.939980","5.178.135.69","10.152.152.11","TCP","60","53262  >  60705 [ACK] Seq=2551 Ack=2009 Win=17328 Len=0"
"170","33.940133","5.178.135.69","10.152.152.11","TCP","60","53262  >  60705 [ACK] Seq=2551 Ack=2038 Win=17328 Len=0"
"171","33.940139","5.178.135.69","10.152.152.11","TCP","60","53262  >  60705 [ACK] Seq=2551 Ack=2093 Win=17328 Len=0"
"172","34.643153","10.152.152.11","85.25.103.119","UDP","70","3697  >  3697 Len=28"
"173","34.765395","5.178.135.69","10.152.152.11","TCP","74","53262  >  60705 [PSH, ACK] Seq=2551 Ack=2093 Win=17328 Len=20"
"174","34.802786","10.152.152.11","5.178.135.69","TCP","54","60705  >  53262 [ACK] Seq=2093 Ack=2571 Win=23488 Len=0"
"175","35.002482","5.178.135.69","10.152.152.11","TCP","437","53262  >  60705 [PSH, ACK] Seq=2571 Ack=2093 Win=17328 Len=383"
"176","35.002500","10.152.152.11","5.178.135.69","TCP","54","60705  >  53262 [ACK] Seq=2093 Ack=2954 Win=25712 Len=0"
"177","35.002905","10.152.152.11","5.178.135.69","TCP","81","60705  >  53262 [PSH, ACK] Seq=2093 Ack=2954 Win=25712 Len=27"
"178","35.003391","10.152.152.11","5.178.135.69","TCP","103","60705  >  53262 [PSH, ACK] Seq=2120 Ack=2954 Win=25712 Len=49"
"179","35.003500","10.152.152.11","5.178.135.69","TCP","82","60705  >  53262 [PSH, ACK] Seq=2169 Ack=2954 Win=25712 Len=28"
"180","35.003771","5.178.135.69","10.152.152.11","TCP","60","53262  >  60705 [ACK] Seq=2954 Ack=2120 Win=17328 Len=0"
"181","35.003777","5.178.135.69","10.152.152.11","TCP","60","53262  >  60705 [ACK] Seq=2954 Ack=2169 Win=17328 Len=0"
"182","35.003779","5.178.135.69","10.152.152.11","TCP","60","53262  >  60705 [ACK] Seq=2954 Ack=2197 Win=17328 Len=0"
"183","35.004490","10.152.152.11","5.178.135.69","TCP","113","60705  >  53262 [PSH, ACK] Seq=2197 Ack=2954 Win=25712 Len=59"
"184","35.005058","5.178.135.69","10.152.152.11","TCP","60","53262  >  60705 [ACK] Seq=2954 Ack=2256 Win=17328 Len=0"
"185","35.807411","5.178.135.69","10.152.152.11","TCP","82","53262  >  60705 [PSH, ACK] Seq=2954 Ack=2256 Win=17328 Len=28"
"186","35.846545","10.152.152.11","5.178.135.69","TCP","54","60705  >  53262 [ACK] Seq=2256 Ack=2982 Win=25712 Len=0"
"187","36.104168","5.178.135.69","10.152.152.11","TCP","244","53262  >  60705 [PSH, ACK] Seq=2982 Ack=2256 Win=17328 Len=190"
"188","36.104188","10.152.152.11","5.178.135.69","TCP","54","60705  >  53262 [ACK] Seq=2256 Ack=3172 Win=27936 Len=0"
"189","36.104601","10.152.152.11","5.178.135.69","TCP","74","60705  >  53262 [PSH, ACK] Seq=2256 Ack=3172 Win=27936 Len=20"
"190","36.104805","10.152.152.11","5.178.135.69","TCP","95","60705  >  53262 [PSH, ACK] Seq=2276 Ack=3172 Win=27936 Len=41"
"191","36.104973","10.152.152.11","5.178.135.69","TCP","74","60705  >  53262 [PSH, ACK] Seq=2317 Ack=3172 Win=27936 Len=20"
"192","36.105055","5.178.135.69","10.152.152.11","TCP","60","53262  >  60705 [ACK] Seq=3172 Ack=2276 Win=17328 Len=0"
"193","36.105158","10.152.152.11","5.178.135.69","TCP","108","60705  >  53262 [PSH, ACK] Seq=2337 Ack=3172 Win=27936 Len=54"
"194","36.105501","10.152.152.11","5.178.135.69","TCP","160","60705  >  53262 [PSH, ACK] Seq=2391 Ack=3172 Win=27936 Len=106"
"195","36.105736","10.152.152.11","5.178.135.69","TCP","94","60705  >  53262 [PSH, ACK] Seq=2497 Ack=3172 Win=27936 Len=40"
"196","36.105829","5.178.135.69","10.152.152.11","TCP","60","53262  >  60705 [ACK] Seq=3172 Ack=2317 Win=17328 Len=0"
"197","36.105832","5.178.135.69","10.152.152.11","TCP","60","53262  >  60705 [ACK] Seq=3172 Ack=2337 Win=17328 Len=0"
"198","36.105834","5.178.135.69","10.152.152.11","TCP","60","53262  >  60705 [ACK] Seq=3172 Ack=2391 Win=17328 Len=0"
"199","36.105836","5.178.135.69","10.152.152.11","TCP","60","53262  >  60705 [ACK] Seq=3172 Ack=2497 Win=17328 Len=0"
"200","36.106069","10.152.152.11","5.178.135.69","TCP","83","60705  >  53262 [PSH, ACK] Seq=2537 Ack=3172 Win=27936 Len=29"
"201","36.106316","5.178.135.69","10.152.152.11","TCP","60","53262  >  60705 [ACK] Seq=3172 Ack=2537 Win=17328 Len=0"
"202","36.106885","5.178.135.69","10.152.152.11","TCP","60","53262  >  60705 [ACK] Seq=3172 Ack=2566 Win=17328 Len=0"
"203","36.608536","10.152.152.11","216.24.87.150","UDP","60","3697  >  14887 Len=18"
"204","36.608657","10.152.152.11","37.204.74.149","UDP","60","3697  >  23265 Len=18"
"205","36.608746","10.152.152.11","213.199.179.167","UDP","60","3697  >  443 Len=18"
"206","36.608821","10.152.152.11","111.221.77.154","UDP","60","3697  >  443 Len=18"
"207","36.939684","5.178.135.69","10.152.152.11","TCP","83","53262  >  60705 [PSH, ACK] Seq=3172 Ack=2566 Win=17328 Len=29"
"208","36.977564","10.152.152.11","5.178.135.69","TCP","54","60705  >  53262 [ACK] Seq=2566 Ack=3201 Win=27936 Len=0"
"209","37.146860","5.178.135.69","10.152.152.11","TCP","254","53262  >  60705 [PSH, ACK] Seq=3201 Ack=2566 Win=17328 Len=200"
"210","37.146878","10.152.152.11","5.178.135.69","TCP","54","60705  >  53262 [ACK] Seq=2566 Ack=3401 Win=30160 Len=0"
"211","37.147336","10.152.152.11","5.178.135.69","TCP","83","60705  >  53262 [PSH, ACK] Seq=2566 Ack=3401 Win=30160 Len=29"
"212","37.147563","10.152.152.11","5.178.135.69","TCP","83","60705  >  53262 [PSH, ACK] Seq=2595 Ack=3401 Win=30160 Len=29"
"213","37.147787","10.152.152.11","5.178.135.69","TCP","113","60705  >  53262 [PSH, ACK] Seq=2624 Ack=3401 Win=30160 Len=59"
"214","37.147878","5.178.135.69","10.152.152.11","TCP","60","53262  >  60705 [ACK] Seq=3401 Ack=2595 Win=17328 Len=0"
"215","37.147961","10.152.152.11","5.178.135.69","TCP","101","60705  >  53262 [PSH, ACK] Seq=2683 Ack=3401 Win=30160 Len=47"
"216","37.148171","5.178.135.69","10.152.152.11","TCP","60","53262  >  60705 [ACK] Seq=3401 Ack=2624 Win=17328 Len=0"
"217","37.148571","5.178.135.69","10.152.152.11","TCP","60","53262  >  60705 [ACK] Seq=3401 Ack=2683 Win=17328 Len=0"
"218","37.148577","5.178.135.69","10.152.152.11","TCP","60","53262  >  60705 [ACK] Seq=3401 Ack=2730 Win=17328 Len=0"
"219","37.731922","10.152.152.11","5.178.135.69","TCP","188","60705  >  53262 [PSH, ACK] Seq=2730 Ack=3401 Win=30160 Len=134"
"220","37.732338","10.152.152.11","157.56.126.111","TLSv1","747","Application Data"
"221","37.733094","5.178.135.69","10.152.152.11","TCP","60","53262  >  60705 [ACK] Seq=3401 Ack=2864 Win=18688 Len=0"
"222","37.733134","157.56.126.111","10.152.152.11","TCP","60","443  >  53178 [ACK] Seq=4062 Ack=3226 Win=2640 Len=0"
"223","37.883986","10.152.152.11","85.25.103.119","UDP","70","3697  >  3697 Len=28"
"224","38.031451","5.178.135.69","10.152.152.11","TCP","186","53262  >  60705 [PSH, ACK] Seq=3401 Ack=2864 Win=18688 Len=132"
"225","38.031911","10.152.152.11","5.178.135.69","TCP","83","60705  >  53262 [PSH, ACK] Seq=2864 Ack=3533 Win=32384 Len=29"
"226","38.032113","10.152.152.11","5.178.135.69","TCP","95","60705  >  53262 [PSH, ACK] Seq=2893 Ack=3533 Win=32384 Len=41"
"227","38.032476","5.178.135.69","10.152.152.11","TCP","60","53262  >  60705 [ACK] Seq=3533 Ack=2893 Win=18688 Len=0"
"228","38.032955","5.178.135.69","10.152.152.11","TCP","60","53262  >  60705 [ACK] Seq=3533 Ack=2934 Win=18688 Len=0"
"229","38.173966","5.178.135.69","10.152.152.11","TCP","122","53262  >  60705 [PSH, ACK] Seq=3533 Ack=2934 Win=18688 Len=68"
"230","38.174425","10.152.152.11","5.178.135.69","TCP","75","60705  >  53262 [PSH, ACK] Seq=2934 Ack=3601 Win=32384 Len=21"
"231","38.174999","5.178.135.69","10.152.152.11","TCP","60","53262  >  60705 [ACK] Seq=3601 Ack=2955 Win=18688 Len=0"
"232","38.315812","157.56.126.111","10.152.152.11","TLSv1","155","Application Data"
"233","38.315836","10.152.152.11","157.56.126.111","TCP","54","53178  >  443 [ACK] Seq=3226 Ack=4163 Win=4133 Len=0"
"234","38.458726","5.178.135.69","10.152.152.11","TCP","82","53262  >  60705 [PSH, ACK] Seq=3601 Ack=2955 Win=18688 Len=28"
"235","38.498391","10.152.152.11","5.178.135.69","TCP","54","60705  >  53262 [ACK] Seq=2955 Ack=3629 Win=32384 Len=0"
"236","38.665870","5.178.135.69","10.152.152.11","TCP","101","53262  >  60705 [PSH, ACK] Seq=3629 Ack=2955 Win=18688 Len=47"
"237","38.665889","10.152.152.11","5.178.135.69","TCP","54","60705  >  53262 [ACK] Seq=2955 Ack=3676 Win=32384 Len=0"
"238","38.666213","10.152.152.11","5.178.135.69","TCP","81","60705  >  53262 [PSH, ACK] Seq=2955 Ack=3676 Win=32384 Len=27"
"239","38.666496","5.178.135.69","10.152.152.11","TCP","60","53262  >  60705 [ACK] Seq=3676 Ack=2982 Win=18688 Len=0"
"240","39.143359","5.178.135.69","10.152.152.11","TCP","81","53262  >  60705 [PSH, ACK] Seq=3676 Ack=2982 Win=18688 Len=27"
"241","39.182590","10.152.152.11","5.178.135.69","TCP","54","60705  >  53262 [ACK] Seq=2982 Ack=3703 Win=32384 Len=0"
"242","39.345507","10.152.152.11","157.56.126.111","TLSv1","699","Application Data"
"243","39.345684","157.56.126.111","10.152.152.11","TCP","60","443  >  53178 [ACK] Seq=4163 Ack=3871 Win=2640 Len=0"
"244","39.791469","157.56.126.111","10.152.152.11","TCP","552","443  >  53178 [PSH, ACK] Seq=4163 Ack=3871 Win=2640 Len=498 [TCP segment of a reassembled PDU]"
"245","39.791572","10.152.152.11","157.56.126.111","TCP","54","53178  >  443 [ACK] Seq=3871 Ack=4661 Win=4133 Len=0"
"246","39.938520","157.56.126.111","10.152.152.11","TLSv1","729","Application Data"
"247","39.938541","10.152.152.11","157.56.126.111","TCP","54","53178  >  443 [ACK] Seq=3871 Ack=5336 Win=4133 Len=0"
"248","39.980748","157.56.126.111","10.152.152.11","TLSv1","155","Application Data"
"249","39.980785","10.152.152.11","157.56.126.111","TCP","54","53178  >  443 [ACK] Seq=3871 Ack=5437 Win=4133 Len=0"
"250","41.423495","5.178.135.69","10.152.152.11","TCP","552","53262  >  60705 [PSH, ACK] Seq=3703 Ack=2982 Win=18688 Len=498"
"251","41.423514","10.152.152.11","5.178.135.69","TCP","54","60705  >  53262 [ACK] Seq=2982 Ack=4201 Win=34608 Len=0"
"252","41.456468","5.178.135.69","10.152.152.11","TCP","286","53262  >  60705 [PSH, ACK] Seq=4201 Ack=2982 Win=18688 Len=232"
"253","41.456488","10.152.152.11","5.178.135.69","TCP","54","60705  >  53262 [ACK] Seq=2982 Ack=4433 Win=36832 Len=0"
"254","41.456526","157.56.126.111","10.152.152.11","TCP","552","443  >  53178 [PSH, ACK] Seq=5437 Ack=3871 Win=2640 Len=498 [TCP segment of a reassembled PDU]"
"255","41.456532","10.152.152.11","157.56.126.111","TCP","54","53178  >  443 [ACK] Seq=3871 Ack=5935 Win=4133 Len=0"
"256","41.456938","10.152.152.11","5.178.135.69","TCP","81","60705  >  53262 [PSH, ACK] Seq=2982 Ack=4433 Win=36832 Len=27"
"257","41.457541","10.152.152.11","5.178.135.69","TCP","95","60705  >  53262 [PSH, ACK] Seq=3009 Ack=4433 Win=36832 Len=41"
"258","41.457625","5.178.135.69","10.152.152.11","TCP","60","53262  >  60705 [ACK] Seq=4433 Ack=3009 Win=18688 Len=0"
"259","41.458110","5.178.135.69","10.152.152.11","TCP","60","53262  >  60705 [ACK] Seq=4433 Ack=3050 Win=18688 Len=0"
"260","41.598226","157.56.126.111","10.152.152.11","TLSv1","585","Application Data"
"261","41.598257","10.152.152.11","157.56.126.111","TCP","54","53178  >  443 [ACK] Seq=3871 Ack=6466 Win=4133 Len=0"
"262","41.598833","10.152.152.11","157.56.126.111","TLSv1","555","Application Data"
"263","41.599580","157.56.126.111","10.152.152.11","TCP","60","443  >  53178 [ACK] Seq=6466 Ack=4372 Win=2640 Len=0"
"264","41.649561","10.152.152.11","216.24.87.150","UDP","60","3697  >  14887 Len=18"
"265","41.649629","10.152.152.11","37.204.74.149","UDP","60","3697  >  23265 Len=18"
"266","42.303772","5.178.135.69","10.152.152.11","TCP","82","53262  >  60705 [PSH, ACK] Seq=4433 Ack=3050 Win=18688 Len=28"
"267","42.341572","10.152.152.11","5.178.135.69","TCP","54","60705  >  53262 [ACK] Seq=3050 Ack=4461 Win=36832 Len=0"
"268","42.920328","157.55.130.151","10.152.152.11","TCP","60","40015  >  32826 [PSH, ACK] Seq=1606 Ack=151 Win=2640 Len=3"
"269","42.957566","10.152.152.11","157.55.130.151","TCP","54","32826  >  40015 [ACK] Seq=151 Ack=1609 Win=4100 Len=0"
"270","43.114019","157.55.130.151","10.152.152.11","TCP","111","40015  >  32826 [PSH, ACK] Seq=1609 Ack=151 Win=2640 Len=57"
"271","43.114038","10.152.152.11","157.55.130.151","TCP","54","32826  >  40015 [ACK] Seq=151 Ack=1666 Win=4100 Len=0"
"272","43.114510","10.152.152.11","157.55.130.151","TCP","104","32826  >  40015 [PSH, ACK] Seq=151 Ack=1666 Win=4100 Len=50"
"273","43.114786","10.152.152.11","85.25.103.119","UDP","70","3697  >  3697 Len=28"
"274","43.115057","157.55.130.151","10.152.152.11","TCP","60","40015  >  32826 [ACK] Seq=1666 Ack=201 Win=2640 Len=0"
"275","43.139497","10.152.152.11","157.56.126.111","TLSv1","747","Application Data"
"276","43.139850","157.56.126.111","10.152.152.11","TCP","60","443  >  53178 [ACK] Seq=6466 Ack=5065 Win=2640 Len=0"
"277","43.340031","10.152.152.11","85.25.103.119","UDP","70","3697  >  3697 Len=28"
"278","43.676521","157.56.126.111","10.152.152.11","TLSv1","155","Application Data"
"279","43.715371","10.152.152.11","157.56.126.111","TCP","54","53178  >  443 [ACK] Seq=5065 Ack=6567 Win=4133 Len=0"
"280","43.777179","10.152.152.11","85.25.103.119","UDP","70","3697  >  3697 Len=28"
"281","44.578652","10.152.152.11","85.25.103.119","UDP","70","3697  >  3697 Len=28"
"282","46.183080","10.152.152.11","85.25.103.119","UDP","70","3697  >  3697 Len=28"
"283","46.690674","10.152.152.11","216.24.87.150","UDP","60","3697  >  14887 Len=18"
"284","46.690823","10.152.152.11","37.204.74.149","UDP","60","3697  >  23265 Len=18"
"285","48.845838","10.152.152.11","157.55.130.151","TCP","378","32826  >  40015 [PSH, ACK] Seq=201 Ack=1666 Win=4100 Len=324"
"286","48.845851","157.55.130.151","10.152.152.11","TCP","60","40015  >  32826 [ACK] Seq=1666 Ack=525 Win=2640 Len=0"
"287","49.135869","157.55.130.151","10.152.152.11","TCP","60","40015  >  32826 [PSH, ACK] Seq=1666 Ack=525 Win=2640 Len=4"
"288","49.174787","10.152.152.11","157.55.130.151","TCP","54","32826  >  40015 [ACK] Seq=525 Ack=1670 Win=4100 Len=0"
"289","49.390589","10.152.152.11","85.25.103.119","UDP","70","3697  >  3697 Len=28"
"290","50.115083","10.152.152.11","157.56.126.111","TLSv1","747","Application Data"
"291","50.115891","157.56.126.111","10.152.152.11","TCP","60","443  >  53178 [ACK] Seq=6567 Ack=5758 Win=2640 Len=0"
"292","50.356111","157.56.126.111","10.152.152.11","TLSv1","155","Application Data"
"293","50.356134","10.152.152.11","157.56.126.111","TCP","54","53178  >  443 [ACK] Seq=5758 Ack=6668 Win=4133 Len=0"
"294","51.710971","10.152.152.11","216.24.87.150","UDP","60","3697  >  14887 Len=18"
"295","51.711121","10.152.152.11","37.204.74.149","UDP","60","3697  >  23265 Len=18"
"296","54.358299","157.55.130.151","10.152.152.11","TCP","60","40015  >  32826 [PSH, ACK] Seq=1670 Ack=525 Win=2640 Len=3"
"297","54.358317","10.152.152.11","157.55.130.151","TCP","54","32826  >  40015 [ACK] Seq=525 Ack=1673 Win=4100 Len=0"
"298","54.553707","157.55.130.151","10.152.152.11","TCP","112","40015  >  32826 [PSH, ACK] Seq=1673 Ack=525 Win=2640 Len=58"
"299","54.553732","10.152.152.11","157.55.130.151","TCP","54","32826  >  40015 [ACK] Seq=525 Ack=1731 Win=4100 Len=0"
"300","54.554163","10.152.152.11","157.55.130.151","TCP","104","32826  >  40015 [PSH, ACK] Seq=525 Ack=1731 Win=4100 Len=50"
"301","54.554445","157.55.130.151","10.152.152.11","TCP","60","40015  >  32826 [ACK] Seq=1731 Ack=575 Win=2640 Len=0"
"302","54.554498","10.152.152.11","85.25.103.119","UDP","70","3697  >  3697 Len=28"
"303","54.759846","10.152.152.11","85.25.103.119","UDP","70","3697  >  3697 Len=28"
"304","55.171768","10.152.152.11","85.25.103.119","UDP","70","3697  >  3697 Len=28"
"305","55.996412","10.152.152.11","85.25.103.119","UDP","70","3697  >  3697 Len=28"
"306","56.227026","10.152.152.11","157.56.126.111","TLSv1","747","Application Data"
"307","56.228551","157.56.126.111","10.152.152.11","TCP","60","443  >  53178 [ACK] Seq=6668 Ack=6451 Win=2640 Len=0"
"308","56.782516","157.56.126.111","10.152.152.11","TLSv1","155","Application Data"
"309","56.782538","10.152.152.11","157.56.126.111","TCP","54","53178  >  443 [ACK] Seq=6451 Ack=6769 Win=4133 Len=0"
"310","56.783089","10.152.152.11","185.41.43.4","UDP","60","3697  >  30994 Len=18"
"311","56.783227","10.152.152.11","68.132.20.177","UDP","60","3697  >  46455 Len=18"
"312","56.783349","10.152.152.11","174.60.37.116","UDP","60","3697  >  1545 Len=18"
"313","56.783465","10.152.152.11","83.204.147.65","UDP","60","3697  >  33256 Len=18"
"314","57.633869","10.152.152.11","85.25.103.119","UDP","70","3697  >  3697 Len=28"
"315","59.689998","5.178.135.69","10.152.152.11","TCP","72","53262  >  60705 [PSH, ACK] Seq=4461 Ack=3050 Win=18688 Len=18"
"316","59.690028","10.152.152.11","5.178.135.69","TCP","54","60705  >  53262 [ACK] Seq=3050 Ack=4479 Win=36832 Len=0"
"317","59.690310","10.152.152.11","5.178.135.69","TCP","58","60705  >  53262 [PSH, ACK] Seq=3050 Ack=4479 Win=36832 Len=4"
"318","59.690572","5.178.135.69","10.152.152.11","TCP","60","53262  >  60705 [ACK] Seq=4479 Ack=3054 Win=18688 Len=0"
"319","60.843135","10.152.152.11","85.25.103.119","UDP","70","3697  >  3697 Len=28"
"320","61.804743","10.152.152.11","157.55.130.151","TCP","126","32826  >  40015 [PSH, ACK] Seq=575 Ack=1731 Win=4100 Len=72"
"321","61.804904","10.152.152.11","185.41.43.4","UDP","60","3697  >  30994 Len=18"
"322","61.805024","10.152.152.11","68.132.20.177","UDP","60","3697  >  46455 Len=18"
"323","61.805147","10.152.152.11","213.199.179.169","UDP","60","3697  >  443 Len=18"
"324","61.805249","157.55.130.151","10.152.152.11","TCP","60","40015  >  32826 [ACK] Seq=1731 Ack=647 Win=2640 Len=0"
"325","61.805403","10.152.152.11","111.221.77.159","UDP","60","3697  >  443 Len=18"
"326","62.079035","157.55.130.151","10.152.152.11","TCP","60","40015  >  32826 [PSH, ACK] Seq=1731 Ack=647 Win=2640 Len=4"
"327","62.079399","10.152.152.11","157.55.130.151","TCP","92","32826  >  40015 [PSH, ACK] Seq=647 Ack=1735 Win=4100 Len=38"
"328","62.079679","157.55.130.151","10.152.152.11","TCP","60","40015  >  32826 [ACK] Seq=1735 Ack=685 Win=2640 Len=0"
"329","62.421100","157.55.130.151","10.152.152.11","TCP","60","40015  >  32826 [PSH, ACK] Seq=1735 Ack=685 Win=2640 Len=3"
"330","62.457558","10.152.152.11","157.55.130.151","TCP","54","32826  >  40015 [ACK] Seq=685 Ack=1738 Win=4100 Len=0"
"331","62.614573","157.55.130.151","10.152.152.11","TCP","69","40015  >  32826 [PSH, ACK] Seq=1738 Ack=685 Win=2640 Len=15"
"332","62.614600","10.152.152.11","157.55.130.151","TCP","54","32826  >  40015 [ACK] Seq=685 Ack=1753 Win=4100 Len=0"
"333","63.338846","10.152.152.11","157.56.126.111","TLSv1","747","Application Data"
"334","63.340291","157.56.126.111","10.152.152.11","TCP","60","443  >  53178 [ACK] Seq=6769 Ack=7144 Win=2640 Len=0"
"335","63.775671","157.56.126.111","10.152.152.11","TLSv1","155","Application Data"
"336","63.775693","10.152.152.11","157.56.126.111","TCP","54","53178  >  443 [ACK] Seq=7144 Ack=6870 Win=4133 Len=0"
"337","65.698460","157.55.130.151","10.152.152.11","TCP","60","40015  >  32826 [PSH, ACK] Seq=1753 Ack=685 Win=2640 Len=3"
"338","65.698479","10.152.152.11","157.55.130.151","TCP","54","32826  >  40015 [ACK] Seq=685 Ack=1756 Win=4100 Len=0"
"339","65.889495","157.55.130.151","10.152.152.11","TCP","112","40015  >  32826 [PSH, ACK] Seq=1756 Ack=685 Win=2640 Len=58"
"340","65.889515","10.152.152.11","157.55.130.151","TCP","54","32826  >  40015 [ACK] Seq=685 Ack=1814 Win=4100 Len=0"
"341","65.889773","10.152.152.11","157.55.130.151","TCP","104","32826  >  40015 [PSH, ACK] Seq=685 Ack=1814 Win=4100 Len=50"
"342","65.889919","10.152.152.11","85.25.103.119","UDP","70","3697  >  3697 Len=28"
"343","65.890631","157.55.130.151","10.152.152.11","TCP","60","40015  >  32826 [ACK] Seq=1814 Ack=735 Win=2640 Len=0"
"344","66.118724","10.152.152.11","85.25.103.119","UDP","70","3697  >  3697 Len=28"
"345","66.521633","10.152.152.11","85.25.103.119","UDP","70","3697  >  3697 Len=28"
"346","66.825757","10.152.152.11","185.41.43.4","UDP","60","3697  >  30994 Len=18"
"347","66.825909","10.152.152.11","68.132.20.177","UDP","60","3697  >  46455 Len=18"
"348","67.326366","10.152.152.11","85.25.103.119","UDP","70","3697  >  3697 Len=28"
"349","68.934568","10.152.152.11","85.25.103.119","UDP","70","3697  >  3697 Len=28"
"350","69.459555","10.152.152.11","157.56.126.111","TLSv1","747","Application Data"
"351","69.460102","157.56.126.111","10.152.152.11","TCP","60","443  >  53178 [ACK] Seq=6870 Ack=7837 Win=2640 Len=0"
