"No.","Time","Source","Destination","Protocol","Length","Info"
"1","0.000000","10.152.152.11","68.232.34.151","TCP","54","56696  >  80 [FIN, ACK] Seq=1 Ack=1 Win=2640 Len=0"
"2","0.000371","68.232.34.151","10.152.152.11","TCP","60","80  >  56696 [ACK] Seq=1 Ack=2 Win=980 Len=0"
"3","0.640011","10.152.152.11","23.235.43.246","TCP","54","35241  >  80 [FIN, ACK] Seq=1 Ack=1 Win=7661 Len=0"
"4","0.640762","23.235.43.246","10.152.152.11","TCP","60","80  >  35241 [FIN, ACK] Seq=1 Ack=2 Win=1047 Len=0"
"5","0.640911","10.152.152.11","23.235.43.246","TCP","54","35241  >  80 [ACK] Seq=2 Ack=2 Win=7661 Len=0"
"6","1.963158","10.152.152.11","10.152.191.255","UDP","86","57621  >  57621 Len=44"
"7","13.708023","10.152.152.11","10.152.152.10","DNS","80","Standard query 0x6939 A audio-fa.spotify.com"
"8","14.226901","10.152.152.10","10.152.152.11","DNS","96","Standard query response 0x6939 A audio-fa.spotify.com A 23.235.43.246"
"9","14.227137","10.152.152.11","23.235.43.246","TCP","66","35242  >  80 [SYN] Seq=0 Win=14600 Len=0 MSS=1460 SACK_PERM=1 WS=16"
"10","14.227369","23.235.43.246","10.152.152.11","TCP","66","80  >  35242 [SYN, ACK] Seq=0 Ack=1 Win=14600 Len=0 MSS=1460 SACK_PERM=1 WS=16"
"11","14.227395","10.152.152.11","23.235.43.246","TCP","54","35242  >  80 [ACK] Seq=1 Ack=1 Win=14608 Len=0"
"12","14.227471","10.152.152.11","23.235.43.246","HTTP","363","GET /audio/3c8a6d8bff0886122cf198555f41cc7a5bb8e593?1456331742_1pzWGk+UlGtPTR9nHfwPkrmJmzukghPkr58hHVBopjQ= HTTP/1.1 "
"13","14.227638","23.235.43.246","10.152.152.11","TCP","60","80  >  35242 [ACK] Seq=1 Ack=310 Win=15680 Len=0"
"14","14.833425","23.235.43.246","10.152.152.11","TCP","584","80  >  35242 [PSH, ACK] Seq=1 Ack=310 Win=15680 Len=530 [TCP segment of a reassembled PDU]"
"15","14.833462","10.152.152.11","23.235.43.246","TCP","54","35242  >  80 [ACK] Seq=310 Ack=531 Win=15680 Len=0"
"16","14.856407","23.235.43.246","10.152.152.11","TCP","1514","80  >  35242 [ACK] Seq=531 Ack=310 Win=15680 Len=1460 [TCP segment of a reassembled PDU]"
"17","14.856429","10.152.152.11","23.235.43.246","TCP","54","35242  >  80 [ACK] Seq=310 Ack=1991 Win=18592 Len=0"
"18","14.856450","23.235.43.246","10.152.152.11","TCP","1514","80  >  35242 [ACK] Seq=1991 Ack=310 Win=15680 Len=1460 [TCP segment of a reassembled PDU]"
"19","14.856457","10.152.152.11","23.235.43.246","TCP","54","35242  >  80 [ACK] Seq=310 Ack=3451 Win=21520 Len=0"
"20","14.856468","23.235.43.246","10.152.152.11","TCP","620","80  >  35242 [PSH, ACK] Seq=3451 Ack=310 Win=15680 Len=566 [TCP segment of a reassembled PDU]"
"21","14.856474","10.152.152.11","23.235.43.246","TCP","54","35242  >  80 [ACK] Seq=310 Ack=4017 Win=24432 Len=0"
"22","14.881930","23.235.43.246","10.152.152.11","TCP","1514","80  >  35242 [ACK] Seq=4017 Ack=310 Win=15680 Len=1460 [TCP segment of a reassembled PDU]"
"23","14.881959","10.152.152.11","23.235.43.246","TCP","54","35242  >  80 [ACK] Seq=310 Ack=5477 Win=27360 Len=0"
"24","14.881990","23.235.43.246","10.152.152.11","TCP","1514","80  >  35242 [ACK] Seq=5477 Ack=310 Win=15680 Len=1460 [TCP segment of a reassembled PDU]"
"25","14.882000","10.152.152.11","23.235.43.246","TCP","54","35242  >  80 [ACK] Seq=310 Ack=6937 Win=30272 Len=0"
"26","14.882019","23.235.43.246","10.152.152.11","TCP","1118","80  >  35242 [PSH, ACK] Seq=6937 Ack=310 Win=15680 Len=1064 [TCP segment of a reassembled PDU]"
"27","14.882029","10.152.152.11","23.235.43.246","TCP","54","35242  >  80 [ACK] Seq=310 Ack=8001 Win=33200 Len=0"
"28","14.925539","23.235.43.246","10.152.152.11","TCP","1514","80  >  35242 [ACK] Seq=8001 Ack=310 Win=15680 Len=1460 [TCP segment of a reassembled PDU]"
"29","14.925579","10.152.152.11","23.235.43.246","TCP","54","35242  >  80 [ACK] Seq=310 Ack=9461 Win=36112 Len=0"
"30","14.925645","23.235.43.246","10.152.152.11","TCP","1514","80  >  35242 [ACK] Seq=9461 Ack=310 Win=15680 Len=1460 [TCP segment of a reassembled PDU]"
"31","14.925659","10.152.152.11","23.235.43.246","TCP","54","35242  >  80 [ACK] Seq=310 Ack=10921 Win=39040 Len=0"
"32","14.925686","23.235.43.246","10.152.152.11","TCP","1118","80  >  35242 [PSH, ACK] Seq=10921 Ack=310 Win=15680 Len=1064 [TCP segment of a reassembled PDU]"
"33","14.925698","10.152.152.11","23.235.43.246","TCP","54","35242  >  80 [ACK] Seq=310 Ack=11985 Win=40336 Len=0"
"34","14.976001","23.235.43.246","10.152.152.11","TCP","1514","80  >  35242 [ACK] Seq=11985 Ack=310 Win=15680 Len=1460 [TCP segment of a reassembled PDU]"
"35","14.976093","10.152.152.11","23.235.43.246","TCP","54","35242  >  80 [ACK] Seq=310 Ack=13445 Win=42240 Len=0"
"36","14.976159","23.235.43.246","10.152.152.11","TCP","1514","80  >  35242 [ACK] Seq=13445 Ack=310 Win=15680 Len=1460 [TCP segment of a reassembled PDU]"
"37","14.976180","10.152.152.11","23.235.43.246","TCP","54","35242  >  80 [ACK] Seq=310 Ack=14905 Win=41456 Len=0"
"38","14.976214","23.235.43.246","10.152.152.11","TCP","1206","80  >  35242 [PSH, ACK] Seq=14905 Ack=310 Win=15680 Len=1152 [TCP segment of a reassembled PDU]"
"39","14.976234","10.152.152.11","23.235.43.246","TCP","54","35242  >  80 [ACK] Seq=310 Ack=16057 Win=40336 Len=0"
"40","14.976835","23.235.43.246","10.152.152.11","TCP","456","80  >  35242 [PSH, ACK] Seq=16057 Ack=310 Win=15680 Len=402 [TCP segment of a reassembled PDU]"
"41","14.976873","10.152.152.11","23.235.43.246","TCP","54","35242  >  80 [ACK] Seq=310 Ack=16459 Win=42240 Len=0"
"42","14.991101","23.235.43.246","10.152.152.11","TCP","1514","80  >  35242 [ACK] Seq=16459 Ack=310 Win=15680 Len=1460 [TCP segment of a reassembled PDU]"
"43","14.991151","10.152.152.11","23.235.43.246","TCP","54","35242  >  80 [ACK] Seq=310 Ack=17919 Win=42240 Len=0"
"44","14.991234","23.235.43.246","10.152.152.11","TCP","1514","80  >  35242 [ACK] Seq=17919 Ack=310 Win=15680 Len=1460 [TCP segment of a reassembled PDU]"
"45","14.991250","10.152.152.11","23.235.43.246","TCP","54","35242  >  80 [ACK] Seq=310 Ack=19379 Win=41456 Len=0"
"46","14.991282","23.235.43.246","10.152.152.11","TCP","1206","80  >  35242 [PSH, ACK] Seq=19379 Ack=310 Win=15680 Len=1152 [TCP segment of a reassembled PDU]"
"47","14.991296","10.152.152.11","23.235.43.246","TCP","54","35242  >  80 [ACK] Seq=310 Ack=20531 Win=40336 Len=0"
"48","14.991332","23.235.43.246","10.152.152.11","TCP","1514","80  >  35242 [ACK] Seq=20531 Ack=310 Win=15680 Len=1460 [TCP segment of a reassembled PDU]"
"49","14.991596","10.152.152.11","23.235.43.246","TCP","54","35242  >  80 [ACK] Seq=310 Ack=21991 Win=39216 Len=0"
"50","14.991722","23.235.43.246","10.152.152.11","TCP","1514","80  >  35242 [ACK] Seq=21991 Ack=310 Win=15680 Len=1460 [TCP segment of a reassembled PDU]"
"51","14.991744","10.152.152.11","23.235.43.246","TCP","54","35242  >  80 [ACK] Seq=310 Ack=23451 Win=38096 Len=0"
"52","14.991786","23.235.43.246","10.152.152.11","TCP","1514","80  >  35242 [ACK] Seq=23451 Ack=310 Win=15680 Len=1460 [TCP segment of a reassembled PDU]"
"53","14.991800","23.235.43.246","10.152.152.11","TCP","880","80  >  35242 [PSH, ACK] Seq=24911 Ack=310 Win=15680 Len=826 [TCP segment of a reassembled PDU]"
"54","14.991821","10.152.152.11","23.235.43.246","TCP","54","35242  >  80 [ACK] Seq=310 Ack=24911 Win=42240 Len=0"
"55","14.991904","10.152.152.11","23.235.43.246","TCP","54","35242  >  80 [ACK] Seq=310 Ack=25737 Win=41456 Len=0"
"56","15.034766","23.235.43.246","10.152.152.11","TCP","1514","80  >  35242 [ACK] Seq=25737 Ack=310 Win=15680 Len=1460 [TCP segment of a reassembled PDU]"
"57","15.034783","10.152.152.11","23.235.43.246","TCP","54","35242  >  80 [ACK] Seq=310 Ack=27197 Win=42240 Len=0"
"58","15.034811","23.235.43.246","10.152.152.11","TCP","1514","80  >  35242 [ACK] Seq=27197 Ack=310 Win=15680 Len=1460 [TCP segment of a reassembled PDU]"
"59","15.034816","10.152.152.11","23.235.43.246","TCP","54","35242  >  80 [ACK] Seq=310 Ack=28657 Win=41456 Len=0"
"60","15.034829","23.235.43.246","10.152.152.11","TCP","1118","80  >  35242 [PSH, ACK] Seq=28657 Ack=310 Win=15680 Len=1064 [TCP segment of a reassembled PDU]"
"61","15.034900","10.152.152.11","23.235.43.246","TCP","54","35242  >  80 [ACK] Seq=310 Ack=29721 Win=42240 Len=0"
"62","15.034982","23.235.43.246","10.152.152.11","TCP","1514","80  >  35242 [ACK] Seq=29721 Ack=310 Win=15680 Len=1460 [TCP segment of a reassembled PDU]"
"63","15.034989","23.235.43.246","10.152.152.11","TCP","1514","80  >  35242 [ACK] Seq=31181 Ack=310 Win=15680 Len=1460 [TCP segment of a reassembled PDU]"
"64","15.034992","23.235.43.246","10.152.152.11","TCP","1118","80  >  35242 [PSH, ACK] Seq=32641 Ack=310 Win=15680 Len=1064 [TCP segment of a reassembled PDU]"
"65","15.035348","10.152.152.11","23.235.43.246","TCP","54","35242  >  80 [ACK] Seq=310 Ack=33705 Win=42240 Len=0"
"66","15.103287","23.235.43.246","10.152.152.11","TCP","1514","80  >  35242 [ACK] Seq=33705 Ack=310 Win=15680 Len=1460 [TCP segment of a reassembled PDU]"
"67","15.103308","23.235.43.246","10.152.152.11","TCP","1514","80  >  35242 [ACK] Seq=35165 Ack=310 Win=15680 Len=1460 [TCP segment of a reassembled PDU]"
"68","15.103311","23.235.43.246","10.152.152.11","TCP","1118","80  >  35242 [PSH, ACK] Seq=36625 Ack=310 Win=15680 Len=1064 [TCP segment of a reassembled PDU]"
"69","15.103365","10.152.152.11","23.235.43.246","TCP","54","35242  >  80 [ACK] Seq=310 Ack=37689 Win=42240 Len=0"
"70","15.103523","23.235.43.246","10.152.152.11","TCP","1514","80  >  35242 [ACK] Seq=37689 Ack=310 Win=15680 Len=1460 [TCP segment of a reassembled PDU]"
"71","15.103540","23.235.43.246","10.152.152.11","TCP","1514","80  >  35242 [ACK] Seq=39149 Ack=310 Win=15680 Len=1460 [TCP segment of a reassembled PDU]"
"72","15.103543","23.235.43.246","10.152.152.11","TCP","1118","80  >  35242 [PSH, ACK] Seq=40609 Ack=310 Win=15680 Len=1064 [TCP segment of a reassembled PDU]"
"73","15.103593","10.152.152.11","23.235.43.246","TCP","54","35242  >  80 [ACK] Seq=310 Ack=41673 Win=42240 Len=0"
"74","15.103754","23.235.43.246","10.152.152.11","TCP","1514","80  >  35242 [ACK] Seq=41673 Ack=310 Win=15680 Len=1460 [TCP segment of a reassembled PDU]"
"75","15.103773","23.235.43.246","10.152.152.11","TCP","892","80  >  35242 [PSH, ACK] Seq=43133 Ack=310 Win=15680 Len=838 [TCP segment of a reassembled PDU]"
"76","15.103826","10.152.152.11","23.235.43.246","TCP","54","35242  >  80 [ACK] Seq=310 Ack=43971 Win=42240 Len=0"
"77","15.104001","23.235.43.246","10.152.152.11","TCP","1502","80  >  35242 [PSH, ACK] Seq=43971 Ack=310 Win=15680 Len=1448 [TCP segment of a reassembled PDU]"
"78","15.104072","10.152.152.11","23.235.43.246","TCP","54","35242  >  80 [ACK] Seq=310 Ack=45419 Win=42240 Len=0"
"79","15.106294","23.235.43.246","10.152.152.11","TCP","1514","80  >  35242 [ACK] Seq=45419 Ack=310 Win=15680 Len=1460 [TCP segment of a reassembled PDU]"
"80","15.106313","23.235.43.246","10.152.152.11","TCP","1490","80  >  35242 [PSH, ACK] Seq=46879 Ack=310 Win=15680 Len=1436 [TCP segment of a reassembled PDU]"
"81","15.106346","10.152.152.11","23.235.43.246","TCP","54","35242  >  80 [ACK] Seq=310 Ack=48315 Win=42240 Len=0"
"82","15.119955","23.235.43.246","10.152.152.11","TCP","1514","80  >  35242 [ACK] Seq=48315 Ack=310 Win=15680 Len=1460 [TCP segment of a reassembled PDU]"
"83","15.119970","23.235.43.246","10.152.152.11","TCP","1490","80  >  35242 [PSH, ACK] Seq=49775 Ack=310 Win=15680 Len=1436 [TCP segment of a reassembled PDU]"
"84","15.120017","10.152.152.11","23.235.43.246","TCP","54","35242  >  80 [ACK] Seq=310 Ack=51211 Win=42240 Len=0"
"85","15.130786","23.235.43.246","10.152.152.11","TCP","1514","80  >  35242 [ACK] Seq=51211 Ack=310 Win=15680 Len=1460 [TCP segment of a reassembled PDU]"
"86","15.130824","10.152.152.11","23.235.43.246","TCP","54","35242  >  80 [ACK] Seq=310 Ack=52671 Win=45152 Len=0"
"87","15.130855","23.235.43.246","10.152.152.11","TCP","1514","80  >  35242 [ACK] Seq=52671 Ack=310 Win=15680 Len=1460 [TCP segment of a reassembled PDU]"
"88","15.130862","10.152.152.11","23.235.43.246","TCP","54","35242  >  80 [ACK] Seq=310 Ack=54131 Win=48080 Len=0"
"89","15.130871","23.235.43.246","10.152.152.11","TCP","620","80  >  35242 [PSH, ACK] Seq=54131 Ack=310 Win=15680 Len=566 [TCP segment of a reassembled PDU]"
"90","15.130875","10.152.152.11","23.235.43.246","TCP","54","35242  >  80 [ACK] Seq=310 Ack=54697 Win=50992 Len=0"
"91","15.152711","23.235.43.246","10.152.152.11","TCP","1514","80  >  35242 [ACK] Seq=54697 Ack=310 Win=15680 Len=1460 [TCP segment of a reassembled PDU]"
"92","15.152731","10.152.152.11","23.235.43.246","TCP","54","35242  >  80 [ACK] Seq=310 Ack=56157 Win=53920 Len=0"
"93","15.152763","23.235.43.246","10.152.152.11","TCP","1514","80  >  35242 [ACK] Seq=56157 Ack=310 Win=15680 Len=1460 [TCP segment of a reassembled PDU]"
"94","15.152770","10.152.152.11","23.235.43.246","TCP","54","35242  >  80 [ACK] Seq=310 Ack=57617 Win=56832 Len=0"
"95","15.152783","23.235.43.246","10.152.152.11","TCP","1118","80  >  35242 [PSH, ACK] Seq=57617 Ack=310 Win=15680 Len=1064 [TCP segment of a reassembled PDU]"
"96","15.152793","10.152.152.11","23.235.43.246","TCP","54","35242  >  80 [ACK] Seq=310 Ack=58681 Win=59760 Len=0"
"97","15.160059","23.235.43.246","10.152.152.11","TCP","1272","80  >  35242 [PSH, ACK] Seq=58681 Ack=310 Win=15680 Len=1218 [TCP segment of a reassembled PDU]"
"98","15.160098","10.152.152.11","23.235.43.246","TCP","54","35242  >  80 [ACK] Seq=310 Ack=59899 Win=62672 Len=0"
"99","15.164319","23.235.43.246","10.152.152.11","TCP","1514","80  >  35242 [ACK] Seq=59899 Ack=310 Win=15680 Len=1460 [TCP segment of a reassembled PDU]"
"100","15.164329","10.152.152.11","23.235.43.246","TCP","54","35242  >  80 [ACK] Seq=310 Ack=61359 Win=65600 Len=0"
"101","15.164354","23.235.43.246","10.152.152.11","TCP","1514","80  >  35242 [ACK] Seq=61359 Ack=310 Win=15680 Len=1460 [TCP segment of a reassembled PDU]"
"102","15.164361","10.152.152.11","23.235.43.246","TCP","54","35242  >  80 [ACK] Seq=310 Ack=62819 Win=68512 Len=0"
"103","15.164386","23.235.43.246","10.152.152.11","TCP","620","80  >  35242 [PSH, ACK] Seq=62819 Ack=310 Win=15680 Len=566 [TCP segment of a reassembled PDU]"
"104","15.164393","10.152.152.11","23.235.43.246","TCP","54","35242  >  80 [ACK] Seq=310 Ack=63385 Win=71232 Len=0"
"105","15.176650","23.235.43.246","10.152.152.11","TCP","1514","80  >  35242 [ACK] Seq=63385 Ack=310 Win=15680 Len=1460 [TCP segment of a reassembled PDU]"
"106","15.176686","10.152.152.11","23.235.43.246","TCP","54","35242  >  80 [ACK] Seq=310 Ack=64845 Win=72672 Len=0"
"107","15.176702","23.235.43.246","10.152.152.11","TCP","1514","80  >  35242 [ACK] Seq=64845 Ack=310 Win=15680 Len=1460 [TCP segment of a reassembled PDU]"
"108","15.176708","23.235.43.246","10.152.152.11","TCP","620","80  >  35242 [PSH, ACK] Seq=66305 Ack=310 Win=15680 Len=566 [TCP segment of a reassembled PDU]"
"109","15.176780","10.152.152.11","23.235.43.246","TCP","54","35242  >  80 [ACK] Seq=310 Ack=66871 Win=72672 Len=0"
"110","15.197652","23.235.43.246","10.152.152.11","TCP","552","80  >  35242 [PSH, ACK] Seq=66871 Ack=310 Win=15680 Len=498 [TCP segment of a reassembled PDU]"
"111","15.197761","10.152.152.11","23.235.43.246","TCP","54","35242  >  80 [ACK] Seq=310 Ack=67369 Win=72672 Len=0"
"112","15.221184","23.235.43.246","10.152.152.11","TCP","1514","80  >  35242 [ACK] Seq=67369 Ack=310 Win=15680 Len=1460 [TCP segment of a reassembled PDU]"
"113","15.221215","23.235.43.246","10.152.152.11","TCP","1514","80  >  35242 [ACK] Seq=68829 Ack=310 Win=15680 Len=1460 [TCP segment of a reassembled PDU]"
"114","15.221219","23.235.43.246","10.152.152.11","TCP","620","80  >  35242 [PSH, ACK] Seq=70289 Ack=310 Win=15680 Len=566 [TCP segment of a reassembled PDU]"
"115","15.221300","10.152.152.11","23.235.43.246","TCP","54","35242  >  80 [ACK] Seq=310 Ack=70855 Win=72672 Len=0"
"116","15.226881","23.235.43.246","10.152.152.11","TCP","552","80  >  35242 [PSH, ACK] Seq=70855 Ack=310 Win=15680 Len=498 [TCP segment of a reassembled PDU]"
"117","15.226972","10.152.152.11","23.235.43.246","TCP","54","35242  >  80 [ACK] Seq=310 Ack=71353 Win=72672 Len=0"
"118","15.247085","23.235.43.246","10.152.152.11","TCP","1514","80  >  35242 [ACK] Seq=71353 Ack=310 Win=15680 Len=1460 [TCP segment of a reassembled PDU]"
"119","15.247116","23.235.43.246","10.152.152.11","TCP","172","80  >  35242 [PSH, ACK] Seq=72813 Ack=310 Win=15680 Len=118 [TCP segment of a reassembled PDU]"
"120","15.247123","10.152.152.11","23.235.43.246","TCP","54","35242  >  80 [ACK] Seq=310 Ack=72931 Win=72672 Len=0"
"121","15.262300","23.235.43.246","10.152.152.11","TCP","1514","80  >  35242 [ACK] Seq=72931 Ack=310 Win=15680 Len=1460 [TCP segment of a reassembled PDU]"
"122","15.262332","23.235.43.246","10.152.152.11","TCP","1514","80  >  35242 [ACK] Seq=74391 Ack=310 Win=15680 Len=1460 [TCP segment of a reassembled PDU]"
"123","15.262335","23.235.43.246","10.152.152.11","TCP","620","80  >  35242 [PSH, ACK] Seq=75851 Ack=310 Win=15680 Len=566 [TCP segment of a reassembled PDU]"
"124","15.262417","10.152.152.11","23.235.43.246","TCP","54","35242  >  80 [ACK] Seq=310 Ack=76417 Win=72672 Len=0"
"125","15.272751","23.235.43.246","10.152.152.11","TCP","1514","80  >  35242 [ACK] Seq=76417 Ack=310 Win=15680 Len=1460 [TCP segment of a reassembled PDU]"
"126","15.272782","23.235.43.246","10.152.152.11","TCP","1514","80  >  35242 [ACK] Seq=77877 Ack=310 Win=15680 Len=1460 [TCP segment of a reassembled PDU]"
"127","15.272786","23.235.43.246","10.152.152.11","TCP","1118","80  >  35242 [PSH, ACK] Seq=79337 Ack=310 Win=15680 Len=1064 [TCP segment of a reassembled PDU]"
"128","15.272826","10.152.152.11","23.235.43.246","TCP","54","35242  >  80 [ACK] Seq=310 Ack=80401 Win=72672 Len=0"
"129","15.276892","23.235.43.246","10.152.152.11","TCP","95","80  >  35242 [PSH, ACK] Seq=80401 Ack=310 Win=15680 Len=41 [TCP segment of a reassembled PDU]"
"130","15.277009","10.152.152.11","23.235.43.246","TCP","54","35242  >  80 [ACK] Seq=310 Ack=80442 Win=72672 Len=0"
"131","15.295726","23.235.43.246","10.152.152.11","TCP","1514","80  >  35242 [ACK] Seq=80442 Ack=310 Win=15680 Len=1460 [TCP segment of a reassembled PDU]"
"132","15.295757","23.235.43.246","10.152.152.11","TCP","1514","80  >  35242 [ACK] Seq=81902 Ack=310 Win=15680 Len=1460 [TCP segment of a reassembled PDU]"
"133","15.295760","23.235.43.246","10.152.152.11","TCP","620","80  >  35242 [PSH, ACK] Seq=83362 Ack=310 Win=15680 Len=566 [TCP segment of a reassembled PDU]"
"134","15.295838","10.152.152.11","23.235.43.246","TCP","54","35242  >  80 [ACK] Seq=310 Ack=83928 Win=72672 Len=0"
"135","15.302561","23.235.43.246","10.152.152.11","TCP","1514","80  >  35242 [ACK] Seq=83928 Ack=310 Win=15680 Len=1460 [TCP segment of a reassembled PDU]"
"136","15.302781","23.235.43.246","10.152.152.11","TCP","1514","80  >  35242 [ACK] Seq=85388 Ack=310 Win=15680 Len=1460 [TCP segment of a reassembled PDU]"
"137","15.302784","23.235.43.246","10.152.152.11","TCP","1118","80  >  35242 [PSH, ACK] Seq=86848 Ack=310 Win=15680 Len=1064 [TCP segment of a reassembled PDU]"
"138","15.302864","10.152.152.11","23.235.43.246","TCP","54","35242  >  80 [ACK] Seq=310 Ack=87912 Win=72672 Len=0"
"139","15.314281","23.235.43.246","10.152.152.11","TCP","1514","80  >  35242 [ACK] Seq=87912 Ack=310 Win=15680 Len=1460 [TCP segment of a reassembled PDU]"
"140","15.314305","23.235.43.246","10.152.152.11","TCP","1514","80  >  35242 [ACK] Seq=89372 Ack=310 Win=15680 Len=1460 [TCP segment of a reassembled PDU]"
"141","15.314308","23.235.43.246","10.152.152.11","TCP","620","80  >  35242 [PSH, ACK] Seq=90832 Ack=310 Win=15680 Len=566 [TCP segment of a reassembled PDU]"
"142","15.314392","10.152.152.11","23.235.43.246","TCP","54","35242  >  80 [ACK] Seq=310 Ack=91398 Win=72672 Len=0"
"143","15.321754","23.235.43.246","10.152.152.11","TCP","552","80  >  35242 [PSH, ACK] Seq=91398 Ack=310 Win=15680 Len=498 [TCP segment of a reassembled PDU]"
"144","15.321827","10.152.152.11","23.235.43.246","TCP","54","35242  >  80 [ACK] Seq=310 Ack=91896 Win=72672 Len=0"
"145","15.326294","10.152.152.11","130.211.86.80","TCP","182","38699  >  80 [PSH, ACK] Seq=1 Ack=1 Win=14761 Len=128"
"146","15.326481","130.211.86.80","10.152.152.11","TCP","60","80  >  38699 [ACK] Seq=1 Ack=129 Win=5131 Len=0"
"147","15.326503","10.152.152.11","130.211.86.80","TCP","65","38699  >  80 [PSH, ACK] Seq=129 Ack=1 Win=14761 Len=11"
"148","15.326609","130.211.86.80","10.152.152.11","TCP","60","80  >  38699 [ACK] Seq=1 Ack=140 Win=5131 Len=0"
"149","15.327251","10.152.152.11","130.211.86.80","TCP","179","38699  >  80 [PSH, ACK] Seq=140 Ack=1 Win=14761 Len=125"
"150","15.327352","130.211.86.80","10.152.152.11","TCP","60","80  >  38699 [ACK] Seq=1 Ack=265 Win=5131 Len=0"
"151","15.327717","10.152.152.11","130.211.86.80","TCP","147","38699  >  80 [PSH, ACK] Seq=265 Ack=1 Win=14761 Len=93"
"152","15.327835","130.211.86.80","10.152.152.11","TCP","60","80  >  38699 [ACK] Seq=1 Ack=358 Win=5131 Len=0"
"153","15.329782","23.235.43.246","10.152.152.11","TCP","1514","80  >  35242 [ACK] Seq=91896 Ack=310 Win=15680 Len=1460 [TCP segment of a reassembled PDU]"
"154","15.329802","23.235.43.246","10.152.152.11","TCP","1514","80  >  35242 [ACK] Seq=93356 Ack=310 Win=15680 Len=1460 [TCP segment of a reassembled PDU]"
"155","15.329805","23.235.43.246","10.152.152.11","TCP","620","80  >  35242 [PSH, ACK] Seq=94816 Ack=310 Win=15680 Len=566 [TCP segment of a reassembled PDU]"
"156","15.329863","10.152.152.11","23.235.43.246","TCP","54","35242  >  80 [ACK] Seq=310 Ack=95382 Win=72672 Len=0"
"157","15.351879","23.235.43.246","10.152.152.11","TCP","1050","80  >  35242 [PSH, ACK] Seq=95382 Ack=310 Win=15680 Len=996 [TCP segment of a reassembled PDU]"
"158","15.351996","10.152.152.11","23.235.43.246","TCP","54","35242  >  80 [ACK] Seq=310 Ack=96378 Win=72672 Len=0"
"159","15.360726","23.235.43.246","10.152.152.11","TCP","1514","80  >  35242 [ACK] Seq=96378 Ack=310 Win=15680 Len=1460 [TCP segment of a reassembled PDU]"
"160","15.360750","23.235.43.246","10.152.152.11","TCP","490","80  >  35242 [PSH, ACK] Seq=97838 Ack=310 Win=15680 Len=436 [TCP segment of a reassembled PDU]"
"161","15.360814","10.152.152.11","23.235.43.246","TCP","54","35242  >  80 [ACK] Seq=310 Ack=98274 Win=72672 Len=0"
"162","15.374039","23.235.43.246","10.152.152.11","TCP","1514","80  >  35242 [ACK] Seq=98274 Ack=310 Win=15680 Len=1460 [TCP segment of a reassembled PDU]"
"163","15.374065","23.235.43.246","10.152.152.11","TCP","1514","80  >  35242 [ACK] Seq=99734 Ack=310 Win=15680 Len=1460 [TCP segment of a reassembled PDU]"
"164","15.374068","23.235.43.246","10.152.152.11","TCP","620","80  >  35242 [PSH, ACK] Seq=101194 Ack=310 Win=15680 Len=566 [TCP segment of a reassembled PDU]"
"165","15.374140","10.152.152.11","23.235.43.246","TCP","54","35242  >  80 [ACK] Seq=310 Ack=101760 Win=72672 Len=0"
"166","15.383827","23.235.43.246","10.152.152.11","TCP","912","80  >  35242 [PSH, ACK] Seq=101760 Ack=310 Win=15680 Len=858 [TCP segment of a reassembled PDU]"
"167","15.383990","10.152.152.11","23.235.43.246","TCP","54","35242  >  80 [ACK] Seq=310 Ack=102618 Win=72672 Len=0"
"168","15.392674","23.235.43.246","10.152.152.11","TCP","1502","80  >  35242 [PSH, ACK] Seq=102618 Ack=310 Win=15680 Len=1448 [TCP segment of a reassembled PDU]"
"169","15.392767","10.152.152.11","23.235.43.246","TCP","54","35242  >  80 [ACK] Seq=310 Ack=104066 Win=72672 Len=0"
"170","15.402229","23.235.43.246","10.152.152.11","TCP","1502","80  >  35242 [PSH, ACK] Seq=104066 Ack=310 Win=15680 Len=1448 [TCP segment of a reassembled PDU]"
"171","15.411083","23.235.43.246","10.152.152.11","TCP","1514","80  >  35242 [ACK] Seq=105514 Ack=310 Win=15680 Len=1460 [TCP segment of a reassembled PDU]"
"172","15.411129","10.152.152.11","23.235.43.246","TCP","54","35242  >  80 [ACK] Seq=310 Ack=106974 Win=72672 Len=0"
"173","15.411162","23.235.43.246","10.152.152.11","TCP","1514","80  >  35242 [ACK] Seq=106974 Ack=310 Win=15680 Len=1460 [TCP segment of a reassembled PDU]"
"174","15.411452","23.235.43.246","10.152.152.11","TCP","620","80  >  35242 [PSH, ACK] Seq=108434 Ack=310 Win=15680 Len=566 [TCP segment of a reassembled PDU]"
"175","15.411487","10.152.152.11","23.235.43.246","TCP","54","35242  >  80 [ACK] Seq=310 Ack=109000 Win=72672 Len=0"
"176","15.439985","23.235.43.246","10.152.152.11","TCP","912","80  >  35242 [PSH, ACK] Seq=109000 Ack=310 Win=15680 Len=858 [TCP segment of a reassembled PDU]"
"177","15.440221","10.152.152.11","23.235.43.246","TCP","54","35242  >  80 [ACK] Seq=310 Ack=109858 Win=72672 Len=0"
"178","15.467212","23.235.43.246","10.152.152.11","TCP","1514","80  >  35242 [ACK] Seq=109858 Ack=310 Win=15680 Len=1460 [TCP segment of a reassembled PDU]"
"179","15.467289","23.235.43.246","10.152.152.11","TCP","1514","80  >  35242 [ACK] Seq=111318 Ack=310 Win=15680 Len=1460 [TCP segment of a reassembled PDU]"
"180","15.467298","23.235.43.246","10.152.152.11","TCP","620","80  >  35242 [PSH, ACK] Seq=112778 Ack=310 Win=15680 Len=566 [TCP segment of a reassembled PDU]"
"181","15.467470","10.152.152.11","23.235.43.246","TCP","54","35242  >  80 [ACK] Seq=310 Ack=113344 Win=72672 Len=0"
"182","15.473777","23.235.43.246","10.152.152.11","TCP","1514","80  >  35242 [ACK] Seq=113344 Ack=310 Win=15680 Len=1460 [TCP segment of a reassembled PDU]"
"183","15.473812","23.235.43.246","10.152.152.11","TCP","900","80  >  35242 [PSH, ACK] Seq=114804 Ack=310 Win=15680 Len=846 [TCP segment of a reassembled PDU]"
"184","15.473919","10.152.152.11","23.235.43.246","TCP","54","35242  >  80 [ACK] Seq=310 Ack=115650 Win=72672 Len=0"
"185","15.475200","23.235.43.246","10.152.152.11","TCP","1514","80  >  35242 [ACK] Seq=115650 Ack=310 Win=15680 Len=1460 [TCP segment of a reassembled PDU]"
"186","15.475256","23.235.43.246","10.152.152.11","TCP","1490","80  >  35242 [PSH, ACK] Seq=117110 Ack=310 Win=15680 Len=1436 [TCP segment of a reassembled PDU]"
"187","15.475443","10.152.152.11","23.235.43.246","TCP","54","35242  >  80 [ACK] Seq=310 Ack=118546 Win=72672 Len=0"
"188","15.476706","23.235.43.246","10.152.152.11","TCP","1514","80  >  35242 [ACK] Seq=118546 Ack=310 Win=15680 Len=1460 [TCP segment of a reassembled PDU]"
"189","15.476758","23.235.43.246","10.152.152.11","TCP","1514","80  >  35242 [ACK] Seq=120006 Ack=310 Win=15680 Len=1460 [TCP segment of a reassembled PDU]"
"190","15.476766","23.235.43.246","10.152.152.11","TCP","620","80  >  35242 [PSH, ACK] Seq=121466 Ack=310 Win=15680 Len=566 [TCP segment of a reassembled PDU]"
"191","15.476889","10.152.152.11","23.235.43.246","TCP","54","35242  >  80 [ACK] Seq=310 Ack=122032 Win=72672 Len=0"
"192","15.484294","23.235.43.246","10.152.152.11","TCP","1514","80  >  35242 [ACK] Seq=122032 Ack=310 Win=15680 Len=1460 [TCP segment of a reassembled PDU]"
"193","15.484359","23.235.43.246","10.152.152.11","TCP","1514","80  >  35242 [ACK] Seq=123492 Ack=310 Win=15680 Len=1460 [TCP segment of a reassembled PDU]"
"194","15.484367","23.235.43.246","10.152.152.11","TCP","620","80  >  35242 [PSH, ACK] Seq=124952 Ack=310 Win=15680 Len=566 [TCP segment of a reassembled PDU]"
"195","15.484502","10.152.152.11","23.235.43.246","TCP","54","35242  >  80 [ACK] Seq=310 Ack=125518 Win=72672 Len=0"
"196","15.512799","23.235.43.246","10.152.152.11","TCP","552","80  >  35242 [PSH, ACK] Seq=125518 Ack=310 Win=15680 Len=498 [TCP segment of a reassembled PDU]"
"197","15.512907","10.152.152.11","23.235.43.246","TCP","54","35242  >  80 [ACK] Seq=310 Ack=126016 Win=72672 Len=0"
"198","15.535162","23.235.43.246","10.152.152.11","TCP","1514","80  >  35242 [ACK] Seq=126016 Ack=310 Win=15680 Len=1460 [TCP segment of a reassembled PDU]"
"199","15.535220","23.235.43.246","10.152.152.11","TCP","1514","80  >  35242 [ACK] Seq=127476 Ack=310 Win=15680 Len=1460 [TCP segment of a reassembled PDU]"
"200","15.535227","23.235.43.246","10.152.152.11","TCP","620","80  >  35242 [PSH, ACK] Seq=128936 Ack=310 Win=15680 Len=566 [TCP segment of a reassembled PDU]"
"201","15.535360","10.152.152.11","23.235.43.246","TCP","54","35242  >  80 [ACK] Seq=310 Ack=129502 Win=72672 Len=0"
"202","15.543945","23.235.43.246","10.152.152.11","TCP","552","80  >  35242 [PSH, ACK] Seq=129502 Ack=310 Win=15680 Len=498 [TCP segment of a reassembled PDU]"
"203","15.544221","10.152.152.11","23.235.43.246","TCP","54","35242  >  80 [ACK] Seq=310 Ack=130000 Win=72672 Len=0"
"204","15.552937","23.235.43.246","10.152.152.11","TCP","1514","80  >  35242 [ACK] Seq=130000 Ack=310 Win=15680 Len=1460 [TCP segment of a reassembled PDU]"
"205","15.552966","23.235.43.246","10.152.152.11","TCP","1514","80  >  35242 [ACK] Seq=131460 Ack=310 Win=15680 Len=1460 [TCP segment of a reassembled PDU]"
"206","15.552974","23.235.43.246","10.152.152.11","TCP","620","80  >  35242 [PSH, ACK] Seq=132920 Ack=310 Win=15680 Len=566 [TCP segment of a reassembled PDU]"
"207","15.553077","10.152.152.11","23.235.43.246","TCP","54","35242  >  80 [ACK] Seq=310 Ack=133486 Win=72672 Len=0"
"208","15.568974","23.235.43.246","10.152.152.11","TCP","1050","80  >  35242 [PSH, ACK] Seq=133486 Ack=310 Win=15680 Len=996 [TCP segment of a reassembled PDU]"
"209","15.569297","10.152.152.11","23.235.43.246","TCP","54","35242  >  80 [ACK] Seq=310 Ack=134482 Win=72672 Len=0"
"210","15.576857","23.235.43.246","10.152.152.11","TCP","1514","80  >  35242 [ACK] Seq=134482 Ack=310 Win=15680 Len=1460 [TCP segment of a reassembled PDU]"
"211","15.576917","23.235.43.246","10.152.152.11","TCP","1514","80  >  35242 [ACK] Seq=135942 Ack=310 Win=15680 Len=1460 [TCP segment of a reassembled PDU]"
"212","15.576926","23.235.43.246","10.152.152.11","TCP","620","80  >  35242 [PSH, ACK] Seq=137402 Ack=310 Win=15680 Len=566 [TCP segment of a reassembled PDU]"
"213","15.577051","10.152.152.11","23.235.43.246","TCP","54","35242  >  80 [ACK] Seq=310 Ack=137968 Win=72672 Len=0"
"214","15.596658","23.235.43.246","10.152.152.11","TCP","904","80  >  35242 [PSH, ACK] Seq=137968 Ack=310 Win=15680 Len=850 [TCP segment of a reassembled PDU]"
"215","15.596884","10.152.152.11","23.235.43.246","TCP","54","35242  >  80 [ACK] Seq=310 Ack=138818 Win=72672 Len=0"
"216","15.609415","23.235.43.246","10.152.152.11","TCP","1514","80  >  35242 [ACK] Seq=138818 Ack=310 Win=15680 Len=1460 [TCP segment of a reassembled PDU]"
"217","15.609452","23.235.43.246","10.152.152.11","TCP","1514","80  >  35242 [ACK] Seq=140278 Ack=310 Win=15680 Len=1460 [TCP segment of a reassembled PDU]"
"218","15.609461","23.235.43.246","10.152.152.11","TCP","620","80  >  35242 [PSH, ACK] Seq=141738 Ack=310 Win=15680 Len=566 [TCP segment of a reassembled PDU]"
"219","15.609626","10.152.152.11","23.235.43.246","TCP","54","35242  >  80 [ACK] Seq=310 Ack=142304 Win=72672 Len=0"
"220","15.627432","23.235.43.246","10.152.152.11","TCP","1514","80  >  35242 [ACK] Seq=142304 Ack=310 Win=15680 Len=1460 [TCP segment of a reassembled PDU]"
"221","15.627496","23.235.43.246","10.152.152.11","TCP","1514","80  >  35242 [ACK] Seq=143764 Ack=310 Win=15680 Len=1460 [TCP segment of a reassembled PDU]"
"222","15.627505","23.235.43.246","10.152.152.11","TCP","1118","80  >  35242 [PSH, ACK] Seq=145224 Ack=310 Win=15680 Len=1064 [TCP segment of a reassembled PDU]"
"223","15.627682","10.152.152.11","23.235.43.246","TCP","54","35242  >  80 [ACK] Seq=310 Ack=146288 Win=72672 Len=0"
"224","15.658134","23.235.43.246","10.152.152.11","TCP","1514","80  >  35242 [ACK] Seq=146288 Ack=310 Win=15680 Len=1460 [TCP segment of a reassembled PDU]"
"225","15.658192","23.235.43.246","10.152.152.11","TCP","1514","80  >  35242 [ACK] Seq=147748 Ack=310 Win=15680 Len=1460 [TCP segment of a reassembled PDU]"
"226","15.658201","23.235.43.246","10.152.152.11","TCP","1118","80  >  35242 [PSH, ACK] Seq=149208 Ack=310 Win=15680 Len=1064 [TCP segment of a reassembled PDU]"
"227","15.658337","10.152.152.11","23.235.43.246","TCP","54","35242  >  80 [ACK] Seq=310 Ack=150272 Win=72672 Len=0"
"228","15.670119","23.235.43.246","10.152.152.11","TCP","1514","80  >  35242 [ACK] Seq=150272 Ack=310 Win=15680 Len=1460 [TCP segment of a reassembled PDU]"
"229","15.670201","23.235.43.246","10.152.152.11","TCP","1514","80  >  35242 [ACK] Seq=151732 Ack=310 Win=15680 Len=1460 [TCP segment of a reassembled PDU]"
"230","15.670210","23.235.43.246","10.152.152.11","TCP","620","80  >  35242 [PSH, ACK] Seq=153192 Ack=310 Win=15680 Len=566 [TCP segment of a reassembled PDU]"
"231","15.670434","10.152.152.11","23.235.43.246","TCP","54","35242  >  80 [ACK] Seq=310 Ack=153758 Win=72672 Len=0"
"232","15.724951","23.235.43.246","10.152.152.11","TCP","1050","80  >  35242 [PSH, ACK] Seq=153758 Ack=310 Win=15680 Len=996 [TCP segment of a reassembled PDU]"
"233","15.725117","10.152.152.11","23.235.43.246","TCP","54","35242  >  80 [ACK] Seq=310 Ack=154754 Win=72672 Len=0"
"234","15.728722","23.235.43.246","10.152.152.11","TCP","1514","80  >  35242 [ACK] Seq=154754 Ack=310 Win=15680 Len=1460 [TCP segment of a reassembled PDU]"
"235","15.728752","23.235.43.246","10.152.152.11","TCP","1514","80  >  35242 [ACK] Seq=156214 Ack=310 Win=15680 Len=1460 [TCP segment of a reassembled PDU]"
"236","15.728763","23.235.43.246","10.152.152.11","TCP","1206","80  >  35242 [PSH, ACK] Seq=157674 Ack=310 Win=15680 Len=1152 [TCP segment of a reassembled PDU]"
"237","15.728771","23.235.43.246","10.152.152.11","TCP","1514","80  >  35242 [ACK] Seq=158826 Ack=310 Win=15680 Len=1460 [TCP segment of a reassembled PDU]"
"238","15.728891","10.152.152.11","23.235.43.246","TCP","54","35242  >  80 [ACK] Seq=310 Ack=160286 Win=72672 Len=0"
"239","15.729380","23.235.43.246","10.152.152.11","TCP","1494","80  >  35242 [PSH, ACK] Seq=160286 Ack=310 Win=15680 Len=1440 [TCP segment of a reassembled PDU]"
"240","15.729504","10.152.152.11","23.235.43.246","TCP","54","35242  >  80 [ACK] Seq=310 Ack=161726 Win=72672 Len=0"
"241","15.729799","23.235.43.246","10.152.152.11","TCP","552","80  >  35242 [PSH, ACK] Seq=161726 Ack=310 Win=15680 Len=498 [TCP segment of a reassembled PDU]"
"242","15.730876","10.152.152.11","23.235.43.246","TCP","54","35242  >  80 [ACK] Seq=310 Ack=162224 Win=72672 Len=0"
"243","15.734644","23.235.43.246","10.152.152.11","TCP","1514","80  >  35242 [ACK] Seq=162224 Ack=310 Win=15680 Len=1460 [TCP segment of a reassembled PDU]"
"244","15.734665","23.235.43.246","10.152.152.11","TCP","1514","80  >  35242 [ACK] Seq=163684 Ack=310 Win=15680 Len=1460 [TCP segment of a reassembled PDU]"
"245","15.734668","23.235.43.246","10.152.152.11","TCP","620","80  >  35242 [PSH, ACK] Seq=165144 Ack=310 Win=15680 Len=566 [TCP segment of a reassembled PDU]"
"246","15.734908","10.152.152.11","23.235.43.246","TCP","54","35242  >  80 [ACK] Seq=310 Ack=165710 Win=72672 Len=0"
"247","15.752898","23.235.43.246","10.152.152.11","TCP","552","80  >  35242 [PSH, ACK] Seq=165710 Ack=310 Win=15680 Len=498 [TCP segment of a reassembled PDU]"
"248","15.752968","10.152.152.11","23.235.43.246","TCP","54","35242  >  80 [ACK] Seq=310 Ack=166208 Win=72672 Len=0"
"249","15.911536","23.235.43.246","10.152.152.11","TCP","1514","80  >  35242 [ACK] Seq=166208 Ack=310 Win=15680 Len=1460 [TCP segment of a reassembled PDU]"
"250","15.911552","23.235.43.246","10.152.152.11","TCP","1514","80  >  35242 [ACK] Seq=167668 Ack=310 Win=15680 Len=1460 [TCP segment of a reassembled PDU]"
"251","15.911555","23.235.43.246","10.152.152.11","TCP","1118","80  >  35242 [PSH, ACK] Seq=169128 Ack=310 Win=15680 Len=1064 [TCP segment of a reassembled PDU]"
"252","15.911606","10.152.152.11","23.235.43.246","TCP","54","35242  >  80 [ACK] Seq=310 Ack=170192 Win=72672 Len=0"
"253","15.911841","23.235.43.246","10.152.152.11","TCP","1514","80  >  35242 [ACK] Seq=170192 Ack=310 Win=15680 Len=1460 [TCP segment of a reassembled PDU]"
"254","15.911859","23.235.43.246","10.152.152.11","TCP","1514","80  >  35242 [ACK] Seq=171652 Ack=310 Win=15680 Len=1460 [TCP segment of a reassembled PDU]"
"255","15.911895","23.235.43.246","10.152.152.11","TCP","1118","80  >  35242 [PSH, ACK] Seq=173112 Ack=310 Win=15680 Len=1064 [TCP segment of a reassembled PDU]"
"256","15.911906","10.152.152.11","23.235.43.246","TCP","54","35242  >  80 [ACK] Seq=310 Ack=174176 Win=72672 Len=0"
"257","15.912108","23.235.43.246","10.152.152.11","TCP","1514","80  >  35242 [ACK] Seq=174176 Ack=310 Win=15680 Len=1460 [TCP segment of a reassembled PDU]"
"258","15.912124","23.235.43.246","10.152.152.11","TCP","1514","80  >  35242 [ACK] Seq=175636 Ack=310 Win=15680 Len=1460 [TCP segment of a reassembled PDU]"
"259","15.912126","23.235.43.246","10.152.152.11","TCP","1118","80  >  35242 [PSH, ACK] Seq=177096 Ack=310 Win=15680 Len=1064 [TCP segment of a reassembled PDU]"
"260","15.912163","10.152.152.11","23.235.43.246","TCP","54","35242  >  80 [ACK] Seq=310 Ack=178160 Win=72672 Len=0"
"261","15.912362","23.235.43.246","10.152.152.11","TCP","1514","80  >  35242 [ACK] Seq=178160 Ack=310 Win=15680 Len=1460 [TCP segment of a reassembled PDU]"
"262","15.912380","23.235.43.246","10.152.152.11","TCP","1514","80  >  35242 [ACK] Seq=179620 Ack=310 Win=15680 Len=1460 [TCP segment of a reassembled PDU]"
"263","15.912384","23.235.43.246","10.152.152.11","TCP","1118","80  >  35242 [PSH, ACK] Seq=181080 Ack=310 Win=15680 Len=1064 [TCP segment of a reassembled PDU]"
"264","15.912430","10.152.152.11","23.235.43.246","TCP","54","35242  >  80 [ACK] Seq=310 Ack=182144 Win=72672 Len=0"
"265","15.912546","23.235.43.246","10.152.152.11","TCP","1514","80  >  35242 [ACK] Seq=182144 Ack=310 Win=15680 Len=1460 [TCP segment of a reassembled PDU]"
"266","15.912562","23.235.43.246","10.152.152.11","TCP","1514","80  >  35242 [ACK] Seq=183604 Ack=310 Win=15680 Len=1460 [TCP segment of a reassembled PDU]"
"267","15.912565","23.235.43.246","10.152.152.11","TCP","1118","80  >  35242 [PSH, ACK] Seq=185064 Ack=310 Win=15680 Len=1064 [TCP segment of a reassembled PDU]"
"268","15.912616","10.152.152.11","23.235.43.246","TCP","54","35242  >  80 [ACK] Seq=310 Ack=186128 Win=72672 Len=0"
"269","15.912844","23.235.43.246","10.152.152.11","TCP","1514","80  >  35242 [ACK] Seq=186128 Ack=310 Win=15680 Len=1460 [TCP segment of a reassembled PDU]"
"270","15.912861","23.235.43.246","10.152.152.11","TCP","1514","80  >  35242 [ACK] Seq=187588 Ack=310 Win=15680 Len=1460 [TCP segment of a reassembled PDU]"
"271","15.912864","23.235.43.246","10.152.152.11","TCP","1118","80  >  35242 [PSH, ACK] Seq=189048 Ack=310 Win=15680 Len=1064 [TCP segment of a reassembled PDU]"
"272","15.912893","10.152.152.11","23.235.43.246","TCP","54","35242  >  80 [ACK] Seq=310 Ack=190112 Win=72672 Len=0"
"273","15.913100","23.235.43.246","10.152.152.11","TCP","1514","80  >  35242 [ACK] Seq=190112 Ack=310 Win=15680 Len=1460 [TCP segment of a reassembled PDU]"
"274","15.913117","23.235.43.246","10.152.152.11","TCP","1514","80  >  35242 [ACK] Seq=191572 Ack=310 Win=15680 Len=1460 [TCP segment of a reassembled PDU]"
"275","15.913120","23.235.43.246","10.152.152.11","TCP","1118","80  >  35242 [PSH, ACK] Seq=193032 Ack=310 Win=15680 Len=1064 [TCP segment of a reassembled PDU]"
"276","15.913150","10.152.152.11","23.235.43.246","TCP","54","35242  >  80 [ACK] Seq=310 Ack=194096 Win=72672 Len=0"
"277","15.913520","23.235.43.246","10.152.152.11","TCP","1514","80  >  35242 [ACK] Seq=194096 Ack=310 Win=15680 Len=1460 [TCP segment of a reassembled PDU]"
"278","15.913537","23.235.43.246","10.152.152.11","TCP","1514","80  >  35242 [ACK] Seq=195556 Ack=310 Win=15680 Len=1460 [TCP segment of a reassembled PDU]"
"279","15.913540","23.235.43.246","10.152.152.11","TCP","1118","80  >  35242 [PSH, ACK] Seq=197016 Ack=310 Win=15680 Len=1064 [TCP segment of a reassembled PDU]"
"280","15.913584","10.152.152.11","23.235.43.246","TCP","54","35242  >  80 [ACK] Seq=310 Ack=198080 Win=72672 Len=0"
"281","15.913727","23.235.43.246","10.152.152.11","TCP","1514","80  >  35242 [ACK] Seq=198080 Ack=310 Win=15680 Len=1460 [TCP segment of a reassembled PDU]"
