"No.","Time","Source","Destination","Protocol","Length","Info"
"1","0.000000","10.152.152.11","194.132.197.178","TCP","72","55157  >  4070 [PSH, ACK] Seq=1 Ack=1 Win=6220 Len=18"
"2","0.000364","194.132.197.178","10.152.152.11","TCP","60","4070  >  55157 [ACK] Seq=1 Ack=19 Win=2640 Len=0"
"3","0.302336","10.152.152.11","194.132.197.178","TCP","72","55157  >  4070 [PSH, ACK] Seq=19 Ack=1 Win=6220 Len=18"
"4","0.302564","194.132.197.178","10.152.152.11","TCP","60","4070  >  55157 [ACK] Seq=1 Ack=37 Win=2640 Len=0"
"5","0.600809","194.132.197.178","10.152.152.11","TCP","552","4070  >  55157 [PSH, ACK] Seq=1 Ack=37 Win=2640 Len=498"
"6","0.600809","10.152.152.11","194.132.197.178","TCP","54","55157  >  4070 [ACK] Seq=37 Ack=499 Win=6220 Len=0"
"7","0.761721","194.132.197.178","10.152.152.11","TCP","1514","4070  >  55157 [ACK] Seq=499 Ack=37 Win=2640 Len=1460"
"8","0.761798","10.152.152.11","194.132.197.178","TCP","54","55157  >  4070 [ACK] Seq=37 Ack=1959 Win=6220 Len=0"
"9","0.761818","194.132.197.178","10.152.152.11","TCP","603","4070  >  55157 [PSH, ACK] Seq=1959 Ack=37 Win=2640 Len=549"
"10","0.761823","10.152.152.11","194.132.197.178","TCP","54","55157  >  4070 [ACK] Seq=37 Ack=2508 Win=6220 Len=0"
"11","0.838358","10.152.152.11","194.132.197.178","TCP","93","55157  >  4070 [PSH, ACK] Seq=37 Ack=2508 Win=6220 Len=39"
"12","0.839176","194.132.197.178","10.152.152.11","TCP","60","4070  >  55157 [ACK] Seq=2508 Ack=76 Win=2640 Len=0"
"13","4.738491","10.152.152.11","194.132.197.178","TCP","446","55157  >  4070 [PSH, ACK] Seq=76 Ack=2508 Win=6220 Len=392"
"14","4.739968","194.132.197.178","10.152.152.11","TCP","60","4070  >  55157 [ACK] Seq=2508 Ack=468 Win=2640 Len=0"
"15","5.084392","10.152.152.11","10.152.152.10","DNS","94","Standard query 0xb99d A heads-ak.spotify.com.edgesuite.net"
"16","5.098919","10.152.152.11","194.132.197.178","TCP","110","55157  >  4070 [PSH, ACK] Seq=468 Ack=2508 Win=6220 Len=56"
"17","5.100251","194.132.197.178","10.152.152.11","TCP","60","4070  >  55157 [ACK] Seq=2508 Ack=524 Win=2640 Len=0"
"18","5.381524","10.152.152.10","10.152.152.11","DNS","110","Standard query response 0xb99d A heads-ak.spotify.com.edgesuite.net A 80.239.178.40"
"19","5.387252","10.152.152.11","80.239.178.40","TCP","66","57943  >  80 [SYN] Seq=0 Win=14600 Len=0 MSS=1460 SACK_PERM=1 WS=16"
"20","5.387972","80.239.178.40","10.152.152.11","TCP","66","80  >  57943 [SYN, ACK] Seq=0 Ack=1 Win=14600 Len=0 MSS=1460 SACK_PERM=1 WS=16"
"21","5.388002","10.152.152.11","80.239.178.40","TCP","54","57943  >  80 [ACK] Seq=1 Ack=1 Win=14608 Len=0"
"22","5.391201","10.152.152.11","80.239.178.40","HTTP","286","GET /head/d7ca96670924922b7ffaf07ae336470f285e475b HTTP/1.1 "
"23","5.392288","80.239.178.40","10.152.152.11","TCP","60","80  >  57943 [ACK] Seq=1 Ack=233 Win=15680 Len=0"
"24","5.518677","10.152.152.11","194.132.197.178","TCP","258","55157  >  4070 [PSH, ACK] Seq=524 Ack=2508 Win=6220 Len=204"
"25","5.519283","194.132.197.178","10.152.152.11","TCP","60","4070  >  55157 [ACK] Seq=2508 Ack=728 Win=2640 Len=0"
"26","5.539375","194.132.197.178","10.152.152.11","TCP","105","4070  >  55157 [PSH, ACK] Seq=2508 Ack=728 Win=2640 Len=51"
"27","5.539397","10.152.152.11","194.132.197.178","TCP","54","55157  >  4070 [ACK] Seq=728 Ack=2559 Win=6220 Len=0"
"28","6.328802","10.152.152.11","194.132.197.178","TCP","103","55157  >  4070 [PSH, ACK] Seq=728 Ack=2559 Win=6220 Len=49"
"29","6.351084","80.239.178.40","10.152.152.11","TCP","1514","80  >  57943 [ACK] Seq=1 Ack=233 Win=15680 Len=1460 [TCP segment of a reassembled PDU]"
"30","6.351109","10.152.152.11","80.239.178.40","TCP","54","57943  >  80 [ACK] Seq=233 Ack=1461 Win=17520 Len=0"
"31","6.351372","80.239.178.40","10.152.152.11","TCP","1514","80  >  57943 [ACK] Seq=1461 Ack=233 Win=15680 Len=1460 [TCP segment of a reassembled PDU]"
"32","6.351377","10.152.152.11","80.239.178.40","TCP","54","57943  >  80 [ACK] Seq=233 Ack=2921 Win=20448 Len=0"
"33","6.351390","80.239.178.40","10.152.152.11","TCP","620","80  >  57943 [PSH, ACK] Seq=2921 Ack=233 Win=15680 Len=566 [TCP segment of a reassembled PDU]"
"34","6.351393","10.152.152.11","80.239.178.40","TCP","54","57943  >  80 [ACK] Seq=233 Ack=3487 Win=23360 Len=0"
"35","6.368009","194.132.197.178","10.152.152.11","TCP","60","4070  >  55157 [ACK] Seq=2559 Ack=777 Win=2640 Len=0"
"36","6.372239","80.239.178.40","10.152.152.11","TCP","1514","80  >  57943 [ACK] Seq=3487 Ack=233 Win=15680 Len=1460 [TCP segment of a reassembled PDU]"
"37","6.372251","10.152.152.11","80.239.178.40","TCP","54","57943  >  80 [ACK] Seq=233 Ack=4947 Win=26288 Len=0"
"38","6.372269","80.239.178.40","10.152.152.11","TCP","1514","80  >  57943 [ACK] Seq=4947 Ack=233 Win=15680 Len=1460 [TCP segment of a reassembled PDU]"
"39","6.372303","10.152.152.11","80.239.178.40","TCP","54","57943  >  80 [ACK] Seq=233 Ack=6407 Win=29200 Len=0"
"40","6.372317","80.239.178.40","10.152.152.11","TCP","620","80  >  57943 [PSH, ACK] Seq=6407 Ack=233 Win=15680 Len=566 [TCP segment of a reassembled PDU]"
"41","6.372320","10.152.152.11","80.239.178.40","TCP","54","57943  >  80 [ACK] Seq=233 Ack=6973 Win=32128 Len=0"
"42","6.381006","80.239.178.40","10.152.152.11","TCP","552","80  >  57943 [PSH, ACK] Seq=6973 Ack=233 Win=15680 Len=498 [TCP segment of a reassembled PDU]"
"43","6.381016","10.152.152.11","80.239.178.40","TCP","54","57943  >  80 [ACK] Seq=233 Ack=7471 Win=35040 Len=0"
"44","6.405384","80.239.178.40","10.152.152.11","TCP","1514","80  >  57943 [ACK] Seq=7471 Ack=233 Win=15680 Len=1460 [TCP segment of a reassembled PDU]"
"45","6.405398","10.152.152.11","80.239.178.40","TCP","54","57943  >  80 [ACK] Seq=233 Ack=8931 Win=37968 Len=0"
"46","6.405415","80.239.178.40","10.152.152.11","TCP","1514","80  >  57943 [ACK] Seq=8931 Ack=233 Win=15680 Len=1460 [TCP segment of a reassembled PDU]"
"47","6.405418","10.152.152.11","80.239.178.40","TCP","54","57943  >  80 [ACK] Seq=233 Ack=10391 Win=40880 Len=0"
"48","6.405431","80.239.178.40","10.152.152.11","TCP","620","80  >  57943 [PSH, ACK] Seq=10391 Ack=233 Win=15680 Len=566 [TCP segment of a reassembled PDU]"
"49","6.405434","10.152.152.11","80.239.178.40","TCP","54","57943  >  80 [ACK] Seq=233 Ack=10957 Win=40336 Len=0"
"50","6.436715","80.239.178.40","10.152.152.11","TCP","552","80  >  57943 [PSH, ACK] Seq=10957 Ack=233 Win=15680 Len=498 [TCP segment of a reassembled PDU]"
"51","6.436739","10.152.152.11","80.239.178.40","TCP","54","57943  >  80 [ACK] Seq=233 Ack=11455 Win=42240 Len=0"
"52","6.492577","80.239.178.40","10.152.152.11","TCP","1514","80  >  57943 [ACK] Seq=11455 Ack=233 Win=15680 Len=1460 [TCP segment of a reassembled PDU]"
"53","6.492593","10.152.152.11","80.239.178.40","TCP","54","57943  >  80 [ACK] Seq=233 Ack=12915 Win=42240 Len=0"
"54","6.492611","80.239.178.40","10.152.152.11","TCP","1514","80  >  57943 [ACK] Seq=12915 Ack=233 Win=15680 Len=1460 [TCP segment of a reassembled PDU]"
"55","6.492614","10.152.152.11","80.239.178.40","TCP","54","57943  >  80 [ACK] Seq=233 Ack=14375 Win=41456 Len=0"
"56","6.492628","80.239.178.40","10.152.152.11","TCP","1118","80  >  57943 [PSH, ACK] Seq=14375 Ack=233 Win=15680 Len=1064 [TCP segment of a reassembled PDU]"
"57","6.493226","10.152.152.11","80.239.178.40","TCP","54","57943  >  80 [ACK] Seq=233 Ack=15439 Win=42240 Len=0"
"58","6.493610","80.239.178.40","10.152.152.11","TCP","552","80  >  57943 [PSH, ACK] Seq=15439 Ack=233 Win=15680 Len=498 [TCP segment of a reassembled PDU]"
"59","6.493948","10.152.152.11","80.239.178.40","TCP","54","57943  >  80 [ACK] Seq=233 Ack=15937 Win=42240 Len=0"
"60","6.499498","80.239.178.40","10.152.152.11","TCP","1514","80  >  57943 [ACK] Seq=15937 Ack=233 Win=15680 Len=1460 [TCP segment of a reassembled PDU]"
"61","6.500175","80.239.178.40","10.152.152.11","TCP","1514","80  >  57943 [ACK] Seq=17397 Ack=233 Win=15680 Len=1460 [TCP segment of a reassembled PDU]"
"62","6.500180","80.239.178.40","10.152.152.11","TCP","620","80  >  57943 [PSH, ACK] Seq=18857 Ack=233 Win=15680 Len=566 [TCP segment of a reassembled PDU]"
"63","6.502686","10.152.152.11","80.239.178.40","TCP","54","57943  >  80 [ACK] Seq=233 Ack=19423 Win=42240 Len=0"
"64","6.511372","80.239.178.40","10.152.152.11","TCP","1514","80  >  57943 [ACK] Seq=19423 Ack=233 Win=15680 Len=1460 [TCP segment of a reassembled PDU]"
"65","6.511388","80.239.178.40","10.152.152.11","TCP","1514","80  >  57943 [ACK] Seq=20883 Ack=233 Win=15680 Len=1460 [TCP segment of a reassembled PDU]"
"66","6.511422","80.239.178.40","10.152.152.11","TCP","1118","80  >  57943 [PSH, ACK] Seq=22343 Ack=233 Win=15680 Len=1064 [TCP segment of a reassembled PDU]"
"67","6.511942","10.152.152.11","80.239.178.40","TCP","54","57943  >  80 [ACK] Seq=233 Ack=23407 Win=40336 Len=0"
"68","6.543600","80.239.178.40","10.152.152.11","TCP","1514","80  >  57943 [ACK] Seq=23407 Ack=233 Win=15680 Len=1460 [TCP segment of a reassembled PDU]"
"69","6.543746","80.239.178.40","10.152.152.11","TCP","1514","80  >  57943 [ACK] Seq=24867 Ack=233 Win=15680 Len=1460 [TCP segment of a reassembled PDU]"
"70","6.543753","10.152.152.11","80.239.178.40","TCP","54","57943  >  80 [ACK] Seq=233 Ack=26327 Win=41456 Len=0"
"71","6.543769","80.239.178.40","10.152.152.11","TCP","620","80  >  57943 [PSH, ACK] Seq=26327 Ack=233 Win=15680 Len=566 [TCP segment of a reassembled PDU]"
"72","6.545518","10.152.152.11","80.239.178.40","TCP","54","57943  >  80 [ACK] Seq=233 Ack=26893 Win=42240 Len=0"
"73","6.553199","80.239.178.40","10.152.152.11","TCP","552","80  >  57943 [PSH, ACK] Seq=26893 Ack=233 Win=15680 Len=498 [TCP segment of a reassembled PDU]"
"74","6.556221","10.152.152.11","80.239.178.40","TCP","54","57943  >  80 [ACK] Seq=233 Ack=27391 Win=42240 Len=0"
"75","6.560109","80.239.178.40","10.152.152.11","TCP","1514","80  >  57943 [ACK] Seq=27391 Ack=233 Win=15680 Len=1460 [TCP segment of a reassembled PDU]"
"76","6.560293","80.239.178.40","10.152.152.11","TCP","1514","80  >  57943 [ACK] Seq=28851 Ack=233 Win=15680 Len=1460 [TCP segment of a reassembled PDU]"
"77","6.560298","80.239.178.40","10.152.152.11","TCP","620","80  >  57943 [PSH, ACK] Seq=30311 Ack=233 Win=15680 Len=566 [TCP segment of a reassembled PDU]"
"78","6.560476","10.152.152.11","80.239.178.40","TCP","54","57943  >  80 [ACK] Seq=233 Ack=30877 Win=40336 Len=0"
"79","6.580657","80.239.178.40","10.152.152.11","TCP","1050","80  >  57943 [PSH, ACK] Seq=30877 Ack=233 Win=15680 Len=996 [TCP segment of a reassembled PDU]"
"80","6.581345","10.152.152.11","80.239.178.40","TCP","54","57943  >  80 [ACK] Seq=233 Ack=31873 Win=42240 Len=0"
"81","6.592918","80.239.178.40","10.152.152.11","TCP","1514","80  >  57943 [ACK] Seq=31873 Ack=233 Win=15680 Len=1460 [TCP segment of a reassembled PDU]"
"82","6.592930","80.239.178.40","10.152.152.11","TCP","1514","80  >  57943 [ACK] Seq=33333 Ack=233 Win=15680 Len=1460 [TCP segment of a reassembled PDU]"
"83","6.592933","80.239.178.40","10.152.152.11","TCP","620","80  >  57943 [PSH, ACK] Seq=34793 Ack=233 Win=15680 Len=566 [TCP segment of a reassembled PDU]"
"84","6.592979","10.152.152.11","80.239.178.40","TCP","54","57943  >  80 [ACK] Seq=233 Ack=35359 Win=40336 Len=0"
"85","6.635525","80.239.178.40","10.152.152.11","TCP","1514","80  >  57943 [ACK] Seq=35359 Ack=233 Win=15680 Len=1460 [TCP segment of a reassembled PDU]"
"86","6.635525","80.239.178.40","10.152.152.11","TCP","1514","80  >  57943 [ACK] Seq=36819 Ack=233 Win=15680 Len=1460 [TCP segment of a reassembled PDU]"
"87","6.635525","10.152.152.11","80.239.178.40","TCP","54","57943  >  80 [ACK] Seq=233 Ack=38279 Win=41456 Len=0"
"88","6.635525","80.239.178.40","10.152.152.11","TCP","620","80  >  57943 [PSH, ACK] Seq=38279 Ack=233 Win=15680 Len=566 [TCP segment of a reassembled PDU]"
"89","6.637092","10.152.152.11","80.239.178.40","TCP","54","57943  >  80 [ACK] Seq=233 Ack=38845 Win=42240 Len=0"
"90","6.637458","80.239.178.40","10.152.152.11","TCP","552","80  >  57943 [PSH, ACK] Seq=38845 Ack=233 Win=15680 Len=498 [TCP segment of a reassembled PDU]"
"91","6.638171","80.239.178.40","10.152.152.11","TCP","1514","80  >  57943 [ACK] Seq=39343 Ack=233 Win=15680 Len=1460 [TCP segment of a reassembled PDU]"
"92","6.638234","10.152.152.11","80.239.178.40","TCP","54","57943  >  80 [ACK] Seq=233 Ack=40803 Win=41456 Len=0"
"93","6.638488","80.239.178.40","10.152.152.11","TCP","1514","80  >  57943 [ACK] Seq=40803 Ack=233 Win=15680 Len=1460 [TCP segment of a reassembled PDU]"
"94","6.638492","80.239.178.40","10.152.152.11","TCP","1118","80  >  57943 [PSH, ACK] Seq=42263 Ack=233 Win=15680 Len=1064 [TCP segment of a reassembled PDU]"
"95","6.641973","10.152.152.11","80.239.178.40","TCP","54","57943  >  80 [ACK] Seq=233 Ack=43327 Win=42240 Len=0"
"96","6.678392","80.239.178.40","10.152.152.11","TCP","1514","80  >  57943 [ACK] Seq=43327 Ack=233 Win=15680 Len=1460 [TCP segment of a reassembled PDU]"
"97","6.678406","80.239.178.40","10.152.152.11","TCP","1514","80  >  57943 [ACK] Seq=44787 Ack=233 Win=15680 Len=1460 [TCP segment of a reassembled PDU]"
"98","6.678409","80.239.178.40","10.152.152.11","TCP","1118","80  >  57943 [PSH, ACK] Seq=46247 Ack=233 Win=15680 Len=1064 [TCP segment of a reassembled PDU]"
"99","6.678411","194.132.197.178","10.152.152.11","TCP","81","4070  >  55157 [PSH, ACK] Seq=2559 Ack=777 Win=2640 Len=27"
"100","6.678432","10.152.152.11","194.132.197.178","TCP","54","55157  >  4070 [ACK] Seq=777 Ack=2586 Win=6220 Len=0"
"101","6.678558","10.152.152.11","80.239.178.40","TCP","54","57943  >  80 [ACK] Seq=233 Ack=47311 Win=42240 Len=0"
"102","6.681661","80.239.178.40","10.152.152.11","TCP","552","80  >  57943 [PSH, ACK] Seq=47311 Ack=233 Win=15680 Len=498 [TCP segment of a reassembled PDU]"
"103","6.681667","10.152.152.11","80.239.178.40","TCP","54","57943  >  80 [ACK] Seq=233 Ack=47809 Win=45152 Len=0"
"104","6.694887","80.239.178.40","10.152.152.11","TCP","1514","80  >  57943 [ACK] Seq=47809 Ack=233 Win=15680 Len=1460 [TCP segment of a reassembled PDU]"
"105","6.694905","10.152.152.11","80.239.178.40","TCP","54","57943  >  80 [ACK] Seq=233 Ack=49269 Win=48080 Len=0"
"106","6.694923","80.239.178.40","10.152.152.11","TCP","1514","80  >  57943 [ACK] Seq=49269 Ack=233 Win=15680 Len=1460 [TCP segment of a reassembled PDU]"
"107","6.694925","10.152.152.11","80.239.178.40","TCP","54","57943  >  80 [ACK] Seq=233 Ack=50729 Win=50992 Len=0"
"108","6.694938","80.239.178.40","10.152.152.11","TCP","620","80  >  57943 [PSH, ACK] Seq=50729 Ack=233 Win=15680 Len=566 [TCP segment of a reassembled PDU]"
"109","6.694940","10.152.152.11","80.239.178.40","TCP","54","57943  >  80 [ACK] Seq=233 Ack=51295 Win=52960 Len=0"
"110","6.722234","80.239.178.40","10.152.152.11","TCP","1514","80  >  57943 [ACK] Seq=51295 Ack=233 Win=15680 Len=1460 [TCP segment of a reassembled PDU]"
"111","6.722251","10.152.152.11","80.239.178.40","TCP","54","57943  >  80 [ACK] Seq=233 Ack=52755 Win=54784 Len=0"
"112","6.722268","80.239.178.40","10.152.152.11","TCP","1514","80  >  57943 [ACK] Seq=52755 Ack=233 Win=15680 Len=1460 [TCP segment of a reassembled PDU]"
"113","6.722272","80.239.178.40","10.152.152.11","TCP","1118","80  >  57943 [PSH, ACK] Seq=54215 Ack=233 Win=15680 Len=1064 [TCP segment of a reassembled PDU]"
"114","6.722969","10.152.152.11","80.239.178.40","TCP","54","57943  >  80 [ACK] Seq=233 Ack=55279 Win=52960 Len=0"
"115","6.740830","80.239.178.40","10.152.152.11","TCP","1514","80  >  57943 [ACK] Seq=55279 Ack=233 Win=15680 Len=1460 [TCP segment of a reassembled PDU]"
"116","6.740841","80.239.178.40","10.152.152.11","TCP","1514","80  >  57943 [ACK] Seq=56739 Ack=233 Win=15680 Len=1460 [TCP segment of a reassembled PDU]"
"117","6.740846","10.152.152.11","80.239.178.40","TCP","54","57943  >  80 [ACK] Seq=233 Ack=58199 Win=54080 Len=0"
"118","6.740862","80.239.178.40","10.152.152.11","TCP","1118","80  >  57943 [PSH, ACK] Seq=58199 Ack=233 Win=15680 Len=1064 [TCP segment of a reassembled PDU]"
"119","6.741401","10.152.152.11","80.239.178.40","TCP","54","57943  >  80 [ACK] Seq=233 Ack=59263 Win=54784 Len=0"
"120","6.760255","80.239.178.40","10.152.152.11","TCP","1514","80  >  57943 [ACK] Seq=59263 Ack=233 Win=15680 Len=1460 [TCP segment of a reassembled PDU]"
"121","6.760255","80.239.178.40","10.152.152.11","TCP","1514","80  >  57943 [ACK] Seq=60723 Ack=233 Win=15680 Len=1460 [TCP segment of a reassembled PDU]"
"122","6.760255","80.239.178.40","10.152.152.11","TCP","1118","80  >  57943 [PSH, ACK] Seq=62183 Ack=233 Win=15680 Len=1064 [TCP segment of a reassembled PDU]"
"123","6.761397","10.152.152.11","80.239.178.40","TCP","54","57943  >  80 [ACK] Seq=233 Ack=63247 Win=52960 Len=0"
"124","6.767625","80.239.178.40","10.152.152.11","TCP","552","80  >  57943 [PSH, ACK] Seq=63247 Ack=233 Win=15680 Len=498 [TCP segment of a reassembled PDU]"
"125","6.773235","10.152.152.11","80.239.178.40","TCP","54","57943  >  80 [ACK] Seq=233 Ack=63745 Win=54784 Len=0"
"126","6.790331","80.239.178.40","10.152.152.11","TCP","1514","80  >  57943 [ACK] Seq=63745 Ack=233 Win=15680 Len=1460 [TCP segment of a reassembled PDU]"
"127","6.790331","80.239.178.40","10.152.152.11","TCP","1514","80  >  57943 [ACK] Seq=65205 Ack=233 Win=15680 Len=1460 [TCP segment of a reassembled PDU]"
"128","6.790331","80.239.178.40","10.152.152.11","TCP","620","80  >  57943 [PSH, ACK] Seq=66665 Ack=233 Win=15680 Len=566 [TCP segment of a reassembled PDU]"
"129","6.790728","10.152.152.11","80.239.178.40","TCP","54","57943  >  80 [ACK] Seq=233 Ack=67231 Win=52960 Len=0"
"130","6.801803","80.239.178.40","10.152.152.11","TCP","1514","80  >  57943 [ACK] Seq=67231 Ack=233 Win=15680 Len=1460 [TCP segment of a reassembled PDU]"
"131","6.801815","80.239.178.40","10.152.152.11","TCP","1514","80  >  57943 [ACK] Seq=68691 Ack=233 Win=15680 Len=1460 [TCP segment of a reassembled PDU]"
"132","6.801869","10.152.152.11","80.239.178.40","TCP","54","57943  >  80 [ACK] Seq=233 Ack=70151 Win=54080 Len=0"
"133","6.802063","80.239.178.40","10.152.152.11","TCP","620","80  >  57943 [PSH, ACK] Seq=70151 Ack=233 Win=15680 Len=566 [TCP segment of a reassembled PDU]"
"134","6.802907","10.152.152.11","80.239.178.40","TCP","54","57943  >  80 [ACK] Seq=233 Ack=70717 Win=54784 Len=0"
"135","6.820929","80.239.178.40","10.152.152.11","TCP","552","80  >  57943 [PSH, ACK] Seq=70717 Ack=233 Win=15680 Len=498 [TCP segment of a reassembled PDU]"
"136","6.821103","10.152.152.11","80.239.178.40","TCP","54","57943  >  80 [ACK] Seq=233 Ack=71215 Win=54784 Len=0"
"137","6.831074","80.239.178.40","10.152.152.11","TCP","1514","80  >  57943 [ACK] Seq=71215 Ack=233 Win=15680 Len=1460 [TCP segment of a reassembled PDU]"
"138","6.831084","80.239.178.40","10.152.152.11","TCP","1514","80  >  57943 [ACK] Seq=72675 Ack=233 Win=15680 Len=1460 [TCP segment of a reassembled PDU]"
"139","6.831087","80.239.178.40","10.152.152.11","TCP","620","80  >  57943 [PSH, ACK] Seq=74135 Ack=233 Win=15680 Len=566 [TCP segment of a reassembled PDU]"
"140","6.831187","10.152.152.11","80.239.178.40","TCP","54","57943  >  80 [ACK] Seq=233 Ack=74701 Win=54480 Len=0"
"141","6.856402","80.239.178.40","10.152.152.11","TCP","552","80  >  57943 [PSH, ACK] Seq=74701 Ack=233 Win=15680 Len=498 [TCP segment of a reassembled PDU]"
"142","6.856417","10.152.152.11","80.239.178.40","TCP","54","57943  >  80 [ACK] Seq=233 Ack=75199 Win=55776 Len=0"
"143","6.892113","80.239.178.40","10.152.152.11","TCP","1514","80  >  57943 [ACK] Seq=75199 Ack=233 Win=15680 Len=1460 [TCP segment of a reassembled PDU]"
"144","6.892134","80.239.178.40","10.152.152.11","TCP","1514","80  >  57943 [ACK] Seq=76659 Ack=233 Win=15680 Len=1460 [TCP segment of a reassembled PDU]"
"145","6.892137","80.239.178.40","10.152.152.11","TCP","1118","80  >  57943 [PSH, ACK] Seq=78119 Ack=233 Win=15680 Len=1064 [TCP segment of a reassembled PDU]"
"146","6.892274","10.152.152.11","80.239.178.40","TCP","54","57943  >  80 [ACK] Seq=233 Ack=79183 Win=54480 Len=0"
"147","6.892920","80.239.178.40","10.152.152.11","TCP","552","80  >  57943 [PSH, ACK] Seq=79183 Ack=233 Win=15680 Len=498 [TCP segment of a reassembled PDU]"
"148","6.893299","10.152.152.11","80.239.178.40","TCP","54","57943  >  80 [ACK] Seq=233 Ack=79681 Win=55776 Len=0"
"149","6.904949","80.239.178.40","10.152.152.11","TCP","1514","80  >  57943 [ACK] Seq=79681 Ack=233 Win=15680 Len=1460 [TCP segment of a reassembled PDU]"
"150","6.904968","80.239.178.40","10.152.152.11","TCP","1514","80  >  57943 [ACK] Seq=81141 Ack=233 Win=15680 Len=1460 [TCP segment of a reassembled PDU]"
"151","6.904972","80.239.178.40","10.152.152.11","TCP","620","80  >  57943 [PSH, ACK] Seq=82601 Ack=233 Win=15680 Len=566 [TCP segment of a reassembled PDU]"
"152","6.905086","10.152.152.11","80.239.178.40","TCP","54","57943  >  80 [ACK] Seq=233 Ack=83167 Win=54480 Len=0"
"153","6.941895","80.239.178.40","10.152.152.11","TCP","1514","80  >  57943 [ACK] Seq=83167 Ack=233 Win=15680 Len=1460 [TCP segment of a reassembled PDU]"
"154","6.941920","80.239.178.40","10.152.152.11","TCP","1514","80  >  57943 [ACK] Seq=84627 Ack=233 Win=15680 Len=1460 [TCP segment of a reassembled PDU]"
"155","6.941927","10.152.152.11","80.239.178.40","TCP","54","57943  >  80 [ACK] Seq=233 Ack=86087 Win=55600 Len=0"
"156","6.941944","80.239.178.40","10.152.152.11","TCP","1118","80  >  57943 [PSH, ACK] Seq=86087 Ack=233 Win=15680 Len=1064 [TCP segment of a reassembled PDU]"
"157","6.943448","10.152.152.11","80.239.178.40","TCP","54","57943  >  80 [ACK] Seq=233 Ack=87151 Win=55776 Len=0"
"158","6.969147","80.239.178.40","10.152.152.11","TCP","1514","80  >  57943 [ACK] Seq=87151 Ack=233 Win=15680 Len=1460 [TCP segment of a reassembled PDU]"
"159","6.969162","80.239.178.40","10.152.152.11","TCP","1514","80  >  57943 [ACK] Seq=88611 Ack=233 Win=15680 Len=1460 [TCP segment of a reassembled PDU]"
"160","6.969265","80.239.178.40","10.152.152.11","TCP","1118","80  >  57943 [PSH, ACK] Seq=90071 Ack=233 Win=15680 Len=1064 [TCP segment of a reassembled PDU]"
"161","6.969377","10.152.152.11","80.239.178.40","TCP","54","57943  >  80 [ACK] Seq=233 Ack=91135 Win=54480 Len=0"
"162","6.970193","80.239.178.40","10.152.152.11","TCP","1514","80  >  57943 [ACK] Seq=91135 Ack=233 Win=15680 Len=1460 [TCP segment of a reassembled PDU]"
"163","6.970199","80.239.178.40","10.152.152.11","TCP","1514","80  >  57943 [ACK] Seq=92595 Ack=233 Win=15680 Len=1460 [TCP segment of a reassembled PDU]"
"164","6.970202","10.152.152.11","80.239.178.40","TCP","54","57943  >  80 [ACK] Seq=233 Ack=94055 Win=55600 Len=0"
"165","6.970216","80.239.178.40","10.152.152.11","TCP","620","80  >  57943 [PSH, ACK] Seq=94055 Ack=233 Win=15680 Len=566 [TCP segment of a reassembled PDU]"
"166","6.970812","10.152.152.11","80.239.178.40","TCP","54","57943  >  80 [ACK] Seq=233 Ack=94621 Win=55776 Len=0"
"167","7.009839","80.239.178.40","10.152.152.11","TCP","1050","80  >  57943 [PSH, ACK] Seq=94621 Ack=233 Win=15680 Len=996 [TCP segment of a reassembled PDU]"
"168","7.010420","10.152.152.11","80.239.178.40","TCP","54","57943  >  80 [ACK] Seq=233 Ack=95617 Win=55776 Len=0"
"169","7.025051","80.239.178.40","10.152.152.11","TCP","1514","80  >  57943 [ACK] Seq=95617 Ack=233 Win=15680 Len=1460 [TCP segment of a reassembled PDU]"
"170","7.025065","80.239.178.40","10.152.152.11","TCP","1514","80  >  57943 [ACK] Seq=97077 Ack=233 Win=15680 Len=1460 [TCP segment of a reassembled PDU]"
"171","7.025070","80.239.178.40","10.152.152.11","TCP","620","80  >  57943 [PSH, ACK] Seq=98537 Ack=233 Win=15680 Len=566 [TCP segment of a reassembled PDU]"
"172","7.025411","10.152.152.11","80.239.178.40","TCP","54","57943  >  80 [ACK] Seq=233 Ack=99103 Win=54480 Len=0"
"173","7.047649","80.239.178.40","10.152.152.11","TCP","1514","80  >  57943 [ACK] Seq=99103 Ack=233 Win=15680 Len=1460 [TCP segment of a reassembled PDU]"
"174","7.047665","80.239.178.40","10.152.152.11","TCP","1514","80  >  57943 [ACK] Seq=100563 Ack=233 Win=15680 Len=1460 [TCP segment of a reassembled PDU]"
"175","7.047673","10.152.152.11","80.239.178.40","TCP","54","57943  >  80 [ACK] Seq=233 Ack=102023 Win=55600 Len=0"
"176","7.047689","80.239.178.40","10.152.152.11","TCP","1118","80  >  57943 [PSH, ACK] Seq=102023 Ack=233 Win=15680 Len=1064 [TCP segment of a reassembled PDU]"
"177","7.048275","10.152.152.11","80.239.178.40","TCP","54","57943  >  80 [ACK] Seq=233 Ack=103087 Win=55776 Len=0"
"178","7.075864","80.239.178.40","10.152.152.11","TCP","1514","80  >  57943 [ACK] Seq=103087 Ack=233 Win=15680 Len=1460 [TCP segment of a reassembled PDU]"
"179","7.075879","80.239.178.40","10.152.152.11","TCP","1514","80  >  57943 [ACK] Seq=104547 Ack=233 Win=15680 Len=1460 [TCP segment of a reassembled PDU]"
"180","7.075882","80.239.178.40","10.152.152.11","TCP","1118","80  >  57943 [PSH, ACK] Seq=106007 Ack=233 Win=15680 Len=1064 [TCP segment of a reassembled PDU]"
"181","7.076026","10.152.152.11","80.239.178.40","TCP","54","57943  >  80 [ACK] Seq=233 Ack=107071 Win=54480 Len=0"
"182","7.099943","80.239.178.40","10.152.152.11","TCP","1514","80  >  57943 [ACK] Seq=107071 Ack=233 Win=15680 Len=1460 [TCP segment of a reassembled PDU]"
"183","7.099958","80.239.178.40","10.152.152.11","TCP","1514","80  >  57943 [ACK] Seq=108531 Ack=233 Win=15680 Len=1460 [TCP segment of a reassembled PDU]"
"184","7.099964","10.152.152.11","80.239.178.40","TCP","54","57943  >  80 [ACK] Seq=233 Ack=109991 Win=55600 Len=0"
"185","7.099972","80.239.178.40","10.152.152.11","TCP","1118","80  >  57943 [PSH, ACK] Seq=109991 Ack=233 Win=15680 Len=1064 [TCP segment of a reassembled PDU]"
"186","7.101793","10.152.152.11","80.239.178.40","TCP","54","57943  >  80 [ACK] Seq=233 Ack=111055 Win=55776 Len=0"
"187","7.108300","80.239.178.40","10.152.152.11","TCP","552","80  >  57943 [PSH, ACK] Seq=111055 Ack=233 Win=15680 Len=498 [TCP segment of a reassembled PDU]"
"188","7.109496","10.152.152.11","80.239.178.40","TCP","54","57943  >  80 [ACK] Seq=233 Ack=111553 Win=55776 Len=0"
"189","7.124901","80.239.178.40","10.152.152.11","TCP","1514","80  >  57943 [ACK] Seq=111553 Ack=233 Win=15680 Len=1460 [TCP segment of a reassembled PDU]"
"190","7.125026","80.239.178.40","10.152.152.11","TCP","1514","80  >  57943 [ACK] Seq=113013 Ack=233 Win=15680 Len=1460 [TCP segment of a reassembled PDU]"
"191","7.125030","80.239.178.40","10.152.152.11","TCP","620","80  >  57943 [PSH, ACK] Seq=114473 Ack=233 Win=15680 Len=566 [TCP segment of a reassembled PDU]"
"192","7.125121","10.152.152.11","80.239.178.40","TCP","54","57943  >  80 [ACK] Seq=233 Ack=115039 Win=54480 Len=0"
"193","7.151837","80.239.178.40","10.152.152.11","TCP","1514","80  >  57943 [ACK] Seq=115039 Ack=233 Win=15680 Len=1460 [TCP segment of a reassembled PDU]"
"194","7.151851","80.239.178.40","10.152.152.11","TCP","1514","80  >  57943 [ACK] Seq=116499 Ack=233 Win=15680 Len=1460 [TCP segment of a reassembled PDU]"
"195","7.151857","10.152.152.11","80.239.178.40","TCP","54","57943  >  80 [ACK] Seq=233 Ack=117959 Win=55600 Len=0"
"196","7.152078","80.239.178.40","10.152.152.11","TCP","1118","80  >  57943 [PSH, ACK] Seq=117959 Ack=233 Win=15680 Len=1064 [TCP segment of a reassembled PDU]"
"197","7.154622","10.152.152.11","80.239.178.40","TCP","54","57943  >  80 [ACK] Seq=233 Ack=119023 Win=55776 Len=0"
"198","7.175414","80.239.178.40","10.152.152.11","TCP","1514","80  >  57943 [ACK] Seq=119023 Ack=233 Win=15680 Len=1460 [TCP segment of a reassembled PDU]"
"199","7.175438","80.239.178.40","10.152.152.11","TCP","1514","80  >  57943 [ACK] Seq=120483 Ack=233 Win=15680 Len=1460 [TCP segment of a reassembled PDU]"
"200","7.175442","80.239.178.40","10.152.152.11","TCP","1118","80  >  57943 [PSH, ACK] Seq=121943 Ack=233 Win=15680 Len=1064 [TCP segment of a reassembled PDU]"
"201","7.175547","10.152.152.11","80.239.178.40","TCP","54","57943  >  80 [ACK] Seq=233 Ack=123007 Win=54480 Len=0"
"202","7.202952","80.239.178.40","10.152.152.11","TCP","1514","80  >  57943 [ACK] Seq=123007 Ack=233 Win=15680 Len=1460 [TCP segment of a reassembled PDU]"
"203","7.202968","80.239.178.40","10.152.152.11","TCP","1514","80  >  57943 [ACK] Seq=124467 Ack=233 Win=15680 Len=1460 [TCP segment of a reassembled PDU]"
"204","7.202982","10.152.152.11","80.239.178.40","TCP","54","57943  >  80 [ACK] Seq=233 Ack=125927 Win=55600 Len=0"
"205","7.202999","80.239.178.40","10.152.152.11","TCP","1118","80  >  57943 [PSH, ACK] Seq=125927 Ack=233 Win=15680 Len=1064 [TCP segment of a reassembled PDU]"
"206","7.206740","10.152.152.11","80.239.178.40","TCP","54","57943  >  80 [ACK] Seq=233 Ack=126991 Win=55776 Len=0"
"207","7.214878","80.239.178.40","10.152.152.11","TCP","552","80  >  57943 [PSH, ACK] Seq=126991 Ack=233 Win=15680 Len=498 [TCP segment of a reassembled PDU]"
"208","7.215023","10.152.152.11","80.239.178.40","TCP","54","57943  >  80 [ACK] Seq=233 Ack=127489 Win=55776 Len=0"
"209","7.252783","80.239.178.40","10.152.152.11","TCP","1514","80  >  57943 [ACK] Seq=127489 Ack=233 Win=15680 Len=1460 [TCP segment of a reassembled PDU]"
"210","7.253020","80.239.178.40","10.152.152.11","TCP","1514","80  >  57943 [ACK] Seq=128949 Ack=233 Win=15680 Len=1460 [TCP segment of a reassembled PDU]"
"211","7.253026","80.239.178.40","10.152.152.11","TCP","1206","80  >  57943 [PSH, ACK] Seq=130409 Ack=233 Win=15680 Len=1152 [TCP segment of a reassembled PDU]"
"212","7.253645","10.152.152.11","80.239.178.40","TCP","54","57943  >  80 [ACK] Seq=233 Ack=131561 Win=55776 Len=0"
"213","7.254046","80.239.178.40","10.152.152.11","HTTP","116","HTTP/1.1 200 OK "
"214","7.254595","10.152.152.11","80.239.178.40","TCP","54","57943  >  80 [ACK] Seq=233 Ack=131623 Win=55776 Len=0"
"215","23.501375","10.152.152.11","10.152.191.255","UDP","86","57621  >  57621 Len=44"
"216","28.211133","10.152.152.11","194.132.197.178","TCP","66","55157  >  4070 [PSH, ACK] Seq=777 Ack=2586 Win=6220 Len=12"
"217","28.211997","194.132.197.178","10.152.152.11","TCP","60","4070  >  55157 [ACK] Seq=2586 Ack=789 Win=2640 Len=0"
"218","31.958042","10.152.152.11","194.132.197.178","TCP","311","55157  >  4070 [PSH, ACK] Seq=789 Ack=2586 Win=6220 Len=257"
"219","31.958693","194.132.197.178","10.152.152.11","TCP","60","4070  >  55157 [ACK] Seq=2586 Ack=1046 Win=2640 Len=0"
"220","31.958765","10.152.152.11","194.132.197.178","TCP","446","55157  >  4070 [PSH, ACK] Seq=1046 Ack=2586 Win=6220 Len=392"
"221","31.959246","194.132.197.178","10.152.152.11","TCP","60","4070  >  55157 [ACK] Seq=2586 Ack=1438 Win=2640 Len=0"
"222","31.959791","10.152.152.11","194.132.197.178","TCP","187","55157  >  4070 [PSH, ACK] Seq=1438 Ack=2586 Win=6220 Len=133"
"223","31.959900","194.132.197.178","10.152.152.11","TCP","60","4070  >  55157 [ACK] Seq=2586 Ack=1571 Win=2640 Len=0"
"224","32.502363","10.152.152.11","194.132.197.178","TCP","415","55157  >  4070 [PSH, ACK] Seq=1571 Ack=2586 Win=6220 Len=361"
"225","32.503651","194.132.197.178","10.152.152.11","TCP","60","4070  >  55157 [ACK] Seq=2586 Ack=1932 Win=2640 Len=0"
"226","32.536443","10.152.152.11","194.132.197.178","TCP","70","55157  >  4070 [PSH, ACK] Seq=1932 Ack=2586 Win=6220 Len=16"
"227","32.537406","194.132.197.178","10.152.152.11","TCP","60","4070  >  55157 [ACK] Seq=2586 Ack=1948 Win=2640 Len=0"
"228","32.545350","10.152.152.11","194.132.197.178","TCP","208","55157  >  4070 [PSH, ACK] Seq=1948 Ack=2586 Win=6220 Len=154"
"229","32.546407","194.132.197.178","10.152.152.11","TCP","60","4070  >  55157 [ACK] Seq=2586 Ack=2102 Win=2640 Len=0"
"230","32.961811","10.152.152.11","194.132.197.178","TCP","103","55157  >  4070 [PSH, ACK] Seq=2102 Ack=2586 Win=6220 Len=49"
"231","32.962040","194.132.197.178","10.152.152.11","TCP","60","4070  >  55157 [ACK] Seq=2586 Ack=2151 Win=2640 Len=0"
"232","33.336488","194.132.197.178","10.152.152.11","TCP","160","4070  >  55157 [PSH, ACK] Seq=2586 Ack=2151 Win=2640 Len=106"
"233","33.336488","10.152.152.11","194.132.197.178","TCP","54","55157  >  4070 [ACK] Seq=2151 Ack=2692 Win=6220 Len=0"
"234","53.504126","10.152.152.11","10.152.191.255","UDP","86","57621  >  57621 Len=44"
"235","66.776304","194.132.197.178","10.152.152.11","TCP","65","4070  >  55157 [PSH, ACK] Seq=2692 Ack=2151 Win=2640 Len=11"
"236","66.776341","10.152.152.11","194.132.197.178","TCP","54","55157  >  4070 [ACK] Seq=2151 Ack=2703 Win=6220 Len=0"
"237","71.788283","PcsCompu_11:4d:b1","PcsCompu_78:57:ca","ARP","42","Who has 10.152.152.10? Tell 10.152.152.11"
"238","71.788648","PcsCompu_78:57:ca","PcsCompu_11:4d:b1","ARP","60","10.152.152.10 is at 08:00:27:78:57:ca"
"239","79.631563","10.152.152.11","194.132.197.178","TCP","66","55157  >  4070 [PSH, ACK] Seq=2151 Ack=2703 Win=6220 Len=12"
"240","79.632407","194.132.197.178","10.152.152.11","TCP","60","4070  >  55157 [ACK] Seq=2703 Ack=2163 Win=2640 Len=0"
"241","79.765617","10.152.152.11","194.132.197.178","TCP","85","55157  >  4070 [PSH, ACK] Seq=2163 Ack=2703 Win=6220 Len=31"
"242","79.766032","194.132.197.178","10.152.152.11","TCP","60","4070  >  55157 [ACK] Seq=2703 Ack=2194 Win=2640 Len=0"
"243","80.055977","194.132.197.178","10.152.152.11","TCP","552","4070  >  55157 [PSH, ACK] Seq=2703 Ack=2194 Win=2640 Len=498"
"244","80.056029","10.152.152.11","194.132.197.178","TCP","54","55157  >  4070 [ACK] Seq=2194 Ack=3201 Win=6220 Len=0"
"245","80.059544","194.132.197.178","10.152.152.11","TCP","1514","4070  >  55157 [ACK] Seq=3201 Ack=2194 Win=2640 Len=1460"
"246","80.059557","10.152.152.11","194.132.197.178","TCP","54","55157  >  4070 [ACK] Seq=2194 Ack=4661 Win=6220 Len=0"
"247","80.059652","194.132.197.178","10.152.152.11","TCP","1514","4070  >  55157 [ACK] Seq=4661 Ack=2194 Win=2640 Len=1460"
"248","80.059658","10.152.152.11","194.132.197.178","TCP","54","55157  >  4070 [ACK] Seq=2194 Ack=6121 Win=6220 Len=0"
"249","80.059671","194.132.197.178","10.152.152.11","TCP","620","4070  >  55157 [PSH, ACK] Seq=6121 Ack=2194 Win=2640 Len=566"
"250","80.059674","10.152.152.11","194.132.197.178","TCP","54","55157  >  4070 [ACK] Seq=2194 Ack=6687 Win=6220 Len=0"
"251","80.064455","194.132.197.178","10.152.152.11","TCP","1514","4070  >  55157 [ACK] Seq=6687 Ack=2194 Win=2640 Len=1460"
"252","80.064469","10.152.152.11","194.132.197.178","TCP","54","55157  >  4070 [ACK] Seq=2194 Ack=8147 Win=6220 Len=0"
"253","80.064487","194.132.197.178","10.152.152.11","TCP","1514","4070  >  55157 [ACK] Seq=8147 Ack=2194 Win=2640 Len=1460"
"254","80.064490","10.152.152.11","194.132.197.178","TCP","54","55157  >  4070 [ACK] Seq=2194 Ack=9607 Win=6220 Len=0"
"255","80.064754","194.132.197.178","10.152.152.11","TCP","620","4070  >  55157 [PSH, ACK] Seq=9607 Ack=2194 Win=2640 Len=566"
"256","80.064800","10.152.152.11","194.132.197.178","TCP","54","55157  >  4070 [ACK] Seq=2194 Ack=10173 Win=6220 Len=0"
"257","80.071868","194.132.197.178","10.152.152.11","TCP","1514","4070  >  55157 [ACK] Seq=10173 Ack=2194 Win=2640 Len=1460"
"258","80.071884","10.152.152.11","194.132.197.178","TCP","54","55157  >  4070 [ACK] Seq=2194 Ack=11633 Win=6220 Len=0"
"259","80.071901","194.132.197.178","10.152.152.11","TCP","1514","4070  >  55157 [ACK] Seq=11633 Ack=2194 Win=2640 Len=1460"
"260","80.071904","10.152.152.11","194.132.197.178","TCP","54","55157  >  4070 [ACK] Seq=2194 Ack=13093 Win=6220 Len=0"
"261","80.071916","194.132.197.178","10.152.152.11","TCP","1118","4070  >  55157 [PSH, ACK] Seq=13093 Ack=2194 Win=2640 Len=1064"
"262","80.071918","10.152.152.11","194.132.197.178","TCP","54","55157  >  4070 [ACK] Seq=2194 Ack=14157 Win=6220 Len=0"
"263","80.201111","194.132.197.178","10.152.152.11","TCP","1514","4070  >  55157 [ACK] Seq=14157 Ack=2194 Win=2640 Len=1460"
"264","80.201135","10.152.152.11","194.132.197.178","TCP","54","55157  >  4070 [ACK] Seq=2194 Ack=15617 Win=6220 Len=0"
"265","80.201334","194.132.197.178","10.152.152.11","TCP","699","4070  >  55157 [PSH, ACK] Seq=15617 Ack=2194 Win=2640 Len=645"
"266","80.201337","10.152.152.11","194.132.197.178","TCP","54","55157  >  4070 [ACK] Seq=2194 Ack=16262 Win=6220 Len=0"
"267","80.201700","194.132.197.178","10.152.152.11","TCP","1514","4070  >  55157 [ACK] Seq=16262 Ack=2194 Win=2640 Len=1460"
"268","80.201704","10.152.152.11","194.132.197.178","TCP","54","55157  >  4070 [ACK] Seq=2194 Ack=17722 Win=6220 Len=0"
"269","80.201718","194.132.197.178","10.152.152.11","TCP","1514","4070  >  55157 [ACK] Seq=17722 Ack=2194 Win=2640 Len=1460"
"270","80.201722","10.152.152.11","194.132.197.178","TCP","54","55157  >  4070 [ACK] Seq=2194 Ack=19182 Win=6189 Len=0"
"271","80.201735","194.132.197.178","10.152.152.11","TCP","620","4070  >  55157 [PSH, ACK] Seq=19182 Ack=2194 Win=2640 Len=566"
"272","80.201783","10.152.152.11","194.132.197.178","TCP","54","55157  >  4070 [ACK] Seq=2194 Ack=19748 Win=6154 Len=0"
"273","80.203156","194.132.197.178","10.152.152.11","TCP","1514","4070  >  55157 [ACK] Seq=19748 Ack=2194 Win=2640 Len=1460"
"274","80.203163","10.152.152.11","194.132.197.178","TCP","54","55157  >  4070 [ACK] Seq=2194 Ack=21208 Win=6063 Len=0"
"275","80.203177","194.132.197.178","10.152.152.11","TCP","1514","4070  >  55157 [ACK] Seq=21208 Ack=2194 Win=2640 Len=1460"
"276","80.203181","194.132.197.178","10.152.152.11","TCP","1206","4070  >  55157 [PSH, ACK] Seq=22668 Ack=2194 Win=2640 Len=1152"
"277","80.203184","194.132.197.178","10.152.152.11","TCP","1514","4070  >  55157 [ACK] Seq=23820 Ack=2194 Win=2640 Len=1460"
"278","80.203513","194.132.197.178","10.152.152.11","TCP","1514","4070  >  55157 [ACK] Seq=25280 Ack=2194 Win=2640 Len=1460"
"279","80.203573","10.152.152.11","194.132.197.178","TCP","54","55157  >  4070 [ACK] Seq=2194 Ack=26740 Win=5769 Len=0"
"280","80.205629","194.132.197.178","10.152.152.11","TCP","532","4070  >  55157 [PSH, ACK] Seq=26740 Ack=2194 Win=2640 Len=478"
"281","80.205638","194.132.197.178","10.152.152.11","TCP","1514","4070  >  55157 [ACK] Seq=27218 Ack=2194 Win=2640 Len=1460"
"282","80.205642","10.152.152.11","194.132.197.178","TCP","54","55157  >  4070 [ACK] Seq=2194 Ack=28678 Win=6220 Len=0"
"283","80.205658","194.132.197.178","10.152.152.11","TCP","1514","4070  >  55157 [ACK] Seq=28678 Ack=2194 Win=2640 Len=1460"
"284","80.206342","194.132.197.178","10.152.152.11","TCP","1073","4070  >  55157 [PSH, ACK] Seq=30138 Ack=2194 Win=2640 Len=1019"
"285","80.208619","10.152.152.11","194.132.197.178","TCP","54","55157  >  4070 [ACK] Seq=2194 Ack=31157 Win=6220 Len=0"
"286","82.211930","10.152.152.11","194.132.197.178","TCP","447","55157  >  4070 [PSH, ACK] Seq=2194 Ack=31157 Win=6220 Len=393"
"287","82.212418","10.152.152.11","194.132.197.178","TCP","187","55157  >  4070 [PSH, ACK] Seq=2587 Ack=31157 Win=6220 Len=133"
"288","82.212823","194.132.197.178","10.152.152.11","TCP","60","4070  >  55157 [ACK] Seq=31157 Ack=2587 Win=2640 Len=0"
"289","82.212841","194.132.197.178","10.152.152.11","TCP","60","4070  >  55157 [ACK] Seq=31157 Ack=2720 Win=2639 Len=0"
"290","82.702915","10.152.152.11","194.132.197.178","TCP","415","55157  >  4070 [PSH, ACK] Seq=2720 Ack=31157 Win=6220 Len=361"
"291","82.704399","194.132.197.178","10.152.152.11","TCP","60","4070  >  55157 [ACK] Seq=31157 Ack=3081 Win=2640 Len=0"
"292","82.872120","10.152.152.11","194.132.197.178","TCP","107","55157  >  4070 [PSH, ACK] Seq=3081 Ack=31157 Win=6220 Len=53"
"293","82.872749","10.152.152.11","194.132.197.178","TCP","208","55157  >  4070 [PSH, ACK] Seq=3134 Ack=31157 Win=6220 Len=154"
"294","82.873049","194.132.197.178","10.152.152.11","TCP","60","4070  >  55157 [ACK] Seq=31157 Ack=3134 Win=2640 Len=0"
"295","82.873063","194.132.197.178","10.152.152.11","TCP","60","4070  >  55157 [ACK] Seq=31157 Ack=3288 Win=2639 Len=0"
"296","83.257278","194.132.197.178","10.152.152.11","TCP","133","4070  >  55157 [PSH, ACK] Seq=31157 Ack=3288 Win=2640 Len=79"
"297","83.257319","10.152.152.11","194.132.197.178","TCP","54","55157  >  4070 [ACK] Seq=3288 Ack=31236 Win=6220 Len=0"
"298","83.326050","10.152.152.11","194.132.197.178","TCP","150","55157  >  4070 [PSH, ACK] Seq=3288 Ack=31236 Win=6220 Len=96"
