"No.","Time","Source","Destination","Protocol","Length","Info"
"1","0.000000","10.152.152.11","5.9.28.6","TCP","219","49655  >  5222 [PSH, ACK] Seq=1 Ack=1 Win=4999 Len=165 [TCP segment of a reassembled PDU]"
"2","0.000496","5.9.28.6","10.152.152.11","TCP","60","5222  >  49655 [ACK] Seq=1 Ack=166 Win=2640 Len=0"
"3","0.265233","5.9.28.6","10.152.152.11","TCP","299","5222  >  49655 [PSH, ACK] Seq=1 Ack=166 Win=2640 Len=245 [TCP segment of a reassembled PDU]"
"4","0.265325","10.152.152.11","5.9.28.6","TCP","54","49655  >  5222 [ACK] Seq=166 Ack=246 Win=4999 Len=0"
"5","5.011117","PcsCompu_11:4d:b1","PcsCompu_78:57:ca","ARP","42","Who has 10.152.152.10? Tell 10.152.152.11"
"6","5.011605","PcsCompu_78:57:ca","PcsCompu_11:4d:b1","ARP","60","10.152.152.10 is at 08:00:27:78:57:ca"
"7","6.817159","10.152.152.11","5.9.28.6","TCP","715","49655  >  5222 [PSH, ACK] Seq=166 Ack=246 Win=4999 Len=661 [TCP segment of a reassembled PDU]"
"8","6.817375","5.9.28.6","10.152.152.11","TCP","60","5222  >  49655 [ACK] Seq=246 Ack=827 Win=2640 Len=0"
"9","7.138599","5.9.28.6","10.152.152.11","TCP","552","5222  >  49655 [PSH, ACK] Seq=246 Ack=827 Win=2640 Len=498 [TCP segment of a reassembled PDU]"
"10","7.138691","10.152.152.11","5.9.28.6","TCP","54","49655  >  5222 [ACK] Seq=827 Ack=744 Win=4999 Len=0"
"11","7.251085","5.9.28.6","10.152.152.11","TCP","281","5222  >  49655 [PSH, ACK] Seq=744 Ack=827 Win=2640 Len=227 [TCP segment of a reassembled PDU]"
"12","7.251110","10.152.152.11","5.9.28.6","TCP","54","49655  >  5222 [ACK] Seq=827 Ack=971 Win=4999 Len=0"
"13","22.713645","5.9.28.6","10.152.152.11","XMPP/XML","363","UNKNOWN PACKET "
"14","22.713679","10.152.152.11","5.9.28.6","TCP","54","49655  >  5222 [ACK] Seq=827 Ack=1280 Win=4999 Len=0"
"15","31.490430","10.152.152.11","5.9.28.6","TCP","1514","49655  >  5222 [ACK] Seq=827 Ack=1280 Win=4999 Len=1460 [TCP segment of a reassembled PDU]"
"16","31.490611","10.152.152.11","5.9.28.6","TCP","231","49655  >  5222 [PSH, ACK] Seq=2287 Ack=1280 Win=4999 Len=177 [TCP segment of a reassembled PDU]"
"17","31.490886","5.9.28.6","10.152.152.11","TCP","60","5222  >  49655 [ACK] Seq=1280 Ack=2287 Win=2640 Len=0"
"18","31.491037","5.9.28.6","10.152.152.11","TCP","60","5222  >  49655 [ACK] Seq=1280 Ack=2464 Win=2629 Len=0"
"19","31.825209","5.9.28.6","10.152.152.11","XMPP/XML","552","UNKNOWN PACKET "
"20","31.825312","10.152.152.11","5.9.28.6","TCP","54","49655  >  5222 [ACK] Seq=2464 Ack=1778 Win=4999 Len=0"
"21","31.937424","5.9.28.6","10.152.152.11","TCP","297","5222  >  49655 [PSH, ACK] Seq=1778 Ack=2464 Win=2640 Len=243 [TCP segment of a reassembled PDU]"
"22","31.937451","10.152.152.11","5.9.28.6","TCP","54","49655  >  5222 [ACK] Seq=2464 Ack=2021 Win=4999 Len=0"
"23","45.699847","5.9.28.6","10.152.152.11","TCP","552","5222  >  49655 [PSH, ACK] Seq=2021 Ack=2464 Win=2640 Len=498 [TCP segment of a reassembled PDU]"
"24","45.699881","10.152.152.11","5.9.28.6","TCP","54","49655  >  5222 [ACK] Seq=2464 Ack=2519 Win=4999 Len=0"
"25","45.812122","5.9.28.6","10.152.152.11","TCP","489","5222  >  49655 [PSH, ACK] Seq=2519 Ack=2464 Win=2640 Len=435 [TCP segment of a reassembled PDU]"
"26","45.812149","10.152.152.11","5.9.28.6","TCP","54","49655  >  5222 [ACK] Seq=2464 Ack=2954 Win=4999 Len=0"
"27","47.905802","10.152.152.11","5.9.28.6","TCP","1195","49655  >  5222 [PSH, ACK] Seq=2464 Ack=2954 Win=4999 Len=1141 [TCP segment of a reassembled PDU]"
"28","47.906297","5.9.28.6","10.152.152.11","TCP","60","5222  >  49655 [ACK] Seq=2954 Ack=3605 Win=2640 Len=0"
"29","48.300526","5.9.28.6","10.152.152.11","TCP","552","5222  >  49655 [PSH, ACK] Seq=2954 Ack=3605 Win=2640 Len=498 [TCP segment of a reassembled PDU]"
"30","48.300617","10.152.152.11","5.9.28.6","TCP","54","49655  >  5222 [ACK] Seq=3605 Ack=3452 Win=4999 Len=0"
"31","48.365362","5.9.28.6","10.152.152.11","TCP","297","5222  >  49655 [PSH, ACK] Seq=3452 Ack=3605 Win=2640 Len=243 [TCP segment of a reassembled PDU]"
"32","48.365460","10.152.152.11","5.9.28.6","TCP","54","49655  >  5222 [ACK] Seq=3605 Ack=3695 Win=4999 Len=0"
"33","52.466942","5.9.28.6","10.152.152.11","TCP","552","5222  >  49655 [PSH, ACK] Seq=3695 Ack=3605 Win=2640 Len=498 [TCP segment of a reassembled PDU]"
"34","52.466976","10.152.152.11","5.9.28.6","TCP","54","49655  >  5222 [ACK] Seq=3605 Ack=4193 Win=4999 Len=0"
"35","52.578863","5.9.28.6","10.152.152.11","TCP","489","5222  >  49655 [PSH, ACK] Seq=4193 Ack=3605 Win=2640 Len=435 [TCP segment of a reassembled PDU]"
"36","52.578936","10.152.152.11","5.9.28.6","TCP","54","49655  >  5222 [ACK] Seq=3605 Ack=4628 Win=4999 Len=0"
"37","76.872134","10.152.152.11","5.9.28.6","TCP","1514","49655  >  5222 [ACK] Seq=3605 Ack=4628 Win=4999 Len=1460 [TCP segment of a reassembled PDU]"
"38","76.872196","10.152.152.11","5.9.28.6","TCP","1514","49655  >  5222 [ACK] Seq=5065 Ack=4628 Win=4999 Len=1460 [TCP segment of a reassembled PDU]"
"39","76.872240","10.152.152.11","5.9.28.6","TCP","1514","49655  >  5222 [ACK] Seq=6525 Ack=4628 Win=4999 Len=1460 [TCP segment of a reassembled PDU]"
"40","76.872278","10.152.152.11","5.9.28.6","TCP","1247","49655  >  5222 [PSH, ACK] Seq=7985 Ack=4628 Win=4999 Len=1193 [TCP segment of a reassembled PDU]"
"41","76.872191","5.9.28.6","10.152.152.11","TCP","60","5222  >  49655 [ACK] Seq=4628 Ack=5065 Win=2640 Len=0"
"42","76.872202","5.9.28.6","10.152.152.11","TCP","60","5222  >  49655 [ACK] Seq=4628 Ack=6525 Win=2591 Len=0"
"43","76.872208","5.9.28.6","10.152.152.11","TCP","60","5222  >  49655 [ACK] Seq=4628 Ack=7985 Win=2521 Len=0"
"44","76.872213","5.9.28.6","10.152.152.11","TCP","60","5222  >  49655 [ACK] Seq=4628 Ack=9178 Win=2451 Len=0"
"45","93.271512","10.152.152.11","5.9.28.6","TCP","171","49655  >  5222 [PSH, ACK] Seq=9178 Ack=4628 Win=4999 Len=117 [TCP segment of a reassembled PDU]"
"46","93.271719","5.9.28.6","10.152.152.11","TCP","60","5222  >  49655 [ACK] Seq=4628 Ack=9295 Win=2640 Len=0"
"47","93.511372","5.9.28.6","10.152.152.11","TCP","552","5222  >  49655 [PSH, ACK] Seq=4628 Ack=9295 Win=2640 Len=498 [TCP segment of a reassembled PDU]"
"48","93.511476","10.152.152.11","5.9.28.6","TCP","54","49655  >  5222 [ACK] Seq=9295 Ack=5126 Win=4999 Len=0"
"49","93.623584","5.9.28.6","10.152.152.11","TCP","393","5222  >  49655 [PSH, ACK] Seq=5126 Ack=9295 Win=2640 Len=339 [TCP segment of a reassembled PDU]"
"50","93.623616","10.152.152.11","5.9.28.6","TCP","54","49655  >  5222 [ACK] Seq=9295 Ack=5465 Win=4999 Len=0"
"51","115.752140","10.152.152.11","5.9.28.6","TCP","1514","49655  >  5222 [ACK] Seq=9295 Ack=5465 Win=4999 Len=1460 [TCP segment of a reassembled PDU]"
"52","115.752253","10.152.152.11","5.9.28.6","TCP","1514","49655  >  5222 [ACK] Seq=10755 Ack=5465 Win=4999 Len=1460 [TCP segment of a reassembled PDU]"
"53","115.752338","10.152.152.11","5.9.28.6","TCP","1514","49655  >  5222 [ACK] Seq=12215 Ack=5465 Win=4999 Len=1460 [TCP segment of a reassembled PDU]"
"54","115.752562","5.9.28.6","10.152.152.11","TCP","60","5222  >  49655 [ACK] Seq=5465 Ack=10755 Win=2640 Len=0"
"55","115.752596","5.9.28.6","10.152.152.11","TCP","60","5222  >  49655 [ACK] Seq=5465 Ack=12215 Win=2591 Len=0"
"56","115.752599","5.9.28.6","10.152.152.11","TCP","60","5222  >  49655 [ACK] Seq=5465 Ack=13675 Win=2521 Len=0"
"57","115.752836","10.152.152.11","5.9.28.6","TCP","1514","49655  >  5222 [ACK] Seq=13675 Ack=5465 Win=4999 Len=1460 [TCP segment of a reassembled PDU]"
"58","115.752926","10.152.152.11","5.9.28.6","TCP","779","49655  >  5222 [PSH, ACK] Seq=15135 Ack=5465 Win=4999 Len=725 [TCP segment of a reassembled PDU]"
"59","115.753124","5.9.28.6","10.152.152.11","TCP","60","5222  >  49655 [ACK] Seq=5465 Ack=15135 Win=2640 Len=0"
"60","115.753131","5.9.28.6","10.152.152.11","TCP","60","5222  >  49655 [ACK] Seq=5465 Ack=15860 Win=2595 Len=0"
"61","123.623412","5.9.28.6","10.152.152.11","TCP","552","5222  >  49655 [PSH, ACK] Seq=5465 Ack=15860 Win=2640 Len=498 [TCP segment of a reassembled PDU]"
"62","123.623502","10.152.152.11","5.9.28.6","TCP","54","49655  >  5222 [ACK] Seq=15860 Ack=5963 Win=4999 Len=0"
"63","123.737943","5.9.28.6","10.152.152.11","TCP","281","5222  >  49655 [PSH, ACK] Seq=5963 Ack=15860 Win=2640 Len=227 [TCP segment of a reassembled PDU]"
"64","123.737972","10.152.152.11","5.9.28.6","TCP","54","49655  >  5222 [ACK] Seq=15860 Ack=6190 Win=4999 Len=0"
"65","142.330000","10.152.152.11","5.9.28.6","TCP","1514","49655  >  5222 [ACK] Seq=15860 Ack=6190 Win=4999 Len=1460 [TCP segment of a reassembled PDU]"
"66","142.330233","10.152.152.11","5.9.28.6","TCP","1514","49655  >  5222 [ACK] Seq=17320 Ack=6190 Win=4999 Len=1460 [TCP segment of a reassembled PDU]"
"67","142.330415","5.9.28.6","10.152.152.11","TCP","60","5222  >  49655 [ACK] Seq=6190 Ack=17320 Win=2640 Len=0"
"68","142.330428","5.9.28.6","10.152.152.11","TCP","60","5222  >  49655 [ACK] Seq=6190 Ack=18780 Win=2591 Len=0"
"69","142.330566","10.152.152.11","5.9.28.6","TCP","1514","49655  >  5222 [ACK] Seq=18780 Ack=6190 Win=4999 Len=1460 [TCP segment of a reassembled PDU]"
"70","142.330783","10.152.152.11","5.9.28.6","TCP","1514","49655  >  5222 [ACK] Seq=20240 Ack=6190 Win=4999 Len=1460 [TCP segment of a reassembled PDU]"
"71","142.331104","5.9.28.6","10.152.152.11","TCP","60","5222  >  49655 [ACK] Seq=6190 Ack=20240 Win=2640 Len=0"
"72","142.331287","5.9.28.6","10.152.152.11","TCP","60","5222  >  49655 [ACK] Seq=6190 Ack=21700 Win=2591 Len=0"
"73","142.331463","10.152.152.11","5.9.28.6","TCP","1259","49655  >  5222 [PSH, ACK] Seq=21700 Ack=6190 Win=4999 Len=1205 [TCP segment of a reassembled PDU]"
"74","142.331614","5.9.28.6","10.152.152.11","TCP","60","5222  >  49655 [ACK] Seq=6190 Ack=22905 Win=2640 Len=0"
"75","142.559244","5.9.28.6","10.152.152.11","TCP","552","5222  >  49655 [PSH, ACK] Seq=6190 Ack=22905 Win=2640 Len=498 [TCP segment of a reassembled PDU]"
"76","142.559316","10.152.152.11","5.9.28.6","TCP","54","49655  >  5222 [ACK] Seq=22905 Ack=6688 Win=4999 Len=0"
"77","142.669727","5.9.28.6","10.152.152.11","TCP","297","5222  >  49655 [PSH, ACK] Seq=6688 Ack=22905 Win=2640 Len=243 [TCP segment of a reassembled PDU]"
"78","142.669802","10.152.152.11","5.9.28.6","TCP","54","49655  >  5222 [ACK] Seq=22905 Ack=6931 Win=4999 Len=0"
"79","153.115594","5.9.28.6","10.152.152.11","TCP","552","5222  >  49655 [PSH, ACK] Seq=6931 Ack=22905 Win=2640 Len=498 [TCP segment of a reassembled PDU]"
"80","153.115630","10.152.152.11","5.9.28.6","TCP","54","49655  >  5222 [ACK] Seq=22905 Ack=7429 Win=4999 Len=0"
"81","153.227532","5.9.28.6","10.152.152.11","TCP","281","5222  >  49655 [PSH, ACK] Seq=7429 Ack=22905 Win=2640 Len=227 [TCP segment of a reassembled PDU]"
"82","153.227561","10.152.152.11","5.9.28.6","TCP","54","49655  >  5222 [ACK] Seq=22905 Ack=7656 Win=4999 Len=0"
"83","167.608034","10.152.152.11","5.9.28.6","TCP","1514","49655  >  5222 [ACK] Seq=22905 Ack=7656 Win=4999 Len=1460 [TCP segment of a reassembled PDU]"
"84","167.608185","10.152.152.11","5.9.28.6","TCP","1514","49655  >  5222 [ACK] Seq=24365 Ack=7656 Win=4999 Len=1460 [TCP segment of a reassembled PDU]"
"85","167.608457","5.9.28.6","10.152.152.11","TCP","60","5222  >  49655 [ACK] Seq=7656 Ack=24365 Win=2640 Len=0"
"86","167.608512","5.9.28.6","10.152.152.11","TCP","60","5222  >  49655 [ACK] Seq=7656 Ack=25825 Win=2591 Len=0"
"87","167.608636","10.152.152.11","5.9.28.6","TCP","1514","49655  >  5222 [ACK] Seq=25825 Ack=7656 Win=4999 Len=1460 [TCP segment of a reassembled PDU]"
"88","167.608792","10.152.152.11","5.9.28.6","TCP","1514","49655  >  5222 [ACK] Seq=27285 Ack=7656 Win=4999 Len=1460 [TCP segment of a reassembled PDU]"
"89","167.608925","5.9.28.6","10.152.152.11","TCP","60","5222  >  49655 [ACK] Seq=7656 Ack=27285 Win=2640 Len=0"
"90","167.609009","10.152.152.11","5.9.28.6","TCP","1259","49655  >  5222 [PSH, ACK] Seq=28745 Ack=7656 Win=4999 Len=1205 [TCP segment of a reassembled PDU]"
"91","167.609092","5.9.28.6","10.152.152.11","TCP","60","5222  >  49655 [ACK] Seq=7656 Ack=28745 Win=2591 Len=0"
"92","167.609145","5.9.28.6","10.152.152.11","TCP","60","5222  >  49655 [ACK] Seq=7656 Ack=29950 Win=2521 Len=0"
"93","167.883089","5.9.28.6","10.152.152.11","TCP","552","5222  >  49655 [PSH, ACK] Seq=7656 Ack=29950 Win=2640 Len=498 [TCP segment of a reassembled PDU]"
"94","167.883351","10.152.152.11","5.9.28.6","TCP","54","49655  >  5222 [ACK] Seq=29950 Ack=8154 Win=4999 Len=0"
"95","167.958576","5.9.28.6","10.152.152.11","TCP","297","5222  >  49655 [PSH, ACK] Seq=8154 Ack=29950 Win=2640 Len=243 [TCP segment of a reassembled PDU]"
"96","167.958610","10.152.152.11","5.9.28.6","TCP","54","49655  >  5222 [ACK] Seq=29950 Ack=8397 Win=4999 Len=0"
"97","180.137688","5.9.28.6","10.152.152.11","TCP","552","5222  >  49655 [PSH, ACK] Seq=8397 Ack=29950 Win=2640 Len=498 [TCP segment of a reassembled PDU]"
"98","180.137737","10.152.152.11","5.9.28.6","TCP","54","49655  >  5222 [ACK] Seq=29950 Ack=8895 Win=4999 Len=0"
"99","180.250339","5.9.28.6","10.152.152.11","TCP","281","5222  >  49655 [PSH, ACK] Seq=8895 Ack=29950 Win=2640 Len=227 [TCP segment of a reassembled PDU]"
"100","180.250372","10.152.152.11","5.9.28.6","TCP","54","49655  >  5222 [ACK] Seq=29950 Ack=9122 Win=4999 Len=0"
"101","189.781886","10.152.152.11","5.9.28.6","TCP","1514","49655  >  5222 [ACK] Seq=29950 Ack=9122 Win=4999 Len=1460 [TCP segment of a reassembled PDU]"
"102","189.781996","10.152.152.11","5.9.28.6","TCP","1514","49655  >  5222 [ACK] Seq=31410 Ack=9122 Win=4999 Len=1460 [TCP segment of a reassembled PDU]"
"103","189.782059","10.152.152.11","5.9.28.6","TCP","1514","49655  >  5222 [ACK] Seq=32870 Ack=9122 Win=4999 Len=1460 [TCP segment of a reassembled PDU]"
"104","189.782170","5.9.28.6","10.152.152.11","TCP","60","5222  >  49655 [ACK] Seq=9122 Ack=31410 Win=2640 Len=0"
"105","189.782178","5.9.28.6","10.152.152.11","TCP","60","5222  >  49655 [ACK] Seq=9122 Ack=32870 Win=2591 Len=0"
"106","189.782288","5.9.28.6","10.152.152.11","TCP","60","5222  >  49655 [ACK] Seq=9122 Ack=34330 Win=2521 Len=0"
"107","189.782334","10.152.152.11","5.9.28.6","TCP","1514","49655  >  5222 [ACK] Seq=34330 Ack=9122 Win=4999 Len=1460 [TCP segment of a reassembled PDU]"
"108","189.782398","10.152.152.11","5.9.28.6","TCP","283","49655  >  5222 [PSH, ACK] Seq=35790 Ack=9122 Win=4999 Len=229 [TCP segment of a reassembled PDU]"
"109","189.782480","5.9.28.6","10.152.152.11","TCP","60","5222  >  49655 [ACK] Seq=9122 Ack=35790 Win=2640 Len=0"
"110","189.782586","5.9.28.6","10.152.152.11","TCP","60","5222  >  49655 [ACK] Seq=9122 Ack=36019 Win=2626 Len=0"
"111","190.020000","5.9.28.6","10.152.152.11","TCP","552","5222  >  49655 [PSH, ACK] Seq=9122 Ack=36019 Win=2640 Len=498 [TCP segment of a reassembled PDU]"
"112","190.020092","10.152.152.11","5.9.28.6","TCP","54","49655  >  5222 [ACK] Seq=36019 Ack=9620 Win=4999 Len=0"
"113","190.132561","5.9.28.6","10.152.152.11","TCP","297","5222  >  49655 [PSH, ACK] Seq=9620 Ack=36019 Win=2640 Len=243 [TCP segment of a reassembled PDU]"
"114","190.132597","10.152.152.11","5.9.28.6","TCP","54","49655  >  5222 [ACK] Seq=36019 Ack=9863 Win=4999 Len=0"
"115","191.825314","5.9.28.6","10.152.152.11","TCP","552","5222  >  49655 [PSH, ACK] Seq=9863 Ack=36019 Win=2640 Len=498 [TCP segment of a reassembled PDU]"
"116","191.825395","10.152.152.11","5.9.28.6","TCP","54","49655  >  5222 [ACK] Seq=36019 Ack=10361 Win=4999 Len=0"
"117","191.938659","5.9.28.6","10.152.152.11","TCP","281","5222  >  49655 [PSH, ACK] Seq=10361 Ack=36019 Win=2640 Len=227 [TCP segment of a reassembled PDU]"
"118","191.938711","10.152.152.11","5.9.28.6","TCP","54","49655  >  5222 [ACK] Seq=36019 Ack=10588 Win=4999 Len=0"
"119","231.492808","10.152.152.11","5.9.28.6","TCP","1514","49655  >  5222 [ACK] Seq=36019 Ack=10588 Win=4999 Len=1460 [TCP segment of a reassembled PDU]"
"120","231.492923","10.152.152.11","5.9.28.6","TCP","1514","49655  >  5222 [ACK] Seq=37479 Ack=10588 Win=4999 Len=1460 [TCP segment of a reassembled PDU]"
"121","231.493031","5.9.28.6","10.152.152.11","TCP","60","5222  >  49655 [ACK] Seq=10588 Ack=37479 Win=2640 Len=0"
"122","231.493038","5.9.28.6","10.152.152.11","TCP","60","5222  >  49655 [ACK] Seq=10588 Ack=38939 Win=2591 Len=0"
"123","231.493097","10.152.152.11","5.9.28.6","TCP","1514","49655  >  5222 [ACK] Seq=38939 Ack=10588 Win=4999 Len=1460 [TCP segment of a reassembled PDU]"
"124","231.493169","10.152.152.11","5.9.28.6","TCP","1514","49655  >  5222 [ACK] Seq=40399 Ack=10588 Win=4999 Len=1460 [TCP segment of a reassembled PDU]"
"125","231.493244","5.9.28.6","10.152.152.11","TCP","60","5222  >  49655 [ACK] Seq=10588 Ack=40399 Win=2640 Len=0"
"126","231.493249","5.9.28.6","10.152.152.11","TCP","60","5222  >  49655 [ACK] Seq=10588 Ack=41859 Win=2591 Len=0"
"127","231.493357","10.152.152.11","5.9.28.6","TCP","1514","49655  >  5222 [ACK] Seq=41859 Ack=10588 Win=4999 Len=1460 [TCP segment of a reassembled PDU]"
"128","231.493506","5.9.28.6","10.152.152.11","TCP","60","5222  >  49655 [ACK] Seq=10588 Ack=43319 Win=2640 Len=0"
"129","231.493559","10.152.152.11","5.9.28.6","TCP","1514","49655  >  5222 [ACK] Seq=43319 Ack=10588 Win=4999 Len=1460 [TCP segment of a reassembled PDU]"
"130","231.493702","5.9.28.6","10.152.152.11","TCP","60","5222  >  49655 [ACK] Seq=10588 Ack=44779 Win=2640 Len=0"
"131","231.493756","10.152.152.11","5.9.28.6","TCP","803","49655  >  5222 [PSH, ACK] Seq=44779 Ack=10588 Win=4999 Len=749 [TCP segment of a reassembled PDU]"
"132","231.493908","5.9.28.6","10.152.152.11","TCP","60","5222  >  49655 [ACK] Seq=10588 Ack=45528 Win=2640 Len=0"
"133","231.721707","5.9.28.6","10.152.152.11","TCP","552","5222  >  49655 [PSH, ACK] Seq=10588 Ack=45528 Win=2640 Len=498 [TCP segment of a reassembled PDU]"
"134","231.721799","10.152.152.11","5.9.28.6","TCP","54","49655  >  5222 [ACK] Seq=45528 Ack=11086 Win=4999 Len=0"
"135","231.833996","5.9.28.6","10.152.152.11","TCP","297","5222  >  49655 [PSH, ACK] Seq=11086 Ack=45528 Win=2640 Len=243 [TCP segment of a reassembled PDU]"
"136","231.834022","10.152.152.11","5.9.28.6","TCP","54","49655  >  5222 [ACK] Seq=45528 Ack=11329 Win=4999 Len=0"
"137","234.393992","5.9.28.6","10.152.152.11","TCP","552","5222  >  49655 [PSH, ACK] Seq=11329 Ack=45528 Win=2640 Len=498 [TCP segment of a reassembled PDU]"
"138","234.394025","10.152.152.11","5.9.28.6","TCP","54","49655  >  5222 [ACK] Seq=45528 Ack=11827 Win=4999 Len=0"
"139","234.504415","5.9.28.6","10.152.152.11","TCP","281","5222  >  49655 [PSH, ACK] Seq=11827 Ack=45528 Win=2640 Len=227 [TCP segment of a reassembled PDU]"
"140","234.504435","10.152.152.11","5.9.28.6","TCP","54","49655  >  5222 [ACK] Seq=45528 Ack=12054 Win=4999 Len=0"
"141","270.974442","10.152.152.11","5.9.28.6","TCP","1514","49655  >  5222 [ACK] Seq=45528 Ack=12054 Win=4999 Len=1460 [TCP segment of a reassembled PDU]"
"142","270.974515","10.152.152.11","5.9.28.6","TCP","1514","49655  >  5222 [ACK] Seq=46988 Ack=12054 Win=4999 Len=1460 [TCP segment of a reassembled PDU]"
"143","270.974532","10.152.152.11","5.9.28.6","TCP","1514","49655  >  5222 [ACK] Seq=48448 Ack=12054 Win=4999 Len=1460 [TCP segment of a reassembled PDU]"
"144","270.974548","10.152.152.11","5.9.28.6","TCP","1514","49655  >  5222 [ACK] Seq=49908 Ack=12054 Win=4999 Len=1460 [TCP segment of a reassembled PDU]"
"145","270.974564","10.152.152.11","5.9.28.6","TCP","1259","49655  >  5222 [PSH, ACK] Seq=51368 Ack=12054 Win=4999 Len=1205 [TCP segment of a reassembled PDU]"
"146","270.974491","5.9.28.6","10.152.152.11","TCP","60","5222  >  49655 [ACK] Seq=12054 Ack=46988 Win=2640 Len=0"
"147","270.974516","5.9.28.6","10.152.152.11","TCP","60","5222  >  49655 [ACK] Seq=12054 Ack=48448 Win=2591 Len=0"
"148","270.974522","5.9.28.6","10.152.152.11","TCP","60","5222  >  49655 [ACK] Seq=12054 Ack=49908 Win=2521 Len=0"
"149","270.974527","5.9.28.6","10.152.152.11","TCP","60","5222  >  49655 [ACK] Seq=12054 Ack=51368 Win=2451 Len=0"
"150","270.974531","5.9.28.6","10.152.152.11","TCP","60","5222  >  49655 [ACK] Seq=12054 Ack=52573 Win=2381 Len=0"
"151","271.197900","5.9.28.6","10.152.152.11","TCP","552","5222  >  49655 [PSH, ACK] Seq=12054 Ack=52573 Win=2640 Len=498 [TCP segment of a reassembled PDU]"
"152","271.197991","10.152.152.11","5.9.28.6","TCP","54","49655  >  5222 [ACK] Seq=52573 Ack=12552 Win=4999 Len=0"
"153","271.310239","5.9.28.6","10.152.152.11","TCP","297","5222  >  49655 [PSH, ACK] Seq=12552 Ack=52573 Win=2640 Len=243 [TCP segment of a reassembled PDU]"
"154","271.310267","10.152.152.11","5.9.28.6","TCP","54","49655  >  5222 [ACK] Seq=52573 Ack=12795 Win=4999 Len=0"
"155","274.541010","5.9.28.6","10.152.152.11","TCP","552","5222  >  49655 [PSH, ACK] Seq=12795 Ack=52573 Win=2640 Len=498 [TCP segment of a reassembled PDU]"
"156","274.541086","10.152.152.11","5.9.28.6","TCP","54","49655  >  5222 [ACK] Seq=52573 Ack=13293 Win=4999 Len=0"
"157","274.654861","5.9.28.6","10.152.152.11","TCP","489","5222  >  49655 [PSH, ACK] Seq=13293 Ack=52573 Win=2640 Len=435 [TCP segment of a reassembled PDU]"
"158","274.654886","10.152.152.11","5.9.28.6","TCP","54","49655  >  5222 [ACK] Seq=52573 Ack=13728 Win=4999 Len=0"
"159","287.533089","10.152.152.11","5.9.28.6","TCP","1514","49655  >  5222 [ACK] Seq=52573 Ack=13728 Win=4999 Len=1460 [TCP segment of a reassembled PDU]"
"160","287.533200","10.152.152.11","5.9.28.6","TCP","1514","49655  >  5222 [ACK] Seq=54033 Ack=13728 Win=4999 Len=1460 [TCP segment of a reassembled PDU]"
"161","287.533273","10.152.152.11","5.9.28.6","TCP","1514","49655  >  5222 [ACK] Seq=55493 Ack=13728 Win=4999 Len=1460 [TCP segment of a reassembled PDU]"
"162","287.533389","10.152.152.11","5.9.28.6","TCP","751","49655  >  5222 [PSH, ACK] Seq=56953 Ack=13728 Win=4999 Len=697 [TCP segment of a reassembled PDU]"
"163","287.533588","5.9.28.6","10.152.152.11","TCP","60","5222  >  49655 [ACK] Seq=13728 Ack=54033 Win=2640 Len=0"
"164","287.533595","5.9.28.6","10.152.152.11","TCP","60","5222  >  49655 [ACK] Seq=13728 Ack=55493 Win=2591 Len=0"
"165","287.533620","5.9.28.6","10.152.152.11","TCP","60","5222  >  49655 [ACK] Seq=13728 Ack=56953 Win=2521 Len=0"
"166","287.533669","5.9.28.6","10.152.152.11","TCP","60","5222  >  49655 [ACK] Seq=13728 Ack=57650 Win=2822 Len=0"
"167","287.787045","5.9.28.6","10.152.152.11","TCP","552","5222  >  49655 [PSH, ACK] Seq=13728 Ack=57650 Win=2822 Len=498 [TCP segment of a reassembled PDU]"
"168","287.787134","10.152.152.11","5.9.28.6","TCP","54","49655  >  5222 [ACK] Seq=57650 Ack=14226 Win=4999 Len=0"
"169","287.896017","5.9.28.6","10.152.152.11","TCP","297","5222  >  49655 [PSH, ACK] Seq=14226 Ack=57650 Win=2822 Len=243 [TCP segment of a reassembled PDU]"
"170","287.896046","10.152.152.11","5.9.28.6","TCP","54","49655  >  5222 [ACK] Seq=57650 Ack=14469 Win=4999 Len=0"
"171","290.186466","5.9.28.6","10.152.152.11","TCP","552","5222  >  49655 [PSH, ACK] Seq=14469 Ack=57650 Win=2822 Len=498 [TCP segment of a reassembled PDU]"
"172","290.186511","10.152.152.11","5.9.28.6","TCP","54","49655  >  5222 [ACK] Seq=57650 Ack=14967 Win=4999 Len=0"
"173","290.296625","5.9.28.6","10.152.152.11","TCP","489","5222  >  49655 [PSH, ACK] Seq=14967 Ack=57650 Win=2822 Len=435 [TCP segment of a reassembled PDU]"
"174","290.296661","10.152.152.11","5.9.28.6","TCP","54","49655  >  5222 [ACK] Seq=57650 Ack=15402 Win=4999 Len=0"
"175","306.599345","10.152.152.11","5.9.28.6","TCP","1514","49655  >  5222 [ACK] Seq=57650 Ack=15402 Win=4999 Len=1460 [TCP segment of a reassembled PDU]"
"176","306.599463","10.152.152.11","5.9.28.6","TCP","1514","49655  >  5222 [ACK] Seq=59110 Ack=15402 Win=4999 Len=1460 [TCP segment of a reassembled PDU]"
"177","306.599526","10.152.152.11","5.9.28.6","TCP","1514","49655  >  5222 [ACK] Seq=60570 Ack=15402 Win=4999 Len=1460 [TCP segment of a reassembled PDU]"
"178","306.599629","10.152.152.11","5.9.28.6","TCP","1247","49655  >  5222 [PSH, ACK] Seq=62030 Ack=15402 Win=4999 Len=1193 [TCP segment of a reassembled PDU]"
"179","306.599722","5.9.28.6","10.152.152.11","TCP","60","5222  >  49655 [ACK] Seq=15402 Ack=59110 Win=3005 Len=0"
"180","306.599730","5.9.28.6","10.152.152.11","TCP","60","5222  >  49655 [ACK] Seq=15402 Ack=60570 Win=3187 Len=0"
"181","306.599733","5.9.28.6","10.152.152.11","TCP","60","5222  >  49655 [ACK] Seq=15402 Ack=62030 Win=3370 Len=0"
"182","306.599850","5.9.28.6","10.152.152.11","TCP","60","5222  >  49655 [ACK] Seq=15402 Ack=63223 Win=3552 Len=0"
"183","306.828371","5.9.28.6","10.152.152.11","TCP","552","5222  >  49655 [PSH, ACK] Seq=15402 Ack=63223 Win=3552 Len=498 [TCP segment of a reassembled PDU]"
"184","306.828463","10.152.152.11","5.9.28.6","TCP","54","49655  >  5222 [ACK] Seq=63223 Ack=15900 Win=4999 Len=0"
"185","306.940672","5.9.28.6","10.152.152.11","TCP","297","5222  >  49655 [PSH, ACK] Seq=15900 Ack=63223 Win=3552 Len=243 [TCP segment of a reassembled PDU]"
"186","306.940703","10.152.152.11","5.9.28.6","TCP","54","49655  >  5222 [ACK] Seq=63223 Ack=16143 Win=4999 Len=0"
"187","310.798638","5.9.28.6","10.152.152.11","TCP","552","5222  >  49655 [PSH, ACK] Seq=16143 Ack=63223 Win=3552 Len=498 [TCP segment of a reassembled PDU]"
"188","310.798673","10.152.152.11","5.9.28.6","TCP","54","49655  >  5222 [ACK] Seq=63223 Ack=16641 Win=4999 Len=0"
"189","310.909242","5.9.28.6","10.152.152.11","TCP","489","5222  >  49655 [PSH, ACK] Seq=16641 Ack=63223 Win=3552 Len=435 [TCP segment of a reassembled PDU]"
"190","310.909322","10.152.152.11","5.9.28.6","TCP","54","49655  >  5222 [ACK] Seq=63223 Ack=17076 Win=4999 Len=0"
"191","323.965425","10.152.152.11","5.9.28.6","TCP","1514","49655  >  5222 [ACK] Seq=63223 Ack=17076 Win=4999 Len=1460 [TCP segment of a reassembled PDU]"
"192","323.965488","10.152.152.11","5.9.28.6","TCP","1514","49655  >  5222 [ACK] Seq=64683 Ack=17076 Win=4999 Len=1460 [TCP segment of a reassembled PDU]"
"193","323.965500","10.152.152.11","5.9.28.6","TCP","1514","49655  >  5222 [ACK] Seq=66143 Ack=17076 Win=4999 Len=1460 [TCP segment of a reassembled PDU]"
"194","323.965527","10.152.152.11","5.9.28.6","TCP","1514","49655  >  5222 [ACK] Seq=67603 Ack=17076 Win=4999 Len=1460 [TCP segment of a reassembled PDU]"
"195","323.965539","10.152.152.11","5.9.28.6","TCP","283","49655  >  5222 [PSH, ACK] Seq=69063 Ack=17076 Win=4999 Len=229 [TCP segment of a reassembled PDU]"
"196","323.965445","5.9.28.6","10.152.152.11","TCP","60","5222  >  49655 [ACK] Seq=17076 Ack=64683 Win=3735 Len=0"
"197","323.965462","5.9.28.6","10.152.152.11","TCP","60","5222  >  49655 [ACK] Seq=17076 Ack=66143 Win=3917 Len=0"
"198","323.965469","5.9.28.6","10.152.152.11","TCP","60","5222  >  49655 [ACK] Seq=17076 Ack=67603 Win=4100 Len=0"
"199","323.965476","5.9.28.6","10.152.152.11","TCP","60","5222  >  49655 [ACK] Seq=17076 Ack=69063 Win=4282 Len=0"
"200","323.965483","5.9.28.6","10.152.152.11","TCP","60","5222  >  49655 [ACK] Seq=17076 Ack=69292 Win=4282 Len=0"
"201","324.206782","5.9.28.6","10.152.152.11","TCP","552","5222  >  49655 [PSH, ACK] Seq=17076 Ack=69292 Win=4282 Len=498 [TCP segment of a reassembled PDU]"
"202","324.206853","10.152.152.11","5.9.28.6","TCP","54","49655  >  5222 [ACK] Seq=69292 Ack=17574 Win=4999 Len=0"
"203","324.320005","5.9.28.6","10.152.152.11","TCP","297","5222  >  49655 [PSH, ACK] Seq=17574 Ack=69292 Win=4282 Len=243 [TCP segment of a reassembled PDU]"
"204","324.320032","10.152.152.11","5.9.28.6","TCP","54","49655  >  5222 [ACK] Seq=69292 Ack=17817 Win=4999 Len=0"
"205","325.947224","5.9.28.6","10.152.152.11","TCP","552","5222  >  49655 [PSH, ACK] Seq=17817 Ack=69292 Win=4282 Len=498 [TCP segment of a reassembled PDU]"
"206","325.947259","10.152.152.11","5.9.28.6","TCP","54","49655  >  5222 [ACK] Seq=69292 Ack=18315 Win=4999 Len=0"
"207","326.059383","5.9.28.6","10.152.152.11","TCP","489","5222  >  49655 [PSH, ACK] Seq=18315 Ack=69292 Win=4282 Len=435 [TCP segment of a reassembled PDU]"
"208","326.059412","10.152.152.11","5.9.28.6","TCP","54","49655  >  5222 [ACK] Seq=69292 Ack=18750 Win=4999 Len=0"
"209","343.832920","10.152.152.11","5.9.28.6","TCP","1514","49655  >  5222 [ACK] Seq=69292 Ack=18750 Win=4999 Len=1460 [TCP segment of a reassembled PDU]"
"210","343.833030","10.152.152.11","5.9.28.6","TCP","1514","49655  >  5222 [ACK] Seq=70752 Ack=18750 Win=4999 Len=1460 [TCP segment of a reassembled PDU]"
"211","343.833061","10.152.152.11","5.9.28.6","TCP","1514","49655  >  5222 [ACK] Seq=72212 Ack=18750 Win=4999 Len=1460 [TCP segment of a reassembled PDU]"
"212","343.833085","10.152.152.11","5.9.28.6","TCP","1514","49655  >  5222 [ACK] Seq=73672 Ack=18750 Win=4999 Len=1460 [TCP segment of a reassembled PDU]"
"213","343.833141","10.152.152.11","5.9.28.6","TCP","779","49655  >  5222 [PSH, ACK] Seq=75132 Ack=18750 Win=4999 Len=725 [TCP segment of a reassembled PDU]"
"214","343.833235","5.9.28.6","10.152.152.11","TCP","60","5222  >  49655 [ACK] Seq=18750 Ack=70752 Win=4465 Len=0"
"215","343.833267","5.9.28.6","10.152.152.11","TCP","60","5222  >  49655 [ACK] Seq=18750 Ack=72212 Win=4647 Len=0"
"216","343.833278","5.9.28.6","10.152.152.11","TCP","60","5222  >  49655 [ACK] Seq=18750 Ack=73672 Win=4830 Len=0"
"217","343.833289","5.9.28.6","10.152.152.11","TCP","60","5222  >  49655 [ACK] Seq=18750 Ack=75132 Win=5012 Len=0"
"218","343.833299","5.9.28.6","10.152.152.11","TCP","60","5222  >  49655 [ACK] Seq=18750 Ack=75857 Win=5195 Len=0"
"219","344.078756","5.9.28.6","10.152.152.11","TCP","552","5222  >  49655 [PSH, ACK] Seq=18750 Ack=75857 Win=5195 Len=498 [TCP segment of a reassembled PDU]"
"220","344.078846","10.152.152.11","5.9.28.6","TCP","54","49655  >  5222 [ACK] Seq=75857 Ack=19248 Win=4999 Len=0"
"221","344.149962","5.9.28.6","10.152.152.11","TCP","297","5222  >  49655 [PSH, ACK] Seq=19248 Ack=75857 Win=5195 Len=243 [TCP segment of a reassembled PDU]"
"222","344.149987","10.152.152.11","5.9.28.6","TCP","54","49655  >  5222 [ACK] Seq=75857 Ack=19491 Win=4999 Len=0"
"223","346.697429","5.9.28.6","10.152.152.11","TCP","552","5222  >  49655 [PSH, ACK] Seq=19491 Ack=75857 Win=5195 Len=498 [TCP segment of a reassembled PDU]"
"224","346.697464","10.152.152.11","5.9.28.6","TCP","54","49655  >  5222 [ACK] Seq=75857 Ack=19989 Win=4999 Len=0"
"225","346.810085","5.9.28.6","10.152.152.11","TCP","489","5222  >  49655 [PSH, ACK] Seq=19989 Ack=75857 Win=5195 Len=435 [TCP segment of a reassembled PDU]"
"226","346.810120","10.152.152.11","5.9.28.6","TCP","54","49655  >  5222 [ACK] Seq=75857 Ack=20424 Win=4999 Len=0"
"227","367.833114","10.152.152.11","5.9.28.6","TCP","1514","49655  >  5222 [ACK] Seq=75857 Ack=20424 Win=4999 Len=1460 [TCP segment of a reassembled PDU]"
"228","367.833323","10.152.152.11","5.9.28.6","TCP","1514","49655  >  5222 [ACK] Seq=77317 Ack=20424 Win=4999 Len=1460 [TCP segment of a reassembled PDU]"
"229","367.833448","10.152.152.11","5.9.28.6","TCP","1514","49655  >  5222 [ACK] Seq=78777 Ack=20424 Win=4999 Len=1460 [TCP segment of a reassembled PDU]"
"230","367.833603","5.9.28.6","10.152.152.11","TCP","60","5222  >  49655 [ACK] Seq=20424 Ack=77317 Win=5377 Len=0"
"231","367.833617","5.9.28.6","10.152.152.11","TCP","60","5222  >  49655 [ACK] Seq=20424 Ack=78777 Win=5560 Len=0"
"232","367.833760","5.9.28.6","10.152.152.11","TCP","60","5222  >  49655 [ACK] Seq=20424 Ack=80237 Win=5593 Len=0"
"233","367.833944","10.152.152.11","5.9.28.6","TCP","1514","49655  >  5222 [ACK] Seq=80237 Ack=20424 Win=4999 Len=1460 [TCP segment of a reassembled PDU]"
"234","367.834070","10.152.152.11","5.9.28.6","TCP","1259","49655  >  5222 [PSH, ACK] Seq=81697 Ack=20424 Win=4999 Len=1205 [TCP segment of a reassembled PDU]"
"235","367.834229","5.9.28.6","10.152.152.11","TCP","60","5222  >  49655 [ACK] Seq=20424 Ack=81697 Win=5593 Len=0"
"236","367.834405","5.9.28.6","10.152.152.11","TCP","60","5222  >  49655 [ACK] Seq=20424 Ack=82902 Win=5593 Len=0"
"237","368.293229","5.9.28.6","10.152.152.11","TCP","552","5222  >  49655 [PSH, ACK] Seq=20424 Ack=82902 Win=5593 Len=498 [TCP segment of a reassembled PDU]"
"238","368.293312","10.152.152.11","5.9.28.6","TCP","54","49655  >  5222 [ACK] Seq=82902 Ack=20922 Win=4999 Len=0"
"239","368.405646","5.9.28.6","10.152.152.11","TCP","297","5222  >  49655 [PSH, ACK] Seq=20922 Ack=82902 Win=5593 Len=243 [TCP segment of a reassembled PDU]"
"240","368.405720","10.152.152.11","5.9.28.6","TCP","54","49655  >  5222 [ACK] Seq=82902 Ack=21165 Win=4999 Len=0"
"241","371.586210","5.9.28.6","10.152.152.11","TCP","552","5222  >  49655 [PSH, ACK] Seq=21165 Ack=82902 Win=5593 Len=498 [TCP segment of a reassembled PDU]"
"242","371.586244","10.152.152.11","5.9.28.6","TCP","54","49655  >  5222 [ACK] Seq=82902 Ack=21663 Win=4999 Len=0"
"243","371.699462","5.9.28.6","10.152.152.11","TCP","489","5222  >  49655 [PSH, ACK] Seq=21663 Ack=82902 Win=5593 Len=435 [TCP segment of a reassembled PDU]"
"244","371.699496","10.152.152.11","5.9.28.6","TCP","54","49655  >  5222 [ACK] Seq=82902 Ack=22098 Win=4999 Len=0"
"245","392.149733","10.152.152.11","5.9.28.6","TCP","1514","49655  >  5222 [ACK] Seq=82902 Ack=22098 Win=4999 Len=1460 [TCP segment of a reassembled PDU]"
"246","392.149839","10.152.152.11","5.9.28.6","TCP","1514","49655  >  5222 [ACK] Seq=84362 Ack=22098 Win=4999 Len=1460 [TCP segment of a reassembled PDU]"
"247","392.149893","10.152.152.11","5.9.28.6","XMPP/XML","1514","UNKNOWN PACKET "
"248","392.150024","5.9.28.6","10.152.152.11","TCP","60","5222  >  49655 [ACK] Seq=22098 Ack=84362 Win=5593 Len=0"
"249","392.150059","5.9.28.6","10.152.152.11","TCP","60","5222  >  49655 [ACK] Seq=22098 Ack=85822 Win=5593 Len=0"
"250","392.150063","5.9.28.6","10.152.152.11","TCP","60","5222  >  49655 [ACK] Seq=22098 Ack=87282 Win=5593 Len=0"
"251","392.150120","10.152.152.11","5.9.28.6","TCP","1514","49655  >  5222 [ACK] Seq=87282 Ack=22098 Win=4999 Len=1460 [TCP segment of a reassembled PDU]"
"252","392.150213","10.152.152.11","5.9.28.6","TCP","1514","49655  >  5222 [ACK] Seq=88742 Ack=22098 Win=4999 Len=1460 [TCP segment of a reassembled PDU]"
"253","392.150300","5.9.28.6","10.152.152.11","TCP","60","5222  >  49655 [ACK] Seq=22098 Ack=88742 Win=5593 Len=0"
"254","392.150319","10.152.152.11","5.9.28.6","TCP","295","49655  >  5222 [PSH, ACK] Seq=90202 Ack=22098 Win=4999 Len=241 [TCP segment of a reassembled PDU]"
"255","392.150415","5.9.28.6","10.152.152.11","TCP","60","5222  >  49655 [ACK] Seq=22098 Ack=90202 Win=5593 Len=0"
"256","392.150507","5.9.28.6","10.152.152.11","TCP","60","5222  >  49655 [ACK] Seq=22098 Ack=90443 Win=5593 Len=0"
"257","392.487565","5.9.28.6","10.152.152.11","TCP","552","5222  >  49655 [PSH, ACK] Seq=22098 Ack=90443 Win=5593 Len=498 [TCP segment of a reassembled PDU]"
"258","392.487658","10.152.152.11","5.9.28.6","TCP","54","49655  >  5222 [ACK] Seq=90443 Ack=22596 Win=4999 Len=0"
"259","392.656168","5.9.28.6","10.152.152.11","TCP","297","5222  >  49655 [PSH, ACK] Seq=22596 Ack=90443 Win=5593 Len=243 [TCP segment of a reassembled PDU]"
"260","392.656203","10.152.152.11","5.9.28.6","TCP","54","49655  >  5222 [ACK] Seq=90443 Ack=22839 Win=4999 Len=0"
"261","394.698720","5.9.28.6","10.152.152.11","TCP","552","5222  >  49655 [PSH, ACK] Seq=22839 Ack=90443 Win=5593 Len=498 [TCP segment of a reassembled PDU]"
"262","394.698756","10.152.152.11","5.9.28.6","TCP","54","49655  >  5222 [ACK] Seq=90443 Ack=23337 Win=4999 Len=0"
"263","395.144134","5.9.28.6","10.152.152.11","TCP","489","5222  >  49655 [PSH, ACK] Seq=23337 Ack=90443 Win=5593 Len=435 [TCP segment of a reassembled PDU]"
"264","395.144166","10.152.152.11","5.9.28.6","TCP","54","49655  >  5222 [ACK] Seq=90443 Ack=23772 Win=4999 Len=0"
"265","423.374743","10.152.152.11","5.9.28.6","TCP","1514","49655  >  5222 [ACK] Seq=90443 Ack=23772 Win=4999 Len=1460 [TCP segment of a reassembled PDU]"
"266","423.374977","10.152.152.11","5.9.28.6","TCP","1514","49655  >  5222 [ACK] Seq=91903 Ack=23772 Win=4999 Len=1460 [TCP segment of a reassembled PDU]"
"267","423.375079","10.152.152.11","5.9.28.6","TCP","1514","49655  >  5222 [ACK] Seq=93363 Ack=23772 Win=4999 Len=1460 [TCP segment of a reassembled PDU]"
"268","423.375167","5.9.28.6","10.152.152.11","TCP","60","5222  >  49655 [ACK] Seq=23772 Ack=91903 Win=5593 Len=0"
"269","423.375216","5.9.28.6","10.152.152.11","TCP","60","5222  >  49655 [ACK] Seq=23772 Ack=93363 Win=5593 Len=0"
"270","423.375219","5.9.28.6","10.152.152.11","TCP","60","5222  >  49655 [ACK] Seq=23772 Ack=94823 Win=5593 Len=0"
"271","423.375278","10.152.152.11","5.9.28.6","TCP","1514","49655  >  5222 [ACK] Seq=94823 Ack=23772 Win=4999 Len=1460 [TCP segment of a reassembled PDU]"
"272","423.375390","10.152.152.11","5.9.28.6","TCP","1514","49655  >  5222 [ACK] Seq=96283 Ack=23772 Win=4999 Len=1460 [TCP segment of a reassembled PDU]"
"273","423.375446","5.9.28.6","10.152.152.11","TCP","60","5222  >  49655 [ACK] Seq=23772 Ack=96283 Win=5593 Len=0"
"274","423.375541","5.9.28.6","10.152.152.11","TCP","60","5222  >  49655 [ACK] Seq=23772 Ack=97743 Win=5593 Len=0"
"275","423.375621","10.152.152.11","5.9.28.6","TCP","791","49655  >  5222 [PSH, ACK] Seq=97743 Ack=23772 Win=4999 Len=737 [TCP segment of a reassembled PDU]"
"276","423.375952","5.9.28.6","10.152.152.11","TCP","60","5222  >  49655 [ACK] Seq=23772 Ack=98480 Win=5593 Len=0"
"277","423.640267","5.9.28.6","10.152.152.11","TCP","552","5222  >  49655 [PSH, ACK] Seq=23772 Ack=98480 Win=5593 Len=498 [TCP segment of a reassembled PDU]"
"278","423.640358","10.152.152.11","5.9.28.6","TCP","54","49655  >  5222 [ACK] Seq=98480 Ack=24270 Win=4999 Len=0"
"279","423.746546","5.9.28.6","10.152.152.11","TCP","297","5222  >  49655 [PSH, ACK] Seq=24270 Ack=98480 Win=5593 Len=243 [TCP segment of a reassembled PDU]"
"280","423.746643","10.152.152.11","5.9.28.6","TCP","54","49655  >  5222 [ACK] Seq=98480 Ack=24513 Win=4999 Len=0"
"281","426.712948","5.9.28.6","10.152.152.11","TCP","552","5222  >  49655 [PSH, ACK] Seq=24513 Ack=98480 Win=5593 Len=498 [TCP segment of a reassembled PDU]"
"282","426.712982","10.152.152.11","5.9.28.6","TCP","54","49655  >  5222 [ACK] Seq=98480 Ack=25011 Win=4999 Len=0"
"283","426.825455","5.9.28.6","10.152.152.11","TCP","489","5222  >  49655 [PSH, ACK] Seq=25011 Ack=98480 Win=5593 Len=435 [TCP segment of a reassembled PDU]"
"284","426.825489","10.152.152.11","5.9.28.6","TCP","54","49655  >  5222 [ACK] Seq=98480 Ack=25446 Win=4999 Len=0"
"285","445.595255","10.152.152.11","5.9.28.6","TCP","1514","49655  >  5222 [ACK] Seq=98480 Ack=25446 Win=4999 Len=1460 [TCP segment of a reassembled PDU]"
"286","445.595363","10.152.152.11","5.9.28.6","TCP","1514","49655  >  5222 [ACK] Seq=99940 Ack=25446 Win=4999 Len=1460 [TCP segment of a reassembled PDU]"
"287","445.595389","10.152.152.11","5.9.28.6","TCP","1514","49655  >  5222 [ACK] Seq=101400 Ack=25446 Win=4999 Len=1460 [TCP segment of a reassembled PDU]"
"288","445.595452","10.152.152.11","5.9.28.6","TCP","1514","49655  >  5222 [ACK] Seq=102860 Ack=25446 Win=4999 Len=1460 [TCP segment of a reassembled PDU]"
"289","445.595465","10.152.152.11","5.9.28.6","TCP","1514","49655  >  5222 [ACK] Seq=104320 Ack=25446 Win=4999 Len=1460 [TCP segment of a reassembled PDU]"
"290","445.595484","10.152.152.11","5.9.28.6","TCP","1287","49655  >  5222 [PSH, ACK] Seq=105780 Ack=25446 Win=4999 Len=1233 [TCP segment of a reassembled PDU]"
"291","445.595544","5.9.28.6","10.152.152.11","TCP","60","5222  >  49655 [ACK] Seq=25446 Ack=99940 Win=5593 Len=0"
"292","445.595571","5.9.28.6","10.152.152.11","TCP","60","5222  >  49655 [ACK] Seq=25446 Ack=101400 Win=5593 Len=0"
"293","445.595576","5.9.28.6","10.152.152.11","TCP","60","5222  >  49655 [ACK] Seq=25446 Ack=102860 Win=5593 Len=0"
"294","445.595581","5.9.28.6","10.152.152.11","TCP","60","5222  >  49655 [ACK] Seq=25446 Ack=104320 Win=5523 Len=0"
"295","445.595586","5.9.28.6","10.152.152.11","TCP","60","5222  >  49655 [ACK] Seq=25446 Ack=105780 Win=5453 Len=0"
"296","445.595599","5.9.28.6","10.152.152.11","TCP","60","5222  >  49655 [ACK] Seq=25446 Ack=107013 Win=5383 Len=0"
"297","446.160646","5.9.28.6","10.152.152.11","TCP","552","5222  >  49655 [PSH, ACK] Seq=25446 Ack=107013 Win=5593 Len=498 [TCP segment of a reassembled PDU]"
"298","446.160737","10.152.152.11","5.9.28.6","TCP","54","49655  >  5222 [ACK] Seq=107013 Ack=25944 Win=4999 Len=0"
"299","446.272447","5.9.28.6","10.152.152.11","TCP","297","5222  >  49655 [PSH, ACK] Seq=25944 Ack=107013 Win=5593 Len=243 [TCP segment of a reassembled PDU]"
"300","446.272472","10.152.152.11","5.9.28.6","TCP","54","49655  >  5222 [ACK] Seq=107013 Ack=26187 Win=4999 Len=0"
"301","447.524758","5.9.28.6","10.152.152.11","TCP","552","5222  >  49655 [PSH, ACK] Seq=26187 Ack=107013 Win=5593 Len=498 [TCP segment of a reassembled PDU]"
"302","447.524794","10.152.152.11","5.9.28.6","TCP","54","49655  >  5222 [ACK] Seq=107013 Ack=26685 Win=4999 Len=0"
"303","447.637041","5.9.28.6","10.152.152.11","TCP","489","5222  >  49655 [PSH, ACK] Seq=26685 Ack=107013 Win=5593 Len=435 [TCP segment of a reassembled PDU]"
"304","447.637067","10.152.152.11","5.9.28.6","TCP","54","49655  >  5222 [ACK] Seq=107013 Ack=27120 Win=4999 Len=0"
"305","457.700192","10.152.152.11","5.9.28.6","TCP","1514","49655  >  5222 [ACK] Seq=107013 Ack=27120 Win=4999 Len=1460 [TCP segment of a reassembled PDU]"
"306","457.700278","10.152.152.11","5.9.28.6","TCP","1514","49655  >  5222 [ACK] Seq=108473 Ack=27120 Win=4999 Len=1460 [TCP segment of a reassembled PDU]"
"307","457.700300","10.152.152.11","5.9.28.6","TCP","1514","49655  >  5222 [ACK] Seq=109933 Ack=27120 Win=4999 Len=1460 [TCP segment of a reassembled PDU]"
"308","457.700320","10.152.152.11","5.9.28.6","TCP","1514","49655  >  5222 [ACK] Seq=111393 Ack=27120 Win=4999 Len=1460 [TCP segment of a reassembled PDU]"
"309","457.700376","10.152.152.11","5.9.28.6","TCP","1514","49655  >  5222 [ACK] Seq=112853 Ack=27120 Win=4999 Len=1460 [TCP segment of a reassembled PDU]"
"310","457.700395","10.152.152.11","5.9.28.6","TCP","1514","49655  >  5222 [ACK] Seq=114313 Ack=27120 Win=4999 Len=1460 [TCP segment of a reassembled PDU]"
"311","457.700451","10.152.152.11","5.9.28.6","TCP","1299","49655  >  5222 [PSH, ACK] Seq=115773 Ack=27120 Win=4999 Len=1245 [TCP segment of a reassembled PDU]"
"312","457.700328","5.9.28.6","10.152.152.11","TCP","60","5222  >  49655 [ACK] Seq=27120 Ack=108473 Win=5739 Len=0"
"313","457.700350","5.9.28.6","10.152.152.11","TCP","60","5222  >  49655 [ACK] Seq=27120 Ack=109933 Win=5739 Len=0"
"314","457.700359","5.9.28.6","10.152.152.11","TCP","60","5222  >  49655 [ACK] Seq=27120 Ack=111393 Win=5688 Len=0"
"315","457.700367","5.9.28.6","10.152.152.11","TCP","60","5222  >  49655 [ACK] Seq=27120 Ack=112853 Win=5618 Len=0"
"316","457.700375","5.9.28.6","10.152.152.11","TCP","60","5222  >  49655 [ACK] Seq=27120 Ack=114313 Win=5548 Len=0"
"317","457.700454","5.9.28.6","10.152.152.11","TCP","60","5222  >  49655 [ACK] Seq=27120 Ack=115773 Win=5478 Len=0"
"318","457.700464","5.9.28.6","10.152.152.11","TCP","60","5222  >  49655 [ACK] Seq=27120 Ack=117018 Win=5408 Len=0"
"319","457.951953","5.9.28.6","10.152.152.11","TCP","552","5222  >  49655 [PSH, ACK] Seq=27120 Ack=117018 Win=5739 Len=498 [TCP segment of a reassembled PDU]"
"320","457.952065","10.152.152.11","5.9.28.6","TCP","54","49655  >  5222 [ACK] Seq=117018 Ack=27618 Win=4999 Len=0"
"321","458.064430","5.9.28.6","10.152.152.11","TCP","297","5222  >  49655 [PSH, ACK] Seq=27618 Ack=117018 Win=5739 Len=243 [TCP segment of a reassembled PDU]"
"322","458.064465","10.152.152.11","5.9.28.6","TCP","54","49655  >  5222 [ACK] Seq=117018 Ack=27861 Win=4999 Len=0"
"323","459.938767","5.9.28.6","10.152.152.11","TCP","552","5222  >  49655 [PSH, ACK] Seq=27861 Ack=117018 Win=5739 Len=498 [TCP segment of a reassembled PDU]"
"324","459.938803","10.152.152.11","5.9.28.6","TCP","54","49655  >  5222 [ACK] Seq=117018 Ack=28359 Win=4999 Len=0"
"325","460.050849","5.9.28.6","10.152.152.11","TCP","489","5222  >  49655 [PSH, ACK] Seq=28359 Ack=117018 Win=5739 Len=435 [TCP segment of a reassembled PDU]"
"326","460.050875","10.152.152.11","5.9.28.6","TCP","54","49655  >  5222 [ACK] Seq=117018 Ack=28794 Win=4999 Len=0"
"327","474.639990","10.152.152.11","5.9.28.6","TCP","1514","49655  >  5222 [ACK] Seq=117018 Ack=28794 Win=4999 Len=1460 [TCP segment of a reassembled PDU]"
"328","474.640039","10.152.152.11","5.9.28.6","TCP","1514","49655  >  5222 [ACK] Seq=118478 Ack=28794 Win=4999 Len=1460 [TCP segment of a reassembled PDU]"
"329","474.640050","10.152.152.11","5.9.28.6","TCP","1514","49655  >  5222 [ACK] Seq=119938 Ack=28794 Win=4999 Len=1460 [TCP segment of a reassembled PDU]"
"330","474.640060","10.152.152.11","5.9.28.6","TCP","1514","49655  >  5222 [ACK] Seq=121398 Ack=28794 Win=4999 Len=1460 [TCP segment of a reassembled PDU]"
"331","474.640080","10.152.152.11","5.9.28.6","TCP","1514","49655  >  5222 [ACK] Seq=122858 Ack=28794 Win=4999 Len=1460 [TCP segment of a reassembled PDU]"
"332","474.640091","10.152.152.11","5.9.28.6","TCP","1514","49655  >  5222 [ACK] Seq=124318 Ack=28794 Win=4999 Len=1460 [TCP segment of a reassembled PDU]"
"333","474.640135","10.152.152.11","5.9.28.6","TCP","803","49655  >  5222 [PSH, ACK] Seq=125778 Ack=28794 Win=4999 Len=749 [TCP segment of a reassembled PDU]"
"334","474.640015","5.9.28.6","10.152.152.11","TCP","60","5222  >  49655 [ACK] Seq=28794 Ack=118478 Win=5739 Len=0"
"335","474.640029","5.9.28.6","10.152.152.11","TCP","60","5222  >  49655 [ACK] Seq=28794 Ack=119938 Win=5739 Len=0"
"336","474.640034","5.9.28.6","10.152.152.11","TCP","60","5222  >  49655 [ACK] Seq=28794 Ack=121398 Win=5688 Len=0"
"337","474.640039","5.9.28.6","10.152.152.11","TCP","60","5222  >  49655 [ACK] Seq=28794 Ack=122858 Win=5618 Len=0"
"338","474.640043","5.9.28.6","10.152.152.11","TCP","60","5222  >  49655 [ACK] Seq=28794 Ack=124318 Win=5548 Len=0"
"339","474.640048","5.9.28.6","10.152.152.11","TCP","60","5222  >  49655 [ACK] Seq=28794 Ack=125778 Win=5478 Len=0"
"340","474.640052","5.9.28.6","10.152.152.11","TCP","60","5222  >  49655 [ACK] Seq=28794 Ack=126527 Win=5432 Len=0"
"341","474.887321","5.9.28.6","10.152.152.11","TCP","552","5222  >  49655 [PSH, ACK] Seq=28794 Ack=126527 Win=5739 Len=498 [TCP segment of a reassembled PDU]"
"342","474.887409","10.152.152.11","5.9.28.6","TCP","54","49655  >  5222 [ACK] Seq=126527 Ack=29292 Win=4999 Len=0"
"343","474.963398","5.9.28.6","10.152.152.11","TCP","297","5222  >  49655 [PSH, ACK] Seq=29292 Ack=126527 Win=5739 Len=243 [TCP segment of a reassembled PDU]"
"344","474.963610","10.152.152.11","5.9.28.6","TCP","54","49655  >  5222 [ACK] Seq=126527 Ack=29535 Win=4999 Len=0"
"345","476.802080","5.9.28.6","10.152.152.11","TCP","552","5222  >  49655 [PSH, ACK] Seq=29535 Ack=126527 Win=5739 Len=498 [TCP segment of a reassembled PDU]"
"346","476.802115","10.152.152.11","5.9.28.6","TCP","54","49655  >  5222 [ACK] Seq=126527 Ack=30033 Win=4999 Len=0"
"347","476.914863","5.9.28.6","10.152.152.11","TCP","489","5222  >  49655 [PSH, ACK] Seq=30033 Ack=126527 Win=5739 Len=435 [TCP segment of a reassembled PDU]"
"348","476.914888","10.152.152.11","5.9.28.6","TCP","54","49655  >  5222 [ACK] Seq=126527 Ack=30468 Win=4999 Len=0"
"349","484.850507","10.152.152.11","5.9.28.6","TCP","1514","49655  >  5222 [ACK] Seq=126527 Ack=30468 Win=4999 Len=1460 [TCP segment of a reassembled PDU]"
"350","484.850634","10.152.152.11","5.9.28.6","TCP","1514","49655  >  5222 [ACK] Seq=127987 Ack=30468 Win=4999 Len=1460 [TCP segment of a reassembled PDU]"
"351","484.850817","5.9.28.6","10.152.152.11","TCP","60","5222  >  49655 [ACK] Seq=30468 Ack=127987 Win=5739 Len=0"
"352","484.850974","5.9.28.6","10.152.152.11","TCP","60","5222  >  49655 [ACK] Seq=30468 Ack=129447 Win=5739 Len=0"
"353","484.851032","10.152.152.11","5.9.28.6","TCP","1514","49655  >  5222 [ACK] Seq=129447 Ack=30468 Win=4999 Len=1460 [TCP segment of a reassembled PDU]"
"354","484.851126","10.152.152.11","5.9.28.6","TCP","1514","49655  >  5222 [ACK] Seq=130907 Ack=30468 Win=4999 Len=1460 [TCP segment of a reassembled PDU]"
"355","484.851224","5.9.28.6","10.152.152.11","TCP","60","5222  >  49655 [ACK] Seq=30468 Ack=130907 Win=5739 Len=0"
"356","484.851336","5.9.28.6","10.152.152.11","TCP","60","5222  >  49655 [ACK] Seq=30468 Ack=132367 Win=5739 Len=0"
"357","484.851426","10.152.152.11","5.9.28.6","TCP","1514","49655  >  5222 [ACK] Seq=132367 Ack=30468 Win=4999 Len=1460 [TCP segment of a reassembled PDU]"
"358","484.851541","10.152.152.11","5.9.28.6","TCP","1514","49655  >  5222 [ACK] Seq=133827 Ack=30468 Win=4999 Len=1460 [TCP segment of a reassembled PDU]"
"359","484.851749","5.9.28.6","10.152.152.11","TCP","60","5222  >  49655 [ACK] Seq=30468 Ack=133827 Win=5739 Len=0"
"360","484.851867","5.9.28.6","10.152.152.11","TCP","60","5222  >  49655 [ACK] Seq=30468 Ack=135287 Win=5739 Len=0"
"361","484.851893","10.152.152.11","5.9.28.6","TCP","1514","49655  >  5222 [ACK] Seq=135287 Ack=30468 Win=4999 Len=1460 [TCP segment of a reassembled PDU]"
"362","484.852027","10.152.152.11","5.9.28.6","TCP","335","49655  >  5222 [PSH, ACK] Seq=136747 Ack=30468 Win=4999 Len=281 [TCP segment of a reassembled PDU]"
"363","484.852129","5.9.28.6","10.152.152.11","TCP","60","5222  >  49655 [ACK] Seq=30468 Ack=136747 Win=5688 Len=0"
"364","484.852264","5.9.28.6","10.152.152.11","TCP","60","5222  >  49655 [ACK] Seq=30468 Ack=137028 Win=5671 Len=0"
"365","485.109774","5.9.28.6","10.152.152.11","TCP","552","5222  >  49655 [PSH, ACK] Seq=30468 Ack=137028 Win=5739 Len=498 [TCP segment of a reassembled PDU]"
"366","485.109865","10.152.152.11","5.9.28.6","TCP","54","49655  >  5222 [ACK] Seq=137028 Ack=30966 Win=4999 Len=0"
"367","485.221786","5.9.28.6","10.152.152.11","TCP","297","5222  >  49655 [PSH, ACK] Seq=30966 Ack=137028 Win=5739 Len=243 [TCP segment of a reassembled PDU]"
"368","485.221812","10.152.152.11","5.9.28.6","TCP","54","49655  >  5222 [ACK] Seq=137028 Ack=31209 Win=4999 Len=0"
"369","487.329129","5.9.28.6","10.152.152.11","TCP","552","5222  >  49655 [PSH, ACK] Seq=31209 Ack=137028 Win=5739 Len=498 [TCP segment of a reassembled PDU]"
"370","487.329165","10.152.152.11","5.9.28.6","TCP","54","49655  >  5222 [ACK] Seq=137028 Ack=31707 Win=4999 Len=0"
"371","487.462345","5.9.28.6","10.152.152.11","TCP","489","5222  >  49655 [PSH, ACK] Seq=31707 Ack=137028 Win=5739 Len=435 [TCP segment of a reassembled PDU]"
"372","487.462361","10.152.152.11","5.9.28.6","TCP","54","49655  >  5222 [ACK] Seq=137028 Ack=32142 Win=4999 Len=0"
"373","493.837201","10.152.152.11","5.9.28.6","TCP","1514","49655  >  5222 [ACK] Seq=137028 Ack=32142 Win=4999 Len=1460 [TCP segment of a reassembled PDU]"
"374","493.837321","10.152.152.11","5.9.28.6","TCP","1514","49655  >  5222 [ACK] Seq=138488 Ack=32142 Win=4999 Len=1460 [TCP segment of a reassembled PDU]"
"375","493.837394","10.152.152.11","5.9.28.6","TCP","1514","49655  >  5222 [ACK] Seq=139948 Ack=32142 Win=4999 Len=1460 [TCP segment of a reassembled PDU]"
"376","493.837514","5.9.28.6","10.152.152.11","TCP","60","5222  >  49655 [ACK] Seq=32142 Ack=138488 Win=5739 Len=0"
"377","493.837541","5.9.28.6","10.152.152.11","TCP","60","5222  >  49655 [ACK] Seq=32142 Ack=139948 Win=5739 Len=0"
"378","493.837544","5.9.28.6","10.152.152.11","TCP","60","5222  >  49655 [ACK] Seq=32142 Ack=141408 Win=5688 Len=0"
"379","493.837600","10.152.152.11","5.9.28.6","TCP","1514","49655  >  5222 [ACK] Seq=141408 Ack=32142 Win=4999 Len=1460 [TCP segment of a reassembled PDU]"
"380","493.837674","10.152.152.11","5.9.28.6","TCP","1514","49655  >  5222 [ACK] Seq=142868 Ack=32142 Win=4999 Len=1460 [TCP segment of a reassembled PDU]"
"381","493.837745","5.9.28.6","10.152.152.11","TCP","60","5222  >  49655 [ACK] Seq=32142 Ack=142868 Win=5739 Len=0"
"382","493.837836","5.9.28.6","10.152.152.11","TCP","60","5222  >  49655 [ACK] Seq=32142 Ack=144328 Win=5739 Len=0"
"383","493.837872","10.152.152.11","5.9.28.6","TCP","1514","49655  >  5222 [ACK] Seq=144328 Ack=32142 Win=4999 Len=1460 [TCP segment of a reassembled PDU]"
"384","493.837937","10.152.152.11","5.9.28.6","TCP","1514","49655  >  5222 [ACK] Seq=145788 Ack=32142 Win=4999 Len=1460 [TCP segment of a reassembled PDU]"
"385","493.838219","5.9.28.6","10.152.152.11","TCP","60","5222  >  49655 [ACK] Seq=32142 Ack=145788 Win=5688 Len=0"
"386","493.838247","5.9.28.6","10.152.152.11","TCP","60","5222  >  49655 [ACK] Seq=32142 Ack=147248 Win=5618 Len=0"
"387","493.838306","10.152.152.11","5.9.28.6","TCP","335","49655  >  5222 [PSH, ACK] Seq=147248 Ack=32142 Win=4999 Len=281 [TCP segment of a reassembled PDU]"
"388","493.838490","5.9.28.6","10.152.152.11","TCP","60","5222  >  49655 [ACK] Seq=32142 Ack=147529 Win=5739 Len=0"
"389","495.125618","5.9.28.6","10.152.152.11","TCP","552","5222  >  49655 [PSH, ACK] Seq=32142 Ack=147529 Win=5739 Len=498 [TCP segment of a reassembled PDU]"
"390","495.125657","10.152.152.11","5.9.28.6","TCP","54","49655  >  5222 [ACK] Seq=147529 Ack=32640 Win=4999 Len=0"
"391","495.239057","5.9.28.6","10.152.152.11","TCP","297","5222  >  49655 [PSH, ACK] Seq=32640 Ack=147529 Win=5739 Len=243 [TCP segment of a reassembled PDU]"
"392","495.239092","10.152.152.11","5.9.28.6","TCP","54","49655  >  5222 [ACK] Seq=147529 Ack=32883 Win=4999 Len=0"
"393","497.133684","5.9.28.6","10.152.152.11","TCP","552","5222  >  49655 [PSH, ACK] Seq=32883 Ack=147529 Win=5739 Len=498 [TCP segment of a reassembled PDU]"
"394","497.133707","10.152.152.11","5.9.28.6","TCP","54","49655  >  5222 [ACK] Seq=147529 Ack=33381 Win=4999 Len=0"
"395","497.246594","5.9.28.6","10.152.152.11","TCP","489","5222  >  49655 [PSH, ACK] Seq=33381 Ack=147529 Win=5739 Len=435 [TCP segment of a reassembled PDU]"
"396","497.246618","10.152.152.11","5.9.28.6","TCP","54","49655  >  5222 [ACK] Seq=147529 Ack=33816 Win=4999 Len=0"
"397","504.663844","10.152.152.11","5.9.28.6","TCP","1514","49655  >  5222 [ACK] Seq=147529 Ack=33816 Win=4999 Len=1460 [TCP segment of a reassembled PDU]"
"398","504.664106","10.152.152.11","5.9.28.6","TCP","1514","49655  >  5222 [ACK] Seq=148989 Ack=33816 Win=4999 Len=1460 [TCP segment of a reassembled PDU]"
"399","504.664179","10.152.152.11","5.9.28.6","TCP","1514","49655  >  5222 [ACK] Seq=150449 Ack=33816 Win=4999 Len=1460 [TCP segment of a reassembled PDU]"
"400","504.664337","5.9.28.6","10.152.152.11","TCP","60","5222  >  49655 [ACK] Seq=33816 Ack=148989 Win=5739 Len=0"
"401","504.664344","5.9.28.6","10.152.152.11","TCP","60","5222  >  49655 [ACK] Seq=33816 Ack=150449 Win=5739 Len=0"
"402","504.664347","5.9.28.6","10.152.152.11","TCP","60","5222  >  49655 [ACK] Seq=33816 Ack=151909 Win=5688 Len=0"
"403","504.664361","10.152.152.11","5.9.28.6","TCP","1514","49655  >  5222 [ACK] Seq=151909 Ack=33816 Win=4999 Len=1460 [TCP segment of a reassembled PDU]"
"404","504.664436","10.152.152.11","5.9.28.6","TCP","1514","49655  >  5222 [ACK] Seq=153369 Ack=33816 Win=4999 Len=1460 [TCP segment of a reassembled PDU]"
"405","504.664508","5.9.28.6","10.152.152.11","TCP","60","5222  >  49655 [ACK] Seq=33816 Ack=153369 Win=5739 Len=0"
"406","504.664612","5.9.28.6","10.152.152.11","TCP","60","5222  >  49655 [ACK] Seq=33816 Ack=154829 Win=5739 Len=0"
"407","504.664683","10.152.152.11","5.9.28.6","TCP","1514","49655  >  5222 [ACK] Seq=154829 Ack=33816 Win=4999 Len=1460 [TCP segment of a reassembled PDU]"
"408","504.664778","10.152.152.11","5.9.28.6","TCP","1514","49655  >  5222 [ACK] Seq=156289 Ack=33816 Win=4999 Len=1460 [TCP segment of a reassembled PDU]"
"409","504.664874","5.9.28.6","10.152.152.11","TCP","60","5222  >  49655 [ACK] Seq=33816 Ack=156289 Win=5739 Len=0"
"410","504.664888","5.9.28.6","10.152.152.11","TCP","60","5222  >  49655 [ACK] Seq=33816 Ack=157749 Win=5739 Len=0"
"411","504.664960","10.152.152.11","5.9.28.6","TCP","815","49655  >  5222 [PSH, ACK] Seq=157749 Ack=33816 Win=4999 Len=761 [TCP segment of a reassembled PDU]"
"412","504.665102","5.9.28.6","10.152.152.11","TCP","60","5222  >  49655 [ACK] Seq=33816 Ack=158510 Win=5692 Len=0"
"413","505.941455","5.9.28.6","10.152.152.11","TCP","552","5222  >  49655 [PSH, ACK] Seq=33816 Ack=158510 Win=5739 Len=498 [TCP segment of a reassembled PDU]"
"414","505.941554","10.152.152.11","5.9.28.6","TCP","54","49655  >  5222 [ACK] Seq=158510 Ack=34314 Win=4999 Len=0"
"415","506.053697","5.9.28.6","10.152.152.11","TCP","297","5222  >  49655 [PSH, ACK] Seq=34314 Ack=158510 Win=5739 Len=243 [TCP segment of a reassembled PDU]"
"416","506.053734","10.152.152.11","5.9.28.6","TCP","54","49655  >  5222 [ACK] Seq=158510 Ack=34557 Win=4999 Len=0"
"417","508.039250","5.9.28.6","10.152.152.11","TCP","552","5222  >  49655 [PSH, ACK] Seq=34557 Ack=158510 Win=5739 Len=498 [TCP segment of a reassembled PDU]"
"418","508.039330","10.152.152.11","5.9.28.6","TCP","54","49655  >  5222 [ACK] Seq=158510 Ack=35055 Win=4999 Len=0"
"419","508.151980","5.9.28.6","10.152.152.11","TCP","489","5222  >  49655 [PSH, ACK] Seq=35055 Ack=158510 Win=5739 Len=435 [TCP segment of a reassembled PDU]"
"420","508.152040","10.152.152.11","5.9.28.6","TCP","54","49655  >  5222 [ACK] Seq=158510 Ack=35490 Win=4999 Len=0"
"421","516.128190","10.152.152.11","5.9.28.6","TCP","1514","49655  >  5222 [ACK] Seq=158510 Ack=35490 Win=4999 Len=1460 [TCP segment of a reassembled PDU]"
"422","516.128244","10.152.152.11","5.9.28.6","TCP","1514","49655  >  5222 [ACK] Seq=159970 Ack=35490 Win=4999 Len=1460 [TCP segment of a reassembled PDU]"
"423","516.128258","10.152.152.11","5.9.28.6","TCP","1514","49655  >  5222 [ACK] Seq=161430 Ack=35490 Win=4999 Len=1460 [TCP segment of a reassembled PDU]"
"424","516.128270","10.152.152.11","5.9.28.6","TCP","1514","49655  >  5222 [ACK] Seq=162890 Ack=35490 Win=4999 Len=1460 [TCP segment of a reassembled PDU]"
"425","516.128303","10.152.152.11","5.9.28.6","TCP","1514","49655  >  5222 [ACK] Seq=164350 Ack=35490 Win=4999 Len=1460 [TCP segment of a reassembled PDU]"
"426","516.128317","10.152.152.11","5.9.28.6","TCP","1514","49655  >  5222 [ACK] Seq=165810 Ack=35490 Win=4999 Len=1460 [TCP segment of a reassembled PDU]"
"427","516.128339","10.152.152.11","5.9.28.6","TCP","1514","49655  >  5222 [ACK] Seq=167270 Ack=35490 Win=4999 Len=1460 [TCP segment of a reassembled PDU]"
"428","516.128365","10.152.152.11","5.9.28.6","TCP","1311","49655  >  5222 [PSH, ACK] Seq=168730 Ack=35490 Win=4999 Len=1257 [TCP segment of a reassembled PDU]"
"429","516.128263","5.9.28.6","10.152.152.11","TCP","60","5222  >  49655 [ACK] Seq=35490 Ack=159970 Win=5739 Len=0"
"430","516.128282","5.9.28.6","10.152.152.11","TCP","60","5222  >  49655 [ACK] Seq=35490 Ack=161430 Win=5739 Len=0"
"431","516.128291","5.9.28.6","10.152.152.11","TCP","60","5222  >  49655 [ACK] Seq=35490 Ack=162890 Win=5688 Len=0"
"432","516.128297","5.9.28.6","10.152.152.11","TCP","60","5222  >  49655 [ACK] Seq=35490 Ack=164350 Win=5618 Len=0"
"433","516.128303","5.9.28.6","10.152.152.11","TCP","60","5222  >  49655 [ACK] Seq=35490 Ack=165810 Win=5548 Len=0"
"434","516.128308","5.9.28.6","10.152.152.11","TCP","60","5222  >  49655 [ACK] Seq=35490 Ack=167270 Win=5478 Len=0"
"435","516.128313","5.9.28.6","10.152.152.11","TCP","60","5222  >  49655 [ACK] Seq=35490 Ack=168730 Win=5408 Len=0"
"436","516.128318","5.9.28.6","10.152.152.11","TCP","60","5222  >  49655 [ACK] Seq=35490 Ack=169987 Win=5338 Len=0"
"437","517.369763","5.9.28.6","10.152.152.11","TCP","552","5222  >  49655 [PSH, ACK] Seq=35490 Ack=169987 Win=5739 Len=498 [TCP segment of a reassembled PDU]"
"438","517.369855","10.152.152.11","5.9.28.6","TCP","54","49655  >  5222 [ACK] Seq=169987 Ack=35988 Win=4999 Len=0"
"439","517.482774","5.9.28.6","10.152.152.11","TCP","297","5222  >  49655 [PSH, ACK] Seq=35988 Ack=169987 Win=5739 Len=243 [TCP segment of a reassembled PDU]"
"440","517.482800","10.152.152.11","5.9.28.6","TCP","54","49655  >  5222 [ACK] Seq=169987 Ack=36231 Win=4999 Len=0"
"441","519.695389","5.9.28.6","10.152.152.11","TCP","552","5222  >  49655 [PSH, ACK] Seq=36231 Ack=169987 Win=5739 Len=498 [TCP segment of a reassembled PDU]"
"442","519.695424","10.152.152.11","5.9.28.6","TCP","54","49655  >  5222 [ACK] Seq=169987 Ack=36729 Win=4999 Len=0"
"443","519.806906","5.9.28.6","10.152.152.11","TCP","489","5222  >  49655 [PSH, ACK] Seq=36729 Ack=169987 Win=5739 Len=435 [TCP segment of a reassembled PDU]"
"444","519.806986","10.152.152.11","5.9.28.6","TCP","54","49655  >  5222 [ACK] Seq=169987 Ack=37164 Win=4999 Len=0"
"445","528.878156","10.152.152.11","5.9.28.6","TCP","1514","49655  >  5222 [ACK] Seq=169987 Ack=37164 Win=4999 Len=1460 [TCP segment of a reassembled PDU]"
"446","528.878212","10.152.152.11","5.9.28.6","TCP","1514","49655  >  5222 [ACK] Seq=171447 Ack=37164 Win=4999 Len=1460 [TCP segment of a reassembled PDU]"
"447","528.878224","10.152.152.11","5.9.28.6","TCP","1514","49655  >  5222 [ACK] Seq=172907 Ack=37164 Win=4999 Len=1460 [TCP segment of a reassembled PDU]"
"448","528.878235","10.152.152.11","5.9.28.6","TCP","1514","49655  >  5222 [ACK] Seq=174367 Ack=37164 Win=4999 Len=1460 [TCP segment of a reassembled PDU]"
"449","528.878255","10.152.152.11","5.9.28.6","TCP","1514","49655  >  5222 [ACK] Seq=175827 Ack=37164 Win=4999 Len=1460 [TCP segment of a reassembled PDU]"
"450","528.878279","10.152.152.11","5.9.28.6","TCP","1514","49655  >  5222 [ACK] Seq=177287 Ack=37164 Win=4999 Len=1460 [TCP segment of a reassembled PDU]"
"451","528.878291","10.152.152.11","5.9.28.6","TCP","1514","49655  >  5222 [ACK] Seq=178747 Ack=37164 Win=4999 Len=1460 [TCP segment of a reassembled PDU]"
"452","528.878310","10.152.152.11","5.9.28.6","TCP","1514","49655  >  5222 [ACK] Seq=180207 Ack=37164 Win=4999 Len=1460 [TCP segment of a reassembled PDU]"
"453","528.878332","10.152.152.11","5.9.28.6","TCP","347","49655  >  5222 [PSH, ACK] Seq=181667 Ack=37164 Win=4999 Len=293 [TCP segment of a reassembled PDU]"
"454","528.878188","5.9.28.6","10.152.152.11","TCP","60","5222  >  49655 [ACK] Seq=37164 Ack=171447 Win=5739 Len=0"
"455","528.878202","5.9.28.6","10.152.152.11","TCP","60","5222  >  49655 [ACK] Seq=37164 Ack=172907 Win=5739 Len=0"
"456","528.878207","5.9.28.6","10.152.152.11","TCP","60","5222  >  49655 [ACK] Seq=37164 Ack=174367 Win=5688 Len=0"
"457","528.878212","5.9.28.6","10.152.152.11","TCP","60","5222  >  49655 [ACK] Seq=37164 Ack=175827 Win=5618 Len=0"
"458","528.878261","5.9.28.6","10.152.152.11","TCP","60","5222  >  49655 [ACK] Seq=37164 Ack=177287 Win=5548 Len=0"
"459","528.878267","5.9.28.6","10.152.152.11","TCP","60","5222  >  49655 [ACK] Seq=37164 Ack=178747 Win=5478 Len=0"
"460","528.878271","5.9.28.6","10.152.152.11","TCP","60","5222  >  49655 [ACK] Seq=37164 Ack=180207 Win=5408 Len=0"
"461","528.878321","5.9.28.6","10.152.152.11","TCP","60","5222  >  49655 [ACK] Seq=37164 Ack=181667 Win=5338 Len=0"
"462","528.878326","5.9.28.6","10.152.152.11","TCP","60","5222  >  49655 [ACK] Seq=37164 Ack=181960 Win=5320 Len=0"
"463","530.271730","5.9.28.6","10.152.152.11","TCP","552","5222  >  49655 [PSH, ACK] Seq=37164 Ack=181960 Win=5739 Len=498 [TCP segment of a reassembled PDU]"
"464","530.271760","10.152.152.11","5.9.28.6","TCP","54","49655  >  5222 [ACK] Seq=181960 Ack=37662 Win=4999 Len=0"
"465","530.372759","5.9.28.6","10.152.152.11","TCP","297","5222  >  49655 [PSH, ACK] Seq=37662 Ack=181960 Win=5739 Len=243 [TCP segment of a reassembled PDU]"
"466","530.372784","10.152.152.11","5.9.28.6","TCP","54","49655  >  5222 [ACK] Seq=181960 Ack=37905 Win=4999 Len=0"
"467","532.059589","5.9.28.6","10.152.152.11","TCP","552","5222  >  49655 [PSH, ACK] Seq=37905 Ack=181960 Win=5739 Len=498 [TCP segment of a reassembled PDU]"
"468","532.059614","10.152.152.11","5.9.28.6","TCP","54","49655  >  5222 [ACK] Seq=181960 Ack=38403 Win=4999 Len=0"
"469","532.170808","5.9.28.6","10.152.152.11","TCP","489","5222  >  49655 [PSH, ACK] Seq=38403 Ack=181960 Win=5739 Len=435 [TCP segment of a reassembled PDU]"
"470","532.170850","10.152.152.11","5.9.28.6","TCP","54","49655  >  5222 [ACK] Seq=181960 Ack=38838 Win=4999 Len=0"
"471","539.831774","10.152.152.11","5.9.28.6","TCP","1514","49655  >  5222 [ACK] Seq=181960 Ack=38838 Win=4999 Len=1460 [TCP segment of a reassembled PDU]"
"472","539.831887","10.152.152.11","5.9.28.6","TCP","1514","49655  >  5222 [ACK] Seq=183420 Ack=38838 Win=4999 Len=1460 [TCP segment of a reassembled PDU]"
"473","539.831987","10.152.152.11","5.9.28.6","TCP","1514","49655  >  5222 [ACK] Seq=184880 Ack=38838 Win=4999 Len=1460 [TCP segment of a reassembled PDU]"
"474","539.832122","5.9.28.6","10.152.152.11","TCP","60","5222  >  49655 [ACK] Seq=38838 Ack=183420 Win=5739 Len=0"
"475","539.832131","5.9.28.6","10.152.152.11","TCP","60","5222  >  49655 [ACK] Seq=38838 Ack=184880 Win=5739 Len=0"
"476","539.832235","5.9.28.6","10.152.152.11","TCP","60","5222  >  49655 [ACK] Seq=38838 Ack=186340 Win=5688 Len=0"
"477","539.832282","10.152.152.11","5.9.28.6","TCP","1514","49655  >  5222 [ACK] Seq=186340 Ack=38838 Win=4999 Len=1460 [TCP segment of a reassembled PDU]"
"478","539.832355","10.152.152.11","5.9.28.6","TCP","1514","49655  >  5222 [ACK] Seq=187800 Ack=38838 Win=4999 Len=1460 [TCP segment of a reassembled PDU]"
"479","539.832426","5.9.28.6","10.152.152.11","TCP","60","5222  >  49655 [ACK] Seq=38838 Ack=187800 Win=5739 Len=0"
"480","539.832584","5.9.28.6","10.152.152.11","TCP","60","5222  >  49655 [ACK] Seq=38838 Ack=189260 Win=5739 Len=0"
"481","539.832659","10.152.152.11","5.9.28.6","TCP","1514","49655  >  5222 [ACK] Seq=189260 Ack=38838 Win=4999 Len=1460 [TCP segment of a reassembled PDU]"
"482","539.832767","5.9.28.6","10.152.152.11","TCP","60","5222  >  49655 [ACK] Seq=38838 Ack=190720 Win=5688 Len=0"
"483","539.832799","10.152.152.11","5.9.28.6","TCP","1514","49655  >  5222 [ACK] Seq=190720 Ack=38838 Win=4999 Len=1460 [TCP segment of a reassembled PDU]"
"484","539.832904","5.9.28.6","10.152.152.11","TCP","60","5222  >  49655 [ACK] Seq=38838 Ack=192180 Win=5739 Len=0"
"485","539.832922","10.152.152.11","5.9.28.6","TCP","1514","49655  >  5222 [ACK] Seq=192180 Ack=38838 Win=4999 Len=1460 [TCP segment of a reassembled PDU]"
"486","539.833030","5.9.28.6","10.152.152.11","TCP","60","5222  >  49655 [ACK] Seq=38838 Ack=193640 Win=5739 Len=0"
"487","539.833061","10.152.152.11","5.9.28.6","TCP","1514","49655  >  5222 [ACK] Seq=193640 Ack=38838 Win=4999 Len=1460 [TCP segment of a reassembled PDU]"
"488","539.833165","5.9.28.6","10.152.152.11","TCP","60","5222  >  49655 [ACK] Seq=38838 Ack=195100 Win=5688 Len=0"
"489","539.833186","10.152.152.11","5.9.28.6","TCP","1514","49655  >  5222 [ACK] Seq=195100 Ack=38838 Win=4999 Len=1460 [TCP segment of a reassembled PDU]"
"490","539.833289","5.9.28.6","10.152.152.11","TCP","60","5222  >  49655 [ACK] Seq=38838 Ack=196560 Win=5618 Len=0"
"491","539.833352","10.152.152.11","5.9.28.6","TCP","371","49655  >  5222 [PSH, ACK] Seq=196560 Ack=38838 Win=4999 Len=317 [TCP segment of a reassembled PDU]"
"492","539.833457","5.9.28.6","10.152.152.11","TCP","60","5222  >  49655 [ACK] Seq=38838 Ack=196877 Win=5739 Len=0"
"493","541.087568","5.9.28.6","10.152.152.11","TCP","552","5222  >  49655 [PSH, ACK] Seq=38838 Ack=196877 Win=5739 Len=498 [TCP segment of a reassembled PDU]"
"494","541.087633","10.152.152.11","5.9.28.6","TCP","54","49655  >  5222 [ACK] Seq=196877 Ack=39336 Win=4999 Len=0"
"495","541.199683","5.9.28.6","10.152.152.11","TCP","297","5222  >  49655 [PSH, ACK] Seq=39336 Ack=196877 Win=5739 Len=243 [TCP segment of a reassembled PDU]"
"496","541.199761","10.152.152.11","5.9.28.6","TCP","54","49655  >  5222 [ACK] Seq=196877 Ack=39579 Win=4999 Len=0"
"497","542.686458","5.9.28.6","10.152.152.11","TCP","552","5222  >  49655 [PSH, ACK] Seq=39579 Ack=196877 Win=5739 Len=498 [TCP segment of a reassembled PDU]"
"498","542.686538","10.152.152.11","5.9.28.6","TCP","54","49655  >  5222 [ACK] Seq=196877 Ack=40077 Win=4999 Len=0"
"499","542.799036","5.9.28.6","10.152.152.11","TCP","489","5222  >  49655 [PSH, ACK] Seq=40077 Ack=196877 Win=5739 Len=435 [TCP segment of a reassembled PDU]"
"500","542.799067","10.152.152.11","5.9.28.6","TCP","54","49655  >  5222 [ACK] Seq=196877 Ack=40512 Win=4999 Len=0"
"501","549.946122","5.9.28.6","10.152.152.11","TCP","552","5222  >  49655 [PSH, ACK] Seq=40512 Ack=196877 Win=5739 Len=498 [TCP segment of a reassembled PDU]"
"502","549.946156","10.152.152.11","5.9.28.6","TCP","54","49655  >  5222 [ACK] Seq=196877 Ack=41010 Win=4999 Len=0"
"503","550.057324","5.9.28.6","10.152.152.11","TCP","489","5222  >  49655 [PSH, ACK] Seq=41010 Ack=196877 Win=5739 Len=435 [TCP segment of a reassembled PDU]"
"504","550.057350","10.152.152.11","5.9.28.6","TCP","54","49655  >  5222 [ACK] Seq=196877 Ack=41445 Win=4999 Len=0"
"505","563.954739","5.9.28.6","10.152.152.11","TCP","552","5222  >  49655 [PSH, ACK] Seq=41445 Ack=196877 Win=5739 Len=498 [TCP segment of a reassembled PDU]"
"506","563.954776","10.152.152.11","5.9.28.6","TCP","54","49655  >  5222 [ACK] Seq=196877 Ack=41943 Win=4999 Len=0"
"507","564.067075","5.9.28.6","10.152.152.11","TCP","489","5222  >  49655 [PSH, ACK] Seq=41943 Ack=196877 Win=5739 Len=435 [TCP segment of a reassembled PDU]"
"508","564.067108","10.152.152.11","5.9.28.6","TCP","54","49655  >  5222 [ACK] Seq=196877 Ack=42378 Win=4999 Len=0"
"509","603.271393","10.152.152.11","5.9.28.6","TCP","171","49655  >  5222 [PSH, ACK] Seq=196877 Ack=42378 Win=4999 Len=117 [TCP segment of a reassembled PDU]"
"510","603.271496","5.9.28.6","10.152.152.11","TCP","60","5222  >  49655 [ACK] Seq=42378 Ack=196994 Win=5739 Len=0"
"511","605.620859","5.9.28.6","10.152.152.11","TCP","552","5222  >  49655 [PSH, ACK] Seq=42378 Ack=196994 Win=5739 Len=498 [TCP segment of a reassembled PDU]"
"512","605.620951","10.152.152.11","5.9.28.6","TCP","54","49655  >  5222 [ACK] Seq=196994 Ack=42876 Win=4999 Len=0"
"513","605.685200","5.9.28.6","10.152.152.11","TCP","393","5222  >  49655 [PSH, ACK] Seq=42876 Ack=196994 Win=5739 Len=339 [TCP segment of a reassembled PDU]"
"514","605.685234","10.152.152.11","5.9.28.6","TCP","54","49655  >  5222 [ACK] Seq=196994 Ack=43215 Win=4999 Len=0"
"515","608.275025","PcsCompu_11:4d:b1","PcsCompu_78:57:ca","ARP","42","Who has 10.152.152.10? Tell 10.152.152.11"
"516","608.275228","PcsCompu_78:57:ca","PcsCompu_11:4d:b1","ARP","60","10.152.152.10 is at 08:00:27:78:57:ca"
"517","663.272419","10.152.152.11","5.9.28.6","TCP","171","49655  >  5222 [PSH, ACK] Seq=196994 Ack=43215 Win=4999 Len=117 [TCP segment of a reassembled PDU]"
"518","663.272677","5.9.28.6","10.152.152.11","TCP","60","5222  >  49655 [ACK] Seq=43215 Ack=197111 Win=5739 Len=0"
"519","663.521073","5.9.28.6","10.152.152.11","TCP","203","5222  >  49655 [PSH, ACK] Seq=43215 Ack=197111 Win=5739 Len=149 [TCP segment of a reassembled PDU]"
"520","663.521168","10.152.152.11","5.9.28.6","TCP","54","49655  >  5222 [ACK] Seq=197111 Ack=43364 Win=4999 Len=0"
"521","668.275065","PcsCompu_11:4d:b1","PcsCompu_78:57:ca","ARP","42","Who has 10.152.152.10? Tell 10.152.152.11"
"522","668.275262","PcsCompu_78:57:ca","PcsCompu_11:4d:b1","ARP","60","10.152.152.10 is at 08:00:27:78:57:ca"
"523","723.273920","10.152.152.11","5.9.28.6","TCP","171","49655  >  5222 [PSH, ACK] Seq=197111 Ack=43364 Win=4999 Len=117 [TCP segment of a reassembled PDU]"
"524","723.274379","5.9.28.6","10.152.152.11","TCP","60","5222  >  49655 [ACK] Seq=43364 Ack=197228 Win=5739 Len=0"
"525","723.554134","5.9.28.6","10.152.152.11","TCP","203","5222  >  49655 [PSH, ACK] Seq=43364 Ack=197228 Win=5739 Len=149 [TCP segment of a reassembled PDU]"
"526","723.554226","10.152.152.11","5.9.28.6","TCP","54","49655  >  5222 [ACK] Seq=197228 Ack=43513 Win=4999 Len=0"
