"No.","Time","Source","Destination","Protocol","Length","Info"
"1","0.000000","10.152.152.11","173.194.121.31","TCP","54","42907  >  443 [ACK] Seq=1 Ack=1 Win=10542 Len=0"
"2","0.001134","173.194.121.31","10.152.152.11","TCP","60","[TCP ACKed unseen segment] 443  >  42907 [ACK] Seq=1 Ack=2 Win=2181 Len=0"
"3","0.265125","10.152.152.11","74.125.228.238","TCP","1514","52161  >  443 [ACK] Seq=1 Ack=1 Win=9412 Len=1460 [TCP segment of a reassembled PDU]"
"4","0.265595","10.152.152.11","74.125.228.238","TLSv1.1","935","Application Data"
"5","0.265801","10.152.152.11","74.125.228.238","TLSv1.1","123","Application Data"
"6","0.265971","10.152.152.11","74.125.228.238","TLSv1.1","651","Application Data"
"7","0.266567","74.125.228.238","10.152.152.11","TCP","60","443  >  52161 [ACK] Seq=1 Ack=1461 Win=2640 Len=0"
"8","0.266594","74.125.228.238","10.152.152.11","TCP","60","443  >  52161 [ACK] Seq=1 Ack=2342 Win=2640 Len=0"
"9","0.266596","74.125.228.238","10.152.152.11","TCP","60","443  >  52161 [ACK] Seq=1 Ack=2411 Win=2639 Len=0"
"10","0.266605","74.125.228.238","10.152.152.11","TCP","60","443  >  52161 [ACK] Seq=1 Ack=3008 Win=2602 Len=0"
"11","0.756832","74.125.228.238","10.152.152.11","TLSv1.1","123","Application Data"
"12","0.797254","10.152.152.11","74.125.228.238","TCP","54","52161  >  443 [ACK] Seq=3008 Ack=70 Win=9412 Len=0"
"13","0.946916","74.125.70.189","10.152.152.11","TLSv1.1","523","Application Data"
"14","0.946952","10.152.152.11","74.125.70.189","TCP","54","37822  >  443 [ACK] Seq=1 Ack=470 Win=2640 Len=0"
"15","0.946977","74.125.228.238","10.152.152.11","TLSv1.1","378","Application Data, Application Data, Application Data, Application Data"
"16","0.946982","10.152.152.11","74.125.228.238","TCP","54","52161  >  443 [ACK] Seq=3008 Ack=394 Win=9412 Len=0"
"17","0.951542","10.152.152.11","74.125.228.238","TLSv1.1","123","Application Data"
"18","0.953160","74.125.228.238","10.152.152.11","TCP","60","443  >  52161 [ACK] Seq=394 Ack=3077 Win=2640 Len=0"
"19","2.816005","10.152.152.11","173.194.121.7","TCP","54","56094  >  443 [ACK] Seq=1 Ack=1 Win=2640 Len=0"
"20","2.817001","173.194.121.7","10.152.152.11","TCP","60","[TCP ACKed unseen segment] 443  >  56094 [ACK] Seq=1 Ack=2 Win=2640 Len=0"
"21","2.943875","10.152.152.11","173.194.121.26","TCP","54","48884  >  443 [ACK] Seq=1 Ack=1 Win=2190 Len=0"
"22","2.944256","173.194.121.26","10.152.152.11","TCP","60","[TCP ACKed unseen segment] 443  >  48884 [ACK] Seq=1 Ack=2 Win=1166 Len=0"
"23","3.692170","10.152.152.11","173.194.121.3","GQUIC","1392","Client Hello, PKN: 1, CID: 2097941014835512147"
"24","3.693879","10.152.152.11","173.194.121.3","TCP","1514","36625  >  443 [ACK] Seq=1 Ack=1 Win=2008 Len=1460 [TCP segment of a reassembled PDU]"
"25","3.694035","10.152.152.11","173.194.121.3","TLSv1.1","919","Application Data"
"26","3.694223","10.152.152.11","173.194.121.3","TLSv1.1","123","Application Data"
"27","3.694430","10.152.152.11","173.194.121.3","TCP","1514","36625  >  443 [ACK] Seq=2395 Ack=1 Win=2008 Len=1460 [TCP segment of a reassembled PDU]"
"28","3.694554","10.152.152.11","173.194.121.3","TLSv1.1","1511","Application Data"
"29","3.694795","173.194.121.3","10.152.152.11","TCP","60","443  >  36625 [ACK] Seq=1 Ack=1461 Win=2640 Len=0"
"30","3.694817","173.194.121.3","10.152.152.11","TCP","60","443  >  36625 [ACK] Seq=1 Ack=2326 Win=2822 Len=0"
"31","3.694821","173.194.121.3","10.152.152.11","TCP","60","443  >  36625 [ACK] Seq=1 Ack=2395 Win=2822 Len=0"
"32","3.694931","10.152.152.11","173.194.121.3","TCP","1514","36625  >  443 [ACK] Seq=5312 Ack=1 Win=2008 Len=1460 [TCP segment of a reassembled PDU]"
"33","3.694956","173.194.121.3","10.152.152.11","TCP","60","443  >  36625 [ACK] Seq=1 Ack=3855 Win=2787 Len=0"
"34","3.694959","173.194.121.3","10.152.152.11","TCP","60","443  >  36625 [ACK] Seq=1 Ack=5312 Win=2717 Len=0"
"35","3.695018","10.152.152.11","173.194.121.3","TLSv1.1","1511","Application Data"
"36","3.695222","10.152.152.11","173.194.121.3","TCP","1514","36625  >  443 [ACK] Seq=8229 Ack=1 Win=2008 Len=1460 [TCP segment of a reassembled PDU]"
"37","3.695322","10.152.152.11","173.194.121.3","TLSv1.1","1511","Application Data"
"38","3.695377","173.194.121.3","10.152.152.11","TCP","60","443  >  36625 [ACK] Seq=1 Ack=6772 Win=2858 Len=0"
"39","3.695386","173.194.121.3","10.152.152.11","TCP","60","443  >  36625 [ACK] Seq=1 Ack=8229 Win=2809 Len=0"
"40","3.695739","173.194.121.3","10.152.152.11","TCP","60","443  >  36625 [ACK] Seq=1 Ack=9689 Win=2739 Len=0"
"41","3.695744","173.194.121.3","10.152.152.11","TCP","60","443  >  36625 [ACK] Seq=1 Ack=11146 Win=2669 Len=0"
"42","3.695819","10.152.152.11","173.194.121.3","TCP","1514","36625  >  443 [ACK] Seq=11146 Ack=1 Win=2008 Len=1460 [TCP segment of a reassembled PDU]"
"43","3.695919","10.152.152.11","173.194.121.3","TLSv1.1","1511","Application Data"
"44","3.696301","173.194.121.3","10.152.152.11","TCP","60","443  >  36625 [ACK] Seq=1 Ack=12606 Win=2858 Len=0"
"45","3.696306","173.194.121.3","10.152.152.11","TCP","60","443  >  36625 [ACK] Seq=1 Ack=14063 Win=2809 Len=0"
"46","3.696388","10.152.152.11","173.194.121.3","TCP","1514","36625  >  443 [ACK] Seq=14063 Ack=1 Win=2008 Len=1460 [TCP segment of a reassembled PDU]"
"47","3.696458","10.152.152.11","173.194.121.3","TLSv1.1","1511","Application Data"
"48","3.696847","10.152.152.11","173.194.121.3","TLSv1.1","795","Application Data"
"49","3.696983","173.194.121.3","10.152.152.11","TCP","60","443  >  36625 [ACK] Seq=1 Ack=15523 Win=2739 Len=0"
"50","3.696985","173.194.121.3","10.152.152.11","TCP","60","443  >  36625 [ACK] Seq=1 Ack=16980 Win=2669 Len=0"
"51","3.697177","173.194.121.3","10.152.152.11","TCP","60","443  >  36625 [ACK] Seq=1 Ack=17721 Win=2623 Len=0"
"52","3.809048","10.152.152.11","173.194.121.7","TCP","1514","56096  >  443 [ACK] Seq=1 Ack=1 Win=2640 Len=1460 [TCP segment of a reassembled PDU]"
"53","3.809351","173.194.121.7","10.152.152.11","TCP","60","443  >  56096 [ACK] Seq=1 Ack=1461 Win=2640 Len=0"
"54","3.809446","10.152.152.11","173.194.121.7","TLSv1.1","935","Application Data"
"55","3.809928","10.152.152.11","173.194.121.7","TLSv1.1","123","Application Data"
"56","3.810169","10.152.152.11","173.194.121.7","TLSv1.1","251","Application Data"
"57","3.810569","173.194.121.7","10.152.152.11","TCP","60","443  >  56096 [ACK] Seq=1 Ack=2342 Win=2640 Len=0"
"58","3.810692","173.194.121.7","10.152.152.11","TCP","60","443  >  56096 [ACK] Seq=1 Ack=2411 Win=2639 Len=0"
"59","3.810698","173.194.121.7","10.152.152.11","TCP","60","443  >  56096 [ACK] Seq=1 Ack=2608 Win=2627 Len=0"
"60","3.842744","10.152.152.11","173.194.121.3","GQUIC","1392","Client Hello, PKN: 2, CID: 2097941014835512147"
"61","4.144075","10.152.152.11","173.194.121.3","GQUIC","1392","Client Hello, PKN: 3, CID: 2097941014835512147"
"62","4.232499","173.194.121.3","10.152.152.11","TLSv1.1","123","Application Data"
"63","4.271628","10.152.152.11","173.194.121.3","TCP","54","36625  >  443 [ACK] Seq=17721 Ack=70 Win=2008 Len=0"
"64","4.422318","173.194.121.3","10.152.152.11","TLSv1.1","325","Application Data, Application Data, Application Data"
"65","4.422355","10.152.152.11","173.194.121.3","TCP","54","36625  >  443 [ACK] Seq=17721 Ack=341 Win=2190 Len=0"
"66","4.422432","173.194.121.7","10.152.152.11","TLSv1.1","123","Application Data"
"67","4.429223","10.152.152.11","173.194.121.3","TLSv1.1","123","Application Data"
"68","4.429876","173.194.121.3","10.152.152.11","TCP","60","443  >  36625 [ACK] Seq=341 Ack=17790 Win=2858 Len=0"
"69","4.459797","10.152.152.11","173.194.121.7","TCP","54","56096  >  443 [ACK] Seq=2608 Ack=70 Win=2640 Len=0"
"70","4.569072","173.194.121.7","10.152.152.11","TLSv1.1","469","Application Data, Application Data, Application Data"
"71","4.569116","10.152.152.11","173.194.121.7","TCP","54","56096  >  443 [ACK] Seq=2608 Ack=485 Win=2640 Len=0"
"72","4.573583","10.152.152.11","173.194.121.7","TLSv1.1","123","Application Data"
"73","4.573796","173.194.121.7","10.152.152.11","TCP","60","443  >  56096 [ACK] Seq=485 Ack=2677 Win=2640 Len=0"
"74","4.744957","10.152.152.11","173.194.121.3","GQUIC","1392","Client Hello, PKN: 4, CID: 2097941014835512147"
"75","5.120379","10.152.152.11","216.58.192.3","TCP","54","33578  >  443 [ACK] Seq=1 Ack=1 Win=1315 Len=0"
"76","5.120676","216.58.192.3","10.152.152.11","TCP","60","[TCP ACKed unseen segment] 443  >  33578 [ACK] Seq=1 Ack=2 Win=1516 Len=0"
"77","5.887566","10.152.152.11","173.194.43.71","TCP","54","34759  >  443 [ACK] Seq=1 Ack=1 Win=6531 Len=0"
"78","5.888687","173.194.43.71","10.152.152.11","TCP","60","[TCP ACKed unseen segment] 443  >  34759 [ACK] Seq=1 Ack=2 Win=2640 Len=0"
"79","5.947600","10.152.152.11","173.194.121.3","GQUIC","1392","Client Hello, PKN: 5, CID: 2097941014835512147"
"80","6.128365","74.125.70.189","10.152.152.11","TLSv1.1","523","Application Data"
"81","6.128481","10.152.152.11","74.125.70.189","TCP","54","37822  >  443 [ACK] Seq=1 Ack=939 Win=2640 Len=0"
"82","7.048357","10.152.152.11","173.194.121.7","TCP","1514","56096  >  443 [ACK] Seq=2677 Ack=485 Win=2640 Len=1460 [TCP segment of a reassembled PDU]"
"83","7.049505","173.194.121.7","10.152.152.11","TCP","60","443  >  56096 [ACK] Seq=485 Ack=4137 Win=2640 Len=0"
"84","7.049553","10.152.152.11","173.194.121.7","TLSv1.1","983","Application Data"
"85","7.049823","10.152.152.11","173.194.121.7","TLSv1.1","251","Application Data"
"86","7.050284","173.194.121.7","10.152.152.11","TCP","60","443  >  56096 [ACK] Seq=485 Ack=5066 Win=2640 Len=0"
"87","7.050284","173.194.121.7","10.152.152.11","TCP","60","443  >  56096 [ACK] Seq=485 Ack=5263 Win=2628 Len=0"
"88","7.053842","10.152.152.11","173.194.121.7","TCP","1514","56096  >  443 [ACK] Seq=5263 Ack=485 Win=2640 Len=1460 [TCP segment of a reassembled PDU]"
"89","7.053949","10.152.152.11","173.194.121.7","TLSv1.1","983","Application Data"
"90","7.054353","173.194.121.7","10.152.152.11","TCP","60","443  >  56096 [ACK] Seq=485 Ack=6723 Win=2640 Len=0"
"91","7.054446","10.152.152.11","173.194.121.7","TLSv1.1","267","Application Data"
"92","7.054644","173.194.121.7","10.152.152.11","TCP","60","443  >  56096 [ACK] Seq=485 Ack=7652 Win=2591 Len=0"
"93","7.054652","173.194.121.7","10.152.152.11","TCP","60","443  >  56096 [ACK] Seq=485 Ack=7865 Win=2640 Len=0"
"94","7.480035","173.194.121.7","10.152.152.11","TLSv1.1","373","Application Data, Application Data, Application Data"
"95","7.487153","10.152.152.11","173.194.121.7","TLSv1.1","123","Application Data"
"96","7.487252","173.194.121.7","10.152.152.11","TCP","60","443  >  56096 [ACK] Seq=804 Ack=7934 Win=2640 Len=0"
"97","7.629296","74.125.70.189","10.152.152.11","TLSv1.1","523","Application Data"
"98","7.629337","10.152.152.11","74.125.70.189","TCP","54","37822  >  443 [ACK] Seq=1 Ack=1408 Win=2640 Len=0"
"99","7.694282","10.152.152.11","173.194.121.3","GQUIC","85","Payload (Encrypted), PKN: 6, CID: 2097941014835512147"
"100","7.819610","173.194.121.7","10.152.152.11","TLSv1.1","357","Application Data, Application Data, Application Data"
"101","7.820591","74.125.70.189","10.152.152.11","TLSv1.1","539","Application Data"
"102","7.820613","10.152.152.11","74.125.70.189","TCP","54","37822  >  443 [ACK] Seq=1 Ack=1893 Win=2640 Len=0"
"103","7.827080","10.152.152.11","173.194.121.7","TLSv1.1","123","Application Data"
"104","7.828060","173.194.121.7","10.152.152.11","TCP","60","443  >  56096 [ACK] Seq=1107 Ack=8003 Win=2640 Len=0"
"105","7.936010","10.152.152.11","173.194.121.31","TCP","54","42899  >  443 [ACK] Seq=1 Ack=1 Win=4887 Len=0"
"106","7.936833","173.194.121.31","10.152.152.11","TCP","60","[TCP ACKed unseen segment] 443  >  42899 [ACK] Seq=1 Ack=2 Win=1315 Len=0"
"107","9.201009","74.125.70.189","10.152.152.11","TLSv1.1","523","Application Data"
"108","9.201061","10.152.152.11","74.125.70.189","TCP","54","37822  >  443 [ACK] Seq=1 Ack=2362 Win=2640 Len=0"
"109","9.215582","10.152.152.11","173.194.121.17","TCP","54","54777  >  443 [ACK] Seq=1 Ack=1 Win=2640 Len=0"
"110","9.216294","173.194.121.17","10.152.152.11","TCP","60","[TCP ACKed unseen segment] 443  >  54777 [ACK] Seq=1 Ack=2 Win=2640 Len=0"
"111","11.127796","74.125.70.189","10.152.152.11","TLSv1.1","523","Application Data"
"112","11.127866","10.152.152.11","74.125.70.189","TCP","54","37822  >  443 [ACK] Seq=1 Ack=2831 Win=2640 Len=0"
"113","11.647275","10.152.152.11","74.125.136.120","TCP","54","39907  >  443 [ACK] Seq=1 Ack=1 Win=2008 Len=0"
"114","11.647656","74.125.136.120","10.152.152.11","TCP","60","[TCP ACKed unseen segment] 443  >  39907 [ACK] Seq=1 Ack=2 Win=1248 Len=0"
"115","11.903730","10.152.152.11","173.194.121.0","TCP","54","48624  >  443 [ACK] Seq=1 Ack=1 Win=2640 Len=0"
"116","11.904893","173.194.121.0","10.152.152.11","TCP","60","[TCP ACKed unseen segment] 443  >  48624 [ACK] Seq=1 Ack=2 Win=2640 Len=0"
"117","12.127034","10.152.152.11","173.194.121.0","TCP","54","48619  >  443 [ACK] Seq=1 Ack=1 Win=2640 Len=0"
"118","12.127988","173.194.121.0","10.152.152.11","TCP","60","[TCP ACKed unseen segment] 443  >  48619 [ACK] Seq=1 Ack=2 Win=2640 Len=0"
"119","13.951906","10.152.152.11","173.194.121.11","TCP","54","49580  >  443 [ACK] Seq=1 Ack=1 Win=2640 Len=0"
"120","13.952275","173.194.121.11","10.152.152.11","TCP","60","[TCP ACKed unseen segment] 443  >  49580 [ACK] Seq=1 Ack=2 Win=1114 Len=0"
"121","14.608726","74.125.70.189","10.152.152.11","TLSv1.1","523","Application Data"
"122","14.608787","10.152.152.11","74.125.70.189","TCP","54","37822  >  443 [ACK] Seq=1 Ack=3300 Win=2640 Len=0"
"123","16.205339","74.125.70.189","10.152.152.11","TLSv1.1","523","Application Data"
"124","16.205408","10.152.152.11","74.125.70.189","TCP","54","37822  >  443 [ACK] Seq=1 Ack=3769 Win=2640 Len=0"
"125","19.007104","74.125.70.189","10.152.152.11","TLSv1.1","523","Application Data"
"126","19.007167","10.152.152.11","74.125.70.189","TCP","54","37822  >  443 [ACK] Seq=1 Ack=4238 Win=2640 Len=0"
"127","19.372834","74.125.70.189","10.152.152.11","TLSv1.1","523","Application Data"
"128","19.372920","10.152.152.11","74.125.70.189","TCP","54","37822  >  443 [ACK] Seq=1 Ack=4707 Win=2640 Len=0"
"129","23.551918","10.152.152.11","74.125.136.84","TCP","54","56707  >  443 [ACK] Seq=1 Ack=1 Win=2555 Len=0"
"130","23.552233","74.125.136.84","10.152.152.11","TCP","60","[TCP ACKed unseen segment] 443  >  56707 [ACK] Seq=1 Ack=2 Win=2507 Len=0"
"131","23.807301","10.152.152.11","173.194.121.0","TCP","54","48610  >  443 [ACK] Seq=1 Ack=1 Win=1825 Len=0"
"132","23.807596","173.194.121.0","10.152.152.11","TCP","60","[TCP ACKed unseen segment] 443  >  48610 [ACK] Seq=1 Ack=2 Win=1114 Len=0"
"133","24.002238","74.125.70.189","10.152.152.11","TLSv1.1","523","Application Data"
"134","24.002288","10.152.152.11","74.125.70.189","TCP","54","37822  >  443 [ACK] Seq=1 Ack=5176 Win=2640 Len=0"
"135","24.372185","74.125.70.189","10.152.152.11","TLSv1.1","523","Application Data"
"136","24.372314","10.152.152.11","74.125.70.189","TCP","54","37822  >  443 [ACK] Seq=1 Ack=5645 Win=2640 Len=0"
"137","24.703837","10.152.152.11","173.194.121.31","TCP","54","42891  >  443 [ACK] Seq=1 Ack=1 Win=2190 Len=0"
"138","24.704126","10.152.152.11","74.125.22.95","TCP","54","55733  >  443 [ACK] Seq=1 Ack=1 Win=2008 Len=0"
"139","24.704637","173.194.121.31","10.152.152.11","TCP","60","[TCP ACKed unseen segment] 443  >  42891 [ACK] Seq=1 Ack=2 Win=1114 Len=0"
"140","24.704671","74.125.22.95","10.152.152.11","TCP","60","[TCP ACKed unseen segment] 443  >  55733 [ACK] Seq=1 Ack=2 Win=1181 Len=0"
"141","24.960008","10.152.152.11","74.125.136.120","TCP","54","39882  >  443 [ACK] Seq=1 Ack=1 Win=1825 Len=0"
"142","24.961050","74.125.136.120","10.152.152.11","TCP","60","[TCP ACKed unseen segment] 443  >  39882 [ACK] Seq=1 Ack=2 Win=1114 Len=0"
"143","25.727602","10.152.152.11","173.194.43.73","TCP","54","46420  >  443 [ACK] Seq=1 Ack=1 Win=2008 Len=0"
"144","25.727831","10.152.152.11","74.125.22.95","TCP","54","55740  >  443 [ACK] Seq=1 Ack=1 Win=1825 Len=0"
"145","25.728519","173.194.43.73","10.152.152.11","TCP","60","[TCP ACKed unseen segment] 443  >  46420 [ACK] Seq=1 Ack=2 Win=1114 Len=0"
"146","25.728544","74.125.22.95","10.152.152.11","TCP","60","[TCP ACKed unseen segment] 443  >  55740 [ACK] Seq=1 Ack=2 Win=1114 Len=0"
"147","26.110964","10.152.152.11","74.125.136.84","TCP","54","56698  >  443 [ACK] Seq=1 Ack=1 Win=2640 Len=0"
"148","26.111269","74.125.136.84","10.152.152.11","TCP","60","[TCP ACKed unseen segment] 443  >  56698 [ACK] Seq=1 Ack=2 Win=1516 Len=0"
"149","27.263142","10.152.152.11","74.125.206.94","TCP","54","38348  >  443 [ACK] Seq=1 Ack=1 Win=5537 Len=0"
"150","27.263588","74.125.206.94","10.152.152.11","TCP","60","[TCP ACKed unseen segment] 443  >  38348 [ACK] Seq=1 Ack=2 Win=1823 Len=0"
"151","27.511500","10.152.152.11","173.194.121.7","TCP","1514","56096  >  443 [ACK] Seq=8003 Ack=1107 Win=2640 Len=1460 [TCP segment of a reassembled PDU]"
"152","27.512226","10.152.152.11","173.194.121.7","TLSv1.1","983","Application Data"
"153","27.512826","173.194.121.7","10.152.152.11","TCP","60","443  >  56096 [ACK] Seq=1107 Ack=9463 Win=2640 Len=0"
"154","27.512854","173.194.121.7","10.152.152.11","TCP","60","443  >  56096 [ACK] Seq=1107 Ack=10392 Win=2640 Len=0"
"155","27.512990","10.152.152.11","173.194.121.7","TLSv1.1","123","Application Data"
"156","27.513246","10.152.152.11","173.194.121.7","TLSv1.1","251","Application Data"
"157","27.513773","173.194.121.7","10.152.152.11","TCP","60","443  >  56096 [ACK] Seq=1107 Ack=10461 Win=2640 Len=0"
"158","27.513822","173.194.121.7","10.152.152.11","TCP","60","443  >  56096 [ACK] Seq=1107 Ack=10658 Win=2640 Len=0"
"159","27.952658","173.194.121.7","10.152.152.11","TLSv1.1","123","Application Data"
"160","27.991891","10.152.152.11","173.194.121.7","TCP","54","56096  >  443 [ACK] Seq=10658 Ack=1176 Win=2640 Len=0"
"161","28.139388","173.194.121.7","10.152.152.11","TLSv1.1","373","Application Data, Application Data, Application Data"
"162","28.139423","10.152.152.11","173.194.121.7","TCP","54","56096  >  443 [ACK] Seq=10658 Ack=1495 Win=2640 Len=0"
"163","28.144682","74.125.70.189","10.152.152.11","TLSv1.1","523","Application Data"
"164","28.144728","10.152.152.11","74.125.70.189","TCP","54","37822  >  443 [ACK] Seq=1 Ack=6114 Win=2640 Len=0"
"165","28.149542","10.152.152.11","173.194.121.7","TLSv1.1","123","Application Data"
"166","28.150373","173.194.121.7","10.152.152.11","TCP","60","443  >  56096 [ACK] Seq=1495 Ack=10727 Win=2640 Len=0"
"167","28.999757","74.125.70.189","10.152.152.11","TLSv1.1","523","Application Data"
"168","28.999811","10.152.152.11","74.125.70.189","TCP","54","37822  >  443 [ACK] Seq=1 Ack=6583 Win=2640 Len=0"
"169","30.636871","74.125.70.189","10.152.152.11","TLSv1.1","523","Application Data"
"170","30.636936","10.152.152.11","74.125.70.189","TCP","54","37822  >  443 [ACK] Seq=1 Ack=7052 Win=2640 Len=0"
"171","31.233027","10.152.152.11","173.194.121.14","TCP","54","55842  >  443 [ACK] Seq=1 Ack=1 Win=2640 Len=0"
"172","31.233465","173.194.121.14","10.152.152.11","TCP","60","[TCP ACKed unseen segment] 443  >  55842 [ACK] Seq=1 Ack=2 Win=2033 Len=0"
"173","32.126917","10.152.152.11","74.125.136.155","TCP","54","47134  >  443 [ACK] Seq=1 Ack=1 Win=1129 Len=0"
"174","32.127016","10.152.152.11","74.125.136.120","TCP","54","39891  >  443 [ACK] Seq=1 Ack=1 Win=5074 Len=0"
"175","32.127428","74.125.136.155","10.152.152.11","TCP","60","[TCP ACKed unseen segment] 443  >  47134 [ACK] Seq=1 Ack=2 Win=1120 Len=0"
"176","32.127453","74.125.136.120","10.152.152.11","TCP","60","[TCP ACKed unseen segment] 443  >  39891 [ACK] Seq=1 Ack=2 Win=1114 Len=0"
"177","34.001260","74.125.70.189","10.152.152.11","TLSv1.1","523","Application Data"
"178","34.001297","10.152.152.11","74.125.70.189","TCP","54","37822  >  443 [ACK] Seq=1 Ack=7521 Win=2640 Len=0"
"179","34.174924","10.152.152.11","74.125.22.188","TCP","54","48917  >  5228 [ACK] Seq=1 Ack=1 Win=2190 Len=0"
"180","34.175763","74.125.22.188","10.152.152.11","TCP","60","[TCP ACKed unseen segment] 5228  >  48917 [ACK] Seq=1 Ack=2 Win=1181 Len=0"
"181","34.431259","10.152.152.11","74.125.136.94","TCP","54","56966  >  80 [ACK] Seq=1 Ack=1 Win=984 Len=0"
"182","34.432224","74.125.136.94","10.152.152.11","TCP","60","[TCP ACKed unseen segment] 80  >  56966 [ACK] Seq=1 Ack=2 Win=1051 Len=0"
"183","35.708452","74.125.70.189","10.152.152.11","TLSv1.1","523","Application Data"
"184","35.708532","10.152.152.11","74.125.70.189","TCP","54","37822  >  443 [ACK] Seq=1 Ack=7990 Win=2640 Len=0"
"185","35.711031","10.152.152.11","173.194.121.3","TCP","54","36624  >  443 [ACK] Seq=1 Ack=1 Win=2008 Len=0"
"186","35.712184","173.194.121.3","10.152.152.11","TCP","60","[TCP ACKed unseen segment] 443  >  36624 [ACK] Seq=1 Ack=2 Win=1229 Len=0"
"187","36.481070","10.152.152.11","74.125.136.132","TCP","54","59158  >  443 [ACK] Seq=1 Ack=1 Win=2640 Len=0"
"188","36.481678","74.125.136.132","10.152.152.11","TCP","60","[TCP ACKed unseen segment] 443  >  59158 [ACK] Seq=1 Ack=2 Win=1382 Len=0"
"189","36.606952","10.152.152.11","173.194.121.31","TCP","54","34118  >  80 [ACK] Seq=1 Ack=1 Win=980 Len=0"
"190","36.607334","173.194.121.31","10.152.152.11","TCP","60","[TCP ACKed unseen segment] 80  >  34118 [ACK] Seq=1 Ack=2 Win=1052 Len=0"
"191","37.037093","74.125.70.189","10.152.152.11","TLSv1.1","1514","Application Data"
"192","37.037153","10.152.152.11","74.125.70.189","TCP","54","37822  >  443 [ACK] Seq=1 Ack=9450 Win=2640 Len=0"
"193","37.037386","74.125.70.189","10.152.152.11","TLSv1.1","1116","Application Data"
"194","37.037394","10.152.152.11","74.125.70.189","TCP","54","37822  >  443 [ACK] Seq=1 Ack=10512 Win=2591 Len=0"
"195","37.112466","10.152.152.11","74.125.70.189","TCP","1514","37822  >  443 [ACK] Seq=1 Ack=10512 Win=2640 Len=1460 [TCP segment of a reassembled PDU]"
"196","37.113054","10.152.152.11","74.125.70.189","TLSv1.1","631","Application Data"
"197","37.113269","10.152.152.11","74.125.70.189","TLSv1.1","411","Application Data"
"198","37.114805","74.125.70.189","10.152.152.11","TCP","60","443  >  37822 [ACK] Seq=10512 Ack=1461 Win=2640 Len=0"
"199","37.114805","74.125.70.189","10.152.152.11","TCP","60","443  >  37822 [ACK] Seq=10512 Ack=2038 Win=2604 Len=0"
"200","37.114805","74.125.70.189","10.152.152.11","TCP","60","443  >  37822 [ACK] Seq=10512 Ack=2395 Win=2582 Len=0"
"201","37.247701","10.152.152.11","74.125.136.113","TCP","54","52073  >  443 [ACK] Seq=1 Ack=1 Win=6703 Len=0"
"202","37.247872","74.125.136.113","10.152.152.11","TCP","60","[TCP ACKed unseen segment] 443  >  52073 [ACK] Seq=1 Ack=2 Win=2640 Len=0"
"203","37.657020","74.125.70.189","10.152.152.11","TLSv1.1","293","Application Data, Application Data, Application Data"
"204","37.657067","10.152.152.11","74.125.70.189","TCP","54","37822  >  443 [ACK] Seq=2395 Ack=10751 Win=2640 Len=0"
"205","37.664531","10.152.152.11","74.125.70.189","TLSv1.1","123","Application Data"
"206","37.665617","74.125.70.189","10.152.152.11","TCP","60","443  >  37822 [ACK] Seq=10751 Ack=2464 Win=2640 Len=0"
"207","38.999179","10.152.152.11","173.194.121.7","TCP","1514","56096  >  443 [ACK] Seq=10727 Ack=1495 Win=2640 Len=1460 [TCP segment of a reassembled PDU]"
"208","38.999221","173.194.121.7","10.152.152.11","TCP","60","443  >  56096 [ACK] Seq=1495 Ack=12187 Win=2640 Len=0"
"209","38.999991","10.152.152.11","173.194.121.7","TLSv1.1","983","Application Data"
"210","39.000210","10.152.152.11","173.194.121.7","TLSv1.1","123","Application Data"
"211","39.000375","10.152.152.11","173.194.121.7","TLSv1.1","283","Application Data"
"212","39.001098","173.194.121.7","10.152.152.11","TCP","60","443  >  56096 [ACK] Seq=1495 Ack=13116 Win=2640 Len=0"
"213","39.001103","173.194.121.7","10.152.152.11","TCP","60","443  >  56096 [ACK] Seq=1495 Ack=13185 Win=2639 Len=0"
"214","39.001139","173.194.121.7","10.152.152.11","TCP","60","443  >  56096 [ACK] Seq=1495 Ack=13414 Win=2625 Len=0"
"215","39.037727","10.152.152.11","173.194.121.7","TCP","1514","56096  >  443 [ACK] Seq=13414 Ack=1495 Win=2640 Len=1460 [TCP segment of a reassembled PDU]"
"216","39.037883","10.152.152.11","173.194.121.7","TLSv1.1","983","Application Data"
"217","39.038133","10.152.152.11","173.194.121.7","TLSv1.1","251","Application Data"
"218","39.038579","173.194.121.7","10.152.152.11","TCP","60","443  >  56096 [ACK] Seq=1495 Ack=14874 Win=2640 Len=0"
"219","39.038603","173.194.121.7","10.152.152.11","TCP","60","443  >  56096 [ACK] Seq=1495 Ack=15803 Win=2591 Len=0"
"220","39.038727","173.194.121.7","10.152.152.11","TCP","60","443  >  56096 [ACK] Seq=1495 Ack=16000 Win=2640 Len=0"
"221","39.040903","10.152.152.11","173.194.121.7","TCP","1514","56096  >  443 [ACK] Seq=16000 Ack=1495 Win=2640 Len=1460 [TCP segment of a reassembled PDU]"
"222","39.041024","10.152.152.11","173.194.121.7","TLSv1.1","983","Application Data"
"223","39.041088","173.194.121.7","10.152.152.11","TCP","60","443  >  56096 [ACK] Seq=1495 Ack=17460 Win=2640 Len=0"
"224","39.041283","10.152.152.11","173.194.121.7","TLSv1.1","267","Application Data"
"225","39.041358","173.194.121.7","10.152.152.11","TCP","60","443  >  56096 [ACK] Seq=1495 Ack=18389 Win=2640 Len=0"
"226","39.041361","173.194.121.7","10.152.152.11","TCP","60","443  >  56096 [ACK] Seq=1495 Ack=18602 Win=2627 Len=0"
"227","39.167160","10.152.152.11","173.194.43.106","TCP","54","43185  >  443 [ACK] Seq=1 Ack=1 Win=1767 Len=0"
"228","39.169188","173.194.43.106","10.152.152.11","TCP","60","[TCP ACKed unseen segment] 443  >  43185 [ACK] Seq=1 Ack=2 Win=1126 Len=0"
"229","39.231812","10.152.152.11","173.194.43.86","TCP","54","53007  >  443 [ACK] Seq=1 Ack=1 Win=16990 Len=0"
"230","39.233035","173.194.43.86","10.152.152.11","TCP","60","[TCP ACKed unseen segment] 443  >  53007 [ACK] Seq=1 Ack=2 Win=5434 Len=0"
"231","39.517239","173.194.121.7","10.152.152.11","TLSv1.1","123","Application Data"
"232","39.554936","10.152.152.11","173.194.121.7","TCP","54","56096  >  443 [ACK] Seq=18602 Ack=1564 Win=2640 Len=0"
"233","39.614928","173.194.121.7","10.152.152.11","TLSv1.1","357","Application Data, Application Data, Application Data"
"234","39.614959","10.152.152.11","173.194.121.7","TCP","54","56096  >  443 [ACK] Seq=18602 Ack=1867 Win=2640 Len=0"
"235","39.621430","10.152.152.11","173.194.121.7","TLSv1.1","123","Application Data"
"236","39.621874","173.194.121.7","10.152.152.11","TCP","60","443  >  56096 [ACK] Seq=1867 Ack=18671 Win=2640 Len=0"
"237","39.706748","173.194.121.7","10.152.152.11","TLSv1.1","357","Application Data, Application Data, Application Data"
"238","39.707690","10.152.152.11","173.194.121.7","TLSv1.1","123","Application Data"
"239","39.707898","173.194.121.7","10.152.152.11","TCP","60","443  >  56096 [ACK] Seq=2170 Ack=18740 Win=2640 Len=0"
"240","39.897054","173.194.121.7","10.152.152.11","TLSv1.1","357","Application Data, Application Data, Application Data"
"241","39.897383","74.125.70.189","10.152.152.11","TLSv1.1","539","Application Data"
"242","39.898469","10.152.152.11","173.194.121.7","TLSv1.1","123","Application Data"
"243","39.898794","173.194.121.7","10.152.152.11","TCP","60","443  >  56096 [ACK] Seq=2473 Ack=18809 Win=2640 Len=0"
"244","39.935721","10.152.152.11","74.125.70.189","TCP","54","37822  >  443 [ACK] Seq=2464 Ack=11236 Win=2640 Len=0"
"245","40.046875","10.152.152.11","173.194.121.7","TCP","1514","56096  >  443 [ACK] Seq=18809 Ack=2473 Win=2640 Len=1460 [TCP segment of a reassembled PDU]"
"246","40.047425","173.194.121.7","10.152.152.11","TCP","60","443  >  56096 [ACK] Seq=2473 Ack=20269 Win=2640 Len=0"
"247","40.047675","10.152.152.11","173.194.121.7","TLSv1.1","983","Application Data"
"248","40.047940","10.152.152.11","173.194.121.7","TLSv1.1","251","Application Data"
"249","40.048426","173.194.121.7","10.152.152.11","TCP","60","443  >  56096 [ACK] Seq=2473 Ack=21198 Win=2640 Len=0"
"250","40.048456","173.194.121.7","10.152.152.11","TCP","60","443  >  56096 [ACK] Seq=2473 Ack=21395 Win=2640 Len=0"
"251","40.526066","173.194.121.7","10.152.152.11","TLSv1.1","373","Application Data, Application Data, Application Data"
"252","40.529799","10.152.152.11","173.194.121.7","TLSv1.1","123","Application Data"
"253","40.530653","173.194.121.7","10.152.152.11","TCP","60","443  >  56096 [ACK] Seq=2792 Ack=21464 Win=2640 Len=0"
"254","40.665342","74.125.70.189","10.152.152.11","TLSv1.1","523","Application Data"
"255","40.665413","10.152.152.11","74.125.70.189","TCP","54","37822  >  443 [ACK] Seq=2464 Ack=11705 Win=2640 Len=0"
"256","44.243563","10.152.152.11","173.194.121.7","TCP","1514","56096  >  443 [ACK] Seq=21464 Ack=2792 Win=2640 Len=1460 [TCP segment of a reassembled PDU]"
"257","44.244013","10.152.152.11","173.194.121.7","TLSv1.1","983","Application Data"
"258","44.244217","10.152.152.11","173.194.121.7","TLSv1.1","251","Application Data"
"259","44.244375","173.194.121.7","10.152.152.11","TCP","60","443  >  56096 [ACK] Seq=2792 Ack=22924 Win=2640 Len=0"
"260","44.244455","173.194.121.7","10.152.152.11","TCP","60","443  >  56096 [ACK] Seq=2792 Ack=23853 Win=2640 Len=0"
"261","44.244648","173.194.121.7","10.152.152.11","TCP","60","443  >  56096 [ACK] Seq=2792 Ack=24050 Win=2628 Len=0"
"262","44.824525","10.152.152.11","173.194.121.7","TCP","1514","56096  >  443 [ACK] Seq=24050 Ack=2792 Win=2640 Len=1460 [TCP segment of a reassembled PDU]"
"263","44.824973","173.194.121.7","10.152.152.11","TCP","60","443  >  56096 [ACK] Seq=2792 Ack=25510 Win=2640 Len=0"
"264","44.825332","10.152.152.11","173.194.121.7","TLSv1.1","983","Application Data"
"265","44.826071","173.194.121.7","10.152.152.11","TCP","60","443  >  56096 [ACK] Seq=2792 Ack=26439 Win=2640 Len=0"
"266","44.826175","10.152.152.11","173.194.121.7","TLSv1.1","267","Application Data"
"267","44.826523","173.194.121.7","10.152.152.11","TCP","60","443  >  56096 [ACK] Seq=2792 Ack=26652 Win=2640 Len=0"
"268","45.002123","173.194.121.7","10.152.152.11","TLSv1.1","373","Application Data, Application Data, Application Data"
"269","45.010180","10.152.152.11","173.194.121.7","TLSv1.1","123","Application Data"
"270","45.011805","173.194.121.7","10.152.152.11","TCP","60","443  >  56096 [ACK] Seq=3111 Ack=26721 Win=2640 Len=0"
"271","45.046423","10.152.152.11","173.194.121.7","TCP","1514","56096  >  443 [ACK] Seq=26721 Ack=3111 Win=2640 Len=1460 [TCP segment of a reassembled PDU]"
"272","45.046690","10.152.152.11","173.194.121.7","TLSv1.1","983","Application Data"
"273","45.047046","10.152.152.11","173.194.121.7","TLSv1.1","251","Application Data"
"274","45.047054","173.194.121.7","10.152.152.11","TCP","60","443  >  56096 [ACK] Seq=3111 Ack=28181 Win=2640 Len=0"
"275","45.047054","173.194.121.7","10.152.152.11","TCP","60","443  >  56096 [ACK] Seq=3111 Ack=29110 Win=2591 Len=0"
"276","45.047533","173.194.121.7","10.152.152.11","TCP","60","443  >  56096 [ACK] Seq=3111 Ack=29307 Win=2640 Len=0"
"277","45.056865","10.152.152.11","173.194.121.31","TCP","54","[TCP Dup ACK 1#1] 42907  >  443 [ACK] Seq=1 Ack=1 Win=10542 Len=0"
"278","45.057293","173.194.121.31","10.152.152.11","TCP","60","[TCP Dup ACK 2#1] [TCP ACKed unseen segment] 443  >  42907 [ACK] Seq=1 Ack=2 Win=2181 Len=0"
"279","45.437070","173.194.121.7","10.152.152.11","TLSv1.1","421","Application Data, Application Data, Application Data"
"280","45.439395","10.152.152.11","173.194.121.7","TLSv1.1","123","Application Data"
"281","45.440085","173.194.121.7","10.152.152.11","TCP","60","443  >  56096 [ACK] Seq=3478 Ack=29376 Win=2640 Len=0"
"282","45.632763","173.194.121.7","10.152.152.11","TLSv1.1","357","Application Data, Application Data, Application Data"
"283","45.643954","10.152.152.11","173.194.121.7","TLSv1.1","123","Application Data"
"284","45.645159","173.194.121.7","10.152.152.11","TCP","60","443  >  56096 [ACK] Seq=3781 Ack=29445 Win=2640 Len=0"
"285","45.785666","74.125.70.189","10.152.152.11","TLSv1.1","523","Application Data"
"286","45.785710","10.152.152.11","74.125.70.189","TCP","54","37822  >  443 [ACK] Seq=2464 Ack=12174 Win=2640 Len=0"
"287","45.983577","10.152.152.11","74.125.228.238","TCP","54","[TCP Keep-Alive] 52161  >  443 [ACK] Seq=3076 Ack=394 Win=9412 Len=0"
"288","45.985827","74.125.228.238","10.152.152.11","TCP","60","[TCP Keep-Alive ACK] 443  >  52161 [ACK] Seq=394 Ack=3077 Win=2640 Len=0"
"289","47.397943","10.152.152.11","10.152.152.10","DNS","83","Standard query 0x3a13 A safebrowsing.google.com"
"290","47.590523","10.152.152.10","10.152.152.11","DNS","99","Standard query response 0x3a13 A safebrowsing.google.com A 173.194.43.100"
"291","47.590951","10.152.152.11","173.194.43.100","TCP","66","57603  >  443 [SYN] Seq=0 Win=14600 Len=0 MSS=1460 SACK_PERM=1 WS=16"
"292","47.590958","173.194.43.100","10.152.152.11","TCP","66","443  >  57603 [SYN, ACK] Seq=0 Ack=1 Win=14600 Len=0 MSS=1460 SACK_PERM=1 WS=16"
"293","47.590986","10.152.152.11","173.194.43.100","TCP","54","57603  >  443 [ACK] Seq=1 Ack=1 Win=14608 Len=0"
"294","47.592525","10.152.152.11","173.194.43.100","TLSv1.1","226","Client Hello"
"295","47.593643","173.194.43.100","10.152.152.11","TCP","60","443  >  57603 [ACK] Seq=1 Ack=173 Win=15680 Len=0"
"296","47.871081","10.152.152.11","173.194.121.7","TCP","54","[TCP Dup ACK 19#1] 56094  >  443 [ACK] Seq=1 Ack=1 Win=2640 Len=0"
"297","47.871996","173.194.121.7","10.152.152.11","TCP","60","[TCP Dup ACK 20#1] [TCP ACKed unseen segment] 443  >  56094 [ACK] Seq=1 Ack=2 Win=2640 Len=0"
"298","47.999866","10.152.152.11","173.194.121.26","TCP","54","[TCP Dup ACK 21#1] 48884  >  443 [ACK] Seq=1 Ack=1 Win=2190 Len=0"
"299","48.000119","173.194.121.26","10.152.152.11","TCP","60","[TCP Dup ACK 22#1] [TCP ACKed unseen segment] 443  >  48884 [ACK] Seq=1 Ack=2 Win=1166 Len=0"
"300","48.006558","74.125.70.189","10.152.152.11","TLSv1.1","523","Application Data"
"301","48.006578","10.152.152.11","74.125.70.189","TCP","54","37822  >  443 [ACK] Seq=2464 Ack=12643 Win=2640 Len=0"
"302","48.222037","173.194.43.100","10.152.152.11","TLSv1.1","1514","Server Hello"
"303","48.222093","10.152.152.11","173.194.43.100","TCP","54","57603  >  443 [ACK] Seq=173 Ack=1461 Win=17520 Len=0"
"304","48.222966","173.194.43.100","10.152.152.11","TCP","1514","443  >  57603 [ACK] Seq=1461 Ack=173 Win=15680 Len=1460 [TCP segment of a reassembled PDU]"
"305","48.222974","10.152.152.11","173.194.43.100","TCP","54","57603  >  443 [ACK] Seq=173 Ack=2921 Win=20448 Len=0"
"306","48.223005","173.194.43.100","10.152.152.11","TCP","122","443  >  57603 [PSH, ACK] Seq=2921 Ack=173 Win=15680 Len=68 [TCP segment of a reassembled PDU]"
"307","48.223054","10.152.152.11","173.194.43.100","TCP","54","57603  >  443 [ACK] Seq=173 Ack=2989 Win=20448 Len=0"
"308","48.352696","173.194.43.100","10.152.152.11","TLSv1.1","981","Certificate, Server Key Exchange, Server Hello Done"
"309","48.352742","10.152.152.11","173.194.43.100","TCP","54","57603  >  443 [ACK] Seq=173 Ack=3916 Win=23360 Len=0"
"310","48.373817","10.152.152.11","173.194.43.100","TLSv1.1","332","Client Key Exchange, Change Cipher Spec, Encrypted Handshake Message"
"311","48.374085","173.194.43.100","10.152.152.11","TCP","60","443  >  57603 [ACK] Seq=3916 Ack=451 Win=16752 Len=0"
"312","48.815487","173.194.43.100","10.152.152.11","TLSv1.1","526","New Session Ticket, Change Cipher Spec, Encrypted Handshake Message, Application Data, Application Data"
"313","48.827962","10.152.152.11","173.194.43.100","TLSv1.1","139","Application Data"
"314","48.828321","10.152.152.11","173.194.43.100","TLSv1.1","123","Application Data"
"315","48.828929","173.194.43.100","10.152.152.11","TCP","60","443  >  57603 [ACK] Seq=4388 Ack=536 Win=16752 Len=0"
"316","48.828941","173.194.43.100","10.152.152.11","TCP","60","443  >  57603 [ACK] Seq=4388 Ack=605 Win=16752 Len=0"
"317","48.829723","10.152.152.11","173.194.43.100","TLSv1.1","683","Application Data"
"318","48.830106","10.152.152.11","173.194.43.100","TCP","1514","57603  >  443 [ACK] Seq=1234 Ack=4388 Win=26288 Len=1460 [TCP segment of a reassembled PDU]"
"319","48.831053","10.152.152.11","173.194.43.100","TLSv1.1","1511","Application Data"
"320","48.831061","173.194.43.100","10.152.152.11","TCP","60","443  >  57603 [ACK] Seq=4388 Ack=1234 Win=18016 Len=0"
"321","48.831061","173.194.43.100","10.152.152.11","TCP","60","443  >  57603 [ACK] Seq=4388 Ack=2694 Win=20928 Len=0"
"322","48.831815","173.194.43.100","10.152.152.11","TCP","60","443  >  57603 [ACK] Seq=4388 Ack=4151 Win=23856 Len=0"
"323","48.832056","10.152.152.11","173.194.43.100","TCP","1514","57603  >  443 [ACK] Seq=4151 Ack=4388 Win=26288 Len=1460 [TCP segment of a reassembled PDU]"
"324","48.832188","10.152.152.11","173.194.43.100","TLSv1.1","1511","Application Data"
"325","48.832527","10.152.152.11","173.194.43.100","TCP","1514","57603  >  443 [ACK] Seq=7068 Ack=4388 Win=26288 Len=1460 [TCP segment of a reassembled PDU]"
"326","48.832674","10.152.152.11","173.194.43.100","TLSv1.1","1511","Application Data"
"327","48.832994","10.152.152.11","173.194.43.100","TCP","1514","57603  >  443 [ACK] Seq=9985 Ack=4388 Win=26288 Len=1460 [TCP segment of a reassembled PDU]"
"328","48.833236","173.194.43.100","10.152.152.11","TCP","60","443  >  57603 [ACK] Seq=4388 Ack=5611 Win=26768 Len=0"
"329","48.833239","173.194.43.100","10.152.152.11","TCP","60","443  >  57603 [ACK] Seq=4388 Ack=7068 Win=29696 Len=0"
"330","48.833252","173.194.43.100","10.152.152.11","TCP","60","443  >  57603 [ACK] Seq=4388 Ack=8528 Win=32608 Len=0"
"331","48.833372","10.152.152.11","173.194.43.100","TLSv1.1","1511","Application Data"
"332","48.833714","10.152.152.11","173.194.43.100","TCP","1514","57603  >  443 [ACK] Seq=12902 Ack=4388 Win=26288 Len=1460 [TCP segment of a reassembled PDU]"
"333","48.833938","10.152.152.11","173.194.43.100","TLSv1.1","1511","Application Data"
"334","48.834068","173.194.43.100","10.152.152.11","TCP","60","443  >  57603 [ACK] Seq=4388 Ack=9985 Win=35536 Len=0"
"335","48.834072","173.194.43.100","10.152.152.11","TCP","60","443  >  57603 [ACK] Seq=4388 Ack=11445 Win=38448 Len=0"
"336","48.834401","10.152.152.11","173.194.43.100","TLSv1.1","1467","Application Data"
"337","48.834815","173.194.43.100","10.152.152.11","TCP","60","443  >  57603 [ACK] Seq=4388 Ack=12902 Win=41376 Len=0"
"338","48.834884","173.194.43.100","10.152.152.11","TCP","60","443  >  57603 [ACK] Seq=4388 Ack=14362 Win=41456 Len=0"
"339","48.834890","173.194.43.100","10.152.152.11","TCP","60","443  >  57603 [ACK] Seq=4388 Ack=15819 Win=40336 Len=0"
"340","48.835077","173.194.43.100","10.152.152.11","TCP","60","443  >  57603 [ACK] Seq=4388 Ack=17232 Win=39216 Len=0"
"341","49.472402","10.152.152.11","173.194.121.3","TCP","54","[TCP Keep-Alive] 36625  >  443 [ACK] Seq=17789 Ack=341 Win=2190 Len=0"
"342","49.473356","173.194.121.3","10.152.152.11","TCP","60","[TCP Keep-Alive ACK] 443  >  36625 [ACK] Seq=341 Ack=17790 Win=2858 Len=0"
"343","49.508829","173.194.43.100","10.152.152.11","TLSv1.1","813","Application Data"
"344","49.524708","173.194.43.100","10.152.152.11","TLSv1.1","1514","Application Data [TCP segment of a reassembled PDU]"
"345","49.524746","10.152.152.11","173.194.43.100","TCP","54","57603  >  443 [ACK] Seq=17232 Ack=6607 Win=32128 Len=0"
"346","49.524780","173.194.43.100","10.152.152.11","TLSv1.1","1514","Application Data [TCP segment of a reassembled PDU]"
"347","49.524974","173.194.43.100","10.152.152.11","TCP","620","443  >  57603 [PSH, ACK] Seq=8067 Ack=17232 Win=42240 Len=566 [TCP segment of a reassembled PDU]"
"348","49.524978","10.152.152.11","173.194.43.100","TCP","54","57603  >  443 [ACK] Seq=17232 Ack=8633 Win=37968 Len=0"
"349","49.663439","173.194.43.100","10.152.152.11","TLSv1.1","591","Application Data, Application Data, Application Data"
"350","49.668866","10.152.152.11","10.152.152.10","DNS","89","Standard query 0xfb5d A safebrowsing-cache.google.com"
