"No.","Time","Source","Destination","Protocol","Length","Info"
"1","0.000000","10.152.152.11","157.56.126.188","TLSv1","683","Application Data"
"2","0.000277","157.56.126.188","10.152.152.11","TCP","60","443  >  50946 [ACK] Seq=1 Ack=630 Win=2640 Len=0"
"3","0.636110","157.56.126.188","10.152.152.11","TCP","552","443  >  50946 [PSH, ACK] Seq=1 Ack=630 Win=2640 Len=498 [TCP segment of a reassembled PDU]"
"4","0.636199","10.152.152.11","157.56.126.188","TCP","54","50946  >  443 [ACK] Seq=630 Ack=499 Win=2640 Len=0"
"5","0.780798","157.56.126.188","10.152.152.11","TLSv1","552","Application Data [TCP segment of a reassembled PDU]"
"6","0.780833","10.152.152.11","157.56.126.188","TCP","54","50946  >  443 [ACK] Seq=630 Ack=997 Win=2640 Len=0"
"7","0.845673","157.56.126.188","10.152.152.11","TLSv1","76","Application Data"
"8","0.845705","10.152.152.11","157.56.126.188","TCP","54","50946  >  443 [ACK] Seq=630 Ack=1019 Win=2640 Len=0"
"9","3.913452","10.152.152.11","157.56.126.188","TLSv1","731","Application Data"
"10","3.913882","157.56.126.188","10.152.152.11","TCP","60","443  >  50946 [ACK] Seq=1019 Ack=1307 Win=2640 Len=0"
"11","4.457564","157.56.126.188","10.152.152.11","TLSv1","155","Application Data"
"12","4.457663","10.152.152.11","157.56.126.188","TCP","54","50946  >  443 [ACK] Seq=1307 Ack=1120 Win=2640 Len=0"
"13","7.575262","10.152.152.11","157.56.126.188","TLSv1","731","Application Data"
"14","7.575715","157.56.126.188","10.152.152.11","TCP","60","443  >  50946 [ACK] Seq=1120 Ack=1984 Win=2640 Len=0"
"15","8.218061","157.56.126.188","10.152.152.11","TLSv1","155","Application Data"
"16","8.218151","10.152.152.11","157.56.126.188","TCP","54","50946  >  443 [ACK] Seq=1984 Ack=1221 Win=2640 Len=0"
"17","17.686412","10.152.152.11","157.56.126.188","TLSv1","731","Application Data"
"18","17.686844","157.56.126.188","10.152.152.11","TCP","60","443  >  50946 [ACK] Seq=1221 Ack=2661 Win=2640 Len=0"
"19","18.264274","157.56.126.188","10.152.152.11","TLSv1","155","Application Data"
"20","18.264364","10.152.152.11","157.56.126.188","TCP","54","50946  >  443 [ACK] Seq=2661 Ack=1322 Win=2640 Len=0"
"21","23.686942","10.152.152.11","157.56.126.188","TLSv1","731","Application Data"
"22","23.687388","157.56.126.188","10.152.152.11","TCP","60","443  >  50946 [ACK] Seq=1322 Ack=3338 Win=2640 Len=0"
"23","25.221007","157.56.126.188","10.152.152.11","TLSv1","155","Application Data"
"24","25.221098","10.152.152.11","157.56.126.188","TCP","54","50946  >  443 [ACK] Seq=3338 Ack=1423 Win=2640 Len=0"
"25","28.393663","10.152.152.11","10.152.152.10","DNS","76","Standard query 0xb74d A irc.freenode.net"
"26","28.393781","10.152.152.11","10.152.152.10","DNS","76","Standard query 0xe176 AAAA irc.freenode.net"
"27","28.633222","10.152.152.10","10.152.152.11","DNS","92","Standard query response 0xb74d A irc.freenode.net A 193.219.128.49"
"28","28.768789","10.152.152.10","10.152.152.11","DNS","76","Standard query response 0xe176 No such name AAAA irc.freenode.net"
"29","28.769440","10.152.152.11","193.219.128.49","TCP","66","54208  >  6667 [SYN] Seq=0 Win=14600 Len=0 MSS=1460 SACK_PERM=1 WS=16"
"30","28.769970","193.219.128.49","10.152.152.11","TCP","66","6667  >  54208 [SYN, ACK] Seq=0 Ack=1 Win=14600 Len=0 MSS=1460 SACK_PERM=1 WS=16"
"31","28.770108","10.152.152.11","193.219.128.49","TCP","54","54208  >  6667 [ACK] Seq=1 Ack=1 Win=14608 Len=0"
"32","28.770662","10.152.152.11","193.219.128.49","IRC","70","Request (PASS)"
"33","28.771001","193.219.128.49","10.152.152.11","TCP","60","6667  >  54208 [ACK] Seq=1 Ack=17 Win=14608 Len=0"
"34","28.771064","10.152.152.11","193.219.128.49","IRC","92","Request (USER)"
"35","28.771435","193.219.128.49","10.152.152.11","TCP","60","6667  >  54208 [ACK] Seq=1 Ack=55 Win=14608 Len=0"
"36","28.771457","10.152.152.11","193.219.128.49","IRC","66","Request (NICK)"
"37","28.771948","193.219.128.49","10.152.152.11","TCP","60","6667  >  54208 [ACK] Seq=1 Ack=67 Win=14608 Len=0"
"38","29.275683","193.219.128.49","10.152.152.11","IRC","118","Response (NOTICE)"
"39","29.275786","10.152.152.11","193.219.128.49","TCP","54","54208  >  6667 [ACK] Seq=67 Ack=65 Win=14608 Len=0"
"40","29.339684","193.219.128.49","10.152.152.11","IRC","105","Response (NOTICE)"
"41","29.339713","10.152.152.11","193.219.128.49","TCP","54","54208  >  6667 [ACK] Seq=67 Ack=116 Win=14608 Len=0"
"42","29.404247","193.219.128.49","10.152.152.11","IRC","108","Response (NOTICE)"
"43","29.404315","10.152.152.11","193.219.128.49","TCP","54","54208  >  6667 [ACK] Seq=67 Ack=170 Win=14608 Len=0"
"44","29.823414","10.152.152.11","157.56.126.188","TLSv1","731","Application Data"
"45","29.823864","157.56.126.188","10.152.152.11","TCP","60","443  >  50946 [ACK] Seq=1423 Ack=4015 Win=2640 Len=0"
"46","29.869133","193.219.128.49","10.152.152.11","IRC","121","Response (NOTICE)"
"47","29.869162","10.152.152.11","193.219.128.49","TCP","54","54208  >  6667 [ACK] Seq=67 Ack=237 Win=14608 Len=0"
"48","30.075479","193.219.128.49","10.152.152.11","IRC","117","Response (433)"
"49","30.075510","10.152.152.11","193.219.128.49","TCP","54","54208  >  6667 [ACK] Seq=67 Ack=300 Win=14608 Len=0"
"50","30.076057","10.152.152.11","193.219.128.49","IRC","67","Request (NICK)"
"51","30.076522","193.219.128.49","10.152.152.11","TCP","60","6667  >  54208 [ACK] Seq=300 Ack=80 Win=14608 Len=0"
"52","30.449408","193.219.128.49","10.152.152.11","IRC","118","Response (433)"
"53","30.449898","10.152.152.11","193.219.128.49","IRC","67","Request (NICK)"
"54","30.450311","193.219.128.49","10.152.152.11","TCP","60","6667  >  54208 [ACK] Seq=364 Ack=93 Win=14608 Len=0"
"55","30.515906","157.56.126.188","10.152.152.11","TLSv1","155","Application Data"
"56","30.516002","10.152.152.11","157.56.126.188","TCP","54","50946  >  443 [ACK] Seq=4015 Ack=1524 Win=2640 Len=0"
"57","30.832701","193.219.128.49","10.152.152.11","IRC","374","Response (465) (ERROR)"
"58","30.833882","10.152.152.11","193.219.128.49","IRC","70","Request (QUIT)"
"59","30.833963","10.152.152.11","193.219.128.49","TCP","54","54208  >  6667 [FIN, ACK] Seq=109 Ack=684 Win=15680 Len=0"
"60","30.834283","193.219.128.49","10.152.152.11","TCP","60","6667  >  54208 [ACK] Seq=684 Ack=109 Win=14608 Len=0"
"61","30.834680","193.219.128.49","10.152.152.11","TCP","60","6667  >  54208 [FIN, ACK] Seq=684 Ack=110 Win=14608 Len=0"
"62","30.834713","10.152.152.11","193.219.128.49","TCP","54","54208  >  6667 [ACK] Seq=110 Ack=685 Win=15680 Len=0"
"63","38.743427","10.152.152.11","157.56.126.188","TLSv1","731","Application Data"
"64","38.743866","157.56.126.188","10.152.152.11","TCP","60","443  >  50946 [ACK] Seq=1524 Ack=4692 Win=2640 Len=0"
"65","39.454158","157.56.126.188","10.152.152.11","TLSv1","155","Application Data"
"66","39.454251","10.152.152.11","157.56.126.188","TCP","54","50946  >  443 [ACK] Seq=4692 Ack=1625 Win=2640 Len=0"
"67","40.455538","10.152.152.11","157.56.126.188","TLSv1","507","Application Data"
"68","40.455854","10.152.152.11","157.55.130.175","TCP","56","42164  >  33033 [PSH, ACK] Seq=1 Ack=1 Win=3917 Len=2"
"69","40.456070","157.56.126.188","10.152.152.11","TCP","60","443  >  50946 [ACK] Seq=1625 Ack=5145 Win=2640 Len=0"
"70","40.456253","157.55.130.175","10.152.152.11","TCP","60","33033  >  42164 [ACK] Seq=1 Ack=3 Win=2640 Len=0"
"71","40.862821","157.56.126.188","10.152.152.11","TLSv1","203","Application Data"
"72","40.862912","10.152.152.11","157.56.126.188","TCP","54","50946  >  443 [ACK] Seq=5145 Ack=1774 Win=2640 Len=0"
"73","43.409658","10.152.152.11","157.56.126.188","TLSv1","1307","Application Data"
"74","43.410005","157.56.126.188","10.152.152.11","TCP","60","443  >  50946 [ACK] Seq=1774 Ack=6398 Win=2640 Len=0"
"75","43.410784","10.152.152.11","157.55.130.175","TCP","87","42164  >  33033 [PSH, ACK] Seq=3 Ack=1 Win=3917 Len=33"
"76","43.411034","157.55.130.175","10.152.152.11","TCP","60","33033  >  42164 [ACK] Seq=1 Ack=36 Win=2640 Len=0"
"77","43.411049","10.152.152.11","157.55.130.175","TCP","288","42164  >  33033 [PSH, ACK] Seq=36 Ack=1 Win=3917 Len=234"
"78","43.411350","157.55.130.175","10.152.152.11","TCP","60","33033  >  42164 [ACK] Seq=1 Ack=270 Win=2640 Len=0"
"79","43.965632","157.55.130.175","10.152.152.11","TCP","60","33033  >  42164 [PSH, ACK] Seq=1 Ack=270 Win=2640 Len=4"
"80","43.965720","10.152.152.11","157.55.130.175","TCP","54","42164  >  33033 [ACK] Seq=270 Ack=5 Win=3917 Len=0"
"81","44.066438","157.55.130.175","10.152.152.11","TCP","552","33033  >  42164 [PSH, ACK] Seq=5 Ack=270 Win=2640 Len=498"
"82","44.066466","10.152.152.11","157.55.130.175","TCP","54","42164  >  33033 [ACK] Seq=270 Ack=503 Win=4042 Len=0"
"83","44.109535","157.55.130.175","10.152.152.11","TCP","552","33033  >  42164 [PSH, ACK] Seq=503 Ack=270 Win=2640 Len=498"
"84","44.109562","10.152.152.11","157.55.130.175","TCP","54","42164  >  33033 [ACK] Seq=270 Ack=1001 Win=4042 Len=0"
"85","44.111529","10.152.152.11","157.55.130.175","TCP","117","42164  >  33033 [PSH, ACK] Seq=270 Ack=1001 Win=4042 Len=63"
"86","44.112004","157.55.130.175","10.152.152.11","TCP","60","33033  >  42164 [ACK] Seq=1001 Ack=333 Win=2640 Len=0"
"87","44.130528","157.55.130.175","10.152.152.11","TCP","696","33033  >  42164 [PSH, ACK] Seq=1001 Ack=333 Win=2640 Len=642"
"88","44.166698","10.152.152.11","157.55.130.175","TCP","54","42164  >  33033 [ACK] Seq=333 Ack=1643 Win=4042 Len=0"
"89","44.183959","10.152.152.11","157.55.130.175","TCP","67","42164  >  33033 [PSH, ACK] Seq=333 Ack=1643 Win=4042 Len=13"
"90","44.222395","157.55.130.175","10.152.152.11","TCP","60","33033  >  42164 [ACK] Seq=1643 Ack=346 Win=2640 Len=0"
"91","44.257106","157.55.130.175","10.152.152.11","TCP","493","33033  >  42164 [PSH, ACK] Seq=1643 Ack=346 Win=2640 Len=439"
"92","44.257132","10.152.152.11","157.55.130.175","TCP","54","42164  >  33033 [ACK] Seq=346 Ack=2082 Win=4042 Len=0"
"93","44.400457","157.55.130.175","10.152.152.11","TCP","493","33033  >  42164 [PSH, ACK] Seq=2082 Ack=346 Win=2640 Len=439"
"94","44.400538","10.152.152.11","157.55.130.175","TCP","54","42164  >  33033 [ACK] Seq=346 Ack=2521 Win=4042 Len=0"
"95","44.518219","10.152.152.11","157.56.126.188","TLSv1","683","Application Data"
"96","44.518489","157.56.126.188","10.152.152.11","TCP","60","443  >  50946 [ACK] Seq=1774 Ack=7027 Win=2640 Len=0"
"97","44.546362","157.56.126.188","10.152.152.11","TLSv1","155","Application Data"
"98","44.546388","10.152.152.11","157.56.126.188","TCP","54","50946  >  443 [ACK] Seq=7027 Ack=1875 Win=2640 Len=0"
"99","44.638850","157.55.130.175","10.152.152.11","TCP","60","33033  >  42164 [PSH, ACK] Seq=2521 Ack=346 Win=2640 Len=4"
"100","44.638875","10.152.152.11","157.55.130.175","TCP","54","42164  >  33033 [ACK] Seq=346 Ack=2525 Win=4042 Len=0"
"101","44.708396","157.55.130.175","10.152.152.11","TCP","757","33033  >  42164 [PSH, ACK] Seq=2525 Ack=346 Win=2640 Len=703"
"102","44.708421","10.152.152.11","157.55.130.175","TCP","54","42164  >  33033 [ACK] Seq=346 Ack=3228 Win=4042 Len=0"
"103","44.712323","10.152.152.11","5.178.135.69","TCP","66","41249  >  53262 [SYN] Seq=0 Win=14600 Len=0 MSS=1460 SACK_PERM=1 WS=16"
"104","44.712717","5.178.135.69","10.152.152.11","TCP","66","53262  >  41249 [SYN, ACK] Seq=0 Ack=1 Win=14600 Len=0 MSS=1460 SACK_PERM=1 WS=16"
"105","44.712754","10.152.152.11","5.178.135.69","TCP","54","41249  >  53262 [ACK] Seq=1 Ack=1 Win=14608 Len=0"
"106","44.713340","10.152.152.11","85.26.42.231","TCP","66","43622  >  27376 [SYN] Seq=0 Win=14600 Len=0 MSS=1460 SACK_PERM=1 WS=16"
"107","44.713759","85.26.42.231","10.152.152.11","TCP","66","27376  >  43622 [SYN, ACK] Seq=0 Ack=1 Win=14600 Len=0 MSS=1460 SACK_PERM=1 WS=16"
"108","44.713833","10.152.152.11","85.26.42.231","TCP","54","43622  >  27376 [ACK] Seq=1 Ack=1 Win=14608 Len=0"
"109","44.714991","10.152.152.11","5.178.135.69","TCP","155","41249  >  53262 [PSH, ACK] Seq=1 Ack=1 Win=14608 Len=101"
"110","44.715369","5.178.135.69","10.152.152.11","TCP","60","53262  >  41249 [ACK] Seq=1 Ack=102 Win=14608 Len=0"
"111","44.716014","10.152.152.11","85.26.42.231","TCP","123","43622  >  27376 [PSH, ACK] Seq=1 Ack=1 Win=14608 Len=69"
"112","44.716419","85.26.42.231","10.152.152.11","TCP","60","27376  >  43622 [ACK] Seq=1 Ack=70 Win=14608 Len=0"
"113","44.716765","10.152.152.11","157.55.130.175","TCP","111","42164  >  33033 [PSH, ACK] Seq=346 Ack=3228 Win=4042 Len=57"
"114","44.717105","157.55.130.175","10.152.152.11","TCP","60","33033  >  42164 [ACK] Seq=3228 Ack=403 Win=2640 Len=0"
"115","44.717173","10.152.152.11","157.55.130.175","TCP","168","42164  >  33033 [PSH, ACK] Seq=403 Ack=3228 Win=4042 Len=114"
"116","44.717454","157.55.130.175","10.152.152.11","TCP","60","33033  >  42164 [ACK] Seq=3228 Ack=517 Win=2640 Len=0"
"117","45.190660","5.178.135.69","10.152.152.11","TCP","158","53262  >  41249 [PSH, ACK] Seq=1 Ack=102 Win=14608 Len=104"
"118","45.190761","10.152.152.11","5.178.135.69","TCP","54","41249  >  53262 [ACK] Seq=102 Ack=105 Win=14608 Len=0"
"119","45.190806","85.26.42.231","10.152.152.11","TCP","111","27376  >  43622 [PSH, ACK] Seq=1 Ack=70 Win=14608 Len=57"
"120","45.190829","10.152.152.11","85.26.42.231","TCP","54","43622  >  27376 [ACK] Seq=70 Ack=58 Win=14608 Len=0"
"121","45.191703","10.152.152.11","5.178.135.69","TCP","62","41249  >  53262 [PSH, ACK] Seq=102 Ack=105 Win=14608 Len=8"
"122","45.192198","5.178.135.69","10.152.152.11","TCP","60","53262  >  41249 [ACK] Seq=105 Ack=110 Win=14608 Len=0"
"123","45.192828","10.152.152.11","85.26.42.231","TCP","62","43622  >  27376 [PSH, ACK] Seq=70 Ack=58 Win=14608 Len=8"
"124","45.193354","85.26.42.231","10.152.152.11","TCP","60","27376  >  43622 [ACK] Seq=58 Ack=78 Win=14608 Len=0"
"125","45.236045","157.55.130.175","10.152.152.11","TCP","60","33033  >  42164 [PSH, ACK] Seq=3228 Ack=517 Win=2640 Len=4"
"126","45.236123","5.178.135.69","10.152.152.11","TCP","62","53262  >  41249 [PSH, ACK] Seq=105 Ack=110 Win=14608 Len=8"
"127","45.236797","10.152.152.11","5.178.135.69","TCP","114","41249  >  53262 [PSH, ACK] Seq=110 Ack=113 Win=14608 Len=60"
"128","45.237134","5.178.135.69","10.152.152.11","TCP","60","53262  >  41249 [ACK] Seq=113 Ack=170 Win=14608 Len=0"
"129","45.257573","85.26.42.231","10.152.152.11","TCP","62","27376  >  43622 [PSH, ACK] Seq=58 Ack=78 Win=14608 Len=8[Malformed Packet]"
"130","45.258408","10.152.152.11","85.26.42.231","TCP","126","43622  >  27376 [PSH, ACK] Seq=78 Ack=66 Win=14608 Len=72"
"131","45.258783","85.26.42.231","10.152.152.11","TCP","60","27376  >  43622 [ACK] Seq=66 Ack=150 Win=14608 Len=0"
"132","45.274747","10.152.152.11","157.55.130.175","TCP","54","42164  >  33033 [ACK] Seq=517 Ack=3232 Win=4042 Len=0"
"133","45.322408","157.56.126.188","10.152.152.11","TCP","1050","443  >  50946 [PSH, ACK] Seq=1875 Ack=7027 Win=2640 Len=996 [TCP segment of a reassembled PDU]"
"134","45.322496","10.152.152.11","157.56.126.188","TCP","54","50946  >  443 [ACK] Seq=7027 Ack=2871 Win=2640 Len=0"
"135","45.387168","157.56.126.188","10.152.152.11","TLSv1","332","Application Data, Application Data"
"136","45.387195","10.152.152.11","157.56.126.188","TCP","54","50946  >  443 [ACK] Seq=7027 Ack=3149 Win=2640 Len=0"
"137","45.387232","157.55.130.175","10.152.152.11","TCP","513","33033  >  42164 [PSH, ACK] Seq=3232 Ack=517 Win=2640 Len=459"
"138","45.387244","10.152.152.11","157.55.130.175","TCP","54","42164  >  33033 [ACK] Seq=517 Ack=3691 Win=4042 Len=0"
"139","45.511412","5.178.135.69","10.152.152.11","TCP","91","53262  >  41249 [PSH, ACK] Seq=113 Ack=170 Win=14608 Len=37"
"140","45.512075","10.152.152.11","5.178.135.69","TCP","68","41249  >  53262 [PSH, ACK] Seq=170 Ack=150 Win=14608 Len=14"
"141","45.512555","5.178.135.69","10.152.152.11","TCP","60","53262  >  41249 [ACK] Seq=150 Ack=184 Win=14608 Len=0"
"142","45.656944","85.26.42.231","10.152.152.11","TCP","120","27376  >  43622 [PSH, ACK] Seq=66 Ack=150 Win=14608 Len=66"
"143","45.657732","10.152.152.11","85.26.42.231","TCP","68","43622  >  27376 [PSH, ACK] Seq=150 Ack=132 Win=14608 Len=14"
"144","45.658099","85.26.42.231","10.152.152.11","TCP","60","27376  >  43622 [ACK] Seq=132 Ack=164 Win=14608 Len=0"
"145","45.885398","5.178.135.69","10.152.152.11","TCP","71","53262  >  41249 [PSH, ACK] Seq=150 Ack=184 Win=14608 Len=17"
"146","45.922728","10.152.152.11","5.178.135.69","TCP","54","41249  >  53262 [ACK] Seq=184 Ack=167 Win=14608 Len=0"
"147","46.016877","85.26.42.231","10.152.152.11","TCP","72","27376  >  43622 [PSH, ACK] Seq=132 Ack=164 Win=14608 Len=18"
"148","46.017942","10.152.152.11","157.55.130.175","TCP","259","42164  >  33033 [PSH, ACK] Seq=517 Ack=3691 Win=4042 Len=205"
"149","46.018623","157.55.130.175","10.152.152.11","TCP","60","33033  >  42164 [ACK] Seq=3691 Ack=722 Win=2640 Len=0"
"150","46.054728","10.152.152.11","85.26.42.231","TCP","54","43622  >  27376 [ACK] Seq=164 Ack=150 Win=14608 Len=0"
"151","46.834964","157.55.130.175","10.152.152.11","TCP","60","33033  >  42164 [PSH, ACK] Seq=3691 Ack=722 Win=2640 Len=3"
"152","46.835083","10.152.152.11","157.55.130.175","TCP","54","42164  >  33033 [ACK] Seq=722 Ack=3694 Win=4042 Len=0"
"153","46.982640","157.55.130.175","10.152.152.11","TCP","61","33033  >  42164 [PSH, ACK] Seq=3694 Ack=722 Win=2640 Len=7"
"154","46.982668","10.152.152.11","157.55.130.175","TCP","54","42164  >  33033 [ACK] Seq=722 Ack=3701 Win=4042 Len=0"
"155","47.781898","5.178.135.69","10.152.152.11","TCP","68","53262  >  41249 [PSH, ACK] Seq=167 Ack=184 Win=14608 Len=14"
"156","47.781921","10.152.152.11","5.178.135.69","TCP","54","41249  >  53262 [ACK] Seq=184 Ack=181 Win=14608 Len=0"
"157","47.782146","10.152.152.11","5.178.135.69","TCP","58","41249  >  53262 [PSH, ACK] Seq=184 Ack=181 Win=14608 Len=4"
"158","47.782379","5.178.135.69","10.152.152.11","TCP","60","53262  >  41249 [ACK] Seq=181 Ack=188 Win=14608 Len=0"
"159","48.034787","5.178.135.69","10.152.152.11","TCP","552","53262  >  41249 [PSH, ACK] Seq=181 Ack=188 Win=14608 Len=498"
"160","48.074697","10.152.152.11","5.178.135.69","TCP","54","41249  >  53262 [ACK] Seq=188 Ack=679 Win=15680 Len=0"
"161","48.176706","5.178.135.69","10.152.152.11","TCP","237","53262  >  41249 [PSH, ACK] Seq=679 Ack=188 Win=14608 Len=183"
"162","48.176750","10.152.152.11","5.178.135.69","TCP","54","41249  >  53262 [ACK] Seq=188 Ack=862 Win=16752 Len=0"
"163","48.179318","10.152.152.11","5.178.135.69","TCP","1078","41249  >  53262 [PSH, ACK] Seq=188 Ack=862 Win=16752 Len=1024"
"164","48.179545","5.178.135.69","10.152.152.11","TCP","60","53262  >  41249 [ACK] Seq=862 Ack=1212 Win=16656 Len=0"
"165","48.179562","10.152.152.11","5.178.135.69","TCP","141","41249  >  53262 [PSH, ACK] Seq=1212 Ack=862 Win=16752 Len=87"
"166","48.179723","5.178.135.69","10.152.152.11","TCP","60","53262  >  41249 [ACK] Seq=862 Ack=1299 Win=16656 Len=0"
"167","48.180106","10.152.152.11","85.26.42.231","TCP","54","43622  >  27376 [FIN, ACK] Seq=164 Ack=150 Win=14608 Len=0"
"168","48.180326","85.26.42.231","10.152.152.11","TCP","60","27376  >  43622 [FIN, ACK] Seq=150 Ack=165 Win=14608 Len=0"
"169","48.180342","10.152.152.11","85.26.42.231","TCP","54","43622  >  27376 [ACK] Seq=165 Ack=151 Win=14608 Len=0"
"170","49.127800","5.178.135.69","10.152.152.11","TCP","552","53262  >  41249 [PSH, ACK] Seq=862 Ack=1299 Win=16656 Len=498"
"171","49.166700","10.152.152.11","5.178.135.69","TCP","54","41249  >  53262 [ACK] Seq=1299 Ack=1360 Win=17824 Len=0"
"172","49.261334","5.178.135.69","10.152.152.11","TCP","105","53262  >  41249 [PSH, ACK] Seq=1360 Ack=1299 Win=16656 Len=51"
"173","49.261362","10.152.152.11","5.178.135.69","TCP","54","41249  >  53262 [ACK] Seq=1299 Ack=1411 Win=17824 Len=0"
"174","49.270277","10.152.152.11","5.178.135.69","TCP","155","41249  >  53262 [PSH, ACK] Seq=1299 Ack=1411 Win=17824 Len=101"
"175","49.270600","5.178.135.69","10.152.152.11","TCP","60","53262  >  41249 [ACK] Seq=1411 Ack=1400 Win=16656 Len=0"
"176","49.270619","10.152.152.11","5.178.135.69","TCP","132","41249  >  53262 [PSH, ACK] Seq=1400 Ack=1411 Win=17824 Len=78"
"177","49.270890","5.178.135.69","10.152.152.11","TCP","60","53262  >  41249 [ACK] Seq=1411 Ack=1478 Win=16656 Len=0"
"178","49.272301","10.152.152.11","157.55.130.175","TCP","147","42164  >  33033 [PSH, ACK] Seq=722 Ack=3701 Win=4042 Len=93"
"179","49.272528","10.152.152.11","174.119.156.255","UDP","60","3697  >  8724 Len=18"
"180","49.272541","157.55.130.175","10.152.152.11","TCP","60","33033  >  42164 [ACK] Seq=3701 Ack=815 Win=2640 Len=0"
"181","49.272571","10.152.152.11","83.34.39.203","UDP","60","3697  >  1117 Len=18"
"182","49.272617","10.152.152.11","172.6.157.32","UDP","60","3697  >  47230 Len=18"
"183","49.272669","10.152.152.11","85.152.106.250","UDP","60","3697  >  12693 Len=18"
"184","49.386399","5.178.135.69","10.152.152.11","TCP","138","53262  >  41249 [PSH, ACK] Seq=1411 Ack=1478 Win=16656 Len=84"
"185","49.387093","10.152.152.11","5.178.135.69","TCP","82","41249  >  53262 [PSH, ACK] Seq=1478 Ack=1495 Win=17824 Len=28"
"186","49.387608","5.178.135.69","10.152.152.11","TCP","60","53262  >  41249 [ACK] Seq=1495 Ack=1506 Win=16656 Len=0"
"187","49.387900","10.152.152.11","5.178.135.69","TCP","81","41249  >  53262 [PSH, ACK] Seq=1506 Ack=1495 Win=17824 Len=27"
"188","49.388311","5.178.135.69","10.152.152.11","TCP","60","53262  >  41249 [ACK] Seq=1495 Ack=1533 Win=16656 Len=0"
"189","49.941488","5.178.135.69","10.152.152.11","TCP","82","53262  >  41249 [PSH, ACK] Seq=1495 Ack=1533 Win=16656 Len=28"
"190","49.978725","10.152.152.11","5.178.135.69","TCP","54","41249  >  53262 [ACK] Seq=1533 Ack=1523 Win=17824 Len=0"
"191","50.140120","5.178.135.69","10.152.152.11","TCP","175","53262  >  41249 [PSH, ACK] Seq=1523 Ack=1533 Win=16656 Len=121"
"192","50.140148","10.152.152.11","5.178.135.69","TCP","54","41249  >  53262 [ACK] Seq=1533 Ack=1644 Win=17824 Len=0"
"193","50.140774","10.152.152.11","5.178.135.69","TCP","75","41249  >  53262 [PSH, ACK] Seq=1533 Ack=1644 Win=17824 Len=21"
"194","50.141139","5.178.135.69","10.152.152.11","TCP","60","53262  >  41249 [ACK] Seq=1644 Ack=1554 Win=16656 Len=0"
"195","50.141467","10.152.152.11","5.178.135.69","TCP","102","41249  >  53262 [PSH, ACK] Seq=1554 Ack=1644 Win=17824 Len=48"
"196","50.141953","5.178.135.69","10.152.152.11","TCP","60","53262  >  41249 [ACK] Seq=1644 Ack=1602 Win=16656 Len=0"
"197","50.142017","10.152.152.11","5.178.135.69","TCP","83","41249  >  53262 [PSH, ACK] Seq=1602 Ack=1644 Win=17824 Len=29"
"198","50.142276","5.178.135.69","10.152.152.11","TCP","60","53262  >  41249 [ACK] Seq=1644 Ack=1631 Win=16656 Len=0"
"199","50.142496","10.152.152.11","5.178.135.69","TCP","139","41249  >  53262 [PSH, ACK] Seq=1631 Ack=1644 Win=17824 Len=85"
"200","50.142879","5.178.135.69","10.152.152.11","TCP","60","53262  >  41249 [ACK] Seq=1644 Ack=1716 Win=16656 Len=0"
"201","50.143124","10.152.152.11","5.178.135.69","TCP","101","41249  >  53262 [PSH, ACK] Seq=1716 Ack=1644 Win=17824 Len=47"
"202","50.143454","5.178.135.69","10.152.152.11","TCP","60","53262  >  41249 [ACK] Seq=1644 Ack=1763 Win=16656 Len=0"
"203","50.251228","157.55.130.175","10.152.152.11","TCP","60","33033  >  42164 [PSH, ACK] Seq=3701 Ack=815 Win=2640 Len=3"
"204","50.251318","10.152.152.11","157.55.130.175","TCP","54","42164  >  33033 [ACK] Seq=815 Ack=3704 Win=4042 Len=0"
"205","50.371495","157.55.130.175","10.152.152.11","TCP","104","33033  >  42164 [PSH, ACK] Seq=3704 Ack=815 Win=2640 Len=50"
"206","50.371529","10.152.152.11","157.55.130.175","TCP","54","42164  >  33033 [ACK] Seq=815 Ack=3754 Win=4042 Len=0"
"207","50.372379","10.152.152.11","5.1.83.201","UDP","70","3697  >  3697 Len=28"
"208","50.442327","157.56.126.188","10.152.152.11","TLSv1","507","Application Data"
"209","50.442361","10.152.152.11","157.56.126.188","TCP","54","50946  >  443 [ACK] Seq=7027 Ack=3602 Win=2640 Len=0"
"210","50.442448","5.178.135.69","10.152.152.11","TCP","169","53262  >  41249 [PSH, ACK] Seq=1644 Ack=1763 Win=16656 Len=115"
"211","50.478723","10.152.152.11","5.178.135.69","TCP","54","41249  >  53262 [ACK] Seq=1763 Ack=1759 Win=17824 Len=0"
"212","50.516253","157.56.126.188","10.152.152.11","TLSv1","507","Application Data"
"213","50.516287","10.152.152.11","157.56.126.188","TCP","54","50946  >  443 [ACK] Seq=7027 Ack=4055 Win=2640 Len=0"
"214","50.618339","10.152.152.11","5.1.83.201","UDP","70","3697  >  3697 Len=28"
"215","51.020458","10.152.152.11","5.1.83.201","UDP","70","3697  >  3697 Len=28"
"216","51.186140","5.178.135.69","10.152.152.11","TCP","82","53262  >  41249 [PSH, ACK] Seq=1759 Ack=1763 Win=16656 Len=28"
"217","51.186171","10.152.152.11","5.178.135.69","TCP","54","41249  >  53262 [ACK] Seq=1763 Ack=1787 Win=17824 Len=0"
"218","51.451858","5.178.135.69","10.152.152.11","TCP","218","53262  >  41249 [PSH, ACK] Seq=1787 Ack=1763 Win=16656 Len=164"
"219","51.451886","10.152.152.11","5.178.135.69","TCP","54","41249  >  53262 [ACK] Seq=1763 Ack=1951 Win=18896 Len=0"
"220","51.452804","10.152.152.11","5.178.135.69","TCP","83","41249  >  53262 [PSH, ACK] Seq=1763 Ack=1951 Win=18896 Len=29"
"221","51.453158","5.178.135.69","10.152.152.11","TCP","60","53262  >  41249 [ACK] Seq=1951 Ack=1792 Win=16656 Len=0"
"222","51.453414","10.152.152.11","5.178.135.69","TCP","792","41249  >  53262 [PSH, ACK] Seq=1792 Ack=1951 Win=18896 Len=738"
"223","51.453807","10.152.152.11","5.178.135.69","TCP","103","41249  >  53262 [PSH, ACK] Seq=2530 Ack=1951 Win=18896 Len=49"
"224","51.453924","5.178.135.69","10.152.152.11","TCP","60","53262  >  41249 [ACK] Seq=1951 Ack=2530 Win=18704 Len=0"
"225","51.454121","5.178.135.69","10.152.152.11","TCP","60","53262  >  41249 [ACK] Seq=1951 Ack=2579 Win=18704 Len=0"
"226","51.454401","10.152.152.11","5.178.135.69","TCP","74","41249  >  53262 [PSH, ACK] Seq=2579 Ack=1951 Win=18896 Len=20"
"227","51.454775","5.178.135.69","10.152.152.11","TCP","60","53262  >  41249 [ACK] Seq=1951 Ack=2599 Win=18704 Len=0"
"228","51.855901","10.152.152.11","5.1.83.201","UDP","70","3697  >  3697 Len=28"
"229","52.415791","5.178.135.69","10.152.152.11","TCP","81","53262  >  41249 [PSH, ACK] Seq=1951 Ack=2599 Win=18704 Len=27"
"230","52.454725","10.152.152.11","5.178.135.69","TCP","54","41249  >  53262 [ACK] Seq=2599 Ack=1978 Win=18896 Len=0"
"231","52.688706","5.178.135.69","10.152.152.11","TCP","184","53262  >  41249 [PSH, ACK] Seq=1978 Ack=2599 Win=18704 Len=130"
"232","52.688740","10.152.152.11","5.178.135.69","TCP","54","41249  >  53262 [ACK] Seq=2599 Ack=2108 Win=19968 Len=0"
"233","52.689435","10.152.152.11","5.178.135.69","TCP","74","41249  >  53262 [PSH, ACK] Seq=2599 Ack=2108 Win=19968 Len=20"
"234","52.689887","5.178.135.69","10.152.152.11","TCP","60","53262  >  41249 [ACK] Seq=2108 Ack=2619 Win=18704 Len=0"
"235","52.690141","10.152.152.11","5.178.135.69","TCP","81","41249  >  53262 [PSH, ACK] Seq=2619 Ack=2108 Win=19968 Len=27"
"236","52.690501","5.178.135.69","10.152.152.11","TCP","60","53262  >  41249 [ACK] Seq=2108 Ack=2646 Win=18704 Len=0"
"237","52.690729","10.152.152.11","5.178.135.69","TCP","369","41249  >  53262 [PSH, ACK] Seq=2646 Ack=2108 Win=19968 Len=315"
"238","52.691130","5.178.135.69","10.152.152.11","TCP","60","53262  >  41249 [ACK] Seq=2108 Ack=2961 Win=20752 Len=0"
"239","52.691169","10.152.152.11","5.178.135.69","TCP","95","41249  >  53262 [PSH, ACK] Seq=2961 Ack=2108 Win=19968 Len=41"
"240","52.691428","5.178.135.69","10.152.152.11","TCP","60","53262  >  41249 [ACK] Seq=2108 Ack=3002 Win=20752 Len=0"
"241","53.494227","10.152.152.11","5.1.83.201","UDP","70","3697  >  3697 Len=28"
"242","53.506180","5.178.135.69","10.152.152.11","TCP","81","53262  >  41249 [PSH, ACK] Seq=2108 Ack=3002 Win=20752 Len=27"
"243","53.542741","10.152.152.11","5.178.135.69","TCP","54","41249  >  53262 [ACK] Seq=3002 Ack=2135 Win=19968 Len=0"
"244","53.746988","5.178.135.69","10.152.152.11","TCP","190","53262  >  41249 [PSH, ACK] Seq=2135 Ack=3002 Win=20752 Len=136"
"245","53.747023","10.152.152.11","5.178.135.69","TCP","54","41249  >  53262 [ACK] Seq=3002 Ack=2271 Win=21040 Len=0"
"246","53.747712","10.152.152.11","5.178.135.69","TCP","82","41249  >  53262 [PSH, ACK] Seq=3002 Ack=2271 Win=21040 Len=28"
"247","53.748168","5.178.135.69","10.152.152.11","TCP","60","53262  >  41249 [ACK] Seq=2271 Ack=3030 Win=20752 Len=0"
"248","53.748322","10.152.152.11","5.178.135.69","TCP","82","41249  >  53262 [PSH, ACK] Seq=3030 Ack=2271 Win=21040 Len=28"
"249","53.748680","5.178.135.69","10.152.152.11","TCP","60","53262  >  41249 [ACK] Seq=2271 Ack=3058 Win=20752 Len=0"
"250","53.748779","10.152.152.11","5.178.135.69","TCP","115","41249  >  53262 [PSH, ACK] Seq=3058 Ack=2271 Win=21040 Len=61"
"251","53.748977","10.152.152.11","5.178.135.69","TCP","108","41249  >  53262 [PSH, ACK] Seq=3119 Ack=2271 Win=21040 Len=54"
"252","53.749062","5.178.135.69","10.152.152.11","TCP","60","53262  >  41249 [ACK] Seq=2271 Ack=3119 Win=20752 Len=0"
"253","53.749149","5.178.135.69","10.152.152.11","TCP","60","53262  >  41249 [ACK] Seq=2271 Ack=3173 Win=20752 Len=0"
"254","53.749416","10.152.152.11","5.178.135.69","TCP","101","41249  >  53262 [PSH, ACK] Seq=3173 Ack=2271 Win=21040 Len=47"
"255","53.749777","5.178.135.69","10.152.152.11","TCP","60","53262  >  41249 [ACK] Seq=2271 Ack=3220 Win=20752 Len=0"
"256","54.301925","10.152.152.11","174.119.156.255","UDP","60","3697  >  8724 Len=18"
"257","54.302168","10.152.152.11","83.34.39.203","UDP","60","3697  >  1117 Len=18"
"258","54.302385","10.152.152.11","157.55.130.154","UDP","60","3697  >  443 Len=18"
"259","54.302669","10.152.152.11","111.221.77.169","UDP","60","3697  >  443 Len=18"
"260","54.570603","5.178.135.69","10.152.152.11","TCP","74","53262  >  41249 [PSH, ACK] Seq=2271 Ack=3220 Win=20752 Len=20"
"261","54.606726","10.152.152.11","5.178.135.69","TCP","54","41249  >  53262 [ACK] Seq=3220 Ack=2291 Win=21040 Len=0"
"262","54.842105","5.178.135.69","10.152.152.11","TCP","344","53262  >  41249 [PSH, ACK] Seq=2291 Ack=3220 Win=20752 Len=290"
"263","54.842139","10.152.152.11","5.178.135.69","TCP","54","41249  >  53262 [ACK] Seq=3220 Ack=2581 Win=22112 Len=0"
"264","54.843560","10.152.152.11","5.178.135.69","TCP","83","41249  >  53262 [PSH, ACK] Seq=3220 Ack=2581 Win=22112 Len=29"
"265","54.843934","5.178.135.69","10.152.152.11","TCP","60","53262  >  41249 [ACK] Seq=2581 Ack=3249 Win=20752 Len=0"
"266","54.844254","10.152.152.11","5.178.135.69","TCP","83","41249  >  53262 [PSH, ACK] Seq=3249 Ack=2581 Win=22112 Len=29"
"267","54.844617","5.178.135.69","10.152.152.11","TCP","60","53262  >  41249 [ACK] Seq=2581 Ack=3278 Win=20752 Len=0"
"268","54.844741","10.152.152.11","5.178.135.69","TCP","107","41249  >  53262 [PSH, ACK] Seq=3278 Ack=2581 Win=22112 Len=53"
"269","54.845009","5.178.135.69","10.152.152.11","TCP","60","53262  >  41249 [ACK] Seq=2581 Ack=3331 Win=20752 Len=0"
"270","54.845405","10.152.152.11","5.178.135.69","TCP","81","41249  >  53262 [PSH, ACK] Seq=3331 Ack=2581 Win=22112 Len=27"
"271","54.845780","5.178.135.69","10.152.152.11","TCP","60","53262  >  41249 [ACK] Seq=2581 Ack=3358 Win=20752 Len=0"
"272","54.846092","10.152.152.11","5.178.135.69","TCP","117","41249  >  53262 [PSH, ACK] Seq=3358 Ack=2581 Win=22112 Len=63"
"273","54.846709","5.178.135.69","10.152.152.11","TCP","60","53262  >  41249 [ACK] Seq=2581 Ack=3421 Win=20752 Len=0"
"274","54.847058","10.152.152.11","5.178.135.69","TCP","82","41249  >  53262 [PSH, ACK] Seq=3421 Ack=2581 Win=22112 Len=28"
"275","54.847446","5.178.135.69","10.152.152.11","TCP","60","53262  >  41249 [ACK] Seq=2581 Ack=3449 Win=20752 Len=0"
"276","55.626300","5.178.135.69","10.152.152.11","TCP","83","53262  >  41249 [PSH, ACK] Seq=2581 Ack=3449 Win=20752 Len=29"
"277","55.662723","10.152.152.11","5.178.135.69","TCP","54","41249  >  53262 [ACK] Seq=3449 Ack=2610 Win=22112 Len=0"
"278","55.888575","5.178.135.69","10.152.152.11","TCP","189","53262  >  41249 [PSH, ACK] Seq=2610 Ack=3449 Win=20752 Len=135"
"279","55.888662","10.152.152.11","5.178.135.69","TCP","54","41249  >  53262 [ACK] Seq=3449 Ack=2745 Win=23184 Len=0"
"280","55.889615","10.152.152.11","5.178.135.69","TCP","80","41249  >  53262 [PSH, ACK] Seq=3449 Ack=2745 Win=23184 Len=26"
"281","55.889920","10.152.152.11","5.178.135.69","TCP","160","41249  >  53262 [PSH, ACK] Seq=3475 Ack=2745 Win=23184 Len=106"
"282","55.890102","5.178.135.69","10.152.152.11","TCP","60","53262  >  41249 [ACK] Seq=2745 Ack=3475 Win=20752 Len=0"
"283","55.890130","5.178.135.69","10.152.152.11","TCP","60","53262  >  41249 [ACK] Seq=2745 Ack=3581 Win=20752 Len=0"
"284","55.890256","10.152.152.11","5.178.135.69","TCP","95","41249  >  53262 [PSH, ACK] Seq=3581 Ack=2745 Win=23184 Len=41"
"285","55.890659","5.178.135.69","10.152.152.11","TCP","60","53262  >  41249 [ACK] Seq=2745 Ack=3622 Win=20752 Len=0"
"286","55.891011","10.152.152.11","5.178.135.69","TCP","81","41249  >  53262 [PSH, ACK] Seq=3622 Ack=2745 Win=23184 Len=27"
"287","55.891465","5.178.135.69","10.152.152.11","TCP","60","53262  >  41249 [ACK] Seq=2745 Ack=3649 Win=20752 Len=0"
"288","56.277203","5.178.135.69","10.152.152.11","TCP","188","53262  >  41249 [PSH, ACK] Seq=2745 Ack=3649 Win=20752 Len=134"
"289","56.277923","10.152.152.11","5.178.135.69","TCP","82","41249  >  53262 [PSH, ACK] Seq=3649 Ack=2879 Win=24256 Len=28"
"290","56.278357","5.178.135.69","10.152.152.11","TCP","60","53262  >  41249 [ACK] Seq=2879 Ack=3677 Win=20752 Len=0"
"291","56.278537","10.152.152.11","5.178.135.69","TCP","101","41249  >  53262 [PSH, ACK] Seq=3677 Ack=2879 Win=24256 Len=47"
"292","56.278998","5.178.135.69","10.152.152.11","TCP","60","53262  >  41249 [ACK] Seq=2879 Ack=3724 Win=20752 Len=0"
"293","56.550741","157.56.126.188","10.152.152.11","TLSv1","507","Application Data"
"294","56.550777","10.152.152.11","157.56.126.188","TCP","54","50946  >  443 [ACK] Seq=7027 Ack=4508 Win=2640 Len=0"
"295","56.702668","10.152.152.11","5.1.83.201","UDP","70","3697  >  3697 Len=28"
"296","57.009956","5.178.135.69","10.152.152.11","TCP","83","53262  >  41249 [PSH, ACK] Seq=2879 Ack=3724 Win=20752 Len=29"
"297","57.049757","10.152.152.11","5.178.135.69","TCP","54","41249  >  53262 [ACK] Seq=3724 Ack=2908 Win=24256 Len=0"
"298","57.082127","5.178.135.69","10.152.152.11","TCP","116","53262  >  41249 [PSH, ACK] Seq=2908 Ack=3724 Win=20752 Len=62"
"299","57.082153","10.152.152.11","5.178.135.69","TCP","54","41249  >  53262 [ACK] Seq=3724 Ack=2970 Win=24256 Len=0"
"300","57.082871","10.152.152.11","5.178.135.69","TCP","81","41249  >  53262 [PSH, ACK] Seq=3724 Ack=2970 Win=24256 Len=27"
"301","57.083317","5.178.135.69","10.152.152.11","TCP","60","53262  >  41249 [ACK] Seq=2970 Ack=3751 Win=20752 Len=0"
"302","57.197592","5.178.135.69","10.152.152.11","TCP","81","53262  >  41249 [PSH, ACK] Seq=2970 Ack=3751 Win=20752 Len=27"
"303","57.234737","10.152.152.11","5.178.135.69","TCP","54","41249  >  53262 [ACK] Seq=3751 Ack=2997 Win=24256 Len=0"
"304","59.072624","10.152.152.11","5.178.135.69","TCP","784","41249  >  53262 [PSH, ACK] Seq=3751 Ack=2997 Win=24256 Len=730"
"305","59.072885","5.178.135.69","10.152.152.11","TCP","60","53262  >  41249 [ACK] Seq=2997 Ack=4481 Win=22800 Len=0"
"306","59.073835","10.152.152.11","157.56.126.188","TLSv1","1307","Application Data"
"307","59.112874","157.56.126.188","10.152.152.11","TCP","60","443  >  50946 [ACK] Seq=4508 Ack=8280 Win=2640 Len=0"
"308","59.302790","10.152.152.11","174.119.156.255","UDP","60","3697  >  8724 Len=18"
"309","59.303056","10.152.152.11","83.34.39.203","UDP","60","3697  >  1117 Len=18"
"310","59.912685","157.56.126.188","10.152.152.11","TLSv1","155","Application Data"
"311","59.912775","10.152.152.11","157.56.126.188","TCP","54","50946  >  443 [ACK] Seq=8280 Ack=4609 Win=2640 Len=0"
"312","60.003744","5.178.135.69","10.152.152.11","TCP","81","53262  >  41249 [PSH, ACK] Seq=2997 Ack=4481 Win=22800 Len=27"
"313","60.003830","10.152.152.11","5.178.135.69","TCP","54","41249  >  53262 [ACK] Seq=4481 Ack=3024 Win=24256 Len=0"
"314","60.263659","5.178.135.69","10.152.152.11","TCP","95","53262  >  41249 [PSH, ACK] Seq=3024 Ack=4481 Win=22800 Len=41"
"315","60.263692","10.152.152.11","5.178.135.69","TCP","54","41249  >  53262 [ACK] Seq=4481 Ack=3065 Win=24256 Len=0"
"316","60.264358","10.152.152.11","5.178.135.69","TCP","82","41249  >  53262 [PSH, ACK] Seq=4481 Ack=3065 Win=24256 Len=28"
"317","60.264768","5.178.135.69","10.152.152.11","TCP","60","53262  >  41249 [ACK] Seq=3065 Ack=4509 Win=22800 Len=0"
"318","60.818330","10.152.152.11","157.55.130.175","TCP","147","42164  >  33033 [PSH, ACK] Seq=815 Ack=3754 Win=4042 Len=93"
"319","60.818909","157.55.130.175","10.152.152.11","TCP","60","33033  >  42164 [ACK] Seq=3754 Ack=908 Win=2640 Len=0"
"320","61.704071","157.55.130.175","10.152.152.11","TCP","60","33033  >  42164 [PSH, ACK] Seq=3754 Ack=908 Win=2640 Len=3"
"321","61.704163","10.152.152.11","157.55.130.175","TCP","54","42164  >  33033 [ACK] Seq=908 Ack=3757 Win=4042 Len=0"
"322","61.851501","157.55.130.175","10.152.152.11","TCP","104","33033  >  42164 [PSH, ACK] Seq=3757 Ack=908 Win=2640 Len=50"
"323","61.851529","10.152.152.11","157.55.130.175","TCP","54","42164  >  33033 [ACK] Seq=908 Ack=3807 Win=4042 Len=0"
"324","61.852461","10.152.152.11","5.1.83.201","UDP","70","3697  >  3697 Len=28"
"325","61.996084","157.56.126.188","10.152.152.11","TLSv1","507","Application Data"
"326","61.996114","10.152.152.11","157.56.126.188","TCP","54","50946  >  443 [ACK] Seq=8280 Ack=5062 Win=2640 Len=0"
"327","62.099444","10.152.152.11","5.1.83.201","UDP","70","3697  >  3697 Len=28"
"328","62.500990","10.152.152.11","5.1.83.201","UDP","70","3697  >  3697 Len=28"
"329","63.302978","10.152.152.11","5.1.83.201","UDP","70","3697  >  3697 Len=28"
"330","64.306503","10.152.152.11","174.119.156.255","UDP","60","3697  >  8724 Len=18"
"331","64.306805","10.152.152.11","83.34.39.203","UDP","60","3697  >  1117 Len=18"
"332","64.907712","10.152.152.11","5.1.83.201","UDP","70","3697  >  3697 Len=28"
"333","68.113867","10.152.152.11","5.1.83.201","UDP","70","3697  >  3697 Len=28"
"334","68.594236","157.56.126.188","10.152.152.11","TLSv1","507","Application Data"
"335","68.594271","10.152.152.11","157.56.126.188","TCP","54","50946  >  443 [ACK] Seq=8280 Ack=5515 Win=2640 Len=0"
"336","69.346739","10.152.152.11","174.119.156.255","UDP","60","3697  >  8724 Len=18"
"337","69.347023","10.152.152.11","83.34.39.203","UDP","60","3697  >  1117 Len=18"
"338","72.253694","10.152.152.11","157.55.130.175","TCP","147","42164  >  33033 [PSH, ACK] Seq=908 Ack=3807 Win=4042 Len=93"
"339","72.254264","157.55.130.175","10.152.152.11","TCP","60","33033  >  42164 [ACK] Seq=3807 Ack=1001 Win=2640 Len=0"
"340","73.062018","157.55.130.175","10.152.152.11","TCP","60","33033  >  42164 [PSH, ACK] Seq=3807 Ack=1001 Win=2640 Len=3"
"341","73.062119","10.152.152.11","157.55.130.175","TCP","54","42164  >  33033 [ACK] Seq=1001 Ack=3810 Win=4042 Len=0"
"342","73.207862","157.55.130.175","10.152.152.11","TCP","104","33033  >  42164 [PSH, ACK] Seq=3810 Ack=1001 Win=2640 Len=50"
"343","73.207890","10.152.152.11","157.55.130.175","TCP","54","42164  >  33033 [ACK] Seq=1001 Ack=3860 Win=4042 Len=0"
"344","73.208830","10.152.152.11","5.1.83.201","UDP","70","3697  >  3697 Len=28"
"345","73.411087","10.152.152.11","5.1.83.201","UDP","70","3697  >  3697 Len=28"
"346","73.814915","10.152.152.11","5.1.83.201","UDP","70","3697  >  3697 Len=28"
"347","74.167275","10.152.152.11","157.56.126.188","TLSv1","683","Application Data"
"348","74.167739","157.56.126.188","10.152.152.11","TCP","60","443  >  50946 [ACK] Seq=5515 Ack=8909 Win=2640 Len=0"
"349","74.624739","10.152.152.11","187.188.101.230","UDP","60","3697  >  63872 Len=18"
"350","74.625005","10.152.152.11","68.105.234.38","UDP","60","3697  >  41903 Len=18"
"351","74.625230","10.152.152.11","188.143.121.199","UDP","60","3697  >  21909 Len=18"
