"No.","Time","Source","Destination","Protocol","Length","Info"
"1","0.000000","10.152.152.11","10.152.152.10","DNS","79","Standard query 0x322c A smtp.googlemail.com"
"2","0.000064","10.152.152.11","10.152.152.10","DNS","79","Standard query 0xf165 AAAA smtp.googlemail.com"
"3","0.292514","10.152.152.10","10.152.152.11","DNS","95","Standard query response 0x322c A smtp.googlemail.com A 74.125.136.16"
"4","0.475394","10.152.152.10","10.152.152.11","DNS","79","Standard query response 0xf165 No such name AAAA smtp.googlemail.com"
"5","0.476146","10.152.152.11","74.125.136.16","TCP","66","50591  >  465 [SYN] Seq=0 Win=14600 Len=0 MSS=1460 SACK_PERM=1 WS=16"
"6","0.476499","74.125.136.16","10.152.152.11","TCP","66","465  >  50591 [SYN, ACK] Seq=0 Ack=1 Win=14600 Len=0 MSS=1460 SACK_PERM=1 WS=16"
"7","0.476540","10.152.152.11","74.125.136.16","TCP","54","50591  >  465 [ACK] Seq=1 Ack=1 Win=14608 Len=0"
"8","0.477368","10.152.152.11","74.125.136.16","TLSv1.2","212","Client Hello"
"9","0.477808","74.125.136.16","10.152.152.11","TCP","60","465  >  50591 [ACK] Seq=1 Ack=159 Win=15680 Len=0"
"10","0.996801","74.125.136.16","10.152.152.11","TLSv1.2","1514","Server Hello"
"11","0.996907","10.152.152.11","74.125.136.16","TCP","54","50591  >  465 [ACK] Seq=159 Ack=1461 Win=17520 Len=0"
"12","0.996944","74.125.136.16","10.152.152.11","TCP","1514","465  >  50591 [ACK] Seq=1461 Ack=159 Win=15680 Len=1460 [TCP segment of a reassembled PDU]"
"13","0.996962","10.152.152.11","74.125.136.16","TCP","54","50591  >  465 [ACK] Seq=159 Ack=2921 Win=20448 Len=0"
"14","0.997028","74.125.136.16","10.152.152.11","TLSv1.2","620","Certificate [TCP segment of a reassembled PDU]"
"15","0.997040","10.152.152.11","74.125.136.16","TCP","54","50591  >  465 [ACK] Seq=159 Ack=3487 Win=23360 Len=0"
"16","1.141714","74.125.136.16","10.152.152.11","TLSv1.2","71","Server Key Exchange, Server Hello Done"
"17","1.141767","10.152.152.11","74.125.136.16","TCP","54","50591  >  465 [ACK] Seq=159 Ack=3504 Win=23360 Len=0"
"18","1.148907","10.152.152.11","74.125.136.16","TLSv1.2","180","Client Key Exchange, Change Cipher Spec, Encrypted Handshake Message"
"19","1.149155","74.125.136.16","10.152.152.11","TCP","60","465  >  50591 [ACK] Seq=3504 Ack=285 Win=15680 Len=0"
"20","1.447163","74.125.136.16","10.152.152.11","TLSv1.2","300","New Session Ticket, Change Cipher Spec, Encrypted Handshake Message"
"21","1.483520","10.152.152.11","74.125.136.16","TCP","54","50591  >  465 [ACK] Seq=285 Ack=3750 Win=26288 Len=0"
"22","1.664861","74.125.136.16","10.152.152.11","TLSv1.2","142","Application Data"
"23","1.664913","10.152.152.11","74.125.136.16","TCP","54","50591  >  465 [ACK] Seq=285 Ack=3838 Win=26288 Len=0"
"24","1.674203","10.152.152.11","74.125.136.16","TLSv1.2","105","Application Data"
"25","1.674565","74.125.136.16","10.152.152.11","TCP","60","465  >  50591 [ACK] Seq=3838 Ack=336 Win=15680 Len=0"
"26","2.045460","74.125.136.16","10.152.152.11","TLSv1.2","298","Application Data"
"27","2.066271","10.152.152.11","10.152.152.10","DNS","78","Standard query 0x8c9e A www.googleapis.com"
"28","2.066312","10.152.152.11","10.152.152.10","DNS","78","Standard query 0x2bd7 AAAA www.googleapis.com"
"29","2.066602","10.152.152.11","10.152.152.10","DNS","78","Standard query 0x8a6a A www.googleapis.com"
"30","2.083039","10.152.152.11","74.125.136.16","TCP","54","50591  >  465 [ACK] Seq=336 Ack=4082 Win=29200 Len=0"
"31","2.384444","10.152.152.10","10.152.152.11","DNS","94","Standard query response 0x8c9e A www.googleapis.com A 216.58.213.10"
"32","2.527609","10.152.152.10","10.152.152.11","DNS","78","Standard query response 0x2bd7 No such name AAAA www.googleapis.com"
"33","2.593072","10.152.152.10","10.152.152.11","DNS","94","Standard query response 0x8a6a A www.googleapis.com A 216.58.213.10"
"34","2.593421","10.152.152.11","216.58.213.10","TCP","66","46669  >  443 [SYN] Seq=0 Win=14600 Len=0 MSS=1460 SACK_PERM=1 WS=16"
"35","2.593717","216.58.213.10","10.152.152.11","TCP","66","443  >  46669 [SYN, ACK] Seq=0 Ack=1 Win=14600 Len=0 MSS=1460 SACK_PERM=1 WS=16"
"36","2.593746","10.152.152.11","216.58.213.10","TCP","54","46669  >  443 [ACK] Seq=1 Ack=1 Win=14608 Len=0"
"37","2.594215","10.152.152.11","216.58.213.10","TLSv1.2","260","Client Hello"
"38","2.594422","216.58.213.10","10.152.152.11","TCP","60","443  >  46669 [ACK] Seq=1 Ack=207 Win=15680 Len=0"
"39","3.100773","216.58.213.10","10.152.152.11","TLSv1.2","1514","Server Hello"
"40","3.100840","10.152.152.11","216.58.213.10","TCP","54","46669  >  443 [ACK] Seq=207 Ack=1461 Win=17520 Len=0"
"41","3.100864","216.58.213.10","10.152.152.11","TCP","1514","443  >  46669 [ACK] Seq=1461 Ack=207 Win=15680 Len=1460 [TCP segment of a reassembled PDU]"
"42","3.100875","10.152.152.11","216.58.213.10","TCP","54","46669  >  443 [ACK] Seq=207 Ack=2921 Win=20448 Len=0"
"43","3.100889","216.58.213.10","10.152.152.11","TLSv1.2","620","Certificate [TCP segment of a reassembled PDU]"
"44","3.100897","10.152.152.11","216.58.213.10","TCP","54","46669  >  443 [ACK] Seq=207 Ack=3487 Win=23360 Len=0"
"45","3.164988","216.58.213.10","10.152.152.11","TLSv1.2","163","Server Key Exchange, Server Hello Done"
"46","3.165037","10.152.152.11","216.58.213.10","TCP","54","46669  >  443 [ACK] Seq=207 Ack=3596 Win=23360 Len=0"
"47","3.169377","10.152.152.11","216.58.213.10","TLSv1.2","180","Client Key Exchange, Change Cipher Spec, Encrypted Handshake Message"
"48","3.169568","216.58.213.10","10.152.152.11","TCP","60","443  >  46669 [ACK] Seq=3596 Ack=333 Win=15680 Len=0"
"49","3.169786","10.152.152.11","216.58.213.10","TLSv1.2","211","Application Data"
"50","3.169937","216.58.213.10","10.152.152.11","TCP","60","443  >  46669 [ACK] Seq=3596 Ack=490 Win=16752 Len=0"
"51","3.170002","10.152.152.11","216.58.213.10","TLSv1.2","336","Application Data"
"52","3.170131","10.152.152.11","216.58.213.10","TLSv1.2","300","Application Data"
"53","3.170244","216.58.213.10","10.152.152.11","TCP","60","443  >  46669 [ACK] Seq=3596 Ack=772 Win=17824 Len=0"
"54","3.170251","216.58.213.10","10.152.152.11","TCP","60","443  >  46669 [ACK] Seq=3596 Ack=1018 Win=18896 Len=0"
"55","3.549182","216.58.213.10","10.152.152.11","TLSv1.2","436","New Session Ticket, Change Cipher Spec, Encrypted Handshake Message, Application Data, Application Data, Application Data"
"56","3.561427","10.152.152.11","216.58.213.10","TLSv1.2","92","Application Data"
"57","3.561921","216.58.213.10","10.152.152.11","TCP","60","443  >  46669 [ACK] Seq=3978 Ack=1056 Win=18896 Len=0"
"58","3.694080","216.58.213.10","10.152.152.11","TLSv1.2","634","Application Data, Application Data, Application Data"
"59","3.694736","10.152.152.11","216.58.213.10","TLSv1.2","100","Application Data"
"60","3.695112","216.58.213.10","10.152.152.11","TCP","60","443  >  46669 [ACK] Seq=4558 Ack=1102 Win=18896 Len=0"
"61","3.727179","10.152.152.11","74.125.136.16","TLSv1.2","250","Application Data"
"62","3.727433","74.125.136.16","10.152.152.11","TCP","60","465  >  50591 [ACK] Seq=4082 Ack=532 Win=16752 Len=0"
"63","4.647982","74.125.136.16","10.152.152.11","TLSv1.2","103","Application Data"
"64","4.648054","10.152.152.11","74.125.136.16","TCP","54","50591  >  465 [ACK] Seq=532 Ack=4131 Win=29200 Len=0"
"65","4.659279","10.152.152.11","74.125.136.16","TLSv1.2","126","Application Data"
"66","4.659715","74.125.136.16","10.152.152.11","TCP","60","465  >  50591 [ACK] Seq=4131 Ack=604 Win=16752 Len=0"
"67","5.146627","74.125.136.16","10.152.152.11","TLSv1.2","125","Application Data"
"68","5.158216","10.152.152.11","74.125.136.16","TLSv1.2","114","Application Data"
"69","5.158710","74.125.136.16","10.152.152.11","TCP","60","465  >  50591 [ACK] Seq=4202 Ack=664 Win=16752 Len=0"
"70","5.547102","74.125.136.16","10.152.152.11","TLSv1.2","125","Application Data"
"71","5.575115","10.152.152.11","74.125.136.16","TLSv1.2","89","Application Data"
"72","5.575429","74.125.136.16","10.152.152.11","TCP","60","465  >  50591 [ACK] Seq=4273 Ack=699 Win=16752 Len=0"
"73","6.347570","74.125.136.16","10.152.152.11","TLSv1.2","126","Application Data"
"74","6.374388","10.152.152.11","74.125.136.16","TCP","1514","50591  >  465 [ACK] Seq=699 Ack=4345 Win=29200 Len=1460 [TCP segment of a reassembled PDU]"
"75","6.374484","10.152.152.11","74.125.136.16","TLSv1.2","1183","Application Data"
"76","6.374790","74.125.136.16","10.152.152.11","TCP","60","465  >  50591 [ACK] Seq=4345 Ack=2159 Win=19664 Len=0"
"77","6.374813","74.125.136.16","10.152.152.11","TCP","60","465  >  50591 [ACK] Seq=4345 Ack=3288 Win=22592 Len=0"
"78","7.746961","74.125.136.16","10.152.152.11","TLSv1.2","136","Application Data"
"79","7.757802","10.152.152.11","74.125.136.16","TLSv1.2","89","Application Data"
"80","7.758313","74.125.136.16","10.152.152.11","TCP","60","465  >  50591 [ACK] Seq=4427 Ack=3323 Win=22592 Len=0"
"81","8.145504","74.125.136.16","10.152.152.11","TLSv1.2","141","Application Data"
"82","8.145571","74.125.136.16","10.152.152.11","TCP","60","465  >  50591 [FIN, ACK] Seq=4514 Ack=3323 Win=22592 Len=0"
"83","8.183476","10.152.152.11","74.125.136.16","TLSv1.2","85","Encrypted Alert"
"84","8.183521","10.152.152.11","74.125.136.16","TCP","54","50591  >  465 [FIN, ACK] Seq=3354 Ack=4515 Win=29200 Len=0"
"85","8.183695","74.125.136.16","10.152.152.11","TCP","60","465  >  50591 [RST] Seq=4515 Win=0 Len=0"
"86","8.183737","74.125.136.16","10.152.152.11","TCP","60","465  >  50591 [RST] Seq=4515 Win=0 Len=0"
"87","27.265147","10.152.152.11","74.125.136.16","TCP","66","50593  >  465 [SYN] Seq=0 Win=14600 Len=0 MSS=1460 SACK_PERM=1 WS=16"
"88","27.265514","74.125.136.16","10.152.152.11","TCP","66","465  >  50593 [SYN, ACK] Seq=0 Ack=1 Win=14600 Len=0 MSS=1460 SACK_PERM=1 WS=16"
"89","27.265555","10.152.152.11","74.125.136.16","TCP","54","50593  >  465 [ACK] Seq=1 Ack=1 Win=14608 Len=0"
"90","27.265877","10.152.152.11","74.125.136.16","TLSv1.2","571","Client Hello"
"91","27.266020","74.125.136.16","10.152.152.11","TCP","60","465  >  50593 [ACK] Seq=1 Ack=518 Win=15680 Len=0"
"92","27.779262","74.125.136.16","10.152.152.11","TLSv1.2","191","Server Hello, Change Cipher Spec, Encrypted Handshake Message"
"93","27.779325","10.152.152.11","74.125.136.16","TCP","54","50593  >  465 [ACK] Seq=518 Ack=138 Win=15680 Len=0"
"94","27.779753","10.152.152.11","74.125.136.16","TLSv1.2","105","Change Cipher Spec, Encrypted Handshake Message"
"95","27.780032","74.125.136.16","10.152.152.11","TCP","60","465  >  50593 [ACK] Seq=138 Ack=569 Win=15680 Len=0"
"96","28.333565","74.125.136.16","10.152.152.11","TLSv1.2","141","Application Data"
"97","28.345283","10.152.152.11","74.125.136.16","TLSv1.2","105","Application Data"
"98","28.345552","74.125.136.16","10.152.152.11","TCP","60","465  >  50593 [ACK] Seq=225 Ack=620 Win=15680 Len=0"
"99","28.733467","74.125.136.16","10.152.152.11","TLSv1.2","298","Application Data"
"100","28.753431","10.152.152.11","10.152.152.10","DNS","78","Standard query 0xc1ae A www.googleapis.com"
"101","28.753496","10.152.152.11","216.58.213.10","TLSv1.2","135","Application Data"
"102","28.753533","10.152.152.11","216.58.213.10","TLSv1.2","300","Application Data"
"103","28.753622","10.152.152.11","10.152.152.10","DNS","78","Standard query 0x5b86 AAAA www.googleapis.com"
"104","28.753668","216.58.213.10","10.152.152.11","TCP","60","443  >  46669 [ACK] Seq=4558 Ack=1183 Win=18896 Len=0"
"105","28.753682","216.58.213.10","10.152.152.11","TCP","60","443  >  46669 [ACK] Seq=4558 Ack=1429 Win=19968 Len=0"
"106","28.773309","10.152.152.11","74.125.136.16","TCP","54","50593  >  465 [ACK] Seq=620 Ack=469 Win=16752 Len=0"
"107","29.070313","10.152.152.10","10.152.152.11","DNS","94","Standard query response 0xc1ae A www.googleapis.com A 216.58.213.10"
"108","29.173200","216.58.213.10","10.152.152.11","TLSv1.2","478","Application Data, Application Data, Application Data"
"109","29.173972","10.152.152.11","216.58.213.10","TLSv1.2","100","Application Data"
"110","29.174340","216.58.213.10","10.152.152.11","TCP","60","443  >  46669 [ACK] Seq=4982 Ack=1475 Win=19968 Len=0"
"111","29.177628","10.152.152.11","74.125.136.16","TLSv1.2","250","Application Data"
"112","29.177960","74.125.136.16","10.152.152.11","TCP","60","465  >  50593 [ACK] Seq=469 Ack=816 Win=16752 Len=0"
"113","29.237597","10.152.152.10","10.152.152.11","DNS","78","Standard query response 0x5b86 No such name AAAA www.googleapis.com"
"114","29.731367","74.125.136.16","10.152.152.11","TLSv1.2","103","Application Data"
"115","29.731419","10.152.152.11","74.125.136.16","TCP","54","50593  >  465 [ACK] Seq=816 Ack=518 Win=16752 Len=0"
"116","29.761574","10.152.152.11","74.125.136.16","TLSv1.2","126","Application Data"
"117","29.761877","74.125.136.16","10.152.152.11","TCP","60","465  >  50593 [ACK] Seq=518 Ack=888 Win=16752 Len=0"
"118","30.136638","74.125.136.16","10.152.152.11","TLSv1.2","124","Application Data"
"119","30.142683","10.152.152.11","74.125.136.16","TLSv1.2","114","Application Data"
"120","30.142979","74.125.136.16","10.152.152.11","TCP","60","465  >  50593 [ACK] Seq=588 Ack=948 Win=16752 Len=0"
"121","30.531380","74.125.136.16","10.152.152.11","TLSv1.2","124","Application Data"
"122","30.559053","10.152.152.11","74.125.136.16","TLSv1.2","89","Application Data"
"123","30.559388","74.125.136.16","10.152.152.11","TCP","60","465  >  50593 [ACK] Seq=658 Ack=983 Win=16752 Len=0"
"124","31.133669","74.125.136.16","10.152.152.11","TLSv1.2","125","Application Data"
"125","31.147079","10.152.152.11","74.125.136.16","TCP","1514","50593  >  465 [ACK] Seq=983 Ack=729 Win=16752 Len=1460 [TCP segment of a reassembled PDU]"
"126","31.147366","10.152.152.11","74.125.136.16","TLSv1.2","1187","Application Data"
"127","31.147543","74.125.136.16","10.152.152.11","TCP","60","465  >  50593 [ACK] Seq=729 Ack=2443 Win=19664 Len=0"
"128","31.147640","74.125.136.16","10.152.152.11","TCP","60","465  >  50593 [ACK] Seq=729 Ack=3576 Win=22592 Len=0"
"129","32.737324","74.125.136.16","10.152.152.11","TLSv1.2","135","Application Data"
"130","32.745598","10.152.152.11","74.125.136.16","TLSv1.2","89","Application Data"
"131","32.745902","74.125.136.16","10.152.152.11","TCP","60","465  >  50593 [ACK] Seq=810 Ack=3611 Win=22592 Len=0"
"132","33.132455","74.125.136.16","10.152.152.11","TLSv1.2","140","Application Data"
"133","33.132557","74.125.136.16","10.152.152.11","TCP","60","465  >  50593 [FIN, ACK] Seq=896 Ack=3611 Win=22592 Len=0"
"134","33.171133","10.152.152.11","74.125.136.16","TLSv1.2","85","Encrypted Alert"
"135","33.171178","10.152.152.11","74.125.136.16","TCP","54","50593  >  465 [FIN, ACK] Seq=3642 Ack=897 Win=16752 Len=0"
"136","33.171372","74.125.136.16","10.152.152.11","TCP","60","465  >  50593 [RST] Seq=897 Win=0 Len=0"
"137","33.171406","74.125.136.16","10.152.152.11","TCP","60","465  >  50593 [RST] Seq=897 Win=0 Len=0"
"138","67.347059","10.152.152.11","10.152.152.10","DNS","78","Standard query 0xe0aa A pop.googlemail.com"
"139","67.347257","10.152.152.11","10.152.152.10","DNS","78","Standard query 0x3beb AAAA pop.googlemail.com"
"140","67.615863","10.152.152.10","10.152.152.11","DNS","94","Standard query response 0xe0aa A pop.googlemail.com A 173.194.65.16"
"141","67.757888","10.152.152.10","10.152.152.11","DNS","78","Standard query response 0x3beb No such name AAAA pop.googlemail.com"
"142","67.758407","10.152.152.11","173.194.65.16","TCP","66","60312  >  995 [SYN] Seq=0 Win=14600 Len=0 MSS=1460 SACK_PERM=1 WS=16"
"143","67.758738","173.194.65.16","10.152.152.11","TCP","66","995  >  60312 [SYN, ACK] Seq=0 Ack=1 Win=14600 Len=0 MSS=1460 SACK_PERM=1 WS=16"
"144","67.758766","10.152.152.11","173.194.65.16","TCP","54","60312  >  995 [ACK] Seq=1 Ack=1 Win=14608 Len=0"
"145","67.759179","10.152.152.11","173.194.65.16","TLSv1.2","571","Client Hello"
"146","67.759394","173.194.65.16","10.152.152.11","TCP","60","995  >  60312 [ACK] Seq=1 Ack=518 Win=15680 Len=0"
"147","68.358837","173.194.65.16","10.152.152.11","TLSv1.2","191","Server Hello, Change Cipher Spec, Encrypted Handshake Message"
"148","68.358900","10.152.152.11","173.194.65.16","TCP","54","60312  >  995 [ACK] Seq=518 Ack=138 Win=15680 Len=0"
"149","68.359235","10.152.152.11","173.194.65.16","TLSv1.2","105","Change Cipher Spec, Encrypted Handshake Message"
"150","68.359443","173.194.65.16","10.152.152.11","TCP","60","995  >  60312 [ACK] Seq=138 Ack=569 Win=15680 Len=0"
"151","68.815399","173.194.65.16","10.152.152.11","TLSv1.2","149","Application Data"
"152","68.821747","10.152.152.11","173.194.65.16","TLSv1.2","89","Application Data"
"153","68.822095","173.194.65.16","10.152.152.11","TCP","60","995  >  60312 [ACK] Seq=233 Ack=604 Win=15680 Len=0"
"154","69.414276","173.194.65.16","10.152.152.11","TLSv1.2","206","Application Data"
"155","69.421352","10.152.152.11","173.194.65.16","TLSv1.2","95","Application Data"
"156","69.421835","173.194.65.16","10.152.152.11","TCP","60","995  >  60312 [ACK] Seq=385 Ack=645 Win=15680 Len=0"
"157","69.938822","173.194.65.16","10.152.152.11","TLSv1.2","87","Application Data"
"158","69.939505","10.152.152.11","173.194.65.16","TLSv1.2","125","Application Data"
"159","69.939815","173.194.65.16","10.152.152.11","TCP","60","995  >  60312 [ACK] Seq=418 Ack=716 Win=15680 Len=0"
"160","71.413648","173.194.65.16","10.152.152.11","TLSv1.2","97","Application Data"
"161","71.418612","10.152.152.11","173.194.65.16","TLSv1.2","89","Application Data"
"162","71.418965","173.194.65.16","10.152.152.11","TCP","60","995  >  60312 [ACK] Seq=461 Ack=751 Win=15680 Len=0"
"163","72.113668","173.194.65.16","10.152.152.11","TLSv1.2","98","Application Data"
"164","72.122254","10.152.152.11","173.194.65.16","TLSv1.2","89","Application Data"
"165","72.122604","173.194.65.16","10.152.152.11","TCP","60","995  >  60312 [ACK] Seq=505 Ack=786 Win=15680 Len=0"
"166","72.810696","173.194.65.16","10.152.152.11","TLSv1.2","162","Application Data"
"167","72.818732","10.152.152.11","173.194.65.16","TLSv1.2","89","Application Data"
"168","72.819076","173.194.65.16","10.152.152.11","TCP","60","995  >  60312 [ACK] Seq=613 Ack=821 Win=15680 Len=0"
"169","73.513743","173.194.65.16","10.152.152.11","TLSv1.2","199","Application Data"
"170","73.518291","10.152.152.11","173.194.65.16","TLSv1.2","91","Application Data"
"171","73.518784","173.194.65.16","10.152.152.11","TCP","60","995  >  60312 [ACK] Seq=758 Ack=858 Win=15680 Len=0"
"172","74.229809","173.194.65.16","10.152.152.11","TLSv1.2","1514","Application Data, Application Data"
"173","74.229839","173.194.65.16","10.152.152.11","TLSv1.2","586","Application Data [TCP segment of a reassembled PDU]"
"174","74.229851","10.152.152.11","173.194.65.16","TCP","54","60312  >  995 [ACK] Seq=858 Ack=2750 Win=23664 Len=0"
"175","74.311844","173.194.65.16","10.152.152.11","TLSv1.2","1514","Application Data, Application Data"
"176","74.311994","173.194.65.16","10.152.152.11","TCP","88","995  >  60312 [PSH, ACK] Seq=4210 Ack=858 Win=15680 Len=34 [TCP segment of a reassembled PDU]"
"177","74.312010","10.152.152.11","173.194.65.16","TCP","54","60312  >  995 [ACK] Seq=858 Ack=4244 Win=26576 Len=0"
"178","74.377549","173.194.65.16","10.152.152.11","TLSv1.2","1514","Application Data [TCP segment of a reassembled PDU]"
"179","74.377665","173.194.65.16","10.152.152.11","TLSv1.2","1514","Application Data [TCP segment of a reassembled PDU]"
"180","74.377686","10.152.152.11","173.194.65.16","TCP","54","60312  >  995 [ACK] Seq=858 Ack=7164 Win=32416 Len=0"
"181","74.377712","173.194.65.16","10.152.152.11","TCP","1118","995  >  60312 [PSH, ACK] Seq=7164 Ack=858 Win=15680 Len=1064 [TCP segment of a reassembled PDU]"
"182","74.414673","10.152.152.11","173.194.65.16","TCP","54","60312  >  995 [ACK] Seq=858 Ack=8228 Win=35344 Len=0"
"183","74.414714","173.194.65.16","10.152.152.11","TLSv1.2","1514","Application Data, Application Data"
"184","74.414738","10.152.152.11","173.194.65.16","TCP","54","60312  >  995 [ACK] Seq=858 Ack=9688 Win=38256 Len=0"
"185","74.414758","173.194.65.16","10.152.152.11","TLSv1.2","1514","Application Data [TCP segment of a reassembled PDU]"
"186","74.414770","10.152.152.11","173.194.65.16","TCP","54","60312  >  995 [ACK] Seq=858 Ack=11148 Win=41184 Len=0"
"187","74.414885","173.194.65.16","10.152.152.11","TLSv1.2","1487","Application Data [TCP segment of a reassembled PDU]"
"188","74.414900","10.152.152.11","173.194.65.16","TCP","54","60312  >  995 [ACK] Seq=858 Ack=12581 Win=40336 Len=0"
"189","74.454670","173.194.65.16","10.152.152.11","TLSv1.2","1514","Application Data [TCP segment of a reassembled PDU]"
"190","74.454782","10.152.152.11","173.194.65.16","TCP","54","60312  >  995 [ACK] Seq=858 Ack=14041 Win=42240 Len=0"
"191","74.454809","173.194.65.16","10.152.152.11","TLSv1.2","1514","Application Data [TCP segment of a reassembled PDU]"
"192","74.454818","10.152.152.11","173.194.65.16","TCP","54","60312  >  995 [ACK] Seq=858 Ack=15501 Win=41456 Len=0"
"193","74.454884","173.194.65.16","10.152.152.11","TLSv1.2","1118","Application Data [TCP segment of a reassembled PDU]"
"194","74.454893","10.152.152.11","173.194.65.16","TCP","54","60312  >  995 [ACK] Seq=858 Ack=16565 Win=40400 Len=0"
"195","74.476992","173.194.65.16","10.152.152.11","TLSv1.2","981","Application Data, Application Data"
"196","74.477050","10.152.152.11","173.194.65.16","TCP","54","60312  >  995 [ACK] Seq=858 Ack=17492 Win=42240 Len=0"
"197","74.516627","173.194.65.16","10.152.152.11","TLSv1.2","1514","Application Data"
"198","74.516653","10.152.152.11","173.194.65.16","TCP","54","60312  >  995 [ACK] Seq=858 Ack=18952 Win=42240 Len=0"
"199","74.516722","173.194.65.16","10.152.152.11","TLSv1.2","1514","Application Data [TCP segment of a reassembled PDU]"
"200","74.516735","10.152.152.11","173.194.65.16","TCP","54","60312  >  995 [ACK] Seq=858 Ack=20412 Win=41456 Len=0"
"201","74.516756","173.194.65.16","10.152.152.11","TCP","1206","995  >  60312 [PSH, ACK] Seq=20412 Ack=858 Win=15680 Len=1152 [TCP segment of a reassembled PDU]"
"202","74.516766","10.152.152.11","173.194.65.16","TCP","54","60312  >  995 [ACK] Seq=858 Ack=21564 Win=40336 Len=0"
"203","74.517005","173.194.65.16","10.152.152.11","TLSv1.2","1514","Application Data [TCP segment of a reassembled PDU]"
"204","74.517018","10.152.152.11","173.194.65.16","TCP","54","60312  >  995 [ACK] Seq=858 Ack=23024 Win=40336 Len=0"
"205","74.517074","173.194.65.16","10.152.152.11","TLSv1.2","1494","Application Data [TCP segment of a reassembled PDU]"
"206","74.517087","10.152.152.11","173.194.65.16","TCP","54","60312  >  995 [ACK] Seq=858 Ack=24464 Win=41456 Len=0"
"207","74.542635","173.194.65.16","10.152.152.11","TLSv1.2","1514","Application Data, Application Data"
"208","74.542676","10.152.152.11","173.194.65.16","TCP","54","60312  >  995 [ACK] Seq=858 Ack=25924 Win=42240 Len=0"
"209","74.542699","173.194.65.16","10.152.152.11","TLSv1.2","1514","Application Data [TCP segment of a reassembled PDU]"
"210","74.542707","10.152.152.11","173.194.65.16","TCP","54","60312  >  995 [ACK] Seq=858 Ack=27384 Win=41456 Len=0"
"211","74.542722","173.194.65.16","10.152.152.11","TCP","1118","995  >  60312 [PSH, ACK] Seq=27384 Ack=858 Win=15680 Len=1064 [TCP segment of a reassembled PDU]"
"212","74.542729","10.152.152.11","173.194.65.16","TCP","54","60312  >  995 [ACK] Seq=858 Ack=28448 Win=40400 Len=0"
"213","74.576643","173.194.65.16","10.152.152.11","TLSv1.2","1514","Application Data [TCP segment of a reassembled PDU]"
"214","74.576672","10.152.152.11","173.194.65.16","TCP","54","60312  >  995 [ACK] Seq=858 Ack=29908 Win=42240 Len=0"
"215","74.576706","173.194.65.16","10.152.152.11","TLSv1.2","1514","Application Data [TCP segment of a reassembled PDU]"
"216","74.576718","173.194.65.16","10.152.152.11","TLSv1.2","1118","Application Data [TCP segment of a reassembled PDU]"
"217","74.576750","10.152.152.11","173.194.65.16","TCP","54","60312  >  995 [ACK] Seq=858 Ack=32432 Win=40336 Len=0"
"218","74.577629","173.194.65.16","10.152.152.11","TLSv1.2","1514","Application Data [TCP segment of a reassembled PDU]"
"219","74.577693","173.194.65.16","10.152.152.11","TLSv1.2","1514","Application Data, Application Data"
"220","74.577709","10.152.152.11","173.194.65.16","TCP","54","60312  >  995 [ACK] Seq=858 Ack=35352 Win=41456 Len=0"
"221","74.577831","173.194.65.16","10.152.152.11","TLSv1.2","949","Application Data [TCP segment of a reassembled PDU]"
"222","74.578105","10.152.152.11","173.194.65.16","TCP","54","60312  >  995 [ACK] Seq=858 Ack=36247 Win=42240 Len=0"
"223","74.578583","173.194.65.16","10.152.152.11","TLSv1.2","1514","Application Data [TCP segment of a reassembled PDU]"
"224","74.578694","173.194.65.16","10.152.152.11","TLSv1.2","1514","Application Data [TCP segment of a reassembled PDU]"
"225","74.578798","10.152.152.11","173.194.65.16","TCP","54","60312  >  995 [ACK] Seq=858 Ack=39167 Win=41456 Len=0"
"226","74.578804","173.194.65.16","10.152.152.11","TLSv1.2","1118","Application Data [TCP segment of a reassembled PDU]"
"227","74.579117","10.152.152.11","173.194.65.16","TCP","54","60312  >  995 [ACK] Seq=858 Ack=40231 Win=42240 Len=0"
"228","74.581186","173.194.65.16","10.152.152.11","TLSv1.2","1514","Application Data [TCP segment of a reassembled PDU]"
"229","74.581204","173.194.65.16","10.152.152.11","TLSv1.2","1514","Application Data [TCP segment of a reassembled PDU]"
"230","74.581277","173.194.65.16","10.152.152.11","TLSv1.2","1118","Application Data [TCP segment of a reassembled PDU]"
"231","74.581453","10.152.152.11","173.194.65.16","TCP","54","60312  >  995 [ACK] Seq=858 Ack=44215 Win=40336 Len=0"
"232","74.617673","173.194.65.16","10.152.152.11","TLSv1.2","1514","Application Data [TCP segment of a reassembled PDU]"
"233","74.617734","173.194.65.16","10.152.152.11","TLSv1.2","1514","Application Data [TCP segment of a reassembled PDU]"
"234","74.617753","10.152.152.11","173.194.65.16","TCP","54","60312  >  995 [ACK] Seq=858 Ack=47135 Win=41456 Len=0"
"235","74.617780","173.194.65.16","10.152.152.11","TLSv1.2","1206","Application Data [TCP segment of a reassembled PDU]"
"236","74.618502","10.152.152.11","173.194.65.16","TCP","54","60312  >  995 [ACK] Seq=858 Ack=48287 Win=42240 Len=0"
"237","74.618742","173.194.65.16","10.152.152.11","TLSv1.2","1460","Application Data [TCP segment of a reassembled PDU]"
"238","74.619092","10.152.152.11","173.194.65.16","TCP","54","60312  >  995 [ACK] Seq=858 Ack=49693 Win=42240 Len=0"
"239","74.621217","173.194.65.16","10.152.152.11","TLSv1.2","1514","Application Data [TCP segment of a reassembled PDU]"
"240","74.621273","173.194.65.16","10.152.152.11","TLSv1.2","1514","Application Data [TCP segment of a reassembled PDU]"
"241","74.621284","173.194.65.16","10.152.152.11","TCP","420","995  >  60312 [PSH, ACK] Seq=52613 Ack=858 Win=15680 Len=366 [TCP segment of a reassembled PDU]"
"242","74.621388","10.152.152.11","173.194.65.16","TCP","54","60312  >  995 [ACK] Seq=858 Ack=52979 Win=40336 Len=0"
"243","74.660928","173.194.65.16","10.152.152.11","TLSv1.2","1514","Application Data [TCP segment of a reassembled PDU]"
"244","74.660986","173.194.65.16","10.152.152.11","TLSv1.2","1514","Application Data [TCP segment of a reassembled PDU]"
"245","74.661002","10.152.152.11","173.194.65.16","TCP","54","60312  >  995 [ACK] Seq=858 Ack=55899 Win=41456 Len=0"
"246","74.661113","173.194.65.16","10.152.152.11","TLSv1.2","1118","Application Data [TCP segment of a reassembled PDU]"
"247","74.661493","173.194.65.16","10.152.152.11","TLSv1.2","1514","Application Data [TCP segment of a reassembled PDU]"
"248","74.661578","173.194.65.16","10.152.152.11","TLSv1.2","1514","Application Data [TCP segment of a reassembled PDU]"
"249","74.661723","10.152.152.11","173.194.65.16","TCP","54","60312  >  995 [ACK] Seq=858 Ack=59883 Win=42240 Len=0"
"250","74.662061","173.194.65.16","10.152.152.11","TLSv1.2","1118","Application Data [TCP segment of a reassembled PDU]"
"251","74.662083","10.152.152.11","173.194.65.16","TCP","54","60312  >  995 [ACK] Seq=858 Ack=60947 Win=45152 Len=0"
"252","74.712624","173.194.65.16","10.152.152.11","TLSv1.2","1514","Application Data [TCP segment of a reassembled PDU]"
"253","74.712722","10.152.152.11","173.194.65.16","TCP","54","60312  >  995 [ACK] Seq=858 Ack=62407 Win=48080 Len=0"
"254","74.712755","173.194.65.16","10.152.152.11","TLSv1.2","1514","Application Data [TCP segment of a reassembled PDU]"
"255","74.712767","10.152.152.11","173.194.65.16","TCP","54","60312  >  995 [ACK] Seq=858 Ack=63867 Win=50992 Len=0"
"256","74.712785","173.194.65.16","10.152.152.11","TCP","1118","995  >  60312 [PSH, ACK] Seq=63867 Ack=858 Win=15680 Len=1064 [TCP segment of a reassembled PDU]"
"257","74.712797","10.152.152.11","173.194.65.16","TCP","54","60312  >  995 [ACK] Seq=858 Ack=64931 Win=53920 Len=0"
"258","74.713223","173.194.65.16","10.152.152.11","TLSv1.2","552","Application Data [TCP segment of a reassembled PDU]"
"259","74.713290","10.152.152.11","173.194.65.16","TCP","54","60312  >  995 [ACK] Seq=858 Ack=65429 Win=56832 Len=0"
"260","74.715396","173.194.65.16","10.152.152.11","TLSv1.2","1514","Application Data [TCP segment of a reassembled PDU]"
"261","74.715416","10.152.152.11","173.194.65.16","TCP","54","60312  >  995 [ACK] Seq=858 Ack=66889 Win=59760 Len=0"
"262","74.715442","173.194.65.16","10.152.152.11","TLSv1.2","915","Application Data, Application Data"
"263","74.715453","10.152.152.11","173.194.65.16","TCP","54","60312  >  995 [ACK] Seq=858 Ack=67750 Win=62672 Len=0"
"264","74.719130","173.194.65.16","10.152.152.11","TLSv1.2","1514","Application Data"
"265","74.719155","10.152.152.11","173.194.65.16","TCP","54","60312  >  995 [ACK] Seq=858 Ack=69210 Win=65600 Len=0"
"266","74.719188","173.194.65.16","10.152.152.11","TLSv1.2","1514","Application Data, Application Data"
"267","74.719201","10.152.152.11","173.194.65.16","TCP","54","60312  >  995 [ACK] Seq=858 Ack=70670 Win=68512 Len=0"
"268","74.719566","173.194.65.16","10.152.152.11","TCP","224","995  >  60312 [PSH, ACK] Seq=70670 Ack=858 Win=15680 Len=170 [TCP segment of a reassembled PDU]"
"269","74.719976","10.152.152.11","173.194.65.16","TCP","54","60312  >  995 [ACK] Seq=858 Ack=70840 Win=68512 Len=0"
"270","74.721662","173.194.65.16","10.152.152.11","TLSv1.2","1514","Application Data [TCP segment of a reassembled PDU]"
"271","74.721687","10.152.152.11","173.194.65.16","TCP","54","60312  >  995 [ACK] Seq=858 Ack=72300 Win=71440 Len=0"
"272","74.721721","173.194.65.16","10.152.152.11","TLSv1.2","1514","Application Data [TCP segment of a reassembled PDU]"
"273","74.721734","10.152.152.11","173.194.65.16","TCP","54","60312  >  995 [ACK] Seq=858 Ack=73760 Win=74352 Len=0"
"274","74.721797","173.194.65.16","10.152.152.11","TCP","1118","995  >  60312 [PSH, ACK] Seq=73760 Ack=858 Win=15680 Len=1064 [TCP segment of a reassembled PDU]"
"275","74.721813","10.152.152.11","173.194.65.16","TCP","54","60312  >  995 [ACK] Seq=858 Ack=74824 Win=77280 Len=0"
"276","74.722508","173.194.65.16","10.152.152.11","TLSv1.2","1514","Application Data, Application Data"
"277","74.722534","10.152.152.11","173.194.65.16","TCP","54","60312  >  995 [ACK] Seq=858 Ack=76284 Win=80192 Len=0"
"278","74.722563","173.194.65.16","10.152.152.11","TLSv1.2","1514","Application Data [TCP segment of a reassembled PDU]"
"279","74.722576","10.152.152.11","173.194.65.16","TCP","54","60312  >  995 [ACK] Seq=858 Ack=77744 Win=83120 Len=0"
"280","74.722851","173.194.65.16","10.152.152.11","TCP","1118","995  >  60312 [PSH, ACK] Seq=77744 Ack=858 Win=15680 Len=1064 [TCP segment of a reassembled PDU]"
"281","74.722876","10.152.152.11","173.194.65.16","TCP","54","60312  >  995 [ACK] Seq=858 Ack=78808 Win=83408 Len=0"
"282","74.726076","173.194.65.16","10.152.152.11","TLSv1.2","1514","Application Data [TCP segment of a reassembled PDU]"
"283","74.726129","173.194.65.16","10.152.152.11","TLSv1.2","1514","Application Data [TCP segment of a reassembled PDU]"
"284","74.726140","10.152.152.11","173.194.65.16","TCP","54","60312  >  995 [ACK] Seq=858 Ack=81728 Win=83808 Len=0"
"285","74.726328","173.194.65.16","10.152.152.11","TLSv1.2","1118","Application Data [TCP segment of a reassembled PDU]"
"286","74.726563","173.194.65.16","10.152.152.11","TLSv1.2","1514","Application Data [TCP segment of a reassembled PDU]"
"287","74.726624","173.194.65.16","10.152.152.11","TLSv1.2","1514","Application Data [TCP segment of a reassembled PDU]"
"288","74.726670","10.152.152.11","173.194.65.16","TCP","54","60312  >  995 [ACK] Seq=858 Ack=85712 Win=82288 Len=0"
"289","74.726790","173.194.65.16","10.152.152.11","TLSv1.2","1118","Application Data [TCP segment of a reassembled PDU]"
"290","74.726969","173.194.65.16","10.152.152.11","TLSv1.2","1514","Application Data [TCP segment of a reassembled PDU]"
"291","74.726980","10.152.152.11","173.194.65.16","TCP","54","60312  >  995 [ACK] Seq=858 Ack=88236 Win=82288 Len=0"
"292","74.726994","173.194.65.16","10.152.152.11","TLSv1.2","1514","Application Data [TCP segment of a reassembled PDU]"
"293","74.727173","173.194.65.16","10.152.152.11","TLSv1.2","1118","Application Data [TCP segment of a reassembled PDU]"
"294","74.727264","10.152.152.11","173.194.65.16","TCP","54","60312  >  995 [ACK] Seq=858 Ack=90760 Win=80048 Len=0"
"295","74.744278","173.194.65.16","10.152.152.11","TLSv1.2","1514","Application Data [TCP segment of a reassembled PDU]"
"296","74.744383","173.194.65.16","10.152.152.11","TLSv1.2","1514","Application Data [TCP segment of a reassembled PDU]"
"297","74.744416","10.152.152.11","173.194.65.16","TCP","54","60312  >  995 [ACK] Seq=858 Ack=93680 Win=83808 Len=0"
"298","74.744459","173.194.65.16","10.152.152.11","TLSv1.2","818","Application Data [TCP segment of a reassembled PDU]"
"299","74.744983","10.152.152.11","173.194.65.16","TCP","54","60312  >  995 [ACK] Seq=858 Ack=94444 Win=83808 Len=0"
"300","74.784855","173.194.65.16","10.152.152.11","TLSv1.2","1514","Application Data [TCP segment of a reassembled PDU]"
"301","74.784961","173.194.65.16","10.152.152.11","TLSv1.2","1514","Application Data [TCP segment of a reassembled PDU]"
"302","74.784986","10.152.152.11","173.194.65.16","TCP","54","60312  >  995 [ACK] Seq=858 Ack=97364 Win=83808 Len=0"
"303","74.785028","173.194.65.16","10.152.152.11","TCP","1118","995  >  60312 [PSH, ACK] Seq=97364 Ack=858 Win=15680 Len=1064 [TCP segment of a reassembled PDU]"
"304","74.785575","10.152.152.11","173.194.65.16","TCP","54","60312  >  995 [ACK] Seq=858 Ack=98428 Win=83808 Len=0"
"305","74.786271","173.194.65.16","10.152.152.11","TLSv1.2","1514","Application Data [TCP segment of a reassembled PDU]"
"306","74.786369","173.194.65.16","10.152.152.11","TLSv1.2","1514","Application Data, Application Data"
"307","74.786392","10.152.152.11","173.194.65.16","TCP","54","60312  >  995 [ACK] Seq=858 Ack=101348 Win=83808 Len=0"
"308","74.786613","173.194.65.16","10.152.152.11","TCP","1018","995  >  60312 [PSH, ACK] Seq=101348 Ack=858 Win=15680 Len=964 [TCP segment of a reassembled PDU]"
"309","74.787122","10.152.152.11","173.194.65.16","TCP","54","60312  >  995 [ACK] Seq=858 Ack=102312 Win=83808 Len=0"
"310","74.791276","173.194.65.16","10.152.152.11","TLSv1.2","1514","Application Data [TCP segment of a reassembled PDU]"
"311","74.791312","10.152.152.11","173.194.65.16","TCP","54","60312  >  995 [ACK] Seq=858 Ack=103772 Win=86720 Len=0"
"312","74.791431","173.194.65.16","10.152.152.11","TLSv1.2","1514","Application Data [TCP segment of a reassembled PDU]"
"313","74.791455","10.152.152.11","173.194.65.16","TCP","54","60312  >  995 [ACK] Seq=858 Ack=105232 Win=86720 Len=0"
"314","74.791496","173.194.65.16","10.152.152.11","TLSv1.2","1118","Application Data [TCP segment of a reassembled PDU]"
"315","74.792128","10.152.152.11","173.194.65.16","TCP","54","60312  >  995 [ACK] Seq=858 Ack=106296 Win=86720 Len=0"
"316","74.804611","173.194.65.16","10.152.152.11","TLSv1.2","1514","Application Data [TCP segment of a reassembled PDU]"
"317","74.804709","173.194.65.16","10.152.152.11","TLSv1.2","1514","Application Data [TCP segment of a reassembled PDU]"
"318","74.804733","10.152.152.11","173.194.65.16","TCP","54","60312  >  995 [ACK] Seq=858 Ack=109216 Win=86720 Len=0"
"319","74.804778","173.194.65.16","10.152.152.11","TLSv1.2","1118","Application Data [TCP segment of a reassembled PDU]"
"320","74.805469","10.152.152.11","173.194.65.16","TCP","54","60312  >  995 [ACK] Seq=858 Ack=110280 Win=86720 Len=0"
"321","74.812207","173.194.65.16","10.152.152.11","TLSv1.2","1514","Application Data [TCP segment of a reassembled PDU]"
"322","74.812306","173.194.65.16","10.152.152.11","TLSv1.2","1514","Application Data [TCP segment of a reassembled PDU]"
"323","74.812330","10.152.152.11","173.194.65.16","TCP","54","60312  >  995 [ACK] Seq=858 Ack=113200 Win=86720 Len=0"
"324","74.812556","173.194.65.16","10.152.152.11","TLSv1.2","1118","Application Data [TCP segment of a reassembled PDU]"
"325","74.813007","10.152.152.11","173.194.65.16","TCP","54","60312  >  995 [ACK] Seq=858 Ack=114264 Win=86720 Len=0"
"326","74.813429","173.194.65.16","10.152.152.11","TCP","552","995  >  60312 [PSH, ACK] Seq=114264 Ack=858 Win=15680 Len=498 [TCP segment of a reassembled PDU]"
"327","74.814289","10.152.152.11","173.194.65.16","TCP","54","60312  >  995 [ACK] Seq=858 Ack=114762 Win=86720 Len=0"
"328","74.818036","173.194.65.16","10.152.152.11","TLSv1.2","1514","Application Data [TCP segment of a reassembled PDU]"
"329","74.818145","173.194.65.16","10.152.152.11","TLSv1.2","1514","Application Data [TCP segment of a reassembled PDU]"
"330","74.818171","10.152.152.11","173.194.65.16","TCP","54","60312  >  995 [ACK] Seq=858 Ack=117682 Win=86720 Len=0"
"331","74.818213","173.194.65.16","10.152.152.11","TLSv1.2","620","Application Data [TCP segment of a reassembled PDU]"
"332","74.818791","10.152.152.11","173.194.65.16","TCP","54","60312  >  995 [ACK] Seq=858 Ack=118248 Win=86720 Len=0"
"333","74.849548","173.194.65.16","10.152.152.11","TLSv1.2","1514","Application Data [TCP segment of a reassembled PDU]"
"334","74.849648","173.194.65.16","10.152.152.11","TLSv1.2","1514","Application Data [TCP segment of a reassembled PDU]"
"335","74.849673","10.152.152.11","173.194.65.16","TCP","54","60312  >  995 [ACK] Seq=858 Ack=121168 Win=86720 Len=0"
"336","74.849713","173.194.65.16","10.152.152.11","TLSv1.2","1118","Application Data [TCP segment of a reassembled PDU]"
"337","74.850490","10.152.152.11","173.194.65.16","TCP","54","60312  >  995 [ACK] Seq=858 Ack=122232 Win=86720 Len=0"
"338","74.858381","173.194.65.16","10.152.152.11","TLSv1.2","1514","Application Data"
"339","74.858483","173.194.65.16","10.152.152.11","TLSv1.2","1514","Application Data [TCP segment of a reassembled PDU]"
"340","74.858506","10.152.152.11","173.194.65.16","TCP","54","60312  >  995 [ACK] Seq=858 Ack=125152 Win=86720 Len=0"
"341","74.858565","173.194.65.16","10.152.152.11","TCP","1118","995  >  60312 [PSH, ACK] Seq=125152 Ack=858 Win=15680 Len=1064 [TCP segment of a reassembled PDU]"
"342","74.858857","10.152.152.11","173.194.65.16","TCP","54","60312  >  995 [ACK] Seq=858 Ack=126216 Win=86720 Len=0"
"343","74.859589","173.194.65.16","10.152.152.11","TLSv1.2","1514","Application Data [TCP segment of a reassembled PDU]"
"344","74.859687","173.194.65.16","10.152.152.11","TLSv1.2","1514","Application Data [TCP segment of a reassembled PDU]"
"345","74.859717","10.152.152.11","173.194.65.16","TCP","54","60312  >  995 [ACK] Seq=858 Ack=129136 Win=86720 Len=0"
"346","74.859867","173.194.65.16","10.152.152.11","TLSv1.2","1118","Application Data [TCP segment of a reassembled PDU]"
"347","74.860502","10.152.152.11","173.194.65.16","TCP","54","60312  >  995 [ACK] Seq=858 Ack=130200 Win=86720 Len=0"
